"No.","Time","Source","Destination","Protocol","Length","Info","RTT","Lost Segement","Duplicate ","Retransmission","IDK"
"2388","61.512324568","10.10.3.105","10.10.3.102","MPTCP","80","46396  >  5201 [SYN] Seq=0 Win=64240 Len=0 MSS=1460 SACK_PERM=1 TSval=2008618275 TSecr=0 WS=128","","","","",""
"2389","61.512386568","10.10.3.102","10.10.3.105","MPTCP","88","5201  >  46396 [SYN, ACK] Seq=0 Ack=1 Win=65160 Len=0 MSS=1460 SACK_PERM=1 TSval=1039744971 TSecr=2008618275 WS=128","0.000062000","","","",""
"2398","62.530171640","10.10.3.105","10.10.3.102","MPTCP","80","[TCP Retransmission] [TCP Port numbers reused] 46396  >  5201 [SYN] Seq=0 Win=64240 Len=0 MSS=1460 SACK_PERM=1 TSval=2008619293 TSecr=0 WS=128","","","","â\234\223","â\234\223"
"2399","62.530217464","10.10.3.102","10.10.3.105","MPTCP","88","[TCP Retransmission] 5201  >  46396 [SYN, ACK] Seq=0 Ack=1 Win=65160 Len=0 MSS=1460 SACK_PERM=1 TSval=1039745988 TSecr=2008618275 WS=128","0.000045824","","","â\234\223","â\234\223"
"2409","63.554002312","10.10.3.105","10.10.3.102","MPTCP","80","[TCP Retransmission] [TCP Port numbers reused] 46396  >  5201 [SYN] Seq=0 Win=64240 Len=0 MSS=1460 SACK_PERM=1 TSval=2008620317 TSecr=0 WS=128","","","","â\234\223","â\234\223"
"2410","63.554048580","10.10.3.102","10.10.3.105","MPTCP","88","[TCP Retransmission] 5201  >  46396 [SYN, ACK] Seq=0 Ack=1 Win=65160 Len=0 MSS=1460 SACK_PERM=1 TSval=1039747012 TSecr=2008618275 WS=128","0.000046268","","","â\234\223","â\234\223"
"2417","64.577911063","10.10.3.105","10.10.3.102","MPTCP","80","[TCP Retransmission] [TCP Port numbers reused] 46396  >  5201 [SYN] Seq=0 Win=64240 Len=0 MSS=1460 SACK_PERM=1 TSval=2008621341 TSecr=0 WS=128","","","","â\234\223","â\234\223"
"2418","64.577960222","10.10.3.102","10.10.3.105","MPTCP","88","[TCP Retransmission] 5201  >  46396 [SYN, ACK] Seq=0 Ack=1 Win=65160 Len=0 MSS=1460 SACK_PERM=1 TSval=1039748036 TSecr=2008618275 WS=128","0.000049159","","","â\234\223","â\234\223"
"2517","65.601983744","10.10.3.105","10.10.3.102","MPTCP","80","[TCP Retransmission] [TCP Port numbers reused] 46396  >  5201 [SYN] Seq=0 Win=64240 Len=0 MSS=1460 SACK_PERM=1 TSval=2008622365 TSecr=0 WS=128","","","","â\234\223","â\234\223"
"2518","65.602023933","10.10.3.102","10.10.3.105","MPTCP","88","[TCP Retransmission] 5201  >  46396 [SYN, ACK] Seq=0 Ack=1 Win=65160 Len=0 MSS=1460 SACK_PERM=1 TSval=1039749060 TSecr=2008618275 WS=128","0.000040189","","","â\234\223","â\234\223"
"2606","66.626174835","10.10.3.105","10.10.3.102","MPTCP","80","[TCP Retransmission] [TCP Port numbers reused] 46396  >  5201 [SYN] Seq=0 Win=64240 Len=0 MSS=1460 SACK_PERM=1 TSval=2008623389 TSecr=0 WS=128","","","","â\234\223","â\234\223"
"2607","66.626219063","10.10.3.102","10.10.3.105","MPTCP","88","[TCP Retransmission] 5201  >  46396 [SYN, ACK] Seq=0 Ack=1 Win=65160 Len=0 MSS=1460 SACK_PERM=1 TSval=1039750084 TSecr=2008618275 WS=128","0.000044228","","","â\234\223","â\234\223"
"2608","66.626413049","10.10.3.105","10.10.3.102","MPTCP","88","46396  >  5201 [ACK] Seq=1 Ack=1 Win=64256 Len=0 TSval=2008623389 TSecr=1039750084","5.114026481","","","",""
"2609","66.626513554","10.10.3.105","10.10.3.102","MPTCP","129","46396  >  5201 [PSH, ACK] Seq=1 Ack=1 Win=64256 Len=37 TSval=2008623389 TSecr=1039750084","","","","",""
"2610","66.626532318","10.10.3.102","10.10.3.105","MPTCP","80","5201  >  46396 [ACK] Seq=1 Ack=38 Win=65152 Len=0 TSval=1039750085 TSecr=2008623389","0.000018764","","","",""
"2611","66.626594854","10.10.3.102","10.10.3.105","MPTCP","97","5201  >  46396 [PSH, ACK] Seq=1 Ack=38 Win=65152 Len=1 TSval=1039750085 TSecr=2008623389","","","","",""
"2612","66.626629557","10.10.3.102","10.10.3.105","MPTCP","84","[TCP Dup ACK 2610#1] 5201  >  46396 [ACK] Seq=2 Ack=38 Win=65152 Len=0 TSval=1039750085 TSecr=2008623389","","","â\234\223","","â\234\223"
"2613","66.626681955","10.10.3.105","10.10.3.102","MPTCP","80","46396  >  5201 [ACK] Seq=38 Ack=2 Win=64256 Len=0 TSval=2008623389 TSecr=1039750085","0.000087101","","","",""
"2614","66.626739805","10.10.3.105","10.10.3.102","MPTCP","76","[TCP Dup ACK 2613#1] 46396  >  5201 [ACK] Seq=38 Ack=2 Win=64256 Len=0 TSval=2008623389 TSecr=1039750085","","","â\234\223","","â\234\223"
"2615","66.626895649","10.10.3.105","10.10.3.102","MPTCP","100","46396  >  5201 [PSH, ACK] Seq=38 Ack=2 Win=64256 Len=4 TSval=2008623390 TSecr=1039750085","","","","",""
"2616","66.627478737","10.10.3.62","10.10.3.102","MPTCP","88","43203  >  5201 [SYN] Seq=0 Win=64256 Len=0 MSS=1460 SACK_PERM=1 TSval=3345790594 TSecr=0 WS=128","","","","",""
"2617","66.627512232","10.10.3.102","10.10.3.62","MPTCP","92","5201  >  43203 [SYN, ACK] Seq=0 Ack=1 Win=65160 Len=0 MSS=1460 SACK_PERM=1 TSval=2492568367 TSecr=3345790594 WS=128","0.000033495","","","",""
"2618","66.627979963","10.10.3.105","10.10.3.59","MPTCP","88","51439  >  5201 [SYN] Seq=0 Win=64256 Len=0 MSS=1460 SACK_PERM=1 TSval=937878721 TSecr=0 WS=128","","","","",""
"2619","66.628018440","10.10.3.59","10.10.3.105","MPTCP","92","5201  >  51439 [SYN, ACK] Seq=0 Ack=1 Win=65160 Len=0 MSS=1460 SACK_PERM=1 TSval=1399858464 TSecr=937878721 WS=128","0.000038477","","","",""
"2620","66.628945328","10.10.3.62","10.10.3.102","MPTCP","92","43203  >  5201 [ACK] Seq=1 Ack=1 Win=64256 Len=0 TSval=3345790596 TSecr=2492568367","0.001433096","","","",""
"2621","66.629000254","10.10.3.102","10.10.3.62","MPTCP","80","[TCP Window Update] 5201  >  43203 [ACK] Seq=1 Ack=1 Win=65280 Len=0 TSval=2492568368 TSecr=3345790596","","","","","â\234\223"
"2623","66.670580611","10.10.3.102","10.10.3.105","MPTCP","80","5201  >  46396 [ACK] Seq=2 Ack=42 Win=65280 Len=0 TSval=1039750129 TSecr=2008623390","0.043684962","","","",""
"2624","66.671134010","10.10.3.105","10.10.3.102","MPTCP","196","46396  >  5201 [PSH, ACK] Seq=42 Ack=2 Win=64256 Len=100 TSval=2008623434 TSecr=1039750129","","","","",""
"2625","66.671174376","10.10.3.102","10.10.3.105","MPTCP","80","5201  >  46396 [ACK] Seq=2 Ack=142 Win=65280 Len=0 TSval=1039750129 TSecr=2008623434","0.000040366","","","",""
"2626","66.671256839","10.10.3.102","10.10.3.105","MPTCP","97","5201  >  46396 [PSH, ACK] Seq=2 Ack=142 Win=65280 Len=1 TSval=1039750129 TSecr=2008623434","","","","",""
"2627","66.671636789","10.10.3.105","10.10.3.102","MPTCP","80","52632  >  5201 [SYN] Seq=0 Win=64240 Len=0 MSS=1460 SACK_PERM=1 TSval=2008623434 TSecr=0 WS=128","","","","",""
"2628","66.671672463","10.10.3.102","10.10.3.105","MPTCP","88","5201  >  52632 [SYN, ACK] Seq=0 Ack=1 Win=65160 Len=0 MSS=1460 SACK_PERM=1 TSval=1039750130 TSecr=2008623434 WS=128","0.000035674","","","",""
"2630","66.671782502","10.10.3.105","10.10.3.102","MPTCP","88","52632  >  5201 [ACK] Seq=1 Ack=1 Win=64256 Len=0 TSval=2008623434 TSecr=1039750130","0.000110039","","","",""
"2631","66.671864576","10.10.3.102","10.10.3.105","MPTCP","84","[TCP Window Update] 5201  >  52632 [ACK] Seq=1 Ack=1 Win=65280 Len=0 TSval=1039750130 TSecr=2008623434","","","","","â\234\223"
"2632","66.671872054","10.10.3.105","10.10.3.102","MPTCP","129","52632  >  5201 [PSH, ACK] Seq=1 Ack=1 Win=64256 Len=37 TSval=2008623434 TSecr=1039750130","","","","",""
"2633","66.671885233","10.10.3.102","10.10.3.105","MPTCP","80","5201  >  52632 [ACK] Seq=1 Ack=38 Win=65280 Len=0 TSval=1039750130 TSecr=2008623434","0.000013179","","","",""
"2634","66.671971301","10.10.3.105","10.10.3.102","MPTCP","76","52632  >  5201 [ACK] Seq=38 Ack=1 Win=64256 Len=0 TSval=2008623435 TSecr=1039750130","","","","",""
"2635","66.672720901","10.10.3.62","10.10.3.102","MPTCP","88","56079  >  5201 [SYN] Seq=0 Win=64256 Len=0 MSS=1460 SACK_PERM=1 TSval=3345790640 TSecr=0 WS=128","","","","",""
"2636","66.672730934","10.10.3.105","10.10.3.59","MPTCP","88","35519  >  5201 [SYN] Seq=0 Win=64256 Len=0 MSS=1460 SACK_PERM=1 TSval=937878767 TSecr=0 WS=128","","","","",""
"2637","66.672762376","10.10.3.102","10.10.3.62","MPTCP","92","5201  >  56079 [SYN, ACK] Seq=0 Ack=1 Win=65160 Len=0 MSS=1460 SACK_PERM=1 TSval=2492568412 TSecr=3345790640 WS=128","0.000041475","","","",""
"2638","66.672768158","10.10.3.59","10.10.3.105","MPTCP","92","5201  >  35519 [SYN, ACK] Seq=0 Ack=1 Win=65160 Len=0 MSS=1460 SACK_PERM=1 TSval=1399858509 TSecr=937878767 WS=128","0.000037224","","","",""
"2640","66.674612893","10.10.3.62","10.10.3.102","MPTCP","92","56079  >  5201 [ACK] Seq=1 Ack=1 Win=64256 Len=0 TSval=3345790641 TSecr=2492568412","0.001850517","","","",""
"2641","66.674691509","10.10.3.102","10.10.3.62","MPTCP","80","[TCP Window Update] 5201  >  56079 [ACK] Seq=1 Ack=1 Win=65280 Len=0 TSval=2492568414 TSecr=3345790641","","","","","â\234\223"
"2645","66.714108202","10.10.3.105","10.10.3.102","MPTCP","80","46396  >  5201 [ACK] Seq=142 Ack=3 Win=64256 Len=0 TSval=2008623477 TSecr=1039750129","0.042851363","","","",""
"2646","66.714155972","10.10.3.102","10.10.3.105","MPTCP","98","5201  >  46396 [PSH, ACK] Seq=3 Ack=142 Win=65280 Len=2 TSval=1039750172 TSecr=2008623477","","","","",""
"2647","66.714269465","10.10.3.105","10.10.3.102","MPTCP","80","46396  >  5201 [ACK] Seq=142 Ack=5 Win=64256 Len=0 TSval=2008623477 TSecr=1039750172","0.000113493","","","",""
"2648","66.714362084","10.10.3.105","10.10.3.102","MPTCP","5788","52632  >  5201 [ACK] Seq=38 Ack=1 Win=64256 Len=5696 TSval=2008623477 TSecr=1039750130","","","","",""
"2649","66.714391948","10.10.3.102","10.10.3.105","MPTCP","80","5201  >  52632 [ACK] Seq=1 Ack=5734 Win=61568 Len=0 TSval=1039750173 TSecr=2008623477","0.000029864","","","",""
"2650","66.714435344","10.10.3.105","10.10.3.102","MPTCP","1516","52632  >  5201 [PSH, ACK] Seq=5734 Ack=1 Win=64256 Len=1424 TSval=2008623477 TSecr=1039750130","","","","",""
"2651","66.714448731","10.10.3.102","10.10.3.105","MPTCP","80","5201  >  52632 [ACK] Seq=1 Ack=7158 Win=60544 Len=0 TSval=1039750173 TSecr=2008623477","0.000013387","","","",""
"2652","66.714435511","10.10.3.105","10.10.3.102","MPTCP","7212","52632  >  5201 [PSH, ACK] Seq=7158 Ack=1 Win=64256 Len=7120 TSval=2008623477 TSecr=1039750130","","","","",""
"2653","66.714461195","10.10.3.102","10.10.3.105","MPTCP","80","5201  >  52632 [ACK] Seq=1 Ack=14278 Win=55552 Len=0 TSval=1039750173 TSecr=2008623477","0.000025684","","","",""
"2654","66.714622209","10.10.3.105","10.10.3.102","MPTCP","10060","52632  >  5201 [PSH, ACK] Seq=14278 Ack=1 Win=64256 Len=9968 TSval=2008623477 TSecr=1039750173","","","","",""
"2655","66.714656345","10.10.3.102","10.10.3.105","MPTCP","80","5201  >  52632 [ACK] Seq=1 Ack=24246 Win=58752 Len=0 TSval=1039750173 TSecr=2008623477","0.000034136","","","",""
"2656","66.714704932","10.10.3.105","10.10.3.102","MPTCP","7212","52632  >  5201 [PSH, ACK] Seq=24246 Ack=1 Win=64256 Len=7120 TSval=2008623477 TSecr=1039750173","","","","",""
"2657","66.714718278","10.10.3.102","10.10.3.105","MPTCP","80","5201  >  52632 [ACK] Seq=1 Ack=31366 Win=53760 Len=0 TSval=1039750173 TSecr=2008623477","0.000013346","","","",""
"2658","66.714779892","10.10.3.105","10.10.3.102","MPTCP","11484","52632  >  5201 [PSH, ACK] Seq=31366 Ack=1 Win=64256 Len=11392 TSval=2008623477 TSecr=1039750173","","","","",""
"2659","66.714794864","10.10.3.102","10.10.3.105","MPTCP","80","5201  >  52632 [ACK] Seq=1 Ack=42758 Win=86912 Len=0 TSval=1039750173 TSecr=2008623477","0.000014972","","","",""
"2660","66.714922534","10.10.3.105","10.10.3.102","MPTCP","18604","52632  >  5201 [PSH, ACK] Seq=42758 Ack=1 Win=64256 Len=18512 TSval=2008623477 TSecr=1039750173","","","","",""
"2661","66.714938396","10.10.3.102","10.10.3.105","MPTCP","80","5201  >  52632 [ACK] Seq=1 Ack=61270 Win=123904 Len=0 TSval=1039750173 TSecr=2008623477","0.000015862","","","",""
"2662","66.714945863","10.10.3.105","10.10.3.102","MPTCP","1516","52632  >  5201 [ACK] Seq=61270 Ack=1 Win=64256 Len=1424 TSval=2008623477 TSecr=1039750173","","","","",""
"2663","66.714955524","10.10.3.102","10.10.3.105","MPTCP","80","5201  >  52632 [ACK] Seq=1 Ack=62694 Win=126848 Len=0 TSval=1039750173 TSecr=2008623477","0.000009661","","","",""
"2664","66.714988466","10.10.3.105","10.10.3.102","MPTCP","2716","52632  >  5201 [PSH, ACK] Seq=62694 Ack=1 Win=64256 Len=2624 TSval=2008623477 TSecr=1039750173","","","","",""
"2665","66.714998517","10.10.3.102","10.10.3.105","MPTCP","80","5201  >  52632 [ACK] Seq=1 Ack=65318 Win=132096 Len=0 TSval=1039750173 TSecr=2008623477","0.000010051","","","",""
"2666","66.715067835","10.10.3.105","10.10.3.102","MPTCP","12908","52632  >  5201 [PSH, ACK] Seq=65318 Ack=1 Win=64256 Len=12816 TSval=2008623477 TSecr=1039750173","","","","",""
"2667","66.715080779","10.10.3.102","10.10.3.105","MPTCP","80","5201  >  52632 [ACK] Seq=1 Ack=78134 Win=157696 Len=0 TSval=1039750173 TSecr=2008623477","0.000012944","","","",""
"2668","66.715089368","10.10.3.105","10.10.3.102","MPTCP","444","52632  >  5201 [PSH, ACK] Seq=78134 Ack=1 Win=64256 Len=352 TSval=2008623478 TSecr=1039750173","","","","",""
"2669","66.715098697","10.10.3.102","10.10.3.105","MPTCP","80","5201  >  52632 [ACK] Seq=1 Ack=78486 Win=160512 Len=0 TSval=1039750173 TSecr=2008623478","0.000009329","","","",""
"2670","66.715248628","10.10.3.105","10.10.3.102","MPTCP","20028","52632  >  5201 [PSH, ACK] Seq=78486 Ack=1 Win=64256 Len=19936 TSval=2008623478 TSecr=1039750173","","","","",""
"2671","66.715263562","10.10.3.102","10.10.3.105","MPTCP","80","5201  >  52632 [ACK] Seq=1 Ack=98422 Win=200448 Len=0 TSval=1039750173 TSecr=2008623478","0.000014934","","","",""
"2672","66.715468475","10.10.3.105","10.10.3.102","MPTCP","22876","52632  >  5201 [PSH, ACK] Seq=98422 Ack=1 Win=64256 Len=22784 TSval=2008623478 TSecr=1039750173","","","","",""
"2673","66.715484423","10.10.3.102","10.10.3.105","MPTCP","80","5201  >  52632 [ACK] Seq=1 Ack=121206 Win=246016 Len=0 TSval=1039750174 TSecr=2008623478","0.000015948","","","",""
"2674","66.715551636","10.10.3.62","10.10.3.102","MPTCP","2076","56079  >  5201 [PSH, ACK] Seq=1 Ack=1 Win=64256 Len=1984 TSval=3345790682 TSecr=2492568414","","","","",""
"2675","66.715565538","10.10.3.102","10.10.3.62","MPTCP","80","5201  >  56079 [ACK] Seq=1 Ack=1985 Win=243968 Len=0 TSval=2492568455 TSecr=3345790682","0.000013902","","","",""
"2676","66.715857327","10.10.3.105","10.10.3.102","MPTCP","45660","52632  >  5201 [PSH, ACK] Seq=121206 Ack=1 Win=64256 Len=45568 TSval=2008623478 TSecr=1039750173","","","","",""
"2677","66.715880906","10.10.3.102","10.10.3.105","MPTCP","80","5201  >  52632 [ACK] Seq=1 Ack=166774 Win=243968 Len=0 TSval=1039750174 TSecr=2008623478","0.000023579","","","",""
"2678","66.716001625","10.10.3.105","10.10.3.102","MPTCP","17180","52632  >  5201 [PSH, ACK] Seq=166774 Ack=1 Win=64256 Len=17088 TSval=2008623478 TSecr=1039750173","","","","",""
"2679","66.716015700","10.10.3.102","10.10.3.105","MPTCP","80","5201  >  52632 [ACK] Seq=1 Ack=183862 Win=243968 Len=0 TSval=1039750174 TSecr=2008623478","0.000014075","","","",""
"2680","66.716302693","10.10.3.105","10.10.3.102","MPTCP","32844","52632  >  5201 [PSH, ACK] Seq=183862 Ack=1 Win=64256 Len=32752 TSval=2008623478 TSecr=1039750174","","","","",""
"2681","66.716321581","10.10.3.102","10.10.3.105","MPTCP","80","5201  >  52632 [ACK] Seq=1 Ack=216614 Win=243968 Len=0 TSval=1039750174 TSecr=2008623478","0.000018888","","","",""
"2682","66.716555740","10.10.3.105","10.10.3.102","MPTCP","29996","52632  >  5201 [PSH, ACK] Seq=216614 Ack=1 Win=64256 Len=29904 TSval=2008623479 TSecr=1039750174","","","","",""
"2683","66.716573971","10.10.3.102","10.10.3.105","MPTCP","80","5201  >  52632 [ACK] Seq=1 Ack=246518 Win=243968 Len=0 TSval=1039750175 TSecr=2008623479","0.000018231","","","",""
"2684","66.716861339","10.10.3.105","10.10.3.102","MPTCP","35692","52632  >  5201 [PSH, ACK] Seq=246518 Ack=1 Win=64256 Len=35600 TSval=2008623479 TSecr=1039750174","","","","",""
"2685","66.716886436","10.10.3.102","10.10.3.105","MPTCP","80","5201  >  52632 [ACK] Seq=1 Ack=282118 Win=243968 Len=0 TSval=1039750175 TSecr=2008623479","0.000025097","","","",""
"2686","66.717068075","10.10.3.105","10.10.3.102","MPTCP","24796","52632  >  5201 [PSH, ACK] Seq=282118 Ack=1 Win=64256 Len=24704 TSval=2008623479 TSecr=1039750174","","","","",""
"2687","66.717085651","10.10.3.102","10.10.3.105","MPTCP","80","5201  >  52632 [ACK] Seq=1 Ack=306822 Win=243968 Len=0 TSval=1039750175 TSecr=2008623479","0.000017576","","","",""
"2688","66.719711128","10.10.3.62","10.10.3.102","MPTCP","1516","56079  >  5201 [ACK] Seq=1985 Ack=1 Win=64256 Len=1424 TSval=3345790682 TSecr=2492568414","","","","",""
"2689","66.719757389","10.10.3.102","10.10.3.62","MPTCP","80","5201  >  56079 [ACK] Seq=1 Ack=3409 Win=242688 Len=0 TSval=2492568459 TSecr=3345790682","0.000046261","","","",""
"2690","66.720862783","10.10.3.105","10.10.3.102","MPTCP","172","52632  >  5201 [PSH, ACK] Seq=306822 Ack=1 Win=64256 Len=80 TSval=2008623483 TSecr=1039750175","","","","",""
"2691","66.731572398","10.10.3.62","10.10.3.102","MPTCP","1196","56079  >  5201 [PSH, ACK] Seq=3409 Ack=1 Win=64256 Len=1104 TSval=3345790685 TSecr=2492568455","","","","",""
"2692","66.731623343","10.10.3.102","10.10.3.62","MPTCP","80","5201  >  56079 [ACK] Seq=1 Ack=4513 Win=241664 Len=0 TSval=2492568471 TSecr=3345790685","0.000050945","","","",""
"2693","66.731862553","10.10.3.102","10.10.3.105","MPTCP","80","5201  >  52632 [ACK] Seq=1 Ack=306902 Win=279296 Len=0 TSval=1039750179 TSecr=2008623483","0.010999770","","","",""
"2694","66.732715269","10.10.3.105","10.10.3.102","MPTCP","52780","52632  >  5201 [PSH, ACK] Seq=306902 Ack=1 Win=64256 Len=52688 TSval=2008623495 TSecr=1039750179","","","","",""
"2695","66.732760064","10.10.3.102","10.10.3.105","MPTCP","80","5201  >  52632 [ACK] Seq=1 Ack=359590 Win=255104 Len=0 TSval=1039750191 TSecr=2008623495","0.000044795","","","",""
"2696","66.732810567","10.10.3.105","10.10.3.102","MPTCP","10060","52632  >  5201 [PSH, ACK] Seq=359590 Ack=1 Win=64256 Len=9968 TSval=2008623495 TSecr=1039750179","","","","",""
"2697","66.732825169","10.10.3.102","10.10.3.105","MPTCP","80","5201  >  52632 [ACK] Seq=1 Ack=369558 Win=248192 Len=0 TSval=1039750191 TSecr=2008623495","0.000014602","","","",""
"2698","66.732975878","10.10.3.105","10.10.3.102","MPTCP","18796","52632  >  5201 [PSH, ACK] Seq=369558 Ack=1 Win=64256 Len=18704 TSval=2008623495 TSecr=1039750179","","","","",""
"2699","66.732991845","10.10.3.102","10.10.3.105","MPTCP","80","5201  >  52632 [ACK] Seq=1 Ack=388262 Win=277888 Len=0 TSval=1039750191 TSecr=2008623495","0.000015967","","","",""
"2700","66.733171190","10.10.3.105","10.10.3.102","MPTCP","22876","52632  >  5201 [PSH, ACK] Seq=388262 Ack=1 Win=64256 Len=22784 TSval=2008623495 TSecr=1039750179","","","","",""
"2701","66.733187293","10.10.3.102","10.10.3.105","MPTCP","80","5201  >  52632 [ACK] Seq=1 Ack=411046 Win=277888 Len=0 TSval=1039750191 TSecr=2008623495","0.000016103","","","",""
"2702","66.733503548","10.10.3.105","10.10.3.102","MPTCP","39964","52632  >  5201 [PSH, ACK] Seq=411046 Ack=1 Win=64256 Len=39872 TSval=2008623496 TSecr=1039750191","","","","",""
"2703","66.733524432","10.10.3.102","10.10.3.105","MPTCP","80","5201  >  52632 [ACK] Seq=1 Ack=450918 Win=277888 Len=0 TSval=1039750192 TSecr=2008623496","0.000020884","","","",""
"2704","66.733728489","10.10.3.105","10.10.3.102","MPTCP","25724","52632  >  5201 [PSH, ACK] Seq=450918 Ack=1 Win=64256 Len=25632 TSval=2008623496 TSecr=1039750191","","","","",""
"2705","66.733745192","10.10.3.102","10.10.3.105","MPTCP","80","5201  >  52632 [ACK] Seq=1 Ack=476550 Win=277888 Len=0 TSval=1039750192 TSecr=2008623496","0.000016703","","","",""
"2706","66.733895781","10.10.3.105","10.10.3.102","MPTCP","20028","52632  >  5201 [PSH, ACK] Seq=476550 Ack=1 Win=64256 Len=19936 TSval=2008623496 TSecr=1039750191","","","","",""
"2707","66.733911093","10.10.3.102","10.10.3.105","MPTCP","80","5201  >  52632 [ACK] Seq=1 Ack=496486 Win=277888 Len=0 TSval=1039750192 TSecr=2008623496","0.000015312","","","",""
"2708","66.734062195","10.10.3.105","10.10.3.102","MPTCP","17180","52632  >  5201 [PSH, ACK] Seq=496486 Ack=1 Win=64256 Len=17088 TSval=2008623496 TSecr=1039750191","","","","",""
"2709","66.734081355","10.10.3.102","10.10.3.105","MPTCP","80","5201  >  52632 [ACK] Seq=1 Ack=513574 Win=277888 Len=0 TSval=1039750192 TSecr=2008623496","0.000019160","","","",""
"2710","66.734120586","10.10.3.105","10.10.3.102","MPTCP","7212","52632  >  5201 [PSH, ACK] Seq=513574 Ack=1 Win=64256 Len=7120 TSval=2008623496 TSecr=1039750191","","","","",""
"2711","66.734132132","10.10.3.102","10.10.3.105","MPTCP","80","5201  >  52632 [ACK] Seq=1 Ack=520694 Win=277888 Len=0 TSval=1039750192 TSecr=2008623496","0.000011546","","","",""
"2712","66.734360813","10.10.3.105","10.10.3.102","MPTCP","28572","52632  >  5201 [ACK] Seq=520694 Ack=1 Win=64256 Len=28480 TSval=2008623496 TSecr=1039750192","","","","",""
"2713","66.734378931","10.10.3.102","10.10.3.105","MPTCP","80","5201  >  52632 [ACK] Seq=1 Ack=549174 Win=277888 Len=0 TSval=1039750193 TSecr=2008623496","0.000018118","","","",""
"2714","66.734476653","10.10.3.105","10.10.3.102","MPTCP","14332","52632  >  5201 [PSH, ACK] Seq=549174 Ack=1 Win=64256 Len=14240 TSval=2008623496 TSecr=1039750192","","","","",""
"2715","66.734491244","10.10.3.102","10.10.3.105","MPTCP","80","5201  >  52632 [ACK] Seq=1 Ack=563414 Win=277888 Len=0 TSval=1039750193 TSecr=2008623496","0.000014591","","","",""
"2716","66.734587263","10.10.3.105","10.10.3.102","MPTCP","12908","52632  >  5201 [PSH, ACK] Seq=563414 Ack=1 Win=64256 Len=12816 TSval=2008623496 TSecr=1039750192","","","","",""
"2717","66.734600214","10.10.3.102","10.10.3.105","MPTCP","80","5201  >  52632 [ACK] Seq=1 Ack=576230 Win=277888 Len=0 TSval=1039750193 TSecr=2008623496","0.000012951","","","",""
"2718","66.734718565","10.10.3.105","10.10.3.102","MPTCP","14332","52632  >  5201 [PSH, ACK] Seq=576230 Ack=1 Win=64256 Len=14240 TSval=2008623497 TSecr=1039750192","","","","",""
"2719","66.734732396","10.10.3.102","10.10.3.105","MPTCP","80","5201  >  52632 [ACK] Seq=1 Ack=590470 Win=277888 Len=0 TSval=1039750193 TSecr=2008623497","0.000013831","","","",""
"2720","66.734804381","10.10.3.105","10.10.3.102","MPTCP","10316","52632  >  5201 [PSH, ACK] Seq=590470 Ack=1 Win=64256 Len=10224 TSval=2008623497 TSecr=1039750192","","","","",""
"2721","66.734816760","10.10.3.102","10.10.3.105","MPTCP","80","5201  >  52632 [ACK] Seq=1 Ack=600694 Win=277888 Len=0 TSval=1039750193 TSecr=2008623497","0.000012379","","","",""
"2723","66.741003377","10.10.3.62","10.10.3.102","MPTCP","1516","56079  >  5201 [ACK] Seq=4513 Ack=1 Win=64256 Len=1424 TSval=3345790700 TSecr=2492568459","","","","",""
"2724","66.741016423","10.10.3.102","10.10.3.62","MPTCP","80","5201  >  56079 [ACK] Seq=1 Ack=5937 Win=276352 Len=0 TSval=2492568480 TSecr=3345790700","0.000013046","","","",""
"2725","66.742183888","10.10.3.105","10.10.3.102","MPTCP","32820","52632  >  5201 [PSH, ACK] Seq=600694 Ack=1 Win=64256 Len=32728 TSval=2008623505 TSecr=1039750193","","","","",""
"2726","66.742204672","10.10.3.102","10.10.3.105","MPTCP","80","5201  >  52632 [ACK] Seq=1 Ack=633422 Win=245248 Len=0 TSval=1039750200 TSecr=2008623505","0.000020784","","","",""
"2727","66.742244014","10.10.3.105","10.10.3.102","MPTCP","180","52632  >  5201 [PSH, ACK] Seq=633422 Ack=1 Win=64256 Len=88 TSval=2008623505 TSecr=1039750200","","","","",""
"2728","66.753043781","10.10.3.62","10.10.3.102","MPTCP","1516","56079  >  5201 [ACK] Seq=5937 Ack=1 Win=64256 Len=1424 TSval=3345790700 TSecr=2492568459","","","","",""
"2729","66.753083497","10.10.3.102","10.10.3.62","MPTCP","80","5201  >  56079 [ACK] Seq=1 Ack=7361 Win=275072 Len=0 TSval=2492568492 TSecr=3345790700","0.000039716","","","",""
"2730","66.754372107","10.10.3.105","10.10.3.102","MPTCP","28572","52632  >  5201 [PSH, ACK] Seq=633510 Ack=1 Win=64256 Len=28480 TSval=2008623517 TSecr=1039750200","","","","",""
"2731","66.754425865","10.10.3.102","10.10.3.105","MPTCP","80","5201  >  52632 [ACK] Seq=1 Ack=661990 Win=275072 Len=0 TSval=1039750213 TSecr=2008623505","0.000053758","","","",""
"2732","66.754756867","10.10.3.105","10.10.3.102","MPTCP","1436","52632  >  5201 [PSH, ACK] Seq=661990 Ack=1 Win=64256 Len=1344 TSval=2008623517 TSecr=1039750213","","","","",""
"2733","66.754802113","10.10.3.102","10.10.3.105","MPTCP","80","5201  >  52632 [ACK] Seq=1 Ack=663334 Win=275072 Len=0 TSval=1039750213 TSecr=2008623517","0.000045246","","","",""
"2734","66.764937796","10.10.3.62","10.10.3.102","MPTCP","1516","56079  >  5201 [ACK] Seq=7361 Ack=1 Win=64256 Len=1424 TSval=3345790700 TSecr=2492568459","","","","",""
"2735","66.764978009","10.10.3.102","10.10.3.62","MPTCP","80","5201  >  56079 [ACK] Seq=1 Ack=8785 Win=275072 Len=0 TSval=2492568504 TSecr=3345790700","0.000040213","","","",""
"2736","66.776794881","10.10.3.62","10.10.3.102","MPTCP","1516","56079  >  5201 [ACK] Seq=8785 Ack=1 Win=64256 Len=1424 TSval=3345790700 TSecr=2492568459","","","","",""
"2737","66.776834958","10.10.3.102","10.10.3.62","MPTCP","80","5201  >  56079 [ACK] Seq=1 Ack=10209 Win=275072 Len=0 TSval=2492568516 TSecr=3345790700","0.000040077","","","",""
"2738","66.788654754","10.10.3.62","10.10.3.102","MPTCP","1516","56079  >  5201 [PSH, ACK] Seq=10209 Ack=1 Win=64256 Len=1424 TSval=3345790700 TSecr=2492568459","","","","",""
"2739","66.788694418","10.10.3.102","10.10.3.62","MPTCP","80","5201  >  56079 [ACK] Seq=1 Ack=11633 Win=275072 Len=0 TSval=2492568528 TSecr=3345790700","0.000039664","","","",""
"2740","66.800566046","10.10.3.62","10.10.3.102","MPTCP","1516","56079  >  5201 [ACK] Seq=11633 Ack=1 Win=64256 Len=1424 TSval=3345790700 TSecr=2492568459","","","","",""
"2741","66.800606215","10.10.3.102","10.10.3.62","MPTCP","80","5201  >  56079 [ACK] Seq=1 Ack=13057 Win=275072 Len=0 TSval=2492568540 TSecr=3345790700","0.000040169","","","",""
"2742","66.812424387","10.10.3.62","10.10.3.102","MPTCP","1516","56079  >  5201 [ACK] Seq=13057 Ack=1 Win=64256 Len=1424 TSval=3345790700 TSecr=2492568459","","","","",""
"2743","66.812468135","10.10.3.102","10.10.3.62","MPTCP","80","5201  >  56079 [ACK] Seq=1 Ack=14481 Win=275072 Len=0 TSval=2492568552 TSecr=3345790700","0.000043748","","","",""
"2744","66.824293559","10.10.3.62","10.10.3.102","MPTCP","1516","56079  >  5201 [ACK] Seq=14481 Ack=1 Win=64256 Len=1424 TSval=3345790700 TSecr=2492568459","","","","",""
"2745","66.824337878","10.10.3.102","10.10.3.62","MPTCP","80","5201  >  56079 [ACK] Seq=1 Ack=15905 Win=275072 Len=0 TSval=2492568563 TSecr=3345790700","0.000044319","","","",""
"2746","66.836125916","10.10.3.62","10.10.3.102","MPTCP","1516","56079  >  5201 [PSH, ACK] Seq=15905 Ack=1 Win=64256 Len=1424 TSval=3345790700 TSecr=2492568459","","","","",""
"2747","66.836169805","10.10.3.102","10.10.3.62","MPTCP","80","5201  >  56079 [ACK] Seq=1 Ack=17329 Win=275072 Len=0 TSval=2492568575 TSecr=3345790700","0.000043889","","","",""
"2749","66.848056357","10.10.3.62","10.10.3.102","MPTCP","1516","56079  >  5201 [ACK] Seq=17329 Ack=1 Win=64256 Len=1424 TSval=3345790705 TSecr=2492568471","","","","",""
"2750","66.848100361","10.10.3.102","10.10.3.62","MPTCP","80","5201  >  56079 [ACK] Seq=1 Ack=18753 Win=275072 Len=0 TSval=2492568587 TSecr=3345790705","0.000044004","","","",""
"2751","66.859715784","10.10.3.62","10.10.3.102","MPTCP","1516","56079  >  5201 [PSH, ACK] Seq=18753 Ack=1 Win=64256 Len=1424 TSval=3345790705 TSecr=2492568471","","","","",""
"2752","66.859758283","10.10.3.102","10.10.3.62","MPTCP","80","5201  >  56079 [ACK] Seq=1 Ack=20177 Win=275072 Len=0 TSval=2492568599 TSecr=3345790705","0.000042499","","","",""
"2753","66.871607714","10.10.3.62","10.10.3.102","MPTCP","1516","56079  >  5201 [ACK] Seq=20177 Ack=1 Win=64256 Len=1424 TSval=3345790710 TSecr=2492568480","","","","",""
"2754","66.871641107","10.10.3.102","10.10.3.62","MPTCP","80","5201  >  56079 [ACK] Seq=1 Ack=21601 Win=275072 Len=0 TSval=2492568611 TSecr=3345790710","0.000033393","","","",""
"2755","66.883411695","10.10.3.62","10.10.3.102","MPTCP","1516","56079  >  5201 [PSH, ACK] Seq=21601 Ack=1 Win=64256 Len=1424 TSval=3345790710 TSecr=2492568480","","","","",""
"2756","66.883433236","10.10.3.102","10.10.3.62","MPTCP","80","5201  >  56079 [ACK] Seq=1 Ack=23025 Win=275072 Len=0 TSval=2492568623 TSecr=3345790710","0.000021541","","","",""
"2757","66.895314273","10.10.3.62","10.10.3.102","MPTCP","1516","56079  >  5201 [ACK] Seq=23025 Ack=1 Win=64256 Len=1424 TSval=3345790722 TSecr=2492568492","","","","",""
"2758","66.895335988","10.10.3.102","10.10.3.62","MPTCP","80","5201  >  56079 [ACK] Seq=1 Ack=24449 Win=275072 Len=0 TSval=2492568634 TSecr=3345790722","0.000021715","","","",""
"2759","66.907162182","10.10.3.62","10.10.3.102","MPTCP","1516","56079  >  5201 [PSH, ACK] Seq=24449 Ack=1 Win=64256 Len=1424 TSval=3345790722 TSecr=2492568492","","","","",""
"2760","66.907182754","10.10.3.102","10.10.3.62","MPTCP","80","5201  >  56079 [ACK] Seq=1 Ack=25873 Win=275072 Len=0 TSval=2492568646 TSecr=3345790722","0.000020572","","","",""
"2761","66.919155875","10.10.3.62","10.10.3.102","MPTCP","1516","56079  >  5201 [ACK] Seq=25873 Ack=1 Win=64256 Len=1424 TSval=3345790734 TSecr=2492568504","","","","",""
"2762","66.919175060","10.10.3.102","10.10.3.62","MPTCP","80","5201  >  56079 [ACK] Seq=1 Ack=27297 Win=275072 Len=0 TSval=2492568658 TSecr=3345790734","0.000019185","","","",""
"2763","66.931723751","10.10.3.62","10.10.3.102","MPTCP","1516","56079  >  5201 [PSH, ACK] Seq=27297 Ack=1 Win=64256 Len=1424 TSval=3345790734 TSecr=2492568504","","","","",""
"2764","66.931760210","10.10.3.102","10.10.3.62","MPTCP","80","5201  >  56079 [ACK] Seq=1 Ack=28721 Win=275072 Len=0 TSval=2492568671 TSecr=3345790734","0.000036459","","","",""
"2765","66.943811544","10.10.3.62","10.10.3.102","MPTCP","1516","56079  >  5201 [ACK] Seq=28721 Ack=1 Win=64256 Len=1424 TSval=3345790745 TSecr=2492568516","","","","",""
"2766","66.943832356","10.10.3.102","10.10.3.62","MPTCP","80","5201  >  56079 [ACK] Seq=1 Ack=30145 Win=275072 Len=0 TSval=2492568683 TSecr=3345790745","0.000020812","","","",""
"2767","66.946534018","10.10.3.105","10.10.3.102","MPTCP","32820","52632  >  5201 [PSH, ACK] Seq=663334 Ack=1 Win=64256 Len=32728 TSval=2008623709 TSecr=1039750213","","","","",""
"2768","66.946571283","10.10.3.102","10.10.3.105","MPTCP","80","5201  >  52632 [ACK] Seq=1 Ack=696062 Win=242432 Len=0 TSval=1039750405 TSecr=2008623709","0.000037265","","","",""
"2769","66.947201361","10.10.3.105","10.10.3.102","MPTCP","59900","52632  >  5201 [PSH, ACK] Seq=696062 Ack=1 Win=64256 Len=59808 TSval=2008623709 TSecr=1039750405","","","","",""
"2770","66.947227821","10.10.3.102","10.10.3.105","MPTCP","80","5201  >  52632 [ACK] Seq=1 Ack=755870 Win=408576 Len=0 TSval=1039750405 TSecr=2008623709","0.000026460","","","",""
"2771","66.947233513","10.10.3.105","10.10.3.102","MPTCP","2940","52632  >  5201 [PSH, ACK] Seq=755870 Ack=1 Win=64256 Len=2848 TSval=2008623709 TSecr=1039750405","","","","",""
"2772","66.947238319","10.10.3.102","10.10.3.105","MPTCP","80","5201  >  52632 [ACK] Seq=1 Ack=758718 Win=414336 Len=0 TSval=1039750405 TSecr=2008623709","0.000004806","","","",""
"2773","66.947725789","10.10.3.105","10.10.3.102","MPTCP","57052","52632  >  5201 [PSH, ACK] Seq=758718 Ack=1 Win=64256 Len=56960 TSval=2008623710 TSecr=1039750405","","","","",""
"2774","66.947746217","10.10.3.102","10.10.3.105","MPTCP","80","5201  >  52632 [ACK] Seq=1 Ack=815678 Win=528256 Len=0 TSval=1039750406 TSecr=2008623710","0.000020428","","","",""
"2775","66.947774901","10.10.3.105","10.10.3.102","MPTCP","5788","52632  >  5201 [PSH, ACK] Seq=815678 Ack=1 Win=64256 Len=5696 TSval=2008623710 TSecr=1039750405","","","","",""
"2776","66.947781258","10.10.3.102","10.10.3.105","MPTCP","80","5201  >  52632 [ACK] Seq=1 Ack=821374 Win=539648 Len=0 TSval=1039750406 TSecr=2008623710","0.000006357","","","",""
"2777","66.948294981","10.10.3.105","10.10.3.102","MPTCP","59900","52632  >  5201 [PSH, ACK] Seq=821374 Ack=1 Win=64256 Len=59808 TSval=2008623710 TSecr=1039750405","","","","",""
"2778","66.948307254","10.10.3.102","10.10.3.105","MPTCP","80","5201  >  52632 [ACK] Seq=1 Ack=881182 Win=659200 Len=0 TSval=1039750406 TSecr=2008623710","0.000012273","","","",""
"2779","66.948310881","10.10.3.105","10.10.3.102","MPTCP","2940","52632  >  5201 [PSH, ACK] Seq=881182 Ack=1 Win=64256 Len=2848 TSval=2008623710 TSecr=1039750406","","","","",""
"2780","66.948314936","10.10.3.102","10.10.3.105","MPTCP","80","5201  >  52632 [ACK] Seq=1 Ack=884030 Win=664960 Len=0 TSval=1039750406 TSecr=2008623710","0.000004055","","","",""
"2781","66.948852203","10.10.3.105","10.10.3.102","MPTCP","62748","52632  >  5201 [PSH, ACK] Seq=884030 Ack=1 Win=64256 Len=62656 TSval=2008623711 TSecr=1039750406","","","","",""
"2782","66.948864907","10.10.3.102","10.10.3.105","MPTCP","80","5201  >  52632 [ACK] Seq=1 Ack=946686 Win=790272 Len=0 TSval=1039750407 TSecr=2008623711","0.000012704","","","",""
"2783","66.949402391","10.10.3.105","10.10.3.102","MPTCP","62748","52632  >  5201 [PSH, ACK] Seq=946686 Ack=1 Win=64256 Len=62656 TSval=2008623711 TSecr=1039750406","","","","",""
"2784","66.949416202","10.10.3.102","10.10.3.105","MPTCP","80","5201  >  52632 [ACK] Seq=1 Ack=1009342 Win=915584 Len=0 TSval=1039750408 TSecr=2008623711","0.000013811","","","",""
"2785","66.949443559","10.10.3.105","10.10.3.102","MPTCP","4364","52632  >  5201 [PSH, ACK] Seq=1009342 Ack=1 Win=64256 Len=4272 TSval=2008623712 TSecr=1039750407","","","","",""
"2786","66.949448490","10.10.3.102","10.10.3.105","MPTCP","80","5201  >  52632 [ACK] Seq=1 Ack=1013614 Win=924032 Len=0 TSval=1039750408 TSecr=2008623712","0.000004931","","","",""
"2787","66.949939344","10.10.3.105","10.10.3.102","MPTCP","58476","52632  >  5201 [PSH, ACK] Seq=1013614 Ack=1 Win=64256 Len=58384 TSval=2008623712 TSecr=1039750407","","","","",""
"2788","66.949951668","10.10.3.102","10.10.3.105","MPTCP","80","5201  >  52632 [ACK] Seq=1 Ack=1071998 Win=1040896 Len=0 TSval=1039750408 TSecr=2008623712","0.000012324","","","",""
"2789","66.950374075","10.10.3.105","10.10.3.102","MPTCP","51356","52632  >  5201 [ACK] Seq=1071998 Ack=1 Win=64256 Len=51264 TSval=2008623712 TSecr=1039750408","","","","",""
"2790","66.950389235","10.10.3.102","10.10.3.105","MPTCP","80","5201  >  52632 [ACK] Seq=1 Ack=1123262 Win=1143424 Len=0 TSval=1039750409 TSecr=2008623712","0.000015160","","","",""
"2791","66.950486970","10.10.3.105","10.10.3.102","MPTCP","11484","52632  >  5201 [PSH, ACK] Seq=1123262 Ack=1 Win=64256 Len=11392 TSval=2008623712 TSecr=1039750408","","","","",""
"2792","66.950493284","10.10.3.102","10.10.3.105","MPTCP","80","5201  >  52632 [ACK] Seq=1 Ack=1134654 Win=1166208 Len=0 TSval=1039750409 TSecr=2008623712","0.000006314","","","",""
"2793","66.950543264","10.10.3.105","10.10.3.102","MPTCP","6444","52632  >  5201 [PSH, ACK] Seq=1134654 Ack=1 Win=64256 Len=6352 TSval=2008623713 TSecr=1039750408","","","","",""
"2794","66.950547824","10.10.3.102","10.10.3.105","MPTCP","80","5201  >  52632 [ACK] Seq=1 Ack=1141006 Win=1178880 Len=0 TSval=1039750409 TSecr=2008623713","0.000004560","","","",""
"2795","66.951083712","10.10.3.105","10.10.3.102","MPTCP","62748","52632  >  5201 [PSH, ACK] Seq=1141006 Ack=1 Win=64256 Len=62656 TSval=2008623713 TSecr=1039750408","","","","",""
"2796","66.951096039","10.10.3.102","10.10.3.105","MPTCP","80","5201  >  52632 [ACK] Seq=1 Ack=1203662 Win=1304192 Len=0 TSval=1039750409 TSecr=2008623713","0.000012327","","","",""
"2797","66.951588039","10.10.3.105","10.10.3.102","MPTCP","59900","52632  >  5201 [PSH, ACK] Seq=1203662 Ack=1 Win=64256 Len=59808 TSval=2008623713 TSecr=1039750409","","","","",""
"2798","66.951602956","10.10.3.102","10.10.3.105","MPTCP","80","5201  >  52632 [ACK] Seq=1 Ack=1263470 Win=1423744 Len=0 TSval=1039750410 TSecr=2008623713","0.000014917","","","",""
"2799","66.951630227","10.10.3.105","10.10.3.102","MPTCP","2940","52632  >  5201 [PSH, ACK] Seq=1263470 Ack=1 Win=64256 Len=2848 TSval=2008623714 TSecr=1039750409","","","","",""
"2800","66.951635414","10.10.3.102","10.10.3.105","MPTCP","80","5201  >  52632 [ACK] Seq=1 Ack=1266318 Win=1429504 Len=0 TSval=1039750410 TSecr=2008623714","0.000005187","","","",""
"2801","66.952161178","10.10.3.105","10.10.3.102","MPTCP","62748","52632  >  5201 [PSH, ACK] Seq=1266318 Ack=1 Win=64256 Len=62656 TSval=2008623714 TSecr=1039750409","","","","",""
"2802","66.952175311","10.10.3.102","10.10.3.105","MPTCP","80","5201  >  52632 [ACK] Seq=1 Ack=1328974 Win=1554816 Len=0 TSval=1039750410 TSecr=2008623714","0.000014133","","","",""
"2803","66.952701995","10.10.3.105","10.10.3.102","MPTCP","62748","52632  >  5201 [PSH, ACK] Seq=1328974 Ack=1 Win=64256 Len=62656 TSval=2008623714 TSecr=1039750410","","","","",""
"2804","66.952715947","10.10.3.102","10.10.3.105","MPTCP","80","5201  >  52632 [ACK] Seq=1 Ack=1391630 Win=1680128 Len=0 TSval=1039750411 TSecr=2008623714","0.000013952","","","",""
"2805","66.953245348","10.10.3.105","10.10.3.102","MPTCP","62748","52632  >  5201 [PSH, ACK] Seq=1391630 Ack=1 Win=64256 Len=62656 TSval=2008623715 TSecr=1039750410","","","","",""
"2806","66.953259403","10.10.3.102","10.10.3.105","MPTCP","80","5201  >  52632 [ACK] Seq=1 Ack=1454286 Win=1805440 Len=0 TSval=1039750411 TSecr=2008623715","0.000014055","","","",""
"2807","66.953786782","10.10.3.105","10.10.3.102","MPTCP","62748","52632  >  5201 [PSH, ACK] Seq=1454286 Ack=1 Win=64256 Len=62656 TSval=2008623715 TSecr=1039750411","","","","",""
"2808","66.953801881","10.10.3.102","10.10.3.105","MPTCP","80","5201  >  52632 [ACK] Seq=1 Ack=1516942 Win=1930752 Len=0 TSval=1039750412 TSecr=2008623715","0.000015099","","","",""
"2809","66.954327781","10.10.3.105","10.10.3.102","MPTCP","62748","52632  >  5201 [PSH, ACK] Seq=1516942 Ack=1 Win=64256 Len=62656 TSval=2008623716 TSecr=1039750411","","","","",""
"2810","66.954346278","10.10.3.102","10.10.3.105","MPTCP","80","5201  >  52632 [ACK] Seq=1 Ack=1579598 Win=2056064 Len=0 TSval=1039750412 TSecr=2008623716","0.000018497","","","",""
"2811","66.954876872","10.10.3.105","10.10.3.102","MPTCP","62748","52632  >  5201 [PSH, ACK] Seq=1579598 Ack=1 Win=64256 Len=62656 TSval=2008623716 TSecr=1039750412","","","","",""
"2812","66.954891790","10.10.3.102","10.10.3.105","MPTCP","80","5201  >  52632 [ACK] Seq=1 Ack=1642254 Win=2181376 Len=0 TSval=1039750413 TSecr=2008623716","0.000014918","","","",""
"2813","66.955417718","10.10.3.105","10.10.3.102","MPTCP","62748","52632  >  5201 [PSH, ACK] Seq=1642254 Ack=1 Win=64256 Len=62656 TSval=2008623717 TSecr=1039750412","","","","",""
"2814","66.955431847","10.10.3.102","10.10.3.105","MPTCP","80","5201  >  52632 [ACK] Seq=1 Ack=1704910 Win=2306688 Len=0 TSval=1039750414 TSecr=2008623717","0.000014129","","","",""
"2815","66.955436174","10.10.3.62","10.10.3.102","MPTCP","1516","56079  >  5201 [PSH, ACK] Seq=30145 Ack=1 Win=64256 Len=1424 TSval=3345790745 TSecr=2492568516","","","","",""
"2816","66.955441088","10.10.3.102","10.10.3.62","MPTCP","80","5201  >  56079 [ACK] Seq=1 Ack=31569 Win=2306688 Len=0 TSval=2492568695 TSecr=3345790745","0.000004914","","","",""
"2817","66.955966793","10.10.3.105","10.10.3.102","MPTCP","62748","52632  >  5201 [PSH, ACK] Seq=1704910 Ack=1 Win=64256 Len=62656 TSval=2008623718 TSecr=1039750413","","","","",""
"2818","66.955982650","10.10.3.102","10.10.3.105","MPTCP","80","5201  >  52632 [ACK] Seq=1 Ack=1767566 Win=2432000 Len=0 TSval=1039750414 TSecr=2008623718","0.000015857","","","",""
"2819","66.956516006","10.10.3.105","10.10.3.102","MPTCP","62748","52632  >  5201 [PSH, ACK] Seq=1767566 Ack=1 Win=64256 Len=62656 TSval=2008623718 TSecr=1039750414","","","","",""
"2820","66.956532883","10.10.3.102","10.10.3.105","MPTCP","80","5201  >  52632 [ACK] Seq=1 Ack=1830222 Win=2557312 Len=0 TSval=1039750415 TSecr=2008623718","0.000016877","","","",""
"2821","66.956860869","10.10.3.105","10.10.3.102","MPTCP","40140","52632  >  5201 [PSH, ACK] Seq=1830222 Ack=1 Win=64256 Len=40048 TSval=2008623719 TSecr=1039750414","","","","",""
"2822","66.956873384","10.10.3.102","10.10.3.105","MPTCP","80","5201  >  52632 [ACK] Seq=1 Ack=1870270 Win=2637440 Len=0 TSval=1039750415 TSecr=2008623719","0.000012515","","","",""
