"No.","Time","Source","Destination","Protocol","Length","Info","RTT","Lost Segement","Duplicate ","Retransmission","IDK"
"376","14.071895489","10.10.3.105","10.10.3.102","MPTCP","80","49134  >  5201 [SYN] Seq=0 Win=64240 Len=0 MSS=1460 SACK_PERM=1 TSval=2008818059 TSecr=0 WS=128","","","","",""
"377","14.071919589","10.10.3.102","10.10.3.105","MPTCP","88","5201  >  49134 [SYN, ACK] Seq=0 Ack=1 Win=65160 Len=0 MSS=1460 SACK_PERM=1 TSval=1039944755 TSecr=2008818059 WS=128","0.000024100","","","",""
"378","14.072004552","10.10.3.105","10.10.3.102","MPTCP","88","49134  >  5201 [ACK] Seq=1 Ack=1 Win=64256 Len=0 TSval=2008818059 TSecr=1039944755","0.000084963","","","",""
"379","14.072065347","10.10.3.105","10.10.3.102","MPTCP","129","49134  >  5201 [PSH, ACK] Seq=1 Ack=1 Win=64256 Len=37 TSval=2008818059 TSecr=1039944755","","","","",""
"380","14.072075444","10.10.3.102","10.10.3.105","MPTCP","80","5201  >  49134 [ACK] Seq=1 Ack=38 Win=65152 Len=0 TSval=1039944755 TSecr=2008818059","0.000010097","","","",""
"381","14.072128183","10.10.3.102","10.10.3.105","MPTCP","97","5201  >  49134 [PSH, ACK] Seq=1 Ack=38 Win=65152 Len=1 TSval=1039944755 TSecr=2008818059","","","","",""
"382","14.072184144","10.10.3.105","10.10.3.102","MPTCP","80","49134  >  5201 [ACK] Seq=38 Ack=2 Win=64256 Len=0 TSval=2008818059 TSecr=1039944755","0.000055961","","","",""
"383","14.072227844","10.10.3.105","10.10.3.102","MPTCP","100","49134  >  5201 [PSH, ACK] Seq=38 Ack=2 Win=64256 Len=4 TSval=2008818059 TSecr=1039944755","","","","",""
"384","14.072403779","10.10.3.102","10.10.3.105","MPTCP","84","5201  >  49134 [ACK] Seq=2 Ack=42 Win=65152 Len=0 TSval=1039944755 TSecr=2008818059","0.000175935","","","",""
"385","14.072492792","10.10.3.105","10.10.3.102","MPTCP","196","49134  >  5201 [PSH, ACK] Seq=42 Ack=2 Win=64256 Len=100 TSval=2008818059 TSecr=1039944755","","","","",""
"386","14.072556992","10.10.3.102","10.10.3.105","MPTCP","97","5201  >  49134 [PSH, ACK] Seq=2 Ack=142 Win=65152 Len=1 TSval=1039944756 TSecr=2008818059","0.000064200","","","",""
"388","14.072954303","10.10.3.105","10.10.3.102","MPTCP","80","49142  >  5201 [SYN] Seq=0 Win=64240 Len=0 MSS=1460 SACK_PERM=1 TSval=2008818060 TSecr=0 WS=128","","","","",""
"389","14.072973623","10.10.3.102","10.10.3.105","MPTCP","88","5201  >  49142 [SYN, ACK] Seq=0 Ack=1 Win=65160 Len=0 MSS=1460 SACK_PERM=1 TSval=1039944756 TSecr=2008818060 WS=128","0.000019320","","","",""
"390","14.073027543","10.10.3.105","10.10.3.102","MPTCP","88","49142  >  5201 [ACK] Seq=1 Ack=1 Win=64256 Len=0 TSval=2008818060 TSecr=1039944756","0.000053920","","","",""
"391","14.073070270","10.10.3.102","10.10.3.105","MPTCP","84","[TCP Window Update] 5201  >  49142 [ACK] Seq=1 Ack=1 Win=65280 Len=0 TSval=1039944756 TSecr=2008818060","","","","","â\234\223"
"392","14.073095171","10.10.3.105","10.10.3.102","MPTCP","129","49142  >  5201 [PSH, ACK] Seq=1 Ack=1 Win=64256 Len=37 TSval=2008818060 TSecr=1039944756","","","","",""
"393","14.073102194","10.10.3.102","10.10.3.105","MPTCP","80","5201  >  49142 [ACK] Seq=1 Ack=38 Win=65280 Len=0 TSval=1039944756 TSecr=2008818060","0.000007023","","","",""
"394","14.073425251","10.10.3.105","10.10.3.102","MPTCP","76","49134  >  5201 [ACK] Seq=142 Ack=3 Win=64256 Len=0 TSval=2008818060 TSecr=1039944756","0.000868259","","","",""
"395","14.073516328","10.10.3.105","10.10.3.102","MPTCP","76","49142  >  5201 [ACK] Seq=38 Ack=1 Win=64256 Len=0 TSval=2008818060 TSecr=1039944756","","","","",""
"397","14.073790357","10.10.3.102","10.10.3.105","MPTCP","97","5201  >  49134 [PSH, ACK] Seq=3 Ack=142 Win=65152 Len=1 TSval=1039944757 TSecr=2008818060","","","","",""
"403","14.075546489","10.10.3.62","10.10.3.102","MPTCP","88","43467  >  5201 [SYN] Seq=0 Win=64256 Len=0 MSS=1460 SACK_PERM=1 TSval=3345985266 TSecr=0 WS=128","","","","",""
"404","14.075558540","10.10.3.102","10.10.3.62","MPTCP","92","5201  >  43467 [SYN, ACK] Seq=0 Ack=1 Win=65160 Len=0 MSS=1460 SACK_PERM=1 TSval=2492763040 TSecr=3345985266 WS=128","0.000012051","","","",""
"450","14.098284781","10.10.3.62","10.10.3.102","MPTCP","88","37459  >  5201 [SYN] Seq=0 Win=64256 Len=0 MSS=1460 SACK_PERM=1 TSval=3345985266 TSecr=0 WS=128","","","","",""
"451","14.098325224","10.10.3.102","10.10.3.62","MPTCP","92","5201  >  37459 [SYN, ACK] Seq=0 Ack=1 Win=65160 Len=0 MSS=1460 SACK_PERM=1 TSval=2492763062 TSecr=3345985266 WS=128","0.000040443","","","",""
"467","14.108409455","10.10.3.105","10.10.3.59","MPTCP","88","49829  >  5201 [SYN] Seq=0 Win=64256 Len=0 MSS=1460 SACK_PERM=1 TSval=938073392 TSecr=0 WS=128","","","","",""
"468","14.108473281","10.10.3.59","10.10.3.105","MPTCP","92","5201  >  49829 [SYN, ACK] Seq=0 Ack=1 Win=65160 Len=0 MSS=1460 SACK_PERM=1 TSval=1400053170 TSecr=938073392 WS=128","0.000063826","","","",""
"469","14.108513807","10.10.3.105","10.10.3.59","MPTCP","88","46369  >  5201 [SYN] Seq=0 Win=64256 Len=0 MSS=1460 SACK_PERM=1 TSval=938073393 TSecr=0 WS=128","","","","",""
"470","14.108535907","10.10.3.59","10.10.3.105","MPTCP","92","5201  >  46369 [SYN, ACK] Seq=0 Ack=1 Win=65160 Len=0 MSS=1460 SACK_PERM=1 TSval=1400053170 TSecr=938073393 WS=128","0.000022100","","","",""
"471","14.113137480","10.10.3.105","10.10.3.59","MPTCP","92","49829  >  5201 [ACK] Seq=1 Ack=1 Win=64256 Len=0 TSval=938073429 TSecr=1400053170","0.004664199","","","",""
"472","14.113249561","10.10.3.59","10.10.3.105","MPTCP","80","[TCP Window Update] 5201  >  49829 [ACK] Seq=1 Ack=1 Win=65280 Len=0 TSval=1400053174 TSecr=938073429","","","","","â\234\223"
"474","14.115653244","10.10.3.105","10.10.3.59","MPTCP","92","46369  >  5201 [ACK] Seq=1 Ack=1 Win=64256 Len=0 TSval=938073430 TSecr=1400053170","0.007117337","","","",""
"475","14.115758514","10.10.3.59","10.10.3.105","MPTCP","80","[TCP Window Update] 5201  >  46369 [ACK] Seq=1 Ack=1 Win=65280 Len=0 TSval=1400053177 TSecr=938073430","","","","","â\234\223"
"476","14.117507413","10.10.3.105","10.10.3.102","MPTCP","80","49134  >  5201 [ACK] Seq=142 Ack=4 Win=64256 Len=0 TSval=2008818105 TSecr=1039944757","0.043717056","","","",""
"477","14.117548512","10.10.3.102","10.10.3.105","MPTCP","97","5201  >  49134 [PSH, ACK] Seq=4 Ack=142 Win=65280 Len=1 TSval=1039944801 TSecr=2008818105","","","","",""
"478","14.117644610","10.10.3.105","10.10.3.102","MPTCP","80","49134  >  5201 [ACK] Seq=142 Ack=5 Win=64256 Len=0 TSval=2008818105 TSecr=1039944801","0.000096098","","","",""
"479","14.117772959","10.10.3.105","10.10.3.102","MPTCP","7212","49142  >  5201 [PSH, ACK] Seq=38 Ack=1 Win=64256 Len=7120 TSval=2008818105 TSecr=1039944756","","","","",""
"480","14.117797621","10.10.3.102","10.10.3.105","MPTCP","80","5201  >  49142 [ACK] Seq=1 Ack=7158 Win=60672 Len=0 TSval=1039944801 TSecr=2008818105","0.000024662","","","",""
"481","14.117832360","10.10.3.105","10.10.3.102","MPTCP","7212","49142  >  5201 [PSH, ACK] Seq=7158 Ack=1 Win=64256 Len=7120 TSval=2008818105 TSecr=1039944756","","","","",""
"482","14.117845722","10.10.3.102","10.10.3.105","MPTCP","80","5201  >  49142 [ACK] Seq=1 Ack=14278 Win=55680 Len=0 TSval=1039944801 TSecr=2008818105","0.000013362","","","",""
"483","14.117967556","10.10.3.105","10.10.3.102","MPTCP","10060","49142  >  5201 [PSH, ACK] Seq=14278 Ack=1 Win=64256 Len=9968 TSval=2008818105 TSecr=1039944801","","","","",""
"484","14.117980920","10.10.3.102","10.10.3.105","MPTCP","80","5201  >  49142 [ACK] Seq=1 Ack=24246 Win=58752 Len=0 TSval=1039944801 TSecr=2008818105","0.000013364","","","",""
"485","14.118044102","10.10.3.105","10.10.3.102","MPTCP","7212","49142  >  5201 [PSH, ACK] Seq=24246 Ack=1 Win=64256 Len=7120 TSval=2008818105 TSecr=1039944801","","","","",""
"486","14.118054670","10.10.3.102","10.10.3.105","MPTCP","80","5201  >  49142 [ACK] Seq=1 Ack=31366 Win=60672 Len=0 TSval=1039944801 TSecr=2008818105","0.000010568","","","",""
"487","14.118151114","10.10.3.105","10.10.3.102","MPTCP","11484","49142  >  5201 [PSH, ACK] Seq=31366 Ack=1 Win=64256 Len=11392 TSval=2008818105 TSecr=1039944801","","","","",""
"488","14.118164967","10.10.3.102","10.10.3.105","MPTCP","80","5201  >  49142 [ACK] Seq=1 Ack=42758 Win=86912 Len=0 TSval=1039944801 TSecr=2008818105","0.000013853","","","",""
"489","14.118310940","10.10.3.105","10.10.3.102","MPTCP","18604","49142  >  5201 [PSH, ACK] Seq=42758 Ack=1 Win=64256 Len=18512 TSval=2008818105 TSecr=1039944801","","","","",""
"490","14.118325406","10.10.3.102","10.10.3.105","MPTCP","80","5201  >  49142 [ACK] Seq=1 Ack=61270 Win=123904 Len=0 TSval=1039944801 TSecr=2008818105","0.000014466","","","",""
"491","14.118339943","10.10.3.105","10.10.3.102","MPTCP","1516","49142  >  5201 [ACK] Seq=61270 Ack=1 Win=64256 Len=1424 TSval=2008818105 TSecr=1039944801","","","","",""
"492","14.118349391","10.10.3.102","10.10.3.105","MPTCP","80","5201  >  49142 [ACK] Seq=1 Ack=62694 Win=126848 Len=0 TSval=1039944802 TSecr=2008818105","0.000009448","","","",""
"493","14.118340074","10.10.3.105","10.10.3.102","MPTCP","2716","49142  >  5201 [PSH, ACK] Seq=62694 Ack=1 Win=64256 Len=2624 TSval=2008818105 TSecr=1039944801","","","","",""
"494","14.118360037","10.10.3.102","10.10.3.105","MPTCP","80","5201  >  49142 [ACK] Seq=1 Ack=65318 Win=132096 Len=0 TSval=1039944802 TSecr=2008818105","0.000019963","","","",""
"495","14.118588979","10.10.3.105","10.10.3.102","MPTCP","28572","49142  >  5201 [PSH, ACK] Seq=65318 Ack=1 Win=64256 Len=28480 TSval=2008818105 TSecr=1039944801","","","","",""
"496","14.118606409","10.10.3.102","10.10.3.105","MPTCP","80","5201  >  49142 [ACK] Seq=1 Ack=93798 Win=189056 Len=0 TSval=1039944802 TSecr=2008818105","0.000017430","","","",""
"497","14.118723314","10.10.3.105","10.10.3.102","MPTCP","14332","49142  >  5201 [PSH, ACK] Seq=93798 Ack=1 Win=64256 Len=14240 TSval=2008818105 TSecr=1039944801","","","","",""
"498","14.118736626","10.10.3.102","10.10.3.105","MPTCP","80","5201  >  49142 [ACK] Seq=1 Ack=108038 Win=217472 Len=0 TSval=1039944802 TSecr=2008818105","0.000013312","","","",""
"499","14.118921574","10.10.3.105","10.10.3.59","MPTCP","1516","46369  >  5201 [ACK] Seq=1 Ack=1 Win=64256 Len=1424 TSval=938073437 TSecr=1400053177","","","","",""
"500","14.118952259","10.10.3.59","10.10.3.105","MPTCP","80","5201  >  46369 [ACK] Seq=1 Ack=1425 Win=215936 Len=0 TSval=1400053180 TSecr=938073437","0.000030685","","","",""
"501","14.118972591","10.10.3.105","10.10.3.102","MPTCP","28572","49142  >  5201 [PSH, ACK] Seq=108038 Ack=1 Win=64256 Len=28480 TSval=2008818105 TSecr=1039944801","","","","",""
"502","14.118987411","10.10.3.105","10.10.3.59","MPTCP","1180","46369  >  5201 [PSH, ACK] Seq=1425 Ack=1 Win=64256 Len=1088 TSval=938073437 TSecr=1400053177","","","","",""
"503","14.118990675","10.10.3.102","10.10.3.105","MPTCP","80","5201  >  49142 [ACK] Seq=1 Ack=136518 Win=241024 Len=0 TSval=1039944802 TSecr=2008818105","0.000018084","","","",""
"504","14.119001991","10.10.3.59","10.10.3.105","MPTCP","80","5201  >  46369 [ACK] Seq=1 Ack=2513 Win=215040 Len=0 TSval=1400053180 TSecr=938073437","0.000014580","","","",""
"505","14.119251765","10.10.3.105","10.10.3.102","MPTCP","32844","49142  >  5201 [PSH, ACK] Seq=136518 Ack=1 Win=64256 Len=32752 TSval=2008818106 TSecr=1039944802","","","","",""
"506","14.119271743","10.10.3.102","10.10.3.105","MPTCP","80","5201  >  49142 [ACK] Seq=1 Ack=169270 Win=268672 Len=0 TSval=1039944802 TSecr=2008818106","0.000019978","","","",""
"507","14.119594032","10.10.3.105","10.10.3.102","MPTCP","41388","49142  >  5201 [PSH, ACK] Seq=169270 Ack=1 Win=64256 Len=41296 TSval=2008818106 TSecr=1039944802","","","","",""
"508","14.119615190","10.10.3.102","10.10.3.105","MPTCP","80","5201  >  49142 [ACK] Seq=1 Ack=210566 Win=262912 Len=0 TSval=1039944803 TSecr=2008818106","0.000021158","","","",""
"509","14.119787827","10.10.3.105","10.10.3.102","MPTCP","21452","49142  >  5201 [PSH, ACK] Seq=210566 Ack=1 Win=64256 Len=21360 TSval=2008818106 TSecr=1039944802","","","","",""
"510","14.119803441","10.10.3.102","10.10.3.105","MPTCP","80","5201  >  49142 [ACK] Seq=1 Ack=231926 Win=276480 Len=0 TSval=1039944803 TSecr=2008818106","0.000015614","","","",""
"511","14.120148993","10.10.3.105","10.10.3.102","MPTCP","42812","49142  >  5201 [PSH, ACK] Seq=231926 Ack=1 Win=64256 Len=42720 TSval=2008818107 TSecr=1039944803","","","","",""
"512","14.120174922","10.10.3.102","10.10.3.105","MPTCP","80","5201  >  49142 [ACK] Seq=1 Ack=274646 Win=261888 Len=0 TSval=1039944803 TSecr=2008818107","0.000025929","","","",""
"513","14.120325604","10.10.3.105","10.10.3.102","MPTCP","20028","49142  >  5201 [PSH, ACK] Seq=274646 Ack=1 Win=64256 Len=19936 TSval=2008818107 TSecr=1039944803","","","","",""
"514","14.120340997","10.10.3.102","10.10.3.105","MPTCP","80","5201  >  49142 [ACK] Seq=1 Ack=294582 Win=277376 Len=0 TSval=1039944804 TSecr=2008818107","0.000015393","","","",""
"515","14.120543437","10.10.3.105","10.10.3.102","MPTCP","24300","49142  >  5201 [PSH, ACK] Seq=294582 Ack=1 Win=64256 Len=24208 TSval=2008818107 TSecr=1039944803","","","","",""
"516","14.120560062","10.10.3.102","10.10.3.105","MPTCP","80","5201  >  49142 [ACK] Seq=1 Ack=318790 Win=274560 Len=0 TSval=1039944804 TSecr=2008818107","0.000016625","","","",""
"517","14.120854300","10.10.3.105","10.10.3.102","MPTCP","38540","49142  >  5201 [PSH, ACK] Seq=318790 Ack=1 Win=64256 Len=38448 TSval=2008818107 TSecr=1039944803","","","","",""
"518","14.120874644","10.10.3.102","10.10.3.105","MPTCP","80","5201  >  49142 [ACK] Seq=1 Ack=357238 Win=264832 Len=0 TSval=1039944804 TSecr=2008818107","0.000020344","","","",""
"519","14.121271594","10.10.3.105","10.10.3.102","MPTCP","45660","49142  >  5201 [PSH, ACK] Seq=357238 Ack=1 Win=64256 Len=45568 TSval=2008818108 TSecr=1039944804","","","","",""
"520","14.121298743","10.10.3.102","10.10.3.105","MPTCP","80","5201  >  49142 [ACK] Seq=1 Ack=402806 Win=259968 Len=0 TSval=1039944804 TSecr=2008818108","0.000027149","","","",""
"521","14.121344043","10.10.3.105","10.10.3.102","MPTCP","10060","49142  >  5201 [ACK] Seq=402806 Ack=1 Win=64256 Len=9968 TSval=2008818108 TSecr=1039944804","","","","",""
"522","14.121358808","10.10.3.102","10.10.3.105","MPTCP","80","5201  >  49142 [ACK] Seq=1 Ack=412774 Win=253184 Len=0 TSval=1039944805 TSecr=2008818108","0.000014765","","","",""
"523","14.121396555","10.10.3.105","10.10.3.102","MPTCP","7212","49142  >  5201 [PSH, ACK] Seq=412774 Ack=1 Win=64256 Len=7120 TSval=2008818108 TSecr=1039944804","","","","",""
"524","14.121407954","10.10.3.102","10.10.3.105","MPTCP","80","5201  >  49142 [ACK] Seq=1 Ack=419894 Win=279168 Len=0 TSval=1039944805 TSecr=2008818108","0.000011399","","","",""
"525","14.121691890","10.10.3.105","10.10.3.102","MPTCP","31420","49142  >  5201 [PSH, ACK] Seq=419894 Ack=1 Win=64256 Len=31328 TSval=2008818108 TSecr=1039944804","","","","",""
"526","14.121711287","10.10.3.102","10.10.3.105","MPTCP","80","5201  >  49142 [ACK] Seq=1 Ack=451222 Win=348672 Len=0 TSval=1039944805 TSecr=2008818108","0.000019397","","","",""
"527","14.121947052","10.10.3.105","10.10.3.102","MPTCP","31420","49142  >  5201 [PSH, ACK] Seq=451222 Ack=1 Win=64256 Len=31328 TSval=2008818108 TSecr=1039944804","","","","",""
"528","14.121965233","10.10.3.102","10.10.3.105","MPTCP","80","5201  >  49142 [ACK] Seq=1 Ack=482550 Win=411392 Len=0 TSval=1039944805 TSecr=2008818108","0.000018181","","","",""
"529","14.122250272","10.10.3.105","10.10.3.102","MPTCP","34268","49142  >  5201 [PSH, ACK] Seq=482550 Ack=1 Win=64256 Len=34176 TSval=2008818108 TSecr=1039944805","","","","",""
"530","14.122272004","10.10.3.102","10.10.3.105","MPTCP","80","5201  >  49142 [ACK] Seq=1 Ack=516726 Win=479744 Len=0 TSval=1039944805 TSecr=2008818108","0.000021732","","","",""
"531","14.122482305","10.10.3.105","10.10.3.102","MPTCP","28572","49142  >  5201 [PSH, ACK] Seq=516726 Ack=1 Win=64256 Len=28480 TSval=2008818109 TSecr=1039944805","","","","",""
"532","14.122500452","10.10.3.102","10.10.3.105","MPTCP","80","5201  >  49142 [ACK] Seq=1 Ack=545206 Win=536704 Len=0 TSval=1039944806 TSecr=2008818109","0.000018147","","","",""
"533","14.122815249","10.10.3.105","10.10.3.102","MPTCP","37116","49142  >  5201 [PSH, ACK] Seq=545206 Ack=1 Win=64256 Len=37024 TSval=2008818109 TSecr=1039944805","","","","",""
"534","14.122835643","10.10.3.102","10.10.3.105","MPTCP","80","5201  >  49142 [ACK] Seq=1 Ack=582230 Win=610688 Len=0 TSval=1039944806 TSecr=2008818109","0.000020394","","","",""
"535","14.123039943","10.10.3.105","10.10.3.102","MPTCP","25724","49142  >  5201 [PSH, ACK] Seq=582230 Ack=1 Win=64256 Len=25632 TSval=2008818109 TSecr=1039944805","","","","",""
"536","14.123056803","10.10.3.102","10.10.3.105","MPTCP","80","5201  >  49142 [ACK] Seq=1 Ack=607862 Win=662016 Len=0 TSval=1039944806 TSecr=2008818109","0.000016860","","","",""
"537","14.123375870","10.10.3.105","10.10.3.102","MPTCP","39964","49142  >  5201 [PSH, ACK] Seq=607862 Ack=1 Win=64256 Len=39872 TSval=2008818110 TSecr=1039944806","","","","",""
"538","14.123396134","10.10.3.102","10.10.3.105","MPTCP","80","5201  >  49142 [ACK] Seq=1 Ack=647734 Win=741760 Len=0 TSval=1039944807 TSecr=2008818110","0.000020264","","","",""
"539","14.123574307","10.10.3.105","10.10.3.102","MPTCP","22876","49142  >  5201 [PSH, ACK] Seq=647734 Ack=1 Win=64256 Len=22784 TSval=2008818110 TSecr=1039944806","","","","",""
"540","14.123590172","10.10.3.102","10.10.3.105","MPTCP","80","5201  >  49142 [ACK] Seq=1 Ack=670518 Win=787328 Len=0 TSval=1039944807 TSecr=2008818110","0.000015865","","","",""
"541","14.123957439","10.10.3.105","10.10.3.102","MPTCP","44236","49142  >  5201 [PSH, ACK] Seq=670518 Ack=1 Win=64256 Len=44144 TSval=2008818110 TSecr=1039944806","","","","",""
"542","14.123978963","10.10.3.102","10.10.3.105","MPTCP","80","5201  >  49142 [ACK] Seq=1 Ack=714662 Win=875648 Len=0 TSval=1039944807 TSecr=2008818110","0.000021524","","","",""
"543","14.124104255","10.10.3.105","10.10.3.102","MPTCP","18604","49142  >  5201 [PSH, ACK] Seq=714662 Ack=1 Win=64256 Len=18512 TSval=2008818110 TSecr=1039944807","","","","",""
"544","14.124119325","10.10.3.102","10.10.3.105","MPTCP","80","5201  >  49142 [ACK] Seq=1 Ack=733174 Win=912640 Len=0 TSval=1039944807 TSecr=2008818110","0.000015070","","","",""
"545","14.124620934","10.10.3.105","10.10.3.102","MPTCP","47084","49142  >  5201 [PSH, ACK] Seq=733174 Ack=1 Win=64256 Len=46992 TSval=2008818111 TSecr=1039944807","","","","",""
"546","14.124645228","10.10.3.102","10.10.3.105","MPTCP","80","5201  >  49142 [ACK] Seq=1 Ack=780166 Win=1006592 Len=0 TSval=1039944808 TSecr=2008818111","0.000024294","","","",""
"547","14.124768041","10.10.3.105","10.10.3.102","MPTCP","15756","49142  >  5201 [PSH, ACK] Seq=780166 Ack=1 Win=64256 Len=15664 TSval=2008818111 TSecr=1039944807","","","","",""
"548","14.124782435","10.10.3.102","10.10.3.105","MPTCP","80","5201  >  49142 [ACK] Seq=1 Ack=795830 Win=1037952 Len=0 TSval=1039944808 TSecr=2008818111","0.000014394","","","",""
"549","14.125207816","10.10.3.105","10.10.3.102","MPTCP","49932","49142  >  5201 [PSH, ACK] Seq=795830 Ack=1 Win=64256 Len=49840 TSval=2008818111 TSecr=1039944807","","","","",""
"550","14.125231254","10.10.3.102","10.10.3.105","MPTCP","80","5201  >  49142 [ACK] Seq=1 Ack=845670 Win=1137664 Len=0 TSval=1039944808 TSecr=2008818111","0.000023438","","","",""
"551","14.125298610","10.10.3.105","10.10.3.102","MPTCP","12908","49142  >  5201 [PSH, ACK] Seq=845670 Ack=1 Win=64256 Len=12816 TSval=2008818112 TSecr=1039944808","","","","",""
"552","14.125316047","10.10.3.102","10.10.3.105","MPTCP","80","5201  >  49142 [ACK] Seq=1 Ack=858486 Win=1163264 Len=0 TSval=1039944808 TSecr=2008818112","0.000017437","","","",""
"553","14.125342747","10.10.3.105","10.10.3.102","MPTCP","4364","49142  >  5201 [ACK] Seq=858486 Ack=1 Win=64256 Len=4272 TSval=2008818112 TSecr=1039944808","","","","",""
"554","14.125353491","10.10.3.102","10.10.3.105","MPTCP","80","5201  >  49142 [ACK] Seq=1 Ack=862758 Win=1171840 Len=0 TSval=1039944809 TSecr=2008818112","0.000010744","","","",""
"555","14.125770028","10.10.3.105","10.10.3.102","MPTCP","48508","49142  >  5201 [PSH, ACK] Seq=862758 Ack=1 Win=64256 Len=48416 TSval=2008818112 TSecr=1039944808","","","","",""
"556","14.125795691","10.10.3.102","10.10.3.105","MPTCP","80","5201  >  49142 [ACK] Seq=1 Ack=911174 Win=1268608 Len=0 TSval=1039944809 TSecr=2008818112","0.000025663","","","",""
"557","14.125864985","10.10.3.105","10.10.3.102","MPTCP","10060","49142  >  5201 [PSH, ACK] Seq=911174 Ack=1 Win=64256 Len=9968 TSval=2008818112 TSecr=1039944808","","","","",""
"558","14.125877047","10.10.3.102","10.10.3.105","MPTCP","80","5201  >  49142 [ACK] Seq=1 Ack=921142 Win=1288576 Len=0 TSval=1039944809 TSecr=2008818112","0.000012062","","","",""
"559","14.126219780","10.10.3.105","10.10.3.102","MPTCP","42812","49142  >  5201 [PSH, ACK] Seq=921142 Ack=1 Win=64256 Len=42720 TSval=2008818112 TSecr=1039944808","","","","",""
"560","14.126240933","10.10.3.102","10.10.3.105","MPTCP","80","5201  >  49142 [ACK] Seq=1 Ack=963862 Win=1373952 Len=0 TSval=1039944809 TSecr=2008818112","0.000021153","","","",""
"561","14.126416689","10.10.3.105","10.10.3.102","MPTCP","20028","49142  >  5201 [PSH, ACK] Seq=963862 Ack=1 Win=64256 Len=19936 TSval=2008818113 TSecr=1039944809","","","","",""
"562","14.126431771","10.10.3.102","10.10.3.105","MPTCP","80","5201  >  49142 [ACK] Seq=1 Ack=983798 Win=1413888 Len=0 TSval=1039944810 TSecr=2008818113","0.000015082","","","",""
"563","14.126833259","10.10.3.105","10.10.3.102","MPTCP","48508","49142  >  5201 [PSH, ACK] Seq=983798 Ack=1 Win=64256 Len=48416 TSval=2008818113 TSecr=1039944809","","","","",""
"564","14.126857929","10.10.3.102","10.10.3.105","MPTCP","80","5201  >  49142 [ACK] Seq=1 Ack=1032214 Win=1510656 Len=0 TSval=1039944810 TSecr=2008818113","0.000024670","","","",""
"565","14.126951153","10.10.3.105","10.10.3.102","MPTCP","14332","49142  >  5201 [PSH, ACK] Seq=1032214 Ack=1 Win=64256 Len=14240 TSval=2008818113 TSecr=1039944809","","","","",""
"566","14.126964663","10.10.3.102","10.10.3.105","MPTCP","80","5201  >  49142 [ACK] Seq=1 Ack=1046454 Win=1539200 Len=0 TSval=1039944810 TSecr=2008818113","0.000013510","","","",""
"567","14.127309790","10.10.3.105","10.10.3.102","MPTCP","41388","49142  >  5201 [PSH, ACK] Seq=1046454 Ack=1 Win=64256 Len=41296 TSval=2008818113 TSecr=1039944809","","","","",""
"568","14.127331252","10.10.3.102","10.10.3.105","MPTCP","80","5201  >  49142 [ACK] Seq=1 Ack=1087750 Win=1621760 Len=0 TSval=1039944811 TSecr=2008818113","0.000021462","","","",""
"569","14.127507888","10.10.3.105","10.10.3.102","MPTCP","21452","49142  >  5201 [PSH, ACK] Seq=1087750 Ack=1 Win=64256 Len=21360 TSval=2008818114 TSecr=1039944810","","","","",""
"570","14.127523736","10.10.3.102","10.10.3.105","MPTCP","80","5201  >  49142 [ACK] Seq=1 Ack=1109110 Win=1664512 Len=0 TSval=1039944811 TSecr=2008818114","0.000015848","","","",""
"571","14.127743093","10.10.3.105","10.10.3.59","MPTCP","1516","46369  >  5201 [ACK] Seq=2513 Ack=1 Win=64256 Len=1424 TSval=938073443 TSecr=1400053180","","","","",""
"572","14.127770925","10.10.3.59","10.10.3.105","MPTCP","80","5201  >  46369 [ACK] Seq=1 Ack=3937 Win=1664512 Len=0 TSval=1400053189 TSecr=938073443","0.000027832","","","",""
"573","14.127925664","10.10.3.105","10.10.3.102","MPTCP","49932","49142  >  5201 [PSH, ACK] Seq=1109110 Ack=1 Win=64256 Len=49840 TSval=2008818114 TSecr=1039944810","","","","",""
"574","14.127949081","10.10.3.102","10.10.3.105","MPTCP","80","5201  >  49142 [ACK] Seq=1 Ack=1158950 Win=1764224 Len=0 TSval=1039944811 TSecr=2008818114","0.000023417","","","",""
"575","14.128041318","10.10.3.105","10.10.3.102","MPTCP","12908","49142  >  5201 [PSH, ACK] Seq=1158950 Ack=1 Win=64256 Len=12816 TSval=2008818114 TSecr=1039944810","","","","",""
"576","14.128054447","10.10.3.102","10.10.3.105","MPTCP","80","5201  >  49142 [ACK] Seq=1 Ack=1171766 Win=1789824 Len=0 TSval=1039944811 TSecr=2008818114","0.000013129","","","",""
"577","14.128426295","10.10.3.105","10.10.3.102","MPTCP","45660","49142  >  5201 [PSH, ACK] Seq=1171766 Ack=1 Win=64256 Len=45568 TSval=2008818114 TSecr=1039944811","","","","",""
"578","14.128449033","10.10.3.102","10.10.3.105","MPTCP","80","5201  >  49142 [ACK] Seq=1 Ack=1217334 Win=1880960 Len=0 TSval=1039944812 TSecr=2008818114","0.000022738","","","",""
"579","14.128572277","10.10.3.105","10.10.3.102","MPTCP","17180","49142  >  5201 [PSH, ACK] Seq=1217334 Ack=1 Win=64256 Len=17088 TSval=2008818115 TSecr=1039944811","","","","",""
"580","14.128586666","10.10.3.102","10.10.3.105","MPTCP","80","5201  >  49142 [ACK] Seq=1 Ack=1234422 Win=1915136 Len=0 TSval=1039944812 TSecr=2008818115","0.000014389","","","",""
"581","14.128648394","10.10.3.105","10.10.3.102","MPTCP","6860","49142  >  5201 [PSH, ACK] Seq=1234422 Ack=1 Win=64256 Len=6768 TSval=2008818115 TSecr=1039944811","","","","",""
"582","14.128660482","10.10.3.102","10.10.3.105","MPTCP","80","5201  >  49142 [ACK] Seq=1 Ack=1241190 Win=1928704 Len=0 TSval=1039944812 TSecr=2008818115","0.000012088","","","",""
"583","14.129084688","10.10.3.105","10.10.3.102","MPTCP","51356","49142  >  5201 [PSH, ACK] Seq=1241190 Ack=1 Win=64256 Len=51264 TSval=2008818115 TSecr=1039944811","","","","",""
"584","14.129107824","10.10.3.102","10.10.3.105","MPTCP","80","5201  >  49142 [ACK] Seq=1 Ack=1292454 Win=2031232 Len=0 TSval=1039944812 TSecr=2008818115","0.000023136","","","",""
"585","14.129178717","10.10.3.105","10.10.3.102","MPTCP","11484","49142  >  5201 [PSH, ACK] Seq=1292454 Ack=1 Win=64256 Len=11392 TSval=2008818115 TSecr=1039944811","","","","",""
"586","14.129191761","10.10.3.102","10.10.3.105","MPTCP","80","5201  >  49142 [ACK] Seq=1 Ack=1303846 Win=2054016 Len=0 TSval=1039944812 TSecr=2008818115","0.000013044","","","",""
"587","14.129358867","10.10.3.105","10.10.3.102","MPTCP","21452","49142  >  5201 [ACK] Seq=1303846 Ack=1 Win=64256 Len=21360 TSval=2008818116 TSecr=1039944812","","","","",""
"588","14.129378310","10.10.3.102","10.10.3.105","MPTCP","80","5201  >  49142 [ACK] Seq=1 Ack=1325206 Win=2096640 Len=0 TSval=1039944813 TSecr=2008818116","0.000019443","","","",""
"589","14.129611186","10.10.3.105","10.10.3.102","MPTCP","28572","49142  >  5201 [PSH, ACK] Seq=1325206 Ack=1 Win=64256 Len=28480 TSval=2008818116 TSecr=1039944812","","","","",""
"590","14.129628886","10.10.3.102","10.10.3.105","MPTCP","80","5201  >  49142 [ACK] Seq=1 Ack=1353686 Win=2153600 Len=0 TSval=1039944813 TSecr=2008818116","0.000017700","","","",""
"591","14.129743952","10.10.3.105","10.10.3.102","MPTCP","12908","49142  >  5201 [PSH, ACK] Seq=1353686 Ack=1 Win=64256 Len=12816 TSval=2008818116 TSecr=1039944812","","","","",""
"592","14.129756136","10.10.3.102","10.10.3.105","MPTCP","80","5201  >  49142 [ACK] Seq=1 Ack=1366502 Win=2179328 Len=0 TSval=1039944813 TSecr=2008818116","0.000012184","","","",""
"593","14.130295409","10.10.3.105","10.10.3.102","MPTCP","62748","49142  >  5201 [PSH, ACK] Seq=1366502 Ack=1 Win=64256 Len=62656 TSval=2008818116 TSecr=1039944812","","","","",""
"594","14.130321918","10.10.3.102","10.10.3.105","MPTCP","80","5201  >  49142 [ACK] Seq=1 Ack=1429158 Win=2304640 Len=0 TSval=1039944813 TSecr=2008818116","0.000026509","","","",""
"595","14.130842702","10.10.3.105","10.10.3.102","MPTCP","62748","49142  >  5201 [PSH, ACK] Seq=1429158 Ack=1 Win=64256 Len=62656 TSval=2008818117 TSecr=1039944813","","","","",""
"596","14.130870308","10.10.3.102","10.10.3.105","MPTCP","80","5201  >  49142 [ACK] Seq=1 Ack=1491814 Win=2429952 Len=0 TSval=1039944814 TSecr=2008818117","0.000027606","","","",""
"597","14.131381569","10.10.3.105","10.10.3.102","MPTCP","62748","49142  >  5201 [PSH, ACK] Seq=1491814 Ack=1 Win=64256 Len=62656 TSval=2008818117 TSecr=1039944813","","","","",""
"598","14.131411105","10.10.3.102","10.10.3.105","MPTCP","80","5201  >  49142 [ACK] Seq=1 Ack=1554470 Win=2555264 Len=0 TSval=1039944815 TSecr=2008818117","0.000029536","","","",""
"599","14.131904035","10.10.3.105","10.10.3.102","MPTCP","62748","49142  >  5201 [PSH, ACK] Seq=1554470 Ack=1 Win=64256 Len=62656 TSval=2008818118 TSecr=1039944814","","","","",""
"600","14.131930984","10.10.3.102","10.10.3.105","MPTCP","80","5201  >  49142 [ACK] Seq=1 Ack=1617126 Win=2680576 Len=0 TSval=1039944815 TSecr=2008818118","0.000026949","","","",""
"601","14.132442228","10.10.3.105","10.10.3.102","MPTCP","62748","49142  >  5201 [PSH, ACK] Seq=1617126 Ack=1 Win=64256 Len=62656 TSval=2008818118 TSecr=1039944815","","","","",""
"602","14.132469057","10.10.3.102","10.10.3.105","MPTCP","80","5201  >  49142 [ACK] Seq=1 Ack=1679782 Win=2805888 Len=0 TSval=1039944816 TSecr=2008818118","0.000026829","","","",""
"603","14.132984698","10.10.3.105","10.10.3.102","MPTCP","62748","49142  >  5201 [PSH, ACK] Seq=1679782 Ack=1 Win=64256 Len=62656 TSval=2008818119 TSecr=1039944815","","","","",""
"604","14.133011983","10.10.3.102","10.10.3.105","MPTCP","80","5201  >  49142 [ACK] Seq=1 Ack=1742438 Win=2805888 Len=0 TSval=1039944816 TSecr=2008818119","0.000027285","","","",""
"605","14.133269877","10.10.3.105","10.10.3.102","MPTCP","31420","49142  >  5201 [PSH, ACK] Seq=1742438 Ack=1 Win=64256 Len=31328 TSval=2008818119 TSecr=1039944815","","","","",""
"606","14.133289872","10.10.3.102","10.10.3.105","MPTCP","80","5201  >  49142 [ACK] Seq=1 Ack=1773766 Win=2805888 Len=0 TSval=1039944816 TSecr=2008818119","0.000019995","","","",""
"607","14.133343316","10.10.3.105","10.10.3.102","MPTCP","10060","49142  >  5201 [ACK] Seq=1773766 Ack=1 Win=64256 Len=9968 TSval=2008818120 TSecr=1039944816","","","","",""
"608","14.133356641","10.10.3.102","10.10.3.105","MPTCP","80","5201  >  49142 [ACK] Seq=1 Ack=1783734 Win=2805888 Len=0 TSval=1039944817 TSecr=2008818120","0.000013325","","","",""
"609","14.133531508","10.10.3.105","10.10.3.102","MPTCP","21452","49142  >  5201 [PSH, ACK] Seq=1783734 Ack=1 Win=64256 Len=21360 TSval=2008818120 TSecr=1039944816","","","","",""
"610","14.133549578","10.10.3.102","10.10.3.105","MPTCP","80","5201  >  49142 [ACK] Seq=1 Ack=1805094 Win=2805888 Len=0 TSval=1039944817 TSecr=2008818120","0.000018070","","","",""
"611","14.134088223","10.10.3.105","10.10.3.102","MPTCP","62748","49142  >  5201 [PSH, ACK] Seq=1805094 Ack=1 Win=64256 Len=62656 TSval=2008818120 TSecr=1039944816","","","","",""
"612","14.134115318","10.10.3.102","10.10.3.105","MPTCP","80","5201  >  49142 [ACK] Seq=1 Ack=1867750 Win=2805888 Len=0 TSval=1039944817 TSecr=2008818120","0.000027095","","","",""
"613","14.134607990","10.10.3.105","10.10.3.102","MPTCP","62748","49142  >  5201 [PSH, ACK] Seq=1867750 Ack=1 Win=64256 Len=62656 TSval=2008818120 TSecr=1039944816","","","","",""
"614","14.134635288","10.10.3.102","10.10.3.105","MPTCP","80","5201  >  49142 [ACK] Seq=1 Ack=1930406 Win=2805888 Len=0 TSval=1039944818 TSecr=2008818120","0.000027298","","","",""
"615","14.135149894","10.10.3.105","10.10.3.102","MPTCP","62748","49142  >  5201 [PSH, ACK] Seq=1930406 Ack=1 Win=64256 Len=62656 TSval=2008818121 TSecr=1039944817","","","","",""
"616","14.135177057","10.10.3.102","10.10.3.105","MPTCP","80","5201  >  49142 [ACK] Seq=1 Ack=1993062 Win=2805888 Len=0 TSval=1039944818 TSecr=2008818121","0.000027163","","","",""
"617","14.135692432","10.10.3.105","10.10.3.102","MPTCP","62748","49142  >  5201 [PSH, ACK] Seq=1993062 Ack=1 Win=64256 Len=62656 TSval=2008818122 TSecr=1039944818","","","","",""
"618","14.135722088","10.10.3.102","10.10.3.105","MPTCP","80","5201  >  49142 [ACK] Seq=1 Ack=2055718 Win=2805888 Len=0 TSval=1039944819 TSecr=2008818122","0.000029656","","","",""
"619","14.135761255","10.10.3.105","10.10.3.102","MPTCP","6204","49142  >  5201 [PSH, ACK] Seq=2055718 Ack=1 Win=64256 Len=6112 TSval=2008818122 TSecr=1039944818","","","","",""
"620","14.135773360","10.10.3.102","10.10.3.105","MPTCP","80","5201  >  49142 [ACK] Seq=1 Ack=2061830 Win=2805888 Len=0 TSval=1039944819 TSecr=2008818122","0.000012105","","","",""
"621","14.140237150","10.10.3.105","10.10.3.59","MPTCP","1516","46369  >  5201 [ACK] Seq=3937 Ack=1 Win=64256 Len=1424 TSval=938073443 TSecr=1400053180","","","","",""
"622","14.140269200","10.10.3.59","10.10.3.105","MPTCP","80","5201  >  46369 [ACK] Seq=1 Ack=5361 Win=2804352 Len=0 TSval=1400053201 TSecr=938073443","0.000032050","","","",""
"623","14.152024739","10.10.3.105","10.10.3.59","MPTCP","1516","46369  >  5201 [ACK] Seq=5361 Ack=1 Win=64256 Len=1424 TSval=938073443 TSecr=1400053180","","","","",""
"624","14.152072038","10.10.3.59","10.10.3.105","MPTCP","80","5201  >  46369 [ACK] Seq=1 Ack=6785 Win=2803072 Len=0 TSval=1400053213 TSecr=938073443","0.000047299","","","",""
"626","14.163748971","10.10.3.105","10.10.3.59","MPTCP","1516","46369  >  5201 [ACK] Seq=6785 Ack=1 Win=64256 Len=1424 TSval=938073443 TSecr=1400053180","","","","",""
"627","14.163796801","10.10.3.59","10.10.3.105","MPTCP","80","5201  >  46369 [ACK] Seq=1 Ack=8209 Win=2801664 Len=0 TSval=1400053225 TSecr=938073443","0.000047830","","","",""
"640","14.186167426","10.10.3.105","10.10.3.59","MPTCP","1516","46369  >  5201 [PSH, ACK] Seq=8209 Ack=1 Win=64256 Len=1424 TSval=938073443 TSecr=1400053180","","","","",""
"641","14.186214297","10.10.3.59","10.10.3.105","MPTCP","80","5201  >  46369 [ACK] Seq=1 Ack=9633 Win=2800256 Len=0 TSval=1400053247 TSecr=938073443","0.000046871","","","",""
"643","14.191938450","10.10.3.105","10.10.3.59","MPTCP","1516","46369  >  5201 [ACK] Seq=9633 Ack=1 Win=64256 Len=1424 TSval=938073443 TSecr=1400053180","","","","",""
"644","14.191985384","10.10.3.59","10.10.3.105","MPTCP","80","5201  >  46369 [ACK] Seq=1 Ack=11057 Win=2798848 Len=0 TSval=1400053253 TSecr=938073443","0.000046934","","","",""
"645","14.198866244","10.10.3.105","10.10.3.59","MPTCP","1516","46369  >  5201 [ACK] Seq=11057 Ack=1 Win=64256 Len=1424 TSval=938073443 TSecr=1400053180","","","","",""
"646","14.198913596","10.10.3.59","10.10.3.105","MPTCP","80","5201  >  46369 [ACK] Seq=1 Ack=12481 Win=2797440 Len=0 TSval=1400053260 TSecr=938073443","0.000047352","","","",""
"647","14.211405445","10.10.3.105","10.10.3.59","MPTCP","1516","46369  >  5201 [ACK] Seq=12481 Ack=1 Win=64256 Len=1424 TSval=938073443 TSecr=1400053180","","","","",""
"648","14.211458174","10.10.3.59","10.10.3.105","MPTCP","80","5201  >  46369 [ACK] Seq=1 Ack=13905 Win=2796032 Len=0 TSval=1400053273 TSecr=938073443","0.000052729","","","",""
"649","14.226398054","10.10.3.105","10.10.3.59","MPTCP","1516","46369  >  5201 [PSH, ACK] Seq=13905 Ack=1 Win=64256 Len=1424 TSval=938073443 TSecr=1400053180","","","","",""
"650","14.226450229","10.10.3.59","10.10.3.105","MPTCP","80","5201  >  46369 [ACK] Seq=1 Ack=15329 Win=2794624 Len=0 TSval=1400053288 TSecr=938073443","0.000052175","","","",""
"651","14.235419686","10.10.3.105","10.10.3.59","MPTCP","1516","46369  >  5201 [ACK] Seq=15329 Ack=1 Win=64256 Len=1424 TSval=938073445 TSecr=1400053180","","","","",""
"652","14.235466360","10.10.3.59","10.10.3.105","MPTCP","80","5201  >  46369 [ACK] Seq=1 Ack=16753 Win=2793216 Len=0 TSval=1400053297 TSecr=938073445","0.000046674","","","",""
"653","14.247342025","10.10.3.105","10.10.3.59","MPTCP","1516","46369  >  5201 [PSH, ACK] Seq=16753 Ack=1 Win=64256 Len=1424 TSval=938073445 TSecr=1400053180","","","","",""
"654","14.247392599","10.10.3.59","10.10.3.105","MPTCP","80","5201  >  46369 [ACK] Seq=1 Ack=18177 Win=2791808 Len=0 TSval=1400053309 TSecr=938073445","0.000050574","","","",""
"655","14.259038973","10.10.3.105","10.10.3.59","MPTCP","1516","46369  >  5201 [ACK] Seq=18177 Ack=1 Win=64256 Len=1424 TSval=938073448 TSecr=1400053189","","","","",""
"656","14.259090529","10.10.3.59","10.10.3.105","MPTCP","80","5201  >  46369 [ACK] Seq=1 Ack=19601 Win=2790400 Len=0 TSval=1400053320 TSecr=938073448","0.000051556","","","",""
"657","14.272138733","10.10.3.62","10.10.3.102","MPTCP","92","43467  >  5201 [ACK] Seq=1 Ack=1 Win=64256 Len=0 TSval=3345985303 TSecr=2492763040","0.196580193","","","",""
"658","14.272239525","10.10.3.102","10.10.3.62","MPTCP","80","[TCP Window Update] 5201  >  43467 [ACK] Seq=1 Ack=1 Win=65280 Len=0 TSval=2492763236 TSecr=3345985303","","","","","â\234\223"
"659","14.272139335","10.10.3.62","10.10.3.102","MPTCP","92","[TCP Dup ACK 657#1] 43467  >  5201 [ACK] Seq=1 Ack=1 Win=64256 Len=0 TSval=3345985382 TSecr=2492763040","","","â\234\223","","â\234\223"
"660","14.272261567","10.10.3.102","10.10.3.62","MPTCP","80","[TCP Dup ACK 404#1] 5201  >  43467 [ACK] Seq=1 Ack=1 Win=65280 Len=0 TSval=2492763236 TSecr=3345985382","","","â\234\223","","â\234\223"
"661","14.272299286","10.10.3.62","10.10.3.102","MPTCP","92","37459  >  5201 [ACK] Seq=1 Ack=1 Win=64256 Len=0 TSval=3345985461 TSecr=2492763062","0.173974062","","","",""
"662","14.272352488","10.10.3.102","10.10.3.62","MPTCP","80","[TCP Window Update] 5201  >  37459 [ACK] Seq=1 Ack=1 Win=2790400 Len=0 TSval=2492763237 TSecr=3345985461","","","","","â\234\223"
"663","14.272742787","10.10.3.105","10.10.3.59","MPTCP","1516","46369  >  5201 [PSH, ACK] Seq=19601 Ack=1 Win=64256 Len=1424 TSval=938073448 TSecr=1400053189","","","","",""
"664","14.272774418","10.10.3.59","10.10.3.105","MPTCP","80","5201  >  46369 [ACK] Seq=1 Ack=21025 Win=2788992 Len=0 TSval=1400053334 TSecr=938073448","0.000031631","","","",""
"665","14.273260311","10.10.3.62","10.10.3.102","MPTCP","92","[TCP Dup ACK 657#2] 43467  >  5201 [ACK] Seq=1 Ack=1 Win=64256 Len=0 TSval=3345985462 TSecr=2492763040","","","â\234\223","","â\234\223"
"666","14.273282397","10.10.3.102","10.10.3.62","MPTCP","80","[TCP Dup ACK 404#2] 5201  >  43467 [ACK] Seq=1 Ack=1 Win=65280 Len=0 TSval=2492763237 TSecr=3345985462","","","â\234\223","","â\234\223"
"676","14.285276685","10.10.3.105","10.10.3.59","MPTCP","1516","46369  >  5201 [ACK] Seq=21025 Ack=1 Win=64256 Len=1424 TSval=938073460 TSecr=1400053201","","","","",""
"677","14.285308679","10.10.3.59","10.10.3.105","MPTCP","80","5201  >  46369 [ACK] Seq=1 Ack=22449 Win=2787584 Len=0 TSval=1400053346 TSecr=938073460","0.000031994","","","",""
"678","14.294163547","10.10.3.105","10.10.3.59","MPTCP","1516","46369  >  5201 [PSH, ACK] Seq=22449 Ack=1 Win=64256 Len=1424 TSval=938073460 TSecr=1400053201","","","","",""
"679","14.294210494","10.10.3.59","10.10.3.105","MPTCP","80","5201  >  46369 [ACK] Seq=1 Ack=23873 Win=2786176 Len=0 TSval=1400053355 TSecr=938073460","0.000046947","","","",""
"680","14.305634495","10.10.3.105","10.10.3.59","MPTCP","1516","46369  >  5201 [ACK] Seq=23873 Ack=1 Win=64256 Len=1424 TSval=938073473 TSecr=1400053213","","","","",""
"681","14.305680579","10.10.3.59","10.10.3.105","MPTCP","80","5201  >  46369 [ACK] Seq=1 Ack=25297 Win=2784768 Len=0 TSval=1400053367 TSecr=938073473","0.000046084","","","",""
"682","14.317637725","10.10.3.105","10.10.3.59","MPTCP","1516","46369  >  5201 [PSH, ACK] Seq=25297 Ack=1 Win=64256 Len=1424 TSval=938073473 TSecr=1400053213","","","","",""
"683","14.317683919","10.10.3.59","10.10.3.105","MPTCP","80","5201  >  46369 [ACK] Seq=1 Ack=26721 Win=2783360 Len=0 TSval=1400053379 TSecr=938073473","0.000046194","","","",""
"684","14.329597625","10.10.3.105","10.10.3.59","MPTCP","1516","46369  >  5201 [ACK] Seq=26721 Ack=1 Win=64256 Len=1424 TSval=938073486 TSecr=1400053225","","","","",""
"685","14.329644334","10.10.3.59","10.10.3.105","MPTCP","80","5201  >  46369 [ACK] Seq=1 Ack=28145 Win=2781952 Len=0 TSval=1400053391 TSecr=938073486","0.000046709","","","",""
"686","14.344967111","10.10.3.105","10.10.3.59","MPTCP","1516","46369  >  5201 [PSH, ACK] Seq=28145 Ack=1 Win=64256 Len=1424 TSval=938073486 TSecr=1400053225","","","","",""
"687","14.345014248","10.10.3.59","10.10.3.105","MPTCP","80","5201  >  46369 [ACK] Seq=1 Ack=29569 Win=2780544 Len=0 TSval=1400053406 TSecr=938073486","0.000047137","","","",""
"688","14.353274409","10.10.3.105","10.10.3.59","MPTCP","1516","46369  >  5201 [ACK] Seq=29569 Ack=1 Win=64256 Len=1424 TSval=938073508 TSecr=1400053247","","","","",""
"689","14.353324521","10.10.3.59","10.10.3.105","MPTCP","80","5201  >  46369 [ACK] Seq=1 Ack=30993 Win=2779136 Len=0 TSval=1400053414 TSecr=938073508","0.000050112","","","",""
