"No.","Time","Source","Destination","Protocol","Length","Info","RTT","Lost Segement","Duplicate ","Retransmission","IDK"
"3694","106.144114250","10.10.3.105","10.10.3.102","MPTCP","80","38840  >  5201 [SYN] Seq=0 Win=64240 Len=0 MSS=1460 SACK_PERM=1 TSval=2008763539 TSecr=0 WS=128","","","","",""
"3695","106.144170375","10.10.3.102","10.10.3.105","MPTCP","88","5201  >  38840 [SYN, ACK] Seq=0 Ack=1 Win=65160 Len=0 MSS=1460 SACK_PERM=1 TSval=1039890235 TSecr=2008763539 WS=128","0.000056125","","","",""
"3696","106.144719410","10.10.3.105","10.10.3.102","MPTCP","88","38840  >  5201 [ACK] Seq=1 Ack=1 Win=64256 Len=0 TSval=2008763539 TSecr=1039890235","0.000549035","","","",""
"3697","106.144720012","10.10.3.105","10.10.3.102","MPTCP","129","38840  >  5201 [PSH, ACK] Seq=1 Ack=1 Win=64256 Len=37 TSval=2008763540 TSecr=1039890235","","","","",""
"3698","106.144860342","10.10.3.102","10.10.3.105","MPTCP","80","5201  >  38840 [ACK] Seq=1 Ack=38 Win=65152 Len=0 TSval=1039890236 TSecr=2008763540","0.000140330","","","",""
"3699","106.144982338","10.10.3.102","10.10.3.105","MPTCP","97","5201  >  38840 [PSH, ACK] Seq=1 Ack=38 Win=65152 Len=1 TSval=1039890236 TSecr=2008763540","","","","",""
"3700","106.145064102","10.10.3.102","10.10.3.105","MPTCP","84","[TCP Dup ACK 3698#1] 5201  >  38840 [ACK] Seq=2 Ack=38 Win=65152 Len=0 TSval=1039890236 TSecr=2008763540","","","â\234\223","","â\234\223"
"3701","106.145076591","10.10.3.105","10.10.3.102","MPTCP","80","38840  >  5201 [ACK] Seq=38 Ack=2 Win=64256 Len=0 TSval=2008763540 TSecr=1039890236","0.000094253","","","",""
"3702","106.145177235","10.10.3.105","10.10.3.102","MPTCP","76","[TCP Dup ACK 3701#1] 38840  >  5201 [ACK] Seq=38 Ack=2 Win=64256 Len=0 TSval=2008763540 TSecr=1039890236","","","â\234\223","","â\234\223"
"3703","106.145280321","10.10.3.105","10.10.3.102","MPTCP","100","38840  >  5201 [PSH, ACK] Seq=38 Ack=2 Win=64256 Len=4 TSval=2008763540 TSecr=1039890236","","","","",""
"3704","106.185815678","10.10.3.102","10.10.3.105","MPTCP","80","5201  >  38840 [ACK] Seq=2 Ack=42 Win=65152 Len=0 TSval=1039890277 TSecr=2008763540","0.040535357","","","",""
"3705","106.186077272","10.10.3.105","10.10.3.102","MPTCP","196","38840  >  5201 [PSH, ACK] Seq=42 Ack=2 Win=64256 Len=100 TSval=2008763581 TSecr=1039890277","","","","",""
"3706","106.186137165","10.10.3.102","10.10.3.105","MPTCP","80","5201  >  38840 [ACK] Seq=2 Ack=142 Win=65152 Len=0 TSval=1039890277 TSecr=2008763581","0.000059893","","","",""
"3707","106.186270597","10.10.3.102","10.10.3.105","MPTCP","97","5201  >  38840 [PSH, ACK] Seq=2 Ack=142 Win=65152 Len=1 TSval=1039890277 TSecr=2008763581","","","","",""
"3708","106.186497045","10.10.3.105","10.10.3.102","MPTCP","80","38842  >  5201 [SYN] Seq=0 Win=64240 Len=0 MSS=1460 SACK_PERM=1 TSval=2008763581 TSecr=0 WS=128","","","","",""
"3709","106.186546852","10.10.3.102","10.10.3.105","MPTCP","88","5201  >  38842 [SYN, ACK] Seq=0 Ack=1 Win=65160 Len=0 MSS=1460 SACK_PERM=1 TSval=1039890277 TSecr=2008763581 WS=128","0.000049807","","","",""
"3710","106.186651403","10.10.3.105","10.10.3.102","MPTCP","88","38842  >  5201 [ACK] Seq=1 Ack=1 Win=64256 Len=0 TSval=2008763582 TSecr=1039890277","0.000104551","","","",""
"3711","106.186651778","10.10.3.105","10.10.3.102","MPTCP","129","38842  >  5201 [PSH, ACK] Seq=1 Ack=1 Win=64256 Len=37 TSval=2008763582 TSecr=1039890277","","","","",""
"3712","106.186763434","10.10.3.102","10.10.3.105","MPTCP","80","5201  >  38842 [ACK] Seq=1 Ack=38 Win=65152 Len=0 TSval=1039890278 TSecr=2008763582","0.000111656","","","",""
"3714","106.186981966","10.10.3.102","10.10.3.105","MPTCP","84","5201  >  38842 [ACK] Seq=1 Ack=38 Win=65152 Len=0 TSval=1039890278 TSecr=2008763582","","","","",""
"3715","106.187078810","10.10.3.105","10.10.3.102","MPTCP","76","38842  >  5201 [ACK] Seq=38 Ack=1 Win=64256 Len=0 TSval=2008763582 TSecr=1039890278","","","","",""
"3716","106.189169089","10.10.3.62","10.10.3.102","MPTCP","88","38527  >  5201 [SYN] Seq=0 Win=64256 Len=0 MSS=1460 SACK_PERM=1 TSval=3345930745 TSecr=0 WS=128","","","","",""
"3717","106.189225181","10.10.3.102","10.10.3.62","MPTCP","92","5201  >  38527 [SYN, ACK] Seq=0 Ack=1 Win=65160 Len=0 MSS=1460 SACK_PERM=1 TSval=2492708561 TSecr=3345930745 WS=128","0.000056092","","","",""
"3718","106.189321210","10.10.3.62","10.10.3.102","MPTCP","88","52483  >  5201 [SYN] Seq=0 Win=64256 Len=0 MSS=1460 SACK_PERM=1 TSval=3345930787 TSecr=0 WS=128","","","","",""
"3719","106.189348603","10.10.3.102","10.10.3.62","MPTCP","92","5201  >  52483 [SYN, ACK] Seq=0 Ack=1 Win=65160 Len=0 MSS=1460 SACK_PERM=1 TSval=2492708561 TSecr=3345930787 WS=128","0.000027393","","","",""
"3721","106.190424255","10.10.3.105","10.10.3.59","MPTCP","88","44427  >  5201 [SYN] Seq=0 Win=64256 Len=0 MSS=1460 SACK_PERM=1 TSval=938018872 TSecr=0 WS=128","","","","",""
"3722","106.190494780","10.10.3.59","10.10.3.105","MPTCP","92","5201  >  44427 [SYN, ACK] Seq=0 Ack=1 Win=65160 Len=0 MSS=1460 SACK_PERM=1 TSval=1399998659 TSecr=938018872 WS=128","0.000070525","","","",""
"3723","106.195775555","10.10.3.105","10.10.3.59","MPTCP","88","59721  >  5201 [SYN] Seq=0 Win=64256 Len=0 MSS=1460 SACK_PERM=1 TSval=938018914 TSecr=0 WS=128","","","","",""
"3724","106.195843048","10.10.3.59","10.10.3.105","MPTCP","92","5201  >  59721 [SYN, ACK] Seq=0 Ack=1 Win=65160 Len=0 MSS=1460 SACK_PERM=1 TSval=1399998665 TSecr=938018914 WS=128","0.000067493","","","",""
"3725","106.200060610","10.10.3.105","10.10.3.59","MPTCP","92","44427  >  5201 [ACK] Seq=1 Ack=1 Win=64256 Len=0 TSval=938018921 TSecr=1399998659","0.009565830","","","",""
"3726","106.200192017","10.10.3.59","10.10.3.105","MPTCP","80","[TCP Window Update] 5201  >  44427 [ACK] Seq=1 Ack=1 Win=65280 Len=0 TSval=1399998669 TSecr=938018921","","","","","â\234\223"
"3727","106.201778994","10.10.3.105","10.10.3.59","MPTCP","92","59721  >  5201 [ACK] Seq=1 Ack=1 Win=64256 Len=0 TSval=938018923 TSecr=1399998665","0.005935946","","","",""
"3728","106.201881325","10.10.3.59","10.10.3.105","MPTCP","80","[TCP Window Update] 5201  >  59721 [ACK] Seq=1 Ack=1 Win=65280 Len=0 TSval=1399998671 TSecr=938018923","","","","","â\234\223"
"3729","106.223940802","10.10.3.105","10.10.3.59","MPTCP","92","[TCP Dup ACK 3727#1] 59721  >  5201 [ACK] Seq=1 Ack=1 Win=64256 Len=0 TSval=938018945 TSecr=1399998665","","","â\234\223","","â\234\223"
"3730","106.223972148","10.10.3.59","10.10.3.105","MPTCP","80","[TCP Dup ACK 3724#1] 5201  >  59721 [ACK] Seq=1 Ack=1 Win=65280 Len=0 TSval=1399998693 TSecr=938018945","","","â\234\223","","â\234\223"
"3731","106.233603050","10.10.3.105","10.10.3.102","MPTCP","80","38840  >  5201 [ACK] Seq=142 Ack=3 Win=64256 Len=0 TSval=2008763629 TSecr=1039890277","0.047332453","","","",""
"3732","106.233652796","10.10.3.102","10.10.3.105","MPTCP","98","5201  >  38840 [PSH, ACK] Seq=3 Ack=142 Win=65280 Len=2 TSval=1039890325 TSecr=2008763629","","","","",""
"3733","106.233757468","10.10.3.105","10.10.3.102","MPTCP","80","38840  >  5201 [ACK] Seq=142 Ack=5 Win=64256 Len=0 TSval=2008763629 TSecr=1039890325","0.000104672","","","",""
"3734","106.233852270","10.10.3.105","10.10.3.102","MPTCP","1516","38842  >  5201 [ACK] Seq=38 Ack=1 Win=64256 Len=1424 TSval=2008763629 TSecr=1039890278","","","","",""
"3735","106.233873964","10.10.3.102","10.10.3.105","MPTCP","80","5201  >  38842 [ACK] Seq=1 Ack=1462 Win=64128 Len=0 TSval=1039890325 TSecr=2008763629","0.000021694","","","",""
"3736","106.242973898","10.10.3.105","10.10.3.102","MPTCP","1516","38842  >  5201 [ACK] Seq=1462 Ack=1 Win=64256 Len=1424 TSval=2008763629 TSecr=1039890278","","","","",""
"3737","106.243027459","10.10.3.102","10.10.3.105","MPTCP","80","5201  >  38842 [ACK] Seq=1 Ack=2886 Win=64128 Len=0 TSval=1039890334 TSecr=2008763629","0.000053561","","","",""
"3738","106.254942212","10.10.3.105","10.10.3.102","MPTCP","1516","38842  >  5201 [ACK] Seq=2886 Ack=1 Win=64256 Len=1424 TSval=2008763629 TSecr=1039890278","","","","",""
"3739","106.254980180","10.10.3.102","10.10.3.105","MPTCP","80","5201  >  38842 [ACK] Seq=1 Ack=4310 Win=64128 Len=0 TSval=1039890346 TSecr=2008763629","0.000037968","","","",""
"3740","106.267069022","10.10.3.105","10.10.3.102","MPTCP","1516","38842  >  5201 [ACK] Seq=4310 Ack=1 Win=64256 Len=1424 TSval=2008763629 TSecr=1039890278","","","","",""
"3741","106.267109362","10.10.3.102","10.10.3.105","MPTCP","80","5201  >  38842 [ACK] Seq=1 Ack=5734 Win=64128 Len=0 TSval=1039890358 TSecr=2008763629","0.000040340","","","",""
"3742","106.279509412","10.10.3.105","10.10.3.102","MPTCP","1516","38842  >  5201 [PSH, ACK] Seq=5734 Ack=1 Win=64256 Len=1424 TSval=2008763629 TSecr=1039890278","","","","",""
"3743","106.279547341","10.10.3.102","10.10.3.105","MPTCP","80","5201  >  38842 [ACK] Seq=1 Ack=7158 Win=64128 Len=0 TSval=1039890370 TSecr=2008763629","0.000037929","","","",""
"3745","106.291460120","10.10.3.105","10.10.3.102","MPTCP","1516","38842  >  5201 [ACK] Seq=7158 Ack=1 Win=64256 Len=1424 TSval=2008763629 TSecr=1039890278","","","","",""
"3746","106.291491294","10.10.3.102","10.10.3.105","MPTCP","80","5201  >  38842 [ACK] Seq=1 Ack=8582 Win=64128 Len=0 TSval=1039890382 TSecr=2008763629","0.000031174","","","",""
"3747","106.305209826","10.10.3.105","10.10.3.102","MPTCP","1516","[TCP Previous segment not captured] 38842  >  5201 [ACK] Seq=14278 Ack=1 Win=64256 Len=1424 TSval=2008763674 TSecr=1039890358","","â\234\223","","","â\234\223"
"3748","106.305232843","10.10.3.102","10.10.3.105","MPTCP","92","[TCP Dup ACK 3746#1] 5201  >  38842 [ACK] Seq=1 Ack=8582 Win=64128 Len=0 TSval=1039890396 TSecr=2008763629 SLE=14278 SRE=15702","","","â\234\223","","â\234\223"
"3749","106.317894456","10.10.3.105","10.10.3.102","MPTCP","1516","38842  >  5201 [ACK] Seq=15702 Ack=1 Win=64256 Len=1424 TSval=2008763686 TSecr=1039890370","","","","",""
"3750","106.317925552","10.10.3.102","10.10.3.105","MPTCP","92","[TCP Dup ACK 3746#2] 5201  >  38842 [ACK] Seq=1 Ack=8582 Win=64128 Len=0 TSval=1039890409 TSecr=2008763629 SLE=14278 SRE=17126","","","â\234\223","","â\234\223"
"3751","106.319248379","10.10.3.105","10.10.3.59","MPTCP","92","[TCP Dup ACK 3727#2] 59721  >  5201 [ACK] Seq=1 Ack=1 Win=64256 Len=0 TSval=938018969 TSecr=1399998665","","","â\234\223","","â\234\223"
"3752","106.319274267","10.10.3.59","10.10.3.105","MPTCP","80","[TCP Dup ACK 3724#2] 5201  >  59721 [ACK] Seq=1 Ack=1 Win=65280 Len=0 TSval=1399998788 TSecr=938018969","","","â\234\223","","â\234\223"
"3753","106.319297026","10.10.3.105","10.10.3.59","MPTCP","92","[TCP Dup ACK 3727#3] 59721  >  5201 [ACK] Seq=1 Ack=1 Win=64256 Len=0 TSval=938018993 TSecr=1399998665","","","â\234\223","","â\234\223"
"3754","106.319301773","10.10.3.59","10.10.3.105","MPTCP","80","[TCP Dup ACK 3724#3] 5201  >  59721 [ACK] Seq=1 Ack=1 Win=65280 Len=0 TSval=1399998788 TSecr=938018993","","","â\234\223","","â\234\223"
"3755","106.319311131","10.10.3.105","10.10.3.59","MPTCP","92","[TCP Dup ACK 3727#4] 59721  >  5201 [ACK] Seq=1 Ack=1 Win=64256 Len=0 TSval=938019017 TSecr=1399998665","","","â\234\223","","â\234\223"
"3756","106.319315780","10.10.3.59","10.10.3.105","MPTCP","80","[TCP Dup ACK 3724#4] 5201  >  59721 [ACK] Seq=1 Ack=1 Win=65280 Len=0 TSval=1399998788 TSecr=938019017","","","â\234\223","","â\234\223"
"3757","106.329418591","10.10.3.105","10.10.3.59","MPTCP","92","[TCP Dup ACK 3725#1] 44427  >  5201 [ACK] Seq=1 Ack=1 Win=64256 Len=0 TSval=938019025 TSecr=1399998659","","","â\234\223","","â\234\223"
"3758","106.329449884","10.10.3.59","10.10.3.105","MPTCP","80","[TCP Dup ACK 3722#1] 5201  >  44427 [ACK] Seq=1 Ack=1 Win=65280 Len=0 TSval=1399998798 TSecr=938019025","","","â\234\223","","â\234\223"
"3759","106.330658386","10.10.3.105","10.10.3.102","MPTCP","1516","[TCP Fast Retransmission] 38842  >  5201 [ACK] Seq=8582 Ack=1 Win=64256 Len=1424 TSval=2008763700 TSecr=1039890396","","","","â\234\223","â\234\223"
"3760","106.330713016","10.10.3.102","10.10.3.105","MPTCP","92","5201  >  38842 [ACK] Seq=1 Ack=10006 Win=64128 Len=0 TSval=1039890422 TSecr=2008763700 SLE=14278 SRE=17126","0.000054630","","","",""
"3761","106.342794746","10.10.3.105","10.10.3.102","MPTCP","1516","[TCP Retransmission] 38842  >  5201 [ACK] Seq=10006 Ack=1 Win=64256 Len=1424 TSval=2008763700 TSecr=1039890396","","","","â\234\223","â\234\223"
"3762","106.342848950","10.10.3.102","10.10.3.105","MPTCP","92","5201  >  38842 [ACK] Seq=1 Ack=11430 Win=64128 Len=0 TSval=1039890434 TSecr=2008763700 SLE=14278 SRE=17126","0.000054204","","","",""
"3763","106.354886917","10.10.3.105","10.10.3.102","MPTCP","1516","[TCP Retransmission] 38842  >  5201 [ACK] Seq=11430 Ack=1 Win=64256 Len=1424 TSval=2008763700 TSecr=1039890396","","","","â\234\223","â\234\223"
"3764","106.354946039","10.10.3.102","10.10.3.105","MPTCP","92","5201  >  38842 [ACK] Seq=1 Ack=12854 Win=64128 Len=0 TSval=1039890446 TSecr=2008763700 SLE=14278 SRE=17126","0.000059122","","","",""
"3765","106.366988985","10.10.3.105","10.10.3.102","MPTCP","1516","[TCP Retransmission] 38842  >  5201 [PSH, ACK] Seq=12854 Ack=1 Win=64256 Len=1424 TSval=2008763700 TSecr=1039890396","","","","â\234\223","â\234\223"
"3766","106.367052029","10.10.3.102","10.10.3.105","MPTCP","80","5201  >  38842 [ACK] Seq=1 Ack=17126 Win=62464 Len=0 TSval=1039890458 TSecr=2008763700","0.049157573","","","",""
"3768","106.380567649","10.10.3.105","10.10.3.102","MPTCP","1516","38842  >  5201 [ACK] Seq=17126 Ack=1 Win=64256 Len=1424 TSval=2008763750 TSecr=1039890434","","","","",""
"3769","106.380625589","10.10.3.102","10.10.3.105","MPTCP","80","5201  >  38842 [ACK] Seq=1 Ack=18550 Win=64128 Len=0 TSval=1039890472 TSecr=2008763750","0.000057940","","","",""
"3770","106.383388686","10.10.3.105","10.10.3.59","MPTCP","92","[TCP Dup ACK 3727#5] 59721  >  5201 [ACK] Seq=1 Ack=1 Win=64256 Len=0 TSval=938019041 TSecr=1399998665","","","â\234\223","","â\234\223"
"3771","106.383424045","10.10.3.59","10.10.3.105","MPTCP","80","[TCP Dup ACK 3724#5] 5201  >  59721 [ACK] Seq=1 Ack=1 Win=65280 Len=0 TSval=1399998852 TSecr=938019041","","","â\234\223","","â\234\223"
"3772","106.388911410","10.10.3.105","10.10.3.59","MPTCP","92","[TCP Dup ACK 3727#6] 59721  >  5201 [ACK] Seq=1 Ack=1 Win=64256 Len=0 TSval=938019065 TSecr=1399998665","","","â\234\223","","â\234\223"
"3773","106.388951245","10.10.3.59","10.10.3.105","MPTCP","80","[TCP Dup ACK 3724#6] 5201  >  59721 [ACK] Seq=1 Ack=1 Win=65280 Len=0 TSval=1399998858 TSecr=938019065","","","â\234\223","","â\234\223"
"3774","106.392865155","10.10.3.105","10.10.3.102","MPTCP","1516","38842  >  5201 [ACK] Seq=18550 Ack=1 Win=64256 Len=1424 TSval=2008763750 TSecr=1039890434","","","","",""
"3775","106.392921230","10.10.3.102","10.10.3.105","MPTCP","80","5201  >  38842 [ACK] Seq=1 Ack=19974 Win=64128 Len=0 TSval=1039890484 TSecr=2008763750","0.000056075","","","",""
"3777","106.404974095","10.10.3.105","10.10.3.102","MPTCP","1516","38842  >  5201 [ACK] Seq=19974 Ack=1 Win=64256 Len=1424 TSval=2008763750 TSecr=1039890434","","","","",""
"3778","106.405029478","10.10.3.102","10.10.3.105","MPTCP","80","5201  >  38842 [ACK] Seq=1 Ack=21398 Win=64128 Len=0 TSval=1039890496 TSecr=2008763750","0.000055383","","","",""
"3779","106.416906427","10.10.3.105","10.10.3.102","MPTCP","1516","38842  >  5201 [PSH, ACK] Seq=21398 Ack=1 Win=64256 Len=1424 TSval=2008763750 TSecr=1039890434","","","","",""
"3780","106.417007544","10.10.3.102","10.10.3.105","MPTCP","80","5201  >  38842 [ACK] Seq=1 Ack=22822 Win=64128 Len=0 TSval=1039890508 TSecr=2008763750","0.000101117","","","",""
"3781","106.429855169","10.10.3.105","10.10.3.59","MPTCP","92","[TCP Dup ACK 3727#7] 59721  >  5201 [ACK] Seq=1 Ack=1 Win=64256 Len=0 TSval=938019089 TSecr=1399998665","","","â\234\223","","â\234\223"
"3782","106.429887730","10.10.3.59","10.10.3.105","MPTCP","80","[TCP Dup ACK 3724#7] 5201  >  59721 [ACK] Seq=1 Ack=1 Win=65280 Len=0 TSval=1399998899 TSecr=938019089","","","â\234\223","","â\234\223"
"3783","106.430188468","10.10.3.105","10.10.3.102","MPTCP","1516","38842  >  5201 [ACK] Seq=22822 Ack=1 Win=64256 Len=1424 TSval=2008763776 TSecr=1039890472","","","","",""
"3784","106.442429830","10.10.3.105","10.10.3.102","MPTCP","1516","38842  >  5201 [PSH, ACK] Seq=24246 Ack=1 Win=64256 Len=1424 TSval=2008763776 TSecr=1039890472","","","","",""
"3785","106.442503010","10.10.3.102","10.10.3.105","MPTCP","80","5201  >  38842 [ACK] Seq=1 Ack=25670 Win=64128 Len=0 TSval=1039890533 TSecr=2008763776","0.000073180","","","",""
"3786","106.456928496","10.10.3.105","10.10.3.102","MPTCP","1516","38842  >  5201 [ACK] Seq=25670 Ack=1 Win=64256 Len=1424 TSval=2008763812 TSecr=1039890508","","","","",""
"3787","106.465517290","10.10.3.105","10.10.3.59","MPTCP","92","[TCP Dup ACK 3727#8] 59721  >  5201 [ACK] Seq=1 Ack=1 Win=64256 Len=0 TSval=938019113 TSecr=1399998665","","","â\234\223","","â\234\223"
"3788","106.465551865","10.10.3.59","10.10.3.105","MPTCP","80","[TCP Dup ACK 3724#8] 5201  >  59721 [ACK] Seq=1 Ack=1 Win=65280 Len=0 TSval=1399998934 TSecr=938019113","","","â\234\223","","â\234\223"
"3789","106.465594240","10.10.3.105","10.10.3.59","MPTCP","92","[TCP Dup ACK 3725#2] 44427  >  5201 [ACK] Seq=1 Ack=1 Win=64256 Len=0 TSval=938019129 TSecr=1399998659","","","â\234\223","","â\234\223"
"3790","106.465603362","10.10.3.59","10.10.3.105","MPTCP","80","[TCP Dup ACK 3722#2] 5201  >  44427 [ACK] Seq=1 Ack=1 Win=65280 Len=0 TSval=1399998935 TSecr=938019129","","","â\234\223","","â\234\223"
"3791","106.465627535","10.10.3.105","10.10.3.59","MPTCP","92","[TCP Dup ACK 3727#9] 59721  >  5201 [ACK] Seq=1 Ack=1 Win=64256 Len=0 TSval=938019137 TSecr=1399998665","","","â\234\223","","â\234\223"
"3792","106.465637249","10.10.3.59","10.10.3.105","MPTCP","80","[TCP Dup ACK 3724#9] 5201  >  59721 [ACK] Seq=1 Ack=1 Win=65280 Len=0 TSval=1399998935 TSecr=938019137","","","â\234\223","","â\234\223"
"3793","106.468888506","10.10.3.105","10.10.3.102","MPTCP","1516","38842  >  5201 [PSH, ACK] Seq=27094 Ack=1 Win=64256 Len=1424 TSval=2008763812 TSecr=1039890508","","","","",""
"3794","106.468949257","10.10.3.102","10.10.3.105","MPTCP","80","5201  >  38842 [ACK] Seq=1 Ack=28518 Win=64128 Len=0 TSval=1039890560 TSecr=2008763812","0.000060751","","","",""
"3795","106.481819902","10.10.3.105","10.10.3.102","MPTCP","1516","38842  >  5201 [ACK] Seq=28518 Ack=1 Win=64256 Len=1424 TSval=2008763838 TSecr=1039890533","","","","",""
"3796","106.493957955","10.10.3.105","10.10.3.102","MPTCP","1516","38842  >  5201 [PSH, ACK] Seq=29942 Ack=1 Win=64256 Len=1424 TSval=2008763838 TSecr=1039890533","","","","",""
"3797","106.494020454","10.10.3.102","10.10.3.105","MPTCP","80","5201  >  38842 [ACK] Seq=1 Ack=31366 Win=64128 Len=0 TSval=1039890585 TSecr=2008763838","0.000062499","","","",""
"3798","106.496567454","10.10.3.105","10.10.3.59","MPTCP","92","[TCP Dup ACK 3727#10] 59721  >  5201 [ACK] Seq=1 Ack=1 Win=64256 Len=0 TSval=938019165 TSecr=1399998665","","","â\234\223","","â\234\223"
"3799","106.496602405","10.10.3.59","10.10.3.105","MPTCP","80","[TCP Dup ACK 3724#10] 5201  >  59721 [ACK] Seq=1 Ack=1 Win=65280 Len=0 TSval=1399998966 TSecr=938019165","","","â\234\223","","â\234\223"
"3800","106.506108161","10.10.3.105","10.10.3.102","MPTCP","1516","38842  >  5201 [ACK] Seq=31366 Ack=1 Win=64256 Len=1424 TSval=2008763852 TSecr=1039890533","","","","",""
"3801","106.517743135","10.10.3.105","10.10.3.102","MPTCP","1516","38842  >  5201 [ACK] Seq=32790 Ack=1 Win=64256 Len=1424 TSval=2008763852 TSecr=1039890533","","","","",""
"3802","106.517768236","10.10.3.102","10.10.3.105","MPTCP","80","5201  >  38842 [ACK] Seq=1 Ack=34214 Win=64128 Len=0 TSval=1039890609 TSecr=2008763852","0.000025101","","","",""
"3803","106.525784393","10.10.3.105","10.10.3.59","MPTCP","92","[TCP Dup ACK 3727#11] 59721  >  5201 [ACK] Seq=1 Ack=1 Win=64256 Len=0 TSval=938019189 TSecr=1399998665","","","â\234\223","","â\234\223"
"3804","106.525798922","10.10.3.59","10.10.3.105","MPTCP","80","[TCP Dup ACK 3724#11] 5201  >  59721 [ACK] Seq=1 Ack=1 Win=65280 Len=0 TSval=1399998995 TSecr=938019189","","","â\234\223","","â\234\223"
"3805","106.525810535","10.10.3.105","10.10.3.59","MPTCP","92","[TCP Dup ACK 3727#12] 59721  >  5201 [ACK] Seq=1 Ack=1 Win=64256 Len=0 TSval=938019213 TSecr=1399998665","","","â\234\223","","â\234\223"
"3806","106.525812721","10.10.3.59","10.10.3.105","MPTCP","80","[TCP Dup ACK 3724#12] 5201  >  59721 [ACK] Seq=1 Ack=1 Win=65280 Len=0 TSval=1399998995 TSecr=938019213","","","â\234\223","","â\234\223"
"3807","106.531554205","10.10.3.105","10.10.3.102","MPTCP","1516","[TCP Previous segment not captured] 38842  >  5201 [ACK] Seq=37062 Ack=1 Win=64256 Len=1424 TSval=2008763889 TSecr=1039890585","","â\234\223","","","â\234\223"
"3808","106.531572449","10.10.3.102","10.10.3.105","MPTCP","92","[TCP Window Update] 5201  >  38842 [ACK] Seq=1 Ack=34214 Win=65280 Len=0 TSval=1039890622 TSecr=2008763852 SLE=37062 SRE=38486","","","","","â\234\223"
"3809","106.543612707","10.10.3.105","10.10.3.102","MPTCP","1516","38842  >  5201 [PSH, ACK] Seq=38486 Ack=1 Win=64256 Len=1424 TSval=2008763889 TSecr=1039890585","","","","",""
"3810","106.543633969","10.10.3.102","10.10.3.105","MPTCP","92","[TCP Dup ACK 3802#1] 5201  >  38842 [ACK] Seq=1 Ack=34214 Win=65280 Len=0 TSval=1039890635 TSecr=2008763852 SLE=37062 SRE=39910","","","â\234\223","","â\234\223"
"3812","106.556729024","10.10.3.105","10.10.3.102","MPTCP","1516","38842  >  5201 [ACK] Seq=39910 Ack=1 Win=64256 Len=1424 TSval=2008763927 TSecr=1039890609","","","","",""
"3813","106.556746750","10.10.3.102","10.10.3.105","MPTCP","92","[TCP Dup ACK 3802#2] 5201  >  38842 [ACK] Seq=1 Ack=34214 Win=65280 Len=0 TSval=1039890648 TSecr=2008763852 SLE=37062 SRE=41334","","","â\234\223","","â\234\223"
"3814","106.562483802","10.10.3.105","10.10.3.59","MPTCP","92","[TCP Dup ACK 3727#13] 59721  >  5201 [ACK] Seq=1 Ack=1 Win=64256 Len=0 TSval=938019237 TSecr=1399998665","","","â\234\223","","â\234\223"
"3815","106.562503212","10.10.3.59","10.10.3.105","MPTCP","80","[TCP Dup ACK 3724#13] 5201  >  59721 [ACK] Seq=1 Ack=1 Win=65280 Len=0 TSval=1399999031 TSecr=938019237","","","â\234\223","","â\234\223"
"3816","106.568636281","10.10.3.105","10.10.3.102","MPTCP","1516","38842  >  5201 [PSH, ACK] Seq=41334 Ack=1 Win=64256 Len=1424 TSval=2008763927 TSecr=1039890609","","","","",""
"3817","106.568779394","10.10.3.102","10.10.3.105","MPTCP","92","[TCP Dup ACK 3802#3] 5201  >  38842 [ACK] Seq=1 Ack=34214 Win=65280 Len=0 TSval=1039890660 TSecr=2008763852 SLE=37062 SRE=42758","","","â\234\223","","â\234\223"
"3818","106.580914005","10.10.3.105","10.10.3.102","MPTCP","1516","[TCP Fast Retransmission] 38842  >  5201 [ACK] Seq=34214 Ack=1 Win=64256 Len=1424 TSval=2008763927 TSecr=1039890622","","","","â\234\223","â\234\223"
"3819","106.580941510","10.10.3.102","10.10.3.105","MPTCP","92","5201  >  38842 [ACK] Seq=1 Ack=35638 Win=64128 Len=0 TSval=1039890672 TSecr=2008763927 SLE=37062 SRE=42758","0.000027505","","","",""
"3822","106.593771154","10.10.3.105","10.10.3.102","MPTCP","1516","[TCP Retransmission] 38842  >  5201 [ACK] Seq=35638 Ack=1 Win=64256 Len=1424 TSval=2008763951 TSecr=1039890635","","","","â\234\223","â\234\223"
"3823","106.593808168","10.10.3.102","10.10.3.105","MPTCP","80","5201  >  38842 [ACK] Seq=1 Ack=42758 Win=60544 Len=0 TSval=1039890685 TSecr=2008763951","0.025171887","","","",""
"3825","106.606233418","10.10.3.105","10.10.3.102","MPTCP","1516","38842  >  5201 [ACK] Seq=42758 Ack=1 Win=64256 Len=1424 TSval=2008763976 TSecr=1039890660","","","","",""
"3826","106.611260674","10.10.3.105","10.10.3.59","MPTCP","92","[TCP Dup ACK 3727#14] 59721  >  5201 [ACK] Seq=1 Ack=1 Win=64256 Len=0 TSval=938019261 TSecr=1399998665","","","â\234\223","","â\234\223"
"3827","106.611292808","10.10.3.59","10.10.3.105","MPTCP","80","[TCP Dup ACK 3724#14] 5201  >  59721 [ACK] Seq=1 Ack=1 Win=65280 Len=0 TSval=1399999080 TSecr=938019261","","","â\234\223","","â\234\223"
"3828","106.611321098","10.10.3.105","10.10.3.59","MPTCP","92","[TCP Dup ACK 3727#15] 59721  >  5201 [ACK] Seq=1 Ack=1 Win=64256 Len=0 TSval=938019285 TSecr=1399998665","","","â\234\223","","â\234\223"
"3829","106.611327731","10.10.3.59","10.10.3.105","MPTCP","80","[TCP Dup ACK 3724#15] 5201  >  59721 [ACK] Seq=1 Ack=1 Win=65280 Len=0 TSval=1399999080 TSecr=938019285","","","â\234\223","","â\234\223"
"3830","106.613031958","10.10.3.105","10.10.3.59","MPTCP","92","[TCP Dup ACK 3727#16] 59721  >  5201 [ACK] Seq=1 Ack=1 Win=64256 Len=0 TSval=938019309 TSecr=1399998665","","","â\234\223","","â\234\223"
"3831","106.613063230","10.10.3.59","10.10.3.105","MPTCP","80","[TCP Dup ACK 3724#16] 5201  >  59721 [ACK] Seq=1 Ack=1 Win=65280 Len=0 TSval=1399999082 TSecr=938019309","","","â\234\223","","â\234\223"
"3832","106.619098683","10.10.3.105","10.10.3.102","MPTCP","1516","38842  >  5201 [ACK] Seq=44182 Ack=1 Win=64256 Len=1424 TSval=2008763988 TSecr=1039890672","","","","",""
"3833","106.619149604","10.10.3.102","10.10.3.105","MPTCP","80","5201  >  38842 [ACK] Seq=1 Ack=45606 Win=64128 Len=0 TSval=1039890710 TSecr=2008763976","0.000050921","","","",""
"3834","106.631528803","10.10.3.105","10.10.3.102","MPTCP","1516","38842  >  5201 [ACK] Seq=45606 Ack=1 Win=64256 Len=1424 TSval=2008763988 TSecr=1039890672","","","","",""
"3835","106.643618222","10.10.3.105","10.10.3.102","MPTCP","1516","38842  >  5201 [PSH, ACK] Seq=47030 Ack=1 Win=64256 Len=1424 TSval=2008763988 TSecr=1039890672","","","","",""
"3836","106.643679710","10.10.3.102","10.10.3.105","MPTCP","80","5201  >  38842 [ACK] Seq=1 Ack=48454 Win=64128 Len=0 TSval=1039890735 TSecr=2008763988","0.000061488","","","",""
"3837","106.656501085","10.10.3.105","10.10.3.102","MPTCP","1516","38842  >  5201 [ACK] Seq=48454 Ack=1 Win=64256 Len=1424 TSval=2008764014 TSecr=1039890710","","","","",""
"3838","106.692815869","10.10.3.105","10.10.3.102","MPTCP","1516","38842  >  5201 [ACK] Seq=49878 Ack=1 Win=64256 Len=1424 TSval=2008764026 TSecr=1039890710","","","","",""
"3839","106.692874032","10.10.3.102","10.10.3.105","MPTCP","80","5201  >  38842 [ACK] Seq=1 Ack=51302 Win=64128 Len=0 TSval=1039890784 TSecr=2008764014","0.000058163","","","",""
"3840","106.703562284","10.10.3.105","10.10.3.59","MPTCP","92","[TCP Dup ACK 3727#17] 59721  >  5201 [ACK] Seq=1 Ack=1 Win=64256 Len=0 TSval=938019333 TSecr=1399998665","","","â\234\223","","â\234\223"
"3841","106.703594431","10.10.3.59","10.10.3.105","MPTCP","80","[TCP Dup ACK 3724#17] 5201  >  59721 [ACK] Seq=1 Ack=1 Win=65280 Len=0 TSval=1399999172 TSecr=938019333","","","â\234\223","","â\234\223"
"3842","106.704919256","10.10.3.105","10.10.3.102","MPTCP","1516","[TCP Previous segment not captured] 38842  >  5201 [ACK] Seq=52726 Ack=1 Win=64256 Len=1424 TSval=2008764039 TSecr=1039890735","","â\234\223","","","â\234\223"
"3843","106.704957577","10.10.3.102","10.10.3.105","MPTCP","92","[TCP Window Update] 5201  >  38842 [ACK] Seq=1 Ack=51302 Win=65280 Len=0 TSval=1039890796 TSecr=2008764014 SLE=52726 SRE=54150","","","","","â\234\223"
"3844","106.706772525","10.10.3.105","10.10.3.59","MPTCP","1516","59721  >  5201 [ACK] Seq=1 Ack=1 Win=64256 Len=1424 TSval=938019346 TSecr=1399998671","","","","",""
"3845","106.706814769","10.10.3.59","10.10.3.105","MPTCP","80","5201  >  59721 [ACK] Seq=1 Ack=1425 Win=65280 Len=0 TSval=1399999176 TSecr=938019346","0.000042244","","","",""
"3846","106.706864412","10.10.3.105","10.10.3.59","MPTCP","1516","59721  >  5201 [PSH, ACK] Seq=1425 Ack=1 Win=64256 Len=1424 TSval=938019346 TSecr=1399998671","","","","",""
"3847","106.706877573","10.10.3.59","10.10.3.105","MPTCP","80","5201  >  59721 [ACK] Seq=1 Ack=2849 Win=65280 Len=0 TSval=1399999176 TSecr=938019346","0.000013161","","","",""
"3848","106.717041634","10.10.3.105","10.10.3.102","MPTCP","1516","[TCP Previous segment not captured] 38842  >  5201 [ACK] Seq=56998 Ack=1 Win=64256 Len=1424 TSval=2008764088 TSecr=1039890784","","â\234\223","","","â\234\223"
"3849","106.717087014","10.10.3.102","10.10.3.105","MPTCP","92","[TCP Dup ACK 3839#1] 5201  >  38842 [ACK] Seq=1 Ack=51302 Win=65280 Len=0 TSval=1039890808 TSecr=2008764014 SLE=56998 SRE=58422","","","â\234\223","","â\234\223"
"3850","106.728967312","10.10.3.105","10.10.3.102","MPTCP","1516","38842  >  5201 [PSH, ACK] Seq=58422 Ack=1 Win=64256 Len=1424 TSval=2008764088 TSecr=1039890784","","","","",""
"3851","106.729003535","10.10.3.102","10.10.3.105","MPTCP","92","[TCP Dup ACK 3839#2] 5201  >  38842 [ACK] Seq=1 Ack=51302 Win=65280 Len=0 TSval=1039890820 TSecr=2008764014 SLE=56998 SRE=59846","","","â\234\223","","â\234\223"
"3852","106.741085499","10.10.3.105","10.10.3.102","MPTCP","1516","[TCP Fast Retransmission] 38842  >  5201 [ACK] Seq=51302 Ack=1 Win=64256 Len=1424 TSval=2008764100 TSecr=1039890796","","","","â\234\223","â\234\223"
"3853","106.741140538","10.10.3.102","10.10.3.105","MPTCP","92","5201  >  38842 [ACK] Seq=1 Ack=54150 Win=62464 Len=0 TSval=1039890832 TSecr=2008764100 SLE=56998 SRE=59846","0.036221282","","","",""
"3854","106.753183847","10.10.3.105","10.10.3.102","MPTCP","1516","[TCP Retransmission] 38842  >  5201 [ACK] Seq=54150 Ack=1 Win=64256 Len=1424 TSval=2008764112 TSecr=1039890808","","","","â\234\223","â\234\223"
"3855","106.753205005","10.10.3.102","10.10.3.105","MPTCP","92","5201  >  38842 [ACK] Seq=1 Ack=55574 Win=61824 Len=0 TSval=1039890844 TSecr=2008764112 SLE=56998 SRE=59846","0.000021158","","","",""
"3856","106.765510721","10.10.3.105","10.10.3.102","MPTCP","1516","[TCP Retransmission] 38842  >  5201 [ACK] Seq=55574 Ack=1 Win=64256 Len=1424 TSval=2008764124 TSecr=1039890820","","","","â\234\223","â\234\223"
"3857","106.765540071","10.10.3.102","10.10.3.105","MPTCP","80","5201  >  38842 [ACK] Seq=1 Ack=59846 Win=59776 Len=0 TSval=1039890856 TSecr=2008764124","0.036572759","","","",""
"3858","106.777624700","10.10.3.105","10.10.3.102","MPTCP","1516","38842  >  5201 [ACK] Seq=59846 Ack=1 Win=64256 Len=1424 TSval=2008764136 TSecr=1039890832","","","","",""
"3859","106.789513598","10.10.3.105","10.10.3.102","MPTCP","1516","38842  >  5201 [PSH, ACK] Seq=61270 Ack=1 Win=64256 Len=1424 TSval=2008764136 TSecr=1039890832","","","","",""
"3860","106.789548253","10.10.3.102","10.10.3.105","MPTCP","80","5201  >  38842 [ACK] Seq=1 Ack=62694 Win=61824 Len=0 TSval=1039890880 TSecr=2008764136","0.000034655","","","",""
"3861","106.801528760","10.10.3.105","10.10.3.102","MPTCP","1516","38842  >  5201 [ACK] Seq=62694 Ack=1 Win=64256 Len=1424 TSval=2008764161 TSecr=1039890856","","","","",""
"3862","106.813957881","10.10.3.105","10.10.3.102","MPTCP","1516","38842  >  5201 [ACK] Seq=64118 Ack=1 Win=64256 Len=1424 TSval=2008764184 TSecr=1039890856","","","","",""
"3863","106.814013541","10.10.3.102","10.10.3.105","MPTCP","80","5201  >  38842 [ACK] Seq=1 Ack=65542 Win=61824 Len=0 TSval=1039890905 TSecr=2008764161","0.000055660","","","",""
"3864","106.825899096","10.10.3.105","10.10.3.102","MPTCP","1516","38842  >  5201 [ACK] Seq=65542 Ack=1 Win=64256 Len=1424 TSval=2008764185 TSecr=1039890880","","","","",""
"3865","106.838083670","10.10.3.105","10.10.3.102","MPTCP","1516","38842  >  5201 [PSH, ACK] Seq=66966 Ack=1 Win=64256 Len=1424 TSval=2008764185 TSecr=1039890880","","","","",""
"3866","106.838144367","10.10.3.102","10.10.3.105","MPTCP","80","5201  >  38842 [ACK] Seq=1 Ack=68390 Win=61824 Len=0 TSval=1039890929 TSecr=2008764185","0.000060697","","","",""
"3867","106.850067257","10.10.3.105","10.10.3.102","MPTCP","1516","38842  >  5201 [ACK] Seq=68390 Ack=1 Win=64256 Len=1424 TSval=2008764209 TSecr=1039890905","","","","",""
"3868","106.861881331","10.10.3.105","10.10.3.102","MPTCP","1516","38842  >  5201 [PSH, ACK] Seq=69814 Ack=1 Win=64256 Len=1424 TSval=2008764209 TSecr=1039890905","","","","",""
"3869","106.861932175","10.10.3.102","10.10.3.105","MPTCP","80","5201  >  38842 [ACK] Seq=1 Ack=71238 Win=61824 Len=0 TSval=1039890953 TSecr=2008764209","0.000050844","","","",""
"3870","106.874040070","10.10.3.105","10.10.3.102","MPTCP","1516","38842  >  5201 [ACK] Seq=71238 Ack=1 Win=64256 Len=1424 TSval=2008764233 TSecr=1039890929","","","","",""
"3871","106.886408796","10.10.3.105","10.10.3.102","MPTCP","1516","38842  >  5201 [PSH, ACK] Seq=72662 Ack=1 Win=64256 Len=1424 TSval=2008764233 TSecr=1039890929","","","","",""
"3872","106.886438733","10.10.3.102","10.10.3.105","MPTCP","80","5201  >  38842 [ACK] Seq=1 Ack=74086 Win=61824 Len=0 TSval=1039890977 TSecr=2008764233","0.000029937","","","",""
"3873","106.898725260","10.10.3.105","10.10.3.102","MPTCP","1516","38842  >  5201 [ACK] Seq=74086 Ack=1 Win=64256 Len=1424 TSval=2008764257 TSecr=1039890953","","","","",""
"3874","106.910828924","10.10.3.105","10.10.3.102","MPTCP","1516","38842  >  5201 [PSH, ACK] Seq=75510 Ack=1 Win=64256 Len=1424 TSval=2008764257 TSecr=1039890953","","","","",""
"3875","106.910876124","10.10.3.102","10.10.3.105","MPTCP","80","5201  >  38842 [ACK] Seq=1 Ack=76934 Win=61824 Len=0 TSval=1039891002 TSecr=2008764257","0.000047200","","","",""
"3876","106.922578113","10.10.3.105","10.10.3.102","MPTCP","1516","38842  >  5201 [ACK] Seq=76934 Ack=1 Win=64256 Len=1424 TSval=2008764282 TSecr=1039890977","","","","",""
"3877","106.934650907","10.10.3.105","10.10.3.102","MPTCP","1516","38842  >  5201 [PSH, ACK] Seq=78358 Ack=1 Win=64256 Len=1424 TSval=2008764282 TSecr=1039890977","","","","",""
"3878","106.934673715","10.10.3.102","10.10.3.105","MPTCP","80","5201  >  38842 [ACK] Seq=1 Ack=79782 Win=61824 Len=0 TSval=1039891026 TSecr=2008764282","0.000022808","","","",""
"3879","106.947079245","10.10.3.105","10.10.3.102","MPTCP","1516","38842  >  5201 [ACK] Seq=79782 Ack=1 Win=64256 Len=1424 TSval=2008764306 TSecr=1039891002","","","","",""
"3880","106.959259745","10.10.3.105","10.10.3.102","MPTCP","1516","38842  >  5201 [PSH, ACK] Seq=81206 Ack=1 Win=64256 Len=1424 TSval=2008764306 TSecr=1039891002","","","","",""
"3881","106.959284508","10.10.3.102","10.10.3.105","MPTCP","80","5201  >  38842 [ACK] Seq=1 Ack=82630 Win=61824 Len=0 TSval=1039891050 TSecr=2008764306","0.000024763","","","",""
"3882","106.971040782","10.10.3.105","10.10.3.102","MPTCP","1516","38842  >  5201 [ACK] Seq=82630 Ack=1 Win=64256 Len=1424 TSval=2008764330 TSecr=1039891026","","","","",""
"3883","106.983295364","10.10.3.105","10.10.3.102","MPTCP","1516","38842  >  5201 [PSH, ACK] Seq=84054 Ack=1 Win=64256 Len=1424 TSval=2008764330 TSecr=1039891026","","","","",""
"3884","106.983358114","10.10.3.102","10.10.3.105","MPTCP","80","5201  >  38842 [ACK] Seq=1 Ack=85478 Win=61824 Len=0 TSval=1039891074 TSecr=2008764330","0.000062750","","","",""
"3885","106.995366168","10.10.3.105","10.10.3.102","MPTCP","1516","38842  >  5201 [ACK] Seq=85478 Ack=1 Win=64256 Len=1424 TSval=2008764355 TSecr=1039891050","","","","",""
"3886","107.007534715","10.10.3.105","10.10.3.102","MPTCP","1516","38842  >  5201 [ACK] Seq=86902 Ack=1 Win=64256 Len=1424 TSval=2008764366 TSecr=1039891050","","","","",""
"3887","107.007569921","10.10.3.102","10.10.3.105","MPTCP","80","5201  >  38842 [ACK] Seq=1 Ack=88326 Win=61824 Len=0 TSval=1039891098 TSecr=2008764355","0.000035206","","","",""
"3888","107.019434718","10.10.3.105","10.10.3.102","MPTCP","1516","38842  >  5201 [PSH, ACK] Seq=88326 Ack=1 Win=64256 Len=1424 TSval=2008764366 TSecr=1039891050","","","","",""
"3889","107.031746732","10.10.3.105","10.10.3.102","MPTCP","1516","38842  >  5201 [ACK] Seq=89750 Ack=1 Win=64256 Len=1424 TSval=2008764390 TSecr=1039891074","","","","",""
"3890","107.031773226","10.10.3.102","10.10.3.105","MPTCP","80","5201  >  38842 [ACK] Seq=1 Ack=91174 Win=61824 Len=0 TSval=1039891123 TSecr=2008764366","0.000026494","","","",""
"3891","107.043861045","10.10.3.105","10.10.3.102","MPTCP","1516","38842  >  5201 [ACK] Seq=91174 Ack=1 Win=64256 Len=1424 TSval=2008764390 TSecr=1039891074","","","","",""
"3892","107.056166031","10.10.3.105","10.10.3.102","MPTCP","1516","38842  >  5201 [PSH, ACK] Seq=92598 Ack=1 Win=64256 Len=1424 TSval=2008764390 TSecr=1039891074","","","","",""
"3893","107.056189674","10.10.3.102","10.10.3.105","MPTCP","80","5201  >  38842 [ACK] Seq=1 Ack=94022 Win=61824 Len=0 TSval=1039891147 TSecr=2008764390","0.000023643","","","",""
"3894","107.068303279","10.10.3.105","10.10.3.102","MPTCP","1516","38842  >  5201 [ACK] Seq=94022 Ack=1 Win=64256 Len=1424 TSval=2008764427 TSecr=1039891123","","","","",""
"3895","107.080165168","10.10.3.105","10.10.3.102","MPTCP","1516","38842  >  5201 [PSH, ACK] Seq=95446 Ack=1 Win=64256 Len=1424 TSval=2008764427 TSecr=1039891123","","","","",""
"3896","107.080189758","10.10.3.102","10.10.3.105","MPTCP","80","5201  >  38842 [ACK] Seq=1 Ack=96870 Win=61824 Len=0 TSval=1039891171 TSecr=2008764427","0.000024590","","","",""
"3897","107.092512866","10.10.3.105","10.10.3.102","MPTCP","1516","38842  >  5201 [ACK] Seq=96870 Ack=1 Win=64256 Len=1424 TSval=2008764451 TSecr=1039891147","","","","",""
"3898","107.104616572","10.10.3.105","10.10.3.102","MPTCP","1516","38842  >  5201 [PSH, ACK] Seq=98294 Ack=1 Win=64256 Len=1424 TSval=2008764451 TSecr=1039891147","","","","",""
"3899","107.104663713","10.10.3.102","10.10.3.105","MPTCP","80","5201  >  38842 [ACK] Seq=1 Ack=99718 Win=61824 Len=0 TSval=1039891196 TSecr=2008764451","0.000047141","","","",""
"3900","107.116566292","10.10.3.105","10.10.3.102","MPTCP","1516","38842  >  5201 [ACK] Seq=99718 Ack=1 Win=64256 Len=1424 TSval=2008764475 TSecr=1039891171","","","","",""
"3901","107.128832898","10.10.3.105","10.10.3.102","MPTCP","1516","38842  >  5201 [PSH, ACK] Seq=101142 Ack=1 Win=64256 Len=1424 TSval=2008764475 TSecr=1039891171","","","","",""
"3902","107.128880021","10.10.3.102","10.10.3.105","MPTCP","80","5201  >  38842 [ACK] Seq=1 Ack=102566 Win=61824 Len=0 TSval=1039891220 TSecr=2008764475","0.000047123","","","",""
"3903","107.135428632","10.10.3.105","10.10.3.102","MPTCP","828","38842  >  5201 [PSH, ACK] Seq=102566 Ack=1 Win=64256 Len=736 TSval=2008764500 TSecr=1039891196","","","","",""
"3904","107.135573084","10.10.3.102","10.10.3.105","MPTCP","80","5201  >  38842 [ACK] Seq=1 Ack=103302 Win=64128 Len=0 TSval=1039891226 TSecr=2008764500","0.000144452","","","",""
"3905","107.147564416","10.10.3.105","10.10.3.102","MPTCP","1516","38842  >  5201 [ACK] Seq=103302 Ack=1 Win=64256 Len=1424 TSval=2008764511 TSecr=1039891196","","","","",""
"3906","107.159671859","10.10.3.105","10.10.3.102","MPTCP","1516","38842  >  5201 [ACK] Seq=104726 Ack=1 Win=64256 Len=1424 TSval=2008764511 TSecr=1039891196","","","","",""
"3907","107.159722272","10.10.3.102","10.10.3.105","MPTCP","80","5201  >  38842 [ACK] Seq=1 Ack=106150 Win=64128 Len=0 TSval=1039891251 TSecr=2008764511","0.000050413","","","",""
"3908","107.171773953","10.10.3.105","10.10.3.102","MPTCP","1516","38842  >  5201 [PSH, ACK] Seq=106150 Ack=1 Win=64256 Len=1424 TSval=2008764511 TSecr=1039891196","","","","",""
"3909","107.183873501","10.10.3.105","10.10.3.102","MPTCP","1516","38842  >  5201 [ACK] Seq=107574 Ack=1 Win=64256 Len=1424 TSval=2008764531 TSecr=1039891226","","","","",""
"3910","107.183925267","10.10.3.102","10.10.3.105","MPTCP","80","5201  >  38842 [ACK] Seq=1 Ack=108998 Win=64128 Len=0 TSval=1039891275 TSecr=2008764511","0.000051766","","","",""
"3912","107.195811669","10.10.3.105","10.10.3.102","MPTCP","1516","38842  >  5201 [PSH, ACK] Seq=108998 Ack=1 Win=64256 Len=1424 TSval=2008764531 TSecr=1039891226","","","","",""
"3913","107.207960233","10.10.3.105","10.10.3.102","MPTCP","1516","38842  >  5201 [ACK] Seq=110422 Ack=1 Win=64256 Len=1424 TSval=2008764579 TSecr=1039891251","","","","",""
"3914","107.208003466","10.10.3.102","10.10.3.105","MPTCP","80","5201  >  38842 [ACK] Seq=1 Ack=111846 Win=64128 Len=0 TSval=1039891299 TSecr=2008764531","0.000043233","","","",""
"3915","107.213831790","10.10.3.102","10.10.3.62","MPTCP","92","[TCP Retransmission] 5201  >  52483 [SYN, ACK] Seq=0 Ack=1 Win=65160 Len=0 MSS=1460 SACK_PERM=1 TSval=2492709586 TSecr=3345930787 WS=128","","","","â\234\223","â\234\223"
