"No.","Time","Source","Destination","Protocol","Length","Info","RTT","Lost Segement","Duplicate ","Retransmission","IDK"
"1463","24.837515093","10.10.3.105","10.10.3.102","MPTCP","80","35064  >  5201 [SYN] Seq=0 Win=64240 Len=0 MSS=1460 SACK_PERM=1 TSval=2009104771 TSecr=0 WS=128","","","","",""
"1465","25.037797732","10.10.3.102","10.10.3.105","MPTCP","88","5201  >  35064 [SYN, ACK] Seq=0 Ack=1 Win=65160 Len=0 MSS=1460 SACK_PERM=1 TSval=1040231468 TSecr=2009104771 WS=128","0.200282639","","","",""
"1466","25.038384922","10.10.3.105","10.10.3.102","MPTCP","88","35064  >  5201 [ACK] Seq=1 Ack=1 Win=64256 Len=0 TSval=2009104972 TSecr=1040231468","0.000587190","","","",""
"1467","25.038385515","10.10.3.105","10.10.3.102","MPTCP","129","35064  >  5201 [PSH, ACK] Seq=1 Ack=1 Win=64256 Len=37 TSval=2009104972 TSecr=1040231468","","","","",""
"1470","25.238602697","10.10.3.102","10.10.3.105","MPTCP","80","5201  >  35064 [ACK] Seq=1 Ack=38 Win=65152 Len=0 TSval=1040231669 TSecr=2009104972","0.200217182","","","",""
"1471","25.238612656","10.10.3.102","10.10.3.105","MPTCP","84","5201  >  35064 [ACK] Seq=1 Ack=38 Win=65152 Len=0 TSval=1040231669 TSecr=2009104972","","","","",""
"1472","25.238655156","10.10.3.102","10.10.3.105","MPTCP","97","5201  >  35064 [PSH, ACK] Seq=1 Ack=38 Win=65152 Len=1 TSval=1040231669 TSecr=2009104972","","","","",""
"1473","25.238937967","10.10.3.105","10.10.3.102","MPTCP","76","35064  >  5201 [ACK] Seq=38 Ack=2 Win=64256 Len=0 TSval=2009105173 TSecr=1040231669","0.000282811","","","",""
"1474","25.238938612","10.10.3.105","10.10.3.102","MPTCP","80","[TCP Dup ACK 1473#1] 35064  >  5201 [ACK] Seq=38 Ack=2 Win=64256 Len=0 TSval=2009105173 TSecr=1040231669","","","â\234\223","","â\234\223"
"1475","25.239068936","10.10.3.105","10.10.3.102","MPTCP","100","35064  >  5201 [PSH, ACK] Seq=38 Ack=2 Win=64256 Len=4 TSval=2009105173 TSecr=1040231669","","","","",""
"1476","25.241139857","10.10.3.105","10.10.3.59","MPTCP","88","56247  >  5201 [SYN] Seq=0 Win=64256 Len=0 MSS=1460 SACK_PERM=1 TSval=938360505 TSecr=0 WS=128","","","","",""
"1477","25.241195539","10.10.3.59","10.10.3.105","MPTCP","92","5201  >  56247 [SYN, ACK] Seq=0 Ack=1 Win=65160 Len=0 MSS=1460 SACK_PERM=1 TSval=1400340250 TSecr=938360505 WS=128","0.000055682","","","",""
"1478","25.242152848","10.10.3.62","10.10.3.102","MPTCP","88","42201  >  5201 [SYN] Seq=0 Win=64256 Len=0 MSS=1460 SACK_PERM=1 TSval=3346272378 TSecr=0 WS=128","","","","",""
"1479","25.243878157","10.10.3.105","10.10.3.59","MPTCP","92","56247  >  5201 [ACK] Seq=1 Ack=1 Win=64256 Len=0 TSval=938360509 TSecr=1400340250","0.002682618","","","",""
"1480","25.243991537","10.10.3.59","10.10.3.105","MPTCP","80","[TCP Window Update] 5201  >  56247 [ACK] Seq=1 Ack=1 Win=65280 Len=0 TSval=1400340253 TSecr=938360509","","","","","â\234\223"
"1482","25.442279466","10.10.3.102","10.10.3.62","MPTCP","92","5201  >  42201 [SYN, ACK] Seq=0 Ack=1 Win=65160 Len=0 MSS=1460 SACK_PERM=1 TSval=2493050154 TSecr=3346272378 WS=128","0.200126618","","","",""
"1484","25.481987646","10.10.3.102","10.10.3.105","MPTCP","80","5201  >  35064 [ACK] Seq=2 Ack=42 Win=65280 Len=0 TSval=1040231913 TSecr=2009105173","0.242918710","","","",""
"1485","25.482571677","10.10.3.105","10.10.3.102","MPTCP","196","35064  >  5201 [PSH, ACK] Seq=42 Ack=2 Win=64256 Len=100 TSval=2009105416 TSecr=1040231913","","","","",""
"1486","25.682628599","10.10.3.102","10.10.3.105","MPTCP","80","5201  >  35064 [ACK] Seq=2 Ack=142 Win=65280 Len=0 TSval=1040232113 TSecr=2009105416","0.200056922","","","",""
"1487","25.682757870","10.10.3.102","10.10.3.105","MPTCP","97","5201  >  35064 [PSH, ACK] Seq=2 Ack=142 Win=65280 Len=1 TSval=1040232114 TSecr=2009105416","","","","",""
"1488","25.683089110","10.10.3.105","10.10.3.102","MPTCP","80","35070  >  5201 [SYN] Seq=0 Win=64240 Len=0 MSS=1460 SACK_PERM=1 TSval=2009105617 TSecr=0 WS=128","","","","",""
"1490","25.685758471","10.10.3.59","10.10.3.105","MPTCP","97","5201  >  56247 [PSH, ACK] Seq=1 Ack=1 Win=65280 Len=1 TSval=1400340695 TSecr=938360509","","","","",""
"1491","25.690602999","10.10.3.105","10.10.3.59","MPTCP","80","56247  >  5201 [ACK] Seq=1 Ack=2 Win=64256 Len=0 TSval=938360955 TSecr=1400340695","0.004844528","","","",""
"1493","25.727234583","10.10.3.105","10.10.3.102","MPTCP","80","35064  >  5201 [ACK] Seq=142 Ack=3 Win=64256 Len=0 TSval=2009105661 TSecr=1040232114","0.044476713","","","",""
"1494","25.883165464","10.10.3.102","10.10.3.105","MPTCP","88","5201  >  35070 [SYN, ACK] Seq=0 Ack=1 Win=65160 Len=0 MSS=1460 SACK_PERM=1 TSval=1040232314 TSecr=2009105617 WS=128","0.200076354","","","",""
"1495","25.883584901","10.10.3.105","10.10.3.102","MPTCP","88","35070  >  5201 [ACK] Seq=1 Ack=1 Win=64256 Len=0 TSval=2009105817 TSecr=1040232314","0.000419437","","","",""
"1496","25.883585560","10.10.3.105","10.10.3.102","MPTCP","129","35070  >  5201 [PSH, ACK] Seq=1 Ack=1 Win=64256 Len=37 TSval=2009105817 TSecr=1040232314","","","","",""
"1561","26.083806950","10.10.3.102","10.10.3.105","MPTCP","80","5201  >  35070 [ACK] Seq=1 Ack=38 Win=65152 Len=0 TSval=1040232514 TSecr=2009105817","0.200221390","","","",""
"1562","26.083886453","10.10.3.102","10.10.3.105","MPTCP","84","5201  >  35070 [ACK] Seq=1 Ack=38 Win=65152 Len=0 TSval=1040232514 TSecr=2009105817","","","","",""
"1563","26.084130292","10.10.3.105","10.10.3.102","MPTCP","76","35070  >  5201 [ACK] Seq=38 Ack=1 Win=64256 Len=0 TSval=2009106018 TSecr=1040232514","","","","",""
"1564","26.085446668","10.10.3.62","10.10.3.102","MPTCP","88","43617  >  5201 [SYN] Seq=0 Win=64256 Len=0 MSS=1460 SACK_PERM=1 TSval=3346273223 TSecr=0 WS=128","","","","",""
"1565","26.085527480","10.10.3.105","10.10.3.59","MPTCP","88","56709  >  5201 [SYN] Seq=0 Win=64256 Len=0 MSS=1460 SACK_PERM=1 TSval=938361350 TSecr=0 WS=128","","","","",""
"1566","26.085540888","10.10.3.59","10.10.3.105","MPTCP","92","5201  >  56709 [SYN, ACK] Seq=0 Ack=1 Win=65160 Len=0 MSS=1460 SACK_PERM=1 TSval=1400341094 TSecr=938361350 WS=128","0.000013408","","","",""
"1567","26.085745940","10.10.3.102","10.10.3.105","MPTCP","97","5201  >  35064 [PSH, ACK] Seq=3 Ack=142 Win=65280 Len=1 TSval=1040232516 TSecr=2009105661","","","","",""
"1568","26.085843445","10.10.3.105","10.10.3.102","MPTCP","80","35064  >  5201 [ACK] Seq=142 Ack=4 Win=64256 Len=0 TSval=2009106020 TSecr=1040232516","0.000097505","","","",""
"1570","26.094945154","10.10.3.105","10.10.3.59","MPTCP","92","56709  >  5201 [ACK] Seq=1 Ack=1 Win=64256 Len=0 TSval=938361353 TSecr=1400341094","0.009404266","","","",""
"1571","26.094988290","10.10.3.59","10.10.3.105","MPTCP","80","[TCP Window Update] 5201  >  56709 [ACK] Seq=1 Ack=1 Win=65280 Len=0 TSval=1400341104 TSecr=938361353","","","","","â\234\223"
"1572","26.101193348","10.10.3.105","10.10.3.59","MPTCP","92","[TCP Dup ACK 1570#1] 56709  >  5201 [ACK] Seq=1 Ack=1 Win=64256 Len=0 TSval=938361365 TSecr=1400341094","","","â\234\223","","â\234\223"
"1573","26.101207446","10.10.3.59","10.10.3.105","MPTCP","80","[TCP Dup ACK 1566#1] 5201  >  56709 [ACK] Seq=1 Ack=1 Win=65280 Len=0 TSval=1400341110 TSecr=938361365","","","â\234\223","","â\234\223"
"1582","26.271371285","10.10.3.62","10.10.3.102","MPTCP","88","[TCP Retransmission] [TCP Port numbers reused] 42201  >  5201 [SYN] Seq=0 Win=64256 Len=0 MSS=1460 SACK_PERM=1 TSval=3346273410 TSecr=0 WS=128","","","","â\234\223","â\234\223"
"1590","26.285720012","10.10.3.102","10.10.3.62","MPTCP","92","5201  >  43617 [SYN, ACK] Seq=0 Ack=1 Win=65160 Len=0 MSS=1460 SACK_PERM=1 TSval=2493050997 TSecr=3346273223 WS=128","0.200273344","","","",""
"1591","26.285863691","10.10.3.102","10.10.3.105","MPTCP","97","5201  >  35064 [PSH, ACK] Seq=4 Ack=142 Win=65280 Len=1 TSval=1040232717 TSecr=2009106020","","","","",""
"1592","26.286016165","10.10.3.105","10.10.3.102","MPTCP","80","35064  >  5201 [ACK] Seq=142 Ack=5 Win=64256 Len=0 TSval=2009106220 TSecr=1040232717","0.000152474","","","",""
"1593","26.286094423","10.10.3.105","10.10.3.102","MPTCP","2940","35070  >  5201 [PSH, ACK] Seq=38 Ack=1 Win=64256 Len=2848 TSval=2009106220 TSecr=1040232514","","","","",""
"1594","26.286094597","10.10.3.105","10.10.3.102","MPTCP","2940","35070  >  5201 [PSH, ACK] Seq=2886 Ack=1 Win=64256 Len=2848 TSval=2009106220 TSecr=1040232514","","","","",""
"1595","26.286094709","10.10.3.105","10.10.3.102","MPTCP","2940","35070  >  5201 [PSH, ACK] Seq=5734 Ack=1 Win=64256 Len=2848 TSval=2009106220 TSecr=1040232514","","","","",""
"1596","26.286177194","10.10.3.105","10.10.3.102","MPTCP","2940","35070  >  5201 [PSH, ACK] Seq=8582 Ack=1 Win=64256 Len=2848 TSval=2009106220 TSecr=1040232514","","","","",""
"1597","26.286256099","10.10.3.105","10.10.3.102","MPTCP","2940","35070  >  5201 [PSH, ACK] Seq=11430 Ack=1 Win=64256 Len=2848 TSval=2009106220 TSecr=1040232514","","","","",""
"1609","26.471638473","10.10.3.102","10.10.3.62","MPTCP","92","[TCP Retransmission] 5201  >  42201 [SYN, ACK] Seq=0 Ack=1 Win=65160 Len=0 MSS=1460 SACK_PERM=1 TSval=2493051183 TSecr=3346272378 WS=128","0.200267188","","","â\234\223","â\234\223"
"1613","26.486178297","10.10.3.102","10.10.3.105","MPTCP","80","5201  >  35070 [ACK] Seq=1 Ack=2886 Win=63488 Len=0 TSval=1040232917 TSecr=2009106220","0.200083874","","","",""
"1614","26.486185177","10.10.3.102","10.10.3.105","MPTCP","80","5201  >  35070 [ACK] Seq=1 Ack=5734 Win=61440 Len=0 TSval=1040232917 TSecr=2009106220","0.200090580","","","",""
"1615","26.486186807","10.10.3.102","10.10.3.105","MPTCP","80","5201  >  35070 [ACK] Seq=1 Ack=8582 Win=59392 Len=0 TSval=1040232917 TSecr=2009106220","0.200092098","","","",""
"1616","26.486194621","10.10.3.102","10.10.3.105","MPTCP","80","5201  >  35070 [ACK] Seq=1 Ack=11430 Win=57344 Len=0 TSval=1040232917 TSecr=2009106220","0.200017427","","","",""
"1617","26.486272599","10.10.3.102","10.10.3.105","MPTCP","80","5201  >  35070 [ACK] Seq=1 Ack=14278 Win=63488 Len=0 TSval=1040232917 TSecr=2009106220","0.200016500","","","",""
"1618","26.486793533","10.10.3.105","10.10.3.102","MPTCP","2940","35070  >  5201 [PSH, ACK] Seq=14278 Ack=1 Win=64256 Len=2848 TSval=2009106420 TSecr=1040232917","","","","",""
"1619","26.486794188","10.10.3.105","10.10.3.102","MPTCP","2940","35070  >  5201 [PSH, ACK] Seq=17126 Ack=1 Win=64256 Len=2848 TSval=2009106420 TSecr=1040232917","","","","",""
"1620","26.486794351","10.10.3.105","10.10.3.102","MPTCP","2940","35070  >  5201 [PSH, ACK] Seq=19974 Ack=1 Win=64256 Len=2848 TSval=2009106420 TSecr=1040232917","","","","",""
"1621","26.486794472","10.10.3.105","10.10.3.102","MPTCP","2940","35070  >  5201 [PSH, ACK] Seq=22822 Ack=1 Win=64256 Len=2848 TSval=2009106420 TSecr=1040232917","","","","",""
"1622","26.486911097","10.10.3.105","10.10.3.102","MPTCP","2940","35070  >  5201 [PSH, ACK] Seq=25670 Ack=1 Win=64256 Len=2848 TSval=2009106421 TSecr=1040232917","","","","",""
"1623","26.486911352","10.10.3.105","10.10.3.102","MPTCP","2940","35070  >  5201 [PSH, ACK] Seq=28518 Ack=1 Win=64256 Len=2848 TSval=2009106421 TSecr=1040232917","","","","",""
"1624","26.486991095","10.10.3.105","10.10.3.102","MPTCP","2940","35070  >  5201 [PSH, ACK] Seq=31366 Ack=1 Win=64256 Len=2848 TSval=2009106421 TSecr=1040232917","","","","",""
"1625","26.487053921","10.10.3.105","10.10.3.102","MPTCP","2940","35070  >  5201 [PSH, ACK] Seq=34214 Ack=1 Win=64256 Len=2848 TSval=2009106421 TSecr=1040232917","","","","",""
"1626","26.487147023","10.10.3.105","10.10.3.102","MPTCP","2940","35070  >  5201 [PSH, ACK] Seq=37062 Ack=1 Win=64256 Len=2848 TSval=2009106421 TSecr=1040232917","","","","",""
"1627","26.487218437","10.10.3.105","10.10.3.102","MPTCP","2940","35070  >  5201 [PSH, ACK] Seq=39910 Ack=1 Win=64256 Len=2848 TSval=2009106421 TSecr=1040232917","","","","",""
"1639","26.506621627","10.10.3.105","10.10.3.59","MPTCP","1516","56709  >  5201 [ACK] Seq=1 Ack=1 Win=64256 Len=1424 TSval=938361752 TSecr=1400341110","","","","",""
"1640","26.506663051","10.10.3.59","10.10.3.105","MPTCP","80","5201  >  56709 [ACK] Seq=1 Ack=1425 Win=86912 Len=0 TSval=1400341515 TSecr=938361752","0.000041424","","","",""
"1641","26.506702543","10.10.3.105","10.10.3.59","MPTCP","1516","56709  >  5201 [ACK] Seq=1425 Ack=1 Win=64256 Len=1424 TSval=938361752 TSecr=1400341110","","","","",""
"1642","26.506715433","10.10.3.59","10.10.3.105","MPTCP","80","5201  >  56709 [ACK] Seq=1 Ack=2849 Win=86912 Len=0 TSval=1400341516 TSecr=938361752","0.000012890","","","",""
"1643","26.506734026","10.10.3.105","10.10.3.59","MPTCP","1516","56709  >  5201 [ACK] Seq=2849 Ack=1 Win=64256 Len=1424 TSval=938361752 TSecr=1400341110","","","","",""
"1644","26.506743080","10.10.3.59","10.10.3.105","MPTCP","80","5201  >  56709 [ACK] Seq=1 Ack=4273 Win=86912 Len=0 TSval=1400341516 TSecr=938361752","0.000009054","","","",""
"1645","26.518886347","10.10.3.105","10.10.3.59","MPTCP","1516","56709  >  5201 [ACK] Seq=4273 Ack=1 Win=64256 Len=1424 TSval=938361752 TSecr=1400341110","","","","",""
"1646","26.518928673","10.10.3.59","10.10.3.105","MPTCP","80","5201  >  56709 [ACK] Seq=1 Ack=5697 Win=86912 Len=0 TSval=1400341528 TSecr=938361752","0.000042326","","","",""
"1647","26.526685906","10.10.3.105","10.10.3.59","MPTCP","1516","56709  >  5201 [PSH, ACK] Seq=5697 Ack=1 Win=64256 Len=1424 TSval=938361752 TSecr=1400341110","","","","",""
"1648","26.526728773","10.10.3.59","10.10.3.105","MPTCP","80","5201  >  56709 [ACK] Seq=1 Ack=7121 Win=86912 Len=0 TSval=1400341536 TSecr=938361752","0.000042867","","","",""
"1649","26.535698250","10.10.3.105","10.10.3.59","MPTCP","1516","56709  >  5201 [ACK] Seq=7121 Ack=1 Win=64256 Len=1424 TSval=938361752 TSecr=1400341110","","","","",""
"1650","26.535731695","10.10.3.59","10.10.3.105","MPTCP","80","5201  >  56709 [ACK] Seq=1 Ack=8545 Win=86912 Len=0 TSval=1400341545 TSecr=938361752","0.000033445","","","",""
"1651","26.546239435","10.10.3.105","10.10.3.59","MPTCP","1516","56709  >  5201 [ACK] Seq=8545 Ack=1 Win=64256 Len=1424 TSval=938361752 TSecr=1400341110","","","","",""
"1652","26.546268753","10.10.3.59","10.10.3.105","MPTCP","80","5201  >  56709 [ACK] Seq=1 Ack=9969 Win=86912 Len=0 TSval=1400341555 TSecr=938361752","0.000029318","","","",""
"1653","26.561568514","10.10.3.105","10.10.3.59","MPTCP","1516","56709  >  5201 [ACK] Seq=9969 Ack=1 Win=64256 Len=1424 TSval=938361752 TSecr=1400341110","","","","",""
"1654","26.561595960","10.10.3.59","10.10.3.105","MPTCP","80","5201  >  56709 [ACK] Seq=1 Ack=11393 Win=87296 Len=0 TSval=1400341570 TSecr=938361752","0.000027446","","","",""
"1655","26.570319037","10.10.3.105","10.10.3.59","MPTCP","1148","56709  >  5201 [PSH, ACK] Seq=11393 Ack=1 Win=64256 Len=1056 TSval=938361752 TSecr=1400341110","","","","",""
"1656","26.570334694","10.10.3.59","10.10.3.105","MPTCP","80","5201  >  56709 [ACK] Seq=1 Ack=12449 Win=90112 Len=0 TSval=1400341579 TSecr=938361752","0.000015657","","","",""
"1664","26.604082655","10.10.3.105","10.10.3.59","MPTCP","1148","[TCP Spurious Retransmission] 56709  >  5201 [PSH, ACK] Seq=11393 Ack=1 Win=64256 Len=1056 TSval=938361765 TSecr=1400341110","","","","â\234\223","â\234\223"
"1665","26.604100533","10.10.3.59","10.10.3.105","MPTCP","92","[TCP Dup ACK 1656#1] 5201  >  56709 [ACK] Seq=1 Ack=12449 Win=90112 Len=0 TSval=1400341613 TSecr=938361765 SLE=11393 SRE=12449","0.000017878","","â\234\223","","â\234\223"
"1666","26.613015730","10.10.3.105","10.10.3.59","MPTCP","1516","56709  >  5201 [ACK] Seq=12449 Ack=1 Win=64256 Len=1424 TSval=938361849 TSecr=1400341515","","","","",""
"1667","26.613041072","10.10.3.59","10.10.3.105","MPTCP","80","5201  >  56709 [ACK] Seq=1 Ack=13873 Win=93056 Len=0 TSval=1400341622 TSecr=938361849","0.000025342","","","",""
"1668","26.620205649","10.10.3.105","10.10.3.59","MPTCP","1516","56709  >  5201 [PSH, ACK] Seq=13873 Ack=1 Win=64256 Len=1424 TSval=938361849 TSecr=1400341515","","","","",""
"1669","26.620235637","10.10.3.59","10.10.3.105","MPTCP","80","5201  >  56709 [ACK] Seq=1 Ack=15297 Win=96000 Len=0 TSval=1400341629 TSecr=938361849","0.000029988","","","",""
"1670","26.656349522","10.10.3.105","10.10.3.59","MPTCP","1516","56709  >  5201 [ACK] Seq=15297 Ack=1 Win=64256 Len=1424 TSval=938361886 TSecr=1400341516","","","","",""
"1671","26.656396126","10.10.3.59","10.10.3.105","MPTCP","80","5201  >  56709 [ACK] Seq=1 Ack=16721 Win=98816 Len=0 TSval=1400341665 TSecr=938361886","0.000046604","","","",""
"1672","26.657960727","10.10.3.105","10.10.3.59","MPTCP","1516","56709  >  5201 [PSH, ACK] Seq=16721 Ack=1 Win=64256 Len=1424 TSval=938361886 TSecr=1400341516","","","","",""
"1673","26.657985811","10.10.3.59","10.10.3.105","MPTCP","80","5201  >  56709 [ACK] Seq=1 Ack=18145 Win=101760 Len=0 TSval=1400341667 TSecr=938361886","0.000025084","","","",""
"1674","26.658005589","10.10.3.105","10.10.3.59","MPTCP","1516","56709  >  5201 [ACK] Seq=18145 Ack=1 Win=64256 Len=1424 TSval=938361887 TSecr=1400341516","","","","",""
"1675","26.658015933","10.10.3.59","10.10.3.105","MPTCP","80","5201  >  56709 [ACK] Seq=1 Ack=19569 Win=104576 Len=0 TSval=1400341667 TSecr=938361887","0.000010344","","","",""
"1676","26.658028061","10.10.3.105","10.10.3.59","MPTCP","1516","56709  >  5201 [PSH, ACK] Seq=19569 Ack=1 Win=64256 Len=1424 TSval=938361887 TSecr=1400341516","","","","",""
"1677","26.658035929","10.10.3.59","10.10.3.105","MPTCP","80","5201  >  56709 [ACK] Seq=1 Ack=20993 Win=107520 Len=0 TSval=1400341667 TSecr=938361887","0.000007868","","","",""
"1678","26.682033375","10.10.3.105","10.10.3.59","MPTCP","1516","56709  >  5201 [ACK] Seq=20993 Ack=1 Win=64256 Len=1424 TSval=938361940 TSecr=1400341528","","","","",""
"1679","26.682053662","10.10.3.59","10.10.3.105","MPTCP","80","5201  >  56709 [ACK] Seq=1 Ack=22417 Win=110464 Len=0 TSval=1400341691 TSecr=938361940","0.000020287","","","",""
"1680","26.682074069","10.10.3.105","10.10.3.59","MPTCP","1516","56709  >  5201 [PSH, ACK] Seq=22417 Ack=1 Win=64256 Len=1424 TSval=938361940 TSecr=1400341528","","","","",""
"1681","26.682078471","10.10.3.59","10.10.3.105","MPTCP","80","5201  >  56709 [ACK] Seq=1 Ack=23841 Win=113280 Len=0 TSval=1400341691 TSecr=938361940","0.000004402","","","",""
"1682","26.686885062","10.10.3.102","10.10.3.105","MPTCP","80","5201  >  35070 [ACK] Seq=1 Ack=17126 Win=63488 Len=0 TSval=1040233118 TSecr=2009106420","0.200091529","","","",""
"1683","26.686889932","10.10.3.102","10.10.3.105","MPTCP","80","5201  >  35070 [ACK] Seq=1 Ack=19974 Win=61440 Len=0 TSval=1040233118 TSecr=2009106420","0.200095744","","","",""
"1684","26.686890478","10.10.3.102","10.10.3.105","MPTCP","80","5201  >  35070 [ACK] Seq=1 Ack=22822 Win=59392 Len=0 TSval=1040233118 TSecr=2009106420","0.200096127","","","",""
"1685","26.686891831","10.10.3.102","10.10.3.105","MPTCP","80","5201  >  35070 [ACK] Seq=1 Ack=25670 Win=57344 Len=0 TSval=1040233118 TSecr=2009106420","0.200097359","","","",""
"1686","26.686923487","10.10.3.102","10.10.3.105","MPTCP","80","5201  >  35070 [ACK] Seq=1 Ack=28518 Win=55296 Len=0 TSval=1040233118 TSecr=2009106421","0.200012390","","","",""
"1687","26.686933082","10.10.3.102","10.10.3.105","MPTCP","80","5201  >  35070 [ACK] Seq=1 Ack=31366 Win=53248 Len=0 TSval=1040233118 TSecr=2009106421","0.200021730","","","",""
"1688","26.687006719","10.10.3.102","10.10.3.105","MPTCP","80","5201  >  35070 [ACK] Seq=1 Ack=34214 Win=69888 Len=0 TSval=1040233118 TSecr=2009106421","0.200015624","","","",""
"1689","26.687068348","10.10.3.102","10.10.3.105","MPTCP","80","5201  >  35070 [ACK] Seq=1 Ack=37062 Win=75520 Len=0 TSval=1040233118 TSecr=2009106421","0.200014427","","","",""
"1690","26.687162134","10.10.3.102","10.10.3.105","MPTCP","80","5201  >  35070 [ACK] Seq=1 Ack=39910 Win=81280 Len=0 TSval=1040233118 TSecr=2009106421","0.200015111","","","",""
"1691","26.687233748","10.10.3.102","10.10.3.105","MPTCP","80","5201  >  35070 [ACK] Seq=1 Ack=42758 Win=86912 Len=0 TSval=1040233118 TSecr=2009106421","0.200015311","","","",""
"1692","26.687296340","10.10.3.105","10.10.3.102","MPTCP","2940","35070  >  5201 [PSH, ACK] Seq=42758 Ack=1 Win=64256 Len=2848 TSval=2009106621 TSecr=1040233118","","","","",""
"1693","26.687346408","10.10.3.105","10.10.3.102","MPTCP","2940","35070  >  5201 [PSH, ACK] Seq=45606 Ack=1 Win=64256 Len=2848 TSval=2009106621 TSecr=1040233118","","","","",""
"1694","26.687375170","10.10.3.105","10.10.3.102","MPTCP","2940","35070  >  5201 [PSH, ACK] Seq=48454 Ack=1 Win=64256 Len=2848 TSval=2009106621 TSecr=1040233118","","","","",""
"1695","26.687472338","10.10.3.105","10.10.3.102","MPTCP","2940","35070  >  5201 [PSH, ACK] Seq=51302 Ack=1 Win=64256 Len=2848 TSval=2009106621 TSecr=1040233118","","","","",""
"1697","26.687570623","10.10.3.105","10.10.3.102","MPTCP","2940","35070  >  5201 [PSH, ACK] Seq=54150 Ack=1 Win=64256 Len=2848 TSval=2009106621 TSecr=1040233118","","","","",""
"1698","26.687647561","10.10.3.105","10.10.3.102","MPTCP","2940","35070  >  5201 [PSH, ACK] Seq=56998 Ack=1 Win=64256 Len=2848 TSval=2009106621 TSecr=1040233118","","","","",""
"1699","26.687745938","10.10.3.105","10.10.3.102","MPTCP","2940","35070  >  5201 [PSH, ACK] Seq=59846 Ack=1 Win=64256 Len=2848 TSval=2009106621 TSecr=1040233118","","","","",""
"1700","26.687832611","10.10.3.105","10.10.3.102","MPTCP","2716","35070  >  5201 [PSH, ACK] Seq=62694 Ack=1 Win=64256 Len=2624 TSval=2009106622 TSecr=1040233118","","","","",""
"1703","26.699765124","10.10.3.105","10.10.3.59","MPTCP","1516","56709  >  5201 [ACK] Seq=23841 Ack=1 Win=64256 Len=1424 TSval=938361943 TSecr=1400341536","","","","",""
"1704","26.699786610","10.10.3.59","10.10.3.105","MPTCP","80","5201  >  56709 [ACK] Seq=1 Ack=25265 Win=130560 Len=0 TSval=1400341709 TSecr=938361943","0.000021486","","","",""
"1705","26.704094948","10.10.3.105","10.10.3.59","MPTCP","1516","56709  >  5201 [PSH, ACK] Seq=25265 Ack=1 Win=64256 Len=1424 TSval=938361943 TSecr=1400341536","","","","",""
"1706","26.704117205","10.10.3.59","10.10.3.105","MPTCP","80","5201  >  56709 [ACK] Seq=1 Ack=26689 Win=129280 Len=0 TSval=1400341713 TSecr=938361943","0.000022257","","","",""
"1707","26.711368951","10.10.3.105","10.10.3.59","MPTCP","1516","56709  >  5201 [ACK] Seq=26689 Ack=1 Win=64256 Len=1424 TSval=938361944 TSecr=1400341545","","","","",""
"1708","26.711391745","10.10.3.59","10.10.3.105","MPTCP","80","5201  >  56709 [ACK] Seq=1 Ack=28113 Win=127872 Len=0 TSval=1400341720 TSecr=938361944","0.000022794","","","",""
"1709","26.723197572","10.10.3.105","10.10.3.59","MPTCP","1516","56709  >  5201 [PSH, ACK] Seq=28113 Ack=1 Win=64256 Len=1424 TSval=938361944 TSecr=1400341545","","","","",""
"1710","26.723219505","10.10.3.59","10.10.3.105","MPTCP","80","5201  >  56709 [ACK] Seq=1 Ack=29537 Win=126464 Len=0 TSval=1400341732 TSecr=938361944","0.000021933","","","",""
"1711","26.735003187","10.10.3.105","10.10.3.59","MPTCP","1516","56709  >  5201 [ACK] Seq=29537 Ack=1 Win=64256 Len=1424 TSval=938361951 TSecr=1400341555","","","","",""
"1712","26.735030616","10.10.3.59","10.10.3.105","MPTCP","80","5201  >  56709 [ACK] Seq=1 Ack=30961 Win=127744 Len=0 TSval=1400341744 TSecr=938361951","0.000027429","","","",""
"1713","26.746347358","10.10.3.105","10.10.3.59","MPTCP","1516","56709  >  5201 [PSH, ACK] Seq=30961 Ack=1 Win=64256 Len=1424 TSval=938361951 TSecr=1400341555","","","","",""
"1714","26.746374714","10.10.3.59","10.10.3.105","MPTCP","80","5201  >  56709 [ACK] Seq=1 Ack=32385 Win=130688 Len=0 TSval=1400341755 TSecr=938361951","0.000027356","","","",""
"1715","26.758030497","10.10.3.105","10.10.3.59","MPTCP","1516","56709  >  5201 [ACK] Seq=32385 Ack=1 Win=64256 Len=1424 TSval=938361953 TSecr=1400341555","","","","",""
"1716","26.758064200","10.10.3.59","10.10.3.105","MPTCP","80","5201  >  56709 [ACK] Seq=1 Ack=33809 Win=133632 Len=0 TSval=1400341767 TSecr=938361953","0.000033703","","","",""
"1717","26.770071428","10.10.3.105","10.10.3.59","MPTCP","1516","56709  >  5201 [ACK] Seq=33809 Ack=1 Win=64256 Len=1424 TSval=938361954 TSecr=1400341570","","","","",""
"1718","26.770109901","10.10.3.59","10.10.3.105","MPTCP","80","5201  >  56709 [ACK] Seq=1 Ack=35233 Win=136448 Len=0 TSval=1400341779 TSecr=938361954","0.000038473","","","",""
"1719","26.782139641","10.10.3.105","10.10.3.59","MPTCP","1516","56709  >  5201 [PSH, ACK] Seq=35233 Ack=1 Win=64256 Len=1424 TSval=938361954 TSecr=1400341570","","","","",""
"1720","26.782194263","10.10.3.59","10.10.3.105","MPTCP","80","5201  >  56709 [ACK] Seq=1 Ack=36657 Win=139392 Len=0 TSval=1400341791 TSecr=938361954","0.000054622","","","",""
"1726","26.808127153","10.10.3.105","10.10.3.59","MPTCP","1516","56709  >  5201 [ACK] Seq=36657 Ack=1 Win=64256 Len=1424 TSval=938361955 TSecr=1400341579","","","","",""
"1727","26.808182183","10.10.3.59","10.10.3.105","MPTCP","80","5201  >  56709 [ACK] Seq=1 Ack=38081 Win=142336 Len=0 TSval=1400341817 TSecr=938361955","0.000055030","","","",""
"1728","26.810839410","10.10.3.105","10.10.3.59","MPTCP","1516","56709  >  5201 [PSH, ACK] Seq=38081 Ack=1 Win=64256 Len=1424 TSval=938361955 TSecr=1400341579","","","","",""
"1729","26.810894745","10.10.3.59","10.10.3.105","MPTCP","80","5201  >  56709 [ACK] Seq=1 Ack=39505 Win=145152 Len=0 TSval=1400341820 TSecr=938361955","0.000055335","","","",""
"1730","26.818347298","10.10.3.105","10.10.3.59","MPTCP","1516","56709  >  5201 [ACK] Seq=39505 Ack=1 Win=64256 Len=1424 TSval=938361977 TSecr=1400341622","","","","",""
"1731","26.818402168","10.10.3.59","10.10.3.105","MPTCP","80","5201  >  56709 [ACK] Seq=1 Ack=40929 Win=148096 Len=0 TSval=1400341827 TSecr=938361977","0.000054870","","","",""
"1732","26.830998713","10.10.3.105","10.10.3.59","MPTCP","1516","56709  >  5201 [PSH, ACK] Seq=40929 Ack=1 Win=64256 Len=1424 TSval=938361977 TSecr=1400341622","","","","",""
"1733","26.831051975","10.10.3.59","10.10.3.105","MPTCP","80","5201  >  56709 [ACK] Seq=1 Ack=42353 Win=150912 Len=0 TSval=1400341840 TSecr=938361977","0.000053262","","","",""
"1734","26.848083252","10.10.3.105","10.10.3.59","MPTCP","1516","56709  >  5201 [ACK] Seq=42353 Ack=1 Win=64256 Len=1424 TSval=938361977 TSecr=1400341665","","","","",""
"1735","26.848130029","10.10.3.59","10.10.3.105","MPTCP","80","5201  >  56709 [ACK] Seq=1 Ack=43777 Win=153856 Len=0 TSval=1400341857 TSecr=938361977","0.000046777","","","",""
"1736","26.855108841","10.10.3.105","10.10.3.59","MPTCP","1516","56709  >  5201 [PSH, ACK] Seq=43777 Ack=1 Win=64256 Len=1424 TSval=938361977 TSecr=1400341665","","","","",""
"1737","26.855154825","10.10.3.59","10.10.3.105","MPTCP","80","5201  >  56709 [ACK] Seq=1 Ack=45201 Win=156800 Len=0 TSval=1400341864 TSecr=938361977","0.000045984","","","",""
"1738","26.871767382","10.10.3.105","10.10.3.59","MPTCP","1516","56709  >  5201 [ACK] Seq=45201 Ack=1 Win=64256 Len=1424 TSval=938361977 TSecr=1400341665","","","","",""
"1739","26.871820696","10.10.3.59","10.10.3.105","MPTCP","80","5201  >  56709 [ACK] Seq=1 Ack=46625 Win=159616 Len=0 TSval=1400341881 TSecr=938361977","0.000053314","","","",""
"1740","26.877187008","10.10.3.105","10.10.3.59","MPTCP","1516","56709  >  5201 [PSH, ACK] Seq=46625 Ack=1 Win=64256 Len=1424 TSval=938361977 TSecr=1400341665","","","","",""
"1741","26.877216564","10.10.3.59","10.10.3.105","MPTCP","80","5201  >  56709 [ACK] Seq=1 Ack=48049 Win=162560 Len=0 TSval=1400341886 TSecr=938361977","0.000029556","","","",""
"1742","26.887332238","10.10.3.102","10.10.3.105","MPTCP","80","5201  >  35070 [ACK] Seq=1 Ack=45606 Win=110336 Len=0 TSval=1040233318 TSecr=2009106621","0.200035898","","","",""
"1743","26.887359613","10.10.3.102","10.10.3.105","MPTCP","80","5201  >  35070 [ACK] Seq=1 Ack=48454 Win=107648 Len=0 TSval=1040233318 TSecr=2009106621","0.200013205","","","",""
"1744","26.887386328","10.10.3.102","10.10.3.105","MPTCP","80","5201  >  35070 [ACK] Seq=1 Ack=51302 Win=104832 Len=0 TSval=1040233318 TSecr=2009106621","0.200011158","","","",""
"1745","26.887483258","10.10.3.102","10.10.3.105","MPTCP","80","5201  >  35070 [ACK] Seq=1 Ack=54150 Win=109696 Len=0 TSval=1040233318 TSecr=2009106621","0.200010920","","","",""
"1746","26.887581781","10.10.3.102","10.10.3.105","MPTCP","80","5201  >  35070 [ACK] Seq=1 Ack=56998 Win=115456 Len=0 TSval=1040233318 TSecr=2009106621","0.200011158","","","",""
"1747","26.887658124","10.10.3.102","10.10.3.105","MPTCP","80","5201  >  35070 [ACK] Seq=1 Ack=59846 Win=121088 Len=0 TSval=1040233318 TSecr=2009106621","0.200010563","","","",""
"1748","26.887756464","10.10.3.102","10.10.3.105","MPTCP","80","5201  >  35070 [ACK] Seq=1 Ack=62694 Win=126848 Len=0 TSval=1040233319 TSecr=2009106621","0.200010526","","","",""
"1749","26.887849842","10.10.3.102","10.10.3.105","MPTCP","80","5201  >  35070 [ACK] Seq=1 Ack=65318 Win=132096 Len=0 TSval=1040233319 TSecr=2009106622","0.200017231","","","",""
"1756","26.897249878","10.10.3.105","10.10.3.59","MPTCP","1516","56709  >  5201 [ACK] Seq=48049 Ack=1 Win=64256 Len=1424 TSval=938361979 TSecr=1400341667","","","","",""
"1757","26.897275413","10.10.3.59","10.10.3.105","MPTCP","80","5201  >  56709 [ACK] Seq=1 Ack=49473 Win=165504 Len=0 TSval=1400341906 TSecr=938361979","0.000025535","","","",""
"1758","26.902546868","10.10.3.105","10.10.3.59","MPTCP","1516","56709  >  5201 [PSH, ACK] Seq=49473 Ack=1 Win=64256 Len=1424 TSval=938361979 TSecr=1400341667","","","","",""
"1759","26.902577065","10.10.3.59","10.10.3.105","MPTCP","80","5201  >  56709 [ACK] Seq=1 Ack=50897 Win=168320 Len=0 TSval=1400341911 TSecr=938361979","0.000030197","","","",""
"1760","26.906483448","10.10.3.105","10.10.3.102","MPTCP","2940","35070  >  5201 [PSH, ACK] Seq=65318 Ack=1 Win=64256 Len=2848 TSval=2009106840 TSecr=1040233319","","","","",""
"1761","26.906483816","10.10.3.105","10.10.3.102","MPTCP","1612","35070  >  5201 [PSH, ACK] Seq=68166 Ack=1 Win=64256 Len=1520 TSval=2009106840 TSecr=1040233319","","","","",""
"1762","26.915878544","10.10.3.105","10.10.3.59","MPTCP","1516","56709  >  5201 [ACK] Seq=50897 Ack=1 Win=64256 Len=1424 TSval=938361979 TSecr=1400341691","","","","",""
"1763","26.915907350","10.10.3.59","10.10.3.105","MPTCP","80","5201  >  56709 [ACK] Seq=1 Ack=52321 Win=171264 Len=0 TSval=1400341925 TSecr=938361979","0.000028806","","","",""
"1764","26.927849537","10.10.3.105","10.10.3.59","MPTCP","1516","56709  >  5201 [PSH, ACK] Seq=52321 Ack=1 Win=64256 Len=1424 TSval=938361979 TSecr=1400341691","","","","",""
"1765","26.927877789","10.10.3.59","10.10.3.105","MPTCP","80","5201  >  56709 [ACK] Seq=1 Ack=53745 Win=174080 Len=0 TSval=1400341937 TSecr=938361979","0.000028252","","","",""
"1766","26.929107398","10.10.3.105","10.10.3.102","MPTCP","2940","35070  >  5201 [PSH, ACK] Seq=69686 Ack=1 Win=64256 Len=2848 TSval=2009106863 TSecr=1040233319","","","","",""
"1767","26.929164678","10.10.3.105","10.10.3.102","MPTCP","1516","35070  >  5201 [ACK] Seq=72534 Ack=1 Win=64256 Len=1424 TSval=2009106863 TSecr=1040233319","","","","",""
"1768","26.936351093","10.10.3.105","10.10.3.59","MPTCP","1516","56709  >  5201 [ACK] Seq=53745 Ack=1 Win=64256 Len=1424 TSval=938361979 TSecr=1400341691","","","","",""
"1769","26.936390033","10.10.3.59","10.10.3.105","MPTCP","80","5201  >  56709 [ACK] Seq=1 Ack=55169 Win=177024 Len=0 TSval=1400341945 TSecr=938361979","0.000038940","","","",""
"1770","26.937454090","10.10.3.105","10.10.3.102","MPTCP","188","35070  >  5201 [PSH, ACK] Seq=73958 Ack=1 Win=64256 Len=96 TSval=2009106871 TSecr=1040233319","","","","",""
"1771","26.937454614","10.10.3.105","10.10.3.102","MPTCP","2940","35070  >  5201 [PSH, ACK] Seq=74054 Ack=1 Win=64256 Len=2848 TSval=2009106871 TSecr=1040233319","","","","",""
"1772","26.937546846","10.10.3.105","10.10.3.102","MPTCP","1484","35070  >  5201 [PSH, ACK] Seq=76902 Ack=1 Win=64256 Len=1392 TSval=2009106871 TSecr=1040233319","","","","",""
"1773","26.937547035","10.10.3.105","10.10.3.102","MPTCP","2940","35070  >  5201 [PSH, ACK] Seq=78294 Ack=1 Win=64256 Len=2848 TSval=2009106871 TSecr=1040233319","","","","",""
"1774","26.937613693","10.10.3.105","10.10.3.102","MPTCP","1516","35070  >  5201 [ACK] Seq=81142 Ack=1 Win=64256 Len=1424 TSval=2009106871 TSecr=1040233319","","","","",""
"1775","26.939246123","10.10.3.105","10.10.3.102","MPTCP","188","35070  >  5201 [PSH, ACK] Seq=82566 Ack=1 Win=64256 Len=96 TSval=2009106873 TSecr=1040233319","","","","",""
"1776","26.939246665","10.10.3.105","10.10.3.102","MPTCP","2940","35070  >  5201 [PSH, ACK] Seq=82662 Ack=1 Win=64256 Len=2848 TSval=2009106873 TSecr=1040233319","","","","",""
"1777","26.939246784","10.10.3.105","10.10.3.102","MPTCP","2940","35070  >  5201 [PSH, ACK] Seq=85510 Ack=1 Win=64256 Len=2848 TSval=2009106873 TSecr=1040233319","","","","",""
"1778","26.939246879","10.10.3.105","10.10.3.102","MPTCP","2940","35070  >  5201 [PSH, ACK] Seq=88358 Ack=1 Win=64256 Len=2848 TSval=2009106873 TSecr=1040233319","","","","",""
"1779","26.940081756","10.10.3.105","10.10.3.102","MPTCP","156","35070  >  5201 [PSH, ACK] Seq=91206 Ack=1 Win=64256 Len=64 TSval=2009106874 TSecr=1040233319","","","","",""
"1780","26.940082302","10.10.3.105","10.10.3.102","MPTCP","2940","35070  >  5201 [PSH, ACK] Seq=91270 Ack=1 Win=64256 Len=2848 TSval=2009106874 TSecr=1040233319","","","","",""
"1781","26.940082390","10.10.3.105","10.10.3.102","MPTCP","2940","35070  >  5201 [PSH, ACK] Seq=94118 Ack=1 Win=64256 Len=2848 TSval=2009106874 TSecr=1040233319","","","","",""
"1782","26.940082476","10.10.3.105","10.10.3.102","MPTCP","2940","35070  >  5201 [PSH, ACK] Seq=96966 Ack=1 Win=64256 Len=2848 TSval=2009106874 TSecr=1040233319","","","","",""
"1783","26.940082560","10.10.3.105","10.10.3.102","MPTCP","156","35070  >  5201 [PSH, ACK] Seq=99814 Ack=1 Win=64256 Len=64 TSval=2009106874 TSecr=1040233319","","","","",""
"1784","26.940168599","10.10.3.105","10.10.3.102","MPTCP","2940","35070  >  5201 [PSH, ACK] Seq=99878 Ack=1 Win=64256 Len=2848 TSval=2009106874 TSecr=1040233319","","","","",""
"1785","26.940203277","10.10.3.105","10.10.3.102","MPTCP","1516","35070  >  5201 [ACK] Seq=102726 Ack=1 Win=64256 Len=1424 TSval=2009106874 TSecr=1040233319","","","","",""
"1786","26.948433186","10.10.3.105","10.10.3.59","MPTCP","1516","56709  >  5201 [ACK] Seq=55169 Ack=1 Win=64256 Len=1424 TSval=938361979 TSecr=1400341691","","","","",""
"1787","26.948477866","10.10.3.59","10.10.3.105","MPTCP","80","5201  >  56709 [ACK] Seq=1 Ack=56593 Win=207744 Len=0 TSval=1400341957 TSecr=938361979","0.000044680","","","",""
"1788","26.960806432","10.10.3.105","10.10.3.59","MPTCP","1516","56709  >  5201 [PSH, ACK] Seq=56593 Ack=1 Win=64256 Len=1424 TSval=938361979 TSecr=1400341691","","","","",""
"1789","26.960852001","10.10.3.59","10.10.3.105","MPTCP","80","5201  >  56709 [ACK] Seq=1 Ack=58017 Win=206464 Len=0 TSval=1400341970 TSecr=938361979","0.000045569","","","",""
"1790","26.961615356","10.10.3.105","10.10.3.102","MPTCP","188","35070  >  5201 [PSH, ACK] Seq=104150 Ack=1 Win=64256 Len=96 TSval=2009106895 TSecr=1040233319","","","","",""
"1791","26.978594682","10.10.3.105","10.10.3.59","MPTCP","1516","56709  >  5201 [ACK] Seq=58017 Ack=1 Win=64256 Len=1424 TSval=938361979 TSecr=1400341691","","","","",""
"1792","26.978641246","10.10.3.59","10.10.3.105","MPTCP","80","5201  >  56709 [ACK] Seq=1 Ack=59441 Win=205056 Len=0 TSval=1400341987 TSecr=938361979","0.000046564","","","",""
"1793","26.989629405","10.10.3.105","10.10.3.59","MPTCP","1516","56709  >  5201 [ACK] Seq=59441 Ack=1 Win=64256 Len=1424 TSval=938361988 TSecr=1400341691","","","","",""
"1794","26.989675204","10.10.3.59","10.10.3.105","MPTCP","80","5201  >  56709 [ACK] Seq=1 Ack=60865 Win=203648 Len=0 TSval=1400341998 TSecr=938361988","0.000045799","","","",""
"1799","27.000898615","10.10.3.105","10.10.3.59","MPTCP","1516","56709  >  5201 [PSH, ACK] Seq=60865 Ack=1 Win=64256 Len=1424 TSval=938361988 TSecr=1400341691","","","","",""
"1800","27.000945676","10.10.3.59","10.10.3.105","MPTCP","80","5201  >  56709 [ACK] Seq=1 Ack=62289 Win=202240 Len=0 TSval=1400342010 TSecr=938361988","0.000047061","","","",""
"1801","27.009502271","10.10.3.105","10.10.3.59","MPTCP","1516","56709  >  5201 [ACK] Seq=62289 Ack=1 Win=64256 Len=1424 TSval=938361989 TSecr=1400341709","","","","",""
"1802","27.009549438","10.10.3.59","10.10.3.105","MPTCP","80","5201  >  56709 [ACK] Seq=1 Ack=63713 Win=207744 Len=0 TSval=1400342018 TSecr=938361989","0.000047167","","","",""
"1803","27.012644959","10.10.3.105","10.10.3.102","MPTCP","2940","35070  >  5201 [PSH, ACK] Seq=104246 Ack=1 Win=64256 Len=2848 TSval=2009106946 TSecr=1040233319","","","","",""
"1804","27.012645557","10.10.3.105","10.10.3.102","MPTCP","2940","35070  >  5201 [PSH, ACK] Seq=107094 Ack=1 Win=64256 Len=2848 TSval=2009106946 TSecr=1040233319","","","","",""
"1805","27.012645675","10.10.3.105","10.10.3.102","MPTCP","1516","35070  >  5201 [PSH, ACK] Seq=109942 Ack=1 Win=64256 Len=1424 TSval=2009106946 TSecr=1040233319","","","","",""
"1806","27.027262912","10.10.3.105","10.10.3.59","MPTCP","1516","56709  >  5201 [PSH, ACK] Seq=63713 Ack=1 Win=64256 Len=1424 TSval=938361989 TSecr=1400341709","","","","",""
"1807","27.027310537","10.10.3.59","10.10.3.105","MPTCP","80","5201  >  56709 [ACK] Seq=1 Ack=65137 Win=222080 Len=0 TSval=1400342036 TSecr=938361989","0.000047625","","","",""
"1808","27.028289466","10.10.3.105","10.10.3.102","MPTCP","2940","35070  >  5201 [PSH, ACK] Seq=111366 Ack=1 Win=64256 Len=2848 TSval=2009106962 TSecr=1040233319","","","","",""
"1809","27.038258852","10.10.3.105","10.10.3.59","MPTCP","1516","56709  >  5201 [ACK] Seq=65137 Ack=1 Win=64256 Len=1424 TSval=938361989 TSecr=1400341713","","","","",""
"1810","27.038305434","10.10.3.59","10.10.3.105","MPTCP","80","5201  >  56709 [ACK] Seq=1 Ack=66561 Win=227712 Len=0 TSval=1400342047 TSecr=938361989","0.000046582","","","",""
"1811","27.046277014","10.10.3.105","10.10.3.59","MPTCP","1516","56709  >  5201 [PSH, ACK] Seq=66561 Ack=1 Win=64256 Len=1424 TSval=938361989 TSecr=1400341713","","","","",""
"1812","27.046308949","10.10.3.59","10.10.3.105","MPTCP","80","5201  >  56709 [ACK] Seq=1 Ack=67985 Win=226432 Len=0 TSval=1400342055 TSecr=938361989","0.000031935","","","",""
"1813","27.058999665","10.10.3.105","10.10.3.59","MPTCP","1516","56709  >  5201 [ACK] Seq=67985 Ack=1 Win=64256 Len=1424 TSval=938361991 TSecr=1400341720","","","","",""
"1814","27.059035595","10.10.3.59","10.10.3.105","MPTCP","80","5201  >  56709 [ACK] Seq=1 Ack=69409 Win=225024 Len=0 TSval=1400342068 TSecr=938361991","0.000035930","","","",""
"1815","27.078866331","10.10.3.105","10.10.3.59","MPTCP","1516","56709  >  5201 [PSH, ACK] Seq=69409 Ack=1 Win=64256 Len=1424 TSval=938361991 TSecr=1400341720","","","","",""
"1816","27.078900096","10.10.3.59","10.10.3.105","MPTCP","80","5201  >  56709 [ACK] Seq=1 Ack=70833 Win=223616 Len=0 TSval=1400342088 TSecr=938361991","0.000033765","","","",""
"1817","27.082017206","10.10.3.105","10.10.3.59","MPTCP","1516","56709  >  5201 [ACK] Seq=70833 Ack=1 Win=64256 Len=1424 TSval=938361991 TSecr=1400341732","","","","",""
"1818","27.082035992","10.10.3.59","10.10.3.105","MPTCP","80","5201  >  56709 [ACK] Seq=1 Ack=72257 Win=222208 Len=0 TSval=1400342091 TSecr=938361991","0.000018786","","","",""
"1820","27.099761691","10.10.3.105","10.10.3.59","MPTCP","1516","56709  >  5201 [PSH, ACK] Seq=72257 Ack=1 Win=64256 Len=1424 TSval=938361991 TSecr=1400341732","","","","",""
"1821","27.099812366","10.10.3.59","10.10.3.105","MPTCP","80","5201  >  56709 [ACK] Seq=1 Ack=73681 Win=220800 Len=0 TSval=1400342109 TSecr=938361991","0.000050675","","","",""
"1822","27.105604884","10.10.3.62","10.10.3.102","MPTCP","88","[TCP Retransmission] [TCP Port numbers reused] 43617  >  5201 [SYN] Seq=0 Win=64256 Len=0 MSS=1460 SACK_PERM=1 TSval=3346274242 TSecr=0 WS=128","","","","â\234\223","â\234\223"
"1823","27.106581347","10.10.3.102","10.10.3.105","MPTCP","80","5201  >  35070 [ACK] Seq=1 Ack=68166 Win=168320 Len=0 TSval=1040233537 TSecr=2009106840","0.200097899","","","",""
"1824","27.106587386","10.10.3.102","10.10.3.105","MPTCP","80","5201  >  35070 [ACK] Seq=1 Ack=69686 Win=168320 Len=0 TSval=1040233537 TSecr=2009106840","0.200103570","","","",""
