"No.","Time","Source","Destination","Protocol","Length","Info","RTT","Lost Segement","Duplicate ","Retransmission","IDK"
"3039","99.373866350","10.10.3.105","10.10.3.102","MPTCP","80","53912  >  5201 [SYN] Seq=0 Win=64240 Len=0 MSS=1460 SACK_PERM=1 TSval=2009242427 TSecr=0 WS=128","","","","",""
"3040","99.373902801","10.10.3.102","10.10.3.105","MPTCP","88","5201  >  53912 [SYN, ACK] Seq=0 Ack=1 Win=65160 Len=0 MSS=1460 SACK_PERM=1 TSval=1040369325 TSecr=2009242427 WS=128","0.000036451","","","",""
"3072","99.574540293","10.10.3.105","10.10.3.102","MPTCP","88","53912  >  5201 [ACK] Seq=1 Ack=1 Win=64256 Len=0 TSval=2009242628 TSecr=1040369325","0.200637492","","","",""
"3073","99.574540513","10.10.3.105","10.10.3.102","MPTCP","129","53912  >  5201 [PSH, ACK] Seq=1 Ack=1 Win=64256 Len=37 TSval=2009242628 TSecr=1040369325","","","","",""
"3074","99.574605953","10.10.3.102","10.10.3.105","MPTCP","80","5201  >  53912 [ACK] Seq=1 Ack=38 Win=65152 Len=0 TSval=1040369526 TSecr=2009242628","0.000065440","","","",""
"3075","99.574678747","10.10.3.102","10.10.3.105","MPTCP","97","5201  >  53912 [PSH, ACK] Seq=1 Ack=38 Win=65152 Len=1 TSval=1040369526 TSecr=2009242628","","","","",""
"3076","99.574694337","10.10.3.102","10.10.3.105","MPTCP","84","[TCP Dup ACK 3074#1] 5201  >  53912 [ACK] Seq=2 Ack=38 Win=65152 Len=0 TSval=1040369526 TSecr=2009242628","","","â\234\223","","â\234\223"
"3077","99.576126389","10.10.3.62","10.10.3.102","MPTCP","88","54369  >  5201 [SYN] Seq=0 Win=64256 Len=0 MSS=1460 SACK_PERM=1 TSval=3346410034 TSecr=0 WS=128","","","","",""
"3078","99.576141268","10.10.3.102","10.10.3.62","MPTCP","92","5201  >  54369 [SYN, ACK] Seq=0 Ack=1 Win=65160 Len=0 MSS=1460 SACK_PERM=1 TSval=2493187808 TSecr=3346410034 WS=128","0.000014879","","","",""
"3079","99.587762473","10.10.3.62","10.10.3.102","MPTCP","92","54369  >  5201 [ACK] Seq=1 Ack=1 Win=64256 Len=0 TSval=3346410040 TSecr=2493187808","0.011621205","","","",""
"3080","99.587796140","10.10.3.102","10.10.3.62","MPTCP","80","[TCP Window Update] 5201  >  54369 [ACK] Seq=1 Ack=1 Win=65280 Len=0 TSval=2493187820 TSecr=3346410040","","","","","â\234\223"
"3084","99.774909270","10.10.3.105","10.10.3.102","MPTCP","80","53912  >  5201 [ACK] Seq=38 Ack=2 Win=64256 Len=0 TSval=2009242829 TSecr=1040369526","0.200230523","","","",""
"3085","99.774909466","10.10.3.105","10.10.3.102","MPTCP","76","[TCP Dup ACK 3084#1] 53912  >  5201 [ACK] Seq=38 Ack=2 Win=64256 Len=0 TSval=2009242829 TSecr=1040369526","","","â\234\223","","â\234\223"
"3086","99.775070624","10.10.3.105","10.10.3.102","MPTCP","100","53912  >  5201 [PSH, ACK] Seq=38 Ack=2 Win=64256 Len=4 TSval=2009242829 TSecr=1040369526","","","","",""
"3087","99.782269027","10.10.3.105","10.10.3.59","MPTCP","88","44971  >  5201 [SYN] Seq=0 Win=64256 Len=0 MSS=1460 SACK_PERM=1 TSval=938498161 TSecr=0 WS=128","","","","",""
"3088","99.817176511","10.10.3.102","10.10.3.105","MPTCP","80","5201  >  53912 [ACK] Seq=2 Ack=42 Win=65152 Len=0 TSval=1040369769 TSecr=2009242829","0.042105887","","","",""
"3089","99.982329737","10.10.3.59","10.10.3.105","MPTCP","92","5201  >  44971 [SYN, ACK] Seq=0 Ack=1 Win=65160 Len=0 MSS=1460 SACK_PERM=1 TSval=1400478112 TSecr=938498161 WS=128","0.200060710","","","",""
"3090","100.017640251","10.10.3.105","10.10.3.102","MPTCP","196","53912  >  5201 [PSH, ACK] Seq=42 Ack=2 Win=64256 Len=100 TSval=2009243071 TSecr=1040369769","","","","",""
"3091","100.017660397","10.10.3.102","10.10.3.105","MPTCP","80","5201  >  53912 [ACK] Seq=2 Ack=142 Win=65280 Len=0 TSval=1040369969 TSecr=2009243071","0.000020146","","","",""
"3092","100.017735230","10.10.3.102","10.10.3.105","MPTCP","97","5201  >  53912 [PSH, ACK] Seq=2 Ack=142 Win=65280 Len=1 TSval=1040369969 TSecr=2009243071","","","","",""
"3098","100.191412133","10.10.3.105","10.10.3.59","MPTCP","92","44971  >  5201 [ACK] Seq=1 Ack=1 Win=64256 Len=0 TSval=938498576 TSecr=1400478112","0.209082396","","","",""
"3109","100.218293275","10.10.3.105","10.10.3.102","MPTCP","80","53914  >  5201 [SYN] Seq=0 Win=64240 Len=0 MSS=1460 SACK_PERM=1 TSval=2009243272 TSecr=0 WS=128","","","","",""
"3110","100.218307691","10.10.3.102","10.10.3.105","MPTCP","88","5201  >  53914 [SYN, ACK] Seq=0 Ack=1 Win=65160 Len=0 MSS=1460 SACK_PERM=1 TSval=1040370170 TSecr=2009243272 WS=128","0.000014416","","","",""
"3111","100.221244222","10.10.3.102","10.10.3.62","MPTCP","97","5201  >  54369 [PSH, ACK] Seq=1 Ack=1 Win=65280 Len=1 TSval=2493188454 TSecr=3346410040","","","","",""
"3115","100.228304129","10.10.3.62","10.10.3.102","MPTCP","80","54369  >  5201 [ACK] Seq=1 Ack=2 Win=64256 Len=0 TSval=3346410683 TSecr=2493188454","0.007059907","","","",""
"3125","100.258853434","10.10.3.105","10.10.3.102","MPTCP","80","53912  >  5201 [ACK] Seq=142 Ack=3 Win=64256 Len=0 TSval=2009243313 TSecr=1040369969","0.241118204","","","",""
"3128","100.391520305","10.10.3.59","10.10.3.105","MPTCP","80","[TCP Window Update] 5201  >  44971 [ACK] Seq=1 Ack=1 Win=65280 Len=0 TSval=1400478521 TSecr=938498576","","","","","â\234\223"
"3134","100.418697606","10.10.3.105","10.10.3.102","MPTCP","88","53914  >  5201 [ACK] Seq=1 Ack=1 Win=64256 Len=0 TSval=2009243472 TSecr=1040370170","0.200389915","","","",""
"3135","100.418697903","10.10.3.105","10.10.3.102","MPTCP","129","53914  >  5201 [PSH, ACK] Seq=1 Ack=1 Win=64256 Len=37 TSval=2009243472 TSecr=1040370170","","","","",""
"3136","100.418766925","10.10.3.102","10.10.3.105","MPTCP","80","5201  >  53914 [ACK] Seq=1 Ack=38 Win=65152 Len=0 TSval=1040370370 TSecr=2009243472","0.000069022","","","",""
"3137","100.418865228","10.10.3.102","10.10.3.105","MPTCP","84","5201  >  53914 [ACK] Seq=1 Ack=38 Win=65152 Len=0 TSval=1040370370 TSecr=2009243472","","","","",""
"3138","100.419315824","10.10.3.62","10.10.3.102","MPTCP","88","49079  >  5201 [SYN] Seq=0 Win=64256 Len=0 MSS=1460 SACK_PERM=1 TSval=3346410878 TSecr=0 WS=128","","","","",""
"3139","100.419345458","10.10.3.102","10.10.3.62","MPTCP","92","5201  >  49079 [SYN, ACK] Seq=0 Ack=1 Win=65160 Len=0 MSS=1460 SACK_PERM=1 TSval=2493188652 TSecr=3346410878 WS=128","0.000029634","","","",""
"3140","100.419704181","10.10.3.102","10.10.3.105","MPTCP","97","5201  >  53912 [PSH, ACK] Seq=3 Ack=142 Win=65280 Len=1 TSval=1040370371 TSecr=2009243313","","","","",""
"3142","100.420982173","10.10.3.62","10.10.3.102","MPTCP","92","49079  >  5201 [ACK] Seq=1 Ack=1 Win=64256 Len=0 TSval=3346410880 TSecr=2493188652","0.001636715","","","",""
"3143","100.421051064","10.10.3.102","10.10.3.62","MPTCP","80","[TCP Window Update] 5201  >  49079 [ACK] Seq=1 Ack=1 Win=65280 Len=0 TSval=2493188653 TSecr=3346410880","","","","","â\234\223"
"3151","100.618973732","10.10.3.105","10.10.3.102","MPTCP","76","53914  >  5201 [ACK] Seq=38 Ack=1 Win=64256 Len=0 TSval=2009243673 TSecr=1040370370","","","","",""
"3152","100.619775896","10.10.3.105","10.10.3.102","MPTCP","80","53912  >  5201 [ACK] Seq=142 Ack=4 Win=64256 Len=0 TSval=2009243674 TSecr=1040370371","0.200071715","","","",""
"3153","100.619791087","10.10.3.102","10.10.3.105","MPTCP","97","5201  >  53912 [PSH, ACK] Seq=4 Ack=142 Win=65280 Len=1 TSval=1040370571 TSecr=2009243674","","","","",""
"3154","100.636983173","10.10.3.105","10.10.3.59","MPTCP","88","56407  >  5201 [SYN] Seq=0 Win=64256 Len=0 MSS=1460 SACK_PERM=1 TSval=938499005 TSecr=0 WS=128","","","","",""
"3157","100.820364167","10.10.3.105","10.10.3.102","MPTCP","80","53912  >  5201 [ACK] Seq=142 Ack=5 Win=64256 Len=0 TSval=2009243874 TSecr=1040370571","0.200573080","","","",""
"3158","100.820364799","10.10.3.105","10.10.3.102","MPTCP","2940","53914  >  5201 [PSH, ACK] Seq=38 Ack=1 Win=64256 Len=2848 TSval=2009243874 TSecr=1040370370","","","","",""
"3159","100.820430000","10.10.3.102","10.10.3.105","MPTCP","80","5201  >  53914 [ACK] Seq=1 Ack=2886 Win=63488 Len=0 TSval=1040370772 TSecr=2009243874","0.000065201","","","",""
"3160","100.820364945","10.10.3.105","10.10.3.102","MPTCP","2940","53914  >  5201 [PSH, ACK] Seq=2886 Ack=1 Win=64256 Len=2848 TSval=2009243874 TSecr=1040370370","","","","",""
"3161","100.820447444","10.10.3.102","10.10.3.105","MPTCP","80","5201  >  53914 [ACK] Seq=1 Ack=5734 Win=61440 Len=0 TSval=1040370772 TSecr=2009243874","0.000082499","","","",""
"3162","100.820365045","10.10.3.105","10.10.3.102","MPTCP","2940","53914  >  5201 [PSH, ACK] Seq=5734 Ack=1 Win=64256 Len=2848 TSval=2009243874 TSecr=1040370370","","","","",""
"3163","100.820458522","10.10.3.102","10.10.3.105","MPTCP","80","5201  >  53914 [ACK] Seq=1 Ack=8582 Win=59392 Len=0 TSval=1040370772 TSecr=2009243874","0.000093477","","","",""
"3164","100.820365150","10.10.3.105","10.10.3.102","MPTCP","2940","53914  >  5201 [PSH, ACK] Seq=8582 Ack=1 Win=64256 Len=2848 TSval=2009243874 TSecr=1040370370","","","","",""
"3165","100.820468939","10.10.3.102","10.10.3.105","MPTCP","80","5201  >  53914 [ACK] Seq=1 Ack=11430 Win=57344 Len=0 TSval=1040370772 TSecr=2009243874","0.000103789","","","",""
"3166","100.820481466","10.10.3.105","10.10.3.102","MPTCP","2940","53914  >  5201 [PSH, ACK] Seq=11430 Ack=1 Win=64256 Len=2848 TSval=2009243874 TSecr=1040370370","","","","",""
"3167","100.820490288","10.10.3.102","10.10.3.105","MPTCP","80","5201  >  53914 [ACK] Seq=1 Ack=14278 Win=55296 Len=0 TSval=1040370772 TSecr=2009243874","0.000008822","","","",""
"3168","100.837047970","10.10.3.59","10.10.3.105","MPTCP","92","5201  >  56407 [SYN, ACK] Seq=0 Ack=1 Win=65160 Len=0 MSS=1460 SACK_PERM=1 TSval=1400478966 TSecr=938499005 WS=128","0.200064797","","","",""
"3169","100.865181687","10.10.3.62","10.10.3.102","MPTCP","1516","49079  >  5201 [ACK] Seq=1 Ack=1 Win=64256 Len=1424 TSval=3346411280 TSecr=2493188653","","","","",""
"3170","100.865205396","10.10.3.102","10.10.3.62","MPTCP","80","5201  >  49079 [ACK] Seq=1 Ack=1425 Win=64128 Len=0 TSval=2493189098 TSecr=3346411280","0.000023709","","","",""
"3171","100.866114317","10.10.3.62","10.10.3.102","MPTCP","1516","49079  >  5201 [ACK] Seq=1425 Ack=1 Win=64256 Len=1424 TSval=3346411280 TSecr=2493188653","","","","",""
"3172","100.866138595","10.10.3.102","10.10.3.62","MPTCP","80","5201  >  49079 [ACK] Seq=1 Ack=2849 Win=64128 Len=0 TSval=2493189098 TSecr=3346411280","0.000024278","","","",""
"3173","100.876321672","10.10.3.62","10.10.3.102","MPTCP","700","49079  >  5201 [PSH, ACK] Seq=2849 Ack=1 Win=64256 Len=608 TSval=3346411280 TSecr=2493188653","","","","",""
"3174","100.876351267","10.10.3.102","10.10.3.62","MPTCP","80","5201  >  49079 [ACK] Seq=1 Ack=3457 Win=64128 Len=0 TSval=2493189109 TSecr=3346411280","0.000029595","","","",""
"3175","100.881836819","10.10.3.62","10.10.3.102","MPTCP","892","49079  >  5201 [PSH, ACK] Seq=3457 Ack=1 Win=64256 Len=800 TSval=3346411290 TSecr=2493188653","","","","",""
"3176","100.881878710","10.10.3.102","10.10.3.62","MPTCP","80","5201  >  49079 [ACK] Seq=1 Ack=4257 Win=64128 Len=0 TSval=2493189114 TSecr=3346411290","0.000041891","","","",""
"3177","100.890621739","10.10.3.62","10.10.3.102","MPTCP","1516","49079  >  5201 [ACK] Seq=4257 Ack=1 Win=64256 Len=1424 TSval=3346411348 TSecr=2493189098","","","","",""
"3178","100.890664777","10.10.3.102","10.10.3.62","MPTCP","80","5201  >  49079 [ACK] Seq=1 Ack=5681 Win=64128 Len=0 TSval=2493189123 TSecr=3346411348","0.000043038","","","",""
"3179","100.900578849","10.10.3.62","10.10.3.102","MPTCP","1516","49079  >  5201 [ACK] Seq=5681 Ack=1 Win=64256 Len=1424 TSval=3346411348 TSecr=2493189098","","","","",""
"3180","100.900622006","10.10.3.102","10.10.3.62","MPTCP","80","5201  >  49079 [ACK] Seq=1 Ack=7105 Win=64128 Len=0 TSval=2493189133 TSecr=3346411348","0.000043157","","","",""
"3181","100.912460496","10.10.3.62","10.10.3.102","MPTCP","1516","49079  >  5201 [ACK] Seq=7105 Ack=1 Win=64256 Len=1424 TSval=3346411348 TSecr=2493189098","","","","",""
"3182","100.912486575","10.10.3.102","10.10.3.62","MPTCP","80","5201  >  49079 [ACK] Seq=1 Ack=8529 Win=64128 Len=0 TSval=2493189145 TSecr=3346411348","0.000026079","","","",""
"3183","100.924364260","10.10.3.62","10.10.3.102","MPTCP","1516","49079  >  5201 [ACK] Seq=8529 Ack=1 Win=64256 Len=1424 TSval=3346411348 TSecr=2493189098","","","","",""
"3184","100.924389886","10.10.3.102","10.10.3.62","MPTCP","80","5201  >  49079 [ACK] Seq=1 Ack=9953 Win=64128 Len=0 TSval=2493189157 TSecr=3346411348","0.000025626","","","",""
"3185","100.936186856","10.10.3.62","10.10.3.102","MPTCP","1516","49079  >  5201 [PSH, ACK] Seq=9953 Ack=1 Win=64256 Len=1424 TSval=3346411348 TSecr=2493189098","","","","",""
"3186","100.936215453","10.10.3.102","10.10.3.62","MPTCP","80","5201  >  49079 [ACK] Seq=1 Ack=11377 Win=64128 Len=0 TSval=2493189169 TSecr=3346411348","0.000028597","","","",""
"3187","100.948094492","10.10.3.62","10.10.3.102","MPTCP","1516","49079  >  5201 [ACK] Seq=11377 Ack=1 Win=64256 Len=1424 TSval=3346411348 TSecr=2493189114","","","","",""
"3188","100.948121123","10.10.3.102","10.10.3.62","MPTCP","80","5201  >  49079 [ACK] Seq=1 Ack=12801 Win=64128 Len=0 TSval=2493189180 TSecr=3346411348","0.000026631","","","",""
"3189","100.960037156","10.10.3.62","10.10.3.102","MPTCP","380","49079  >  5201 [PSH, ACK] Seq=12801 Ack=1 Win=64256 Len=288 TSval=3346411354 TSecr=2493189114","","","","",""
"3190","100.960079093","10.10.3.102","10.10.3.62","MPTCP","80","5201  >  49079 [ACK] Seq=1 Ack=13089 Win=64128 Len=0 TSval=2493189192 TSecr=3346411354","0.000041937","","","",""
"3191","101.020913034","10.10.3.105","10.10.3.102","MPTCP","2940","53914  >  5201 [PSH, ACK] Seq=14278 Ack=1 Win=64256 Len=2848 TSval=2009244075 TSecr=1040370772","","","","",""
"3192","101.020970746","10.10.3.102","10.10.3.105","MPTCP","80","5201  >  53914 [ACK] Seq=1 Ack=17126 Win=61184 Len=0 TSval=1040370972 TSecr=2009244075","0.000057712","","","",""
"3193","101.020913720","10.10.3.105","10.10.3.102","MPTCP","2940","53914  >  5201 [PSH, ACK] Seq=17126 Ack=1 Win=64256 Len=2848 TSval=2009244075 TSecr=1040370772","","","","",""
"3194","101.020991212","10.10.3.102","10.10.3.105","MPTCP","80","5201  >  53914 [ACK] Seq=1 Ack=19974 Win=58496 Len=0 TSval=1040370972 TSecr=2009244075","0.000077492","","","",""
"3195","101.020913836","10.10.3.105","10.10.3.102","MPTCP","2940","53914  >  5201 [PSH, ACK] Seq=19974 Ack=1 Win=64256 Len=2848 TSval=2009244075 TSecr=1040370772","","","","",""
"3196","101.021005801","10.10.3.102","10.10.3.105","MPTCP","80","5201  >  53914 [ACK] Seq=1 Ack=22822 Win=55680 Len=0 TSval=1040370972 TSecr=2009244075","0.000091965","","","",""
"3197","101.020913951","10.10.3.105","10.10.3.102","MPTCP","2940","53914  >  5201 [PSH, ACK] Seq=22822 Ack=1 Win=64256 Len=2848 TSval=2009244075 TSecr=1040370772","","","","",""
"3198","101.021018628","10.10.3.102","10.10.3.105","MPTCP","80","5201  >  53914 [ACK] Seq=1 Ack=25670 Win=52864 Len=0 TSval=1040370972 TSecr=2009244075","0.000104677","","","",""
"3199","101.021043010","10.10.3.105","10.10.3.102","MPTCP","2940","53914  >  5201 [PSH, ACK] Seq=25670 Ack=1 Win=64256 Len=2848 TSval=2009244075 TSecr=1040370772","","","","",""
"3200","101.021054187","10.10.3.102","10.10.3.105","MPTCP","80","5201  >  53914 [ACK] Seq=1 Ack=28518 Win=50048 Len=0 TSval=1040370972 TSecr=2009244075","0.000011177","","","",""
"3201","101.021043138","10.10.3.105","10.10.3.102","MPTCP","2940","53914  >  5201 [PSH, ACK] Seq=28518 Ack=1 Win=64256 Len=2848 TSval=2009244075 TSecr=1040370772","","","","",""
"3202","101.021066691","10.10.3.102","10.10.3.105","MPTCP","80","5201  >  53914 [ACK] Seq=1 Ack=31366 Win=52736 Len=0 TSval=1040370972 TSecr=2009244075","0.000023553","","","",""
"3203","101.021043248","10.10.3.105","10.10.3.102","MPTCP","2940","53914  >  5201 [PSH, ACK] Seq=31366 Ack=1 Win=64256 Len=2848 TSval=2009244075 TSecr=1040370772","","","","",""
"3204","101.021079226","10.10.3.102","10.10.3.105","MPTCP","80","5201  >  53914 [ACK] Seq=1 Ack=34214 Win=64128 Len=0 TSval=1040370972 TSecr=2009244075","0.000035978","","","",""
"3205","101.021043388","10.10.3.105","10.10.3.102","MPTCP","2940","53914  >  5201 [PSH, ACK] Seq=34214 Ack=1 Win=64256 Len=2848 TSval=2009244075 TSecr=1040370772","","","","",""
"3206","101.021091263","10.10.3.102","10.10.3.105","MPTCP","80","5201  >  53914 [ACK] Seq=1 Ack=37062 Win=69888 Len=0 TSval=1040370972 TSecr=2009244075","0.000047875","","","",""
"3207","101.021123752","10.10.3.105","10.10.3.102","MPTCP","2940","53914  >  5201 [PSH, ACK] Seq=37062 Ack=1 Win=64256 Len=2848 TSval=2009244075 TSecr=1040370772","","","","",""
"3208","101.021137626","10.10.3.102","10.10.3.105","MPTCP","80","5201  >  53914 [ACK] Seq=1 Ack=39910 Win=75520 Len=0 TSval=1040370972 TSecr=2009244075","0.000013874","","","",""
"3209","101.021123915","10.10.3.105","10.10.3.102","MPTCP","2940","53914  >  5201 [PSH, ACK] Seq=39910 Ack=1 Win=64256 Len=2848 TSval=2009244075 TSecr=1040370772","","","","",""
"3210","101.021150305","10.10.3.102","10.10.3.105","MPTCP","80","5201  >  53914 [ACK] Seq=1 Ack=42758 Win=81280 Len=0 TSval=1040370972 TSecr=2009244075","0.000026390","","","",""
"3211","101.027499538","10.10.3.62","10.10.3.102","MPTCP","1516","49079  >  5201 [ACK] Seq=13089 Ack=1 Win=64256 Len=1424 TSval=3346411480 TSecr=2493189192","","","","",""
"3212","101.027542461","10.10.3.102","10.10.3.62","MPTCP","80","5201  >  49079 [ACK] Seq=1 Ack=14513 Win=81280 Len=0 TSval=2493189260 TSecr=3346411480","0.000042923","","","",""
"3213","101.051153805","10.10.3.62","10.10.3.102","MPTCP","1516","49079  >  5201 [ACK] Seq=14513 Ack=1 Win=64256 Len=1424 TSval=3346411480 TSecr=2493189192","","","","",""
"3214","101.051201677","10.10.3.102","10.10.3.62","MPTCP","80","5201  >  49079 [ACK] Seq=1 Ack=15937 Win=81280 Len=0 TSval=2493189284 TSecr=3346411480","0.000047872","","","",""
"3215","101.066164360","10.10.3.62","10.10.3.102","MPTCP","1516","49079  >  5201 [ACK] Seq=15937 Ack=1 Win=64256 Len=1424 TSval=3346411480 TSecr=2493189192","","","","",""
"3216","101.066211697","10.10.3.102","10.10.3.62","MPTCP","80","5201  >  49079 [ACK] Seq=1 Ack=17361 Win=81280 Len=0 TSval=2493189299 TSecr=3346411480","0.000047337","","","",""
"3217","101.067070257","10.10.3.62","10.10.3.102","MPTCP","1516","49079  >  5201 [ACK] Seq=17361 Ack=1 Win=64256 Len=1424 TSval=3346411480 TSecr=2493189192","","","","",""
"3218","101.067117460","10.10.3.102","10.10.3.62","MPTCP","80","5201  >  49079 [ACK] Seq=1 Ack=18785 Win=81280 Len=0 TSval=2493189299 TSecr=3346411480","0.000047203","","","",""
"3219","101.071132872","10.10.3.105","10.10.3.59","MPTCP","92","56407  >  5201 [ACK] Seq=1 Ack=1 Win=64256 Len=0 TSval=938499437 TSecr=1400478966","0.234084902","","","",""
"3220","101.077406917","10.10.3.62","10.10.3.102","MPTCP","1516","49079  >  5201 [ACK] Seq=18785 Ack=1 Win=64256 Len=1424 TSval=3346411480 TSecr=2493189192","","","","",""
"3221","101.077454639","10.10.3.102","10.10.3.62","MPTCP","80","5201  >  49079 [ACK] Seq=1 Ack=20209 Win=81280 Len=0 TSval=2493189310 TSecr=3346411480","0.000047722","","","",""
"3222","101.089289780","10.10.3.62","10.10.3.102","MPTCP","1516","49079  >  5201 [ACK] Seq=20209 Ack=1 Win=64256 Len=1424 TSval=3346411480 TSecr=2493189192","","","","",""
"3223","101.089346891","10.10.3.102","10.10.3.62","MPTCP","80","5201  >  49079 [ACK] Seq=1 Ack=21633 Win=81536 Len=0 TSval=2493189322 TSecr=3346411480","0.000057111","","","",""
"3224","101.100964466","10.10.3.62","10.10.3.102","MPTCP","1516","49079  >  5201 [ACK] Seq=21633 Ack=1 Win=64256 Len=1424 TSval=3346411480 TSecr=2493189192","","","","",""
"3225","101.101006709","10.10.3.102","10.10.3.62","MPTCP","80","5201  >  49079 [ACK] Seq=1 Ack=23057 Win=84352 Len=0 TSval=2493189333 TSecr=3346411480","0.000042243","","","",""
"3226","101.112858904","10.10.3.62","10.10.3.102","MPTCP","1516","49079  >  5201 [PSH, ACK] Seq=23057 Ack=1 Win=64256 Len=1424 TSval=3346411480 TSecr=2493189192","","","","",""
"3227","101.112879074","10.10.3.102","10.10.3.62","MPTCP","80","5201  >  49079 [ACK] Seq=1 Ack=24481 Win=87296 Len=0 TSval=2493189345 TSecr=3346411480","0.000020170","","","",""
"3228","101.124687725","10.10.3.62","10.10.3.102","MPTCP","1516","49079  >  5201 [ACK] Seq=24481 Ack=1 Win=64256 Len=1424 TSval=3346411480 TSecr=2493189192","","","","",""
"3229","101.124708173","10.10.3.102","10.10.3.62","MPTCP","80","5201  >  49079 [ACK] Seq=1 Ack=25905 Win=90240 Len=0 TSval=2493189357 TSecr=3346411480","0.000020448","","","",""
"3230","101.136785802","10.10.3.62","10.10.3.102","MPTCP","1516","49079  >  5201 [ACK] Seq=25905 Ack=1 Win=64256 Len=1424 TSval=3346411480 TSecr=2493189192","","","","",""
"3231","101.136807142","10.10.3.102","10.10.3.62","MPTCP","80","5201  >  49079 [ACK] Seq=1 Ack=27329 Win=93056 Len=0 TSval=2493189369 TSecr=3346411480","0.000021340","","","",""
"3232","101.148703842","10.10.3.62","10.10.3.102","MPTCP","1516","49079  >  5201 [ACK] Seq=27329 Ack=1 Win=64256 Len=1424 TSval=3346411480 TSecr=2493189192","","","","",""
"3233","101.148725192","10.10.3.102","10.10.3.62","MPTCP","80","5201  >  49079 [ACK] Seq=1 Ack=28753 Win=96000 Len=0 TSval=2493189381 TSecr=3346411480","0.000021350","","","",""
"3234","101.160560485","10.10.3.62","10.10.3.102","MPTCP","1516","49079  >  5201 [ACK] Seq=28753 Ack=1 Win=64256 Len=1424 TSval=3346411480 TSecr=2493189192","","","","",""
"3235","101.160581292","10.10.3.102","10.10.3.62","MPTCP","80","5201  >  49079 [ACK] Seq=1 Ack=30177 Win=98944 Len=0 TSval=2493189393 TSecr=3346411480","0.000020807","","","",""
"3237","101.172401383","10.10.3.62","10.10.3.102","MPTCP","1516","49079  >  5201 [ACK] Seq=30177 Ack=1 Win=64256 Len=1424 TSval=3346411480 TSecr=2493189192","","","","",""
"3238","101.172423868","10.10.3.102","10.10.3.62","MPTCP","80","5201  >  49079 [ACK] Seq=1 Ack=31601 Win=101760 Len=0 TSval=2493189405 TSecr=3346411480","0.000022485","","","",""
"3239","101.184293055","10.10.3.62","10.10.3.102","MPTCP","1516","49079  >  5201 [ACK] Seq=31601 Ack=1 Win=64256 Len=1424 TSval=3346411480 TSecr=2493189192","","","","",""
"3240","101.184329385","10.10.3.102","10.10.3.62","MPTCP","80","5201  >  49079 [ACK] Seq=1 Ack=33025 Win=104704 Len=0 TSval=2493189417 TSecr=3346411480","0.000036330","","","",""
"3241","101.196148098","10.10.3.62","10.10.3.102","MPTCP","1516","49079  >  5201 [ACK] Seq=33025 Ack=1 Win=64256 Len=1424 TSval=3346411480 TSecr=2493189192","","","","",""
"3242","101.196194297","10.10.3.102","10.10.3.62","MPTCP","80","5201  >  49079 [ACK] Seq=1 Ack=34449 Win=107520 Len=0 TSval=2493189429 TSecr=3346411480","0.000046199","","","",""
"3244","101.207994667","10.10.3.62","10.10.3.102","MPTCP","1516","49079  >  5201 [PSH, ACK] Seq=34449 Ack=1 Win=64256 Len=1424 TSval=3346411480 TSecr=2493189192","","","","",""
"3245","101.208038417","10.10.3.102","10.10.3.62","MPTCP","80","5201  >  49079 [ACK] Seq=1 Ack=35873 Win=110464 Len=0 TSval=2493189440 TSecr=3346411480","0.000043750","","","",""
"3246","101.219718717","10.10.3.62","10.10.3.102","MPTCP","1516","49079  >  5201 [ACK] Seq=35873 Ack=1 Win=64256 Len=1424 TSval=3346411529 TSecr=2493189284","","","","",""
"3247","101.219761389","10.10.3.102","10.10.3.62","MPTCP","80","5201  >  49079 [ACK] Seq=1 Ack=37297 Win=113408 Len=0 TSval=2493189452 TSecr=3346411529","0.000042672","","","",""
"3248","101.221763532","10.10.3.105","10.10.3.102","MPTCP","2940","53914  >  5201 [PSH, ACK] Seq=42758 Ack=1 Win=64256 Len=2848 TSval=2009244275 TSecr=1040370972","","","","",""
"3249","101.221816001","10.10.3.102","10.10.3.105","MPTCP","80","5201  >  53914 [ACK] Seq=1 Ack=45606 Win=110464 Len=0 TSval=1040371173 TSecr=2009244275","0.000052469","","","",""
"3250","101.221764162","10.10.3.105","10.10.3.102","MPTCP","2940","53914  >  5201 [PSH, ACK] Seq=45606 Ack=1 Win=64256 Len=2848 TSval=2009244275 TSecr=1040370972","","","","",""
"3251","101.221835088","10.10.3.102","10.10.3.105","MPTCP","80","5201  >  53914 [ACK] Seq=1 Ack=48454 Win=107776 Len=0 TSval=1040371173 TSecr=2009244275","0.000070926","","","",""
"3252","101.221764313","10.10.3.105","10.10.3.102","MPTCP","2940","53914  >  5201 [PSH, ACK] Seq=48454 Ack=1 Win=64256 Len=2848 TSval=2009244275 TSecr=1040370972","","","","",""
"3253","101.221846080","10.10.3.102","10.10.3.105","MPTCP","80","5201  >  53914 [ACK] Seq=1 Ack=51302 Win=104960 Len=0 TSval=1040371173 TSecr=2009244275","0.000081767","","","",""
"3254","101.221764421","10.10.3.105","10.10.3.102","MPTCP","2940","53914  >  5201 [PSH, ACK] Seq=51302 Ack=1 Win=64256 Len=2848 TSval=2009244275 TSecr=1040370972","","","","",""
"3255","101.221865418","10.10.3.102","10.10.3.105","MPTCP","80","5201  >  53914 [ACK] Seq=1 Ack=54150 Win=104064 Len=0 TSval=1040371173 TSecr=2009244275","0.000100997","","","",""
"3256","101.221893256","10.10.3.105","10.10.3.102","MPTCP","2940","53914  >  5201 [PSH, ACK] Seq=54150 Ack=1 Win=64256 Len=2848 TSval=2009244275 TSecr=1040370972","","","","",""
"3257","101.221904390","10.10.3.102","10.10.3.105","MPTCP","80","5201  >  53914 [ACK] Seq=1 Ack=56998 Win=109696 Len=0 TSval=1040371173 TSecr=2009244275","0.000011134","","","",""
"3258","101.221893385","10.10.3.105","10.10.3.102","MPTCP","2940","53914  >  5201 [PSH, ACK] Seq=56998 Ack=1 Win=64256 Len=2848 TSval=2009244275 TSecr=1040370972","","","","",""
"3259","101.221915763","10.10.3.102","10.10.3.105","MPTCP","80","5201  >  53914 [ACK] Seq=1 Ack=59846 Win=115456 Len=0 TSval=1040371173 TSecr=2009244275","0.000022378","","","",""
"3260","101.221893499","10.10.3.105","10.10.3.102","MPTCP","2940","53914  >  5201 [PSH, ACK] Seq=59846 Ack=1 Win=64256 Len=2848 TSval=2009244275 TSecr=1040370972","","","","",""
"3261","101.221927204","10.10.3.102","10.10.3.105","MPTCP","80","5201  >  53914 [ACK] Seq=1 Ack=62694 Win=121088 Len=0 TSval=1040371173 TSecr=2009244275","0.000033705","","","",""
"3262","101.221893603","10.10.3.105","10.10.3.102","MPTCP","2716","53914  >  5201 [PSH, ACK] Seq=62694 Ack=1 Win=64256 Len=2624 TSval=2009244275 TSecr=1040370972","","","","",""
"3263","101.221957268","10.10.3.102","10.10.3.105","MPTCP","80","5201  >  53914 [ACK] Seq=1 Ack=65318 Win=126336 Len=0 TSval=1040371173 TSecr=2009244275","0.000063665","","","",""
"3264","101.231752884","10.10.3.62","10.10.3.102","MPTCP","1516","49079  >  5201 [PSH, ACK] Seq=37297 Ack=1 Win=64256 Len=1424 TSval=3346411529 TSecr=2493189284","","","","",""
"3265","101.231799515","10.10.3.102","10.10.3.62","MPTCP","80","5201  >  49079 [ACK] Seq=1 Ack=38721 Win=124800 Len=0 TSval=2493189464 TSecr=3346411529","0.000046631","","","",""
"3266","101.271467517","10.10.3.59","10.10.3.105","MPTCP","80","[TCP Window Update] 5201  >  56407 [ACK] Seq=1 Ack=1 Win=81280 Len=0 TSval=1400479401 TSecr=938499437","","","","","â\234\223"
"3268","101.422317046","10.10.3.105","10.10.3.102","MPTCP","2940","53914  >  5201 [PSH, ACK] Seq=65318 Ack=1 Win=64256 Len=2848 TSval=2009244476 TSecr=1040371173","","","","",""
"3269","101.422335637","10.10.3.102","10.10.3.105","MPTCP","80","5201  >  53914 [ACK] Seq=1 Ack=68166 Win=132096 Len=0 TSval=1040371374 TSecr=2009244476","0.000018591","","","",""
"3270","101.422365744","10.10.3.105","10.10.3.102","MPTCP","2940","53914  >  5201 [PSH, ACK] Seq=68166 Ack=1 Win=64256 Len=2848 TSval=2009244476 TSecr=1040371173","","","","",""
"3271","101.422373140","10.10.3.102","10.10.3.105","MPTCP","80","5201  >  53914 [ACK] Seq=1 Ack=71014 Win=137728 Len=0 TSval=1040371374 TSecr=2009244476","0.000007396","","","",""
"3272","101.422365799","10.10.3.105","10.10.3.102","MPTCP","2940","53914  >  5201 [PSH, ACK] Seq=71014 Ack=1 Win=64256 Len=2848 TSval=2009244476 TSecr=1040371173","","","","",""
"3273","101.422377968","10.10.3.102","10.10.3.105","MPTCP","80","5201  >  53914 [ACK] Seq=1 Ack=73862 Win=143488 Len=0 TSval=1040371374 TSecr=2009244476","0.000012169","","","",""
"3274","101.422365856","10.10.3.105","10.10.3.102","MPTCP","156","53914  >  5201 [PSH, ACK] Seq=73862 Ack=1 Win=64256 Len=64 TSval=2009244476 TSecr=1040371173","","","","",""
"3275","101.422381924","10.10.3.102","10.10.3.105","MPTCP","80","5201  >  53914 [ACK] Seq=1 Ack=73926 Win=143488 Len=0 TSval=1040371374 TSecr=2009244476","0.000016068","","","",""
"3276","101.422408811","10.10.3.105","10.10.3.102","MPTCP","2940","53914  >  5201 [PSH, ACK] Seq=73926 Ack=1 Win=64256 Len=2848 TSval=2009244476 TSecr=1040371173","","","","",""
"3277","101.422414997","10.10.3.102","10.10.3.105","MPTCP","80","5201  >  53914 [ACK] Seq=1 Ack=76774 Win=149120 Len=0 TSval=1040371374 TSecr=2009244476","0.000006186","","","",""
"3278","101.422408904","10.10.3.105","10.10.3.102","MPTCP","2940","53914  >  5201 [PSH, ACK] Seq=76774 Ack=1 Win=64256 Len=2848 TSval=2009244476 TSecr=1040371173","","","","",""
"3279","101.422419423","10.10.3.102","10.10.3.105","MPTCP","80","5201  >  53914 [ACK] Seq=1 Ack=79622 Win=154880 Len=0 TSval=1040371374 TSecr=2009244476","0.000010519","","","",""
"3280","101.422446222","10.10.3.105","10.10.3.102","MPTCP","2876","53914  >  5201 [PSH, ACK] Seq=79622 Ack=1 Win=64256 Len=2784 TSval=2009244476 TSecr=1040371173","","","","",""
"3281","101.422452052","10.10.3.102","10.10.3.105","MPTCP","80","5201  >  53914 [ACK] Seq=1 Ack=82406 Win=160384 Len=0 TSval=1040371374 TSecr=2009244476","0.000005830","","","",""
"3282","101.422482673","10.10.3.105","10.10.3.102","MPTCP","2940","53914  >  5201 [PSH, ACK] Seq=82406 Ack=1 Win=64256 Len=2848 TSval=2009244476 TSecr=1040371173","","","","",""
"3283","101.422488990","10.10.3.102","10.10.3.105","MPTCP","80","5201  >  53914 [ACK] Seq=1 Ack=85254 Win=166144 Len=0 TSval=1040371374 TSecr=2009244476","0.000006317","","","",""
"3284","101.422482735","10.10.3.105","10.10.3.102","MPTCP","2940","53914  >  5201 [PSH, ACK] Seq=85254 Ack=1 Win=64256 Len=2848 TSval=2009244476 TSecr=1040371173","","","","",""
"3285","101.422493818","10.10.3.102","10.10.3.105","MPTCP","80","5201  >  53914 [ACK] Seq=1 Ack=88102 Win=171776 Len=0 TSval=1040371374 TSecr=2009244476","0.000011083","","","",""
"3286","101.422520751","10.10.3.105","10.10.3.102","MPTCP","2940","53914  >  5201 [PSH, ACK] Seq=88102 Ack=1 Win=64256 Len=2848 TSval=2009244476 TSecr=1040371173","","","","",""
"3287","101.422526465","10.10.3.102","10.10.3.105","MPTCP","80","5201  >  53914 [ACK] Seq=1 Ack=90950 Win=177536 Len=0 TSval=1040371374 TSecr=2009244476","0.000005714","","","",""
"3288","101.422552953","10.10.3.105","10.10.3.102","MPTCP","2940","53914  >  5201 [PSH, ACK] Seq=90950 Ack=1 Win=64256 Len=2848 TSval=2009244476 TSecr=1040371173","","","","",""
"3289","101.422559103","10.10.3.102","10.10.3.105","MPTCP","80","5201  >  53914 [ACK] Seq=1 Ack=93798 Win=183168 Len=0 TSval=1040371374 TSecr=2009244476","0.000006150","","","",""
"3290","101.422553043","10.10.3.105","10.10.3.102","MPTCP","2940","53914  >  5201 [PSH, ACK] Seq=93798 Ack=1 Win=64256 Len=2848 TSval=2009244476 TSecr=1040371173","","","","",""
"3291","101.422563545","10.10.3.102","10.10.3.105","MPTCP","80","5201  >  53914 [ACK] Seq=1 Ack=96646 Win=188928 Len=0 TSval=1040371374 TSecr=2009244476","0.000010502","","","",""
"3292","101.422590153","10.10.3.105","10.10.3.102","MPTCP","2940","53914  >  5201 [PSH, ACK] Seq=96646 Ack=1 Win=64256 Len=2848 TSval=2009244476 TSecr=1040371173","","","","",""
"3293","101.422595776","10.10.3.102","10.10.3.105","MPTCP","80","5201  >  53914 [ACK] Seq=1 Ack=99494 Win=194560 Len=0 TSval=1040371374 TSecr=2009244476","0.000005623","","","",""
"3294","101.422622289","10.10.3.105","10.10.3.102","MPTCP","2940","53914  >  5201 [PSH, ACK] Seq=99494 Ack=1 Win=64256 Len=2848 TSval=2009244476 TSecr=1040371173","","","","",""
"3295","101.422628139","10.10.3.102","10.10.3.105","MPTCP","80","5201  >  53914 [ACK] Seq=1 Ack=102342 Win=200320 Len=0 TSval=1040371374 TSecr=2009244476","0.000005850","","","",""
"3296","101.422622347","10.10.3.105","10.10.3.102","MPTCP","2940","53914  >  5201 [PSH, ACK] Seq=102342 Ack=1 Win=64256 Len=2848 TSval=2009244476 TSecr=1040371173","","","","",""
"3297","101.422632620","10.10.3.102","10.10.3.105","MPTCP","80","5201  >  53914 [ACK] Seq=1 Ack=105190 Win=205952 Len=0 TSval=1040371374 TSecr=2009244476","0.000010273","","","",""
"3298","101.422658339","10.10.3.105","10.10.3.102","MPTCP","2940","53914  >  5201 [PSH, ACK] Seq=105190 Ack=1 Win=64256 Len=2848 TSval=2009244476 TSecr=1040371173","","","","",""
"3299","101.422664177","10.10.3.102","10.10.3.105","MPTCP","80","5201  >  53914 [ACK] Seq=1 Ack=108038 Win=211712 Len=0 TSval=1040371374 TSecr=2009244476","0.000005838","","","",""
"3300","101.422693328","10.10.3.105","10.10.3.102","MPTCP","2940","53914  >  5201 [PSH, ACK] Seq=108038 Ack=1 Win=64256 Len=2848 TSval=2009244476 TSecr=1040371173","","","","",""
"3301","101.422699258","10.10.3.102","10.10.3.105","MPTCP","80","5201  >  53914 [ACK] Seq=1 Ack=110886 Win=217344 Len=0 TSval=1040371374 TSecr=2009244476","0.000005930","","","",""
"3302","101.422726064","10.10.3.105","10.10.3.102","MPTCP","2940","53914  >  5201 [PSH, ACK] Seq=110886 Ack=1 Win=64256 Len=2848 TSval=2009244476 TSecr=1040371173","","","","",""
"3303","101.422732773","10.10.3.102","10.10.3.105","MPTCP","80","5201  >  53914 [ACK] Seq=1 Ack=113734 Win=223104 Len=0 TSval=1040371374 TSecr=2009244476","0.000006709","","","",""
"3304","101.422726123","10.10.3.105","10.10.3.102","MPTCP","2940","53914  >  5201 [PSH, ACK] Seq=113734 Ack=1 Win=64256 Len=2848 TSval=2009244476 TSecr=1040371173","","","","",""
"3305","101.422737056","10.10.3.102","10.10.3.105","MPTCP","80","5201  >  53914 [ACK] Seq=1 Ack=116582 Win=228736 Len=0 TSval=1040371374 TSecr=2009244476","0.000010933","","","",""
"3306","101.422763347","10.10.3.105","10.10.3.102","MPTCP","2940","53914  >  5201 [PSH, ACK] Seq=116582 Ack=1 Win=64256 Len=2848 TSval=2009244476 TSecr=1040371173","","","","",""
"3307","101.422769355","10.10.3.102","10.10.3.105","MPTCP","80","5201  >  53914 [ACK] Seq=1 Ack=119430 Win=234496 Len=0 TSval=1040371374 TSecr=2009244476","0.000006008","","","",""
"3308","101.422795790","10.10.3.105","10.10.3.102","MPTCP","2940","53914  >  5201 [PSH, ACK] Seq=119430 Ack=1 Win=64256 Len=2848 TSval=2009244476 TSecr=1040371173","","","","",""
"3309","101.422801532","10.10.3.102","10.10.3.105","MPTCP","80","5201  >  53914 [ACK] Seq=1 Ack=122278 Win=240128 Len=0 TSval=1040371374 TSecr=2009244476","0.000005742","","","",""
"3310","101.422795851","10.10.3.105","10.10.3.102","MPTCP","2940","53914  >  5201 [PSH, ACK] Seq=122278 Ack=1 Win=64256 Len=2848 TSval=2009244476 TSecr=1040371173","","","","",""
"3311","101.422806033","10.10.3.102","10.10.3.105","MPTCP","80","5201  >  53914 [ACK] Seq=1 Ack=125126 Win=245888 Len=0 TSval=1040371374 TSecr=2009244476","0.000010182","","","",""
"3312","101.422852515","10.10.3.105","10.10.3.102","MPTCP","1516","53914  >  5201 [ACK] Seq=125126 Ack=1 Win=64256 Len=1424 TSval=2009244476 TSecr=1040371173","","","","",""
"3313","101.422859522","10.10.3.102","10.10.3.105","MPTCP","80","5201  >  53914 [ACK] Seq=1 Ack=126550 Win=246272 Len=0 TSval=1040371374 TSecr=2009244476","0.000007007","","","",""
"3315","101.487636671","10.10.3.62","10.10.3.102","MPTCP","1516","49079  >  5201 [ACK] Seq=38721 Ack=1 Win=64256 Len=1424 TSval=3346411531 TSecr=2493189299","","","","",""
"3316","101.487666136","10.10.3.102","10.10.3.62","MPTCP","80","5201  >  49079 [ACK] Seq=1 Ack=40145 Win=244736 Len=0 TSval=2493189720 TSecr=3346411531","0.000029465","","","",""
"3317","101.494577838","10.10.3.62","10.10.3.102","MPTCP","1516","49079  >  5201 [ACK] Seq=40145 Ack=1 Win=64256 Len=1424 TSval=3346411531 TSecr=2493189299","","","","",""
"3318","101.494611101","10.10.3.102","10.10.3.62","MPTCP","80","5201  >  49079 [ACK] Seq=1 Ack=41569 Win=243456 Len=0 TSval=2493189727 TSecr=3346411531","0.000033263","","","",""
"3319","101.498887983","10.10.3.62","10.10.3.102","MPTCP","1516","49079  >  5201 [ACK] Seq=41569 Ack=1 Win=64256 Len=1424 TSval=3346411531 TSecr=2493189299","","","","",""
"3320","101.498926768","10.10.3.102","10.10.3.62","MPTCP","80","5201  >  49079 [ACK] Seq=1 Ack=42993 Win=242048 Len=0 TSval=2493189731 TSecr=3346411531","0.000038785","","","",""
"3322","101.510740298","10.10.3.62","10.10.3.102","MPTCP","1516","49079  >  5201 [PSH, ACK] Seq=42993 Ack=1 Win=64256 Len=1424 TSval=3346411531 TSecr=2493189299","","","","",""
"3323","101.510788298","10.10.3.102","10.10.3.62","MPTCP","80","5201  >  49079 [ACK] Seq=1 Ack=44417 Win=240640 Len=0 TSval=2493189743 TSecr=3346411531","0.000048000","","","",""
"3324","101.522475257","10.10.3.62","10.10.3.102","MPTCP","1516","49079  >  5201 [ACK] Seq=44417 Ack=1 Win=64256 Len=1424 TSval=3346411692 TSecr=2493189464","","","","",""
"3325","101.522520765","10.10.3.102","10.10.3.62","MPTCP","80","5201  >  49079 [ACK] Seq=1 Ack=45841 Win=239232 Len=0 TSval=2493189755 TSecr=3346411692","0.000045508","","","",""
"3326","101.534331171","10.10.3.62","10.10.3.102","MPTCP","1516","49079  >  5201 [ACK] Seq=45841 Ack=1 Win=64256 Len=1424 TSval=3346411692 TSecr=2493189464","","","","",""
"3327","101.534382112","10.10.3.102","10.10.3.62","MPTCP","80","5201  >  49079 [ACK] Seq=1 Ack=47265 Win=237824 Len=0 TSval=2493189767 TSecr=3346411692","0.000050941","","","",""
"3328","101.546193948","10.10.3.62","10.10.3.102","MPTCP","1516","49079  >  5201 [ACK] Seq=47265 Ack=1 Win=64256 Len=1424 TSval=3346411692 TSecr=2493189464","","","","",""
"3329","101.546231185","10.10.3.102","10.10.3.62","MPTCP","80","5201  >  49079 [ACK] Seq=1 Ack=48689 Win=236416 Len=0 TSval=2493189779 TSecr=3346411692","0.000037237","","","",""
"3330","101.558062677","10.10.3.62","10.10.3.102","MPTCP","1516","49079  >  5201 [PSH, ACK] Seq=48689 Ack=1 Win=64256 Len=1424 TSval=3346411692 TSecr=2493189464","","","","",""
"3331","101.558094122","10.10.3.102","10.10.3.62","MPTCP","80","5201  >  49079 [ACK] Seq=1 Ack=50113 Win=235008 Len=0 TSval=2493189790 TSecr=3346411692","0.000031445","","","",""
"3332","101.570076986","10.10.3.62","10.10.3.102","MPTCP","1516","49079  >  5201 [ACK] Seq=50113 Ack=1 Win=64256 Len=1424 TSval=3346411954 TSecr=2493189464","","","","",""
"3333","101.570124895","10.10.3.102","10.10.3.62","MPTCP","80","5201  >  49079 [ACK] Seq=1 Ack=51537 Win=233600 Len=0 TSval=2493189802 TSecr=3346411954","0.000047909","","","",""
"3334","101.582015642","10.10.3.62","10.10.3.102","MPTCP","1516","49079  >  5201 [ACK] Seq=51537 Ack=1 Win=64256 Len=1424 TSval=3346411954 TSecr=2493189464","","","","",""
"3335","101.582064316","10.10.3.102","10.10.3.62","MPTCP","80","5201  >  49079 [ACK] Seq=1 Ack=52961 Win=232192 Len=0 TSval=2493189814 TSecr=3346411954","0.000048674","","","",""
"3336","101.593852677","10.10.3.62","10.10.3.102","MPTCP","1516","49079  >  5201 [ACK] Seq=52961 Ack=1 Win=64256 Len=1424 TSval=3346411954 TSecr=2493189464","","","","",""
"3337","101.593899800","10.10.3.102","10.10.3.62","MPTCP","80","5201  >  49079 [ACK] Seq=1 Ack=54385 Win=230784 Len=0 TSval=2493189826 TSecr=3346411954","0.000047123","","","",""
"3338","101.605564701","10.10.3.62","10.10.3.102","MPTCP","1516","49079  >  5201 [ACK] Seq=54385 Ack=1 Win=64256 Len=1424 TSval=3346411954 TSecr=2493189464","","","","",""
"3339","101.605607622","10.10.3.102","10.10.3.62","MPTCP","80","5201  >  49079 [ACK] Seq=1 Ack=55809 Win=229376 Len=0 TSval=2493189838 TSecr=3346411954","0.000042921","","","",""
"3340","101.617435812","10.10.3.62","10.10.3.102","MPTCP","1516","49079  >  5201 [ACK] Seq=55809 Ack=1 Win=64256 Len=1424 TSval=3346411954 TSecr=2493189464","","","","",""
"3341","101.617475881","10.10.3.102","10.10.3.62","MPTCP","80","5201  >  49079 [ACK] Seq=1 Ack=57233 Win=227968 Len=0 TSval=2493189850 TSecr=3346411954","0.000040069","","","",""
"3342","101.622821524","10.10.3.105","10.10.3.102","MPTCP","1116","53914  >  5201 [PSH, ACK] Seq=126550 Ack=1 Win=64256 Len=1024 TSval=2009244676 TSecr=1040371374","","","","",""
"3343","101.622853899","10.10.3.102","10.10.3.105","MPTCP","80","5201  >  53914 [ACK] Seq=1 Ack=127574 Win=251648 Len=0 TSval=1040371574 TSecr=2009244676","0.000032375","","","",""
"3344","101.622821893","10.10.3.105","10.10.3.102","MPTCP","2940","53914  >  5201 [PSH, ACK] Seq=127574 Ack=1 Win=64256 Len=2848 TSval=2009244676 TSecr=1040371374","","","","",""
"3345","101.622870365","10.10.3.102","10.10.3.105","MPTCP","80","5201  >  53914 [ACK] Seq=1 Ack=130422 Win=257280 Len=0 TSval=1040371574 TSecr=2009244676","0.000048472","","","",""
