"No.","Time","Source","Destination","Protocol","Length","Info","RTT","Lost Segement","Duplicate ","Retransmission","IDK"
"708","33.782857905","10.10.3.105","10.10.3.102","MPTCP","80","51720  >  5201 [SYN] Seq=0 Win=64240 Len=0 MSS=1460 SACK_PERM=1 TSval=2009691700 TSecr=0 WS=128","","","","",""
"709","33.782920583","10.10.3.102","10.10.3.105","MPTCP","88","5201  >  51720 [SYN, ACK] Seq=0 Ack=1 Win=65160 Len=0 MSS=1460 SACK_PERM=1 TSval=1040818399 TSecr=2009691700 WS=128","0.000062678","","","",""
"710","33.783587775","10.10.3.105","10.10.3.102","MPTCP","88","51720  >  5201 [ACK] Seq=1 Ack=1 Win=64256 Len=0 TSval=2009691701 TSecr=1040818399","0.000667192","","","",""
"711","33.783588429","10.10.3.105","10.10.3.102","MPTCP","129","51720  >  5201 [PSH, ACK] Seq=1 Ack=1 Win=64256 Len=37 TSval=2009691701 TSecr=1040818399","","","","",""
"712","33.783734489","10.10.3.102","10.10.3.105","MPTCP","80","5201  >  51720 [ACK] Seq=1 Ack=38 Win=65152 Len=0 TSval=1040818400 TSecr=2009691701","0.000146060","","","",""
"713","33.783797644","10.10.3.102","10.10.3.105","MPTCP","84","5201  >  51720 [ACK] Seq=1 Ack=38 Win=65152 Len=0 TSval=1040818400 TSecr=2009691701","","","","",""
"714","33.783868013","10.10.3.102","10.10.3.105","MPTCP","97","5201  >  51720 [PSH, ACK] Seq=1 Ack=38 Win=65152 Len=1 TSval=1040818400 TSecr=2009691701","","","","",""
"715","33.784370908","10.10.3.105","10.10.3.102","MPTCP","80","51720  >  5201 [ACK] Seq=38 Ack=2 Win=64256 Len=0 TSval=2009691702 TSecr=1040818400","0.000502895","","","",""
"716","33.784371386","10.10.3.105","10.10.3.102","MPTCP","76","[TCP Dup ACK 715#1] 51720  >  5201 [ACK] Seq=38 Ack=2 Win=64256 Len=0 TSval=2009691702 TSecr=1040818400","","","â\234\223","","â\234\223"
"717","33.784600753","10.10.3.105","10.10.3.102","MPTCP","100","51720  >  5201 [PSH, ACK] Seq=38 Ack=2 Win=64256 Len=4 TSval=2009691702 TSecr=1040818400","","","","",""
"718","33.798260249","10.10.3.62","10.10.3.102","MPTCP","88","60281  >  5201 [SYN] Seq=0 Win=64256 Len=0 MSS=1460 SACK_PERM=1 TSval=3346858907 TSecr=0 WS=128","","","","",""
"719","33.798330124","10.10.3.102","10.10.3.62","MPTCP","92","5201  >  60281 [SYN, ACK] Seq=0 Ack=1 Win=65160 Len=0 MSS=1460 SACK_PERM=1 TSval=2493636695 TSecr=3346858907 WS=128","0.000069875","","","",""
"720","33.799170174","10.10.3.105","10.10.3.59","MPTCP","88","38409  >  5201 [SYN] Seq=0 Win=64256 Len=0 MSS=1460 SACK_PERM=1 TSval=938947034 TSecr=0 WS=128","","","","",""
"721","33.799239580","10.10.3.59","10.10.3.105","MPTCP","92","5201  >  38409 [SYN, ACK] Seq=0 Ack=1 Win=65160 Len=0 MSS=1460 SACK_PERM=1 TSval=1400926793 TSecr=938947034 WS=128","0.000069406","","","",""
"722","33.805407440","10.10.3.105","10.10.3.59","MPTCP","92","38409  >  5201 [ACK] Seq=1 Ack=1 Win=64256 Len=0 TSval=938947052 TSecr=1400926793","0.006167860","","","",""
"723","33.805531774","10.10.3.59","10.10.3.105","MPTCP","80","[TCP Window Update] 5201  >  38409 [ACK] Seq=1 Ack=1 Win=65280 Len=0 TSval=1400926800 TSecr=938947052","","","","","â\234\223"
"724","33.806670196","10.10.3.62","10.10.3.102","MPTCP","92","60281  >  5201 [ACK] Seq=1 Ack=1 Win=64256 Len=0 TSval=3346858927 TSecr=2493636695","0.008340072","","","",""
"725","33.806785108","10.10.3.102","10.10.3.62","MPTCP","80","[TCP Window Update] 5201  >  60281 [ACK] Seq=1 Ack=1 Win=65280 Len=0 TSval=2493636704 TSecr=3346858927","","","","","â\234\223"
"726","33.828488004","10.10.3.102","10.10.3.105","MPTCP","80","5201  >  51720 [ACK] Seq=2 Ack=42 Win=65280 Len=0 TSval=1040818445 TSecr=2009691702","0.043887251","","","",""
"727","33.829037502","10.10.3.105","10.10.3.102","MPTCP","196","51720  >  5201 [PSH, ACK] Seq=42 Ack=2 Win=64256 Len=100 TSval=2009691746 TSecr=1040818445","","","","",""
"728","33.829084741","10.10.3.102","10.10.3.105","MPTCP","80","5201  >  51720 [ACK] Seq=2 Ack=142 Win=65280 Len=0 TSval=1040818445 TSecr=2009691746","0.000047239","","","",""
"729","33.829191727","10.10.3.102","10.10.3.105","MPTCP","97","5201  >  51720 [PSH, ACK] Seq=2 Ack=142 Win=65280 Len=1 TSval=1040818445 TSecr=2009691746","","","","",""
"731","33.829814380","10.10.3.105","10.10.3.102","MPTCP","80","51734  >  5201 [SYN] Seq=0 Win=64240 Len=0 MSS=1460 SACK_PERM=1 TSval=2009691747 TSecr=0 WS=128","","","","",""
"732","33.829857993","10.10.3.102","10.10.3.105","MPTCP","88","5201  >  51734 [SYN, ACK] Seq=0 Ack=1 Win=65160 Len=0 MSS=1460 SACK_PERM=1 TSval=1040818446 TSecr=2009691747 WS=128","0.000043613","","","",""
"733","33.830463958","10.10.3.105","10.10.3.102","MPTCP","88","51734  >  5201 [ACK] Seq=1 Ack=1 Win=64256 Len=0 TSval=2009691748 TSecr=1040818446","0.000605965","","","",""
"734","33.830464311","10.10.3.105","10.10.3.102","MPTCP","129","51734  >  5201 [PSH, ACK] Seq=1 Ack=1 Win=64256 Len=37 TSval=2009691748 TSecr=1040818446","","","","",""
"735","33.830575349","10.10.3.102","10.10.3.105","MPTCP","80","5201  >  51734 [ACK] Seq=1 Ack=38 Win=65152 Len=0 TSval=1040818447 TSecr=2009691748","0.000111038","","","",""
"736","33.832681976","10.10.3.102","10.10.3.105","MPTCP","84","5201  >  51734 [ACK] Seq=1 Ack=38 Win=65152 Len=0 TSval=1040818447 TSecr=2009691748","","","","",""
"738","33.833040644","10.10.3.62","10.10.3.102","MPTCP","88","36021  >  5201 [SYN] Seq=0 Win=64256 Len=0 MSS=1460 SACK_PERM=1 TSval=3346858953 TSecr=0 WS=128","","","","",""
"739","33.833083043","10.10.3.102","10.10.3.62","MPTCP","92","5201  >  36021 [SYN, ACK] Seq=0 Ack=1 Win=65160 Len=0 MSS=1460 SACK_PERM=1 TSval=2493636730 TSecr=3346858953 WS=128","0.000042399","","","",""
"740","33.833119126","10.10.3.105","10.10.3.102","MPTCP","76","51734  >  5201 [ACK] Seq=38 Ack=1 Win=64256 Len=0 TSval=2009691750 TSecr=1040818447","","","","",""
"741","33.835035123","10.10.3.105","10.10.3.59","MPTCP","88","35159  >  5201 [SYN] Seq=0 Win=64256 Len=0 MSS=1460 SACK_PERM=1 TSval=938947082 TSecr=0 WS=128","","","","",""
"742","33.835080924","10.10.3.59","10.10.3.105","MPTCP","92","5201  >  35159 [SYN, ACK] Seq=0 Ack=1 Win=65160 Len=0 MSS=1460 SACK_PERM=1 TSval=1400926829 TSecr=938947082 WS=128","0.000045801","","","",""
"743","33.840519998","10.10.3.105","10.10.3.59","MPTCP","92","35159  >  5201 [ACK] Seq=1 Ack=1 Win=64256 Len=0 TSval=938947086 TSecr=1400926829","0.005439074","","","",""
"744","33.840600486","10.10.3.59","10.10.3.105","MPTCP","80","[TCP Window Update] 5201  >  35159 [ACK] Seq=1 Ack=1 Win=65280 Len=0 TSval=1400926835 TSecr=938947086","","","","","â\234\223"
"745","33.844348636","10.10.3.62","10.10.3.102","MPTCP","92","36021  >  5201 [ACK] Seq=1 Ack=1 Win=64256 Len=0 TSval=3346858962 TSecr=2493636730","0.011265593","","","",""
"746","33.844443516","10.10.3.102","10.10.3.62","MPTCP","80","[TCP Window Update] 5201  >  36021 [ACK] Seq=1 Ack=1 Win=65280 Len=0 TSval=2493636742 TSecr=3346858962","","","","","â\234\223"
"747","33.871301413","10.10.3.105","10.10.3.102","MPTCP","80","51720  >  5201 [ACK] Seq=142 Ack=3 Win=64256 Len=0 TSval=2009691789 TSecr=1040818445","0.042109686","","","",""
"748","33.871324203","10.10.3.102","10.10.3.105","MPTCP","98","5201  >  51720 [PSH, ACK] Seq=3 Ack=142 Win=65280 Len=2 TSval=1040818487 TSecr=2009691789","","","","",""
"749","33.871790912","10.10.3.105","10.10.3.102","MPTCP","80","51720  >  5201 [ACK] Seq=142 Ack=5 Win=64256 Len=0 TSval=2009691789 TSecr=1040818487","0.000466709","","","",""
"750","33.871848398","10.10.3.105","10.10.3.102","MPTCP","7212","51734  >  5201 [PSH, ACK] Seq=38 Ack=1 Win=64256 Len=7120 TSval=2009691789 TSecr=1040818447","","","","",""
"751","33.871860459","10.10.3.102","10.10.3.105","MPTCP","80","5201  >  51734 [ACK] Seq=1 Ack=7158 Win=60672 Len=0 TSval=1040818488 TSecr=2009691789","0.000012061","","","",""
"752","33.871909371","10.10.3.105","10.10.3.102","MPTCP","7212","51734  >  5201 [PSH, ACK] Seq=7158 Ack=1 Win=64256 Len=7120 TSval=2009691789 TSecr=1040818447","","","","",""
"753","33.871914495","10.10.3.102","10.10.3.105","MPTCP","80","5201  >  51734 [ACK] Seq=1 Ack=14278 Win=60672 Len=0 TSval=1040818488 TSecr=2009691789","0.000005124","","","",""
"754","33.872444234","10.10.3.105","10.10.3.102","MPTCP","10060","51734  >  5201 [PSH, ACK] Seq=14278 Ack=1 Win=64256 Len=9968 TSval=2009691789 TSecr=1040818488","","","","",""
"755","33.872451890","10.10.3.102","10.10.3.105","MPTCP","80","5201  >  51734 [ACK] Seq=1 Ack=24246 Win=58752 Len=0 TSval=1040818489 TSecr=2009691789","0.000007656","","","",""
"756","33.872522290","10.10.3.105","10.10.3.102","MPTCP","7212","51734  >  5201 [PSH, ACK] Seq=24246 Ack=1 Win=64256 Len=7120 TSval=2009691790 TSecr=1040818488","","","","",""
"757","33.872527157","10.10.3.102","10.10.3.105","MPTCP","80","5201  >  51734 [ACK] Seq=1 Ack=31366 Win=78336 Len=0 TSval=1040818489 TSecr=2009691790","0.000004867","","","",""
"758","33.872618648","10.10.3.105","10.10.3.102","MPTCP","11484","51734  >  5201 [PSH, ACK] Seq=31366 Ack=1 Win=64256 Len=11392 TSval=2009691790 TSecr=1040818488","","","","",""
"759","33.872623190","10.10.3.102","10.10.3.105","MPTCP","80","5201  >  51734 [ACK] Seq=1 Ack=42758 Win=101120 Len=0 TSval=1040818489 TSecr=2009691790","0.000004542","","","",""
"760","33.873036683","10.10.3.105","10.10.3.102","MPTCP","18604","51734  >  5201 [PSH, ACK] Seq=42758 Ack=1 Win=64256 Len=18512 TSval=2009691790 TSecr=1040818489","","","","",""
"761","33.873043627","10.10.3.102","10.10.3.105","MPTCP","80","5201  >  51734 [ACK] Seq=1 Ack=61270 Win=138240 Len=0 TSval=1040818489 TSecr=2009691790","0.000006944","","","",""
"762","33.873067766","10.10.3.105","10.10.3.102","MPTCP","1516","51734  >  5201 [ACK] Seq=61270 Ack=1 Win=64256 Len=1424 TSval=2009691790 TSecr=1040818489","","","","",""
"763","33.873074990","10.10.3.102","10.10.3.105","MPTCP","80","5201  >  51734 [ACK] Seq=1 Ack=62694 Win=141056 Len=0 TSval=1040818489 TSecr=2009691790","0.000007224","","","",""
"764","33.873133477","10.10.3.105","10.10.3.102","MPTCP","2716","51734  >  5201 [PSH, ACK] Seq=62694 Ack=1 Win=64256 Len=2624 TSval=2009691790 TSecr=1040818489","","","","",""
"765","33.873141052","10.10.3.102","10.10.3.105","MPTCP","80","5201  >  51734 [ACK] Seq=1 Ack=65318 Win=146304 Len=0 TSval=1040818489 TSecr=2009691790","0.000007575","","","",""
"766","33.873372103","10.10.3.105","10.10.3.102","MPTCP","28572","51734  >  5201 [PSH, ACK] Seq=65318 Ack=1 Win=64256 Len=28480 TSval=2009691790 TSecr=1040818489","","","","",""
"767","33.873379461","10.10.3.102","10.10.3.105","MPTCP","80","5201  >  51734 [ACK] Seq=1 Ack=93798 Win=150656 Len=0 TSval=1040818489 TSecr=2009691790","0.000007358","","","",""
"768","33.873429639","10.10.3.105","10.10.3.102","MPTCP","5788","51734  >  5201 [PSH, ACK] Seq=93798 Ack=1 Win=64256 Len=5696 TSval=2009691790 TSecr=1040818489","","","","",""
"769","33.873433737","10.10.3.102","10.10.3.105","MPTCP","80","5201  >  51734 [ACK] Seq=1 Ack=99494 Win=150656 Len=0 TSval=1040818490 TSecr=2009691790","0.000004098","","","",""
"770","33.873548662","10.10.3.105","10.10.3.102","MPTCP","15756","51734  >  5201 [PSH, ACK] Seq=99494 Ack=1 Win=64256 Len=15664 TSval=2009691791 TSecr=1040818489","","","","",""
"771","33.873553716","10.10.3.102","10.10.3.105","MPTCP","80","5201  >  51734 [ACK] Seq=1 Ack=115158 Win=150656 Len=0 TSval=1040818490 TSecr=2009691791","0.000005054","","","",""
"772","33.873813445","10.10.3.105","10.10.3.102","MPTCP","29996","51734  >  5201 [PSH, ACK] Seq=115158 Ack=1 Win=64256 Len=29904 TSval=2009691791 TSecr=1040818489","","","","",""
"773","33.873819828","10.10.3.102","10.10.3.105","MPTCP","80","5201  >  51734 [ACK] Seq=1 Ack=145062 Win=150656 Len=0 TSval=1040818490 TSecr=2009691791","0.000006383","","","",""
"774","33.874092393","10.10.3.105","10.10.3.102","MPTCP","32844","51734  >  5201 [PSH, ACK] Seq=145062 Ack=1 Win=64256 Len=32752 TSval=2009691791 TSecr=1040818489","","","","",""
"775","33.874099392","10.10.3.102","10.10.3.105","MPTCP","80","5201  >  51734 [ACK] Seq=1 Ack=177814 Win=150656 Len=0 TSval=1040818490 TSecr=2009691791","0.000006999","","","",""
"776","33.874281654","10.10.3.105","10.10.3.102","MPTCP","20572","51734  >  5201 [PSH, ACK] Seq=177814 Ack=1 Win=64256 Len=20480 TSval=2009691791 TSecr=1040818490","","","","",""
"777","33.874287227","10.10.3.102","10.10.3.105","MPTCP","80","5201  >  51734 [ACK] Seq=1 Ack=198294 Win=150656 Len=0 TSval=1040818490 TSecr=2009691791","0.000005573","","","",""
"778","33.886942815","10.10.3.62","10.10.3.102","MPTCP","1516","36021  >  5201 [ACK] Seq=1 Ack=1 Win=64256 Len=1424 TSval=3346858995 TSecr=2493636742","","","","",""
"779","33.886968318","10.10.3.102","10.10.3.62","MPTCP","80","5201  >  36021 [ACK] Seq=1 Ack=1425 Win=149120 Len=0 TSval=2493636784 TSecr=3346858995","0.000025503","","","",""
"780","33.895826285","10.10.3.105","10.10.3.102","MPTCP","268","51734  >  5201 [PSH, ACK] Seq=198294 Ack=1 Win=64256 Len=176 TSval=2009691813 TSecr=1040818490","","","","",""
"781","33.895859676","10.10.3.102","10.10.3.105","MPTCP","80","5201  >  51734 [ACK] Seq=1 Ack=198470 Win=150528 Len=0 TSval=1040818512 TSecr=2009691813","0.000033391","","","",""
"782","33.896772585","10.10.3.105","10.10.3.102","MPTCP","1388","51734  >  5201 [PSH, ACK] Seq=198470 Ack=1 Win=64256 Len=1296 TSval=2009691814 TSecr=1040818512","","","","",""
"783","33.896794657","10.10.3.102","10.10.3.105","MPTCP","80","5201  >  51734 [ACK] Seq=1 Ack=199766 Win=150528 Len=0 TSval=1040818513 TSecr=2009691814","0.000022072","","","",""
"786","33.907650311","10.10.3.105","10.10.3.59","MPTCP","1516","35159  >  5201 [ACK] Seq=1 Ack=1 Win=64256 Len=1424 TSval=938947122 TSecr=1400926835","","","","",""
"787","33.907671988","10.10.3.59","10.10.3.105","MPTCP","80","5201  >  35159 [ACK] Seq=1 Ack=1425 Win=150528 Len=0 TSval=1400926902 TSecr=938947122","0.000021677","","","",""
"788","33.907650466","10.10.3.105","10.10.3.59","MPTCP","1516","35159  >  5201 [ACK] Seq=1425 Ack=1 Win=64256 Len=1424 TSval=938947122 TSecr=1400926835","","","","",""
"789","33.907689500","10.10.3.59","10.10.3.105","MPTCP","80","5201  >  35159 [ACK] Seq=1 Ack=2849 Win=150528 Len=0 TSval=1400926902 TSecr=938947122","0.000039034","","","",""
"790","33.907699129","10.10.3.105","10.10.3.59","MPTCP","1516","35159  >  5201 [ACK] Seq=2849 Ack=1 Win=64256 Len=1424 TSval=938947122 TSecr=1400926835","","","","",""
"791","33.907703507","10.10.3.59","10.10.3.105","MPTCP","80","5201  >  35159 [ACK] Seq=1 Ack=4273 Win=150528 Len=0 TSval=1400926902 TSecr=938947122","0.000004378","","","",""
"792","33.907699209","10.10.3.105","10.10.3.59","MPTCP","1516","35159  >  5201 [ACK] Seq=4273 Ack=1 Win=64256 Len=1424 TSval=938947122 TSecr=1400926835","","","","",""
"793","33.907711058","10.10.3.59","10.10.3.105","MPTCP","80","5201  >  35159 [ACK] Seq=1 Ack=5697 Win=150528 Len=0 TSval=1400926902 TSecr=938947122","0.000011849","","","",""
"794","33.910868090","10.10.3.105","10.10.3.59","MPTCP","1516","35159  >  5201 [PSH, ACK] Seq=5697 Ack=1 Win=64256 Len=1424 TSval=938947122 TSecr=1400926835","","","","",""
"795","33.910892352","10.10.3.59","10.10.3.105","MPTCP","80","5201  >  35159 [ACK] Seq=1 Ack=7121 Win=150528 Len=0 TSval=1400926905 TSecr=938947122","0.000024262","","","",""
"797","33.924384494","10.10.3.105","10.10.3.59","MPTCP","1516","35159  >  5201 [ACK] Seq=7121 Ack=1 Win=64256 Len=1424 TSval=938947122 TSecr=1400926835","","","","",""
"798","33.924414382","10.10.3.59","10.10.3.105","MPTCP","80","5201  >  35159 [ACK] Seq=1 Ack=8545 Win=150528 Len=0 TSval=1400926918 TSecr=938947122","0.000029888","","","",""
"799","33.932963384","10.10.3.105","10.10.3.59","MPTCP","1516","35159  >  5201 [ACK] Seq=8545 Ack=1 Win=64256 Len=1424 TSval=938947122 TSecr=1400926835","","","","",""
"800","33.932998734","10.10.3.59","10.10.3.105","MPTCP","80","5201  >  35159 [ACK] Seq=1 Ack=9969 Win=150528 Len=0 TSval=1400926927 TSecr=938947122","0.000035350","","","",""
"801","33.937342287","10.10.3.62","10.10.3.102","MPTCP","1180","36021  >  5201 [PSH, ACK] Seq=1425 Ack=1 Win=64256 Len=1088 TSval=3346858995 TSecr=2493636742","","","","",""
"802","33.937405040","10.10.3.102","10.10.3.62","MPTCP","80","5201  >  36021 [ACK] Seq=1 Ack=2513 Win=148224 Len=0 TSval=2493636834 TSecr=3346858995","0.000062753","","","",""
"803","33.938713097","10.10.3.62","10.10.3.102","MPTCP","1180","[TCP Spurious Retransmission] 36021  >  5201 [PSH, ACK] Seq=1425 Ack=1 Win=64256 Len=1088 TSval=3346859018 TSecr=2493636742","","","","â\234\223","â\234\223"
"804","33.938750203","10.10.3.102","10.10.3.62","MPTCP","92","[TCP Dup ACK 802#1] 5201  >  36021 [ACK] Seq=1 Ack=2513 Win=148224 Len=0 TSval=2493636836 TSecr=3346859018 SLE=1425 SRE=2513","0.000037106","","â\234\223","","â\234\223"
"805","33.945574482","10.10.3.105","10.10.3.102","MPTCP","8844","51734  >  5201 [PSH, ACK] Seq=199766 Ack=1 Win=64256 Len=8752 TSval=2009691862 TSecr=1040818513","","","","",""
"806","33.945623744","10.10.3.102","10.10.3.105","MPTCP","80","5201  >  51734 [ACK] Seq=1 Ack=208518 Win=148224 Len=0 TSval=1040818562 TSecr=2009691862","0.000049262","","","",""
"807","33.946973681","10.10.3.105","10.10.3.59","MPTCP","1516","35159  >  5201 [ACK] Seq=9969 Ack=1 Win=64256 Len=1424 TSval=938947122 TSecr=1400926835","","","","",""
"808","33.947019846","10.10.3.59","10.10.3.105","MPTCP","80","5201  >  35159 [ACK] Seq=1 Ack=11393 Win=149120 Len=0 TSval=1400926941 TSecr=938947122","0.000046165","","","",""
"809","33.948671860","10.10.3.105","10.10.3.102","MPTCP","2412","51734  >  5201 [PSH, ACK] Seq=208518 Ack=1 Win=64256 Len=2320 TSval=2009691866 TSecr=1040818562","","","","",""
"810","33.948717321","10.10.3.102","10.10.3.105","MPTCP","80","5201  >  51734 [ACK] Seq=1 Ack=210838 Win=172416 Len=0 TSval=1040818565 TSecr=2009691866","0.000045461","","","",""
"811","33.949707409","10.10.3.105","10.10.3.102","MPTCP","23388","51734  >  5201 [PSH, ACK] Seq=210838 Ack=1 Win=64256 Len=23296 TSval=2009691867 TSecr=1040818565","","","","",""
"812","33.949769860","10.10.3.102","10.10.3.105","MPTCP","80","5201  >  51734 [ACK] Seq=1 Ack=234134 Win=219008 Len=0 TSval=1040818566 TSecr=2009691867","0.000062451","","","",""
"813","33.950887984","10.10.3.105","10.10.3.102","MPTCP","46684","51734  >  5201 [PSH, ACK] Seq=234134 Ack=1 Win=64256 Len=46592 TSval=2009691868 TSecr=1040818566","","","","",""
"814","33.950936199","10.10.3.102","10.10.3.105","MPTCP","80","5201  >  51734 [ACK] Seq=1 Ack=280726 Win=312192 Len=0 TSval=1040818567 TSecr=2009691868","0.000048215","","","",""
"815","33.952136268","10.10.3.105","10.10.3.102","MPTCP","62748","51734  >  5201 [PSH, ACK] Seq=280726 Ack=1 Win=64256 Len=62656 TSval=2009691869 TSecr=1040818567","","","","",""
"816","33.952199114","10.10.3.102","10.10.3.105","MPTCP","80","5201  >  51734 [ACK] Seq=1 Ack=343382 Win=312192 Len=0 TSval=1040818568 TSecr=2009691869","0.000062846","","","",""
"817","33.952395398","10.10.3.105","10.10.3.102","MPTCP","30620","51734  >  5201 [PSH, ACK] Seq=343382 Ack=1 Win=64256 Len=30528 TSval=2009691869 TSecr=1040818567","","","","",""
"818","33.952415464","10.10.3.102","10.10.3.105","MPTCP","80","5201  >  51734 [ACK] Seq=1 Ack=373910 Win=312192 Len=0 TSval=1040818568 TSecr=2009691869","0.000020066","","","",""
"819","33.959854032","10.10.3.105","10.10.3.59","MPTCP","1516","35159  >  5201 [ACK] Seq=11393 Ack=1 Win=64256 Len=1424 TSval=938947122 TSecr=1400926835","","","","",""
"820","33.959900190","10.10.3.59","10.10.3.105","MPTCP","80","5201  >  35159 [ACK] Seq=1 Ack=12817 Win=310656 Len=0 TSval=1400926954 TSecr=938947122","0.000046158","","","",""
"821","33.972399082","10.10.3.105","10.10.3.59","MPTCP","1516","35159  >  5201 [PSH, ACK] Seq=12817 Ack=1 Win=64256 Len=1424 TSval=938947122 TSecr=1400926835","","","","",""
"822","33.972462907","10.10.3.59","10.10.3.105","MPTCP","80","5201  >  35159 [ACK] Seq=1 Ack=14241 Win=309376 Len=0 TSval=1400926967 TSecr=938947122","0.000063825","","","",""
"823","33.974804961","10.10.3.105","10.10.3.102","MPTCP","124","51734  >  5201 [PSH, ACK] Seq=373910 Ack=1 Win=64256 Len=32 TSval=2009691892 TSecr=1040818568","","","","",""
"824","33.980235726","10.10.3.105","10.10.3.59","MPTCP","1020","35159  >  5201 [PSH, ACK] Seq=14241 Ack=1 Win=64256 Len=928 TSval=938947137 TSecr=1400926835","","","","",""
"825","33.980291667","10.10.3.59","10.10.3.105","MPTCP","80","5201  >  35159 [ACK] Seq=1 Ack=15169 Win=308480 Len=0 TSval=1400926974 TSecr=938947137","0.000055941","","","",""
"826","33.980631557","10.10.3.102","10.10.3.105","MPTCP","80","5201  >  51734 [ACK] Seq=1 Ack=373942 Win=462464 Len=0 TSval=1040818591 TSecr=2009691892","0.005826596","","","",""
"827","33.981982110","10.10.3.105","10.10.3.102","MPTCP","62748","51734  >  5201 [PSH, ACK] Seq=373942 Ack=1 Win=64256 Len=62656 TSval=2009691899 TSecr=1040818591","","","","",""
"828","33.982055762","10.10.3.102","10.10.3.105","MPTCP","80","5201  >  51734 [ACK] Seq=1 Ack=436598 Win=440832 Len=0 TSval=1040818598 TSecr=2009691899","0.000073652","","","",""
"829","33.982073155","10.10.3.105","10.10.3.102","MPTCP","4220","51734  >  5201 [PSH, ACK] Seq=436598 Ack=1 Win=64256 Len=4128 TSval=2009691899 TSecr=1040818591","","","","",""
"830","33.982085457","10.10.3.102","10.10.3.105","MPTCP","80","5201  >  51734 [ACK] Seq=1 Ack=440726 Win=437888 Len=0 TSval=1040818598 TSecr=2009691899","0.000012302","","","",""
"831","33.982825066","10.10.3.105","10.10.3.102","MPTCP","62748","51734  >  5201 [PSH, ACK] Seq=440726 Ack=1 Win=64256 Len=62656 TSval=2009691899 TSecr=1040818591","","","","",""
"832","33.982865178","10.10.3.102","10.10.3.105","MPTCP","80","5201  >  51734 [ACK] Seq=1 Ack=503382 Win=440832 Len=0 TSval=1040818599 TSecr=2009691899","0.000040112","","","",""
"833","33.983105185","10.10.3.105","10.10.3.102","MPTCP","31420","51734  >  5201 [PSH, ACK] Seq=503382 Ack=1 Win=64256 Len=31328 TSval=2009691899 TSecr=1040818591","","","","",""
"834","33.983124322","10.10.3.102","10.10.3.105","MPTCP","80","5201  >  51734 [ACK] Seq=1 Ack=534710 Win=440832 Len=0 TSval=1040818599 TSecr=2009691899","0.000019137","","","",""
"835","33.983386798","10.10.3.105","10.10.3.102","MPTCP","31420","51734  >  5201 [PSH, ACK] Seq=534710 Ack=1 Win=64256 Len=31328 TSval=2009691900 TSecr=1040818598","","","","",""
"836","33.983405931","10.10.3.102","10.10.3.105","MPTCP","80","5201  >  51734 [ACK] Seq=1 Ack=566038 Win=440832 Len=0 TSval=1040818599 TSecr=2009691900","0.000019133","","","",""
"837","33.983923553","10.10.3.105","10.10.3.102","MPTCP","62748","51734  >  5201 [PSH, ACK] Seq=566038 Ack=1 Win=64256 Len=62656 TSval=2009691900 TSecr=1040818599","","","","",""
"838","33.983951046","10.10.3.102","10.10.3.105","MPTCP","80","5201  >  51734 [ACK] Seq=1 Ack=628694 Win=440832 Len=0 TSval=1040818600 TSecr=2009691900","0.000027493","","","",""
"839","33.984447530","10.10.3.62","10.10.3.102","MPTCP","1516","36021  >  5201 [ACK] Seq=2513 Ack=1 Win=64256 Len=1424 TSval=3346859104 TSecr=2493636836","","","","",""
"840","33.984466303","10.10.3.102","10.10.3.62","MPTCP","80","5201  >  36021 [ACK] Seq=1 Ack=3937 Win=439296 Len=0 TSval=2493636882 TSecr=3346859104","0.000018773","","","",""
"841","33.984447668","10.10.3.105","10.10.3.102","MPTCP","61324","51734  >  5201 [ACK] Seq=628694 Ack=1 Win=64256 Len=61232 TSval=2009691901 TSecr=1040818599","","","","",""
"842","33.984495639","10.10.3.102","10.10.3.105","MPTCP","80","5201  >  51734 [ACK] Seq=1 Ack=689926 Win=439296 Len=0 TSval=1040818601 TSecr=2009691901","0.000047971","","","",""
"843","33.984543895","10.10.3.105","10.10.3.102","MPTCP","1516","51734  >  5201 [PSH, ACK] Seq=689926 Ack=1 Win=64256 Len=1424 TSval=2009691901 TSecr=1040818599","","","","",""
"844","33.984556379","10.10.3.102","10.10.3.105","MPTCP","80","5201  >  51734 [ACK] Seq=1 Ack=691350 Win=439296 Len=0 TSval=1040818601 TSecr=2009691901","0.000012484","","","",""
"845","33.984844471","10.10.3.105","10.10.3.102","MPTCP","45660","51734  >  5201 [PSH, ACK] Seq=691350 Ack=1 Win=64256 Len=45568 TSval=2009691901 TSecr=1040818599","","","","",""
"846","33.984871782","10.10.3.102","10.10.3.105","MPTCP","80","5201  >  51734 [ACK] Seq=1 Ack=736918 Win=439296 Len=0 TSval=1040818601 TSecr=2009691901","0.000027311","","","",""
"847","33.984969494","10.10.3.105","10.10.3.102","MPTCP","13820","51734  >  5201 [PSH, ACK] Seq=736918 Ack=1 Win=64256 Len=13728 TSval=2009691902 TSecr=1040818600","","","","",""
"848","33.984983905","10.10.3.102","10.10.3.105","MPTCP","80","5201  >  51734 [ACK] Seq=1 Ack=750646 Win=439296 Len=0 TSval=1040818601 TSecr=2009691902","0.000014411","","","",""
"849","33.990643490","10.10.3.105","10.10.3.59","MPTCP","1516","35159  >  5201 [ACK] Seq=15169 Ack=1 Win=64256 Len=1424 TSval=938947231 TSecr=1400926974","","","","",""
"850","33.990672480","10.10.3.59","10.10.3.105","MPTCP","80","5201  >  35159 [ACK] Seq=1 Ack=16593 Win=439296 Len=0 TSval=1400926985 TSecr=938947231","0.000028990","","","",""
"851","33.992042993","10.10.3.62","10.10.3.102","MPTCP","1516","36021  >  5201 [ACK] Seq=3937 Ack=1 Win=64256 Len=1424 TSval=3346859104 TSecr=2493636836","","","","",""
"852","33.992064184","10.10.3.102","10.10.3.62","MPTCP","80","5201  >  36021 [ACK] Seq=1 Ack=5361 Win=438016 Len=0 TSval=2493636889 TSecr=3346859104","0.000021191","","","",""
"853","33.994666652","10.10.3.62","10.10.3.102","MPTCP","1516","36021  >  5201 [ACK] Seq=5361 Ack=1 Win=64256 Len=1424 TSval=3346859104 TSecr=2493636836","","","","",""
"854","33.994721294","10.10.3.102","10.10.3.62","MPTCP","80","5201  >  36021 [ACK] Seq=1 Ack=6785 Win=436608 Len=0 TSval=2493636892 TSecr=3346859104","0.000054642","","","",""
"855","33.995964327","10.10.3.105","10.10.3.102","MPTCP","31396","51734  >  5201 [PSH, ACK] Seq=750646 Ack=1 Win=64256 Len=31304 TSval=2009691913 TSecr=1040818601","","","","",""
"856","33.996030125","10.10.3.102","10.10.3.105","MPTCP","80","5201  >  51734 [ACK] Seq=1 Ack=781950 Win=408192 Len=0 TSval=1040818612 TSecr=2009691913","0.000065798","","","",""
"857","33.996447002","10.10.3.105","10.10.3.102","MPTCP","180","51734  >  5201 [PSH, ACK] Seq=781950 Ack=1 Win=64256 Len=88 TSval=2009691914 TSecr=1040818612","","","","",""
"858","34.006507857","10.10.3.62","10.10.3.102","MPTCP","1516","36021  >  5201 [ACK] Seq=6785 Ack=1 Win=64256 Len=1424 TSval=3346859104 TSecr=2493636836","","","","",""
"859","34.006547994","10.10.3.102","10.10.3.62","MPTCP","80","5201  >  36021 [ACK] Seq=1 Ack=8209 Win=435200 Len=0 TSval=2493636904 TSecr=3346859104","0.000040137","","","",""
"860","34.011857993","10.10.3.105","10.10.3.102","MPTCP","25724","51734  >  5201 [PSH, ACK] Seq=782038 Ack=1 Win=64256 Len=25632 TSval=2009691929 TSecr=1040818612","","","","",""
"861","34.011909618","10.10.3.102","10.10.3.105","MPTCP","80","5201  >  51734 [ACK] Seq=1 Ack=807670 Win=435200 Len=0 TSval=1040818628 TSecr=2009691914","0.000051625","","","",""
"862","34.012478983","10.10.3.105","10.10.3.102","MPTCP","1468","51734  >  5201 [PSH, ACK] Seq=807670 Ack=1 Win=64256 Len=1376 TSval=2009691930 TSecr=1040818628","","","","",""
"863","34.012509841","10.10.3.102","10.10.3.105","MPTCP","80","5201  >  51734 [ACK] Seq=1 Ack=809046 Win=435200 Len=0 TSval=1040818629 TSecr=2009691930","0.000030858","","","",""
"864","34.014436876","10.10.3.105","10.10.3.59","MPTCP","1516","35159  >  5201 [PSH, ACK] Seq=16593 Ack=1 Win=64256 Len=1424 TSval=938947231 TSecr=1400926974","","","","",""
"865","34.014480521","10.10.3.59","10.10.3.105","MPTCP","80","5201  >  35159 [ACK] Seq=1 Ack=18017 Win=438016 Len=0 TSval=1400927009 TSecr=938947231","0.000043645","","","",""
"866","34.016687918","10.10.3.105","10.10.3.59","MPTCP","1516","35159  >  5201 [ACK] Seq=18017 Ack=1 Win=64256 Len=1424 TSval=938947231 TSecr=1400926974","","","","",""
"867","34.016692318","10.10.3.105","10.10.3.102","MPTCP","2908","51734  >  5201 [PSH, ACK] Seq=809046 Ack=1 Win=64256 Len=2816 TSval=2009691934 TSecr=1040818629","","","","",""
"868","34.016734136","10.10.3.59","10.10.3.105","MPTCP","80","5201  >  35159 [ACK] Seq=1 Ack=19441 Win=438016 Len=0 TSval=1400927011 TSecr=938947231","0.000046218","","","",""
"869","34.016734277","10.10.3.102","10.10.3.105","MPTCP","80","5201  >  51734 [ACK] Seq=1 Ack=811862 Win=438016 Len=0 TSval=1040818633 TSecr=2009691934","0.000041959","","","",""
"870","34.018351211","10.10.3.62","10.10.3.102","MPTCP","1516","36021  >  5201 [PSH, ACK] Seq=8209 Ack=1 Win=64256 Len=1424 TSval=3346859104 TSecr=2493636836","","","","",""
"871","34.018391842","10.10.3.102","10.10.3.62","MPTCP","80","5201  >  36021 [ACK] Seq=1 Ack=9633 Win=438016 Len=0 TSval=2493636915 TSecr=3346859104","0.000040631","","","",""
"872","34.025007857","10.10.3.105","10.10.3.59","MPTCP","1516","35159  >  5201 [PSH, ACK] Seq=19441 Ack=1 Win=64256 Len=1424 TSval=938947231 TSecr=1400926974","","","","",""
"873","34.025050653","10.10.3.59","10.10.3.105","MPTCP","80","5201  >  35159 [ACK] Seq=1 Ack=20865 Win=438016 Len=0 TSval=1400927019 TSecr=938947231","0.000042796","","","",""
"874","34.030256006","10.10.3.62","10.10.3.102","MPTCP","1516","36021  >  5201 [ACK] Seq=9633 Ack=1 Win=64256 Len=1424 TSval=3346859104 TSecr=2493636836","","","","",""
"875","34.030297533","10.10.3.102","10.10.3.62","MPTCP","80","5201  >  36021 [ACK] Seq=1 Ack=11057 Win=438016 Len=0 TSval=2493636927 TSecr=3346859104","0.000041527","","","",""
"876","34.037789390","10.10.3.105","10.10.3.59","MPTCP","1516","35159  >  5201 [ACK] Seq=20865 Ack=1 Win=64256 Len=1424 TSval=938947231 TSecr=1400926974","","","","",""
"877","34.037833734","10.10.3.59","10.10.3.105","MPTCP","80","5201  >  35159 [ACK] Seq=1 Ack=22289 Win=438016 Len=0 TSval=1400927032 TSecr=938947231","0.000044344","","","",""
"878","34.042048047","10.10.3.62","10.10.3.102","MPTCP","1516","36021  >  5201 [ACK] Seq=11057 Ack=1 Win=64256 Len=1424 TSval=3346859104 TSecr=2493636836","","","","",""
"879","34.042089124","10.10.3.102","10.10.3.62","MPTCP","80","5201  >  36021 [ACK] Seq=1 Ack=12481 Win=438016 Len=0 TSval=2493636939 TSecr=3346859104","0.000041077","","","",""
"880","34.053804096","10.10.3.62","10.10.3.102","MPTCP","1516","36021  >  5201 [ACK] Seq=12481 Ack=1 Win=64256 Len=1424 TSval=3346859104 TSecr=2493636836","","","","",""
"881","34.053843922","10.10.3.102","10.10.3.62","MPTCP","80","5201  >  36021 [ACK] Seq=1 Ack=13905 Win=438016 Len=0 TSval=2493636951 TSecr=3346859104","0.000039826","","","",""
"882","34.062908477","10.10.3.105","10.10.3.59","MPTCP","1516","35159  >  5201 [PSH, ACK] Seq=22289 Ack=1 Win=64256 Len=1424 TSval=938947231 TSecr=1400926974","","","","",""
"883","34.062939697","10.10.3.59","10.10.3.105","MPTCP","80","5201  >  35159 [ACK] Seq=1 Ack=23713 Win=438016 Len=0 TSval=1400927057 TSecr=938947231","0.000031220","","","",""
"884","34.065682798","10.10.3.62","10.10.3.102","MPTCP","1516","36021  >  5201 [ACK] Seq=13905 Ack=1 Win=64256 Len=1424 TSval=3346859104 TSecr=2493636836","","","","",""
"885","34.065709020","10.10.3.102","10.10.3.62","MPTCP","80","5201  >  36021 [ACK] Seq=1 Ack=15329 Win=438016 Len=0 TSval=2493636963 TSecr=3346859104","0.000026222","","","",""
"886","34.073340189","10.10.3.105","10.10.3.59","MPTCP","1516","35159  >  5201 [ACK] Seq=23713 Ack=1 Win=64256 Len=1424 TSval=938947231 TSecr=1400926974","","","","",""
"887","34.073375323","10.10.3.59","10.10.3.105","MPTCP","80","5201  >  35159 [ACK] Seq=1 Ack=25137 Win=438016 Len=0 TSval=1400927067 TSecr=938947231","0.000035134","","","",""
"888","34.073411567","10.10.3.105","10.10.3.59","MPTCP","1516","35159  >  5201 [PSH, ACK] Seq=25137 Ack=1 Win=64256 Len=1424 TSval=938947231 TSecr=1400926974","","","","",""
"889","34.073422668","10.10.3.59","10.10.3.105","MPTCP","80","5201  >  35159 [ACK] Seq=1 Ack=26561 Win=438016 Len=0 TSval=1400927068 TSecr=938947231","0.000011101","","","",""
"890","34.077566957","10.10.3.62","10.10.3.102","MPTCP","1516","36021  >  5201 [PSH, ACK] Seq=15329 Ack=1 Win=64256 Len=1424 TSval=3346859104 TSecr=2493636836","","","","",""
"891","34.077592127","10.10.3.102","10.10.3.62","MPTCP","80","5201  >  36021 [ACK] Seq=1 Ack=16753 Win=438016 Len=0 TSval=2493636975 TSecr=3346859104","0.000025170","","","",""
"892","34.083611576","10.10.3.105","10.10.3.59","MPTCP","1516","35159  >  5201 [ACK] Seq=26561 Ack=1 Win=64256 Len=1424 TSval=938947231 TSecr=1400926974","","","","",""
"893","34.083640271","10.10.3.59","10.10.3.105","MPTCP","80","5201  >  35159 [ACK] Seq=1 Ack=27985 Win=438016 Len=0 TSval=1400927078 TSecr=938947231","0.000028695","","","",""
"894","34.089450339","10.10.3.62","10.10.3.102","MPTCP","1516","36021  >  5201 [ACK] Seq=16753 Ack=1 Win=64256 Len=1424 TSval=3346859119 TSecr=2493636882","","","","",""
"895","34.089475644","10.10.3.102","10.10.3.62","MPTCP","80","5201  >  36021 [ACK] Seq=1 Ack=18177 Win=438016 Len=0 TSval=2493636987 TSecr=3346859119","0.000025305","","","",""
"896","34.096995336","10.10.3.105","10.10.3.59","MPTCP","1516","35159  >  5201 [PSH, ACK] Seq=27985 Ack=1 Win=64256 Len=1424 TSval=938947231 TSecr=1400926974","","","","",""
"897","34.097023771","10.10.3.59","10.10.3.105","MPTCP","80","5201  >  35159 [ACK] Seq=1 Ack=29409 Win=438016 Len=0 TSval=1400927091 TSecr=938947231","0.000028435","","","",""
"898","34.099791145","10.10.3.105","10.10.3.102","MPTCP","32820","51734  >  5201 [PSH, ACK] Seq=811862 Ack=1 Win=64256 Len=32728 TSval=2009692017 TSecr=1040818633","","","","",""
"899","34.099842212","10.10.3.102","10.10.3.105","MPTCP","80","5201  >  51734 [ACK] Seq=1 Ack=844590 Win=405376 Len=0 TSval=1040818716 TSecr=2009692017","0.000051067","","","",""
"900","34.100474585","10.10.3.105","10.10.3.102","MPTCP","14420","51734  >  5201 [PSH, ACK] Seq=844590 Ack=1 Win=64256 Len=14328 TSval=2009692017 TSecr=1040818716","","","","",""
"901","34.100506517","10.10.3.102","10.10.3.105","MPTCP","80","5201  >  51734 [ACK] Seq=1 Ack=858918 Win=510080 Len=0 TSval=1040818717 TSecr=2009692017","0.000031932","","","",""
"902","34.101245234","10.10.3.62","10.10.3.102","MPTCP","1516","36021  >  5201 [PSH, ACK] Seq=18177 Ack=1 Win=64256 Len=1424 TSval=3346859119 TSecr=2493636882","","","","",""
"903","34.101271430","10.10.3.102","10.10.3.62","MPTCP","80","5201  >  36021 [ACK] Seq=1 Ack=19601 Win=510080 Len=0 TSval=2493636998 TSecr=3346859119","0.000026196","","","",""
"904","34.101473677","10.10.3.105","10.10.3.102","MPTCP","62748","51734  >  5201 [PSH, ACK] Seq=858918 Ack=1 Win=64256 Len=62656 TSval=2009692018 TSecr=1040818717","","","","",""
"905","34.101499301","10.10.3.102","10.10.3.105","MPTCP","80","5201  >  51734 [ACK] Seq=1 Ack=921574 Win=635392 Len=0 TSval=1040818718 TSecr=2009692018","0.000025624","","","",""
"906","34.101828953","10.10.3.105","10.10.3.102","MPTCP","42140","51734  >  5201 [PSH, ACK] Seq=921574 Ack=1 Win=64256 Len=42048 TSval=2009692018 TSecr=1040818717","","","","",""
"907","34.101850021","10.10.3.102","10.10.3.105","MPTCP","80","5201  >  51734 [ACK] Seq=1 Ack=963622 Win=719488 Len=0 TSval=1040818718 TSecr=2009692018","0.000021068","","","",""
"908","34.102443833","10.10.3.105","10.10.3.102","MPTCP","62748","51734  >  5201 [PSH, ACK] Seq=963622 Ack=1 Win=64256 Len=62656 TSval=2009692019 TSecr=1040818718","","","","",""
"909","34.102476350","10.10.3.102","10.10.3.105","MPTCP","80","5201  >  51734 [ACK] Seq=1 Ack=1026278 Win=844800 Len=0 TSval=1040818719 TSecr=2009692019","0.000032517","","","",""
"910","34.102996411","10.10.3.105","10.10.3.102","MPTCP","62748","51734  >  5201 [PSH, ACK] Seq=1026278 Ack=1 Win=64256 Len=62656 TSval=2009692019 TSecr=1040818718","","","","",""
"911","34.103013026","10.10.3.102","10.10.3.105","MPTCP","80","5201  >  51734 [ACK] Seq=1 Ack=1088934 Win=970112 Len=0 TSval=1040818719 TSecr=2009692019","0.000016615","","","",""
"912","34.103476190","10.10.3.105","10.10.3.102","MPTCP","55628","51734  >  5201 [PSH, ACK] Seq=1088934 Ack=1 Win=64256 Len=55536 TSval=2009692019 TSecr=1040818718","","","","",""
"913","34.103493327","10.10.3.102","10.10.3.105","MPTCP","80","5201  >  51734 [ACK] Seq=1 Ack=1144470 Win=1081216 Len=0 TSval=1040818720 TSecr=2009692019","0.000017137","","","",""
"914","34.103523832","10.10.3.105","10.10.3.102","MPTCP","7212","51734  >  5201 [PSH, ACK] Seq=1144470 Ack=1 Win=64256 Len=7120 TSval=2009692020 TSecr=1040818719","","","","",""
"915","34.103530247","10.10.3.102","10.10.3.105","MPTCP","80","5201  >  51734 [ACK] Seq=1 Ack=1151590 Win=1095424 Len=0 TSval=1040818720 TSecr=2009692020","0.000006415","","","",""
"916","34.104063305","10.10.3.105","10.10.3.102","MPTCP","62748","51734  >  5201 [PSH, ACK] Seq=1151590 Ack=1 Win=64256 Len=62656 TSval=2009692021 TSecr=1040818719","","","","",""
"917","34.104078278","10.10.3.102","10.10.3.105","MPTCP","80","5201  >  51734 [ACK] Seq=1 Ack=1214246 Win=1220736 Len=0 TSval=1040818720 TSecr=2009692021","0.000014973","","","",""
"918","34.104420589","10.10.3.105","10.10.3.102","MPTCP","41388","51734  >  5201 [ACK] Seq=1214246 Ack=1 Win=64256 Len=41296 TSval=2009692021 TSecr=1040818720","","","","",""
"919","34.104434089","10.10.3.102","10.10.3.105","MPTCP","80","5201  >  51734 [ACK] Seq=1 Ack=1255542 Win=1303296 Len=0 TSval=1040818721 TSecr=2009692021","0.000013500","","","",""
"920","34.104606370","10.10.3.105","10.10.3.102","MPTCP","21452","51734  >  5201 [PSH, ACK] Seq=1255542 Ack=1 Win=64256 Len=21360 TSval=2009692021 TSecr=1040818720","","","","",""
"921","34.104615312","10.10.3.102","10.10.3.105","MPTCP","80","5201  >  51734 [ACK] Seq=1 Ack=1276902 Win=1346048 Len=0 TSval=1040818721 TSecr=2009692021","0.000008942","","","",""
"922","34.105149429","10.10.3.105","10.10.3.102","MPTCP","62748","51734  >  5201 [PSH, ACK] Seq=1276902 Ack=1 Win=64256 Len=62656 TSval=2009692021 TSecr=1040818720","","","","",""
"923","34.105165462","10.10.3.102","10.10.3.105","MPTCP","80","5201  >  51734 [ACK] Seq=1 Ack=1339558 Win=1471360 Len=0 TSval=1040818721 TSecr=2009692021","0.000016033","","","",""
"924","34.105170064","10.10.3.105","10.10.3.102","MPTCP","1516","51734  >  5201 [ACK] Seq=1339558 Ack=1 Win=64256 Len=1424 TSval=2009692021 TSecr=1040818720","","","","",""
"925","34.105175156","10.10.3.102","10.10.3.105","MPTCP","80","5201  >  51734 [ACK] Seq=1 Ack=1340982 Win=1474304 Len=0 TSval=1040818721 TSecr=2009692021","0.000005092","","","",""
"926","34.105703890","10.10.3.105","10.10.3.102","MPTCP","61324","51734  >  5201 [PSH, ACK] Seq=1340982 Ack=1 Win=64256 Len=61232 TSval=2009692022 TSecr=1040818720","","","","",""
"927","34.105720618","10.10.3.102","10.10.3.105","MPTCP","80","5201  >  51734 [ACK] Seq=1 Ack=1402214 Win=1596672 Len=0 TSval=1040818722 TSecr=2009692022","0.000016728","","","",""
"928","34.105728744","10.10.3.105","10.10.3.102","MPTCP","4364","51734  >  5201 [PSH, ACK] Seq=1402214 Ack=1 Win=64256 Len=4272 TSval=2009692022 TSecr=1040818720","","","","",""
"929","34.105734140","10.10.3.102","10.10.3.105","MPTCP","80","5201  >  51734 [ACK] Seq=1 Ack=1406486 Win=1605248 Len=0 TSval=1040818722 TSecr=2009692022","0.000005396","","","",""
"930","34.106240426","10.10.3.105","10.10.3.102","MPTCP","58476","51734  >  5201 [PSH, ACK] Seq=1406486 Ack=1 Win=64256 Len=58384 TSval=2009692022 TSecr=1040818721","","","","",""
"931","34.106254859","10.10.3.102","10.10.3.105","MPTCP","80","5201  >  51734 [ACK] Seq=1 Ack=1464870 Win=1721984 Len=0 TSval=1040818722 TSecr=2009692022","0.000014433","","","",""
"932","34.106772324","10.10.3.105","10.10.3.102","MPTCP","62748","51734  >  5201 [PSH, ACK] Seq=1464870 Ack=1 Win=64256 Len=62656 TSval=2009692023 TSecr=1040818721","","","","",""
"933","34.106794300","10.10.3.102","10.10.3.105","MPTCP","80","5201  >  51734 [ACK] Seq=1 Ack=1527526 Win=1847296 Len=0 TSval=1040818723 TSecr=2009692023","0.000021976","","","",""
"934","34.106993865","10.10.3.105","10.10.3.59","MPTCP","1516","35159  >  5201 [ACK] Seq=29409 Ack=1 Win=64256 Len=1424 TSval=938947231 TSecr=1400926974","","","","",""
"935","34.107017754","10.10.3.59","10.10.3.105","MPTCP","80","5201  >  35159 [ACK] Seq=1 Ack=30833 Win=1845760 Len=0 TSval=1400927101 TSecr=938947231","0.000023889","","","",""
"936","34.107316794","10.10.3.105","10.10.3.102","MPTCP","62748","51734  >  5201 [PSH, ACK] Seq=1527526 Ack=1 Win=64256 Len=62656 TSval=2009692023 TSecr=1040818722","","","","",""
