"No.","Time","Source","Destination","Protocol","Length","Info","RTT","Lost Segement","Duplicate ","Retransmission","IDK"
"53","4.589106310","10.10.3.105","10.10.3.102","MPTCP","80","32878  >  5201 [SYN] Seq=0 Win=64240 Len=0 MSS=1460 SACK_PERM=1 TSval=2008897291 TSecr=0 WS=128","","","","",""
"54","4.589161522","10.10.3.102","10.10.3.105","MPTCP","88","5201  >  32878 [SYN, ACK] Seq=0 Ack=1 Win=65160 Len=0 MSS=1460 SACK_PERM=1 TSval=1040023988 TSecr=2008897291 WS=128","0.000055212","","","",""
"55","4.589375462","10.10.3.105","10.10.3.102","MPTCP","88","32878  >  5201 [ACK] Seq=1 Ack=1 Win=64256 Len=0 TSval=2008897291 TSecr=1040023988","0.000213940","","","",""
"56","4.589375824","10.10.3.105","10.10.3.102","MPTCP","129","32878  >  5201 [PSH, ACK] Seq=1 Ack=1 Win=64256 Len=37 TSval=2008897291 TSecr=1040023988","","","","",""
"57","4.589500700","10.10.3.102","10.10.3.105","MPTCP","80","5201  >  32878 [ACK] Seq=1 Ack=38 Win=65152 Len=0 TSval=1040023988 TSecr=2008897291","0.000124876","","","",""
"58","4.589626267","10.10.3.102","10.10.3.105","MPTCP","97","5201  >  32878 [PSH, ACK] Seq=1 Ack=38 Win=65152 Len=1 TSval=1040023988 TSecr=2008897291","","","","",""
"59","4.589697930","10.10.3.102","10.10.3.105","MPTCP","84","[TCP Dup ACK 57#1] 5201  >  32878 [ACK] Seq=2 Ack=38 Win=65152 Len=0 TSval=1040023988 TSecr=2008897291","","","â\234\223","","â\234\223"
"60","4.589708857","10.10.3.105","10.10.3.102","MPTCP","80","32878  >  5201 [ACK] Seq=38 Ack=2 Win=64256 Len=0 TSval=2008897292 TSecr=1040023988","0.000082590","","","",""
"61","4.589778418","10.10.3.105","10.10.3.102","MPTCP","100","32878  >  5201 [PSH, ACK] Seq=38 Ack=2 Win=64256 Len=4 TSval=2008897292 TSecr=1040023988","","","","",""
"62","4.589824274","10.10.3.105","10.10.3.102","MPTCP","76","[TCP Dup ACK 60#1] 32878  >  5201 [ACK] Seq=42 Ack=2 Win=64256 Len=0 TSval=2008897292 TSecr=1040023988","","","â\234\223","","â\234\223"
"63","4.591543450","10.10.3.62","10.10.3.102","MPTCP","88","54933  >  5201 [SYN] Seq=0 Win=64256 Len=0 MSS=1460 SACK_PERM=1 TSval=3346064497 TSecr=0 WS=128","","","","",""
"64","4.591593961","10.10.3.102","10.10.3.62","MPTCP","92","5201  >  54933 [SYN, ACK] Seq=0 Ack=1 Win=65160 Len=0 MSS=1460 SACK_PERM=1 TSval=2492842271 TSecr=3346064497 WS=128","0.000050511","","","",""
"66","4.593793009","10.10.3.105","10.10.3.59","MPTCP","88","34069  >  5201 [SYN] Seq=0 Win=64256 Len=0 MSS=1460 SACK_PERM=1 TSval=938152624 TSecr=0 WS=128","","","","",""
"67","4.596185656","10.10.3.62","10.10.3.102","MPTCP","92","54933  >  5201 [ACK] Seq=1 Ack=1 Win=64256 Len=0 TSval=3346064502 TSecr=2492842271","0.004591695","","","",""
"68","4.596300675","10.10.3.102","10.10.3.62","MPTCP","80","[TCP Window Update] 5201  >  54933 [ACK] Seq=1 Ack=1 Win=65280 Len=0 TSval=2492842276 TSecr=3346064502","","","","","â\234\223"
"69","4.630249117","10.10.3.102","10.10.3.105","MPTCP","80","5201  >  32878 [ACK] Seq=2 Ack=42 Win=65280 Len=0 TSval=1040024029 TSecr=2008897292","0.040470699","","","",""
"70","4.630869580","10.10.3.105","10.10.3.102","MPTCP","196","32878  >  5201 [PSH, ACK] Seq=42 Ack=2 Win=64256 Len=100 TSval=2008897333 TSecr=1040024029","","","","",""
"71","4.630918515","10.10.3.102","10.10.3.105","MPTCP","80","5201  >  32878 [ACK] Seq=2 Ack=142 Win=65280 Len=0 TSval=1040024029 TSecr=2008897333","0.000048935","","","",""
"72","4.631049083","10.10.3.102","10.10.3.105","MPTCP","97","5201  >  32878 [PSH, ACK] Seq=2 Ack=142 Win=65280 Len=1 TSval=1040024030 TSecr=2008897333","","","","",""
"73","4.631295559","10.10.3.105","10.10.3.102","MPTCP","80","32890  >  5201 [SYN] Seq=0 Win=64240 Len=0 MSS=1460 SACK_PERM=1 TSval=2008897333 TSecr=0 WS=128","","","","",""
"74","4.631339635","10.10.3.102","10.10.3.105","MPTCP","88","5201  >  32890 [SYN, ACK] Seq=0 Ack=1 Win=65160 Len=0 MSS=1460 SACK_PERM=1 TSval=1040024030 TSecr=2008897333 WS=128","0.000044076","","","",""
"75","4.631557533","10.10.3.105","10.10.3.102","MPTCP","88","32890  >  5201 [ACK] Seq=1 Ack=1 Win=64256 Len=0 TSval=2008897334 TSecr=1040024030","0.000217898","","","",""
"77","4.631690358","10.10.3.105","10.10.3.102","MPTCP","129","32890  >  5201 [PSH, ACK] Seq=1 Ack=1 Win=64256 Len=37 TSval=2008897334 TSecr=1040024030","","","","",""
"78","4.631715423","10.10.3.102","10.10.3.105","MPTCP","80","5201  >  32890 [ACK] Seq=1 Ack=38 Win=65152 Len=0 TSval=1040024030 TSecr=2008897334","0.000025065","","","",""
"79","4.631870715","10.10.3.102","10.10.3.105","MPTCP","84","5201  >  32890 [ACK] Seq=1 Ack=38 Win=65152 Len=0 TSval=1040024030 TSecr=2008897334","","","","",""
"80","4.631964696","10.10.3.105","10.10.3.102","MPTCP","76","32890  >  5201 [ACK] Seq=38 Ack=1 Win=64256 Len=0 TSval=2008897334 TSecr=1040024030","","","","",""
"81","4.632619857","10.10.3.62","10.10.3.102","MPTCP","88","55347  >  5201 [SYN] Seq=0 Win=64256 Len=0 MSS=1460 SACK_PERM=1 TSval=3346064539 TSecr=0 WS=128","","","","",""
"82","4.632638515","10.10.3.105","10.10.3.59","MPTCP","88","35825  >  5201 [SYN] Seq=0 Win=64256 Len=0 MSS=1460 SACK_PERM=1 TSval=938152666 TSecr=0 WS=128","","","","",""
"83","4.632664758","10.10.3.102","10.10.3.62","MPTCP","92","5201  >  55347 [SYN, ACK] Seq=0 Ack=1 Win=65160 Len=0 MSS=1460 SACK_PERM=1 TSval=2492842312 TSecr=3346064539 WS=128","0.000044901","","","",""
"84","4.633821473","10.10.3.62","10.10.3.102","MPTCP","92","55347  >  5201 [ACK] Seq=1 Ack=1 Win=64256 Len=0 TSval=3346064541 TSecr=2492842312","0.001156715","","","",""
"85","4.633898910","10.10.3.102","10.10.3.62","MPTCP","80","[TCP Window Update] 5201  >  55347 [ACK] Seq=1 Ack=1 Win=65280 Len=0 TSval=2492842313 TSecr=3346064541","","","","","â\234\223"
"87","4.674546875","10.10.3.105","10.10.3.102","MPTCP","80","32878  >  5201 [ACK] Seq=142 Ack=3 Win=64256 Len=0 TSval=2008897377 TSecr=1040024030","0.043497792","","","",""
"88","4.674596479","10.10.3.102","10.10.3.105","MPTCP","98","5201  >  32878 [PSH, ACK] Seq=3 Ack=142 Win=65280 Len=2 TSval=1040024073 TSecr=2008897377","","","","",""
"89","4.674695676","10.10.3.105","10.10.3.102","MPTCP","80","32878  >  5201 [ACK] Seq=142 Ack=5 Win=64256 Len=0 TSval=2008897377 TSecr=1040024073","0.000099197","","","",""
"90","4.674825360","10.10.3.105","10.10.3.102","MPTCP","7212","32890  >  5201 [PSH, ACK] Seq=38 Ack=1 Win=64256 Len=7120 TSval=2008897377 TSecr=1040024030","","","","",""
"91","4.674851369","10.10.3.102","10.10.3.105","MPTCP","80","5201  >  32890 [ACK] Seq=1 Ack=7158 Win=60672 Len=0 TSval=1040024073 TSecr=2008897377","0.000026009","","","",""
"92","4.674889490","10.10.3.105","10.10.3.102","MPTCP","7212","32890  >  5201 [PSH, ACK] Seq=7158 Ack=1 Win=64256 Len=7120 TSval=2008897377 TSecr=1040024030","","","","",""
"93","4.674903013","10.10.3.102","10.10.3.105","MPTCP","80","5201  >  32890 [ACK] Seq=1 Ack=14278 Win=55680 Len=0 TSval=1040024073 TSecr=2008897377","0.000013523","","","",""
"94","4.675077886","10.10.3.105","10.10.3.102","MPTCP","10060","32890  >  5201 [PSH, ACK] Seq=14278 Ack=1 Win=64256 Len=9968 TSval=2008897377 TSecr=1040024073","","","","",""
"95","4.675110622","10.10.3.102","10.10.3.105","MPTCP","80","5201  >  32890 [ACK] Seq=1 Ack=24246 Win=58752 Len=0 TSval=1040024074 TSecr=2008897377","0.000032736","","","",""
"96","4.675165095","10.10.3.105","10.10.3.102","MPTCP","7212","32890  >  5201 [PSH, ACK] Seq=24246 Ack=1 Win=64256 Len=7120 TSval=2008897377 TSecr=1040024073","","","","",""
"97","4.675178112","10.10.3.102","10.10.3.105","MPTCP","80","5201  >  32890 [ACK] Seq=1 Ack=31366 Win=60672 Len=0 TSval=1040024074 TSecr=2008897377","0.000013017","","","",""
"98","4.675241492","10.10.3.105","10.10.3.102","MPTCP","11484","32890  >  5201 [PSH, ACK] Seq=31366 Ack=1 Win=64256 Len=11392 TSval=2008897377 TSecr=1040024073","","","","",""
"99","4.675255515","10.10.3.102","10.10.3.105","MPTCP","80","5201  >  32890 [ACK] Seq=1 Ack=42758 Win=86912 Len=0 TSval=1040024074 TSecr=2008897377","0.000014023","","","",""
"100","4.675410114","10.10.3.105","10.10.3.102","MPTCP","18604","32890  >  5201 [PSH, ACK] Seq=42758 Ack=1 Win=64256 Len=18512 TSval=2008897377 TSecr=1040024074","","","","",""
"101","4.675425720","10.10.3.102","10.10.3.105","MPTCP","80","5201  >  32890 [ACK] Seq=1 Ack=61270 Win=123904 Len=0 TSval=1040024074 TSecr=2008897377","0.000015606","","","",""
"102","4.675438156","10.10.3.105","10.10.3.102","MPTCP","1516","32890  >  5201 [ACK] Seq=61270 Ack=1 Win=64256 Len=1424 TSval=2008897377 TSecr=1040024074","","","","",""
"103","4.675447981","10.10.3.102","10.10.3.105","MPTCP","80","5201  >  32890 [ACK] Seq=1 Ack=62694 Win=126848 Len=0 TSval=1040024074 TSecr=2008897377","0.000009825","","","",""
"104","4.675438280","10.10.3.105","10.10.3.102","MPTCP","2716","32890  >  5201 [PSH, ACK] Seq=62694 Ack=1 Win=64256 Len=2624 TSval=2008897377 TSecr=1040024074","","","","",""
"105","4.675459415","10.10.3.102","10.10.3.105","MPTCP","80","5201  >  32890 [ACK] Seq=1 Ack=65318 Win=132096 Len=0 TSval=1040024074 TSecr=2008897377","0.000021135","","","",""
"106","4.675691382","10.10.3.105","10.10.3.102","MPTCP","28572","32890  >  5201 [PSH, ACK] Seq=65318 Ack=1 Win=64256 Len=28480 TSval=2008897377 TSecr=1040024074","","","","",""
"107","4.675709795","10.10.3.102","10.10.3.105","MPTCP","80","5201  >  32890 [ACK] Seq=1 Ack=93798 Win=189056 Len=0 TSval=1040024074 TSecr=2008897377","0.000018413","","","",""
"108","4.675754453","10.10.3.105","10.10.3.102","MPTCP","5788","32890  >  5201 [PSH, ACK] Seq=93798 Ack=1 Win=64256 Len=5696 TSval=2008897377 TSecr=1040024074","","","","",""
"109","4.675765709","10.10.3.102","10.10.3.105","MPTCP","80","5201  >  32890 [ACK] Seq=1 Ack=99494 Win=200448 Len=0 TSval=1040024074 TSecr=2008897377","0.000011256","","","",""
"110","4.675828669","10.10.3.105","10.10.3.102","MPTCP","8636","32890  >  5201 [PSH, ACK] Seq=99494 Ack=1 Win=64256 Len=8544 TSval=2008897378 TSecr=1040024074","","","","",""
"111","4.675840161","10.10.3.102","10.10.3.105","MPTCP","80","5201  >  32890 [ACK] Seq=1 Ack=108038 Win=217472 Len=0 TSval=1040024074 TSecr=2008897378","0.000011492","","","",""
"112","4.676068394","10.10.3.105","10.10.3.102","MPTCP","28572","32890  >  5201 [PSH, ACK] Seq=108038 Ack=1 Win=64256 Len=28480 TSval=2008897378 TSecr=1040024074","","","","",""
"113","4.676085566","10.10.3.102","10.10.3.105","MPTCP","80","5201  >  32890 [ACK] Seq=1 Ack=136518 Win=242176 Len=0 TSval=1040024075 TSecr=2008897378","0.000017172","","","",""
"114","4.676321113","10.10.3.105","10.10.3.102","MPTCP","31068","32890  >  5201 [PSH, ACK] Seq=136518 Ack=1 Win=64256 Len=30976 TSval=2008897378 TSecr=1040024074","","","","",""
"115","4.676339610","10.10.3.102","10.10.3.105","MPTCP","80","5201  >  32890 [ACK] Seq=1 Ack=167494 Win=242176 Len=0 TSval=1040024075 TSecr=2008897378","0.000018497","","","",""
"116","4.676688166","10.10.3.105","10.10.3.102","MPTCP","41388","32890  >  5201 [PSH, ACK] Seq=167494 Ack=1 Win=64256 Len=41296 TSval=2008897378 TSecr=1040024075","","","","",""
"117","4.676709377","10.10.3.102","10.10.3.105","MPTCP","80","5201  >  32890 [ACK] Seq=1 Ack=208790 Win=242176 Len=0 TSval=1040024075 TSecr=2008897378","0.000021211","","","",""
"118","4.676888272","10.10.3.105","10.10.3.102","MPTCP","21452","32890  >  5201 [PSH, ACK] Seq=208790 Ack=1 Win=64256 Len=21360 TSval=2008897379 TSecr=1040024075","","","","",""
"119","4.676905481","10.10.3.102","10.10.3.105","MPTCP","80","5201  >  32890 [ACK] Seq=1 Ack=230150 Win=242176 Len=0 TSval=1040024075 TSecr=2008897379","0.000017209","","","",""
"120","4.677254179","10.10.3.105","10.10.3.102","MPTCP","42812","32890  >  5201 [PSH, ACK] Seq=230150 Ack=1 Win=64256 Len=42720 TSval=2008897379 TSecr=1040024075","","","","",""
"121","4.677280664","10.10.3.102","10.10.3.105","MPTCP","80","5201  >  32890 [ACK] Seq=1 Ack=272870 Win=242176 Len=0 TSval=1040024076 TSecr=2008897379","0.000026485","","","",""
"122","4.677408059","10.10.3.105","10.10.3.102","MPTCP","17036","32890  >  5201 [PSH, ACK] Seq=272870 Ack=1 Win=64256 Len=16944 TSval=2008897379 TSecr=1040024075","","","","",""
"123","4.677423199","10.10.3.102","10.10.3.105","MPTCP","80","5201  >  32890 [ACK] Seq=1 Ack=289814 Win=242176 Len=0 TSval=1040024076 TSecr=2008897379","0.000015140","","","",""
"124","4.677453903","10.10.3.62","10.10.3.102","MPTCP","2940","55347  >  5201 [ACK] Seq=1 Ack=1 Win=64256 Len=2848 TSval=3346064582 TSecr=2492842313","","","","",""
"125","4.677466042","10.10.3.102","10.10.3.62","MPTCP","80","5201  >  55347 [ACK] Seq=1 Ack=2849 Win=239232 Len=0 TSval=2492842357 TSecr=3346064582","0.000012139","","","",""
"126","4.687968504","10.10.3.62","10.10.3.102","MPTCP","1516","55347  >  5201 [ACK] Seq=2849 Ack=1 Win=64256 Len=1424 TSval=3346064582 TSecr=2492842313","","","","",""
"127","4.688015556","10.10.3.102","10.10.3.62","MPTCP","80","5201  >  55347 [ACK] Seq=1 Ack=4273 Win=237952 Len=0 TSval=2492842367 TSecr=3346064582","0.000047052","","","",""
"128","4.690358016","10.10.3.105","10.10.3.102","MPTCP","140","32890  >  5201 [PSH, ACK] Seq=289814 Ack=1 Win=64256 Len=48 TSval=2008897392 TSecr=1040024076","","","","",""
"129","4.699688156","10.10.3.62","10.10.3.102","MPTCP","460","55347  >  5201 [PSH, ACK] Seq=4273 Ack=1 Win=64256 Len=368 TSval=3346064582 TSecr=2492842313","","","","",""
"130","4.699718148","10.10.3.102","10.10.3.62","MPTCP","80","5201  >  55347 [ACK] Seq=1 Ack=4641 Win=237696 Len=0 TSval=2492842379 TSecr=3346064582","0.000029992","","","",""
"131","4.703460889","10.10.3.62","10.10.3.102","MPTCP","1516","55347  >  5201 [ACK] Seq=4641 Ack=1 Win=64256 Len=1424 TSval=3346064583 TSecr=2492842313","","","","",""
"132","4.703490098","10.10.3.102","10.10.3.62","MPTCP","80","5201  >  55347 [ACK] Seq=1 Ack=6065 Win=236288 Len=0 TSval=2492842383 TSecr=3346064583","0.000029209","","","",""
"133","4.715338537","10.10.3.62","10.10.3.102","MPTCP","1516","55347  >  5201 [ACK] Seq=6065 Ack=1 Win=64256 Len=1424 TSval=3346064583 TSecr=2492842313","","","","",""
"134","4.715368259","10.10.3.102","10.10.3.62","MPTCP","80","5201  >  55347 [ACK] Seq=1 Ack=7489 Win=234880 Len=0 TSval=2492842395 TSecr=3346064583","0.000029722","","","",""
"135","4.727388495","10.10.3.62","10.10.3.102","MPTCP","1516","55347  >  5201 [ACK] Seq=7489 Ack=1 Win=64256 Len=1424 TSval=3346064583 TSecr=2492842313","","","","",""
"136","4.727417821","10.10.3.102","10.10.3.62","MPTCP","80","5201  >  55347 [ACK] Seq=1 Ack=8913 Win=233472 Len=0 TSval=2492842407 TSecr=3346064583","0.000029326","","","",""
"137","4.734242107","10.10.3.102","10.10.3.105","MPTCP","80","5201  >  32890 [ACK] Seq=1 Ack=289862 Win=242176 Len=0 TSval=1040024133 TSecr=2008897392","0.043884091","","","",""
"138","4.734467219","10.10.3.105","10.10.3.102","MPTCP","8956","32890  >  5201 [PSH, ACK] Seq=289862 Ack=1 Win=64256 Len=8864 TSval=2008897436 TSecr=1040024133","","","","",""
"139","4.734492412","10.10.3.102","10.10.3.105","MPTCP","80","5201  >  32890 [ACK] Seq=1 Ack=298726 Win=242176 Len=0 TSval=1040024133 TSecr=2008897436","0.000025193","","","",""
"140","4.739252975","10.10.3.62","10.10.3.102","MPTCP","1516","55347  >  5201 [ACK] Seq=8913 Ack=1 Win=64256 Len=1424 TSval=3346064583 TSecr=2492842313","","","","",""
"141","4.739282698","10.10.3.102","10.10.3.62","MPTCP","80","5201  >  55347 [ACK] Seq=1 Ack=10337 Win=240640 Len=0 TSval=2492842419 TSecr=3346064583","0.000029723","","","",""
"142","4.751118603","10.10.3.62","10.10.3.102","MPTCP","1516","55347  >  5201 [PSH, ACK] Seq=10337 Ack=1 Win=64256 Len=1424 TSval=3346064583 TSecr=2492842313","","","","",""
"143","4.751148010","10.10.3.102","10.10.3.62","MPTCP","80","5201  >  55347 [ACK] Seq=1 Ack=11761 Win=239360 Len=0 TSval=2492842431 TSecr=3346064583","0.000029407","","","",""
"144","4.752442937","10.10.3.105","10.10.3.102","MPTCP","124","32890  >  5201 [PSH, ACK] Seq=298726 Ack=1 Win=64256 Len=32 TSval=2008897454 TSecr=1040024133","","","","",""
"145","4.763095893","10.10.3.62","10.10.3.102","MPTCP","1516","55347  >  5201 [ACK] Seq=11761 Ack=1 Win=64256 Len=1424 TSval=3346064587 TSecr=2492842357","","","","",""
"146","4.763136000","10.10.3.102","10.10.3.62","MPTCP","80","5201  >  55347 [ACK] Seq=1 Ack=13185 Win=237952 Len=0 TSval=2492842443 TSecr=3346064587","0.000040107","","","",""
"147","4.774902602","10.10.3.62","10.10.3.102","MPTCP","1516","55347  >  5201 [ACK] Seq=13185 Ack=1 Win=64256 Len=1424 TSval=3346064587 TSecr=2492842357","","","","",""
"148","4.774948044","10.10.3.102","10.10.3.62","MPTCP","80","5201  >  55347 [ACK] Seq=1 Ack=14609 Win=236544 Len=0 TSval=2492842454 TSecr=3346064587","0.000045442","","","",""
"149","4.786787260","10.10.3.62","10.10.3.102","MPTCP","1516","55347  >  5201 [ACK] Seq=14609 Ack=1 Win=64256 Len=1424 TSval=3346064587 TSecr=2492842357","","","","",""
"150","4.786833529","10.10.3.102","10.10.3.62","MPTCP","80","5201  >  55347 [ACK] Seq=1 Ack=16033 Win=235136 Len=0 TSval=2492842466 TSecr=3346064587","0.000046269","","","",""
"151","4.794251053","10.10.3.102","10.10.3.105","MPTCP","80","5201  >  32890 [ACK] Seq=1 Ack=298758 Win=242176 Len=0 TSval=1040024193 TSecr=2008897454","0.041808116","","","",""
"153","4.794884605","10.10.3.105","10.10.3.102","MPTCP","7180","32890  >  5201 [PSH, ACK] Seq=298758 Ack=1 Win=64256 Len=7088 TSval=2008897497 TSecr=1040024193","","","","",""
"154","4.794932147","10.10.3.102","10.10.3.105","MPTCP","80","5201  >  32890 [ACK] Seq=1 Ack=305846 Win=242176 Len=0 TSval=1040024193 TSecr=2008897497","0.000047542","","","",""
"155","4.798620072","10.10.3.62","10.10.3.102","MPTCP","1516","55347  >  5201 [PSH, ACK] Seq=16033 Ack=1 Win=64256 Len=1424 TSval=3346064587 TSecr=2492842357","","","","",""
"156","4.798667250","10.10.3.102","10.10.3.62","MPTCP","80","5201  >  55347 [ACK] Seq=1 Ack=17457 Win=240640 Len=0 TSval=2492842478 TSecr=3346064587","0.000047178","","","",""
"157","4.810377201","10.10.3.62","10.10.3.102","MPTCP","316","55347  >  5201 [PSH, ACK] Seq=17457 Ack=1 Win=64256 Len=224 TSval=3346064608 TSecr=2492842379","","","","",""
"158","4.810438343","10.10.3.102","10.10.3.62","MPTCP","80","5201  >  55347 [ACK] Seq=1 Ack=17681 Win=240640 Len=0 TSval=2492842490 TSecr=3346064608","0.000061142","","","",""
"159","4.811806460","10.10.3.105","10.10.3.102","MPTCP","42812","32890  >  5201 [PSH, ACK] Seq=305846 Ack=1 Win=64256 Len=42720 TSval=2008897513 TSecr=1040024193","","","","",""
"160","4.811870673","10.10.3.102","10.10.3.105","MPTCP","80","5201  >  32890 [ACK] Seq=1 Ack=348566 Win=261888 Len=0 TSval=1040024210 TSecr=2008897513","0.000064213","","","",""
"161","4.811986820","10.10.3.105","10.10.3.102","MPTCP","20028","32890  >  5201 [PSH, ACK] Seq=348566 Ack=1 Win=64256 Len=19936 TSval=2008897513 TSecr=1040024193","","","","",""
"162","4.812005954","10.10.3.102","10.10.3.105","MPTCP","80","5201  >  32890 [ACK] Seq=1 Ack=368502 Win=277376 Len=0 TSval=1040024210 TSecr=2008897513","0.000019134","","","",""
"163","4.812054588","10.10.3.105","10.10.3.102","MPTCP","6684","32890  >  5201 [PSH, ACK] Seq=368502 Ack=1 Win=64256 Len=6592 TSval=2008897514 TSecr=1040024210","","","","",""
"164","4.812070286","10.10.3.102","10.10.3.105","MPTCP","80","5201  >  32890 [ACK] Seq=1 Ack=375094 Win=286336 Len=0 TSval=1040024211 TSecr=2008897514","0.000015698","","","",""
"165","4.812424553","10.10.3.105","10.10.3.102","MPTCP","42812","32890  >  5201 [PSH, ACK] Seq=375094 Ack=1 Win=64256 Len=42720 TSval=2008897514 TSecr=1040024210","","","","",""
"166","4.812449691","10.10.3.102","10.10.3.105","MPTCP","80","5201  >  32890 [ACK] Seq=1 Ack=417814 Win=286336 Len=0 TSval=1040024211 TSecr=2008897514","0.000025138","","","",""
"167","4.812580414","10.10.3.105","10.10.3.102","MPTCP","17180","32890  >  5201 [PSH, ACK] Seq=417814 Ack=1 Win=64256 Len=17088 TSval=2008897514 TSecr=1040024211","","","","",""
"168","4.812597118","10.10.3.102","10.10.3.105","MPTCP","80","5201  >  32890 [ACK] Seq=1 Ack=434902 Win=286336 Len=0 TSval=1040024211 TSecr=2008897514","0.000016704","","","",""
"169","4.812606154","10.10.3.105","10.10.3.102","MPTCP","2940","32890  >  5201 [PSH, ACK] Seq=434902 Ack=1 Win=64256 Len=2848 TSval=2008897515 TSecr=1040024211","","","","",""
"170","4.812616497","10.10.3.102","10.10.3.105","MPTCP","80","5201  >  32890 [ACK] Seq=1 Ack=437750 Win=286336 Len=0 TSval=1040024211 TSecr=2008897515","0.000010343","","","",""
"171","4.812974564","10.10.3.105","10.10.3.102","MPTCP","42812","32890  >  5201 [PSH, ACK] Seq=437750 Ack=1 Win=64256 Len=42720 TSval=2008897515 TSecr=1040024211","","","","",""
"172","4.813005444","10.10.3.102","10.10.3.105","MPTCP","80","5201  >  32890 [ACK] Seq=1 Ack=480470 Win=286336 Len=0 TSval=1040024211 TSecr=2008897515","0.000030880","","","",""
"173","4.813164993","10.10.3.105","10.10.3.102","MPTCP","20028","32890  >  5201 [PSH, ACK] Seq=480470 Ack=1 Win=64256 Len=19936 TSval=2008897515 TSecr=1040024211","","","","",""
"174","4.813182285","10.10.3.102","10.10.3.105","MPTCP","80","5201  >  32890 [ACK] Seq=1 Ack=500406 Win=286336 Len=0 TSval=1040024212 TSecr=2008897515","0.000017292","","","",""
"175","4.813374863","10.10.3.105","10.10.3.102","MPTCP","24300","32890  >  5201 [PSH, ACK] Seq=500406 Ack=1 Win=64256 Len=24208 TSval=2008897515 TSecr=1040024211","","","","",""
"176","4.813407122","10.10.3.102","10.10.3.105","MPTCP","80","5201  >  32890 [ACK] Seq=1 Ack=524614 Win=286336 Len=0 TSval=1040024212 TSecr=2008897515","0.000032259","","","",""
"177","4.813698681","10.10.3.105","10.10.3.102","MPTCP","38540","32890  >  5201 [PSH, ACK] Seq=524614 Ack=1 Win=64256 Len=38448 TSval=2008897515 TSecr=1040024211","","","","",""
"178","4.813729656","10.10.3.102","10.10.3.105","MPTCP","80","5201  >  32890 [ACK] Seq=1 Ack=563062 Win=286336 Len=0 TSval=1040024212 TSecr=2008897515","0.000030975","","","",""
"179","4.813751302","10.10.3.105","10.10.3.102","MPTCP","7212","32890  >  5201 [PSH, ACK] Seq=563062 Ack=1 Win=64256 Len=7120 TSval=2008897516 TSecr=1040024212","","","","",""
"180","4.813763753","10.10.3.102","10.10.3.105","MPTCP","80","5201  >  32890 [ACK] Seq=1 Ack=570182 Win=286336 Len=0 TSval=1040024212 TSecr=2008897516","0.000012451","","","",""
"181","4.813980126","10.10.3.105","10.10.3.102","MPTCP","25884","32890  >  5201 [PSH, ACK] Seq=570182 Ack=1 Win=64256 Len=25792 TSval=2008897516 TSecr=1040024212","","","","",""
"182","4.814022539","10.10.3.102","10.10.3.105","MPTCP","80","5201  >  32890 [ACK] Seq=1 Ack=595974 Win=286336 Len=0 TSval=1040024212 TSecr=2008897516","0.000042413","","","",""
"183","4.814889709","10.10.3.62","10.10.3.102","MPTCP","1516","55347  >  5201 [ACK] Seq=17681 Ack=1 Win=64256 Len=1424 TSval=3346064719 TSecr=2492842490","","","","",""
"184","4.814915631","10.10.3.102","10.10.3.62","MPTCP","80","5201  >  55347 [ACK] Seq=1 Ack=19105 Win=284800 Len=0 TSval=2492842494 TSecr=3346064719","0.000025922","","","",""
"185","4.824711917","10.10.3.62","10.10.3.102","MPTCP","1516","55347  >  5201 [ACK] Seq=19105 Ack=1 Win=64256 Len=1424 TSval=3346064719 TSecr=2492842490","","","","",""
"186","4.824733006","10.10.3.102","10.10.3.62","MPTCP","80","5201  >  55347 [ACK] Seq=1 Ack=20529 Win=283520 Len=0 TSval=2492842504 TSecr=3346064719","0.000021089","","","",""
"187","4.827238750","10.10.3.105","10.10.3.102","MPTCP","124","32890  >  5201 [PSH, ACK] Seq=595974 Ack=1 Win=64256 Len=32 TSval=2008897529 TSecr=1040024212","","","","",""
"188","4.836585947","10.10.3.62","10.10.3.102","MPTCP","1516","55347  >  5201 [ACK] Seq=20529 Ack=1 Win=64256 Len=1424 TSval=3346064719 TSecr=2492842490","","","","",""
"189","4.836607696","10.10.3.102","10.10.3.62","MPTCP","80","5201  >  55347 [ACK] Seq=1 Ack=21953 Win=282112 Len=0 TSval=2492842516 TSecr=3346064719","0.000021749","","","",""
"190","4.836650855","10.10.3.102","10.10.3.105","MPTCP","80","5201  >  32890 [ACK] Seq=1 Ack=596006 Win=288896 Len=0 TSval=1040024226 TSecr=2008897529","0.009412105","","","",""
"191","4.837073704","10.10.3.105","10.10.3.102","MPTCP","6892","32890  >  5201 [PSH, ACK] Seq=596006 Ack=1 Win=64256 Len=6800 TSval=2008897539 TSecr=1040024226","","","","",""
"192","4.837114240","10.10.3.102","10.10.3.105","MPTCP","80","5201  >  32890 [ACK] Seq=1 Ack=602806 Win=302592 Len=0 TSval=1040024236 TSecr=2008897539","0.000040536","","","",""
"193","4.837399167","10.10.3.105","10.10.3.102","MPTCP","13788","32890  >  5201 [PSH, ACK] Seq=602806 Ack=1 Win=64256 Len=13696 TSval=2008897539 TSecr=1040024236","","","","",""
"194","4.837410348","10.10.3.102","10.10.3.105","MPTCP","80","5201  >  32890 [ACK] Seq=1 Ack=616502 Win=329984 Len=0 TSval=1040024236 TSecr=2008897539","0.000011181","","","",""
"195","4.837742910","10.10.3.105","10.10.3.102","MPTCP","27484","32890  >  5201 [PSH, ACK] Seq=616502 Ack=1 Win=64256 Len=27392 TSval=2008897540 TSecr=1040024236","","","","",""
"196","4.837756646","10.10.3.102","10.10.3.105","MPTCP","80","5201  >  32890 [ACK] Seq=1 Ack=643894 Win=384768 Len=0 TSval=1040024236 TSecr=2008897540","0.000013736","","","",""
"197","4.838003851","10.10.3.105","10.10.3.102","MPTCP","18604","32890  >  5201 [ACK] Seq=643894 Ack=1 Win=64256 Len=18512 TSval=2008897540 TSecr=1040024236","","","","",""
"198","4.838018122","10.10.3.102","10.10.3.105","MPTCP","80","5201  >  32890 [ACK] Seq=1 Ack=662406 Win=421760 Len=0 TSval=1040024237 TSecr=2008897540","0.000014271","","","",""
"199","4.838251730","10.10.3.105","10.10.3.102","MPTCP","27148","32890  >  5201 [PSH, ACK] Seq=662406 Ack=1 Win=64256 Len=27056 TSval=2008897540 TSecr=1040024236","","","","",""
"200","4.838260255","10.10.3.102","10.10.3.105","MPTCP","80","5201  >  32890 [ACK] Seq=1 Ack=689462 Win=475904 Len=0 TSval=1040024237 TSecr=2008897540","0.000008525","","","",""
"201","4.838310463","10.10.3.105","10.10.3.102","MPTCP","9308","32890  >  5201 [PSH, ACK] Seq=689462 Ack=1 Win=64256 Len=9216 TSval=2008897540 TSecr=1040024236","","","","",""
"202","4.838317928","10.10.3.102","10.10.3.105","MPTCP","80","5201  >  32890 [ACK] Seq=1 Ack=698678 Win=494336 Len=0 TSval=1040024237 TSecr=2008897540","0.000007465","","","",""
"203","4.838624074","10.10.3.105","10.10.3.102","MPTCP","35692","32890  >  5201 [PSH, ACK] Seq=698678 Ack=1 Win=64256 Len=35600 TSval=2008897540 TSecr=1040024237","","","","",""
"204","4.838633747","10.10.3.102","10.10.3.105","MPTCP","80","5201  >  32890 [ACK] Seq=1 Ack=734278 Win=565504 Len=0 TSval=1040024237 TSecr=2008897540","0.000009673","","","",""
"205","4.838636809","10.10.3.105","10.10.3.102","MPTCP","1484","32890  >  5201 [PSH, ACK] Seq=734278 Ack=1 Win=64256 Len=1392 TSval=2008897540 TSecr=1040024237","","","","",""
"206","4.838640469","10.10.3.102","10.10.3.105","MPTCP","80","5201  >  32890 [ACK] Seq=1 Ack=735670 Win=568448 Len=0 TSval=1040024237 TSecr=2008897540","0.000003660","","","",""
"207","4.839035480","10.10.3.105","10.10.3.102","MPTCP","45660","32890  >  5201 [PSH, ACK] Seq=735670 Ack=1 Win=64256 Len=45568 TSval=2008897540 TSecr=1040024237","","","","",""
"208","4.839045997","10.10.3.102","10.10.3.105","MPTCP","80","5201  >  32890 [ACK] Seq=1 Ack=781238 Win=659584 Len=0 TSval=1040024238 TSecr=2008897540","0.000010517","","","",""
"209","4.839117756","10.10.3.105","10.10.3.102","MPTCP","8636","32890  >  5201 [PSH, ACK] Seq=781238 Ack=1 Win=64256 Len=8544 TSval=2008897541 TSecr=1040024237","","","","",""
"210","4.839122972","10.10.3.102","10.10.3.105","MPTCP","80","5201  >  32890 [ACK] Seq=1 Ack=789782 Win=676608 Len=0 TSval=1040024238 TSecr=2008897541","0.000005216","","","",""
"211","4.839193672","10.10.3.105","10.10.3.102","MPTCP","8636","32890  >  5201 [PSH, ACK] Seq=789782 Ack=1 Win=64256 Len=8544 TSval=2008897541 TSecr=1040024237","","","","",""
"212","4.839198933","10.10.3.102","10.10.3.105","MPTCP","80","5201  >  32890 [ACK] Seq=1 Ack=798326 Win=693760 Len=0 TSval=1040024238 TSecr=2008897541","0.000005261","","","",""
"213","4.839433098","10.10.3.105","10.10.3.102","MPTCP","28572","32890  >  5201 [PSH, ACK] Seq=798326 Ack=1 Win=64256 Len=28480 TSval=2008897541 TSecr=1040024237","","","","",""
"214","4.839440967","10.10.3.102","10.10.3.105","MPTCP","80","5201  >  32890 [ACK] Seq=1 Ack=826806 Win=750720 Len=0 TSval=1040024238 TSecr=2008897541","0.000007869","","","",""
"215","4.839721199","10.10.3.105","10.10.3.102","MPTCP","34268","32890  >  5201 [PSH, ACK] Seq=826806 Ack=1 Win=64256 Len=34176 TSval=2008897541 TSecr=1040024238","","","","",""
"216","4.839728811","10.10.3.102","10.10.3.105","MPTCP","80","5201  >  32890 [ACK] Seq=1 Ack=860982 Win=819072 Len=0 TSval=1040024238 TSecr=2008897541","0.000007612","","","",""
"217","4.839847865","10.10.3.105","10.10.3.102","MPTCP","14332","32890  >  5201 [PSH, ACK] Seq=860982 Ack=1 Win=64256 Len=14240 TSval=2008897542 TSecr=1040024238","","","","",""
"218","4.839853521","10.10.3.102","10.10.3.105","MPTCP","80","5201  >  32890 [ACK] Seq=1 Ack=875222 Win=847488 Len=0 TSval=1040024238 TSecr=2008897542","0.000005656","","","",""
"219","4.840014883","10.10.3.105","10.10.3.102","MPTCP","18604","32890  >  5201 [PSH, ACK] Seq=875222 Ack=1 Win=64256 Len=18512 TSval=2008897542 TSecr=1040024238","","","","",""
"220","4.840020712","10.10.3.102","10.10.3.105","MPTCP","80","5201  >  32890 [ACK] Seq=1 Ack=893734 Win=884480 Len=0 TSval=1040024239 TSecr=2008897542","0.000005829","","","",""
"221","4.840260300","10.10.3.105","10.10.3.102","MPTCP","29996","32890  >  5201 [PSH, ACK] Seq=893734 Ack=1 Win=64256 Len=29904 TSval=2008897542 TSecr=1040024238","","","","",""
"222","4.840267555","10.10.3.102","10.10.3.105","MPTCP","80","5201  >  32890 [ACK] Seq=1 Ack=923638 Win=944384 Len=0 TSval=1040024239 TSecr=2008897542","0.000007255","","","",""
"223","4.840568603","10.10.3.105","10.10.3.102","MPTCP","35692","32890  >  5201 [PSH, ACK] Seq=923638 Ack=1 Win=64256 Len=35600 TSval=2008897542 TSecr=1040024238","","","","",""
"224","4.840580403","10.10.3.102","10.10.3.105","MPTCP","80","5201  >  32890 [ACK] Seq=1 Ack=959238 Win=1015552 Len=0 TSval=1040024239 TSecr=2008897542","0.000011800","","","",""
"225","4.840812165","10.10.3.105","10.10.3.102","MPTCP","27148","32890  >  5201 [PSH, ACK] Seq=959238 Ack=1 Win=64256 Len=27056 TSval=2008897542 TSecr=1040024239","","","","",""
"226","4.840819386","10.10.3.102","10.10.3.105","MPTCP","80","5201  >  32890 [ACK] Seq=1 Ack=986294 Win=1069696 Len=0 TSval=1040024239 TSecr=2008897542","0.000007221","","","",""
"227","4.840892933","10.10.3.105","10.10.3.102","MPTCP","10724","32890  >  5201 [PSH, ACK] Seq=986294 Ack=1 Win=64256 Len=10632 TSval=2008897542 TSecr=1040024239","","","","",""
"228","4.840897742","10.10.3.102","10.10.3.105","MPTCP","80","5201  >  32890 [ACK] Seq=1 Ack=996926 Win=1090944 Len=0 TSval=1040024239 TSecr=2008897542","0.000004809","","","",""
"229","4.848428444","10.10.3.62","10.10.3.102","MPTCP","1516","55347  >  5201 [ACK] Seq=21953 Ack=1 Win=64256 Len=1424 TSval=3346064719 TSecr=2492842490","","","","",""
"230","4.848436186","10.10.3.102","10.10.3.62","MPTCP","80","5201  >  55347 [ACK] Seq=1 Ack=23377 Win=1089408 Len=0 TSval=2492842528 TSecr=3346064719","0.000007742","","","",""
"231","4.860342326","10.10.3.62","10.10.3.102","MPTCP","1516","55347  >  5201 [ACK] Seq=23377 Ack=1 Win=64256 Len=1424 TSval=3346064719 TSecr=2492842490","","","","",""
"232","4.860378912","10.10.3.102","10.10.3.62","MPTCP","80","5201  >  55347 [ACK] Seq=1 Ack=24801 Win=1088128 Len=0 TSval=2492842540 TSecr=3346064719","0.000036586","","","",""
"233","4.872232501","10.10.3.62","10.10.3.102","MPTCP","1516","55347  >  5201 [ACK] Seq=24801 Ack=1 Win=64256 Len=1424 TSval=3346064719 TSecr=2492842490","","","","",""
"234","4.872275467","10.10.3.102","10.10.3.62","MPTCP","80","5201  >  55347 [ACK] Seq=1 Ack=26225 Win=1086720 Len=0 TSval=2492842552 TSecr=3346064719","0.000042966","","","",""
"235","4.884282354","10.10.3.62","10.10.3.102","MPTCP","1516","55347  >  5201 [ACK] Seq=26225 Ack=1 Win=64256 Len=1424 TSval=3346064719 TSecr=2492842490","","","","",""
"236","4.884327749","10.10.3.102","10.10.3.62","MPTCP","80","5201  >  55347 [ACK] Seq=1 Ack=27649 Win=1085312 Len=0 TSval=2492842564 TSecr=3346064719","0.000045395","","","",""
"237","4.895978798","10.10.3.62","10.10.3.102","MPTCP","1516","55347  >  5201 [ACK] Seq=27649 Ack=1 Win=64256 Len=1424 TSval=3346064719 TSecr=2492842490","","","","",""
"238","4.896021590","10.10.3.102","10.10.3.62","MPTCP","80","5201  >  55347 [ACK] Seq=1 Ack=29073 Win=1083904 Len=0 TSval=2492842575 TSecr=3346064719","0.000042792","","","",""
"240","4.907847645","10.10.3.62","10.10.3.102","MPTCP","1516","55347  >  5201 [ACK] Seq=29073 Ack=1 Win=64256 Len=1424 TSval=3346064719 TSecr=2492842490","","","","",""
"241","4.907877573","10.10.3.102","10.10.3.62","MPTCP","80","5201  >  55347 [ACK] Seq=1 Ack=30497 Win=1082496 Len=0 TSval=2492842587 TSecr=3346064719","0.000029928","","","",""
"242","4.919888977","10.10.3.62","10.10.3.102","MPTCP","1516","55347  >  5201 [ACK] Seq=30497 Ack=1 Win=64256 Len=1424 TSval=3346064719 TSecr=2492842490","","","","",""
"243","4.919934298","10.10.3.102","10.10.3.62","MPTCP","80","5201  >  55347 [ACK] Seq=1 Ack=31921 Win=1081088 Len=0 TSval=2492842599 TSecr=3346064719","0.000045321","","","",""
"245","4.931574448","10.10.3.62","10.10.3.102","MPTCP","1516","55347  >  5201 [PSH, ACK] Seq=31921 Ack=1 Win=64256 Len=1424 TSval=3346064719 TSecr=2492842490","","","","",""
"246","4.931616159","10.10.3.102","10.10.3.62","MPTCP","80","5201  >  55347 [ACK] Seq=1 Ack=33345 Win=1079680 Len=0 TSval=2492842611 TSecr=3346064719","0.000041711","","","",""
"247","4.943652653","10.10.3.62","10.10.3.102","MPTCP","1516","55347  >  5201 [ACK] Seq=33345 Ack=1 Win=64256 Len=1424 TSval=3346064719 TSecr=2492842490","","","","",""
"248","4.943697819","10.10.3.102","10.10.3.62","MPTCP","80","5201  >  55347 [ACK] Seq=1 Ack=34769 Win=1078272 Len=0 TSval=2492842623 TSecr=3346064719","0.000045166","","","",""
"249","4.955358280","10.10.3.62","10.10.3.102","MPTCP","1516","55347  >  5201 [ACK] Seq=34769 Ack=1 Win=64256 Len=1424 TSval=3346064719 TSecr=2492842490","","","","",""
"250","4.955404871","10.10.3.102","10.10.3.62","MPTCP","80","5201  >  55347 [ACK] Seq=1 Ack=36193 Win=1076864 Len=0 TSval=2492842635 TSecr=3346064719","0.000046591","","","",""
"251","4.967196388","10.10.3.62","10.10.3.102","MPTCP","1516","55347  >  5201 [ACK] Seq=36193 Ack=1 Win=64256 Len=1424 TSval=3346064719 TSecr=2492842490","","","","",""
"252","4.967218221","10.10.3.102","10.10.3.62","MPTCP","80","5201  >  55347 [ACK] Seq=1 Ack=37617 Win=1075456 Len=0 TSval=2492842647 TSecr=3346064719","0.000021833","","","",""
"253","4.979249808","10.10.3.62","10.10.3.102","MPTCP","1516","55347  >  5201 [ACK] Seq=37617 Ack=1 Win=64256 Len=1424 TSval=3346064719 TSecr=2492842490","","","","",""
"254","4.979271701","10.10.3.102","10.10.3.62","MPTCP","80","5201  >  55347 [ACK] Seq=1 Ack=39041 Win=1074048 Len=0 TSval=2492842659 TSecr=3346064719","0.000021893","","","",""
"255","4.990949856","10.10.3.62","10.10.3.102","MPTCP","1516","55347  >  5201 [ACK] Seq=39041 Ack=1 Win=64256 Len=1424 TSval=3346064719 TSecr=2492842490","","","","",""
"256","4.990968479","10.10.3.102","10.10.3.62","MPTCP","80","5201  >  55347 [ACK] Seq=1 Ack=40465 Win=1072640 Len=0 TSval=2492842670 TSecr=3346064719","0.000018623","","","",""
"257","5.002913841","10.10.3.62","10.10.3.102","MPTCP","1516","55347  >  5201 [ACK] Seq=40465 Ack=1 Win=64256 Len=1424 TSval=3346064719 TSecr=2492842490","","","","",""
"258","5.002934492","10.10.3.102","10.10.3.62","MPTCP","80","5201  >  55347 [ACK] Seq=1 Ack=41889 Win=1071232 Len=0 TSval=2492842682 TSecr=3346064719","0.000020651","","","",""
"259","5.014897121","10.10.3.62","10.10.3.102","MPTCP","1516","55347  >  5201 [ACK] Seq=41889 Ack=1 Win=64256 Len=1424 TSval=3346064719 TSecr=2492842490","","","","",""
"260","5.014920238","10.10.3.102","10.10.3.62","MPTCP","80","5201  >  55347 [ACK] Seq=1 Ack=43313 Win=1069824 Len=0 TSval=2492842694 TSecr=3346064719","0.000023117","","","",""
"261","5.026612140","10.10.3.62","10.10.3.102","MPTCP","1516","55347  >  5201 [ACK] Seq=43313 Ack=1 Win=64256 Len=1424 TSval=3346064719 TSecr=2492842490","","","","",""
"262","5.026634524","10.10.3.102","10.10.3.62","MPTCP","80","5201  >  55347 [ACK] Seq=1 Ack=44737 Win=1068416 Len=0 TSval=2492842706 TSecr=3346064719","0.000022384","","","",""
"263","5.038645066","10.10.3.62","10.10.3.102","MPTCP","1516","55347  >  5201 [ACK] Seq=44737 Ack=1 Win=64256 Len=1424 TSval=3346064719 TSecr=2492842490","","","","",""
"264","5.038675588","10.10.3.102","10.10.3.62","MPTCP","80","5201  >  55347 [ACK] Seq=1 Ack=46161 Win=1067008 Len=0 TSval=2492842718 TSecr=3346064719","0.000030522","","","",""
"265","5.050536297","10.10.3.62","10.10.3.102","MPTCP","1516","55347  >  5201 [ACK] Seq=46161 Ack=1 Win=64256 Len=1424 TSval=3346064719 TSecr=2492842490","","","","",""
"266","5.050570727","10.10.3.102","10.10.3.62","MPTCP","80","5201  >  55347 [ACK] Seq=1 Ack=47585 Win=1065600 Len=0 TSval=2492842730 TSecr=3346064719","0.000034430","","","",""
"267","5.062371328","10.10.3.62","10.10.3.102","MPTCP","1516","55347  >  5201 [PSH, ACK] Seq=47585 Ack=1 Win=64256 Len=1424 TSval=3346064719 TSecr=2492842490","","","","",""
"268","5.062413046","10.10.3.102","10.10.3.62","MPTCP","80","5201  >  55347 [ACK] Seq=1 Ack=49009 Win=1064192 Len=0 TSval=2492842742 TSecr=3346064719","0.000041718","","","",""
"269","5.074270160","10.10.3.62","10.10.3.102","MPTCP","1516","55347  >  5201 [ACK] Seq=49009 Ack=1 Win=64256 Len=1424 TSval=3346064734 TSecr=2492842494","","","","",""
"270","5.074315304","10.10.3.102","10.10.3.62","MPTCP","80","5201  >  55347 [ACK] Seq=1 Ack=50433 Win=1062784 Len=0 TSval=2492842754 TSecr=3346064734","0.000045144","","","",""
"271","5.086126323","10.10.3.62","10.10.3.102","MPTCP","1516","55347  >  5201 [PSH, ACK] Seq=50433 Ack=1 Win=64256 Len=1424 TSval=3346064734 TSecr=2492842494","","","","",""
"272","5.086172205","10.10.3.102","10.10.3.62","MPTCP","80","5201  >  55347 [ACK] Seq=1 Ack=51857 Win=1061376 Len=0 TSval=2492842766 TSecr=3346064734","0.000045882","","","",""
"273","5.093896524","10.10.3.59","10.10.3.105","MPTCP","92","5201  >  34069 [SYN, ACK] Seq=0 Ack=1 Win=65160 Len=0 MSS=1460 SACK_PERM=1 TSval=1400132370 TSecr=938152624 WS=128","0.500103515","","","",""
"274","5.096361912","10.10.3.105","10.10.3.59","MPTCP","92","34069  >  5201 [ACK] Seq=1 Ack=1 Win=64256 Len=0 TSval=938153130 TSecr=1400132370","0.002465388","","","",""
"275","5.097829975","10.10.3.62","10.10.3.102","MPTCP","1516","55347  >  5201 [ACK] Seq=51857 Ack=1 Win=64256 Len=1424 TSval=3346064734 TSecr=2492842494","","","","",""
"276","5.097862033","10.10.3.102","10.10.3.62","MPTCP","80","5201  >  55347 [ACK] Seq=1 Ack=53281 Win=1059968 Len=0 TSval=2492842777 TSecr=3346064734","0.000032058","","","",""
"277","5.109680824","10.10.3.62","10.10.3.102","MPTCP","1516","55347  >  5201 [PSH, ACK] Seq=53281 Ack=1 Win=64256 Len=1424 TSval=3346064734 TSecr=2492842494","","","","",""
"278","5.109712769","10.10.3.102","10.10.3.62","MPTCP","80","5201  >  55347 [ACK] Seq=1 Ack=54705 Win=1058560 Len=0 TSval=2492842789 TSecr=3346064734","0.000031945","","","",""
"280","5.121762073","10.10.3.62","10.10.3.102","MPTCP","1516","55347  >  5201 [ACK] Seq=54705 Ack=1 Win=64256 Len=1424 TSval=3346064734 TSecr=2492842504","","","","",""
"281","5.121807533","10.10.3.102","10.10.3.62","MPTCP","80","5201  >  55347 [ACK] Seq=1 Ack=56129 Win=1057152 Len=0 TSval=2492842801 TSecr=3346064734","0.000045460","","","",""
"283","5.132747765","10.10.3.59","10.10.3.105","MPTCP","92","5201  >  35825 [SYN, ACK] Seq=0 Ack=1 Win=65160 Len=0 MSS=1460 SACK_PERM=1 TSval=1400132409 TSecr=938152666 WS=128","0.500109250","","","",""
"284","5.133610259","10.10.3.62","10.10.3.102","MPTCP","1516","55347  >  5201 [PSH, ACK] Seq=56129 Ack=1 Win=64256 Len=1424 TSval=3346064734 TSecr=2492842504","","","","",""
"285","5.133655413","10.10.3.102","10.10.3.62","MPTCP","80","5201  >  55347 [ACK] Seq=1 Ack=57553 Win=1055744 Len=0 TSval=2492842813 TSecr=3346064734","0.000045154","","","",""
"286","5.134939181","10.10.3.105","10.10.3.102","MPTCP","7212","32890  >  5201 [PSH, ACK] Seq=996926 Ack=1 Win=64256 Len=7120 TSval=2008897837 TSecr=1040024239","","","","",""
