"No.","Time","Source","Destination","Protocol","Length","Info","RTT","Lost Segement","Duplicate ","Retransmission","IDK"
"8","1.308631717","10.10.3.105","10.10.3.102","MPTCP","80","46094  >  5201 [SYN] Seq=0 Win=64240 Len=0 MSS=1460 SACK_PERM=1 TSval=2009618084 TSecr=0 WS=128","","","","",""
"9","1.308686773","10.10.3.102","10.10.3.105","MPTCP","88","5201  >  46094 [SYN, ACK] Seq=0 Ack=1 Win=65160 Len=0 MSS=1460 SACK_PERM=1 TSval=1040744782 TSecr=2009618084 WS=128","0.000055056","","","",""
"10","1.308995503","10.10.3.105","10.10.3.102","MPTCP","88","46094  >  5201 [ACK] Seq=1 Ack=1 Win=64256 Len=0 TSval=2009618084 TSecr=1040744782","0.000308730","","","",""
"11","1.308996163","10.10.3.105","10.10.3.102","MPTCP","129","46094  >  5201 [PSH, ACK] Seq=1 Ack=1 Win=64256 Len=37 TSval=2009618084 TSecr=1040744782","","","","",""
"12","1.309152699","10.10.3.102","10.10.3.105","MPTCP","80","5201  >  46094 [ACK] Seq=1 Ack=38 Win=65152 Len=0 TSval=1040744783 TSecr=2009618084","0.000156536","","","",""
"13","1.309283082","10.10.3.102","10.10.3.105","MPTCP","97","5201  >  46094 [PSH, ACK] Seq=1 Ack=38 Win=65152 Len=1 TSval=1040744783 TSecr=2009618084","","","","",""
"14","1.309374921","10.10.3.102","10.10.3.105","MPTCP","84","[TCP Dup ACK 12#1] 5201  >  46094 [ACK] Seq=2 Ack=38 Win=65152 Len=0 TSval=1040744783 TSecr=2009618084","","","â\234\223","","â\234\223"
"15","1.309411635","10.10.3.105","10.10.3.102","MPTCP","80","46094  >  5201 [ACK] Seq=38 Ack=2 Win=64256 Len=0 TSval=2009618085 TSecr=1040744783","0.000128553","","","",""
"16","1.309463567","10.10.3.105","10.10.3.102","MPTCP","76","[TCP Dup ACK 15#1] 46094  >  5201 [ACK] Seq=38 Ack=2 Win=64256 Len=0 TSval=2009618085 TSecr=1040744783","","","â\234\223","","â\234\223"
"17","1.309538246","10.10.3.105","10.10.3.102","MPTCP","100","46094  >  5201 [PSH, ACK] Seq=38 Ack=2 Win=64256 Len=4 TSval=2009618085 TSecr=1040744783","","","","",""
"18","1.310078716","10.10.3.105","10.10.3.59","MPTCP","88","42475  >  5201 [SYN] Seq=0 Win=64256 Len=0 MSS=1460 SACK_PERM=1 TSval=938873417 TSecr=0 WS=128","","","","",""
"19","1.310139222","10.10.3.59","10.10.3.105","MPTCP","92","5201  >  42475 [SYN, ACK] Seq=0 Ack=1 Win=65160 Len=0 MSS=1460 SACK_PERM=1 TSval=1400853162 TSecr=938873417 WS=128","0.000060506","","","",""
"20","1.354928100","10.10.3.102","10.10.3.105","MPTCP","80","5201  >  46094 [ACK] Seq=2 Ack=42 Win=65152 Len=0 TSval=1040744829 TSecr=2009618085","0.045389854","","","",""
"21","1.355148347","10.10.3.105","10.10.3.102","MPTCP","196","46094  >  5201 [PSH, ACK] Seq=42 Ack=2 Win=64256 Len=100 TSval=2009618130 TSecr=1040744829","","","","",""
"22","1.355193613","10.10.3.102","10.10.3.105","MPTCP","80","5201  >  46094 [ACK] Seq=2 Ack=142 Win=65152 Len=0 TSval=1040744829 TSecr=2009618130","0.000045266","","","",""
"23","1.355253247","10.10.3.102","10.10.3.105","MPTCP","97","5201  >  46094 [PSH, ACK] Seq=2 Ack=142 Win=65152 Len=1 TSval=1040744829 TSecr=2009618130","","","","",""
"24","1.355473816","10.10.3.105","10.10.3.102","MPTCP","80","46102  >  5201 [SYN] Seq=0 Win=64240 Len=0 MSS=1460 SACK_PERM=1 TSval=2009618131 TSecr=0 WS=128","","","","",""
"25","1.355495628","10.10.3.102","10.10.3.105","MPTCP","88","5201  >  46102 [SYN, ACK] Seq=0 Ack=1 Win=65160 Len=0 MSS=1460 SACK_PERM=1 TSval=1040744829 TSecr=2009618131 WS=128","0.000021812","","","",""
"27","1.355587450","10.10.3.105","10.10.3.102","MPTCP","88","46102  >  5201 [ACK] Seq=1 Ack=1 Win=64256 Len=0 TSval=2009618131 TSecr=1040744829","0.000091822","","","",""
"28","1.355651522","10.10.3.105","10.10.3.102","MPTCP","129","46102  >  5201 [PSH, ACK] Seq=1 Ack=1 Win=64256 Len=37 TSval=2009618131 TSecr=1040744829","","","","",""
"29","1.355665591","10.10.3.102","10.10.3.105","MPTCP","80","5201  >  46102 [ACK] Seq=1 Ack=38 Win=65152 Len=0 TSval=1040744829 TSecr=2009618131","0.000014069","","","",""
"30","1.356048390","10.10.3.102","10.10.3.105","MPTCP","84","5201  >  46102 [ACK] Seq=1 Ack=38 Win=65152 Len=0 TSval=1040744829 TSecr=2009618131","","","","",""
"31","1.356144415","10.10.3.105","10.10.3.102","MPTCP","76","46102  >  5201 [ACK] Seq=38 Ack=1 Win=64256 Len=0 TSval=2009618131 TSecr=1040744829","","","","",""
"33","1.358478181","10.10.3.105","10.10.3.59","MPTCP","88","41489  >  5201 [SYN] Seq=0 Win=64256 Len=0 MSS=1460 SACK_PERM=1 TSval=938873463 TSecr=0 WS=128","","","","",""
"34","1.358498627","10.10.3.59","10.10.3.105","MPTCP","92","5201  >  41489 [SYN, ACK] Seq=0 Ack=1 Win=65160 Len=0 MSS=1460 SACK_PERM=1 TSval=1400853210 TSecr=938873463 WS=128","0.000020446","","","",""
"35","1.397408421","10.10.3.105","10.10.3.102","MPTCP","80","46094  >  5201 [ACK] Seq=142 Ack=3 Win=64256 Len=0 TSval=2009618173 TSecr=1040744829","0.042155174","","","",""
"36","1.397457466","10.10.3.102","10.10.3.105","MPTCP","98","5201  >  46094 [PSH, ACK] Seq=3 Ack=142 Win=65152 Len=2 TSval=1040744871 TSecr=2009618173","","","","",""
"37","1.397557334","10.10.3.105","10.10.3.102","MPTCP","80","46094  >  5201 [ACK] Seq=142 Ack=5 Win=64256 Len=0 TSval=2009618173 TSecr=1040744871","0.000099868","","","",""
"38","1.397669126","10.10.3.105","10.10.3.102","MPTCP","7212","46102  >  5201 [PSH, ACK] Seq=38 Ack=1 Win=64256 Len=7120 TSval=2009618173 TSecr=1040744829","","","","",""
"39","1.397695810","10.10.3.102","10.10.3.105","MPTCP","80","5201  >  46102 [ACK] Seq=1 Ack=7158 Win=60672 Len=0 TSval=1040744871 TSecr=2009618173","0.000026684","","","",""
"40","1.397733299","10.10.3.105","10.10.3.102","MPTCP","7212","46102  >  5201 [PSH, ACK] Seq=7158 Ack=1 Win=64256 Len=7120 TSval=2009618173 TSecr=1040744829","","","","",""
"41","1.397746393","10.10.3.102","10.10.3.105","MPTCP","80","5201  >  46102 [ACK] Seq=1 Ack=14278 Win=55680 Len=0 TSval=1040744871 TSecr=2009618173","0.000013094","","","",""
"42","1.397963986","10.10.3.105","10.10.3.102","MPTCP","10060","46102  >  5201 [PSH, ACK] Seq=14278 Ack=1 Win=64256 Len=9968 TSval=2009618173 TSecr=1040744871","","","","",""
"43","1.397998320","10.10.3.102","10.10.3.105","MPTCP","80","5201  >  46102 [ACK] Seq=1 Ack=24246 Win=58752 Len=0 TSval=1040744872 TSecr=2009618173","0.000034334","","","",""
"44","1.398045372","10.10.3.105","10.10.3.102","MPTCP","7212","46102  >  5201 [PSH, ACK] Seq=24246 Ack=1 Win=64256 Len=7120 TSval=2009618173 TSecr=1040744871","","","","",""
"45","1.398058772","10.10.3.102","10.10.3.105","MPTCP","80","5201  >  46102 [ACK] Seq=1 Ack=31366 Win=53760 Len=0 TSval=1040744872 TSecr=2009618173","0.000013400","","","",""
"46","1.398094907","10.10.3.105","10.10.3.102","MPTCP","11484","46102  >  5201 [PSH, ACK] Seq=31366 Ack=1 Win=64256 Len=11392 TSval=2009618173 TSecr=1040744871","","","","",""
"47","1.398108871","10.10.3.102","10.10.3.105","MPTCP","80","5201  >  46102 [ACK] Seq=1 Ack=42758 Win=86912 Len=0 TSval=1040744872 TSecr=2009618173","0.000013964","","","",""
"48","1.398259749","10.10.3.105","10.10.3.102","MPTCP","18604","46102  >  5201 [PSH, ACK] Seq=42758 Ack=1 Win=64256 Len=18512 TSval=2009618173 TSecr=1040744872","","","","",""
"49","1.398276220","10.10.3.102","10.10.3.105","MPTCP","80","5201  >  46102 [ACK] Seq=1 Ack=61270 Win=123904 Len=0 TSval=1040744872 TSecr=2009618173","0.000016471","","","",""
"50","1.398284032","10.10.3.105","10.10.3.102","MPTCP","1516","46102  >  5201 [ACK] Seq=61270 Ack=1 Win=64256 Len=1424 TSval=2009618173 TSecr=1040744872","","","","",""
"51","1.398292989","10.10.3.102","10.10.3.105","MPTCP","80","5201  >  46102 [ACK] Seq=1 Ack=62694 Win=126848 Len=0 TSval=1040744872 TSecr=2009618173","0.000008957","","","",""
"52","1.398525850","10.10.3.105","10.10.3.102","MPTCP","28572","46102  >  5201 [PSH, ACK] Seq=62694 Ack=1 Win=64256 Len=28480 TSval=2009618173 TSecr=1040744872","","","","",""
"53","1.398544459","10.10.3.102","10.10.3.105","MPTCP","80","5201  >  46102 [ACK] Seq=1 Ack=91174 Win=183808 Len=0 TSval=1040744872 TSecr=2009618173","0.000018609","","","",""
"54","1.398643878","10.10.3.105","10.10.3.102","MPTCP","14332","46102  >  5201 [PSH, ACK] Seq=91174 Ack=1 Win=64256 Len=14240 TSval=2009618174 TSecr=1040744872","","","","",""
"55","1.398658251","10.10.3.102","10.10.3.105","MPTCP","80","5201  >  46102 [ACK] Seq=1 Ack=105414 Win=212224 Len=0 TSval=1040744872 TSecr=2009618174","0.000014373","","","",""
"56","1.398837560","10.10.3.105","10.10.3.102","MPTCP","22876","46102  >  5201 [ACK] Seq=105414 Ack=1 Win=64256 Len=22784 TSval=2009618174 TSecr=1040744872","","","","",""
"57","1.398854679","10.10.3.102","10.10.3.105","MPTCP","80","5201  >  46102 [ACK] Seq=1 Ack=128198 Win=257792 Len=0 TSval=1040744873 TSecr=2009618174","0.000017119","","","",""
"58","1.398918656","10.10.3.105","10.10.3.102","MPTCP","8636","46102  >  5201 [PSH, ACK] Seq=128198 Ack=1 Win=64256 Len=8544 TSval=2009618174 TSecr=1040744872","","","","",""
"59","1.398930429","10.10.3.102","10.10.3.105","MPTCP","80","5201  >  46102 [ACK] Seq=1 Ack=136742 Win=274944 Len=0 TSval=1040744873 TSecr=2009618174","0.000011773","","","",""
"60","1.399185606","10.10.3.105","10.10.3.102","MPTCP","29996","46102  >  5201 [PSH, ACK] Seq=136742 Ack=1 Win=64256 Len=29904 TSval=2009618174 TSecr=1040744872","","","","",""
"61","1.399204129","10.10.3.102","10.10.3.105","MPTCP","80","5201  >  46102 [ACK] Seq=1 Ack=166646 Win=270592 Len=0 TSval=1040744873 TSecr=2009618174","0.000018523","","","",""
"62","1.399524474","10.10.3.105","10.10.3.102","MPTCP","39964","46102  >  5201 [PSH, ACK] Seq=166646 Ack=1 Win=64256 Len=39872 TSval=2009618174 TSecr=1040744873","","","","",""
"63","1.399545492","10.10.3.102","10.10.3.105","MPTCP","80","5201  >  46102 [ACK] Seq=1 Ack=206518 Win=354688 Len=0 TSval=1040744873 TSecr=2009618174","0.000021018","","","",""
"64","1.399723961","10.10.3.105","10.10.3.102","MPTCP","22876","46102  >  5201 [PSH, ACK] Seq=206518 Ack=1 Win=64256 Len=22784 TSval=2009618175 TSecr=1040744873","","","","",""
"65","1.399740129","10.10.3.102","10.10.3.105","MPTCP","80","5201  >  46102 [ACK] Seq=1 Ack=229302 Win=400256 Len=0 TSval=1040744873 TSecr=2009618175","0.000016168","","","",""
"66","1.400064042","10.10.3.105","10.10.3.102","MPTCP","41388","46102  >  5201 [PSH, ACK] Seq=229302 Ack=1 Win=64256 Len=41296 TSval=2009618175 TSecr=1040744873","","","","",""
"67","1.400093490","10.10.3.102","10.10.3.105","MPTCP","80","5201  >  46102 [ACK] Seq=1 Ack=270598 Win=482816 Len=0 TSval=1040744874 TSecr=2009618175","0.000029448","","","",""
"68","1.400266611","10.10.3.105","10.10.3.102","MPTCP","21452","46102  >  5201 [PSH, ACK] Seq=270598 Ack=1 Win=64256 Len=21360 TSval=2009618175 TSecr=1040744873","","","","",""
"69","1.400282146","10.10.3.102","10.10.3.105","MPTCP","80","5201  >  46102 [ACK] Seq=1 Ack=291958 Win=525568 Len=0 TSval=1040744874 TSecr=2009618175","0.000015535","","","",""
"70","1.400434549","10.10.3.105","10.10.3.102","MPTCP","21452","46102  >  5201 [PSH, ACK] Seq=291958 Ack=1 Win=64256 Len=21360 TSval=2009618175 TSecr=1040744873","","","","",""
"71","1.400449841","10.10.3.102","10.10.3.105","MPTCP","80","5201  >  46102 [ACK] Seq=1 Ack=313318 Win=568320 Len=0 TSval=1040744874 TSecr=2009618175","0.000015292","","","",""
"72","1.400795671","10.10.3.105","10.10.3.102","MPTCP","41388","46102  >  5201 [PSH, ACK] Seq=313318 Ack=1 Win=64256 Len=41296 TSval=2009618175 TSecr=1040744874","","","","",""
"73","1.400816694","10.10.3.102","10.10.3.105","MPTCP","80","5201  >  46102 [ACK] Seq=1 Ack=354614 Win=650880 Len=0 TSval=1040744874 TSecr=2009618175","0.000021023","","","",""
"74","1.401188341","10.10.3.105","10.10.3.102","MPTCP","44236","46102  >  5201 [PSH, ACK] Seq=354614 Ack=1 Win=64256 Len=44144 TSval=2009618176 TSecr=1040744874","","","","",""
"75","1.401211112","10.10.3.102","10.10.3.105","MPTCP","80","5201  >  46102 [ACK] Seq=1 Ack=398758 Win=739200 Len=0 TSval=1040744875 TSecr=2009618176","0.000022771","","","",""
"76","1.401337581","10.10.3.105","10.10.3.102","MPTCP","18604","46102  >  5201 [PSH, ACK] Seq=398758 Ack=1 Win=64256 Len=18512 TSval=2009618176 TSecr=1040744874","","","","",""
"77","1.401352451","10.10.3.102","10.10.3.105","MPTCP","80","5201  >  46102 [ACK] Seq=1 Ack=417270 Win=776192 Len=0 TSval=1040744875 TSecr=2009618176","0.000014870","","","",""
"78","1.401728134","10.10.3.105","10.10.3.102","MPTCP","45660","46102  >  5201 [PSH, ACK] Seq=417270 Ack=1 Win=64256 Len=45568 TSval=2009618177 TSecr=1040744875","","","","",""
"79","1.401749971","10.10.3.102","10.10.3.105","MPTCP","80","5201  >  46102 [ACK] Seq=1 Ack=462838 Win=867328 Len=0 TSval=1040744875 TSecr=2009618177","0.000021837","","","",""
"80","1.401870521","10.10.3.105","10.10.3.102","MPTCP","17180","46102  >  5201 [PSH, ACK] Seq=462838 Ack=1 Win=64256 Len=17088 TSval=2009618177 TSecr=1040744875","","","","",""
"81","1.401884215","10.10.3.102","10.10.3.105","MPTCP","80","5201  >  46102 [ACK] Seq=1 Ack=479926 Win=901504 Len=0 TSval=1040744876 TSecr=2009618177","0.000013694","","","",""
"82","1.402147503","10.10.3.105","10.10.3.102","MPTCP","31420","46102  >  5201 [PSH, ACK] Seq=479926 Ack=1 Win=64256 Len=31328 TSval=2009618177 TSecr=1040744875","","","","",""
"83","1.402168192","10.10.3.102","10.10.3.105","MPTCP","80","5201  >  46102 [ACK] Seq=1 Ack=511254 Win=964096 Len=0 TSval=1040744876 TSecr=2009618177","0.000020689","","","",""
"84","1.402427881","10.10.3.105","10.10.3.102","MPTCP","31420","46102  >  5201 [PSH, ACK] Seq=511254 Ack=1 Win=64256 Len=31328 TSval=2009618177 TSecr=1040744875","","","","",""
"85","1.402446930","10.10.3.102","10.10.3.105","MPTCP","80","5201  >  46102 [ACK] Seq=1 Ack=542582 Win=1026816 Len=0 TSval=1040744876 TSecr=2009618177","0.000019049","","","",""
"86","1.402708976","10.10.3.105","10.10.3.102","MPTCP","34268","46102  >  5201 [PSH, ACK] Seq=542582 Ack=1 Win=64256 Len=34176 TSval=2009618177 TSecr=1040744876","","","","",""
"87","1.402728367","10.10.3.102","10.10.3.105","MPTCP","80","5201  >  46102 [ACK] Seq=1 Ack=576758 Win=1095168 Len=0 TSval=1040744876 TSecr=2009618177","0.000019391","","","",""
"88","1.402829031","10.10.3.105","10.10.3.102","MPTCP","14332","46102  >  5201 [ACK] Seq=576758 Ack=1 Win=64256 Len=14240 TSval=2009618178 TSecr=1040744876","","","","",""
"89","1.402845110","10.10.3.102","10.10.3.105","MPTCP","80","5201  >  46102 [ACK] Seq=1 Ack=590998 Win=1123584 Len=0 TSval=1040744877 TSecr=2009618178","0.000016079","","","",""
"90","1.402960999","10.10.3.105","10.10.3.102","MPTCP","14332","46102  >  5201 [PSH, ACK] Seq=590998 Ack=1 Win=64256 Len=14240 TSval=2009618178 TSecr=1040744876","","","","",""
"91","1.402974886","10.10.3.102","10.10.3.105","MPTCP","80","5201  >  46102 [ACK] Seq=1 Ack=605238 Win=1152128 Len=0 TSval=1040744877 TSecr=2009618178","0.000013887","","","",""
"92","1.403292347","10.10.3.105","10.10.3.102","MPTCP","37116","46102  >  5201 [PSH, ACK] Seq=605238 Ack=1 Win=64256 Len=37024 TSval=2009618178 TSecr=1040744876","","","","",""
"93","1.403312023","10.10.3.102","10.10.3.105","MPTCP","80","5201  >  46102 [ACK] Seq=1 Ack=642262 Win=1226112 Len=0 TSval=1040744877 TSecr=2009618178","0.000019676","","","",""
"94","1.403493330","10.10.3.105","10.10.3.102","MPTCP","25724","46102  >  5201 [PSH, ACK] Seq=642262 Ack=1 Win=64256 Len=25632 TSval=2009618178 TSecr=1040744876","","","","",""
"95","1.403509946","10.10.3.102","10.10.3.105","MPTCP","80","5201  >  46102 [ACK] Seq=1 Ack=667894 Win=1277440 Len=0 TSval=1040744877 TSecr=2009618178","0.000016616","","","",""
"96","1.403855323","10.10.3.105","10.10.3.102","MPTCP","41388","46102  >  5201 [PSH, ACK] Seq=667894 Ack=1 Win=64256 Len=41296 TSval=2009618178 TSecr=1040744877","","","","",""
"97","1.403876293","10.10.3.102","10.10.3.105","MPTCP","80","5201  >  46102 [ACK] Seq=1 Ack=709190 Win=1360000 Len=0 TSval=1040744878 TSecr=2009618178","0.000020970","","","",""
"98","1.404056285","10.10.3.105","10.10.3.102","MPTCP","21452","46102  >  5201 [PSH, ACK] Seq=709190 Ack=1 Win=64256 Len=21360 TSval=2009618179 TSecr=1040744877","","","","",""
"99","1.404071974","10.10.3.102","10.10.3.105","MPTCP","80","5201  >  46102 [ACK] Seq=1 Ack=730550 Win=1402752 Len=0 TSval=1040744878 TSecr=2009618179","0.000015689","","","",""
"100","1.404417534","10.10.3.105","10.10.3.102","MPTCP","44236","46102  >  5201 [PSH, ACK] Seq=730550 Ack=1 Win=64256 Len=44144 TSval=2009618179 TSecr=1040744877","","","","",""
"101","1.404442782","10.10.3.102","10.10.3.105","MPTCP","80","5201  >  46102 [ACK] Seq=1 Ack=774694 Win=1491072 Len=0 TSval=1040744878 TSecr=2009618179","0.000025248","","","",""
"102","1.404593156","10.10.3.105","10.10.3.102","MPTCP","18604","46102  >  5201 [PSH, ACK] Seq=774694 Ack=1 Win=64256 Len=18512 TSval=2009618179 TSecr=1040744878","","","","",""
"103","1.404608649","10.10.3.102","10.10.3.105","MPTCP","80","5201  >  46102 [ACK] Seq=1 Ack=793206 Win=1528064 Len=0 TSval=1040744878 TSecr=2009618179","0.000015493","","","",""
"104","1.404983309","10.10.3.105","10.10.3.102","MPTCP","47084","46102  >  5201 [PSH, ACK] Seq=793206 Ack=1 Win=64256 Len=46992 TSval=2009618179 TSecr=1040744878","","","","",""
"105","1.405005437","10.10.3.102","10.10.3.105","MPTCP","80","5201  >  46102 [ACK] Seq=1 Ack=840198 Win=1622016 Len=0 TSval=1040744879 TSecr=2009618179","0.000022128","","","",""
"106","1.405128317","10.10.3.105","10.10.3.102","MPTCP","15756","46102  >  5201 [PSH, ACK] Seq=840198 Ack=1 Win=64256 Len=15664 TSval=2009618180 TSecr=1040744878","","","","",""
"107","1.405142879","10.10.3.102","10.10.3.105","MPTCP","80","5201  >  46102 [ACK] Seq=1 Ack=855862 Win=1653376 Len=0 TSval=1040744879 TSecr=2009618180","0.000014562","","","",""
"108","1.405569180","10.10.3.105","10.10.3.102","MPTCP","49932","46102  >  5201 [PSH, ACK] Seq=855862 Ack=1 Win=64256 Len=49840 TSval=2009618180 TSecr=1040744878","","","","",""
"109","1.405592083","10.10.3.102","10.10.3.105","MPTCP","80","5201  >  46102 [ACK] Seq=1 Ack=905702 Win=1753088 Len=0 TSval=1040744879 TSecr=2009618180","0.000022903","","","",""
"110","1.405659709","10.10.3.105","10.10.3.102","MPTCP","12908","46102  >  5201 [PSH, ACK] Seq=905702 Ack=1 Win=64256 Len=12816 TSval=2009618180 TSecr=1040744879","","","","",""
"111","1.405671951","10.10.3.102","10.10.3.105","MPTCP","80","5201  >  46102 [ACK] Seq=1 Ack=918518 Win=1778688 Len=0 TSval=1040744879 TSecr=2009618180","0.000012242","","","",""
"112","1.406129822","10.10.3.105","10.10.3.102","MPTCP","52780","46102  >  5201 [PSH, ACK] Seq=918518 Ack=1 Win=64256 Len=52688 TSval=2009618181 TSecr=1040744879","","","","",""
"113","1.406154078","10.10.3.102","10.10.3.105","MPTCP","80","5201  >  46102 [ACK] Seq=1 Ack=971206 Win=1884032 Len=0 TSval=1040744880 TSecr=2009618181","0.000024256","","","",""
"114","1.406220106","10.10.3.105","10.10.3.102","MPTCP","10060","46102  >  5201 [PSH, ACK] Seq=971206 Ack=1 Win=64256 Len=9968 TSval=2009618181 TSecr=1040744879","","","","",""
"115","1.406231470","10.10.3.102","10.10.3.105","MPTCP","80","5201  >  46102 [ACK] Seq=1 Ack=981174 Win=1904000 Len=0 TSval=1040744880 TSecr=2009618181","0.000011364","","","",""
"116","1.406575780","10.10.3.105","10.10.3.102","MPTCP","42812","46102  >  5201 [PSH, ACK] Seq=981174 Ack=1 Win=64256 Len=42720 TSval=2009618181 TSecr=1040744879","","","","",""
"117","1.406598515","10.10.3.102","10.10.3.105","MPTCP","80","5201  >  46102 [ACK] Seq=1 Ack=1023894 Win=1989376 Len=0 TSval=1040744880 TSecr=2009618181","0.000022735","","","",""
"118","1.406751852","10.10.3.105","10.10.3.102","MPTCP","20028","46102  >  5201 [PSH, ACK] Seq=1023894 Ack=1 Win=64256 Len=19936 TSval=2009618182 TSecr=1040744880","","","","",""
"119","1.406768182","10.10.3.102","10.10.3.105","MPTCP","80","5201  >  46102 [ACK] Seq=1 Ack=1043830 Win=2029312 Len=0 TSval=1040744880 TSecr=2009618182","0.000016330","","","",""
"120","1.406836561","10.10.3.105","10.10.3.102","MPTCP","10060","46102  >  5201 [ACK] Seq=1043830 Ack=1 Win=64256 Len=9968 TSval=2009618182 TSecr=1040744880","","","","",""
"121","1.406848584","10.10.3.102","10.10.3.105","MPTCP","80","5201  >  46102 [ACK] Seq=1 Ack=1053798 Win=2049280 Len=0 TSval=1040744881 TSecr=2009618182","0.000012023","","","",""
"122","1.407166005","10.10.3.105","10.10.3.102","MPTCP","38540","46102  >  5201 [PSH, ACK] Seq=1053798 Ack=1 Win=64256 Len=38448 TSval=2009618182 TSecr=1040744880","","","","",""
"123","1.407186455","10.10.3.102","10.10.3.105","MPTCP","80","5201  >  46102 [ACK] Seq=1 Ack=1092246 Win=2126080 Len=0 TSval=1040744881 TSecr=2009618182","0.000020450","","","",""
"124","1.407303464","10.10.3.105","10.10.3.102","MPTCP","14332","46102  >  5201 [PSH, ACK] Seq=1092246 Ack=1 Win=64256 Len=14240 TSval=2009618182 TSecr=1040744880","","","","",""
"125","1.407316411","10.10.3.102","10.10.3.105","MPTCP","80","5201  >  46102 [ACK] Seq=1 Ack=1106486 Win=2154624 Len=0 TSval=1040744881 TSecr=2009618182","0.000012947","","","",""
"126","1.407639273","10.10.3.105","10.10.3.102","MPTCP","41388","46102  >  5201 [PSH, ACK] Seq=1106486 Ack=1 Win=64256 Len=41296 TSval=2009618182 TSecr=1040744880","","","","",""
"127","1.407660224","10.10.3.102","10.10.3.105","MPTCP","80","5201  >  46102 [ACK] Seq=1 Ack=1147782 Win=2237184 Len=0 TSval=1040744881 TSecr=2009618182","0.000020951","","","",""
"128","1.407837312","10.10.3.105","10.10.3.102","MPTCP","21452","46102  >  5201 [PSH, ACK] Seq=1147782 Ack=1 Win=64256 Len=21360 TSval=2009618182 TSecr=1040744880","","","","",""
"129","1.407852644","10.10.3.102","10.10.3.105","MPTCP","80","5201  >  46102 [ACK] Seq=1 Ack=1169142 Win=2279936 Len=0 TSval=1040744882 TSecr=2009618182","0.000015332","","","",""
"130","1.408280902","10.10.3.105","10.10.3.102","MPTCP","51356","46102  >  5201 [PSH, ACK] Seq=1169142 Ack=1 Win=64256 Len=51264 TSval=2009618183 TSecr=1040744881","","","","",""
"131","1.408304091","10.10.3.102","10.10.3.105","MPTCP","80","5201  >  46102 [ACK] Seq=1 Ack=1220406 Win=2271872 Len=0 TSval=1040744882 TSecr=2009618183","0.000023189","","","",""
"132","1.408370664","10.10.3.105","10.10.3.102","MPTCP","11484","46102  >  5201 [PSH, ACK] Seq=1220406 Ack=1 Win=64256 Len=11392 TSval=2009618183 TSecr=1040744881","","","","",""
"133","1.408384655","10.10.3.102","10.10.3.105","MPTCP","80","5201  >  46102 [ACK] Seq=1 Ack=1231798 Win=2298880 Len=0 TSval=1040744882 TSecr=2009618183","0.000013991","","","",""
"134","1.408781874","10.10.3.105","10.10.3.102","MPTCP","47084","46102  >  5201 [PSH, ACK] Seq=1231798 Ack=1 Win=64256 Len=46992 TSval=2009618183 TSecr=1040744881","","","","",""
"135","1.408806913","10.10.3.102","10.10.3.105","MPTCP","80","5201  >  46102 [ACK] Seq=1 Ack=1278790 Win=2274816 Len=0 TSval=1040744882 TSecr=2009618183","0.000025039","","","",""
"136","1.408907437","10.10.3.105","10.10.3.102","MPTCP","15756","46102  >  5201 [PSH, ACK] Seq=1278790 Ack=1 Win=64256 Len=15664 TSval=2009618183 TSecr=1040744882","","","","",""
"137","1.408922229","10.10.3.102","10.10.3.105","MPTCP","80","5201  >  46102 [ACK] Seq=1 Ack=1294454 Win=2296064 Len=0 TSval=1040744883 TSecr=2009618183","0.000014792","","","",""
"138","1.409429152","10.10.3.105","10.10.3.102","MPTCP","59900","46102  >  5201 [PSH, ACK] Seq=1294454 Ack=1 Win=64256 Len=59808 TSval=2009618184 TSecr=1040744882","","","","",""
"139","1.409455919","10.10.3.102","10.10.3.105","MPTCP","80","5201  >  46102 [ACK] Seq=1 Ack=1354262 Win=2265984 Len=0 TSval=1040744883 TSecr=2009618184","0.000026767","","","",""
"140","1.409470709","10.10.3.105","10.10.3.102","MPTCP","2940","46102  >  5201 [PSH, ACK] Seq=1354262 Ack=1 Win=64256 Len=2848 TSval=2009618184 TSecr=1040744882","","","","",""
"141","1.409480236","10.10.3.102","10.10.3.105","MPTCP","80","5201  >  46102 [ACK] Seq=1 Ack=1357110 Win=2263936 Len=0 TSval=1040744883 TSecr=2009618184","0.000009527","","","",""
"142","1.409961717","10.10.3.105","10.10.3.102","MPTCP","58476","46102  >  5201 [PSH, ACK] Seq=1357110 Ack=1 Win=64256 Len=58384 TSval=2009618184 TSecr=1040744882","","","","",""
"143","1.409987580","10.10.3.102","10.10.3.105","MPTCP","80","5201  >  46102 [ACK] Seq=1 Ack=1415494 Win=2267008 Len=0 TSval=1040744884 TSecr=2009618184","0.000025863","","","",""
"144","1.409997622","10.10.3.105","10.10.3.102","MPTCP","4364","46102  >  5201 [PSH, ACK] Seq=1415494 Ack=1 Win=64256 Len=4272 TSval=2009618184 TSecr=1040744883","","","","",""
"145","1.410007393","10.10.3.102","10.10.3.105","MPTCP","80","5201  >  46102 [ACK] Seq=1 Ack=1419766 Win=2263936 Len=0 TSval=1040744884 TSecr=2009618184","0.000009771","","","",""
"146","1.410545493","10.10.3.105","10.10.3.102","MPTCP","62748","46102  >  5201 [PSH, ACK] Seq=1419766 Ack=1 Win=64256 Len=62656 TSval=2009618185 TSecr=1040744883","","","","",""
"147","1.410572665","10.10.3.102","10.10.3.105","MPTCP","80","5201  >  46102 [ACK] Seq=1 Ack=1482422 Win=2264064 Len=0 TSval=1040744884 TSecr=2009618185","0.000027172","","","",""
"148","1.410884301","10.10.3.105","10.10.3.102","MPTCP","39964","46102  >  5201 [ACK] Seq=1482422 Ack=1 Win=64256 Len=39872 TSval=2009618185 TSecr=1040744884","","","","",""
"149","1.410923185","10.10.3.102","10.10.3.105","MPTCP","80","5201  >  46102 [ACK] Seq=1 Ack=1522294 Win=2279552 Len=0 TSval=1040744885 TSecr=2009618185","0.000038884","","","",""
"150","1.411078375","10.10.3.105","10.10.3.102","MPTCP","22876","46102  >  5201 [PSH, ACK] Seq=1522294 Ack=1 Win=64256 Len=22784 TSval=2009618185 TSecr=1040744884","","","","",""
"151","1.411100258","10.10.3.102","10.10.3.105","MPTCP","80","5201  >  46102 [ACK] Seq=1 Ack=1545078 Win=2291200 Len=0 TSval=1040744885 TSecr=2009618185","0.000021883","","","",""
"152","1.411618035","10.10.3.105","10.10.3.102","MPTCP","62748","46102  >  5201 [PSH, ACK] Seq=1545078 Ack=1 Win=64256 Len=62656 TSval=2009618186 TSecr=1040744884","","","","",""
"153","1.411651757","10.10.3.102","10.10.3.105","MPTCP","80","5201  >  46102 [ACK] Seq=1 Ack=1607734 Win=2264064 Len=0 TSval=1040744885 TSecr=2009618186","0.000033722","","","",""
"154","1.412161097","10.10.3.105","10.10.3.102","MPTCP","62748","46102  >  5201 [PSH, ACK] Seq=1607734 Ack=1 Win=64256 Len=62656 TSval=2009618186 TSecr=1040744885","","","","",""
"155","1.412195901","10.10.3.102","10.10.3.105","MPTCP","80","5201  >  46102 [ACK] Seq=1 Ack=1670390 Win=2264064 Len=0 TSval=1040744886 TSecr=2009618186","0.000034804","","","",""
"156","1.412713475","10.10.3.105","10.10.3.102","MPTCP","62748","46102  >  5201 [PSH, ACK] Seq=1670390 Ack=1 Win=64256 Len=62656 TSval=2009618187 TSecr=1040744885","","","","",""
"157","1.412741345","10.10.3.102","10.10.3.105","MPTCP","80","5201  >  46102 [ACK] Seq=1 Ack=1733046 Win=2264064 Len=0 TSval=1040744886 TSecr=2009618187","0.000027870","","","",""
"158","1.413257401","10.10.3.105","10.10.3.102","MPTCP","62748","46102  >  5201 [PSH, ACK] Seq=1733046 Ack=1 Win=64256 Len=62656 TSval=2009618188 TSecr=1040744886","","","","",""
"159","1.413293062","10.10.3.102","10.10.3.105","MPTCP","80","5201  >  46102 [ACK] Seq=1 Ack=1795702 Win=2264064 Len=0 TSval=1040744887 TSecr=2009618188","0.000035661","","","",""
"160","1.413800327","10.10.3.105","10.10.3.102","MPTCP","62748","46102  >  5201 [PSH, ACK] Seq=1795702 Ack=1 Win=64256 Len=62656 TSval=2009618188 TSecr=1040744886","","","","",""
"161","1.413833113","10.10.3.102","10.10.3.105","MPTCP","80","5201  >  46102 [ACK] Seq=1 Ack=1858358 Win=2264064 Len=0 TSval=1040744888 TSecr=2009618188","0.000032786","","","",""
"162","1.414323867","10.10.3.105","10.10.3.102","MPTCP","62748","46102  >  5201 [PSH, ACK] Seq=1858358 Ack=1 Win=64256 Len=62656 TSval=2009618189 TSecr=1040744887","","","","",""
"163","1.414356686","10.10.3.102","10.10.3.105","MPTCP","80","5201  >  46102 [ACK] Seq=1 Ack=1921014 Win=2264064 Len=0 TSval=1040744888 TSecr=2009618189","0.000032819","","","",""
"164","1.414846204","10.10.3.105","10.10.3.102","MPTCP","59900","46102  >  5201 [ACK] Seq=1921014 Ack=1 Win=64256 Len=59808 TSval=2009618189 TSecr=1040744888","","","","",""
"165","1.414879866","10.10.3.102","10.10.3.105","MPTCP","80","5201  >  46102 [ACK] Seq=1 Ack=1980822 Win=2265984 Len=0 TSval=1040744889 TSecr=2009618189","0.000033662","","","",""
"166","1.414926529","10.10.3.105","10.10.3.102","MPTCP","2940","46102  >  5201 [PSH, ACK] Seq=1980822 Ack=1 Win=64256 Len=2848 TSval=2009618189 TSecr=1040744888","","","","",""
"167","1.414936914","10.10.3.102","10.10.3.105","MPTCP","80","5201  >  46102 [ACK] Seq=1 Ack=1983670 Win=2263936 Len=0 TSval=1040744889 TSecr=2009618189","0.000010385","","","",""
"168","1.415420662","10.10.3.105","10.10.3.102","MPTCP","62748","46102  >  5201 [PSH, ACK] Seq=1983670 Ack=1 Win=64256 Len=62656 TSval=2009618190 TSecr=1040744888","","","","",""
"169","1.415457853","10.10.3.102","10.10.3.105","MPTCP","80","5201  >  46102 [ACK] Seq=1 Ack=2046326 Win=2264064 Len=0 TSval=1040744889 TSecr=2009618190","0.000037191","","","",""
"170","1.415785856","10.10.3.105","10.10.3.102","MPTCP","44236","46102  >  5201 [PSH, ACK] Seq=2046326 Ack=1 Win=64256 Len=44144 TSval=2009618190 TSecr=1040744888","","","","",""
"171","1.415813967","10.10.3.102","10.10.3.105","MPTCP","80","5201  >  46102 [ACK] Seq=1 Ack=2090470 Win=2276736 Len=0 TSval=1040744889 TSecr=2009618190","0.000028111","","","",""
"172","1.415962352","10.10.3.105","10.10.3.102","MPTCP","18604","46102  >  5201 [PSH, ACK] Seq=2090470 Ack=1 Win=64256 Len=18512 TSval=2009618190 TSecr=1040744889","","","","",""
"173","1.415981218","10.10.3.102","10.10.3.105","MPTCP","80","5201  >  46102 [ACK] Seq=1 Ack=2108982 Win=2294144 Len=0 TSval=1040744890 TSecr=2009618190","0.000018866","","","",""
"174","1.416486622","10.10.3.105","10.10.3.102","MPTCP","62748","46102  >  5201 [PSH, ACK] Seq=2108982 Ack=1 Win=64256 Len=62656 TSval=2009618191 TSecr=1040744889","","","","",""
"175","1.416518993","10.10.3.102","10.10.3.105","MPTCP","80","5201  >  46102 [ACK] Seq=1 Ack=2171638 Win=2264064 Len=0 TSval=1040744890 TSecr=2009618191","0.000032371","","","",""
"176","1.417033365","10.10.3.105","10.10.3.102","MPTCP","62748","46102  >  5201 [PSH, ACK] Seq=2171638 Ack=1 Win=64256 Len=62656 TSval=2009618191 TSecr=1040744889","","","","",""
"177","1.417066314","10.10.3.102","10.10.3.105","MPTCP","80","5201  >  46102 [ACK] Seq=1 Ack=2234294 Win=2264064 Len=0 TSval=1040744891 TSecr=2009618191","0.000032949","","","",""
"178","1.417497294","10.10.3.105","10.10.3.102","MPTCP","52780","46102  >  5201 [PSH, ACK] Seq=2234294 Ack=1 Win=64256 Len=52688 TSval=2009618192 TSecr=1040744890","","","","",""
"179","1.417528787","10.10.3.102","10.10.3.105","MPTCP","80","5201  >  46102 [ACK] Seq=1 Ack=2286982 Win=2270848 Len=0 TSval=1040744891 TSecr=2009618192","0.000031493","","","",""
"180","1.417569276","10.10.3.105","10.10.3.102","MPTCP","10060","46102  >  5201 [PSH, ACK] Seq=2286982 Ack=1 Win=64256 Len=9968 TSval=2009618192 TSecr=1040744890","","","","",""
"181","1.417582491","10.10.3.102","10.10.3.105","MPTCP","80","5201  >  46102 [ACK] Seq=1 Ack=2296950 Win=2263936 Len=0 TSval=1040744891 TSecr=2009618192","0.000013215","","","",""
"182","1.418115686","10.10.3.105","10.10.3.102","MPTCP","62748","46102  >  5201 [PSH, ACK] Seq=2296950 Ack=1 Win=64256 Len=62656 TSval=2009618192 TSecr=1040744891","","","","",""
"183","1.418148656","10.10.3.102","10.10.3.105","MPTCP","80","5201  >  46102 [ACK] Seq=1 Ack=2359606 Win=2264064 Len=0 TSval=1040744892 TSecr=2009618192","0.000032970","","","",""
"184","1.418652755","10.10.3.105","10.10.3.102","MPTCP","62748","46102  >  5201 [PSH, ACK] Seq=2359606 Ack=1 Win=64256 Len=62656 TSval=2009618193 TSecr=1040744891","","","","",""
"185","1.418685301","10.10.3.102","10.10.3.105","MPTCP","80","5201  >  46102 [ACK] Seq=1 Ack=2422262 Win=2264064 Len=0 TSval=1040744892 TSecr=2009618193","0.000032546","","","",""
"186","1.418841147","10.10.3.105","10.10.3.102","MPTCP","21452","46102  >  5201 [ACK] Seq=2422262 Ack=1 Win=64256 Len=21360 TSval=2009618193 TSecr=1040744891","","","","",""
"187","1.418862120","10.10.3.102","10.10.3.105","MPTCP","80","5201  >  46102 [ACK] Seq=1 Ack=2443622 Win=2292224 Len=0 TSval=1040744893 TSecr=2009618193","0.000020973","","","",""
"188","1.419212592","10.10.3.105","10.10.3.102","MPTCP","41388","46102  >  5201 [PSH, ACK] Seq=2443622 Ack=1 Win=64256 Len=41296 TSval=2009618193 TSecr=1040744891","","","","",""
"189","1.419240132","10.10.3.102","10.10.3.105","MPTCP","80","5201  >  46102 [ACK] Seq=1 Ack=2484918 Win=2278656 Len=0 TSval=1040744893 TSecr=2009618193","0.000027540","","","",""
"190","1.419755950","10.10.3.105","10.10.3.102","MPTCP","62748","46102  >  5201 [PSH, ACK] Seq=2484918 Ack=1 Win=64256 Len=62656 TSval=2009618194 TSecr=1040744892","","","","",""
"191","1.419790501","10.10.3.102","10.10.3.105","MPTCP","80","5201  >  46102 [ACK] Seq=1 Ack=2547574 Win=2264064 Len=0 TSval=1040744893 TSecr=2009618194","0.000034551","","","",""
"192","1.420297542","10.10.3.105","10.10.3.102","MPTCP","62748","46102  >  5201 [PSH, ACK] Seq=2547574 Ack=1 Win=64256 Len=62656 TSval=2009618194 TSecr=1040744892","","","","",""
"193","1.420331911","10.10.3.102","10.10.3.105","MPTCP","80","5201  >  46102 [ACK] Seq=1 Ack=2610230 Win=2264064 Len=0 TSval=1040744894 TSecr=2009618194","0.000034369","","","",""
"194","1.420823630","10.10.3.105","10.10.3.102","MPTCP","62748","46102  >  5201 [PSH, ACK] Seq=2610230 Ack=1 Win=64256 Len=62656 TSval=2009618195 TSecr=1040744893","","","","",""
"195","1.420856756","10.10.3.102","10.10.3.105","MPTCP","80","5201  >  46102 [ACK] Seq=1 Ack=2672886 Win=2264064 Len=0 TSval=1040744895 TSecr=2009618195","0.000033126","","","",""
"196","1.421373450","10.10.3.105","10.10.3.102","MPTCP","62748","46102  >  5201 [PSH, ACK] Seq=2672886 Ack=1 Win=64256 Len=62656 TSval=2009618195 TSecr=1040744893","","","","",""
"197","1.421406352","10.10.3.102","10.10.3.105","MPTCP","80","5201  >  46102 [ACK] Seq=1 Ack=2735542 Win=2264064 Len=0 TSval=1040744895 TSecr=2009618195","0.000032902","","","",""
"198","1.421899638","10.10.3.105","10.10.3.102","MPTCP","62748","46102  >  5201 [PSH, ACK] Seq=2735542 Ack=1 Win=64256 Len=62656 TSval=2009618196 TSecr=1040744894","","","","",""
"199","1.421933001","10.10.3.102","10.10.3.105","MPTCP","80","5201  >  46102 [ACK] Seq=1 Ack=2798198 Win=2264064 Len=0 TSval=1040744896 TSecr=2009618196","0.000033363","","","",""
"200","1.422448188","10.10.3.105","10.10.3.102","MPTCP","62748","46102  >  5201 [PSH, ACK] Seq=2798198 Ack=1 Win=64256 Len=62656 TSval=2009618196 TSecr=1040744895","","","","",""
"201","1.422481144","10.10.3.102","10.10.3.105","MPTCP","80","5201  >  46102 [ACK] Seq=1 Ack=2860854 Win=2264064 Len=0 TSval=1040744896 TSecr=2009618196","0.000032956","","","",""
"202","1.422842915","10.10.3.105","10.10.3.102","MPTCP","45660","46102  >  5201 [ACK] Seq=2860854 Ack=1 Win=64256 Len=45568 TSval=2009618197 TSecr=1040744895","","","","",""
"203","1.422872115","10.10.3.102","10.10.3.105","MPTCP","80","5201  >  46102 [ACK] Seq=1 Ack=2906422 Win=2275712 Len=0 TSval=1040744897 TSecr=2009618197","0.000029200","","","",""
"204","1.422997305","10.10.3.105","10.10.3.102","MPTCP","17180","46102  >  5201 [PSH, ACK] Seq=2906422 Ack=1 Win=64256 Len=17088 TSval=2009618197 TSecr=1040744895","","","","",""
"205","1.423016664","10.10.3.102","10.10.3.105","MPTCP","80","5201  >  46102 [ACK] Seq=1 Ack=2923510 Win=2295040 Len=0 TSval=1040744897 TSecr=2009618197","0.000019359","","","",""
"206","1.423534105","10.10.3.105","10.10.3.102","MPTCP","62748","46102  >  5201 [PSH, ACK] Seq=2923510 Ack=1 Win=64256 Len=62656 TSval=2009618197 TSecr=1040744896","","","","",""
"207","1.423566985","10.10.3.102","10.10.3.105","MPTCP","80","5201  >  46102 [ACK] Seq=1 Ack=2986166 Win=2264064 Len=0 TSval=1040744897 TSecr=2009618197","0.000032880","","","",""
"208","1.424079927","10.10.3.105","10.10.3.102","MPTCP","62748","46102  >  5201 [PSH, ACK] Seq=2986166 Ack=1 Win=64256 Len=62656 TSval=2009618198 TSecr=1040744896","","","","",""
"209","1.424113997","10.10.3.102","10.10.3.105","MPTCP","80","5201  >  46102 [ACK] Seq=1 Ack=3048822 Win=2264064 Len=0 TSval=1040744898 TSecr=2009618198","0.000034070","","","",""
"210","1.424625714","10.10.3.105","10.10.3.102","MPTCP","62748","46102  >  5201 [PSH, ACK] Seq=3048822 Ack=1 Win=64256 Len=62656 TSval=2009618198 TSecr=1040744897","","","","",""
"211","1.424658048","10.10.3.102","10.10.3.105","MPTCP","80","5201  >  46102 [ACK] Seq=1 Ack=3111478 Win=2264064 Len=0 TSval=1040744898 TSecr=2009618198","0.000032334","","","",""
"212","1.425160265","10.10.3.105","10.10.3.102","MPTCP","62748","46102  >  5201 [PSH, ACK] Seq=3111478 Ack=1 Win=64256 Len=62656 TSval=2009618199 TSecr=1040744897","","","","",""
"213","1.425194891","10.10.3.102","10.10.3.105","MPTCP","80","5201  >  46102 [ACK] Seq=1 Ack=3174134 Win=2264064 Len=0 TSval=1040744899 TSecr=2009618199","0.000034626","","","",""
"214","1.425708805","10.10.3.105","10.10.3.102","MPTCP","62748","46102  >  5201 [PSH, ACK] Seq=3174134 Ack=1 Win=64256 Len=62656 TSval=2009618200 TSecr=1040744898","","","","",""
"215","1.425735918","10.10.3.102","10.10.3.105","MPTCP","80","5201  >  46102 [ACK] Seq=1 Ack=3236790 Win=2264064 Len=0 TSval=1040744899 TSecr=2009618200","0.000027113","","","",""
"216","1.426252489","10.10.3.105","10.10.3.102","MPTCP","62748","46102  >  5201 [PSH, ACK] Seq=3236790 Ack=1 Win=64256 Len=62656 TSval=2009618200 TSecr=1040744898","","","","",""
"217","1.426287659","10.10.3.102","10.10.3.105","MPTCP","80","5201  >  46102 [ACK] Seq=1 Ack=3299446 Win=2264064 Len=0 TSval=1040744900 TSecr=2009618200","0.000035170","","","",""
"218","1.426793960","10.10.3.105","10.10.3.102","MPTCP","62748","46102  >  5201 [PSH, ACK] Seq=3299446 Ack=1 Win=64256 Len=62656 TSval=2009618201 TSecr=1040744899","","","","",""
"219","1.426838917","10.10.3.102","10.10.3.105","MPTCP","80","5201  >  46102 [ACK] Seq=1 Ack=3362102 Win=2264064 Len=0 TSval=1040744900 TSecr=2009618201","0.000044957","","","",""
"220","1.427334189","10.10.3.105","10.10.3.102","MPTCP","62748","46102  >  5201 [PSH, ACK] Seq=3362102 Ack=1 Win=64256 Len=62656 TSval=2009618201 TSecr=1040744899","","","","",""
"221","1.427368509","10.10.3.102","10.10.3.105","MPTCP","80","5201  >  46102 [ACK] Seq=1 Ack=3424758 Win=2264064 Len=0 TSval=1040744901 TSecr=2009618201","0.000034320","","","",""
"222","1.427875986","10.10.3.105","10.10.3.102","MPTCP","62748","46102  >  5201 [PSH, ACK] Seq=3424758 Ack=1 Win=64256 Len=62656 TSval=2009618202 TSecr=1040744900","","","","",""
"223","1.427909190","10.10.3.102","10.10.3.105","MPTCP","80","5201  >  46102 [ACK] Seq=1 Ack=3487414 Win=2264064 Len=0 TSval=1040744902 TSecr=2009618202","0.000033204","","","",""
"224","1.428403119","10.10.3.105","10.10.3.102","MPTCP","62748","46102  >  5201 [PSH, ACK] Seq=3487414 Ack=1 Win=64256 Len=62656 TSval=2009618202 TSecr=1040744900","","","","",""
"225","1.428437738","10.10.3.102","10.10.3.105","MPTCP","80","5201  >  46102 [ACK] Seq=1 Ack=3550070 Win=2264064 Len=0 TSval=1040744902 TSecr=2009618202","0.000034619","","","",""
"226","1.428947400","10.10.3.105","10.10.3.102","MPTCP","62748","46102  >  5201 [PSH, ACK] Seq=3550070 Ack=1 Win=64256 Len=62656 TSval=2009618203 TSecr=1040744901","","","","",""
"227","1.428979580","10.10.3.102","10.10.3.105","MPTCP","80","5201  >  46102 [ACK] Seq=1 Ack=3612726 Win=2264064 Len=0 TSval=1040744903 TSecr=2009618203","0.000032180","","","",""
"228","1.429494660","10.10.3.105","10.10.3.102","MPTCP","62748","46102  >  5201 [PSH, ACK] Seq=3612726 Ack=1 Win=64256 Len=62656 TSval=2009618203 TSecr=1040744902","","","","",""
"229","1.429527535","10.10.3.102","10.10.3.105","MPTCP","80","5201  >  46102 [ACK] Seq=1 Ack=3675382 Win=2264064 Len=0 TSval=1040744903 TSecr=2009618203","0.000032875","","","",""
"230","1.430024137","10.10.3.105","10.10.3.102","MPTCP","62748","46102  >  5201 [PSH, ACK] Seq=3675382 Ack=1 Win=64256 Len=62656 TSval=2009618204 TSecr=1040744902","","","","",""
"231","1.430056613","10.10.3.102","10.10.3.105","MPTCP","80","5201  >  46102 [ACK] Seq=1 Ack=3738038 Win=2264064 Len=0 TSval=1040744904 TSecr=2009618204","0.000032476","","","",""
"232","1.430569410","10.10.3.105","10.10.3.102","MPTCP","62748","46102  >  5201 [PSH, ACK] Seq=3738038 Ack=1 Win=64256 Len=62656 TSval=2009618204 TSecr=1040744902","","","","",""
"233","1.430602790","10.10.3.102","10.10.3.105","MPTCP","80","5201  >  46102 [ACK] Seq=1 Ack=3800694 Win=2264064 Len=0 TSval=1040744904 TSecr=2009618204","0.000033380","","","",""
