"No.","Time","Source","Destination","Protocol","Length","Info","RTT","Lost Segement","Duplicate ","Retransmission","IDK"
"241","6.981231923","10.10.3.105","10.10.3.102","MPTCP","80","48422  >  5201 [SYN] Seq=0 Win=64240 Len=0 MSS=1460 SACK_PERM=1 TSval=2010134916 TSecr=0 WS=128","","","","",""
"242","6.981261216","10.10.3.102","10.10.3.105","MPTCP","88","5201  >  48422 [SYN, ACK] Seq=0 Ack=1 Win=65160 Len=0 MSS=1460 SACK_PERM=1 TSval=1041261849 TSecr=2010134916 WS=128","0.000029293","","","",""
"243","7.162516851","10.10.3.105","10.10.3.102","MPTCP","129","48422  >  5201 [PSH, ACK] Seq=1 Ack=1 Win=64256 Len=37 TSval=2010135150 TSecr=1041261849","0.181255635","","","",""
"244","7.162638964","10.10.3.102","10.10.3.105","MPTCP","80","5201  >  48422 [ACK] Seq=1 Ack=38 Win=65152 Len=0 TSval=1041262030 TSecr=2010135150","0.000122113","","","",""
"245","7.162694301","10.10.3.102","10.10.3.105","MPTCP","84","5201  >  48422 [ACK] Seq=1 Ack=38 Win=65152 Len=0 TSval=1041262030 TSecr=2010135150","","","","",""
"246","7.162801241","10.10.3.102","10.10.3.105","MPTCP","97","5201  >  48422 [PSH, ACK] Seq=1 Ack=38 Win=65152 Len=1 TSval=1041262031 TSecr=2010135150","","","","",""
"248","7.165226255","10.10.3.62","10.10.3.102","MPTCP","88","58439  >  5201 [SYN] Seq=0 Win=64256 Len=0 MSS=1460 SACK_PERM=1 TSval=3347302536 TSecr=0 WS=128","","","","",""
"249","7.165281401","10.10.3.102","10.10.3.62","MPTCP","92","5201  >  58439 [SYN, ACK] Seq=0 Ack=1 Win=65160 Len=0 MSS=1460 SACK_PERM=1 TSval=2494080314 TSecr=3347302536 WS=128","0.000055146","","","",""
"250","7.179181117","10.10.3.105","10.10.3.102","MPTCP","88","48422  >  5201 [ACK] Seq=1 Ack=1 Win=64256 Len=0 TSval=2010135149 TSecr=1041261849","","","","",""
"251","7.179212662","10.10.3.102","10.10.3.105","MPTCP","80","5201  >  48422 [ACK] Seq=2 Ack=38 Win=65152 Len=0 TSval=1041262047 TSecr=2010135150","","","","",""
"275","7.375623758","10.10.3.105","10.10.3.102","MPTCP","100","48422  >  5201 [PSH, ACK] Seq=38 Ack=2 Win=64256 Len=4 TSval=2010135331 TSecr=1041262031","0.212822517","","","",""
"286","7.383170140","10.10.3.105","10.10.3.102","MPTCP","80","48422  >  5201 [ACK] Seq=38 Ack=2 Win=64256 Len=0 TSval=2010135331 TSecr=1041262031","","","","",""
"308","7.399087523","10.10.3.105","10.10.3.102","MPTCP","76","48422  >  5201 [ACK] Seq=38 Ack=2 Win=64256 Len=0 TSval=2010135331 TSecr=1041262031","","","","",""
"319","7.403470961","10.10.3.105","10.10.3.59","MPTCP","88","44827  >  5201 [SYN] Seq=0 Win=64256 Len=0 MSS=1460 SACK_PERM=1 TSval=939390663 TSecr=0 WS=128","","","","",""
"320","7.403533715","10.10.3.59","10.10.3.105","MPTCP","92","5201  >  44827 [SYN, ACK] Seq=0 Ack=1 Win=65160 Len=0 MSS=1460 SACK_PERM=1 TSval=1401370649 TSecr=939390663 WS=128","0.000062754","","","",""
"321","7.417032634","10.10.3.102","10.10.3.105","MPTCP","80","5201  >  48422 [ACK] Seq=2 Ack=42 Win=65152 Len=0 TSval=1041262285 TSecr=2010135331","0.041408876","","","",""
"336","7.580949167","10.10.3.105","10.10.3.59","MPTCP","92","44827  >  5201 [ACK] Seq=1 Ack=1 Win=64256 Len=0 TSval=939390904 TSecr=1401370649","0.177415452","","","",""
"337","7.581062051","10.10.3.59","10.10.3.105","MPTCP","80","[TCP Window Update] 5201  >  44827 [ACK] Seq=1 Ack=1 Win=65280 Len=0 TSval=1401370827 TSecr=939390904","","","","","â\234\223"
"338","7.621703028","10.10.3.105","10.10.3.102","MPTCP","196","48422  >  5201 [PSH, ACK] Seq=42 Ack=2 Win=64256 Len=100 TSval=2010135585 TSecr=1041262285","","","","",""
"339","7.621758902","10.10.3.102","10.10.3.105","MPTCP","80","5201  >  48422 [ACK] Seq=2 Ack=142 Win=65152 Len=0 TSval=1041262489 TSecr=2010135585","0.000055874","","","",""
"340","7.621905551","10.10.3.102","10.10.3.105","MPTCP","97","5201  >  48422 [PSH, ACK] Seq=2 Ack=142 Win=65280 Len=1 TSval=1041262490 TSecr=2010135585","","","","",""
"352","7.792126595","10.10.3.105","10.10.3.102","MPTCP","80","48428  >  5201 [SYN] Seq=0 Win=64240 Len=0 MSS=1460 SACK_PERM=1 TSval=2010135790 TSecr=0 WS=128","","","","",""
"353","7.792187592","10.10.3.102","10.10.3.105","MPTCP","88","5201  >  48428 [SYN, ACK] Seq=0 Ack=1 Win=65160 Len=0 MSS=1460 SACK_PERM=1 TSval=1041262660 TSecr=2010135790 WS=128","0.000060997","","","",""
"354","7.823570642","10.10.3.105","10.10.3.102","MPTCP","80","48422  >  5201 [ACK] Seq=142 Ack=3 Win=64256 Len=0 TSval=2010135833 TSecr=1041262490","0.201665091","","","",""
"365","7.974091436","10.10.3.105","10.10.3.102","MPTCP","88","48428  >  5201 [ACK] Seq=1 Ack=1 Win=64256 Len=0 TSval=2010135961 TSecr=1041262660","0.181903844","","","",""
"366","7.974219650","10.10.3.102","10.10.3.105","MPTCP","84","[TCP Window Update] 5201  >  48428 [ACK] Seq=1 Ack=1 Win=65280 Len=0 TSval=1041262842 TSecr=2010135961","","","","","â\234\223"
"367","7.975848811","10.10.3.62","10.10.3.102","MPTCP","88","41929  >  5201 [SYN] Seq=0 Win=64256 Len=0 MSS=1460 SACK_PERM=1 TSval=3347303348 TSecr=0 WS=128","","","","",""
"368","7.975871401","10.10.3.102","10.10.3.62","MPTCP","92","5201  >  41929 [SYN, ACK] Seq=0 Ack=1 Win=65160 Len=0 MSS=1460 SACK_PERM=1 TSval=2494081125 TSecr=3347303348 WS=128","0.000022590","","","",""
"372","8.038344031","10.10.3.105","10.10.3.102","MPTCP","129","48428  >  5201 [PSH, ACK] Seq=1 Ack=1 Win=64256 Len=37 TSval=2010135961 TSecr=1041262660","","","","",""
"373","8.038376458","10.10.3.102","10.10.3.105","MPTCP","80","5201  >  48428 [ACK] Seq=1 Ack=38 Win=65280 Len=0 TSval=1041262906 TSecr=2010135961","0.000032427","","","",""
"374","8.039571942","10.10.3.102","10.10.3.105","MPTCP","97","5201  >  48422 [PSH, ACK] Seq=3 Ack=142 Win=65280 Len=1 TSval=1041262907 TSecr=2010135833","","","","",""
"388","8.152621385","10.10.3.105","10.10.3.102","MPTCP","76","48428  >  5201 [ACK] Seq=38 Ack=1 Win=64256 Len=0 TSval=2010136142 TSecr=1041262842","","","","",""
"389","8.156070871","10.10.3.105","10.10.3.59","MPTCP","88","50927  >  5201 [SYN] Seq=0 Win=64256 Len=0 MSS=1460 SACK_PERM=1 TSval=939391474 TSecr=0 WS=128","","","","",""
"390","8.156138795","10.10.3.59","10.10.3.105","MPTCP","92","5201  >  50927 [SYN, ACK] Seq=0 Ack=1 Win=65160 Len=0 MSS=1460 SACK_PERM=1 TSval=1401371402 TSecr=939391474 WS=128","0.000067924","","","",""
"392","8.180874094","10.10.3.102","10.10.3.62","MPTCP","92","[TCP Retransmission] 5201  >  58439 [SYN, ACK] Seq=0 Ack=1 Win=65160 Len=0 MSS=1460 SACK_PERM=1 TSval=2494081330 TSecr=3347302536 WS=128","","","","â\234\223","â\234\223"
"397","8.241048283","10.10.3.59","10.10.3.105","MPTCP","97","5201  >  44827 [PSH, ACK] Seq=1 Ack=1 Win=65280 Len=1 TSval=1401371487 TSecr=939390904","","","","",""
"399","8.271075048","10.10.3.105","10.10.3.102","MPTCP","80","48422  >  5201 [ACK] Seq=142 Ack=4 Win=64256 Len=0 TSval=2010136208 TSecr=1041262907","0.231503106","","","",""
"400","8.271129281","10.10.3.102","10.10.3.105","MPTCP","97","5201  >  48422 [PSH, ACK] Seq=4 Ack=142 Win=65280 Len=1 TSval=1041263139 TSecr=2010136208","","","","",""
"406","8.360591704","10.10.3.105","10.10.3.59","MPTCP","92","50927  >  5201 [ACK] Seq=1 Ack=1 Win=64256 Len=0 TSval=939391668 TSecr=1401371402","0.204452909","","","",""
"407","8.360710114","10.10.3.59","10.10.3.105","MPTCP","80","[TCP Window Update] 5201  >  50927 [ACK] Seq=1 Ack=1 Win=65280 Len=0 TSval=1401371606 TSecr=939391668","","","","","â\234\223"
"408","8.374911376","10.10.3.62","10.10.3.102","MPTCP","88","[TCP Retransmission] [TCP Port numbers reused] 58439  >  5201 [SYN] Seq=0 Win=64256 Len=0 MSS=1460 SACK_PERM=1 TSval=3347303554 TSecr=0 WS=128","","","","â\234\223","â\234\223"
"409","8.374957577","10.10.3.102","10.10.3.62","MPTCP","92","[TCP Retransmission] 5201  >  58439 [SYN, ACK] Seq=0 Ack=1 Win=65160 Len=0 MSS=1460 SACK_PERM=1 TSval=2494081524 TSecr=3347302536 WS=128","0.000046201","","","â\234\223","â\234\223"
"416","8.427343279","10.10.3.105","10.10.3.102","MPTCP","2940","[TCP Previous segment not captured] 48428  >  5201 [PSH, ACK] Seq=8582 Ack=1 Win=64256 Len=2848 TSval=2010136439 TSecr=1041262906","","â\234\223","","","â\234\223"
"417","8.427384250","10.10.3.102","10.10.3.105","MPTCP","92","5201  >  48428 [ACK] Seq=1 Ack=38 Win=65280 Len=0 TSval=1041263295 TSecr=2010136142 SLE=8582 SRE=11430","","","","",""
"418","8.462267732","10.10.3.105","10.10.3.102","MPTCP","80","48422  >  5201 [ACK] Seq=142 Ack=5 Win=64256 Len=0 TSval=2010136439 TSecr=1041263139","0.191138451","","","",""
"419","8.468079708","10.10.3.105","10.10.3.59","MPTCP","80","44827  >  5201 [ACK] Seq=1 Ack=2 Win=64256 Len=0 TSval=939391747 TSecr=1401371487","0.227031425","","","",""
"420","8.477487266","10.10.3.105","10.10.3.102","MPTCP","2940","[TCP Out-Of-Order] 48428  >  5201 [PSH, ACK] Seq=2886 Ack=1 Win=64256 Len=2848 TSval=2010136439 TSecr=1041262906","","","","","â\234\223"
"421","8.477509205","10.10.3.102","10.10.3.105","MPTCP","92","[TCP Dup ACK 373#1] 5201  >  48428 [ACK] Seq=1 Ack=38 Win=65280 Len=0 TSval=1041263345 TSecr=2010136142 SLE=2886 SRE=5734","","","â\234\223","","â\234\223"
"422","8.483365937","10.10.3.105","10.10.3.102","MPTCP","2940","48428  >  5201 [PSH, ACK] Seq=11430 Ack=1 Win=64256 Len=2848 TSval=2010136439 TSecr=1041262906","","","","",""
"423","8.483382390","10.10.3.102","10.10.3.105","MPTCP","92","[TCP Dup ACK 373#2] 5201  >  48428 [ACK] Seq=1 Ack=38 Win=65280 Len=0 TSval=1041263351 TSecr=2010136142 SLE=8582 SRE=14278","","","â\234\223","","â\234\223"
"424","8.517042663","10.10.3.105","10.10.3.102","MPTCP","2940","[TCP Out-Of-Order] 48428  >  5201 [PSH, ACK] Seq=38 Ack=1 Win=64256 Len=2848 TSval=2010136439 TSecr=1041262906","","","","","â\234\223"
"425","8.517069336","10.10.3.102","10.10.3.105","MPTCP","92","5201  >  48428 [ACK] Seq=1 Ack=5734 Win=61440 Len=0 TSval=1041263385 TSecr=2010136439 SLE=8582 SRE=14278","0.039582070","","","",""
"427","8.519837912","10.10.3.105","10.10.3.102","MPTCP","2940","[TCP Out-Of-Order] 48428  >  5201 [PSH, ACK] Seq=5734 Ack=1 Win=64256 Len=2848 TSval=2010136439 TSecr=1041262906","","","","","â\234\223"
"428","8.519860174","10.10.3.102","10.10.3.105","MPTCP","80","5201  >  48428 [ACK] Seq=1 Ack=14278 Win=59520 Len=0 TSval=1041263388 TSecr=2010136439","0.036494237","","","",""
"430","8.596580296","10.10.3.105","10.10.3.102","MPTCP","2940","48428  >  5201 [PSH, ACK] Seq=14278 Ack=1 Win=64256 Len=2848 TSval=2010136596 TSecr=1041263295","","","","",""
"431","8.596630653","10.10.3.102","10.10.3.105","MPTCP","80","5201  >  48428 [ACK] Seq=1 Ack=17126 Win=63488 Len=0 TSval=1041263464 TSecr=2010136596","0.000050357","","","",""
"432","8.635308486","10.10.3.105","10.10.3.59","MPTCP","1516","[TCP Previous segment not captured] 50927  >  5201 [ACK] Seq=5697 Ack=1 Win=64256 Len=1424 TSval=939391973 TSecr=1401371606","","â\234\223","","","â\234\223"
"433","8.635348011","10.10.3.59","10.10.3.105","MPTCP","92","[TCP Dup ACK 390#1] 5201  >  50927 [ACK] Seq=1 Ack=1 Win=65280 Len=0 TSval=1401371881 TSecr=939391668 SLE=5697 SRE=7121","","","â\234\223","","â\234\223"
"434","8.645065077","10.10.3.105","10.10.3.59","MPTCP","1516","50927  >  5201 [PSH, ACK] Seq=7121 Ack=1 Win=64256 Len=1424 TSval=939391973 TSecr=1401371606","","","","",""
"435","8.645106768","10.10.3.59","10.10.3.105","MPTCP","92","[TCP Dup ACK 390#2] 5201  >  50927 [ACK] Seq=1 Ack=1 Win=65280 Len=0 TSval=1401371891 TSecr=939391668 SLE=5697 SRE=8545","","","â\234\223","","â\234\223"
"436","8.647054685","10.10.3.105","10.10.3.59","MPTCP","1516","[TCP Previous segment not captured] 50927  >  5201 [ACK] Seq=11393 Ack=1 Win=64256 Len=1424 TSval=939391973 TSecr=1401371606","","â\234\223","","","â\234\223"
"437","8.647095440","10.10.3.59","10.10.3.105","MPTCP","92","[TCP Dup ACK 390#3] 5201  >  50927 [ACK] Seq=1 Ack=1 Win=65280 Len=0 TSval=1401371893 TSecr=939391668 SLE=11393 SRE=12817","","","â\234\223","","â\234\223"
"438","8.647753756","10.10.3.105","10.10.3.102","MPTCP","2940","[TCP Previous segment not captured] 48428  >  5201 [PSH, ACK] Seq=21398 Ack=1 Win=64256 Len=2848 TSval=2010136652 TSecr=1041263351","","â\234\223","","","â\234\223"
"439","8.647798889","10.10.3.102","10.10.3.105","MPTCP","92","[TCP Window Update] 5201  >  48428 [ACK] Seq=1 Ack=17126 Win=65280 Len=0 TSval=1041263515 TSecr=2010136596 SLE=21398 SRE=24246","","","","","â\234\223"
"440","8.651558007","10.10.3.105","10.10.3.59","MPTCP","1516","50927  >  5201 [PSH, ACK] Seq=12817 Ack=1 Win=64256 Len=1424 TSval=939391973 TSecr=1401371606","","","","",""
"441","8.652745898","10.10.3.59","10.10.3.105","MPTCP","92","[TCP Dup ACK 390#4] 5201  >  50927 [ACK] Seq=1 Ack=1 Win=65280 Len=0 TSval=1401371897 TSecr=939391668 SLE=11393 SRE=14241","","","â\234\223","","â\234\223"
"442","8.673803990","10.10.3.105","10.10.3.59","MPTCP","1516","[TCP Out-Of-Order] 50927  >  5201 [ACK] Seq=2849 Ack=1 Win=64256 Len=1424 TSval=939391973 TSecr=1401371606","","","","","â\234\223"
"443","8.675161689","10.10.3.59","10.10.3.105","MPTCP","92","[TCP Dup ACK 390#5] 5201  >  50927 [ACK] Seq=1 Ack=1 Win=65280 Len=0 TSval=1401371920 TSecr=939391668 SLE=2849 SRE=4273","","","â\234\223","","â\234\223"
"444","8.678811653","10.10.3.105","10.10.3.59","MPTCP","1516","[TCP Out-Of-Order] 50927  >  5201 [PSH, ACK] Seq=4273 Ack=1 Win=64256 Len=1424 TSval=939391973 TSecr=1401371606","","","","","â\234\223"
"445","8.679986485","10.10.3.59","10.10.3.105","MPTCP","92","[TCP Dup ACK 390#6] 5201  >  50927 [ACK] Seq=1 Ack=1 Win=65280 Len=0 TSval=1401371925 TSecr=939391668 SLE=2849 SRE=8545","","","â\234\223","","â\234\223"
"446","8.684004248","10.10.3.105","10.10.3.59","MPTCP","1516","[TCP Fast Retransmission] 50927  >  5201 [ACK] Seq=1 Ack=1 Win=64256 Len=1424 TSval=939391973 TSecr=1401371606","","","","â\234\223","â\234\223"
"447","8.684032463","10.10.3.59","10.10.3.105","MPTCP","92","5201  >  50927 [ACK] Seq=1 Ack=1425 Win=65280 Len=0 TSval=1401371930 TSecr=939391973 SLE=2849 SRE=8545","0.000028215","","","",""
"448","8.690191934","10.10.3.105","10.10.3.102","MPTCP","2940","[TCP Out-Of-Order] 48428  >  5201 [PSH, ACK] Seq=17126 Ack=1 Win=64256 Len=2848 TSval=2010136646 TSecr=1041263345","","","","","â\234\223"
"449","8.690231494","10.10.3.102","10.10.3.105","MPTCP","92","5201  >  48428 [ACK] Seq=1 Ack=19974 Win=63488 Len=0 TSval=1041263558 TSecr=2010136646 SLE=21398 SRE=24246","0.000039560","","","",""
"450","8.694922903","10.10.3.105","10.10.3.102","MPTCP","1516","[TCP Out-Of-Order] 48428  >  5201 [ACK] Seq=19974 Ack=1 Win=64256 Len=1424 TSval=2010136646 TSecr=1041263345","","","","","â\234\223"
"451","8.694946695","10.10.3.102","10.10.3.105","MPTCP","80","5201  >  48428 [ACK] Seq=1 Ack=24246 Win=62464 Len=0 TSval=1041263563 TSecr=2010136646","0.047192939","","","",""
"453","8.706746562","10.10.3.105","10.10.3.59","MPTCP","1516","[TCP Out-Of-Order] 50927  >  5201 [PSH, ACK] Seq=1425 Ack=1 Win=64256 Len=1424 TSval=939391973 TSecr=1401371606","","","","","â\234\223"
"454","8.706779844","10.10.3.59","10.10.3.105","MPTCP","92","5201  >  50927 [ACK] Seq=1 Ack=8545 Win=64128 Len=0 TSval=1401371952 TSecr=939391973 SLE=11393 SRE=14241","0.061714767","","","",""
"455","8.714430812","10.10.3.105","10.10.3.59","MPTCP","1516","[TCP Out-Of-Order] 50927  >  5201 [ACK] Seq=8545 Ack=1 Win=64256 Len=1424 TSval=939391973 TSecr=1401371606","","","","","â\234\223"
"456","8.714451289","10.10.3.59","10.10.3.105","MPTCP","92","5201  >  50927 [ACK] Seq=1 Ack=9969 Win=64128 Len=0 TSval=1401371960 TSecr=939391973 SLE=11393 SRE=14241","0.000020477","","","",""
"457","8.771343216","10.10.3.105","10.10.3.59","MPTCP","1516","[TCP Out-Of-Order] 50927  >  5201 [PSH, ACK] Seq=9969 Ack=1 Win=64256 Len=1424 TSval=939391973 TSecr=1401371606","","","","","â\234\223"
"458","8.771391699","10.10.3.59","10.10.3.105","MPTCP","80","5201  >  50927 [ACK] Seq=1 Ack=14241 Win=64128 Len=0 TSval=1401372017 TSecr=939391973","0.119833692","","","",""
"459","8.797183496","10.10.3.105","10.10.3.102","MPTCP","2940","48428  >  5201 [PSH, ACK] Seq=24246 Ack=1 Win=64256 Len=2848 TSval=2010136765 TSecr=1041263464","","","","",""
"460","8.797241337","10.10.3.102","10.10.3.105","MPTCP","80","5201  >  48428 [ACK] Seq=1 Ack=27094 Win=63488 Len=0 TSval=1041263665 TSecr=2010136765","0.000057841","","","",""
"461","8.838823362","10.10.3.105","10.10.3.102","MPTCP","2940","48428  >  5201 [PSH, ACK] Seq=27094 Ack=1 Win=64256 Len=2848 TSval=2010136816 TSecr=1041263515","","","","",""
"462","8.838875984","10.10.3.102","10.10.3.105","MPTCP","80","5201  >  48428 [ACK] Seq=1 Ack=29942 Win=63488 Len=0 TSval=1041263707 TSecr=2010136816","0.000052622","","","",""
"463","8.861272579","10.10.3.105","10.10.3.102","MPTCP","2940","[TCP Previous segment not captured] 48428  >  5201 [PSH, ACK] Seq=31366 Ack=1 Win=64256 Len=2848 TSval=2010136863 TSecr=1041263563","","â\234\223","","","â\234\223"
"464","8.861314915","10.10.3.102","10.10.3.105","MPTCP","92","[TCP Window Update] 5201  >  48428 [ACK] Seq=1 Ack=29942 Win=64128 Len=0 TSval=1041263729 TSecr=2010136816 SLE=31366 SRE=34214","","","","","â\234\223"
"465","8.881232116","10.10.3.105","10.10.3.102","MPTCP","1516","[TCP Out-Of-Order] 48428  >  5201 [ACK] Seq=29942 Ack=1 Win=64256 Len=1424 TSval=2010136858 TSecr=1041263558","","","","","â\234\223"
"466","8.881286852","10.10.3.102","10.10.3.105","MPTCP","80","5201  >  48428 [ACK] Seq=1 Ack=34214 Win=62464 Len=0 TSval=1041263749 TSecr=2010136858","0.020014273","","","",""
"467","8.884270048","10.10.3.105","10.10.3.59","MPTCP","1516","[TCP Previous segment not captured] 50927  >  5201 [ACK] Seq=17089 Ack=1 Win=64256 Len=1424 TSval=939392186 TSecr=1401371930","","â\234\223","","","â\234\223"
"468","8.884309209","10.10.3.59","10.10.3.105","MPTCP","92","[TCP Dup ACK 458#1] 5201  >  50927 [ACK] Seq=1 Ack=14241 Win=64128 Len=0 TSval=1401372130 TSecr=939391973 SLE=17089 SRE=18513","","","â\234\223","","â\234\223"
"469","8.884360384","10.10.3.105","10.10.3.59","MPTCP","1516","50927  >  5201 [PSH, ACK] Seq=18513 Ack=1 Win=64256 Len=1424 TSval=939392186 TSecr=1401371930","","","","",""
"470","8.884373158","10.10.3.59","10.10.3.105","MPTCP","92","[TCP Dup ACK 458#2] 5201  >  50927 [ACK] Seq=1 Ack=14241 Win=64128 Len=0 TSval=1401372130 TSecr=939391973 SLE=17089 SRE=19937","","","â\234\223","","â\234\223"
"471","8.884393698","10.10.3.105","10.10.3.59","MPTCP","1516","50927  >  5201 [ACK] Seq=19937 Ack=1 Win=64256 Len=1424 TSval=939392211 TSecr=1401371952","","","","",""
"472","8.884403113","10.10.3.59","10.10.3.105","MPTCP","92","[TCP Dup ACK 458#3] 5201  >  50927 [ACK] Seq=1 Ack=14241 Win=64128 Len=0 TSval=1401372130 TSecr=939391973 SLE=17089 SRE=21361","","","â\234\223","","â\234\223"
"473","8.884422494","10.10.3.105","10.10.3.59","MPTCP","1516","50927  >  5201 [PSH, ACK] Seq=21361 Ack=1 Win=64256 Len=1424 TSval=939392211 TSecr=1401371952","","","","",""
"474","8.884431481","10.10.3.59","10.10.3.105","MPTCP","92","[TCP Dup ACK 458#4] 5201  >  50927 [ACK] Seq=1 Ack=14241 Win=64128 Len=0 TSval=1401372130 TSecr=939391973 SLE=17089 SRE=22785","","","â\234\223","","â\234\223"
"475","8.893384481","10.10.3.105","10.10.3.59","MPTCP","1516","[TCP Spurious Retransmission] 50927  >  5201 [ACK] Seq=1425 Ack=1 Win=64256 Len=1424 TSval=939392184 TSecr=1401371897","","","","â\234\223","â\234\223"
"476","8.893416940","10.10.3.59","10.10.3.105","MPTCP","92","[TCP Dup ACK 458#5] 5201  >  50927 [ACK] Seq=1 Ack=14241 Win=64128 Len=0 TSval=1401372139 TSecr=939391973 SLE=1425 SRE=2849","","","â\234\223","","â\234\223"
"478","8.929646075","10.10.3.105","10.10.3.59","MPTCP","1516","[TCP Previous segment not captured] 50927  >  5201 [ACK] Seq=25633 Ack=1 Win=64256 Len=1424 TSval=939392219 TSecr=1401371960","","â\234\223","","","â\234\223"
"479","8.929683421","10.10.3.59","10.10.3.105","MPTCP","92","[TCP Dup ACK 458#6] 5201  >  50927 [ACK] Seq=1 Ack=14241 Win=64128 Len=0 TSval=1401372175 TSecr=939391973 SLE=25633 SRE=27057","","","â\234\223","","â\234\223"
"480","8.929721325","10.10.3.105","10.10.3.59","MPTCP","1516","50927  >  5201 [PSH, ACK] Seq=27057 Ack=1 Win=64256 Len=1424 TSval=939392219 TSecr=1401371960","","","","",""
"481","8.929731108","10.10.3.59","10.10.3.105","MPTCP","92","[TCP Dup ACK 458#7] 5201  >  50927 [ACK] Seq=1 Ack=14241 Win=64128 Len=0 TSval=1401372175 TSecr=939391973 SLE=25633 SRE=28481","","","â\234\223","","â\234\223"
"482","8.936767734","10.10.3.105","10.10.3.59","MPTCP","1516","[TCP Spurious Retransmission] 50927  >  5201 [ACK] Seq=8545 Ack=1 Win=64256 Len=1424 TSval=939392186 TSecr=1401371925","","","","â\234\223","â\234\223"
"483","8.936813849","10.10.3.59","10.10.3.105","MPTCP","92","[TCP Dup ACK 458#8] 5201  >  50927 [ACK] Seq=1 Ack=14241 Win=64128 Len=0 TSval=1401372183 TSecr=939391973 SLE=8545 SRE=9969","","","â\234\223","","â\234\223"
"484","8.951620782","10.10.3.105","10.10.3.102","MPTCP","1516","48428  >  5201 [ACK] Seq=34214 Ack=1 Win=64256 Len=1424 TSval=2010136966 TSecr=1041263665","","","","",""
"485","8.951672823","10.10.3.102","10.10.3.105","MPTCP","80","5201  >  48428 [ACK] Seq=1 Ack=35638 Win=64128 Len=0 TSval=1041263819 TSecr=2010136966","0.000052041","","","",""
"486","8.952756164","10.10.3.105","10.10.3.59","MPTCP","1516","[TCP Fast Retransmission] 50927  >  5201 [ACK] Seq=14241 Ack=1 Win=64256 Len=1424 TSval=939392166 TSecr=1401371881","","","","â\234\223","â\234\223"
"487","8.952798941","10.10.3.59","10.10.3.105","MPTCP","92","5201  >  50927 [ACK] Seq=1 Ack=15665 Win=67072 Len=0 TSval=1401372198 TSecr=939392166 SLE=25633 SRE=28481","0.000042777","","","",""
"488","8.973687103","10.10.3.105","10.10.3.59","MPTCP","1516","[TCP Out-Of-Order] 50927  >  5201 [ACK] Seq=15665 Ack=1 Win=64256 Len=1424 TSval=939392181 TSecr=1401371891","","","","","â\234\223"
"489","8.973711531","10.10.3.59","10.10.3.105","MPTCP","92","5201  >  50927 [ACK] Seq=1 Ack=22785 Win=69888 Len=0 TSval=1401372219 TSecr=939392181 SLE=25633 SRE=28481","0.089289037","","","",""
"490","8.974996892","10.10.3.105","10.10.3.59","MPTCP","1516","[TCP Spurious Retransmission] 50927  >  5201 [ACK] Seq=1 Ack=1 Win=64256 Len=1424 TSval=939392181 TSecr=1401371893","","","","â\234\223","â\234\223"
"491","8.975004079","10.10.3.59","10.10.3.105","MPTCP","92","[TCP Dup ACK 489#1] 5201  >  50927 [ACK] Seq=1 Ack=22785 Win=69888 Len=0 TSval=1401372221 TSecr=939392181 SLE=1 SRE=1425","","","â\234\223","","â\234\223"
"492","8.978051366","10.10.3.105","10.10.3.59","MPTCP","1516","50927  >  5201 [ACK] Seq=28481 Ack=1 Win=64256 Len=1424 TSval=939392273 TSecr=1401372017","","","","",""
"493","8.978071463","10.10.3.59","10.10.3.105","MPTCP","92","[TCP Window Update] 5201  >  50927 [ACK] Seq=1 Ack=22785 Win=72832 Len=0 TSval=1401372224 TSecr=939392181 SLE=25633 SRE=29905","","","","","â\234\223"
"494","8.980797955","10.10.3.102","10.10.3.62","MPTCP","92","[TCP Retransmission] 5201  >  41929 [SYN, ACK] Seq=0 Ack=1 Win=65160 Len=0 MSS=1460 SACK_PERM=1 TSval=2494082130 TSecr=3347303348 WS=128","","","","â\234\223","â\234\223"
"495","8.981568807","10.10.3.62","10.10.3.102","MPTCP","88","[TCP Retransmission] [TCP Port numbers reused] 41929  >  5201 [SYN] Seq=0 Win=64256 Len=0 MSS=1460 SACK_PERM=1 TSval=3347304354 TSecr=0 WS=128","","","","â\234\223","â\234\223"
"496","8.981584655","10.10.3.102","10.10.3.62","MPTCP","92","[TCP Retransmission] 5201  >  41929 [SYN, ACK] Seq=0 Ack=1 Win=65160 Len=0 MSS=1460 SACK_PERM=1 TSval=2494082130 TSecr=3347303348 WS=128","0.000015848","","","â\234\223","â\234\223"
"497","8.988129933","10.10.3.105","10.10.3.59","MPTCP","1516","50927  >  5201 [PSH, ACK] Seq=29905 Ack=1 Win=64256 Len=1424 TSval=939392273 TSecr=1401372017","","","","",""
"498","8.988150306","10.10.3.59","10.10.3.105","MPTCP","92","[TCP Window Update] 5201  >  50927 [ACK] Seq=1 Ack=22785 Win=75776 Len=0 TSval=1401372234 TSecr=939392181 SLE=25633 SRE=31329","","","","","â\234\223"
"499","9.011359191","10.10.3.105","10.10.3.59","MPTCP","1516","[TCP Spurious Retransmission] 50927  >  5201 [ACK] Seq=4273 Ack=1 Win=64256 Len=1424 TSval=939392184 TSecr=1401371920","","","","â\234\223","â\234\223"
"500","9.011374171","10.10.3.59","10.10.3.105","MPTCP","92","[TCP Dup ACK 489#2] 5201  >  50927 [ACK] Seq=1 Ack=22785 Win=75776 Len=0 TSval=1401372257 TSecr=939392181 SLE=4273 SRE=5697","","","â\234\223","","â\234\223"
"501","9.014819954","10.10.3.105","10.10.3.59","MPTCP","1516","[TCP Fast Retransmission] 50927  >  5201 [ACK] Seq=22785 Ack=1 Win=64256 Len=1424 TSval=939392219 TSecr=1401371960","","","","â\234\223","â\234\223"
"502","9.014841802","10.10.3.59","10.10.3.105","MPTCP","92","5201  >  50927 [ACK] Seq=1 Ack=24209 Win=78592 Len=0 TSval=1401372261 TSecr=939392219 SLE=25633 SRE=31329","0.000021848","","","",""
"503","9.039069542","10.10.3.105","10.10.3.59","MPTCP","1516","[TCP Out-Of-Order] 50927  >  5201 [PSH, ACK] Seq=24209 Ack=1 Win=64256 Len=1424 TSval=939392219 TSecr=1401371960","","","","","â\234\223"
"504","9.039095121","10.10.3.59","10.10.3.105","MPTCP","80","5201  >  50927 [ACK] Seq=1 Ack=31329 Win=81536 Len=0 TSval=1401372285 TSecr=939392219","0.050965188","","","",""
"506","9.051543901","10.10.3.105","10.10.3.102","MPTCP","2940","[TCP Previous segment not captured] 48428  >  5201 [PSH, ACK] Seq=38486 Ack=1 Win=64256 Len=2848 TSval=2010137050 TSecr=1041263749","","â\234\223","","","â\234\223"
"507","9.051573171","10.10.3.102","10.10.3.105","MPTCP","92","[TCP Window Update] 5201  >  48428 [ACK] Seq=1 Ack=35638 Win=81536 Len=0 TSval=1041263919 TSecr=2010136966 SLE=38486 SRE=41334","","","","","â\234\223"
"509","9.075140836","10.10.3.105","10.10.3.59","MPTCP","1516","[TCP Previous segment not captured] 50927  >  5201 [ACK] Seq=35577 Ack=1 Win=64256 Len=1424 TSval=939392394 TSecr=1401372130","","â\234\223","","","â\234\223"
"510","9.075178031","10.10.3.59","10.10.3.105","MPTCP","92","[TCP Window Update] 5201  >  50927 [ACK] Seq=1 Ack=31329 Win=84352 Len=0 TSval=1401372321 TSecr=939392219 SLE=35577 SRE=37001","","","","","â\234\223"
"511","9.075215956","10.10.3.105","10.10.3.59","MPTCP","1516","50927  >  5201 [PSH, ACK] Seq=37001 Ack=1 Win=64256 Len=1424 TSval=939392394 TSecr=1401372130","","","","",""
"512","9.075225668","10.10.3.59","10.10.3.105","MPTCP","92","[TCP Window Update] 5201  >  50927 [ACK] Seq=1 Ack=31329 Win=87296 Len=0 TSval=1401372321 TSecr=939392219 SLE=35577 SRE=38425","","","","","â\234\223"
"513","9.080988891","10.10.3.105","10.10.3.102","MPTCP","2940","[TCP Out-Of-Order] 48428  >  5201 [PSH, ACK] Seq=35638 Ack=1 Win=64256 Len=2848 TSval=2010137030 TSecr=1041263729","","","","","â\234\223"
"514","9.081039345","10.10.3.102","10.10.3.105","MPTCP","80","5201  >  48428 [ACK] Seq=1 Ack=41334 Win=81536 Len=0 TSval=1041263949 TSecr=2010137030","0.029495444","","","",""
"515","9.086578653","10.10.3.105","10.10.3.59","MPTCP","1516","50927  >  5201 [ACK] Seq=38425 Ack=1 Win=64256 Len=1424 TSval=939392394 TSecr=1401372130","","","","",""
"516","9.086615663","10.10.3.59","10.10.3.105","MPTCP","92","[TCP Window Update] 5201  >  50927 [ACK] Seq=1 Ack=31329 Win=90240 Len=0 TSval=1401372332 TSecr=939392219 SLE=35577 SRE=39849","","","","","â\234\223"
"517","9.099167321","10.10.3.105","10.10.3.59","MPTCP","1452","50927  >  5201 [PSH, ACK] Seq=39849 Ack=1 Win=64256 Len=1360 TSval=939392394 TSecr=1401372130","","","","",""
"518","9.099208777","10.10.3.59","10.10.3.105","MPTCP","92","[TCP Window Update] 5201  >  50927 [ACK] Seq=1 Ack=31329 Win=93056 Len=0 TSval=1401372345 TSecr=939392219 SLE=35577 SRE=41209","","","","","â\234\223"
"520","9.117084378","10.10.3.105","10.10.3.59","MPTCP","1516","[TCP Out-Of-Order] 50927  >  5201 [ACK] Seq=32729 Ack=1 Win=64256 Len=1424 TSval=939392388 TSecr=1401372130","","","","","â\234\223"
"521","9.117125128","10.10.3.59","10.10.3.105","MPTCP","92","[TCP Window Update] 5201  >  50927 [ACK] Seq=1 Ack=31329 Win=96000 Len=0 TSval=1401372363 TSecr=939392219 SLE=32729 SRE=34153","","","","","â\234\223"
"522","9.122480062","10.10.3.105","10.10.3.59","MPTCP","1516","[TCP Out-Of-Order] 50927  >  5201 [PSH, ACK] Seq=34153 Ack=1 Win=64256 Len=1424 TSval=939392388 TSecr=1401372130","","","","","â\234\223"
"523","9.122518371","10.10.3.59","10.10.3.105","MPTCP","92","[TCP Window Update] 5201  >  50927 [ACK] Seq=1 Ack=31329 Win=98944 Len=0 TSval=1401372368 TSecr=939392219 SLE=32729 SRE=41209","","","","","â\234\223"
"524","9.133598067","10.10.3.105","10.10.3.59","MPTCP","1516","[TCP Spurious Retransmission] 50927  >  5201 [ACK] Seq=15665 Ack=1 Win=64256 Len=1424 TSval=939392431 TSecr=1401372175","","","","â\234\223","â\234\223"
"525","9.133630119","10.10.3.59","10.10.3.105","MPTCP","92","[TCP Dup ACK 504#1] 5201  >  50927 [ACK] Seq=1 Ack=31329 Win=98944 Len=0 TSval=1401372379 TSecr=939392219 SLE=15665 SRE=17089","","","â\234\223","","â\234\223"
"526","9.145442799","10.10.3.105","10.10.3.59","MPTCP","1516","50927  >  5201 [ACK] Seq=41209 Ack=1 Win=64256 Len=1424 TSval=939392436 TSecr=1401372175","","","","",""
"527","9.145479413","10.10.3.59","10.10.3.105","MPTCP","92","[TCP Window Update] 5201  >  50927 [ACK] Seq=1 Ack=31329 Win=101760 Len=0 TSval=1401372391 TSecr=939392219 SLE=32729 SRE=42633","","","","","â\234\223"
"528","9.157176647","10.10.3.105","10.10.3.59","MPTCP","1516","[TCP Spurious Retransmission] 50927  >  5201 [ACK] Seq=14241 Ack=1 Win=64256 Len=1424 TSval=939392417 TSecr=1401372139","","","","â\234\223","â\234\223"
"529","9.157207293","10.10.3.59","10.10.3.105","MPTCP","92","[TCP Dup ACK 504#2] 5201  >  50927 [ACK] Seq=1 Ack=31329 Win=101760 Len=0 TSval=1401372403 TSecr=939392219 SLE=14241 SRE=15665","","","â\234\223","","â\234\223"
"531","9.169065392","10.10.3.105","10.10.3.59","MPTCP","1492","[TCP Fast Retransmission] 50927  >  5201 [PSH, ACK] Seq=31329 Ack=1 Win=64256 Len=1400 TSval=939392388 TSecr=1401372130","","","","â\234\223","â\234\223"
"532","9.169118454","10.10.3.59","10.10.3.105","MPTCP","80","5201  >  50927 [ACK] Seq=1 Ack=42633 Win=104704 Len=0 TSval=1401372415 TSecr=939392388","0.023675655","","","",""
"533","9.180936391","10.10.3.105","10.10.3.59","MPTCP","1516","[TCP Previous segment not captured] 50927  >  5201 [ACK] Seq=51417 Ack=1 Win=64256 Len=1424 TSval=939392490 TSecr=1401372234","","â\234\223","","","â\234\223"
"534","9.180973887","10.10.3.59","10.10.3.105","MPTCP","92","[TCP Window Update] 5201  >  50927 [ACK] Seq=1 Ack=42633 Win=107520 Len=0 TSval=1401372427 TSecr=939392388 SLE=51417 SRE=52841","","","","","â\234\223"
"535","9.187342613","10.10.3.105","10.10.3.102","MPTCP","1516","48428  >  5201 [ACK] Seq=41334 Ack=1 Win=64256 Len=1424 TSval=2010137120 TSecr=1041263819","","","","",""
"536","9.187380112","10.10.3.102","10.10.3.105","MPTCP","80","5201  >  48428 [ACK] Seq=1 Ack=42758 Win=105984 Len=0 TSval=1041264055 TSecr=2010137120","0.000037499","","","",""
"537","9.192545224","10.10.3.105","10.10.3.59","MPTCP","332","50927  >  5201 [PSH, ACK] Seq=52841 Ack=1 Win=64256 Len=240 TSval=939392490 TSecr=1401372234","","","","",""
"538","9.192572159","10.10.3.59","10.10.3.105","MPTCP","92","[TCP Window Update] 5201  >  50927 [ACK] Seq=1 Ack=42633 Win=110464 Len=0 TSval=1401372438 TSecr=939392388 SLE=51417 SRE=53081","","","","","â\234\223"
"539","9.195216447","10.10.3.105","10.10.3.59","MPTCP","1516","[TCP Out-Of-Order] 50927  >  5201 [ACK] Seq=44057 Ack=1 Win=64256 Len=1424 TSval=939392478 TSecr=1401372219","","","","","â\234\223"
"540","9.195239139","10.10.3.59","10.10.3.105","MPTCP","92","[TCP Window Update] 5201  >  50927 [ACK] Seq=1 Ack=42633 Win=113280 Len=0 TSval=1401372441 TSecr=939392388 SLE=44057 SRE=45481","","","","","â\234\223"
"542","9.207931311","10.10.3.105","10.10.3.59","MPTCP","1516","[TCP Out-Of-Order] 50927  >  5201 [PSH, ACK] Seq=45481 Ack=1 Win=64256 Len=1424 TSval=939392478 TSecr=1401372219","","","","","â\234\223"
"543","9.207955726","10.10.3.59","10.10.3.105","MPTCP","92","[TCP Window Update] 5201  >  50927 [ACK] Seq=1 Ack=42633 Win=116224 Len=0 TSval=1401372454 TSecr=939392388 SLE=44057 SRE=46905","","","","","â\234\223"
"544","9.208845239","10.10.3.62","10.10.3.102","MPTCP","88","[TCP Retransmission] [TCP Port numbers reused] 58439  >  5201 [SYN] Seq=0 Win=64256 Len=0 MSS=1460 SACK_PERM=1 TSval=3347304578 TSecr=0 WS=128","","","","â\234\223","â\234\223"
"545","9.208878251","10.10.3.102","10.10.3.62","MPTCP","92","[TCP Retransmission] 5201  >  58439 [SYN, ACK] Seq=0 Ack=1 Win=65160 Len=0 MSS=1460 SACK_PERM=1 TSval=2494082358 TSecr=3347302536 WS=128","0.000033012","","","â\234\223","â\234\223"
"546","9.219676106","10.10.3.105","10.10.3.59","MPTCP","1516","[TCP Out-Of-Order] 50927  >  5201 [PSH, ACK] Seq=42633 Ack=1 Win=64256 Len=1424 TSval=939392459 TSecr=1401372198","","","","","â\234\223"
"547","9.219706420","10.10.3.59","10.10.3.105","MPTCP","92","5201  >  50927 [ACK] Seq=1 Ack=46905 Win=119168 Len=0 TSval=1401372465 TSecr=939392459 SLE=51417 SRE=53081","0.011775109","","","",""
"548","9.231000021","10.10.3.105","10.10.3.59","MPTCP","1516","50927  >  5201 [ACK] Seq=53081 Ack=1 Win=64256 Len=1424 TSval=939392517 TSecr=1401372261","","","","",""
"549","9.231025221","10.10.3.59","10.10.3.105","MPTCP","92","[TCP Window Update] 5201  >  50927 [ACK] Seq=1 Ack=46905 Win=121984 Len=0 TSval=1401372477 TSecr=939392459 SLE=51417 SRE=54505","","","","","â\234\223"
"550","9.237871790","10.10.3.105","10.10.3.102","MPTCP","2940","48428  >  5201 [PSH, ACK] Seq=42758 Ack=1 Win=64256 Len=2848 TSval=2010137220 TSecr=1041263919","","","","",""
"551","9.237904497","10.10.3.102","10.10.3.105","MPTCP","80","5201  >  48428 [ACK] Seq=1 Ack=45606 Win=119040 Len=0 TSval=1041264106 TSecr=2010137220","0.000032707","","","",""
"552","9.242859900","10.10.3.105","10.10.3.59","MPTCP","1516","50927  >  5201 [PSH, ACK] Seq=54505 Ack=1 Win=64256 Len=1424 TSval=939392517 TSecr=1401372261","","","","",""
"553","9.242900042","10.10.3.59","10.10.3.105","MPTCP","92","[TCP Window Update] 5201  >  50927 [ACK] Seq=1 Ack=46905 Win=124928 Len=0 TSval=1401372489 TSecr=939392459 SLE=51417 SRE=55929","","","","","â\234\223"
"554","9.259244713","10.10.3.105","10.10.3.59","MPTCP","1516","[TCP Out-Of-Order] 50927  >  5201 [ACK] Seq=46905 Ack=1 Win=64256 Len=1424 TSval=939392478 TSecr=1401372219","","","","","â\234\223"
"555","9.259286589","10.10.3.59","10.10.3.105","MPTCP","92","5201  >  50927 [ACK] Seq=1 Ack=48329 Win=127744 Len=0 TSval=1401372505 TSecr=939392478 SLE=51417 SRE=55929","0.000041876","","","",""
"556","9.272067822","10.10.3.105","10.10.3.59","MPTCP","1516","[TCP Out-Of-Order] 50927  >  5201 [PSH, ACK] Seq=48329 Ack=1 Win=64256 Len=1424 TSval=939392478 TSecr=1401372219","","","","","â\234\223"
"557","9.272111332","10.10.3.59","10.10.3.105","MPTCP","92","5201  >  50927 [ACK] Seq=1 Ack=49753 Win=130688 Len=0 TSval=1401372518 TSecr=939392478 SLE=51417 SRE=55929","0.000043510","","","",""
"558","9.290683856","10.10.3.105","10.10.3.102","MPTCP","1516","48428  >  5201 [ACK] Seq=45606 Ack=1 Win=64256 Len=1424 TSval=2010137249 TSecr=1041263949","","","","",""
"559","9.290733434","10.10.3.102","10.10.3.105","MPTCP","80","5201  >  48428 [ACK] Seq=1 Ack=47030 Win=129152 Len=0 TSval=1041264158 TSecr=2010137249","0.000049578","","","",""
"560","9.320326049","10.10.3.105","10.10.3.59","MPTCP","1516","[TCP Out-Of-Order] 50927  >  5201 [ACK] Seq=49753 Ack=1 Win=64256 Len=1424 TSval=939392479 TSecr=1401372224","","","","","â\234\223"
"561","9.320374705","10.10.3.59","10.10.3.105","MPTCP","92","5201  >  50927 [ACK] Seq=1 Ack=51177 Win=133632 Len=0 TSval=1401372566 TSecr=939392479 SLE=51417 SRE=55929","0.000048656","","","",""
"562","9.336704223","10.10.3.105","10.10.3.59","MPTCP","332","[TCP Out-Of-Order] 50927  >  5201 [PSH, ACK] Seq=51177 Ack=1 Win=64256 Len=240 TSval=939392479 TSecr=1401372224","","","","","â\234\223"
"563","9.336753515","10.10.3.59","10.10.3.105","MPTCP","80","5201  >  50927 [ACK] Seq=1 Ack=55929 Win=136448 Len=0 TSval=1401372582 TSecr=939392479","0.093893615","","","",""
"564","9.336704585","10.10.3.105","10.10.3.59","MPTCP","1516","[TCP Previous segment not captured] 50927  >  5201 [ACK] Seq=64473 Ack=1 Win=64256 Len=1424 TSval=939392589 TSecr=1401372332","","â\234\223","","","â\234\223"
"565","9.336789118","10.10.3.59","10.10.3.105","MPTCP","92","[TCP Window Update] 5201  >  50927 [ACK] Seq=1 Ack=55929 Win=139392 Len=0 TSval=1401372583 TSecr=939392479 SLE=64473 SRE=65897","","","","","â\234\223"
"566","9.336704690","10.10.3.105","10.10.3.59","MPTCP","1516","50927  >  5201 [PSH, ACK] Seq=65897 Ack=1 Win=64256 Len=1424 TSval=939392589 TSecr=1401372332","","","","",""
"567","9.336805903","10.10.3.59","10.10.3.105","MPTCP","92","[TCP Window Update] 5201  >  50927 [ACK] Seq=1 Ack=55929 Win=142208 Len=0 TSval=1401372583 TSecr=939392479 SLE=64473 SRE=67321","","","","","â\234\223"
"568","9.336704793","10.10.3.105","10.10.3.59","MPTCP","1516","[TCP Previous segment not captured] 50927  >  5201 [ACK] Seq=67545 Ack=1 Win=64256 Len=1424 TSval=939392619 TSecr=1401372363","","â\234\223","","","â\234\223"
"569","9.336820761","10.10.3.59","10.10.3.105","MPTCP","92","[TCP Window Update] 5201  >  50927 [ACK] Seq=1 Ack=55929 Win=145152 Len=0 TSval=1401372583 TSecr=939392479 SLE=67545 SRE=68969","","","","","â\234\223"
"570","9.339183341","10.10.3.105","10.10.3.59","MPTCP","1516","50927  >  5201 [PSH, ACK] Seq=68969 Ack=1 Win=64256 Len=1424 TSval=939392619 TSecr=1401372363","","","","",""
"571","9.339220086","10.10.3.59","10.10.3.105","MPTCP","92","[TCP Window Update] 5201  >  50927 [ACK] Seq=1 Ack=55929 Win=147968 Len=0 TSval=1401372585 TSecr=939392479 SLE=67545 SRE=70393","","","","","â\234\223"
"572","9.343426164","10.10.3.105","10.10.3.59","MPTCP","1516","50927  >  5201 [ACK] Seq=70393 Ack=1 Win=64256 Len=1424 TSval=939392624 TSecr=1401372368","","","","",""
"573","9.343463094","10.10.3.59","10.10.3.105","MPTCP","92","[TCP Window Update] 5201  >  50927 [ACK] Seq=1 Ack=55929 Win=150912 Len=0 TSval=1401372589 TSecr=939392479 SLE=67545 SRE=71817","","","","","â\234\223"
"574","9.352524348","10.10.3.105","10.10.3.59","MPTCP","1516","50927  >  5201 [PSH, ACK] Seq=71817 Ack=1 Win=64256 Len=1424 TSval=939392624 TSecr=1401372368","","","","",""
"575","9.352565417","10.10.3.59","10.10.3.105","MPTCP","92","[TCP Window Update] 5201  >  50927 [ACK] Seq=1 Ack=55929 Win=153856 Len=0 TSval=1401372598 TSecr=939392479 SLE=67545 SRE=73241","","","","","â\234\223"
"577","9.364428928","10.10.3.105","10.10.3.59","MPTCP","1516","[TCP Out-Of-Order] 50927  >  5201 [ACK] Seq=55929 Ack=1 Win=64256 Len=1424 TSval=939392540 TSecr=1401372285","","","","","â\234\223"
"578","9.364477604","10.10.3.59","10.10.3.105","MPTCP","92","5201  >  50927 [ACK] Seq=1 Ack=57353 Win=156672 Len=0 TSval=1401372610 TSecr=939392540 SLE=67545 SRE=73241","0.000048676","","","",""
"579","9.383326908","10.10.3.105","10.10.3.59","MPTCP","1516","[TCP Out-Of-Order] 50927  >  5201 [PSH, ACK] Seq=57353 Ack=1 Win=64256 Len=1424 TSval=939392540 TSecr=1401372285","","","","","â\234\223"
"580","9.383372889","10.10.3.59","10.10.3.105","MPTCP","92","5201  >  50927 [ACK] Seq=1 Ack=58777 Win=159616 Len=0 TSval=1401372629 TSecr=939392540 SLE=67545 SRE=73241","0.000045981","","","",""
"581","9.391833215","10.10.3.105","10.10.3.59","MPTCP","316","[TCP Out-Of-Order] 50927  >  5201 [PSH, ACK] Seq=67321 Ack=1 Win=64256 Len=224 TSval=939392600 TSecr=1401372345","","","","","â\234\223"
"582","9.391871632","10.10.3.59","10.10.3.105","MPTCP","92","[TCP Window Update] 5201  >  50927 [ACK] Seq=1 Ack=58777 Win=162432 Len=0 TSval=1401372638 TSecr=939392540 SLE=64473 SRE=73241","","","","","â\234\223"
"583","9.409731945","10.10.3.105","10.10.3.59","MPTCP","1516","[TCP Out-Of-Order] 50927  >  5201 [ACK] Seq=58777 Ack=1 Win=64256 Len=1424 TSval=939392580 TSecr=1401372321","","","","","â\234\223"
"584","9.409777366","10.10.3.59","10.10.3.105","MPTCP","92","5201  >  50927 [ACK] Seq=1 Ack=60201 Win=165376 Len=0 TSval=1401372655 TSecr=939392580 SLE=64473 SRE=73241","0.000045421","","","",""
"585","9.412189422","10.10.3.105","10.10.3.102","MPTCP","1516","[TCP Previous segment not captured] 48428  >  5201 [ACK] Seq=48454 Ack=1 Win=64256 Len=1424 TSval=2010137406 TSecr=1041264106","","â\234\223","","","â\234\223"
"586","9.412232016","10.10.3.102","10.10.3.105","MPTCP","92","[TCP Window Update] 5201  >  48428 [ACK] Seq=1 Ack=47030 Win=165376 Len=0 TSval=1041264280 TSecr=2010137249 SLE=48454 SRE=49878","","","","","â\234\223"
