"No.","Time","Source","Destination","Protocol","Length","Info","RTT","Lost Segement","Duplicate ","Retransmission","IDK"
"6535","155.465369423","10.10.3.105","10.10.3.102","MPTCP","80","36420  >  5201 [SYN] Seq=0 Win=64240 Len=0 MSS=1460 SACK_PERM=1 TSval=2009886732 TSecr=0 WS=128","","","","",""
"6536","155.572665456","10.10.3.102","10.10.3.105","MPTCP","88","5201  >  36420 [SYN, ACK] Seq=0 Ack=1 Win=65160 Len=0 MSS=1460 SACK_PERM=1 TSval=1041013431 TSecr=2009886732 WS=128","0.107296033","","","",""
"6537","155.573249864","10.10.3.105","10.10.3.102","MPTCP","88","36420  >  5201 [ACK] Seq=1 Ack=1 Win=64256 Len=0 TSval=2009886840 TSecr=1041013431","0.000584408","","","",""
"6538","155.573250448","10.10.3.105","10.10.3.102","MPTCP","129","36420  >  5201 [PSH, ACK] Seq=1 Ack=1 Win=64256 Len=37 TSval=2009886840 TSecr=1041013431","","","","",""
"6539","155.682376471","10.10.3.102","10.10.3.105","MPTCP","97","5201  >  36420 [PSH, ACK] Seq=1 Ack=38 Win=65152 Len=1 TSval=1041013539 TSecr=2009886840","0.109126023","","","",""
"6540","155.682973958","10.10.3.105","10.10.3.102","MPTCP","80","36420  >  5201 [ACK] Seq=38 Ack=2 Win=64256 Len=0 TSval=2009886950 TSecr=1041013539","0.000597487","","","",""
"6541","155.683038484","10.10.3.105","10.10.3.102","MPTCP","100","36420  >  5201 [PSH, ACK] Seq=38 Ack=2 Win=64256 Len=4 TSval=2009886950 TSecr=1041013539","","","","",""
"6542","155.686582191","10.10.3.62","10.10.3.102","MPTCP","88","52079  >  5201 [SYN] Seq=0 Win=64256 Len=0 MSS=1460 SACK_PERM=1 TSval=3347054155 TSecr=0 WS=128","","","","",""
"6543","155.688663980","10.10.3.102","10.10.3.105","MPTCP","84","[TCP Keep-Alive] 5201  >  36420 [ACK] Seq=1 Ack=38 Win=65152 Len=0 TSval=1041013539 TSecr=2009886840","","","","","â\234\223"
"6544","155.689224917","10.10.3.105","10.10.3.102","MPTCP","80","[TCP Keep-Alive ACK] 36420  >  5201 [ACK] Seq=42 Ack=2 Win=64256 Len=0 TSval=2009886956 TSecr=1041013539","","","","","â\234\223"
"6545","155.689960059","10.10.3.102","10.10.3.105","MPTCP","80","[TCP Keep-Alive] 5201  >  36420 [ACK] Seq=1 Ack=38 Win=65152 Len=0 TSval=1041013539 TSecr=2009886840","","","","","â\234\223"
"6546","155.800290972","10.10.3.102","10.10.3.62","MPTCP","92","5201  >  52079 [SYN, ACK] Seq=0 Ack=1 Win=65160 Len=0 MSS=1460 SACK_PERM=1 TSval=2493831934 TSecr=3347054155 WS=128","0.113708781","","","",""
"6547","155.809380977","10.10.3.102","10.10.3.105","MPTCP","80","5201  >  36420 [ACK] Seq=2 Ack=42 Win=65152 Len=0 TSval=1041013693 TSecr=2009886950","0.126342493","","","",""
"6548","155.809584446","10.10.3.105","10.10.3.102","MPTCP","196","36420  >  5201 [PSH, ACK] Seq=42 Ack=2 Win=64256 Len=100 TSval=2009887076 TSecr=1041013693","","","","",""
"6551","155.892880152","10.10.3.102","10.10.3.105","MPTCP","80","5201  >  36420 [ACK] Seq=2 Ack=142 Win=65152 Len=0 TSval=1041013775 TSecr=2009887076","0.083295706","","","",""
"6553","155.927399127","10.10.3.102","10.10.3.105","MPTCP","97","5201  >  36420 [PSH, ACK] Seq=2 Ack=142 Win=65152 Len=1 TSval=1041013776 TSecr=2009887076","","","","",""
"6554","155.927777821","10.10.3.105","10.10.3.102","MPTCP","80","36424  >  5201 [SYN] Seq=0 Win=64240 Len=0 MSS=1460 SACK_PERM=1 TSval=2009887194 TSecr=0 WS=128","","","","",""
"6556","155.970136455","10.10.3.105","10.10.3.102","MPTCP","80","36420  >  5201 [ACK] Seq=142 Ack=3 Win=64256 Len=0 TSval=2009887237 TSecr=1041013776","0.042737328","","","",""
"6557","156.032701694","10.10.3.102","10.10.3.105","MPTCP","88","5201  >  36424 [SYN, ACK] Seq=0 Ack=1 Win=65160 Len=0 MSS=1460 SACK_PERM=1 TSval=1041013894 TSecr=2009887194 WS=128","0.104923873","","","",""
"6558","156.033277338","10.10.3.105","10.10.3.102","MPTCP","88","36424  >  5201 [ACK] Seq=1 Ack=1 Win=64256 Len=0 TSval=2009887300 TSecr=1041013894","0.000575644","","","",""
"6559","156.033277993","10.10.3.105","10.10.3.102","MPTCP","129","36424  >  5201 [PSH, ACK] Seq=1 Ack=1 Win=64256 Len=37 TSval=2009887300 TSecr=1041013894","","","","",""
"6566","156.115822986","10.10.3.102","10.10.3.105","MPTCP","97","5201  >  36420 [PSH, ACK] Seq=3 Ack=142 Win=65152 Len=1 TSval=1041014002 TSecr=2009887237","","","","",""
"6567","156.115981252","10.10.3.105","10.10.3.102","MPTCP","80","36420  >  5201 [ACK] Seq=142 Ack=4 Win=64256 Len=0 TSval=2009887383 TSecr=1041014002","0.000158266","","","",""
"6568","156.117400586","10.10.3.102","10.10.3.105","MPTCP","84","5201  >  36424 [ACK] Seq=1 Ack=38 Win=65152 Len=0 TSval=1041013999 TSecr=2009887300","0.084122593","","","",""
"6569","156.117563376","10.10.3.105","10.10.3.102","MPTCP","76","36424  >  5201 [ACK] Seq=38 Ack=1 Win=64256 Len=0 TSval=2009887384 TSecr=1041013999","","","","",""
"6571","156.119932580","10.10.3.62","10.10.3.102","MPTCP","88","50983  >  5201 [SYN] Seq=0 Win=64256 Len=0 MSS=1460 SACK_PERM=1 TSval=3347054589 TSecr=0 WS=128","","","","",""
"6572","156.120182478","10.10.3.105","10.10.3.59","MPTCP","88","42571  >  5201 [SYN] Seq=0 Win=64256 Len=0 MSS=1460 SACK_PERM=1 TSval=939142716 TSecr=0 WS=128","","","","",""
"6573","156.120217023","10.10.3.59","10.10.3.105","MPTCP","92","5201  >  42571 [SYN, ACK] Seq=0 Ack=1 Win=65160 Len=0 MSS=1460 SACK_PERM=1 TSval=1401122464 TSecr=939142716 WS=128","0.000034545","","","",""
"6576","156.123284570","10.10.3.105","10.10.3.59","MPTCP","92","42571  >  5201 [ACK] Seq=1 Ack=1 Win=64256 Len=0 TSval=939142722 TSecr=1401122464","0.003067547","","","",""
"6577","156.123362900","10.10.3.59","10.10.3.105","MPTCP","80","[TCP Window Update] 5201  >  42571 [ACK] Seq=1 Ack=1 Win=65280 Len=0 TSval=1401122467 TSecr=939142722","","","","","â\234\223"
"6578","156.142446027","10.10.3.102","10.10.3.105","MPTCP","80","5201  >  36424 [ACK] Seq=1 Ack=38 Win=65152 Len=0 TSval=1041013999 TSecr=2009887300","","","","",""
"6586","156.213618564","10.10.3.102","10.10.3.105","MPTCP","97","5201  >  36420 [PSH, ACK] Seq=4 Ack=142 Win=65152 Len=1 TSval=1041014082 TSecr=2009887383","","","","",""
"6587","156.213723540","10.10.3.105","10.10.3.102","MPTCP","80","36420  >  5201 [ACK] Seq=142 Ack=5 Win=64256 Len=0 TSval=2009887481 TSecr=1041014082","0.000104976","","","",""
"6588","156.213797045","10.10.3.105","10.10.3.102","MPTCP","2940","36424  >  5201 [PSH, ACK] Seq=38 Ack=1 Win=64256 Len=2848 TSval=2009887481 TSecr=1041013999","","","","",""
"6589","156.213862151","10.10.3.105","10.10.3.102","MPTCP","2940","36424  >  5201 [PSH, ACK] Seq=2886 Ack=1 Win=64256 Len=2848 TSval=2009887481 TSecr=1041013999","","","","",""
"6590","156.213921562","10.10.3.105","10.10.3.102","MPTCP","2940","36424  >  5201 [PSH, ACK] Seq=5734 Ack=1 Win=64256 Len=2848 TSval=2009887481 TSecr=1041013999","","","","",""
"6591","156.214039367","10.10.3.105","10.10.3.102","MPTCP","2940","36424  >  5201 [PSH, ACK] Seq=8582 Ack=1 Win=64256 Len=2848 TSval=2009887481 TSecr=1041013999","","","","",""
"6592","156.214119151","10.10.3.105","10.10.3.102","MPTCP","2940","36424  >  5201 [PSH, ACK] Seq=11430 Ack=1 Win=64256 Len=2848 TSval=2009887481 TSecr=1041013999","","","","",""
"6593","156.218453190","10.10.3.102","10.10.3.62","MPTCP","92","5201  >  50983 [SYN, ACK] Seq=0 Ack=1 Win=65160 Len=0 MSS=1460 SACK_PERM=1 TSval=2493832367 TSecr=3347054589 WS=128","0.098520610","","","",""
"6599","156.294918961","10.10.3.102","10.10.3.105","MPTCP","80","5201  >  36424 [ACK] Seq=1 Ack=8582 Win=63488 Len=0 TSval=1041014180 TSecr=2009887481","0.080997399","","","",""
"6600","156.295222058","10.10.3.102","10.10.3.105","MPTCP","80","5201  >  36424 [ACK] Seq=1 Ack=11430 Win=63488 Len=0 TSval=1041014180 TSecr=2009887481","0.081182691","","","",""
"6601","156.295361149","10.10.3.105","10.10.3.102","MPTCP","2940","36424  >  5201 [PSH, ACK] Seq=14278 Ack=1 Win=64256 Len=2848 TSval=2009887562 TSecr=1041014180","","","","",""
"6602","156.295456090","10.10.3.105","10.10.3.102","MPTCP","2940","36424  >  5201 [PSH, ACK] Seq=17126 Ack=1 Win=64256 Len=2848 TSval=2009887562 TSecr=1041014180","","","","",""
"6603","156.295456314","10.10.3.105","10.10.3.102","MPTCP","2940","36424  >  5201 [PSH, ACK] Seq=19974 Ack=1 Win=64256 Len=2848 TSval=2009887562 TSecr=1041014180","","","","",""
"6604","156.295517782","10.10.3.105","10.10.3.102","MPTCP","2940","36424  >  5201 [PSH, ACK] Seq=22822 Ack=1 Win=64256 Len=2848 TSval=2009887562 TSecr=1041014180","","","","",""
"6605","156.295517924","10.10.3.105","10.10.3.102","MPTCP","2940","36424  >  5201 [PSH, ACK] Seq=25670 Ack=1 Win=64256 Len=2848 TSval=2009887562 TSecr=1041014180","","","","",""
"6606","156.295614585","10.10.3.105","10.10.3.102","MPTCP","2940","36424  >  5201 [PSH, ACK] Seq=28518 Ack=1 Win=64256 Len=2848 TSval=2009887562 TSecr=1041014180","","","","",""
"6607","156.295698658","10.10.3.105","10.10.3.102","MPTCP","2940","36424  >  5201 [PSH, ACK] Seq=31366 Ack=1 Win=64256 Len=2848 TSval=2009887562 TSecr=1041014180","","","","",""
"6608","156.295790499","10.10.3.105","10.10.3.102","MPTCP","2940","36424  >  5201 [PSH, ACK] Seq=34214 Ack=1 Win=64256 Len=2848 TSval=2009887563 TSecr=1041014180","","","","",""
"6609","156.298482937","10.10.3.105","10.10.3.59","MPTCP","1516","42571  >  5201 [ACK] Seq=1 Ack=1 Win=64256 Len=1424 TSval=939142894 TSecr=1401122467","","","","",""
"6610","156.298529285","10.10.3.59","10.10.3.105","MPTCP","80","5201  >  42571 [ACK] Seq=1 Ack=1425 Win=92672 Len=0 TSval=1401122642 TSecr=939142894","0.000046348","","","",""
"6611","156.300512567","10.10.3.105","10.10.3.59","MPTCP","1516","42571  >  5201 [ACK] Seq=1425 Ack=1 Win=64256 Len=1424 TSval=939142894 TSecr=1401122467","","","","",""
"6612","156.300562880","10.10.3.59","10.10.3.105","MPTCP","80","5201  >  42571 [ACK] Seq=1 Ack=2849 Win=92672 Len=0 TSval=1401122644 TSecr=939142894","0.000050313","","","",""
"6613","156.305035964","10.10.3.102","10.10.3.105","MPTCP","80","5201  >  36424 [ACK] Seq=1 Ack=2886 Win=63488 Len=0 TSval=1041014180 TSecr=2009887481","","","","",""
"6615","156.310265487","10.10.3.105","10.10.3.59","MPTCP","1516","42571  >  5201 [PSH, ACK] Seq=2849 Ack=1 Win=64256 Len=1424 TSval=939142894 TSecr=1401122467","","","","",""
"6616","156.310311874","10.10.3.59","10.10.3.105","MPTCP","80","5201  >  42571 [ACK] Seq=1 Ack=4273 Win=92672 Len=0 TSval=1401122654 TSecr=939142894","0.000046387","","","",""
"6619","156.313283583","10.10.3.102","10.10.3.105","MPTCP","80","5201  >  36424 [ACK] Seq=1 Ack=5734 Win=61440 Len=0 TSval=1041014180 TSecr=2009887481","","","","",""
"6621","156.318803214","10.10.3.102","10.10.3.105","MPTCP","80","5201  >  36424 [ACK] Seq=1 Ack=14278 Win=61440 Len=0 TSval=1041014180 TSecr=2009887481","0.104684063","","","",""
"6622","156.319224832","10.10.3.105","10.10.3.102","MPTCP","2940","36424  >  5201 [PSH, ACK] Seq=37062 Ack=1 Win=64256 Len=2848 TSval=2009887586 TSecr=1041014180","","","","",""
"6623","156.319225176","10.10.3.105","10.10.3.102","MPTCP","2940","36424  >  5201 [PSH, ACK] Seq=39910 Ack=1 Win=64256 Len=2848 TSval=2009887586 TSecr=1041014180","","","","",""
"6624","156.321990787","10.10.3.105","10.10.3.59","MPTCP","1516","42571  >  5201 [ACK] Seq=4273 Ack=1 Win=64256 Len=1424 TSval=939142894 TSecr=1401122467","","","","",""
"6625","156.322019643","10.10.3.59","10.10.3.105","MPTCP","80","5201  >  42571 [ACK] Seq=1 Ack=5697 Win=104064 Len=0 TSval=1401122666 TSecr=939142894","0.000028856","","","",""
"6626","156.332762990","10.10.3.105","10.10.3.59","MPTCP","1148","42571  >  5201 [PSH, ACK] Seq=5697 Ack=1 Win=64256 Len=1056 TSval=939142894 TSecr=1401122467","","","","",""
"6627","156.332782809","10.10.3.59","10.10.3.105","MPTCP","80","5201  >  42571 [ACK] Seq=1 Ack=6753 Win=104064 Len=0 TSval=1401122677 TSecr=939142894","0.000019819","","","",""
"6631","156.340123028","10.10.3.105","10.10.3.59","MPTCP","1516","42571  >  5201 [ACK] Seq=6753 Ack=1 Win=64256 Len=1424 TSval=939142894 TSecr=1401122467","","","","",""
"6632","156.340141281","10.10.3.59","10.10.3.105","MPTCP","80","5201  >  42571 [ACK] Seq=1 Ack=8177 Win=104064 Len=0 TSval=1401122684 TSecr=939142894","0.000018253","","","",""
"6637","156.355369194","10.10.3.105","10.10.3.59","MPTCP","1516","42571  >  5201 [PSH, ACK] Seq=8177 Ack=1 Win=64256 Len=1424 TSval=939142894 TSecr=1401122467","","","","",""
"6638","156.355390512","10.10.3.59","10.10.3.105","MPTCP","80","5201  >  42571 [ACK] Seq=1 Ack=9601 Win=104064 Len=0 TSval=1401122699 TSecr=939142894","0.000021318","","","",""
"6640","156.367205339","10.10.3.105","10.10.3.59","MPTCP","1516","42571  >  5201 [ACK] Seq=9601 Ack=1 Win=64256 Len=1424 TSval=939142900 TSecr=1401122642","","","","",""
"6641","156.367223687","10.10.3.59","10.10.3.105","MPTCP","80","5201  >  42571 [ACK] Seq=1 Ack=11025 Win=104064 Len=0 TSval=1401122711 TSecr=939142900","0.000018348","","","",""
"6642","156.378388065","10.10.3.105","10.10.3.59","MPTCP","1516","42571  >  5201 [ACK] Seq=11025 Ack=1 Win=64256 Len=1424 TSval=939142900 TSecr=1401122642","","","","",""
"6643","156.378409307","10.10.3.59","10.10.3.105","MPTCP","80","5201  >  42571 [ACK] Seq=1 Ack=12449 Win=104064 Len=0 TSval=1401122722 TSecr=939142900","0.000021242","","","",""
"6644","156.378866966","10.10.3.102","10.10.3.105","MPTCP","80","5201  >  36424 [ACK] Seq=1 Ack=22822 Win=59392 Len=0 TSval=1041014261 TSecr=2009887562","0.083410652","","","",""
"6645","156.379331555","10.10.3.105","10.10.3.102","MPTCP","2940","36424  >  5201 [PSH, ACK] Seq=42758 Ack=1 Win=64256 Len=2848 TSval=2009887646 TSecr=1041014261","","","","",""
"6646","156.379331677","10.10.3.105","10.10.3.102","MPTCP","2940","36424  >  5201 [PSH, ACK] Seq=45606 Ack=1 Win=64256 Len=2848 TSval=2009887646 TSecr=1041014261","","","","",""
"6647","156.379377435","10.10.3.105","10.10.3.102","MPTCP","2940","36424  >  5201 [PSH, ACK] Seq=48454 Ack=1 Win=64256 Len=2848 TSval=2009887646 TSecr=1041014261","","","","",""
"6648","156.379405184","10.10.3.105","10.10.3.102","MPTCP","2940","36424  >  5201 [PSH, ACK] Seq=51302 Ack=1 Win=64256 Len=2848 TSval=2009887646 TSecr=1041014261","","","","",""
"6649","156.379436237","10.10.3.105","10.10.3.102","MPTCP","2940","36424  >  5201 [PSH, ACK] Seq=54150 Ack=1 Win=64256 Len=2848 TSval=2009887646 TSecr=1041014261","","","","",""
"6650","156.379436283","10.10.3.105","10.10.3.102","MPTCP","2940","36424  >  5201 [PSH, ACK] Seq=56998 Ack=1 Win=64256 Len=2848 TSval=2009887646 TSecr=1041014261","","","","",""
"6651","156.379601242","10.10.3.102","10.10.3.105","MPTCP","80","5201  >  36424 [ACK] Seq=1 Ack=25670 Win=69888 Len=0 TSval=1041014261 TSecr=2009887562","0.084083460","","","",""
"6652","156.379763442","10.10.3.105","10.10.3.102","MPTCP","2940","36424  >  5201 [PSH, ACK] Seq=59846 Ack=1 Win=64256 Len=2848 TSval=2009887647 TSecr=1041014261","","","","",""
"6653","156.379763628","10.10.3.105","10.10.3.102","MPTCP","2716","36424  >  5201 [PSH, ACK] Seq=62694 Ack=1 Win=64256 Len=2624 TSval=2009887647 TSecr=1041014261","","","","",""
"6654","156.386423568","10.10.3.102","10.10.3.105","MPTCP","80","5201  >  36424 [ACK] Seq=1 Ack=31366 Win=81280 Len=0 TSval=1041014262 TSecr=2009887562","0.090808983","","","",""
"6655","156.388530202","10.10.3.102","10.10.3.105","MPTCP","80","5201  >  36424 [ACK] Seq=1 Ack=17126 Win=63488 Len=0 TSval=1041014261 TSecr=2009887562","","","","",""
"6656","156.388666565","10.10.3.105","10.10.3.59","MPTCP","1516","42571  >  5201 [ACK] Seq=12449 Ack=1 Win=64256 Len=1424 TSval=939142900 TSecr=1401122642","","","","",""
"6657","156.388698901","10.10.3.59","10.10.3.105","MPTCP","80","5201  >  42571 [ACK] Seq=1 Ack=13873 Win=134144 Len=0 TSval=1401122733 TSecr=939142900","0.000032336","","","",""
"6658","156.389638951","10.10.3.102","10.10.3.105","MPTCP","80","5201  >  36424 [ACK] Seq=1 Ack=28518 Win=75520 Len=0 TSval=1041014261 TSecr=2009887562","","","","",""
"6659","156.397277942","10.10.3.102","10.10.3.105","MPTCP","80","5201  >  36424 [ACK] Seq=1 Ack=37062 Win=92672 Len=0 TSval=1041014262 TSecr=2009887563","0.101487443","","","",""
"6660","156.399819996","10.10.3.102","10.10.3.105","MPTCP","80","5201  >  36424 [ACK] Seq=1 Ack=42758 Win=104064 Len=0 TSval=1041014285 TSecr=2009887586","0.080594820","","","",""
"6661","156.402551310","10.10.3.102","10.10.3.105","MPTCP","80","5201  >  36424 [ACK] Seq=1 Ack=19974 Win=61440 Len=0 TSval=1041014261 TSecr=2009887562","","","","",""
"6662","156.402744527","10.10.3.105","10.10.3.59","MPTCP","1516","42571  >  5201 [PSH, ACK] Seq=13873 Ack=1 Win=64256 Len=1424 TSval=939142900 TSecr=1401122642","","","","",""
"6663","156.402787457","10.10.3.59","10.10.3.105","MPTCP","80","5201  >  42571 [ACK] Seq=1 Ack=15297 Win=132864 Len=0 TSval=1401122747 TSecr=939142900","0.000042930","","","",""
"6664","156.402990034","10.10.3.105","10.10.3.102","MPTCP","76","[TCP Dup ACK 6558#1] 36424  >  5201 [ACK] Seq=65318 Ack=1 Win=64256 Len=0 TSval=2009887670 TSecr=1041014285","","","â\234\223","","â\234\223"
"6665","156.403155769","10.10.3.102","10.10.3.105","MPTCP","80","5201  >  36424 [ACK] Seq=1 Ack=34214 Win=86912 Len=0 TSval=1041014262 TSecr=2009887562","","","","",""
"6668","156.413978794","10.10.3.105","10.10.3.59","MPTCP","1516","42571  >  5201 [ACK] Seq=15297 Ack=1 Win=64256 Len=1424 TSval=939142911 TSecr=1401122654","","","","",""
"6669","156.414025276","10.10.3.59","10.10.3.105","MPTCP","80","5201  >  42571 [ACK] Seq=1 Ack=16721 Win=131456 Len=0 TSval=1401122758 TSecr=939142911","0.000046482","","","",""
"6670","156.422463946","10.10.3.102","10.10.3.105","MPTCP","80","5201  >  36424 [ACK] Seq=1 Ack=39910 Win=98304 Len=0 TSval=1041014285 TSecr=2009887586","","","","",""
"6671","156.424746956","10.10.3.105","10.10.3.59","MPTCP","1516","42571  >  5201 [ACK] Seq=16721 Ack=1 Win=64256 Len=1424 TSval=939142911 TSecr=1401122654","","","","",""
"6672","156.424792469","10.10.3.59","10.10.3.105","MPTCP","80","5201  >  42571 [ACK] Seq=1 Ack=18145 Win=130048 Len=0 TSval=1401122769 TSecr=939142911","0.000045513","","","",""
"6673","156.443551911","10.10.3.105","10.10.3.59","MPTCP","1516","42571  >  5201 [PSH, ACK] Seq=18145 Ack=1 Win=64256 Len=1424 TSval=939142911 TSecr=1401122654","","","","",""
"6674","156.443598287","10.10.3.59","10.10.3.105","MPTCP","80","5201  >  42571 [ACK] Seq=1 Ack=19569 Win=128640 Len=0 TSval=1401122787 TSecr=939142911","0.000046376","","","",""
"6675","156.447216717","10.10.3.105","10.10.3.59","MPTCP","1516","42571  >  5201 [ACK] Seq=19569 Ack=1 Win=64256 Len=1424 TSval=939142922 TSecr=1401122666","","","","",""
"6676","156.447262730","10.10.3.59","10.10.3.105","MPTCP","80","5201  >  42571 [ACK] Seq=1 Ack=20993 Win=127232 Len=0 TSval=1401122791 TSecr=939142922","0.000046013","","","",""
"6677","156.458999759","10.10.3.105","10.10.3.59","MPTCP","1516","42571  >  5201 [ACK] Seq=20993 Ack=1 Win=64256 Len=1424 TSval=939142922 TSecr=1401122666","","","","",""
"6678","156.459046909","10.10.3.59","10.10.3.105","MPTCP","80","5201  >  42571 [ACK] Seq=1 Ack=22417 Win=125824 Len=0 TSval=1401122803 TSecr=939142922","0.000047150","","","",""
"6679","156.459546727","10.10.3.102","10.10.3.105","MPTCP","80","5201  >  36424 [ACK] Seq=1 Ack=51302 Win=121088 Len=0 TSval=1041014345 TSecr=2009887646","0.080169292","","","",""
"6680","156.459867523","10.10.3.102","10.10.3.105","MPTCP","80","5201  >  36424 [ACK] Seq=1 Ack=59846 Win=134528 Len=0 TSval=1041014345 TSecr=2009887646","0.080431240","","","",""
"6681","156.460022585","10.10.3.102","10.10.3.105","MPTCP","80","5201  >  36424 [ACK] Seq=1 Ack=48454 Win=115456 Len=0 TSval=1041014345 TSecr=2009887646","","","","",""
"6682","156.464500433","10.10.3.102","10.10.3.105","MPTCP","80","5201  >  36424 [ACK] Seq=1 Ack=54150 Win=126848 Len=0 TSval=1041014345 TSecr=2009887646","","","","",""
"6683","156.466443851","10.10.3.102","10.10.3.105","MPTCP","80","5201  >  36424 [ACK] Seq=1 Ack=56998 Win=132480 Len=0 TSval=1041014345 TSecr=2009887646","","","","",""
"6684","156.470886864","10.10.3.105","10.10.3.59","MPTCP","1516","42571  >  5201 [PSH, ACK] Seq=22417 Ack=1 Win=64256 Len=1424 TSval=939142922 TSecr=1401122666","","","","",""
"6685","156.470933572","10.10.3.59","10.10.3.105","MPTCP","80","5201  >  42571 [ACK] Seq=1 Ack=23841 Win=124416 Len=0 TSval=1401122815 TSecr=939142922","0.000046708","","","",""
"6686","156.474471428","10.10.3.102","10.10.3.105","MPTCP","80","5201  >  36424 [ACK] Seq=1 Ack=62694 Win=136576 Len=0 TSval=1041014346 TSecr=2009887647","0.094707986","","","",""
"6687","156.480336642","10.10.3.102","10.10.3.105","MPTCP","80","5201  >  36424 [ACK] Seq=1 Ack=45606 Win=109696 Len=0 TSval=1041014345 TSecr=2009887646","","","","",""
"6688","156.482918351","10.10.3.105","10.10.3.59","MPTCP","1516","42571  >  5201 [ACK] Seq=23841 Ack=1 Win=64256 Len=1424 TSval=939142933 TSecr=1401122677","","","","",""
"6689","156.482963545","10.10.3.59","10.10.3.105","MPTCP","80","5201  >  42571 [ACK] Seq=1 Ack=25265 Win=123008 Len=0 TSval=1401122827 TSecr=939142933","0.000045194","","","",""
"6690","156.494994983","10.10.3.105","10.10.3.59","MPTCP","1516","42571  >  5201 [PSH, ACK] Seq=25265 Ack=1 Win=64256 Len=1424 TSval=939142933 TSecr=1401122677","","","","",""
"6691","156.495042412","10.10.3.59","10.10.3.105","MPTCP","80","5201  >  42571 [ACK] Seq=1 Ack=26689 Win=121600 Len=0 TSval=1401122839 TSecr=939142933","0.000047429","","","",""
"6692","156.497426377","10.10.3.102","10.10.3.105","MPTCP","80","5201  >  36424 [ACK] Seq=1 Ack=65318 Win=135680 Len=0 TSval=1041014346 TSecr=2009887647","0.117662749","","","",""
"6693","156.497994580","10.10.3.105","10.10.3.102","MPTCP","140","36424  >  5201 [PSH, ACK] Seq=65318 Ack=1 Win=64256 Len=48 TSval=2009887765 TSecr=1041014346","","","","",""
"6694","156.513030804","10.10.3.105","10.10.3.59","MPTCP","1516","42571  >  5201 [ACK] Seq=26689 Ack=1 Win=64256 Len=1424 TSval=939142940 TSecr=1401122684","","","","",""
"6695","156.513077161","10.10.3.59","10.10.3.105","MPTCP","80","5201  >  42571 [ACK] Seq=1 Ack=28113 Win=147328 Len=0 TSval=1401122857 TSecr=939142940","0.000046357","","","",""
"6696","156.514479384","10.10.3.105","10.10.3.102","MPTCP","2940","36424  >  5201 [PSH, ACK] Seq=65366 Ack=1 Win=64256 Len=2848 TSval=2009887781 TSecr=1041014346","","","","",""
"6697","156.514479996","10.10.3.105","10.10.3.102","MPTCP","2940","36424  >  5201 [PSH, ACK] Seq=68214 Ack=1 Win=64256 Len=2848 TSval=2009887781 TSecr=1041014346","","","","",""
"6698","156.514480106","10.10.3.105","10.10.3.102","MPTCP","2940","36424  >  5201 [PSH, ACK] Seq=71062 Ack=1 Win=64256 Len=2848 TSval=2009887781 TSecr=1041014346","","","","",""
"6699","156.514480207","10.10.3.105","10.10.3.102","MPTCP","2940","36424  >  5201 [PSH, ACK] Seq=73910 Ack=1 Win=64256 Len=2848 TSval=2009887781 TSecr=1041014346","","","","",""
"6700","156.514585822","10.10.3.105","10.10.3.102","MPTCP","2940","36424  >  5201 [PSH, ACK] Seq=76758 Ack=1 Win=64256 Len=2848 TSval=2009887781 TSecr=1041014346","","","","",""
"6701","156.514586041","10.10.3.105","10.10.3.102","MPTCP","2940","36424  >  5201 [PSH, ACK] Seq=79606 Ack=1 Win=64256 Len=2848 TSval=2009887781 TSecr=1041014346","","","","",""
"6702","156.514586129","10.10.3.105","10.10.3.102","MPTCP","2940","36424  >  5201 [PSH, ACK] Seq=82454 Ack=1 Win=64256 Len=2848 TSval=2009887781 TSecr=1041014346","","","","",""
"6703","156.514586231","10.10.3.105","10.10.3.102","MPTCP","2940","36424  >  5201 [PSH, ACK] Seq=85302 Ack=1 Win=64256 Len=2848 TSval=2009887781 TSecr=1041014346","","","","",""
"6704","156.514630788","10.10.3.105","10.10.3.102","MPTCP","2940","36424  >  5201 [PSH, ACK] Seq=88150 Ack=1 Win=64256 Len=2848 TSval=2009887781 TSecr=1041014346","","","","",""
"6705","156.514697625","10.10.3.105","10.10.3.102","MPTCP","1516","36424  >  5201 [ACK] Seq=90998 Ack=1 Win=64256 Len=1424 TSval=2009887781 TSecr=1041014346","","","","",""
"6706","156.518542371","10.10.3.105","10.10.3.59","MPTCP","1516","42571  >  5201 [PSH, ACK] Seq=28113 Ack=1 Win=64256 Len=1424 TSval=939142940 TSecr=1401122684","","","","",""
"6707","156.518587767","10.10.3.59","10.10.3.105","MPTCP","80","5201  >  42571 [ACK] Seq=1 Ack=29537 Win=201472 Len=0 TSval=1401122862 TSecr=939142940","0.000045396","","","",""
"6708","156.519469083","10.10.3.105","10.10.3.102","MPTCP","188","36424  >  5201 [PSH, ACK] Seq=92422 Ack=1 Win=64256 Len=96 TSval=2009887786 TSecr=1041014346","","","","",""
"6709","156.519469761","10.10.3.105","10.10.3.102","MPTCP","2940","36424  >  5201 [PSH, ACK] Seq=92518 Ack=1 Win=64256 Len=2848 TSval=2009887786 TSecr=1041014346","","","","",""
"6710","156.519563414","10.10.3.105","10.10.3.102","MPTCP","2940","36424  >  5201 [PSH, ACK] Seq=95366 Ack=1 Win=64256 Len=2848 TSval=2009887786 TSecr=1041014346","","","","",""
"6711","156.519603082","10.10.3.105","10.10.3.102","MPTCP","2940","36424  >  5201 [PSH, ACK] Seq=98214 Ack=1 Win=64256 Len=2848 TSval=2009887786 TSecr=1041014346","","","","",""
"6712","156.519671526","10.10.3.105","10.10.3.102","MPTCP","2940","36424  >  5201 [PSH, ACK] Seq=101062 Ack=1 Win=64256 Len=2848 TSval=2009887786 TSecr=1041014346","","","","",""
"6713","156.519753800","10.10.3.105","10.10.3.102","MPTCP","2940","36424  >  5201 [PSH, ACK] Seq=103910 Ack=1 Win=64256 Len=2848 TSval=2009887787 TSecr=1041014346","","","","",""
"6714","156.519843003","10.10.3.105","10.10.3.102","MPTCP","2940","36424  >  5201 [PSH, ACK] Seq=106758 Ack=1 Win=64256 Len=2848 TSval=2009887787 TSecr=1041014346","","","","",""
"6715","156.519843132","10.10.3.105","10.10.3.102","MPTCP","2940","36424  >  5201 [PSH, ACK] Seq=109606 Ack=1 Win=64256 Len=2848 TSval=2009887787 TSecr=1041014346","","","","",""
"6716","156.519896863","10.10.3.105","10.10.3.102","MPTCP","2940","36424  >  5201 [PSH, ACK] Seq=112454 Ack=1 Win=64256 Len=2848 TSval=2009887787 TSecr=1041014346","","","","",""
"6717","156.519897010","10.10.3.105","10.10.3.102","MPTCP","2940","36424  >  5201 [PSH, ACK] Seq=115302 Ack=1 Win=64256 Len=2848 TSval=2009887787 TSecr=1041014346","","","","",""
"6718","156.519949564","10.10.3.105","10.10.3.102","MPTCP","2940","36424  >  5201 [PSH, ACK] Seq=118150 Ack=1 Win=64256 Len=2848 TSval=2009887787 TSecr=1041014346","","","","",""
"6719","156.519949706","10.10.3.105","10.10.3.102","MPTCP","2940","36424  >  5201 [PSH, ACK] Seq=120998 Ack=1 Win=64256 Len=2848 TSval=2009887787 TSecr=1041014346","","","","",""
"6720","156.520006228","10.10.3.105","10.10.3.102","MPTCP","2940","36424  >  5201 [PSH, ACK] Seq=123846 Ack=1 Win=64256 Len=2848 TSval=2009887787 TSecr=1041014346","","","","",""
"6721","156.520006393","10.10.3.105","10.10.3.102","MPTCP","2940","36424  >  5201 [PSH, ACK] Seq=126694 Ack=1 Win=64256 Len=2848 TSval=2009887787 TSecr=1041014346","","","","",""
"6722","156.520065166","10.10.3.105","10.10.3.102","MPTCP","2940","36424  >  5201 [PSH, ACK] Seq=129542 Ack=1 Win=64256 Len=2848 TSval=2009887787 TSecr=1041014346","","","","",""
"6723","156.520065288","10.10.3.105","10.10.3.102","MPTCP","2940","36424  >  5201 [PSH, ACK] Seq=132390 Ack=1 Win=64256 Len=2848 TSval=2009887787 TSecr=1041014346","","","","",""
"6724","156.520065403","10.10.3.105","10.10.3.102","MPTCP","2940","36424  >  5201 [PSH, ACK] Seq=135238 Ack=1 Win=64256 Len=2848 TSval=2009887787 TSecr=1041014346","","","","",""
"6725","156.520131264","10.10.3.105","10.10.3.102","MPTCP","2940","36424  >  5201 [PSH, ACK] Seq=138086 Ack=1 Win=64256 Len=2848 TSval=2009887787 TSecr=1041014346","","","","",""
"6726","156.520170025","10.10.3.105","10.10.3.102","MPTCP","1516","36424  >  5201 [ACK] Seq=140934 Ack=1 Win=64256 Len=1424 TSval=2009887787 TSecr=1041014346","","","","",""
"6727","156.530433241","10.10.3.105","10.10.3.59","MPTCP","1516","42571  >  5201 [ACK] Seq=29537 Ack=1 Win=64256 Len=1424 TSval=939142956 TSecr=1401122699","","","","",""
"6728","156.530480852","10.10.3.59","10.10.3.105","MPTCP","80","5201  >  42571 [ACK] Seq=1 Ack=30961 Win=301184 Len=0 TSval=1401122874 TSecr=939142956","0.000047611","","","",""
"6729","156.542356493","10.10.3.105","10.10.3.59","MPTCP","1516","42571  >  5201 [PSH, ACK] Seq=30961 Ack=1 Win=64256 Len=1424 TSval=939142956 TSecr=1401122699","","","","",""
"6730","156.542403392","10.10.3.59","10.10.3.105","MPTCP","80","5201  >  42571 [ACK] Seq=1 Ack=32385 Win=299904 Len=0 TSval=1401122886 TSecr=939142956","0.000046899","","","",""
"6731","156.553933165","10.10.3.105","10.10.3.59","MPTCP","1516","42571  >  5201 [ACK] Seq=32385 Ack=1 Win=64256 Len=1424 TSval=939142968 TSecr=1401122711","","","","",""
"6732","156.553978113","10.10.3.59","10.10.3.105","MPTCP","80","5201  >  42571 [ACK] Seq=1 Ack=33809 Win=298496 Len=0 TSval=1401122898 TSecr=939142968","0.000044948","","","",""
"6733","156.565936619","10.10.3.105","10.10.3.59","MPTCP","1516","42571  >  5201 [PSH, ACK] Seq=33809 Ack=1 Win=64256 Len=1424 TSval=939142968 TSecr=1401122711","","","","",""
"6734","156.565984094","10.10.3.59","10.10.3.105","MPTCP","80","5201  >  42571 [ACK] Seq=1 Ack=35233 Win=297088 Len=0 TSval=1401122910 TSecr=939142968","0.000047475","","","",""
"6735","156.577831301","10.10.3.105","10.10.3.59","MPTCP","1516","42571  >  5201 [ACK] Seq=35233 Ack=1 Win=64256 Len=1424 TSval=939142978 TSecr=1401122722","","","","",""
"6736","156.577876978","10.10.3.59","10.10.3.105","MPTCP","80","5201  >  42571 [ACK] Seq=1 Ack=36657 Win=295680 Len=0 TSval=1401122922 TSecr=939142978","0.000045677","","","",""
"6737","156.589544962","10.10.3.105","10.10.3.59","MPTCP","1516","42571  >  5201 [PSH, ACK] Seq=36657 Ack=1 Win=64256 Len=1424 TSval=939142978 TSecr=1401122722","","","","",""
"6738","156.589574734","10.10.3.59","10.10.3.105","MPTCP","80","5201  >  42571 [ACK] Seq=1 Ack=38081 Win=294272 Len=0 TSval=1401122933 TSecr=939142978","0.000029772","","","",""
"6739","156.593660547","10.10.3.102","10.10.3.105","MPTCP","80","5201  >  36424 [ACK] Seq=1 Ack=65366 Win=148864 Len=0 TSval=1041014464 TSecr=2009887765","0.095665967","","","",""
"6740","156.593992882","10.10.3.105","10.10.3.102","MPTCP","2940","36424  >  5201 [PSH, ACK] Seq=142358 Ack=1 Win=64256 Len=2848 TSval=2009887861 TSecr=1041014464","","","","",""
"6741","156.600593023","10.10.3.102","10.10.3.105","MPTCP","80","5201  >  36424 [ACK] Seq=1 Ack=115302 Win=248576 Len=0 TSval=1041014486 TSecr=2009887787","0.080696160","","","",""
"6742","156.601023415","10.10.3.105","10.10.3.102","MPTCP","2940","36424  >  5201 [PSH, ACK] Seq=145206 Ack=1 Win=64256 Len=2848 TSval=2009887868 TSecr=1041014486","","","","",""
"6743","156.601023794","10.10.3.105","10.10.3.102","MPTCP","124","36424  >  5201 [PSH, ACK] Seq=148054 Ack=1 Win=64256 Len=32 TSval=2009887868 TSecr=1041014486","","","","",""
"6744","156.601100234","10.10.3.105","10.10.3.102","MPTCP","2940","36424  >  5201 [PSH, ACK] Seq=148086 Ack=1 Win=64256 Len=2848 TSval=2009887868 TSecr=1041014486","","","","",""
"6745","156.601138795","10.10.3.105","10.10.3.102","MPTCP","1516","36424  >  5201 [ACK] Seq=150934 Ack=1 Win=64256 Len=1424 TSval=2009887868 TSecr=1041014486","","","","",""
"6746","156.601924331","10.10.3.105","10.10.3.59","MPTCP","1516","42571  >  5201 [ACK] Seq=38081 Ack=1 Win=64256 Len=1424 TSval=939142989 TSecr=1401122733","","","","",""
"6747","156.601956595","10.10.3.59","10.10.3.105","MPTCP","80","5201  >  42571 [ACK] Seq=1 Ack=39505 Win=321152 Len=0 TSval=1401122946 TSecr=939142989","0.000032264","","","",""
"6748","156.602721863","10.10.3.105","10.10.3.102","MPTCP","716","36424  >  5201 [PSH, ACK] Seq=152358 Ack=1 Win=64256 Len=624 TSval=2009887870 TSecr=1041014486","","","","",""
"6749","156.602801595","10.10.3.105","10.10.3.102","MPTCP","2940","36424  >  5201 [PSH, ACK] Seq=152982 Ack=1 Win=64256 Len=2848 TSval=2009887870 TSecr=1041014486","","","","",""
"6750","156.602801844","10.10.3.105","10.10.3.102","MPTCP","2940","36424  >  5201 [PSH, ACK] Seq=155830 Ack=1 Win=64256 Len=2848 TSval=2009887870 TSecr=1041014486","","","","",""
"6751","156.602899618","10.10.3.105","10.10.3.102","MPTCP","2940","36424  >  5201 [PSH, ACK] Seq=158678 Ack=1 Win=64256 Len=2848 TSval=2009887870 TSecr=1041014486","","","","",""
"6752","156.602975717","10.10.3.105","10.10.3.102","MPTCP","2940","36424  >  5201 [PSH, ACK] Seq=161526 Ack=1 Win=64256 Len=2848 TSval=2009887870 TSecr=1041014486","","","","",""
"6753","156.603063257","10.10.3.102","10.10.3.105","MPTCP","80","5201  >  36424 [ACK] Seq=1 Ack=92518 Win=203008 Len=0 TSval=1041014485 TSecr=2009887786","","","","",""
"6754","156.603070431","10.10.3.105","10.10.3.102","MPTCP","2940","36424  >  5201 [PSH, ACK] Seq=164374 Ack=1 Win=64256 Len=2848 TSval=2009887870 TSecr=1041014486","","","","",""
"6755","156.603139864","10.10.3.105","10.10.3.102","MPTCP","2940","36424  >  5201 [PSH, ACK] Seq=167222 Ack=1 Win=64256 Len=2848 TSval=2009887870 TSecr=1041014486","","","","",""
"6756","156.603233953","10.10.3.105","10.10.3.102","MPTCP","2940","36424  >  5201 [PSH, ACK] Seq=170070 Ack=1 Win=64256 Len=2848 TSval=2009887870 TSecr=1041014486","","","","",""
"6757","156.603276803","10.10.3.105","10.10.3.102","MPTCP","2940","36424  >  5201 [PSH, ACK] Seq=172918 Ack=1 Win=64256 Len=2848 TSval=2009887870 TSecr=1041014486","","","","",""
"6758","156.603342102","10.10.3.105","10.10.3.102","MPTCP","2940","36424  >  5201 [PSH, ACK] Seq=175766 Ack=1 Win=64256 Len=2848 TSval=2009887870 TSecr=1041014486","","","","",""
"6759","156.603420968","10.10.3.105","10.10.3.102","MPTCP","1516","36424  >  5201 [ACK] Seq=178614 Ack=1 Win=64256 Len=1424 TSval=2009887870 TSecr=1041014486","","","","",""
"6760","156.603534936","10.10.3.102","10.10.3.105","MPTCP","80","5201  >  36424 [ACK] Seq=1 Ack=82454 Win=183040 Len=0 TSval=1041014480 TSecr=2009887781","","","","",""
"6761","156.603703279","10.10.3.102","10.10.3.105","MPTCP","80","5201  >  36424 [ACK] Seq=1 Ack=112454 Win=242816 Len=0 TSval=1041014486 TSecr=2009887787","","","","",""
"6762","156.605138163","10.10.3.102","10.10.3.105","MPTCP","80","5201  >  36424 [ACK] Seq=1 Ack=71062 Win=160256 Len=0 TSval=1041014480 TSecr=2009887781","","","","",""
"6763","156.606282765","10.10.3.102","10.10.3.105","MPTCP","80","5201  >  36424 [ACK] Seq=1 Ack=103910 Win=225792 Len=0 TSval=1041014486 TSecr=2009887786","","","","",""
"6764","156.606567868","10.10.3.102","10.10.3.105","MPTCP","80","5201  >  36424 [ACK] Seq=1 Ack=126694 Win=271360 Len=0 TSval=1041014486 TSecr=2009887787","0.086561640","","","",""
"6765","156.606819506","10.10.3.102","10.10.3.105","MPTCP","80","5201  >  36424 [ACK] Seq=1 Ack=109606 Win=237184 Len=0 TSval=1041014486 TSecr=2009887787","","","","",""
"6766","156.607874957","10.10.3.102","10.10.3.105","MPTCP","80","5201  >  36424 [ACK] Seq=1 Ack=140934 Win=299776 Len=0 TSval=1041014486 TSecr=2009887787","0.087743693","","","",""
"6767","156.609294510","10.10.3.102","10.10.3.105","MPTCP","80","5201  >  36424 [ACK] Seq=1 Ack=142358 Win=302720 Len=0 TSval=1041014486 TSecr=2009887787","0.089124485","","","",""
"6768","156.612461630","10.10.3.102","10.10.3.105","MPTCP","80","5201  >  36424 [ACK] Seq=1 Ack=98214 Win=214400 Len=0 TSval=1041014485 TSecr=2009887786","","","","",""
"6769","156.612549817","10.10.3.102","10.10.3.105","MPTCP","80","5201  >  36424 [ACK] Seq=1 Ack=132390 Win=282752 Len=0 TSval=1041014486 TSecr=2009887787","","","","",""
"6770","156.612915605","10.10.3.102","10.10.3.105","MPTCP","80","5201  >  36424 [ACK] Seq=1 Ack=73910 Win=165888 Len=0 TSval=1041014480 TSecr=2009887781","","","","",""
"6771","156.613067407","10.10.3.102","10.10.3.105","MPTCP","80","5201  >  36424 [ACK] Seq=1 Ack=123846 Win=265600 Len=0 TSval=1041014486 TSecr=2009887787","","","","",""
"6772","156.613315445","10.10.3.105","10.10.3.59","MPTCP","1516","42571  >  5201 [PSH, ACK] Seq=39505 Ack=1 Win=64256 Len=1424 TSval=939142989 TSecr=1401122733","","","","",""
"6773","156.613342926","10.10.3.59","10.10.3.105","MPTCP","80","5201  >  42571 [ACK] Seq=1 Ack=40929 Win=378112 Len=0 TSval=1401122957 TSecr=939142989","0.000027481","","","",""
"6774","156.613722628","10.10.3.102","10.10.3.105","MPTCP","80","5201  >  36424 [ACK] Seq=1 Ack=120998 Win=259968 Len=0 TSval=1041014486 TSecr=2009887787","","","","",""
"6775","156.614151254","10.10.3.105","10.10.3.102","MPTCP","1340","36424  >  5201 [PSH, ACK] Seq=180038 Ack=1 Win=64256 Len=1248 TSval=2009887881 TSecr=1041014486","","","","",""
"6776","156.614151449","10.10.3.105","10.10.3.102","MPTCP","2940","36424  >  5201 [PSH, ACK] Seq=181286 Ack=1 Win=64256 Len=2848 TSval=2009887881 TSecr=1041014486","","","","",""
"6777","156.614151527","10.10.3.105","10.10.3.102","MPTCP","2940","36424  >  5201 [PSH, ACK] Seq=184134 Ack=1 Win=64256 Len=2848 TSval=2009887881 TSecr=1041014486","","","","",""
"6778","156.614233511","10.10.3.105","10.10.3.102","MPTCP","2940","36424  >  5201 [PSH, ACK] Seq=186982 Ack=1 Win=64256 Len=2848 TSval=2009887881 TSecr=1041014486","","","","",""
"6779","156.614309227","10.10.3.105","10.10.3.102","MPTCP","2940","36424  >  5201 [PSH, ACK] Seq=189830 Ack=1 Win=64256 Len=2848 TSval=2009887881 TSecr=1041014486","","","","",""
"6780","156.614397350","10.10.3.105","10.10.3.102","MPTCP","2940","36424  >  5201 [PSH, ACK] Seq=192678 Ack=1 Win=64256 Len=2848 TSval=2009887881 TSecr=1041014486","","","","",""
"6781","156.614482319","10.10.3.105","10.10.3.102","MPTCP","2940","36424  >  5201 [PSH, ACK] Seq=195526 Ack=1 Win=64256 Len=2848 TSval=2009887881 TSecr=1041014486","","","","",""
"6782","156.614561774","10.10.3.105","10.10.3.102","MPTCP","2940","36424  >  5201 [PSH, ACK] Seq=198374 Ack=1 Win=64256 Len=2848 TSval=2009887881 TSecr=1041014486","","","","",""
"6783","156.614644671","10.10.3.105","10.10.3.102","MPTCP","2940","36424  >  5201 [PSH, ACK] Seq=201222 Ack=1 Win=64256 Len=2848 TSval=2009887881 TSecr=1041014486","","","","",""
"6784","156.614725428","10.10.3.105","10.10.3.102","MPTCP","2940","36424  >  5201 [PSH, ACK] Seq=204070 Ack=1 Win=64256 Len=2848 TSval=2009887882 TSecr=1041014486","","","","",""
"6785","156.614802890","10.10.3.105","10.10.3.102","MPTCP","2940","36424  >  5201 [PSH, ACK] Seq=206918 Ack=1 Win=64256 Len=2848 TSval=2009887882 TSecr=1041014486","","","","",""
"6786","156.614882955","10.10.3.105","10.10.3.102","MPTCP","2940","36424  >  5201 [PSH, ACK] Seq=209766 Ack=1 Win=64256 Len=2848 TSval=2009887882 TSecr=1041014486","","","","",""
"6787","156.614959971","10.10.3.105","10.10.3.102","MPTCP","2940","36424  >  5201 [PSH, ACK] Seq=212614 Ack=1 Win=64256 Len=2848 TSval=2009887882 TSecr=1041014486","","","","",""
"6788","156.615026867","10.10.3.105","10.10.3.102","MPTCP","2940","36424  >  5201 [PSH, ACK] Seq=215462 Ack=1 Win=64256 Len=2848 TSval=2009887882 TSecr=1041014486","","","","",""
"6789","156.615102866","10.10.3.105","10.10.3.102","MPTCP","2940","36424  >  5201 [PSH, ACK] Seq=218310 Ack=1 Win=64256 Len=2848 TSval=2009887882 TSecr=1041014486","","","","",""
"6790","156.615134840","10.10.3.105","10.10.3.102","MPTCP","2940","36424  >  5201 [PSH, ACK] Seq=221158 Ack=1 Win=64256 Len=2848 TSval=2009887882 TSecr=1041014486","","","","",""
"6791","156.615134915","10.10.3.105","10.10.3.102","MPTCP","2940","36424  >  5201 [PSH, ACK] Seq=224006 Ack=1 Win=64256 Len=2848 TSval=2009887882 TSecr=1041014486","","","","",""
"6792","156.615174261","10.10.3.105","10.10.3.102","MPTCP","2940","36424  >  5201 [PSH, ACK] Seq=226854 Ack=1 Win=64256 Len=2848 TSval=2009887882 TSecr=1041014486","","","","",""
"6793","156.615204793","10.10.3.105","10.10.3.102","MPTCP","2940","36424  >  5201 [PSH, ACK] Seq=229702 Ack=1 Win=64256 Len=2848 TSval=2009887882 TSecr=1041014486","","","","",""
"6794","156.615235418","10.10.3.105","10.10.3.102","MPTCP","2940","36424  >  5201 [PSH, ACK] Seq=232550 Ack=1 Win=64256 Len=2848 TSval=2009887882 TSecr=1041014486","","","","",""
"6795","156.615235473","10.10.3.105","10.10.3.102","MPTCP","2940","36424  >  5201 [PSH, ACK] Seq=235398 Ack=1 Win=64256 Len=2848 TSval=2009887882 TSecr=1041014486","","","","",""
"6796","156.615271942","10.10.3.105","10.10.3.102","MPTCP","1516","36424  >  5201 [PSH, ACK] Seq=238246 Ack=1 Win=64256 Len=1424 TSval=2009887882 TSecr=1041014486","","","","",""
"6797","156.620175531","10.10.3.102","10.10.3.105","MPTCP","80","5201  >  36424 [ACK] Seq=1 Ack=138086 Win=294144 Len=0 TSval=1041014486 TSecr=2009887787","","","","",""
"6798","156.621529237","10.10.3.102","10.10.3.105","MPTCP","80","5201  >  36424 [ACK] Seq=1 Ack=68214 Win=154496 Len=0 TSval=1041014480 TSecr=2009887781","","","","",""
