"No.","Time","Source","Destination","Protocol","Length","Info","RTT","Lost Segement","Duplicate ","Retransmission","IDK"
"2253","84.529931728","10.10.3.105","10.10.3.102","MPTCP","80","56478  >  5201 [SYN] Seq=0 Win=64240 Len=0 MSS=1460 SACK_PERM=1 TSval=2010087556 TSecr=0 WS=128","","","","",""
"2254","84.529973138","10.10.3.102","10.10.3.105","MPTCP","88","5201  >  56478 [SYN, ACK] Seq=0 Ack=1 Win=65160 Len=0 MSS=1460 SACK_PERM=1 TSval=1041214256 TSecr=2010087556 WS=128","0.000041410","","","",""
"2255","84.530128697","10.10.3.105","10.10.3.102","MPTCP","88","56478  >  5201 [ACK] Seq=1 Ack=1 Win=64256 Len=0 TSval=2010087556 TSecr=1041214256","0.000155559","","","",""
"2256","84.530128884","10.10.3.105","10.10.3.102","MPTCP","129","56478  >  5201 [PSH, ACK] Seq=1 Ack=1 Win=64256 Len=37 TSval=2010087556 TSecr=1041214256","","","","",""
"2257","84.530192824","10.10.3.102","10.10.3.105","MPTCP","80","5201  >  56478 [ACK] Seq=1 Ack=38 Win=65152 Len=0 TSval=1041214256 TSecr=2010087556","0.000063940","","","",""
"2258","84.530206312","10.10.3.102","10.10.3.105","MPTCP","84","5201  >  56478 [ACK] Seq=1 Ack=38 Win=65152 Len=0 TSval=1041214256 TSecr=2010087556","","","","",""
"2259","84.530259922","10.10.3.102","10.10.3.105","MPTCP","97","5201  >  56478 [PSH, ACK] Seq=1 Ack=38 Win=65152 Len=1 TSval=1041214256 TSecr=2010087556","","","","",""
"2260","84.530278820","10.10.3.105","10.10.3.102","MPTCP","76","56478  >  5201 [ACK] Seq=38 Ack=1 Win=64256 Len=0 TSval=2010087557 TSecr=1041214256","","","","",""
"2261","84.530307310","10.10.3.105","10.10.3.102","MPTCP","80","56478  >  5201 [ACK] Seq=38 Ack=2 Win=64256 Len=0 TSval=2010087557 TSecr=1041214256","0.000047388","","","",""
"2262","84.530449436","10.10.3.105","10.10.3.102","MPTCP","100","56478  >  5201 [PSH, ACK] Seq=38 Ack=2 Win=64256 Len=4 TSval=2010087557 TSecr=1041214256","","","","",""
"2263","84.532004962","10.10.3.105","10.10.3.59","MPTCP","88","33143  >  5201 [SYN] Seq=0 Win=64256 Len=0 MSS=1460 SACK_PERM=1 TSval=939342889 TSecr=0 WS=128","","","","",""
"2264","84.532022720","10.10.3.59","10.10.3.105","MPTCP","92","5201  >  33143 [SYN, ACK] Seq=0 Ack=1 Win=65160 Len=0 MSS=1460 SACK_PERM=1 TSval=1401322636 TSecr=939342889 WS=128","0.000017758","","","",""
"2265","84.533004874","10.10.3.105","10.10.3.59","MPTCP","92","33143  >  5201 [ACK] Seq=1 Ack=1 Win=64256 Len=0 TSval=939342891 TSecr=1401322636","0.000982154","","","",""
"2266","84.533034224","10.10.3.59","10.10.3.105","MPTCP","80","[TCP Window Update] 5201  >  33143 [ACK] Seq=1 Ack=1 Win=65280 Len=0 TSval=1401322637 TSecr=939342891","","","","","â\234\223"
"2267","84.570926023","10.10.3.102","10.10.3.105","MPTCP","80","5201  >  56478 [ACK] Seq=2 Ack=42 Win=65280 Len=0 TSval=1041214297 TSecr=2010087557","0.040476587","","","",""
"2268","84.571346124","10.10.3.105","10.10.3.102","MPTCP","196","56478  >  5201 [PSH, ACK] Seq=42 Ack=2 Win=64256 Len=100 TSval=2010087598 TSecr=1041214297","","","","",""
"2269","84.571399608","10.10.3.102","10.10.3.105","MPTCP","80","5201  >  56478 [ACK] Seq=2 Ack=142 Win=65280 Len=0 TSval=1041214297 TSecr=2010087598","0.000053484","","","",""
"2270","84.571517653","10.10.3.102","10.10.3.105","MPTCP","97","5201  >  56478 [PSH, ACK] Seq=2 Ack=142 Win=65280 Len=1 TSval=1041214297 TSecr=2010087598","","","","",""
"2271","84.571765220","10.10.3.105","10.10.3.102","MPTCP","80","56490  >  5201 [SYN] Seq=0 Win=64240 Len=0 MSS=1460 SACK_PERM=1 TSval=2010087598 TSecr=0 WS=128","","","","",""
"2272","84.571808931","10.10.3.102","10.10.3.105","MPTCP","88","5201  >  56490 [SYN, ACK] Seq=0 Ack=1 Win=65160 Len=0 MSS=1460 SACK_PERM=1 TSval=1041214298 TSecr=2010087598 WS=128","0.000043711","","","",""
"2274","84.572136666","10.10.3.105","10.10.3.102","MPTCP","88","56490  >  5201 [ACK] Seq=1 Ack=1 Win=64256 Len=0 TSval=2010087598 TSecr=1041214298","0.000327735","","","",""
"2275","84.572137020","10.10.3.105","10.10.3.102","MPTCP","129","56490  >  5201 [PSH, ACK] Seq=1 Ack=1 Win=64256 Len=37 TSval=2010087598 TSecr=1041214298","","","","",""
"2276","84.572242049","10.10.3.102","10.10.3.105","MPTCP","80","5201  >  56490 [ACK] Seq=1 Ack=38 Win=65152 Len=0 TSval=1041214298 TSecr=2010087598","0.000105029","","","",""
"2277","84.572283865","10.10.3.102","10.10.3.105","MPTCP","84","5201  >  56490 [ACK] Seq=1 Ack=38 Win=65152 Len=0 TSval=1041214298 TSecr=2010087598","","","","",""
"2278","84.572421334","10.10.3.105","10.10.3.102","MPTCP","76","56490  >  5201 [ACK] Seq=38 Ack=1 Win=64256 Len=0 TSval=2010087599 TSecr=1041214298","","","","",""
"2279","84.573084094","10.10.3.105","10.10.3.59","MPTCP","88","60461  >  5201 [SYN] Seq=0 Win=64256 Len=0 MSS=1460 SACK_PERM=1 TSval=939342931 TSecr=0 WS=128","","","","",""
"2280","84.573128307","10.10.3.59","10.10.3.105","MPTCP","92","5201  >  60461 [SYN, ACK] Seq=0 Ack=1 Win=65160 Len=0 MSS=1460 SACK_PERM=1 TSval=1401322677 TSecr=939342931 WS=128","0.000044213","","","",""
"2282","84.574626500","10.10.3.105","10.10.3.59","MPTCP","92","60461  >  5201 [ACK] Seq=1 Ack=1 Win=64256 Len=0 TSval=939342932 TSecr=1401322677","0.001498193","","","",""
"2283","84.574709723","10.10.3.59","10.10.3.105","MPTCP","80","[TCP Window Update] 5201  >  60461 [ACK] Seq=1 Ack=1 Win=65280 Len=0 TSval=1401322679 TSecr=939342932","","","","","â\234\223"
"2287","84.618405846","10.10.3.105","10.10.3.102","MPTCP","80","56478  >  5201 [ACK] Seq=142 Ack=3 Win=64256 Len=0 TSval=2010087645 TSecr=1041214297","0.046888193","","","",""
"2288","84.618453352","10.10.3.102","10.10.3.105","MPTCP","98","5201  >  56478 [PSH, ACK] Seq=3 Ack=142 Win=65280 Len=2 TSval=1041214344 TSecr=2010087645","","","","",""
"2289","84.618525717","10.10.3.105","10.10.3.102","MPTCP","80","56478  >  5201 [ACK] Seq=142 Ack=5 Win=64256 Len=0 TSval=2010087645 TSecr=1041214344","0.000072365","","","",""
"2290","84.618646363","10.10.3.105","10.10.3.102","MPTCP","7212","56490  >  5201 [PSH, ACK] Seq=38 Ack=1 Win=64256 Len=7120 TSval=2010087645 TSecr=1041214298","","","","",""
"2291","84.618675246","10.10.3.102","10.10.3.105","MPTCP","80","5201  >  56490 [ACK] Seq=1 Ack=7158 Win=60672 Len=0 TSval=1041214344 TSecr=2010087645","0.000028883","","","",""
"2292","84.618722066","10.10.3.105","10.10.3.102","MPTCP","7212","56490  >  5201 [PSH, ACK] Seq=7158 Ack=1 Win=64256 Len=7120 TSval=2010087645 TSecr=1041214298","","","","",""
"2293","84.618737309","10.10.3.102","10.10.3.105","MPTCP","80","5201  >  56490 [ACK] Seq=1 Ack=14278 Win=55680 Len=0 TSval=1041214345 TSecr=2010087645","0.000015243","","","",""
"2294","84.618926086","10.10.3.105","10.10.3.102","MPTCP","10060","56490  >  5201 [PSH, ACK] Seq=14278 Ack=1 Win=64256 Len=9968 TSval=2010087645 TSecr=1041214344","","","","",""
"2295","84.618959036","10.10.3.102","10.10.3.105","MPTCP","80","5201  >  56490 [ACK] Seq=1 Ack=24246 Win=58752 Len=0 TSval=1041214345 TSecr=2010087645","0.000032950","","","",""
"2296","84.619003726","10.10.3.105","10.10.3.102","MPTCP","7212","56490  >  5201 [PSH, ACK] Seq=24246 Ack=1 Win=64256 Len=7120 TSval=2010087645 TSecr=1041214345","","","","",""
"2297","84.619016314","10.10.3.102","10.10.3.105","MPTCP","80","5201  >  56490 [ACK] Seq=1 Ack=31366 Win=53760 Len=0 TSval=1041214345 TSecr=2010087645","0.000012588","","","",""
"2298","84.619087884","10.10.3.105","10.10.3.102","MPTCP","11484","56490  >  5201 [PSH, ACK] Seq=31366 Ack=1 Win=64256 Len=11392 TSval=2010087645 TSecr=1041214345","","","","",""
"2299","84.619102247","10.10.3.102","10.10.3.105","MPTCP","80","5201  >  56490 [ACK] Seq=1 Ack=42758 Win=86912 Len=0 TSval=1041214345 TSecr=2010087645","0.000014363","","","",""
"2300","84.619272978","10.10.3.105","10.10.3.102","MPTCP","18604","56490  >  5201 [PSH, ACK] Seq=42758 Ack=1 Win=64256 Len=18512 TSval=2010087645 TSecr=1041214345","","","","",""
"2301","84.619288402","10.10.3.102","10.10.3.105","MPTCP","80","5201  >  56490 [ACK] Seq=1 Ack=61270 Win=123904 Len=0 TSval=1041214345 TSecr=2010087645","0.000015424","","","",""
"2302","84.619325433","10.10.3.105","10.10.3.102","MPTCP","1516","56490  >  5201 [ACK] Seq=61270 Ack=1 Win=64256 Len=1424 TSval=2010087645 TSecr=1041214345","","","","",""
"2303","84.619337037","10.10.3.102","10.10.3.105","MPTCP","80","5201  >  56490 [ACK] Seq=1 Ack=62694 Win=126848 Len=0 TSval=1041214345 TSecr=2010087645","0.000011604","","","",""
"2304","84.619389461","10.10.3.105","10.10.3.102","MPTCP","2716","56490  >  5201 [PSH, ACK] Seq=62694 Ack=1 Win=64256 Len=2624 TSval=2010087645 TSecr=1041214345","","","","",""
"2305","84.619404420","10.10.3.102","10.10.3.105","MPTCP","80","5201  >  56490 [ACK] Seq=1 Ack=65318 Win=132096 Len=0 TSval=1041214345 TSecr=2010087645","0.000014959","","","",""
"2306","84.619631599","10.10.3.105","10.10.3.102","MPTCP","28572","56490  >  5201 [PSH, ACK] Seq=65318 Ack=1 Win=64256 Len=28480 TSval=2010087645 TSecr=1041214345","","","","",""
"2307","84.619649218","10.10.3.102","10.10.3.105","MPTCP","80","5201  >  56490 [ACK] Seq=1 Ack=93798 Win=189056 Len=0 TSval=1041214345 TSecr=2010087645","0.000017619","","","",""
"2308","84.619686724","10.10.3.105","10.10.3.102","MPTCP","5788","56490  >  5201 [PSH, ACK] Seq=93798 Ack=1 Win=64256 Len=5696 TSval=2010087645 TSecr=1041214345","","","","",""
"2309","84.619697743","10.10.3.102","10.10.3.105","MPTCP","80","5201  >  56490 [ACK] Seq=1 Ack=99494 Win=200448 Len=0 TSval=1041214346 TSecr=2010087645","0.000011019","","","",""
"2310","84.619760042","10.10.3.105","10.10.3.102","MPTCP","8636","56490  >  5201 [PSH, ACK] Seq=99494 Ack=1 Win=64256 Len=8544 TSval=2010087646 TSecr=1041214345","","","","",""
"2311","84.619771421","10.10.3.102","10.10.3.105","MPTCP","80","5201  >  56490 [ACK] Seq=1 Ack=108038 Win=217472 Len=0 TSval=1041214346 TSecr=2010087646","0.000011379","","","",""
"2312","84.619775070","10.10.3.105","10.10.3.59","MPTCP","1516","60461  >  5201 [ACK] Seq=1 Ack=1 Win=64256 Len=1424 TSval=939342977 TSecr=1401322679","","","","",""
"2313","84.619808026","10.10.3.59","10.10.3.105","MPTCP","80","5201  >  60461 [ACK] Seq=1 Ack=1425 Win=215936 Len=0 TSval=1401322724 TSecr=939342977","0.000032956","","","",""
"2314","84.620006701","10.10.3.105","10.10.3.102","MPTCP","28572","56490  >  5201 [PSH, ACK] Seq=108038 Ack=1 Win=64256 Len=28480 TSval=2010087646 TSecr=1041214345","","","","",""
"2315","84.620023872","10.10.3.102","10.10.3.105","MPTCP","80","5201  >  56490 [ACK] Seq=1 Ack=136518 Win=242176 Len=0 TSval=1041214346 TSecr=2010087646","0.000017171","","","",""
"2316","84.620260185","10.10.3.105","10.10.3.102","MPTCP","31068","56490  >  5201 [PSH, ACK] Seq=136518 Ack=1 Win=64256 Len=30976 TSval=2010087646 TSecr=1041214345","","","","",""
"2317","84.620278263","10.10.3.102","10.10.3.105","MPTCP","80","5201  >  56490 [ACK] Seq=1 Ack=167494 Win=242176 Len=0 TSval=1041214346 TSecr=2010087646","0.000018078","","","",""
"2318","84.620560728","10.10.3.105","10.10.3.59","MPTCP","1180","60461  >  5201 [PSH, ACK] Seq=1425 Ack=1 Win=64256 Len=1088 TSval=939342977 TSecr=1401322679","","","","",""
"2319","84.620590560","10.10.3.59","10.10.3.105","MPTCP","80","5201  >  60461 [ACK] Seq=1 Ack=2513 Win=241024 Len=0 TSval=1401322724 TSecr=939342977","0.000029832","","","",""
"2320","84.620622011","10.10.3.105","10.10.3.102","MPTCP","41388","56490  >  5201 [PSH, ACK] Seq=167494 Ack=1 Win=64256 Len=41296 TSval=2010087646 TSecr=1041214346","","","","",""
"2321","84.620643358","10.10.3.102","10.10.3.105","MPTCP","80","5201  >  56490 [ACK] Seq=1 Ack=208790 Win=241024 Len=0 TSval=1041214346 TSecr=2010087646","0.000021347","","","",""
"2322","84.620816662","10.10.3.105","10.10.3.102","MPTCP","21452","56490  >  5201 [PSH, ACK] Seq=208790 Ack=1 Win=64256 Len=21360 TSval=2010087647 TSecr=1041214346","","","","",""
"2323","84.620831792","10.10.3.102","10.10.3.105","MPTCP","80","5201  >  56490 [ACK] Seq=1 Ack=230150 Win=241024 Len=0 TSval=1041214347 TSecr=2010087647","0.000015130","","","",""
"2324","84.621202736","10.10.3.105","10.10.3.102","MPTCP","42812","56490  >  5201 [PSH, ACK] Seq=230150 Ack=1 Win=64256 Len=42720 TSval=2010087647 TSecr=1041214346","","","","",""
"2325","84.621238085","10.10.3.102","10.10.3.105","MPTCP","80","5201  >  56490 [ACK] Seq=1 Ack=272870 Win=241024 Len=0 TSval=1041214347 TSecr=2010087647","0.000035349","","","",""
"2326","84.621365895","10.10.3.105","10.10.3.102","MPTCP","18460","56490  >  5201 [PSH, ACK] Seq=272870 Ack=1 Win=64256 Len=18368 TSval=2010087647 TSecr=1041214347","","","","",""
"2327","84.621384386","10.10.3.102","10.10.3.105","MPTCP","80","5201  >  56490 [ACK] Seq=1 Ack=291238 Win=241024 Len=0 TSval=1041214347 TSecr=2010087647","0.000018491","","","",""
"2328","84.628642826","10.10.3.105","10.10.3.59","MPTCP","1516","60461  >  5201 [ACK] Seq=2513 Ack=1 Win=64256 Len=1424 TSval=939342977 TSecr=1401322679","","","","",""
"2329","84.628674049","10.10.3.59","10.10.3.105","MPTCP","80","5201  >  60461 [ACK] Seq=1 Ack=3937 Win=239744 Len=0 TSval=1401322732 TSecr=939342977","0.000031223","","","",""
"2330","84.630701119","10.10.3.105","10.10.3.102","MPTCP","30484","56490  >  5201 [PSH, ACK] Seq=291238 Ack=1 Win=64256 Len=30392 TSval=2010087657 TSecr=1041214347","","","","",""
"2331","84.630735828","10.10.3.102","10.10.3.105","MPTCP","80","5201  >  56490 [ACK] Seq=1 Ack=321630 Win=210816 Len=0 TSval=1041214357 TSecr=2010087657","0.000034709","","","",""
"2332","84.631224313","10.10.3.105","10.10.3.102","MPTCP","42812","56490  >  5201 [PSH, ACK] Seq=321630 Ack=1 Win=64256 Len=42720 TSval=2010087657 TSecr=1041214357","","","","",""
"2333","84.631253007","10.10.3.102","10.10.3.105","MPTCP","80","5201  >  56490 [ACK] Seq=1 Ack=364350 Win=261888 Len=0 TSval=1041214357 TSecr=2010087657","0.000028694","","","",""
"2334","84.631382226","10.10.3.105","10.10.3.102","MPTCP","20028","56490  >  5201 [PSH, ACK] Seq=364350 Ack=1 Win=64256 Len=19936 TSval=2010087657 TSecr=1041214357","","","","",""
"2335","84.631398254","10.10.3.102","10.10.3.105","MPTCP","80","5201  >  56490 [ACK] Seq=1 Ack=384286 Win=277376 Len=0 TSval=1041214357 TSecr=2010087657","0.000016028","","","",""
"2336","84.631601770","10.10.3.105","10.10.3.102","MPTCP","24300","56490  >  5201 [PSH, ACK] Seq=384286 Ack=1 Win=64256 Len=24208 TSval=2010087657 TSecr=1041214357","","","","",""
"2337","84.631618374","10.10.3.102","10.10.3.105","MPTCP","80","5201  >  56490 [ACK] Seq=1 Ack=408494 Win=274560 Len=0 TSval=1041214357 TSecr=2010087657","0.000016604","","","",""
"2338","84.631933426","10.10.3.105","10.10.3.102","MPTCP","38540","56490  >  5201 [PSH, ACK] Seq=408494 Ack=1 Win=64256 Len=38448 TSval=2010087658 TSecr=1041214357","","","","",""
"2339","84.631954211","10.10.3.102","10.10.3.105","MPTCP","80","5201  >  56490 [ACK] Seq=1 Ack=446942 Win=264832 Len=0 TSval=1041214358 TSecr=2010087658","0.000020785","","","",""
"2340","84.632327032","10.10.3.105","10.10.3.102","MPTCP","45660","56490  >  5201 [PSH, ACK] Seq=446942 Ack=1 Win=64256 Len=45568 TSval=2010087658 TSecr=1041214357","","","","",""
"2341","84.632359008","10.10.3.102","10.10.3.105","MPTCP","80","5201  >  56490 [ACK] Seq=1 Ack=492510 Win=259968 Len=0 TSval=1041214358 TSecr=2010087658","0.000031976","","","",""
"2342","84.632460808","10.10.3.105","10.10.3.102","MPTCP","17180","56490  >  5201 [PSH, ACK] Seq=492510 Ack=1 Win=64256 Len=17088 TSval=2010087658 TSecr=1041214358","","","","",""
"2343","84.632482662","10.10.3.102","10.10.3.105","MPTCP","80","5201  >  56490 [ACK] Seq=1 Ack=509598 Win=279296 Len=0 TSval=1041214358 TSecr=2010087658","0.000021854","","","",""
"2344","84.632741129","10.10.3.105","10.10.3.102","MPTCP","31420","56490  >  5201 [PSH, ACK] Seq=509598 Ack=1 Win=64256 Len=31328 TSval=2010087658 TSecr=1041214358","","","","",""
"2345","84.632766138","10.10.3.102","10.10.3.105","MPTCP","80","5201  >  56490 [ACK] Seq=1 Ack=540926 Win=269568 Len=0 TSval=1041214359 TSecr=2010087658","0.000025009","","","",""
"2346","84.633005507","10.10.3.105","10.10.3.102","MPTCP","31420","56490  >  5201 [PSH, ACK] Seq=540926 Ack=1 Win=64256 Len=31328 TSval=2010087659 TSecr=1041214358","","","","",""
"2347","84.633028978","10.10.3.102","10.10.3.105","MPTCP","80","5201  >  56490 [ACK] Seq=1 Ack=572254 Win=269568 Len=0 TSval=1041214359 TSecr=2010087659","0.000023471","","","",""
"2348","84.633261473","10.10.3.105","10.10.3.102","MPTCP","29692","56490  >  5201 [PSH, ACK] Seq=572254 Ack=1 Win=64256 Len=29600 TSval=2010087659 TSecr=1041214358","","","","",""
"2349","84.633285646","10.10.3.102","10.10.3.105","MPTCP","80","5201  >  56490 [ACK] Seq=1 Ack=601854 Win=270720 Len=0 TSval=1041214359 TSecr=2010087659","0.000024173","","","",""
"2350","84.633592113","10.10.3.105","10.10.3.102","MPTCP","37116","56490  >  5201 [PSH, ACK] Seq=601854 Ack=1 Win=64256 Len=37024 TSval=2010087659 TSecr=1041214359","","","","",""
"2351","84.633615863","10.10.3.102","10.10.3.105","MPTCP","80","5201  >  56490 [ACK] Seq=1 Ack=638878 Win=270720 Len=0 TSval=1041214359 TSecr=2010087659","0.000023750","","","",""
"2352","84.633821796","10.10.3.105","10.10.3.102","MPTCP","25724","56490  >  5201 [PSH, ACK] Seq=638878 Ack=1 Win=64256 Len=25632 TSval=2010087659 TSecr=1041214359","","","","",""
"2353","84.633844009","10.10.3.102","10.10.3.105","MPTCP","80","5201  >  56490 [ACK] Seq=1 Ack=664510 Win=270720 Len=0 TSval=1041214360 TSecr=2010087659","0.000022213","","","",""
"2354","84.634141220","10.10.3.105","10.10.3.102","MPTCP","38540","56490  >  5201 [PSH, ACK] Seq=664510 Ack=1 Win=64256 Len=38448 TSval=2010087660 TSecr=1041214359","","","","",""
"2355","84.634161976","10.10.3.102","10.10.3.105","MPTCP","80","5201  >  56490 [ACK] Seq=1 Ack=702958 Win=270720 Len=0 TSval=1041214360 TSecr=2010087660","0.000020756","","","",""
"2356","84.634341715","10.10.3.105","10.10.3.102","MPTCP","24300","56490  >  5201 [PSH, ACK] Seq=702958 Ack=1 Win=64256 Len=24208 TSval=2010087660 TSecr=1041214359","","","","",""
"2357","84.634365355","10.10.3.102","10.10.3.105","MPTCP","80","5201  >  56490 [ACK] Seq=1 Ack=727166 Win=270720 Len=0 TSval=1041214360 TSecr=2010087660","0.000023640","","","",""
"2358","84.634692920","10.10.3.105","10.10.3.102","MPTCP","39964","56490  >  5201 [ACK] Seq=727166 Ack=1 Win=64256 Len=39872 TSval=2010087660 TSecr=1041214360","","","","",""
"2359","84.634720466","10.10.3.102","10.10.3.105","MPTCP","80","5201  >  56490 [ACK] Seq=1 Ack=767038 Win=270720 Len=0 TSval=1041214361 TSecr=2010087660","0.000027546","","","",""
"2360","84.634762130","10.10.3.105","10.10.3.102","MPTCP","1516","56490  >  5201 [PSH, ACK] Seq=767038 Ack=1 Win=64256 Len=1424 TSval=2010087660 TSecr=1041214360","","","","",""
"2361","84.634774236","10.10.3.102","10.10.3.105","MPTCP","80","5201  >  56490 [ACK] Seq=1 Ack=768462 Win=270720 Len=0 TSval=1041214361 TSecr=2010087660","0.000012106","","","",""
"2362","84.634894657","10.10.3.105","10.10.3.102","MPTCP","21452","56490  >  5201 [PSH, ACK] Seq=768462 Ack=1 Win=64256 Len=21360 TSval=2010087661 TSecr=1041214360","","","","",""
"2363","84.634914223","10.10.3.102","10.10.3.105","MPTCP","80","5201  >  56490 [ACK] Seq=1 Ack=789822 Win=270720 Len=0 TSval=1041214361 TSecr=2010087661","0.000019566","","","",""
"2364","84.635280170","10.10.3.105","10.10.3.102","MPTCP","45660","56490  >  5201 [PSH, ACK] Seq=789822 Ack=1 Win=64256 Len=45568 TSval=2010087661 TSecr=1041214360","","","","",""
"2365","84.635306866","10.10.3.102","10.10.3.105","MPTCP","80","5201  >  56490 [ACK] Seq=1 Ack=835390 Win=270720 Len=0 TSval=1041214361 TSecr=2010087661","0.000026696","","","",""
"2366","84.635403920","10.10.3.105","10.10.3.102","MPTCP","12892","56490  >  5201 [PSH, ACK] Seq=835390 Ack=1 Win=64256 Len=12800 TSval=2010087661 TSecr=1041214361","","","","",""
"2367","84.635420475","10.10.3.102","10.10.3.105","MPTCP","80","5201  >  56490 [ACK] Seq=1 Ack=848190 Win=270720 Len=0 TSval=1041214361 TSecr=2010087661","0.000016555","","","",""
"2368","84.638518829","10.10.3.105","10.10.3.102","MPTCP","32820","56490  >  5201 [PSH, ACK] Seq=848190 Ack=1 Win=64256 Len=32728 TSval=2010087665 TSecr=1041214361","","","","",""
"2369","84.638548862","10.10.3.102","10.10.3.105","MPTCP","80","5201  >  56490 [ACK] Seq=1 Ack=880918 Win=238080 Len=0 TSval=1041214364 TSecr=2010087665","0.000030033","","","",""
"2370","84.639257128","10.10.3.105","10.10.3.102","MPTCP","57052","56490  >  5201 [PSH, ACK] Seq=880918 Ack=1 Win=64256 Len=56960 TSval=2010087665 TSecr=1041214364","","","","",""
"2371","84.639285308","10.10.3.102","10.10.3.105","MPTCP","80","5201  >  56490 [ACK] Seq=1 Ack=937878 Win=252160 Len=0 TSval=1041214365 TSecr=2010087665","0.000028180","","","",""
"2372","84.639323439","10.10.3.105","10.10.3.102","MPTCP","5788","56490  >  5201 [PSH, ACK] Seq=937878 Ack=1 Win=64256 Len=5696 TSval=2010087665 TSecr=1041214364","","","","",""
"2373","84.639334731","10.10.3.102","10.10.3.105","MPTCP","80","5201  >  56490 [ACK] Seq=1 Ack=943574 Win=248192 Len=0 TSval=1041214365 TSecr=2010087665","0.000011292","","","",""
"2374","84.639759889","10.10.3.105","10.10.3.102","MPTCP","51356","56490  >  5201 [PSH, ACK] Seq=943574 Ack=1 Win=64256 Len=51264 TSval=2010087665 TSecr=1041214364","","","","",""
"2375","84.639791401","10.10.3.102","10.10.3.105","MPTCP","80","5201  >  56490 [ACK] Seq=1 Ack=994838 Win=256128 Len=0 TSval=1041214366 TSecr=2010087665","0.000031512","","","",""
"2376","84.639861742","10.10.3.105","10.10.3.102","MPTCP","11484","56490  >  5201 [PSH, ACK] Seq=994838 Ack=1 Win=64256 Len=11392 TSval=2010087666 TSecr=1041214365","","","","",""
"2377","84.639877946","10.10.3.102","10.10.3.105","MPTCP","80","5201  >  56490 [ACK] Seq=1 Ack=1006230 Win=283136 Len=0 TSval=1041214366 TSecr=2010087666","0.000016204","","","",""
"2378","84.640226099","10.10.3.105","10.10.3.59","MPTCP","796","60461  >  5201 [PSH, ACK] Seq=3937 Ack=1 Win=64256 Len=704 TSval=939342977 TSecr=1401322679","","","","",""
"2379","84.640253434","10.10.3.59","10.10.3.105","MPTCP","80","5201  >  60461 [ACK] Seq=1 Ack=4641 Win=283136 Len=0 TSval=1401322744 TSecr=939342977","0.000027335","","","",""
"2380","84.640274485","10.10.3.105","10.10.3.102","MPTCP","48508","56490  >  5201 [PSH, ACK] Seq=1006230 Ack=1 Win=64256 Len=48416 TSval=2010087666 TSecr=1041214365","","","","",""
"2381","84.640303891","10.10.3.102","10.10.3.105","MPTCP","80","5201  >  56490 [ACK] Seq=1 Ack=1054646 Win=258048 Len=0 TSval=1041214366 TSecr=2010087666","0.000029406","","","",""
"2382","84.640398393","10.10.3.105","10.10.3.102","MPTCP","14332","56490  >  5201 [PSH, ACK] Seq=1054646 Ack=1 Win=64256 Len=14240 TSval=2010087666 TSecr=1041214366","","","","",""
"2383","84.640414795","10.10.3.102","10.10.3.105","MPTCP","80","5201  >  56490 [ACK] Seq=1 Ack=1068886 Win=281216 Len=0 TSval=1041214366 TSecr=2010087666","0.000016402","","","",""
"2384","84.640786072","10.10.3.105","10.10.3.102","MPTCP","45660","56490  >  5201 [PSH, ACK] Seq=1068886 Ack=1 Win=64256 Len=45568 TSval=2010087666 TSecr=1041214366","","","","",""
"2385","84.640813401","10.10.3.102","10.10.3.105","MPTCP","80","5201  >  56490 [ACK] Seq=1 Ack=1114454 Win=259968 Len=0 TSval=1041214367 TSecr=2010087666","0.000027329","","","",""
"2386","84.640941068","10.10.3.105","10.10.3.102","MPTCP","17180","56490  >  5201 [PSH, ACK] Seq=1114454 Ack=1 Win=64256 Len=17088 TSval=2010087667 TSecr=1041214366","","","","",""
"2387","84.640959701","10.10.3.102","10.10.3.105","MPTCP","80","5201  >  56490 [ACK] Seq=1 Ack=1131542 Win=279296 Len=0 TSval=1041214367 TSecr=2010087667","0.000018633","","","",""
"2388","84.641336474","10.10.3.105","10.10.3.102","MPTCP","45660","56490  >  5201 [PSH, ACK] Seq=1131542 Ack=1 Win=64256 Len=45568 TSval=2010087667 TSecr=1041214366","","","","",""
"2389","84.641364528","10.10.3.102","10.10.3.105","MPTCP","80","5201  >  56490 [ACK] Seq=1 Ack=1177110 Win=259968 Len=0 TSval=1041214367 TSecr=2010087667","0.000028054","","","",""
"2390","84.641486249","10.10.3.105","10.10.3.102","MPTCP","17180","56490  >  5201 [PSH, ACK] Seq=1177110 Ack=1 Win=64256 Len=17088 TSval=2010087667 TSecr=1041214367","","","","",""
"2391","84.641500814","10.10.3.102","10.10.3.105","MPTCP","80","5201  >  56490 [ACK] Seq=1 Ack=1194198 Win=279296 Len=0 TSval=1041214367 TSecr=2010087667","0.000014565","","","",""
"2392","84.641874239","10.10.3.105","10.10.3.102","MPTCP","45660","56490  >  5201 [PSH, ACK] Seq=1194198 Ack=1 Win=64256 Len=45568 TSval=2010087667 TSecr=1041214367","","","","",""
"2393","84.641903649","10.10.3.102","10.10.3.105","MPTCP","80","5201  >  56490 [ACK] Seq=1 Ack=1239766 Win=259968 Len=0 TSval=1041214368 TSecr=2010087667","0.000029410","","","",""
"2394","84.642049251","10.10.3.105","10.10.3.102","MPTCP","17180","56490  >  5201 [PSH, ACK] Seq=1239766 Ack=1 Win=64256 Len=17088 TSval=2010087667 TSecr=1041214367","","","","",""
"2395","84.642069269","10.10.3.102","10.10.3.105","MPTCP","80","5201  >  56490 [ACK] Seq=1 Ack=1256854 Win=279296 Len=0 TSval=1041214368 TSecr=2010087667","0.000020018","","","",""
"2396","84.642464896","10.10.3.105","10.10.3.102","MPTCP","48508","56490  >  5201 [PSH, ACK] Seq=1256854 Ack=1 Win=64256 Len=48416 TSval=2010087668 TSecr=1041214367","","","","",""
"2397","84.642493250","10.10.3.102","10.10.3.105","MPTCP","80","5201  >  56490 [ACK] Seq=1 Ack=1305270 Win=258048 Len=0 TSval=1041214368 TSecr=2010087668","0.000028354","","","",""
"2398","84.642584398","10.10.3.105","10.10.3.102","MPTCP","14332","56490  >  5201 [PSH, ACK] Seq=1305270 Ack=1 Win=64256 Len=14240 TSval=2010087668 TSecr=1041214367","","","","",""
"2399","84.642600758","10.10.3.102","10.10.3.105","MPTCP","80","5201  >  56490 [ACK] Seq=1 Ack=1319510 Win=281216 Len=0 TSval=1041214368 TSecr=2010087668","0.000016360","","","",""
"2400","84.642683272","10.10.3.105","10.10.3.102","MPTCP","11484","56490  >  5201 [ACK] Seq=1319510 Ack=1 Win=64256 Len=11392 TSval=2010087668 TSecr=1041214368","","","","",""
"2401","84.642700107","10.10.3.102","10.10.3.105","MPTCP","80","5201  >  56490 [ACK] Seq=1 Ack=1330902 Win=283136 Len=0 TSval=1041214369 TSecr=2010087668","0.000016835","","","",""
"2402","84.643022346","10.10.3.105","10.10.3.102","MPTCP","39964","56490  >  5201 [PSH, ACK] Seq=1330902 Ack=1 Win=64256 Len=39872 TSval=2010087668 TSecr=1041214368","","","","",""
"2403","84.643050023","10.10.3.102","10.10.3.105","MPTCP","80","5201  >  56490 [ACK] Seq=1 Ack=1370774 Win=263808 Len=0 TSval=1041214369 TSecr=2010087668","0.000027677","","","",""
"2404","84.643138233","10.10.3.105","10.10.3.102","MPTCP","11484","56490  >  5201 [PSH, ACK] Seq=1370774 Ack=1 Win=64256 Len=11392 TSval=2010087668 TSecr=1041214368","","","","",""
"2405","84.643154766","10.10.3.102","10.10.3.105","MPTCP","80","5201  >  56490 [ACK] Seq=1 Ack=1382166 Win=283136 Len=0 TSval=1041214369 TSecr=2010087668","0.000016533","","","",""
"2406","84.643640205","10.10.3.105","10.10.3.102","MPTCP","58476","56490  >  5201 [PSH, ACK] Seq=1382166 Ack=1 Win=64256 Len=58384 TSval=2010087669 TSecr=1041214368","","","","",""
"2407","84.643672423","10.10.3.102","10.10.3.105","MPTCP","80","5201  >  56490 [ACK] Seq=1 Ack=1440550 Win=251264 Len=0 TSval=1041214369 TSecr=2010087669","0.000032218","","","",""
"2408","84.643690642","10.10.3.105","10.10.3.102","MPTCP","4364","56490  >  5201 [PSH, ACK] Seq=1440550 Ack=1 Win=64256 Len=4272 TSval=2010087669 TSecr=1041214368","","","","",""
"2409","84.643700976","10.10.3.102","10.10.3.105","MPTCP","80","5201  >  56490 [ACK] Seq=1 Ack=1444822 Win=248192 Len=0 TSval=1041214370 TSecr=2010087669","0.000010334","","","",""
"2410","84.644209668","10.10.3.105","10.10.3.102","MPTCP","62748","56490  >  5201 [PSH, ACK] Seq=1444822 Ack=1 Win=64256 Len=62656 TSval=2010087669 TSecr=1041214369","","","","",""
"2411","84.644245378","10.10.3.102","10.10.3.105","MPTCP","80","5201  >  56490 [ACK] Seq=1 Ack=1507478 Win=248320 Len=0 TSval=1041214370 TSecr=2010087669","0.000035710","","","",""
"2412","84.644757421","10.10.3.105","10.10.3.102","MPTCP","62748","56490  >  5201 [PSH, ACK] Seq=1507478 Ack=1 Win=64256 Len=62656 TSval=2010087670 TSecr=1041214369","","","","",""
"2413","84.644791639","10.10.3.102","10.10.3.105","MPTCP","80","5201  >  56490 [ACK] Seq=1 Ack=1570134 Win=248320 Len=0 TSval=1041214371 TSecr=2010087670","0.000034218","","","",""
"2414","84.645301695","10.10.3.105","10.10.3.102","MPTCP","62748","56490  >  5201 [PSH, ACK] Seq=1570134 Ack=1 Win=64256 Len=62656 TSval=2010087671 TSecr=1041214370","","","","",""
"2415","84.645334034","10.10.3.102","10.10.3.105","MPTCP","80","5201  >  56490 [ACK] Seq=1 Ack=1632790 Win=248320 Len=0 TSval=1041214371 TSecr=2010087671","0.000032339","","","",""
"2416","84.645825964","10.10.3.105","10.10.3.102","MPTCP","62748","56490  >  5201 [PSH, ACK] Seq=1632790 Ack=1 Win=64256 Len=62656 TSval=2010087671 TSecr=1041214371","","","","",""
"2417","84.645859111","10.10.3.102","10.10.3.105","MPTCP","80","5201  >  56490 [ACK] Seq=1 Ack=1695446 Win=248320 Len=0 TSval=1041214372 TSecr=2010087671","0.000033147","","","",""
"2418","84.646379579","10.10.3.105","10.10.3.102","MPTCP","62748","56490  >  5201 [PSH, ACK] Seq=1695446 Ack=1 Win=64256 Len=62656 TSval=2010087672 TSecr=1041214371","","","","",""
"2419","84.646413442","10.10.3.102","10.10.3.105","MPTCP","80","5201  >  56490 [ACK] Seq=1 Ack=1758102 Win=248320 Len=0 TSval=1041214372 TSecr=2010087672","0.000033863","","","",""
"2420","84.646684905","10.10.3.105","10.10.3.102","MPTCP","37116","56490  >  5201 [ACK] Seq=1758102 Ack=1 Win=64256 Len=37024 TSval=2010087672 TSecr=1041214372","","","","",""
"2421","84.646710707","10.10.3.102","10.10.3.105","MPTCP","80","5201  >  56490 [ACK] Seq=1 Ack=1795126 Win=265728 Len=0 TSval=1041214373 TSecr=2010087672","0.000025802","","","",""
"2422","84.646918642","10.10.3.105","10.10.3.102","MPTCP","25724","56490  >  5201 [PSH, ACK] Seq=1795126 Ack=1 Win=64256 Len=25632 TSval=2010087672 TSecr=1041214372","","","","",""
"2423","84.646941811","10.10.3.102","10.10.3.105","MPTCP","80","5201  >  56490 [ACK] Seq=1 Ack=1820758 Win=273536 Len=0 TSval=1041214373 TSecr=2010087672","0.000023169","","","",""
"2424","84.647128807","10.10.3.105","10.10.3.59","MPTCP","1516","60461  >  5201 [ACK] Seq=4641 Ack=1 Win=64256 Len=1424 TSval=939342977 TSecr=1401322679","","","","",""
"2425","84.647156088","10.10.3.59","10.10.3.105","MPTCP","80","5201  >  60461 [ACK] Seq=1 Ack=6065 Win=281728 Len=0 TSval=1401322751 TSecr=939342977","0.000027281","","","",""
"2426","84.647455115","10.10.3.105","10.10.3.102","MPTCP","62748","56490  >  5201 [PSH, ACK] Seq=1820758 Ack=1 Win=64256 Len=62656 TSval=2010087673 TSecr=1041214372","","","","",""
"2427","84.647488713","10.10.3.102","10.10.3.105","MPTCP","80","5201  >  56490 [ACK] Seq=1 Ack=1883414 Win=248320 Len=0 TSval=1041214373 TSecr=2010087673","0.000033598","","","",""
"2428","84.648004211","10.10.3.105","10.10.3.102","MPTCP","62748","56490  >  5201 [PSH, ACK] Seq=1883414 Ack=1 Win=64256 Len=62656 TSval=2010087673 TSecr=1041214373","","","","",""
"2429","84.648037096","10.10.3.102","10.10.3.105","MPTCP","80","5201  >  56490 [ACK] Seq=1 Ack=1946070 Win=248320 Len=0 TSval=1041214374 TSecr=2010087673","0.000032885","","","",""
"2430","84.648531250","10.10.3.105","10.10.3.102","MPTCP","62748","56490  >  5201 [PSH, ACK] Seq=1946070 Ack=1 Win=64256 Len=62656 TSval=2010087674 TSecr=1041214373","","","","",""
"2431","84.648565480","10.10.3.102","10.10.3.105","MPTCP","80","5201  >  56490 [ACK] Seq=1 Ack=2008726 Win=248320 Len=0 TSval=1041214374 TSecr=2010087674","0.000034230","","","",""
"2432","84.649183895","10.10.3.105","10.10.3.102","MPTCP","62748","56490  >  5201 [PSH, ACK] Seq=2008726 Ack=1 Win=64256 Len=62656 TSval=2010087674 TSecr=1041214374","","","","",""
"2433","84.649219305","10.10.3.102","10.10.3.105","MPTCP","80","5201  >  56490 [ACK] Seq=1 Ack=2071382 Win=248320 Len=0 TSval=1041214375 TSecr=2010087674","0.000035410","","","",""
"2434","84.649656495","10.10.3.105","10.10.3.102","MPTCP","62748","56490  >  5201 [PSH, ACK] Seq=2071382 Ack=1 Win=64256 Len=62656 TSval=2010087675 TSecr=1041214374","","","","",""
"2435","84.649689738","10.10.3.102","10.10.3.105","MPTCP","80","5201  >  56490 [ACK] Seq=1 Ack=2134038 Win=248320 Len=0 TSval=1041214376 TSecr=2010087675","0.000033243","","","",""
"2436","84.650039495","10.10.3.105","10.10.3.102","MPTCP","44236","56490  >  5201 [PSH, ACK] Seq=2134038 Ack=1 Win=64256 Len=44144 TSval=2010087675 TSecr=1041214374","","","","",""
"2437","84.650068327","10.10.3.102","10.10.3.105","MPTCP","80","5201  >  56490 [ACK] Seq=1 Ack=2178182 Win=260992 Len=0 TSval=1041214376 TSecr=2010087675","0.000028832","","","",""
"2438","84.650196453","10.10.3.105","10.10.3.102","MPTCP","18604","56490  >  5201 [PSH, ACK] Seq=2178182 Ack=1 Win=64256 Len=18512 TSval=2010087676 TSecr=1041214375","","","","",""
"2439","84.650211986","10.10.3.102","10.10.3.105","MPTCP","80","5201  >  56490 [ACK] Seq=1 Ack=2196694 Win=278400 Len=0 TSval=1041214376 TSecr=2010087676","0.000015533","","","",""
"2440","84.650678464","10.10.3.105","10.10.3.102","MPTCP","57052","56490  >  5201 [ACK] Seq=2196694 Ack=1 Win=64256 Len=56960 TSval=2010087676 TSecr=1041214376","","","","",""
"2441","84.650714948","10.10.3.102","10.10.3.105","MPTCP","80","5201  >  56490 [ACK] Seq=1 Ack=2253654 Win=252160 Len=0 TSval=1041214377 TSecr=2010087676","0.000036484","","","",""
"2442","84.650753369","10.10.3.105","10.10.3.102","MPTCP","5788","56490  >  5201 [PSH, ACK] Seq=2253654 Ack=1 Win=64256 Len=5696 TSval=2010087676 TSecr=1041214376","","","","",""
"2443","84.650765943","10.10.3.102","10.10.3.105","MPTCP","80","5201  >  56490 [ACK] Seq=1 Ack=2259350 Win=248192 Len=0 TSval=1041214377 TSecr=2010087676","0.000012574","","","",""
"2444","84.651281271","10.10.3.105","10.10.3.102","MPTCP","62748","56490  >  5201 [PSH, ACK] Seq=2259350 Ack=1 Win=64256 Len=62656 TSval=2010087676 TSecr=1041214376","","","","",""
"2445","84.651311935","10.10.3.102","10.10.3.105","MPTCP","80","5201  >  56490 [ACK] Seq=1 Ack=2322006 Win=248320 Len=0 TSval=1041214377 TSecr=2010087676","0.000030664","","","",""
"2446","84.651744172","10.10.3.105","10.10.3.102","MPTCP","54204","56490  >  5201 [PSH, ACK] Seq=2322006 Ack=1 Win=64256 Len=54112 TSval=2010087677 TSecr=1041214376","","","","",""
"2447","84.651768919","10.10.3.102","10.10.3.105","MPTCP","80","5201  >  56490 [ACK] Seq=1 Ack=2376118 Win=254080 Len=0 TSval=1041214378 TSecr=2010087677","0.000024747","","","",""
"2448","84.651807921","10.10.3.105","10.10.3.102","MPTCP","8636","56490  >  5201 [PSH, ACK] Seq=2376118 Ack=1 Win=64256 Len=8544 TSval=2010087677 TSecr=1041214377","","","","",""
"2449","84.651819565","10.10.3.102","10.10.3.105","MPTCP","80","5201  >  56490 [ACK] Seq=1 Ack=2384662 Win=248192 Len=0 TSval=1041214378 TSecr=2010087677","0.000011644","","","",""
"2450","84.652356395","10.10.3.105","10.10.3.102","MPTCP","62748","56490  >  5201 [PSH, ACK] Seq=2384662 Ack=1 Win=64256 Len=62656 TSval=2010087678 TSecr=1041214377","","","","",""
"2451","84.652383307","10.10.3.102","10.10.3.105","MPTCP","80","5201  >  56490 [ACK] Seq=1 Ack=2447318 Win=248320 Len=0 TSval=1041214378 TSecr=2010087678","0.000026912","","","",""
"2452","84.652899890","10.10.3.105","10.10.3.102","MPTCP","62748","56490  >  5201 [PSH, ACK] Seq=2447318 Ack=1 Win=64256 Len=62656 TSval=2010087678 TSecr=1041214378","","","","",""
"2453","84.652928312","10.10.3.102","10.10.3.105","MPTCP","80","5201  >  56490 [ACK] Seq=1 Ack=2509974 Win=248320 Len=0 TSval=1041214379 TSecr=2010087678","0.000028422","","","",""
"2454","84.653440402","10.10.3.105","10.10.3.102","MPTCP","62748","56490  >  5201 [PSH, ACK] Seq=2509974 Ack=1 Win=64256 Len=62656 TSval=2010087679 TSecr=1041214378","","","","",""
"2455","84.653466955","10.10.3.102","10.10.3.105","MPTCP","80","5201  >  56490 [ACK] Seq=1 Ack=2572630 Win=248320 Len=0 TSval=1041214379 TSecr=2010087679","0.000026553","","","",""
"2456","84.653982594","10.10.3.105","10.10.3.102","MPTCP","62748","56490  >  5201 [PSH, ACK] Seq=2572630 Ack=1 Win=64256 Len=62656 TSval=2010087679 TSecr=1041214378","","","","",""
"2457","84.654009350","10.10.3.102","10.10.3.105","MPTCP","80","5201  >  56490 [ACK] Seq=1 Ack=2635286 Win=248320 Len=0 TSval=1041214380 TSecr=2010087679","0.000026756","","","",""
"2458","84.654522042","10.10.3.105","10.10.3.102","MPTCP","62748","56490  >  5201 [PSH, ACK] Seq=2635286 Ack=1 Win=64256 Len=62656 TSval=2010087679 TSecr=1041214379","","","","",""
"2459","84.654548443","10.10.3.102","10.10.3.105","MPTCP","80","5201  >  56490 [ACK] Seq=1 Ack=2697942 Win=248320 Len=0 TSval=1041214380 TSecr=2010087679","0.000026401","","","",""
"2460","84.654678671","10.10.3.105","10.10.3.102","MPTCP","18604","56490  >  5201 [ACK] Seq=2697942 Ack=1 Win=64256 Len=18512 TSval=2010087680 TSecr=1041214379","","","","",""
"2461","84.654699464","10.10.3.102","10.10.3.105","MPTCP","80","5201  >  56490 [ACK] Seq=1 Ack=2716454 Win=278400 Len=0 TSval=1041214381 TSecr=2010087680","0.000020793","","","",""
"2462","84.655070723","10.10.3.105","10.10.3.102","MPTCP","44236","56490  >  5201 [PSH, ACK] Seq=2716454 Ack=1 Win=64256 Len=44144 TSval=2010087680 TSecr=1041214379","","","","",""
"2463","84.655092485","10.10.3.102","10.10.3.105","MPTCP","80","5201  >  56490 [ACK] Seq=1 Ack=2760598 Win=260992 Len=0 TSval=1041214381 TSecr=2010087680","0.000021762","","","",""
"2464","84.655610313","10.10.3.105","10.10.3.102","MPTCP","62748","56490  >  5201 [PSH, ACK] Seq=2760598 Ack=1 Win=64256 Len=62656 TSval=2010087680 TSecr=1041214380","","","","",""
"2465","84.655637495","10.10.3.102","10.10.3.105","MPTCP","80","5201  >  56490 [ACK] Seq=1 Ack=2823254 Win=248320 Len=0 TSval=1041214381 TSecr=2010087680","0.000027182","","","",""
"2466","84.656152696","10.10.3.105","10.10.3.102","MPTCP","62748","56490  >  5201 [PSH, ACK] Seq=2823254 Ack=1 Win=64256 Len=62656 TSval=2010087681 TSecr=1041214380","","","","",""
"2467","84.656179743","10.10.3.102","10.10.3.105","MPTCP","80","5201  >  56490 [ACK] Seq=1 Ack=2885910 Win=248320 Len=0 TSval=1041214382 TSecr=2010087681","0.000027047","","","",""
"2468","84.656694907","10.10.3.105","10.10.3.102","MPTCP","62748","56490  >  5201 [PSH, ACK] Seq=2885910 Ack=1 Win=64256 Len=62656 TSval=2010087682 TSecr=1041214381","","","","",""
"2469","84.656721913","10.10.3.102","10.10.3.105","MPTCP","80","5201  >  56490 [ACK] Seq=1 Ack=2948566 Win=248320 Len=0 TSval=1041214383 TSecr=2010087682","0.000027006","","","",""
"2470","84.657233387","10.10.3.105","10.10.3.102","MPTCP","62748","56490  >  5201 [PSH, ACK] Seq=2948566 Ack=1 Win=64256 Len=62656 TSval=2010087682 TSecr=1041214381","","","","",""
"2471","84.657262234","10.10.3.102","10.10.3.105","MPTCP","80","5201  >  56490 [ACK] Seq=1 Ack=3011222 Win=248320 Len=0 TSval=1041214383 TSecr=2010087682","0.000028847","","","",""
"2472","84.657778129","10.10.3.105","10.10.3.102","MPTCP","62748","56490  >  5201 [PSH, ACK] Seq=3011222 Ack=1 Win=64256 Len=62656 TSval=2010087683 TSecr=1041214382","","","","",""
"2473","84.657805508","10.10.3.102","10.10.3.105","MPTCP","80","5201  >  56490 [ACK] Seq=1 Ack=3073878 Win=248320 Len=0 TSval=1041214384 TSecr=2010087683","0.000027379","","","",""
"2474","84.658320947","10.10.3.105","10.10.3.102","MPTCP","62748","56490  >  5201 [PSH, ACK] Seq=3073878 Ack=1 Win=64256 Len=62656 TSval=2010087683 TSecr=1041214383","","","","",""
"2475","84.658346994","10.10.3.102","10.10.3.105","MPTCP","80","5201  >  56490 [ACK] Seq=1 Ack=3136534 Win=248320 Len=0 TSval=1041214384 TSecr=2010087683","0.000026047","","","",""
"2476","84.658429529","10.10.3.105","10.10.3.59","MPTCP","1516","60461  >  5201 [ACK] Seq=6065 Ack=1 Win=64256 Len=1424 TSval=939342977 TSecr=1401322679","","","","",""
"2477","84.658457612","10.10.3.59","10.10.3.105","MPTCP","80","5201  >  60461 [ACK] Seq=1 Ack=7489 Win=280320 Len=0 TSval=1401322762 TSecr=939342977","0.000028083","","","",""
"2478","84.658674500","10.10.3.105","10.10.3.102","MPTCP","42812","56490  >  5201 [ACK] Seq=3136534 Ack=1 Win=64256 Len=42720 TSval=2010087684 TSecr=1041214383","","","","",""
"2479","84.658697639","10.10.3.102","10.10.3.105","MPTCP","80","5201  >  56490 [ACK] Seq=1 Ack=3179254 Win=261888 Len=0 TSval=1041214385 TSecr=2010087684","0.000023139","","","",""
