"No.","Time","Source","Destination","Protocol","Length","Info","RTT","Lost Segement","Duplicate ","Retransmission","IDK"
"8","0.566264411","10.10.3.105","10.10.3.102","MPTCP","80","53740  >  5201 [SYN] Seq=0 Win=64240 Len=0 MSS=1460 SACK_PERM=1 TSval=2008315050 TSecr=0 WS=128","","","","",""
"9","0.566307738","10.10.3.102","10.10.3.105","MPTCP","88","5201  >  53740 [SYN, ACK] Seq=0 Ack=1 Win=65160 Len=0 MSS=1460 SACK_PERM=1 TSval=1039441746 TSecr=2008315050 WS=128","0.000043327","","","",""
"10","0.566466612","10.10.3.105","10.10.3.102","MPTCP","88","53740  >  5201 [ACK] Seq=1 Ack=1 Win=64256 Len=0 TSval=2008315051 TSecr=1039441746","0.000158874","","","",""
"11","0.566466797","10.10.3.105","10.10.3.102","MPTCP","129","53740  >  5201 [PSH, ACK] Seq=1 Ack=1 Win=64256 Len=37 TSval=2008315051 TSecr=1039441746","","","","",""
"12","0.566531259","10.10.3.102","10.10.3.105","MPTCP","80","5201  >  53740 [ACK] Seq=1 Ack=38 Win=65152 Len=0 TSval=1039441746 TSecr=2008315051","0.000064462","","","",""
"13","0.566591955","10.10.3.102","10.10.3.105","MPTCP","97","5201  >  53740 [PSH, ACK] Seq=1 Ack=38 Win=65152 Len=1 TSval=1039441746 TSecr=2008315051","","","","",""
"14","0.566611470","10.10.3.102","10.10.3.105","MPTCP","84","[TCP Dup ACK 12#1] 5201  >  53740 [ACK] Seq=2 Ack=38 Win=65152 Len=0 TSval=1039441746 TSecr=2008315051","","","â\234\223","","â\234\223"
"15","0.566685327","10.10.3.105","10.10.3.102","MPTCP","80","53740  >  5201 [ACK] Seq=38 Ack=2 Win=64256 Len=0 TSval=2008315051 TSecr=1039441746","0.000093372","","","",""
"16","0.566739599","10.10.3.105","10.10.3.102","MPTCP","76","[TCP Dup ACK 15#1] 53740  >  5201 [ACK] Seq=38 Ack=2 Win=64256 Len=0 TSval=2008315051 TSecr=1039441746","","","â\234\223","","â\234\223"
"17","0.566939477","10.10.3.105","10.10.3.102","MPTCP","100","53740  >  5201 [PSH, ACK] Seq=38 Ack=2 Win=64256 Len=4 TSval=2008315051 TSecr=1039441746","","","","",""
"18","0.567574043","10.10.3.62","10.10.3.102","MPTCP","88","52665  >  5201 [SYN] Seq=0 Win=64256 Len=0 MSS=1460 SACK_PERM=1 TSval=3345482256 TSecr=0 WS=128","","","","",""
"19","0.567608596","10.10.3.105","10.10.3.59","MPTCP","88","40125  >  5201 [SYN] Seq=0 Win=64256 Len=0 MSS=1460 SACK_PERM=1 TSval=937570383 TSecr=0 WS=128","","","","",""
"20","0.567613785","10.10.3.102","10.10.3.62","MPTCP","92","5201  >  52665 [SYN, ACK] Seq=0 Ack=1 Win=65160 Len=0 MSS=1460 SACK_PERM=1 TSval=2492260028 TSecr=3345482256 WS=128","0.000039742","","","",""
"21","0.567625005","10.10.3.59","10.10.3.105","MPTCP","92","5201  >  40125 [SYN, ACK] Seq=0 Ack=1 Win=65160 Len=0 MSS=1460 SACK_PERM=1 TSval=1399550125 TSecr=937570383 WS=128","0.000016409","","","",""
"23","0.572554054","10.10.3.62","10.10.3.102","MPTCP","92","52665  >  5201 [ACK] Seq=1 Ack=1 Win=64256 Len=0 TSval=3345482259 TSecr=2492260028","0.004940269","","","",""
"24","0.572567131","10.10.3.105","10.10.3.59","MPTCP","92","40125  >  5201 [ACK] Seq=1 Ack=1 Win=64256 Len=0 TSval=937570387 TSecr=1399550125","0.004942126","","","",""
"25","0.572617920","10.10.3.59","10.10.3.105","MPTCP","80","[TCP Window Update] 5201  >  40125 [ACK] Seq=1 Ack=1 Win=65280 Len=0 TSval=1399550130 TSecr=937570387","","","","","â\234\223"
"26","0.572618091","10.10.3.102","10.10.3.62","MPTCP","80","[TCP Window Update] 5201  >  52665 [ACK] Seq=1 Ack=1 Win=65280 Len=0 TSval=2492260033 TSecr=3345482259","","","","","â\234\223"
"29","0.609030826","10.10.3.102","10.10.3.105","MPTCP","80","5201  >  53740 [ACK] Seq=2 Ack=42 Win=65280 Len=0 TSval=1039441789 TSecr=2008315051","0.042091349","","","",""
"30","0.609342868","10.10.3.105","10.10.3.102","MPTCP","196","53740  >  5201 [PSH, ACK] Seq=42 Ack=2 Win=64256 Len=100 TSval=2008315093 TSecr=1039441789","","","","",""
"31","0.609393546","10.10.3.102","10.10.3.105","MPTCP","80","5201  >  53740 [ACK] Seq=2 Ack=142 Win=65280 Len=0 TSval=1039441789 TSecr=2008315093","0.000050678","","","",""
"32","0.609528240","10.10.3.102","10.10.3.105","MPTCP","97","5201  >  53740 [PSH, ACK] Seq=2 Ack=142 Win=65280 Len=1 TSval=1039441789 TSecr=2008315093","","","","",""
"33","0.609795430","10.10.3.105","10.10.3.102","MPTCP","80","53748  >  5201 [SYN] Seq=0 Win=64240 Len=0 MSS=1460 SACK_PERM=1 TSval=2008315094 TSecr=0 WS=128","","","","",""
"34","0.609839590","10.10.3.102","10.10.3.105","MPTCP","88","5201  >  53748 [SYN, ACK] Seq=0 Ack=1 Win=65160 Len=0 MSS=1460 SACK_PERM=1 TSval=1039441790 TSecr=2008315094 WS=128","0.000044160","","","",""
"36","0.610016963","10.10.3.105","10.10.3.102","MPTCP","88","53748  >  5201 [ACK] Seq=1 Ack=1 Win=64256 Len=0 TSval=2008315094 TSecr=1039441790","0.000177373","","","",""
"37","0.610127264","10.10.3.105","10.10.3.102","MPTCP","129","53748  >  5201 [PSH, ACK] Seq=1 Ack=1 Win=64256 Len=37 TSval=2008315094 TSecr=1039441790","","","","",""
"38","0.610151279","10.10.3.102","10.10.3.105","MPTCP","80","5201  >  53748 [ACK] Seq=1 Ack=38 Win=65152 Len=0 TSval=1039441790 TSecr=2008315094","0.000024015","","","",""
"39","0.610180483","10.10.3.102","10.10.3.105","MPTCP","84","5201  >  53748 [ACK] Seq=1 Ack=38 Win=65152 Len=0 TSval=1039441790 TSecr=2008315094","","","","",""
"40","0.610296770","10.10.3.105","10.10.3.102","MPTCP","76","53748  >  5201 [ACK] Seq=38 Ack=1 Win=64256 Len=0 TSval=2008315094 TSecr=1039441790","","","","",""
"41","0.610927285","10.10.3.62","10.10.3.102","MPTCP","88","57691  >  5201 [SYN] Seq=0 Win=64256 Len=0 MSS=1460 SACK_PERM=1 TSval=3345482299 TSecr=0 WS=128","","","","",""
"42","0.610970615","10.10.3.102","10.10.3.62","MPTCP","92","5201  >  57691 [SYN, ACK] Seq=0 Ack=1 Win=65160 Len=0 MSS=1460 SACK_PERM=1 TSval=2492260072 TSecr=3345482299 WS=128","0.000043330","","","",""
"43","0.610980327","10.10.3.105","10.10.3.59","MPTCP","88","41019  >  5201 [SYN] Seq=0 Win=64256 Len=0 MSS=1460 SACK_PERM=1 TSval=937570426 TSecr=0 WS=128","","","","",""
"44","0.611027054","10.10.3.59","10.10.3.105","MPTCP","92","5201  >  41019 [SYN, ACK] Seq=0 Ack=1 Win=65160 Len=0 MSS=1460 SACK_PERM=1 TSval=1399550169 TSecr=937570426 WS=128","0.000046727","","","",""
"46","0.614910428","10.10.3.62","10.10.3.102","MPTCP","92","57691  >  5201 [ACK] Seq=1 Ack=1 Win=64256 Len=0 TSval=3345482302 TSecr=2492260072","0.003939813","","","",""
"47","0.614982035","10.10.3.102","10.10.3.62","MPTCP","80","[TCP Window Update] 5201  >  57691 [ACK] Seq=1 Ack=1 Win=65280 Len=0 TSval=2492260076 TSecr=3345482302","","","","","â\234\223"
"48","0.615742870","10.10.3.105","10.10.3.59","MPTCP","92","41019  >  5201 [ACK] Seq=1 Ack=1 Win=64256 Len=0 TSval=937570431 TSecr=1399550169","0.004715816","","","",""
"49","0.615822502","10.10.3.59","10.10.3.105","MPTCP","80","[TCP Window Update] 5201  >  41019 [ACK] Seq=1 Ack=1 Win=65280 Len=0 TSval=1399550174 TSecr=937570431","","","","","â\234\223"
"52","0.652638604","10.10.3.105","10.10.3.102","MPTCP","80","53740  >  5201 [ACK] Seq=142 Ack=3 Win=64256 Len=0 TSval=2008315137 TSecr=1039441789","0.043110364","","","",""
"53","0.652687662","10.10.3.102","10.10.3.105","MPTCP","98","5201  >  53740 [PSH, ACK] Seq=3 Ack=142 Win=65280 Len=2 TSval=1039441832 TSecr=2008315137","","","","",""
"54","0.652787732","10.10.3.105","10.10.3.102","MPTCP","80","53740  >  5201 [ACK] Seq=142 Ack=5 Win=64256 Len=0 TSval=2008315137 TSecr=1039441832","0.000100070","","","",""
"55","0.652916640","10.10.3.105","10.10.3.102","MPTCP","7212","53748  >  5201 [PSH, ACK] Seq=38 Ack=1 Win=64256 Len=7120 TSval=2008315137 TSecr=1039441790","","","","",""
"56","0.652943350","10.10.3.102","10.10.3.105","MPTCP","80","5201  >  53748 [ACK] Seq=1 Ack=7158 Win=60672 Len=0 TSval=1039441833 TSecr=2008315137","0.000026710","","","",""
"57","0.652980938","10.10.3.105","10.10.3.102","MPTCP","7212","53748  >  5201 [PSH, ACK] Seq=7158 Ack=1 Win=64256 Len=7120 TSval=2008315137 TSecr=1039441790","","","","",""
"58","0.652995403","10.10.3.102","10.10.3.105","MPTCP","80","5201  >  53748 [ACK] Seq=1 Ack=14278 Win=55680 Len=0 TSval=1039441833 TSecr=2008315137","0.000014465","","","",""
"59","0.653197640","10.10.3.105","10.10.3.102","MPTCP","10060","53748  >  5201 [PSH, ACK] Seq=14278 Ack=1 Win=64256 Len=9968 TSval=2008315137 TSecr=1039441833","","","","",""
"60","0.653232049","10.10.3.102","10.10.3.105","MPTCP","80","5201  >  53748 [ACK] Seq=1 Ack=24246 Win=58752 Len=0 TSval=1039441833 TSecr=2008315137","0.000034409","","","",""
"61","0.653281020","10.10.3.105","10.10.3.102","MPTCP","7212","53748  >  5201 [PSH, ACK] Seq=24246 Ack=1 Win=64256 Len=7120 TSval=2008315137 TSecr=1039441833","","","","",""
"62","0.653294664","10.10.3.102","10.10.3.105","MPTCP","80","5201  >  53748 [ACK] Seq=1 Ack=31366 Win=53760 Len=0 TSval=1039441833 TSecr=2008315137","0.000013644","","","",""
"63","0.653355573","10.10.3.105","10.10.3.102","MPTCP","11484","53748  >  5201 [PSH, ACK] Seq=31366 Ack=1 Win=64256 Len=11392 TSval=2008315137 TSecr=1039441833","","","","",""
"64","0.653369700","10.10.3.102","10.10.3.105","MPTCP","80","5201  >  53748 [ACK] Seq=1 Ack=42758 Win=86912 Len=0 TSval=1039441833 TSecr=2008315137","0.000014127","","","",""
"65","0.653520235","10.10.3.105","10.10.3.102","MPTCP","18604","53748  >  5201 [PSH, ACK] Seq=42758 Ack=1 Win=64256 Len=18512 TSval=2008315137 TSecr=1039441833","","","","",""
"66","0.653536768","10.10.3.102","10.10.3.105","MPTCP","80","5201  >  53748 [ACK] Seq=1 Ack=61270 Win=123904 Len=0 TSval=1039441833 TSecr=2008315137","0.000016533","","","",""
"67","0.653568224","10.10.3.105","10.10.3.102","MPTCP","1516","53748  >  5201 [ACK] Seq=61270 Ack=1 Win=64256 Len=1424 TSval=2008315137 TSecr=1039441833","","","","",""
"68","0.653578670","10.10.3.102","10.10.3.105","MPTCP","80","5201  >  53748 [ACK] Seq=1 Ack=62694 Win=126848 Len=0 TSval=1039441833 TSecr=2008315137","0.000010446","","","",""
"69","0.653679960","10.10.3.105","10.10.3.102","MPTCP","2716","53748  >  5201 [PSH, ACK] Seq=62694 Ack=1 Win=64256 Len=2624 TSval=2008315137 TSecr=1039441833","","","","",""
"70","0.653711701","10.10.3.102","10.10.3.105","MPTCP","80","5201  >  53748 [ACK] Seq=1 Ack=65318 Win=132096 Len=0 TSval=1039441833 TSecr=2008315137","0.000031741","","","",""
"71","0.653899837","10.10.3.105","10.10.3.102","MPTCP","28572","53748  >  5201 [PSH, ACK] Seq=65318 Ack=1 Win=64256 Len=28480 TSval=2008315138 TSecr=1039441833","","","","",""
"72","0.653919798","10.10.3.102","10.10.3.105","MPTCP","80","5201  >  53748 [ACK] Seq=1 Ack=93798 Win=189056 Len=0 TSval=1039441834 TSecr=2008315138","0.000019961","","","",""
"73","0.653932045","10.10.3.105","10.10.3.102","MPTCP","5788","53748  >  5201 [PSH, ACK] Seq=93798 Ack=1 Win=64256 Len=5696 TSval=2008315138 TSecr=1039441833","","","","",""
"74","0.653942752","10.10.3.102","10.10.3.105","MPTCP","80","5201  >  53748 [ACK] Seq=1 Ack=99494 Win=200448 Len=0 TSval=1039441834 TSecr=2008315138","0.000010707","","","",""
"75","0.654030809","10.10.3.105","10.10.3.102","MPTCP","8636","53748  >  5201 [PSH, ACK] Seq=99494 Ack=1 Win=64256 Len=8544 TSval=2008315138 TSecr=1039441833","","","","",""
"76","0.654042224","10.10.3.102","10.10.3.105","MPTCP","80","5201  >  53748 [ACK] Seq=1 Ack=108038 Win=217472 Len=0 TSval=1039441834 TSecr=2008315138","0.000011415","","","",""
"77","0.654271989","10.10.3.105","10.10.3.102","MPTCP","28572","53748  >  5201 [PSH, ACK] Seq=108038 Ack=1 Win=64256 Len=28480 TSval=2008315138 TSecr=1039441833","","","","",""
"78","0.654289557","10.10.3.102","10.10.3.105","MPTCP","80","5201  >  53748 [ACK] Seq=1 Ack=136518 Win=242176 Len=0 TSval=1039441834 TSecr=2008315138","0.000017568","","","",""
"79","0.654543386","10.10.3.105","10.10.3.102","MPTCP","31068","53748  >  5201 [PSH, ACK] Seq=136518 Ack=1 Win=64256 Len=30976 TSval=2008315138 TSecr=1039441834","","","","",""
"80","0.654569757","10.10.3.102","10.10.3.105","MPTCP","80","5201  >  53748 [ACK] Seq=1 Ack=167494 Win=242176 Len=0 TSval=1039441834 TSecr=2008315138","0.000026371","","","",""
"81","0.654891490","10.10.3.105","10.10.3.102","MPTCP","41388","53748  >  5201 [PSH, ACK] Seq=167494 Ack=1 Win=64256 Len=41296 TSval=2008315138 TSecr=1039441834","","","","",""
"82","0.654916652","10.10.3.102","10.10.3.105","MPTCP","80","5201  >  53748 [ACK] Seq=1 Ack=208790 Win=242176 Len=0 TSval=1039441835 TSecr=2008315138","0.000025162","","","",""
"83","0.655094184","10.10.3.105","10.10.3.102","MPTCP","21452","53748  >  5201 [PSH, ACK] Seq=208790 Ack=1 Win=64256 Len=21360 TSval=2008315139 TSecr=1039441834","","","","",""
"84","0.655110895","10.10.3.102","10.10.3.105","MPTCP","80","5201  >  53748 [ACK] Seq=1 Ack=230150 Win=242176 Len=0 TSval=1039441835 TSecr=2008315139","0.000016711","","","",""
"85","0.655175730","10.10.3.105","10.10.3.59","MPTCP","1516","41019  >  5201 [ACK] Seq=1 Ack=1 Win=64256 Len=1424 TSval=937570469 TSecr=1399550174","","","","",""
"86","0.655205886","10.10.3.59","10.10.3.105","MPTCP","80","5201  >  41019 [ACK] Seq=1 Ack=1425 Win=242176 Len=0 TSval=1399550213 TSecr=937570469","0.000030156","","","",""
"87","0.655457803","10.10.3.105","10.10.3.102","MPTCP","42812","53748  >  5201 [PSH, ACK] Seq=230150 Ack=1 Win=64256 Len=42720 TSval=2008315139 TSecr=1039441835","","","","",""
"88","0.655488955","10.10.3.102","10.10.3.105","MPTCP","80","5201  >  53748 [ACK] Seq=1 Ack=272870 Win=242176 Len=0 TSval=1039441835 TSecr=2008315139","0.000031152","","","",""
"89","0.656560906","10.10.3.105","10.10.3.59","MPTCP","1516","41019  >  5201 [ACK] Seq=1425 Ack=1 Win=64256 Len=1424 TSval=937570469 TSecr=1399550174","","","","",""
"90","0.656590501","10.10.3.59","10.10.3.105","MPTCP","80","5201  >  41019 [ACK] Seq=1 Ack=2849 Win=242176 Len=0 TSval=1399550214 TSecr=937570469","0.000029595","","","",""
"91","0.660398172","10.10.3.105","10.10.3.102","MPTCP","1372","[TCP Previous segment not captured] 53748  >  5201 [PSH, ACK] Seq=288534 Ack=1 Win=64256 Len=1280 TSval=2008315145 TSecr=1039441835","","â\234\223","","","â\234\223"
"92","0.660410139","10.10.3.102","10.10.3.105","MPTCP","92","[TCP Dup ACK 88#1] 5201  >  53748 [ACK] Seq=1 Ack=272870 Win=242176 Len=0 TSval=1039441840 TSecr=2008315139 SLE=288534 SRE=289814","","","â\234\223","","â\234\223"
"93","0.674342563","10.10.3.62","10.10.3.102","MPTCP","1516","57691  >  5201 [ACK] Seq=1 Ack=1 Win=64256 Len=1424 TSval=3345482342 TSecr=2492260076","","","","",""
"94","0.674388137","10.10.3.102","10.10.3.62","MPTCP","80","5201  >  57691 [ACK] Seq=1 Ack=1425 Win=240640 Len=0 TSval=2492260135 TSecr=3345482342","0.000045574","","","",""
"95","0.675391134","10.10.3.105","10.10.3.59","MPTCP","1516","41019  >  5201 [ACK] Seq=2849 Ack=1 Win=64256 Len=1424 TSval=937570469 TSecr=1399550174","","","","",""
"96","0.675434251","10.10.3.59","10.10.3.105","MPTCP","80","5201  >  41019 [ACK] Seq=1 Ack=4273 Win=240768 Len=0 TSval=1399550233 TSecr=937570469","0.000043117","","","",""
"97","0.676564161","10.10.3.62","10.10.3.102","MPTCP","1516","57691  >  5201 [ACK] Seq=1425 Ack=1 Win=64256 Len=1424 TSval=3345482342 TSecr=2492260076","","","","",""
"98","0.676598115","10.10.3.102","10.10.3.62","MPTCP","80","5201  >  57691 [ACK] Seq=1 Ack=2849 Win=239360 Len=0 TSval=2492260137 TSecr=3345482342","0.000033954","","","",""
"99","0.680631353","10.10.3.105","10.10.3.59","MPTCP","1516","41019  >  5201 [PSH, ACK] Seq=4273 Ack=1 Win=64256 Len=1424 TSval=937570469 TSecr=1399550174","","","","",""
"100","0.680672379","10.10.3.59","10.10.3.105","MPTCP","80","5201  >  41019 [ACK] Seq=1 Ack=5697 Win=239360 Len=0 TSval=1399550238 TSecr=937570469","0.000041026","","","",""
"101","0.685740371","10.10.3.62","10.10.3.102","MPTCP","1516","57691  >  5201 [ACK] Seq=2849 Ack=1 Win=64256 Len=1424 TSval=3345482342 TSecr=2492260076","","","","",""
"102","0.685788367","10.10.3.102","10.10.3.62","MPTCP","80","5201  >  57691 [ACK] Seq=1 Ack=4273 Win=237952 Len=0 TSval=2492260146 TSecr=3345482342","0.000047996","","","",""
"103","0.697053949","10.10.3.105","10.10.3.59","MPTCP","1516","41019  >  5201 [ACK] Seq=5697 Ack=1 Win=64256 Len=1424 TSval=937570469 TSecr=1399550174","","","","",""
"104","0.697100051","10.10.3.59","10.10.3.105","MPTCP","80","5201  >  41019 [ACK] Seq=1 Ack=7121 Win=237952 Len=0 TSval=1399550255 TSecr=937570469","0.000046102","","","",""
"105","0.697381334","10.10.3.62","10.10.3.102","MPTCP","460","57691  >  5201 [PSH, ACK] Seq=4273 Ack=1 Win=64256 Len=368 TSval=3345482342 TSecr=2492260076","","","","",""
"106","0.697439361","10.10.3.102","10.10.3.62","MPTCP","80","5201  >  57691 [ACK] Seq=1 Ack=4641 Win=237696 Len=0 TSval=2492260158 TSecr=3345482342","0.000058027","","","",""
"107","0.701149657","10.10.3.62","10.10.3.102","MPTCP","460","[TCP Spurious Retransmission] 57691  >  5201 [PSH, ACK] Seq=4273 Ack=1 Win=64256 Len=368 TSval=3345482354 TSecr=2492260076","","","","â\234\223","â\234\223"
"108","0.701190849","10.10.3.102","10.10.3.62","MPTCP","92","[TCP Dup ACK 106#1] 5201  >  57691 [ACK] Seq=1 Ack=4641 Win=237696 Len=0 TSval=2492260162 TSecr=3345482354 SLE=4273 SRE=4641","0.000041192","","â\234\223","","â\234\223"
"109","0.701331324","10.10.3.105","10.10.3.59","MPTCP","1516","41019  >  5201 [ACK] Seq=7121 Ack=1 Win=64256 Len=1424 TSval=937570469 TSecr=1399550174","","","","",""
"110","0.701368344","10.10.3.59","10.10.3.105","MPTCP","80","5201  >  41019 [ACK] Seq=1 Ack=8545 Win=236544 Len=0 TSval=1399550259 TSecr=937570469","0.000037020","","","",""
"111","0.704873192","10.10.3.62","10.10.3.102","MPTCP","1516","57691  >  5201 [ACK] Seq=4641 Ack=1 Win=64256 Len=1424 TSval=3345482389 TSecr=2492260158","","","","",""
"112","0.704920190","10.10.3.102","10.10.3.62","MPTCP","80","5201  >  57691 [ACK] Seq=1 Ack=6065 Win=236544 Len=0 TSval=2492260166 TSecr=3345482389","0.000046998","","","",""
"113","0.706608170","10.10.3.105","10.10.3.102","MPTCP","140","53748  >  5201 [PSH, ACK] Seq=289814 Ack=1 Win=64256 Len=48 TSval=2008315191 TSecr=1039441840","","","","",""
"114","0.706649996","10.10.3.102","10.10.3.105","MPTCP","92","[TCP Dup ACK 88#2] 5201  >  53748 [ACK] Seq=1 Ack=272870 Win=242176 Len=0 TSval=1039441886 TSecr=2008315139 SLE=288534 SRE=289862","","","â\234\223","","â\234\223"
"115","0.707036392","10.10.3.105","10.10.3.102","MPTCP","1516","[TCP Fast Retransmission] 53748  >  5201 [ACK] Seq=272870 Ack=1 Win=64256 Len=1424 TSval=2008315191 TSecr=1039441886","","","","â\234\223","â\234\223"
"116","0.707079017","10.10.3.102","10.10.3.105","MPTCP","92","5201  >  53748 [ACK] Seq=1 Ack=274294 Win=242176 Len=0 TSval=1039441887 TSecr=2008315191 SLE=288534 SRE=289862","0.000042625","","","",""
"117","0.707554148","10.10.3.105","10.10.3.102","MPTCP","2940","[TCP Retransmission] 53748  >  5201 [PSH, ACK] Seq=274294 Ack=1 Win=64256 Len=2848 TSval=2008315191 TSecr=1039441887","","","","â\234\223","â\234\223"
"118","0.707607148","10.10.3.102","10.10.3.105","MPTCP","92","5201  >  53748 [ACK] Seq=1 Ack=277142 Win=242176 Len=0 TSval=1039441887 TSecr=2008315191 SLE=288534 SRE=289862","0.000053000","","","",""
"119","0.708172351","10.10.3.105","10.10.3.102","MPTCP","4364","[TCP Retransmission] 53748  >  5201 [PSH, ACK] Seq=277142 Ack=1 Win=64256 Len=4272 TSval=2008315192 TSecr=1039441887","","","","â\234\223","â\234\223"
"120","0.708227017","10.10.3.102","10.10.3.105","MPTCP","92","5201  >  53748 [ACK] Seq=1 Ack=281414 Win=242176 Len=0 TSval=1039441888 TSecr=2008315192 SLE=288534 SRE=289862","0.000054666","","","",""
"121","0.708542390","10.10.3.105","10.10.3.102","MPTCP","5788","[TCP Retransmission] 53748  >  5201 [PSH, ACK] Seq=281414 Ack=1 Win=64256 Len=5696 TSval=2008315193 TSecr=1039441888","","","","â\234\223","â\234\223"
"122","0.708595925","10.10.3.102","10.10.3.105","MPTCP","92","5201  >  53748 [ACK] Seq=1 Ack=287110 Win=242176 Len=0 TSval=1039441888 TSecr=2008315193 SLE=288534 SRE=289862","0.000053535","","","",""
"123","0.708791330","10.10.3.105","10.10.3.102","MPTCP","1516","[TCP Retransmission] 53748  >  5201 [ACK] Seq=287110 Ack=1 Win=64256 Len=1424 TSval=2008315193 TSecr=1039441888","","","","â\234\223","â\234\223"
"124","0.708831325","10.10.3.102","10.10.3.105","MPTCP","80","5201  >  53748 [ACK] Seq=1 Ack=289862 Win=242176 Len=0 TSval=1039441889 TSecr=2008315193","0.002223155","","","",""
"125","0.708791726","10.10.3.105","10.10.3.102","MPTCP","2940","53748  >  5201 [PSH, ACK] Seq=289862 Ack=1 Win=64256 Len=2848 TSval=2008315193 TSecr=1039441888","","","","",""
"126","0.708851235","10.10.3.102","10.10.3.105","MPTCP","80","5201  >  53748 [ACK] Seq=1 Ack=292710 Win=242176 Len=0 TSval=1039441889 TSecr=2008315193","0.000059509","","","",""
"127","0.708791854","10.10.3.105","10.10.3.102","MPTCP","2940","53748  >  5201 [PSH, ACK] Seq=292710 Ack=1 Win=64256 Len=2848 TSval=2008315193 TSecr=1039441888","","","","",""
"128","0.708864684","10.10.3.102","10.10.3.105","MPTCP","80","5201  >  53748 [ACK] Seq=1 Ack=295558 Win=242176 Len=0 TSval=1039441889 TSecr=2008315193","0.000072830","","","",""
"129","0.708903559","10.10.3.105","10.10.3.102","MPTCP","300","53748  >  5201 [PSH, ACK] Seq=295558 Ack=1 Win=64256 Len=208 TSval=2008315193 TSecr=1039441889","","","","",""
"130","0.708915498","10.10.3.102","10.10.3.105","MPTCP","80","5201  >  53748 [ACK] Seq=1 Ack=295766 Win=242176 Len=0 TSval=1039441889 TSecr=2008315193","0.000011939","","","",""
"131","0.713256681","10.10.3.105","10.10.3.59","MPTCP","1516","41019  >  5201 [ACK] Seq=8545 Ack=1 Win=64256 Len=1424 TSval=937570469 TSecr=1399550174","","","","",""
"132","0.713306887","10.10.3.59","10.10.3.105","MPTCP","80","5201  >  41019 [ACK] Seq=1 Ack=9969 Win=240640 Len=0 TSval=1399550271 TSecr=937570469","0.000050206","","","",""
"133","0.716737010","10.10.3.62","10.10.3.102","MPTCP","1516","57691  >  5201 [ACK] Seq=6065 Ack=1 Win=64256 Len=1424 TSval=3345482389 TSecr=2492260158","","","","",""
"134","0.716786908","10.10.3.102","10.10.3.62","MPTCP","80","5201  >  57691 [ACK] Seq=1 Ack=7489 Win=240640 Len=0 TSval=2492260177 TSecr=3345482389","0.000049898","","","",""
"135","0.728730425","10.10.3.62","10.10.3.102","MPTCP","1516","57691  >  5201 [ACK] Seq=7489 Ack=1 Win=64256 Len=1424 TSval=3345482389 TSecr=2492260158","","","","",""
"136","0.728775163","10.10.3.102","10.10.3.62","MPTCP","80","5201  >  57691 [ACK] Seq=1 Ack=8913 Win=240640 Len=0 TSval=2492260189 TSecr=3345482389","0.000044738","","","",""
"137","0.730274915","10.10.3.105","10.10.3.59","MPTCP","1516","41019  >  5201 [PSH, ACK] Seq=9969 Ack=1 Win=64256 Len=1424 TSval=937570469 TSecr=1399550174","","","","",""
"138","0.730320335","10.10.3.59","10.10.3.105","MPTCP","80","5201  >  41019 [ACK] Seq=1 Ack=11393 Win=239360 Len=0 TSval=1399550288 TSecr=937570469","0.000045420","","","",""
"139","0.732649739","10.10.3.105","10.10.3.102","MPTCP","124","53748  >  5201 [PSH, ACK] Seq=295766 Ack=1 Win=64256 Len=32 TSval=2008315217 TSecr=1039441889","","","","",""
"140","0.737168317","10.10.3.105","10.10.3.59","MPTCP","1516","41019  >  5201 [ACK] Seq=11393 Ack=1 Win=64256 Len=1424 TSval=937570470 TSecr=1399550174","","","","",""
"141","0.737212653","10.10.3.59","10.10.3.105","MPTCP","80","5201  >  41019 [ACK] Seq=1 Ack=12817 Win=237952 Len=0 TSval=1399550295 TSecr=937570470","0.000044336","","","",""
"142","0.740318245","10.10.3.62","10.10.3.102","MPTCP","1516","57691  >  5201 [ACK] Seq=8913 Ack=1 Win=64256 Len=1424 TSval=3345482389 TSecr=2492260158","","","","",""
"143","0.740355320","10.10.3.102","10.10.3.62","MPTCP","80","5201  >  57691 [ACK] Seq=1 Ack=10337 Win=239360 Len=0 TSval=2492260201 TSecr=3345482389","0.000037075","","","",""
"144","0.742740683","10.10.3.105","10.10.3.102","MPTCP","1516","53748  >  5201 [PSH, ACK] Seq=295798 Ack=1 Win=64256 Len=1424 TSval=2008315227 TSecr=1039441889","","","","",""
"145","0.742771680","10.10.3.102","10.10.3.105","MPTCP","80","5201  >  53748 [ACK] Seq=1 Ack=297222 Win=240768 Len=0 TSval=1039441922 TSecr=2008315217","0.000030997","","","",""
"146","0.743101783","10.10.3.105","10.10.3.102","MPTCP","1500","53748  >  5201 [PSH, ACK] Seq=297222 Ack=1 Win=64256 Len=1408 TSval=2008315227 TSecr=1039441922","","","","",""
"147","0.750175660","10.10.3.105","10.10.3.59","MPTCP","316","41019  >  5201 [PSH, ACK] Seq=12817 Ack=1 Win=64256 Len=224 TSval=937570470 TSecr=1399550174","","","","",""
"148","0.750219211","10.10.3.59","10.10.3.105","MPTCP","80","5201  >  41019 [ACK] Seq=1 Ack=13041 Win=237824 Len=0 TSval=1399550308 TSecr=937570470","0.000043551","","","",""
"149","0.750453611","10.10.3.102","10.10.3.105","MPTCP","80","5201  >  53748 [ACK] Seq=1 Ack=298630 Win=284032 Len=0 TSval=1039441923 TSecr=2008315227","0.007351828","","","",""
"150","0.751092802","10.10.3.105","10.10.3.102","MPTCP","29996","53748  >  5201 [PSH, ACK] Seq=298630 Ack=1 Win=64256 Len=29904 TSval=2008315235 TSecr=1039441923","","","","",""
"151","0.751130413","10.10.3.102","10.10.3.105","MPTCP","80","5201  >  53748 [ACK] Seq=1 Ack=328534 Win=284032 Len=0 TSval=1039441931 TSecr=2008315235","0.000037611","","","",""
"152","0.751347241","10.10.3.105","10.10.3.102","MPTCP","29996","53748  >  5201 [PSH, ACK] Seq=328534 Ack=1 Win=64256 Len=29904 TSval=2008315235 TSecr=1039441923","","","","",""
"153","0.751366660","10.10.3.102","10.10.3.105","MPTCP","80","5201  >  53748 [ACK] Seq=1 Ack=358438 Win=284032 Len=0 TSval=1039441931 TSecr=2008315235","0.000019419","","","",""
"154","0.751435013","10.10.3.105","10.10.3.102","MPTCP","2940","53748  >  5201 [PSH, ACK] Seq=358438 Ack=1 Win=64256 Len=2848 TSval=2008315235 TSecr=1039441931","","","","",""
"155","0.751445785","10.10.3.102","10.10.3.105","MPTCP","80","5201  >  53748 [ACK] Seq=1 Ack=361286 Win=284032 Len=0 TSval=1039441931 TSecr=2008315235","0.000010772","","","",""
"156","0.751481287","10.10.3.105","10.10.3.102","MPTCP","6668","53748  >  5201 [PSH, ACK] Seq=361286 Ack=1 Win=64256 Len=6576 TSval=2008315235 TSecr=1039441931","","","","",""
"157","0.751492312","10.10.3.102","10.10.3.105","MPTCP","80","5201  >  53748 [ACK] Seq=1 Ack=367862 Win=284032 Len=0 TSval=1039441931 TSecr=2008315235","0.000011025","","","",""
"158","0.751666120","10.10.3.105","10.10.3.102","MPTCP","20028","53748  >  5201 [PSH, ACK] Seq=367862 Ack=1 Win=64256 Len=19936 TSval=2008315235 TSecr=1039441931","","","","",""
"159","0.751681564","10.10.3.102","10.10.3.105","MPTCP","80","5201  >  53748 [ACK] Seq=1 Ack=387798 Win=284032 Len=0 TSval=1039441931 TSecr=2008315235","0.000015444","","","",""
"160","0.751739489","10.10.3.105","10.10.3.102","MPTCP","4364","[TCP Previous segment not captured] 53748  >  5201 [PSH, ACK] Seq=417702 Ack=1 Win=64256 Len=4272 TSval=2008315236 TSecr=1039441931","","â\234\223","","","â\234\223"
"161","0.751750272","10.10.3.102","10.10.3.105","MPTCP","92","[TCP Dup ACK 159#1] 5201  >  53748 [ACK] Seq=1 Ack=387798 Win=284032 Len=0 TSval=1039441931 TSecr=2008315235 SLE=417702 SRE=421974","","","â\234\223","","â\234\223"
"162","0.751814903","10.10.3.105","10.10.3.102","MPTCP","7212","53748  >  5201 [PSH, ACK] Seq=421974 Ack=1 Win=64256 Len=7120 TSval=2008315236 TSecr=1039441931","","","","",""
"163","0.751825611","10.10.3.102","10.10.3.105","MPTCP","92","[TCP Dup ACK 159#2] 5201  >  53748 [ACK] Seq=1 Ack=387798 Win=284032 Len=0 TSval=1039441932 TSecr=2008315235 SLE=417702 SRE=429094","","","â\234\223","","â\234\223"
"164","0.751859324","10.10.3.105","10.10.3.102","MPTCP","1516","53748  >  5201 [ACK] Seq=429094 Ack=1 Win=64256 Len=1424 TSval=2008315236 TSecr=1039441931","","","","",""
"165","0.751867489","10.10.3.102","10.10.3.105","MPTCP","92","[TCP Dup ACK 159#3] 5201  >  53748 [ACK] Seq=1 Ack=387798 Win=284032 Len=0 TSval=1039441932 TSecr=2008315235 SLE=417702 SRE=430518","","","â\234\223","","â\234\223"
"166","0.751928586","10.10.3.105","10.10.3.102","MPTCP","11020","53748  >  5201 [PSH, ACK] Seq=430518 Ack=1 Win=64256 Len=10928 TSval=2008315236 TSecr=1039441931","","","","",""
"167","0.751939204","10.10.3.102","10.10.3.105","MPTCP","92","[TCP Dup ACK 159#4] 5201  >  53748 [ACK] Seq=1 Ack=387798 Win=284032 Len=0 TSval=1039441932 TSecr=2008315235 SLE=417702 SRE=441446","","","â\234\223","","â\234\223"
"168","0.751972134","10.10.3.105","10.10.3.102","MPTCP","4364","[TCP Fast Retransmission] 53748  >  5201 [PSH, ACK] Seq=387798 Ack=1 Win=64256 Len=4272 TSval=2008315236 TSecr=1039441931","","","","â\234\223","â\234\223"
"169","0.751984055","10.10.3.102","10.10.3.105","MPTCP","92","5201  >  53748 [ACK] Seq=1 Ack=392070 Win=284032 Len=0 TSval=1039441932 TSecr=2008315236 SLE=417702 SRE=441446","0.000011921","","","",""
"170","0.752081263","10.10.3.105","10.10.3.102","MPTCP","7212","[TCP Out-Of-Order] 53748  >  5201 [PSH, ACK] Seq=392070 Ack=1 Win=64256 Len=7120 TSval=2008315236 TSecr=1039441932","","","","","â\234\223"
"171","0.752092544","10.10.3.102","10.10.3.105","MPTCP","92","5201  >  53748 [ACK] Seq=1 Ack=399190 Win=284032 Len=0 TSval=1039441932 TSecr=2008315236 SLE=417702 SRE=441446","0.000011281","","","",""
"172","0.752128053","10.10.3.62","10.10.3.102","MPTCP","1516","57691  >  5201 [PSH, ACK] Seq=10337 Ack=1 Win=64256 Len=1424 TSval=3345482389 TSecr=2492260158","","","","",""
"173","0.752141278","10.10.3.102","10.10.3.62","MPTCP","80","5201  >  57691 [ACK] Seq=1 Ack=11761 Win=282496 Len=0 TSval=2492260213 TSecr=3345482389","0.000013225","","","",""
"174","0.752203439","10.10.3.105","10.10.3.102","MPTCP","12908","[TCP Retransmission] 53748  >  5201 [PSH, ACK] Seq=399190 Ack=1 Win=64256 Len=12816 TSval=2008315236 TSecr=1039441932","","","","â\234\223","â\234\223"
"175","0.752216490","10.10.3.102","10.10.3.105","MPTCP","92","5201  >  53748 [ACK] Seq=1 Ack=412006 Win=282496 Len=0 TSval=1039441932 TSecr=2008315236 SLE=417702 SRE=441446","0.000013051","","","",""
"176","0.752299099","10.10.3.105","10.10.3.102","MPTCP","5788","[TCP Retransmission] 53748  >  5201 [PSH, ACK] Seq=412006 Ack=1 Win=64256 Len=5696 TSval=2008315236 TSecr=1039441932","","","","â\234\223","â\234\223"
"177","0.752316101","10.10.3.102","10.10.3.105","MPTCP","80","5201  >  53748 [ACK] Seq=1 Ack=441446 Win=282496 Len=0 TSval=1039441932 TSecr=2008315236","0.000387515","","","",""
"178","0.753009161","10.10.3.105","10.10.3.59","MPTCP","316","[TCP Spurious Retransmission] 41019  >  5201 [PSH, ACK] Seq=12817 Ack=1 Win=64256 Len=224 TSval=937570489 TSecr=1399550214","","","","â\234\223","â\234\223"
"179","0.753025249","10.10.3.59","10.10.3.105","MPTCP","92","[TCP Window Update] 5201  >  41019 [ACK] Seq=1 Ack=13041 Win=282496 Len=0 TSval=1399550311 TSecr=937570489 SLE=12817 SRE=13041","0.000016088","","","","â\234\223"
"180","0.756464504","10.10.3.105","10.10.3.59","MPTCP","1516","41019  >  5201 [ACK] Seq=13041 Ack=1 Win=64256 Len=1424 TSval=937570567 TSecr=1399550295","","","","",""
"181","0.756482127","10.10.3.59","10.10.3.105","MPTCP","80","5201  >  41019 [ACK] Seq=1 Ack=14465 Win=282496 Len=0 TSval=1399550314 TSecr=937570567","0.000017623","","","",""
"182","0.763895789","10.10.3.62","10.10.3.102","MPTCP","204","57691  >  5201 [PSH, ACK] Seq=11761 Ack=1 Win=64256 Len=112 TSval=3345482389 TSecr=2492260158","","","","",""
"183","0.765687749","10.10.3.62","10.10.3.102","MPTCP","1516","57691  >  5201 [ACK] Seq=11873 Ack=1 Win=64256 Len=1424 TSval=3345482440 TSecr=2492260201","","","","",""
"184","0.765716261","10.10.3.102","10.10.3.62","MPTCP","80","5201  >  57691 [ACK] Seq=1 Ack=13297 Win=281088 Len=0 TSval=2492260226 TSecr=3345482389","0.000028512","","","",""
"185","0.769043366","10.10.3.105","10.10.3.59","MPTCP","1516","41019  >  5201 [PSH, ACK] Seq=14465 Ack=1 Win=64256 Len=1424 TSval=937570567 TSecr=1399550295","","","","",""
"186","0.769064926","10.10.3.59","10.10.3.105","MPTCP","80","5201  >  41019 [ACK] Seq=1 Ack=15889 Win=281216 Len=0 TSval=1399550327 TSecr=937570567","0.000021560","","","",""
"187","0.772048936","10.10.3.105","10.10.3.102","MPTCP","21452","53748  >  5201 [PSH, ACK] Seq=441446 Ack=1 Win=64256 Len=21360 TSval=2008315256 TSecr=1039441932","","","","",""
"188","0.772082499","10.10.3.102","10.10.3.105","MPTCP","80","5201  >  53748 [ACK] Seq=1 Ack=462806 Win=333696 Len=0 TSval=1039441952 TSecr=2008315256","0.000033563","","","",""
"189","0.772225766","10.10.3.105","10.10.3.102","MPTCP","21452","53748  >  5201 [PSH, ACK] Seq=462806 Ack=1 Win=64256 Len=21360 TSval=2008315256 TSecr=1039441932","","","","",""
"190","0.772238633","10.10.3.102","10.10.3.105","MPTCP","80","5201  >  53748 [ACK] Seq=1 Ack=484166 Win=376448 Len=0 TSval=1039441952 TSecr=2008315256","0.000012867","","","",""
"191","0.772404509","10.10.3.105","10.10.3.102","MPTCP","20028","53748  >  5201 [PSH, ACK] Seq=484166 Ack=1 Win=64256 Len=19936 TSval=2008315256 TSecr=1039441952","","","","",""
"192","0.772417863","10.10.3.102","10.10.3.105","MPTCP","80","5201  >  53748 [ACK] Seq=1 Ack=504102 Win=416256 Len=0 TSval=1039441952 TSecr=2008315256","0.000013354","","","",""
"193","0.772601653","10.10.3.105","10.10.3.102","MPTCP","22876","53748  >  5201 [PSH, ACK] Seq=504102 Ack=1 Win=64256 Len=22784 TSval=2008315256 TSecr=1039441952","","","","",""
"194","0.772613215","10.10.3.102","10.10.3.105","MPTCP","80","5201  >  53748 [ACK] Seq=1 Ack=526886 Win=461824 Len=0 TSval=1039441952 TSecr=2008315256","0.000011562","","","",""
"195","0.772772849","10.10.3.105","10.10.3.102","MPTCP","21452","53748  >  5201 [PSH, ACK] Seq=526886 Ack=1 Win=64256 Len=21360 TSval=2008315257 TSecr=1039441952","","","","",""
"196","0.772791595","10.10.3.102","10.10.3.105","MPTCP","80","5201  >  53748 [ACK] Seq=1 Ack=548246 Win=504576 Len=0 TSval=1039441953 TSecr=2008315257","0.000018746","","","",""
"197","0.772949995","10.10.3.105","10.10.3.102","MPTCP","18604","53748  >  5201 [PSH, ACK] Seq=548246 Ack=1 Win=64256 Len=18512 TSval=2008315257 TSecr=1039441952","","","","",""
"198","0.772962145","10.10.3.102","10.10.3.105","MPTCP","80","5201  >  53748 [ACK] Seq=1 Ack=566758 Win=541568 Len=0 TSval=1039441953 TSecr=2008315257","0.000012150","","","",""
"199","0.772992100","10.10.3.105","10.10.3.102","MPTCP","4364","53748  >  5201 [PSH, ACK] Seq=566758 Ack=1 Win=64256 Len=4272 TSval=2008315257 TSecr=1039441952","","","","",""
"200","0.772999132","10.10.3.102","10.10.3.105","MPTCP","80","5201  >  53748 [ACK] Seq=1 Ack=571030 Win=550144 Len=0 TSval=1039441953 TSecr=2008315257","0.000007032","","","",""
"201","0.773181097","10.10.3.105","10.10.3.102","MPTCP","21452","53748  >  5201 [PSH, ACK] Seq=571030 Ack=1 Win=64256 Len=21360 TSval=2008315257 TSecr=1039441953","","","","",""
"202","0.773191966","10.10.3.102","10.10.3.105","MPTCP","80","5201  >  53748 [ACK] Seq=1 Ack=592390 Win=592896 Len=0 TSval=1039441953 TSecr=2008315257","0.000010869","","","",""
"203","0.773350135","10.10.3.105","10.10.3.102","MPTCP","18604","53748  >  5201 [PSH, ACK] Seq=592390 Ack=1 Win=64256 Len=18512 TSval=2008315257 TSecr=1039441953","","","","",""
"204","0.773360600","10.10.3.102","10.10.3.105","MPTCP","80","5201  >  53748 [ACK] Seq=1 Ack=610902 Win=629888 Len=0 TSval=1039441953 TSecr=2008315257","0.000010465","","","",""
"205","0.773391378","10.10.3.105","10.10.3.102","MPTCP","4364","53748  >  5201 [PSH, ACK] Seq=610902 Ack=1 Win=64256 Len=4272 TSval=2008315257 TSecr=1039441953","","","","",""
"206","0.773398708","10.10.3.102","10.10.3.105","MPTCP","80","5201  >  53748 [ACK] Seq=1 Ack=615174 Win=638464 Len=0 TSval=1039441953 TSecr=2008315257","0.000007330","","","",""
"207","0.773503320","10.10.3.105","10.10.3.102","MPTCP","14332","53748  >  5201 [PSH, ACK] Seq=615174 Ack=1 Win=64256 Len=14240 TSval=2008315257 TSecr=1039441953","","","","",""
"208","0.773512069","10.10.3.102","10.10.3.105","MPTCP","80","5201  >  53748 [ACK] Seq=1 Ack=629414 Win=666880 Len=0 TSval=1039441953 TSecr=2008315257","0.000008749","","","",""
"209","0.773571695","10.10.3.105","10.10.3.102","MPTCP","7212","53748  >  5201 [PSH, ACK] Seq=629414 Ack=1 Win=64256 Len=7120 TSval=2008315257 TSecr=1039441953","","","","",""
"210","0.773579752","10.10.3.102","10.10.3.105","MPTCP","80","5201  >  53748 [ACK] Seq=1 Ack=636534 Win=681216 Len=0 TSval=1039441953 TSecr=2008315257","0.000008057","","","",""
"211","0.773732984","10.10.3.105","10.10.3.102","MPTCP","18604","53748  >  5201 [PSH, ACK] Seq=636534 Ack=1 Win=64256 Len=18512 TSval=2008315258 TSecr=1039441953","","","","",""
"212","0.773742969","10.10.3.102","10.10.3.105","MPTCP","80","5201  >  53748 [ACK] Seq=1 Ack=655046 Win=718208 Len=0 TSval=1039441953 TSecr=2008315258","0.000009985","","","",""
"213","0.773778716","10.10.3.105","10.10.3.102","MPTCP","4364","53748  >  5201 [PSH, ACK] Seq=655046 Ack=1 Win=64256 Len=4272 TSval=2008315258 TSecr=1039441953","","","","",""
"214","0.773786552","10.10.3.102","10.10.3.105","MPTCP","80","5201  >  53748 [ACK] Seq=1 Ack=659318 Win=726784 Len=0 TSval=1039441954 TSecr=2008315258","0.000007836","","","",""
"215","0.773941267","10.10.3.105","10.10.3.102","MPTCP","21452","53748  >  5201 [PSH, ACK] Seq=659318 Ack=1 Win=64256 Len=21360 TSval=2008315258 TSecr=1039441953","","","","",""
"216","0.773951784","10.10.3.102","10.10.3.105","MPTCP","80","5201  >  53748 [ACK] Seq=1 Ack=680678 Win=769408 Len=0 TSval=1039441954 TSecr=2008315258","0.000010517","","","",""
"217","0.774035867","10.10.3.105","10.10.3.102","MPTCP","11484","53748  >  5201 [PSH, ACK] Seq=680678 Ack=1 Win=64256 Len=11392 TSval=2008315258 TSecr=1039441953","","","","",""
"218","0.774058453","10.10.3.102","10.10.3.105","MPTCP","80","5201  >  53748 [ACK] Seq=1 Ack=692070 Win=792192 Len=0 TSval=1039441954 TSecr=2008315258","0.000022586","","","",""
"219","0.774134718","10.10.3.105","10.10.3.102","MPTCP","11484","53748  >  5201 [PSH, ACK] Seq=692070 Ack=1 Win=64256 Len=11392 TSval=2008315258 TSecr=1039441954","","","","",""
"220","0.774144043","10.10.3.102","10.10.3.105","MPTCP","80","5201  >  53748 [ACK] Seq=1 Ack=703462 Win=814976 Len=0 TSval=1039441954 TSecr=2008315258","0.000009325","","","",""
"221","0.774338299","10.10.3.105","10.10.3.102","MPTCP","21452","53748  >  5201 [PSH, ACK] Seq=703462 Ack=1 Win=64256 Len=21360 TSval=2008315258 TSecr=1039441954","","","","",""
"222","0.774347473","10.10.3.102","10.10.3.105","MPTCP","80","5201  >  53748 [ACK] Seq=1 Ack=724822 Win=857728 Len=0 TSval=1039441954 TSecr=2008315258","0.000009174","","","",""
"223","0.774520171","10.10.3.105","10.10.3.102","MPTCP","21452","53748  >  5201 [PSH, ACK] Seq=724822 Ack=1 Win=64256 Len=21360 TSval=2008315258 TSecr=1039441954","","","","",""
"224","0.774528840","10.10.3.102","10.10.3.105","MPTCP","80","5201  >  53748 [ACK] Seq=1 Ack=746182 Win=900480 Len=0 TSval=1039441954 TSecr=2008315258","0.000008669","","","",""
"225","0.774533119","10.10.3.105","10.10.3.102","MPTCP","1516","53748  >  5201 [ACK] Seq=746182 Ack=1 Win=64256 Len=1424 TSval=2008315258 TSecr=1039441954","","","","",""
"226","0.774538090","10.10.3.102","10.10.3.105","MPTCP","80","5201  >  53748 [ACK] Seq=1 Ack=747606 Win=903424 Len=0 TSval=1039441954 TSecr=2008315258","0.000004971","","","",""
"227","0.774592647","10.10.3.105","10.10.3.102","MPTCP","7212","53748  >  5201 [PSH, ACK] Seq=747606 Ack=1 Win=64256 Len=7120 TSval=2008315259 TSecr=1039441954","","","","",""
"228","0.774599263","10.10.3.102","10.10.3.105","MPTCP","80","5201  >  53748 [ACK] Seq=1 Ack=754726 Win=917632 Len=0 TSval=1039441954 TSecr=2008315259","0.000006616","","","",""
"229","0.774721106","10.10.3.105","10.10.3.102","MPTCP","14332","53748  >  5201 [PSH, ACK] Seq=754726 Ack=1 Win=64256 Len=14240 TSval=2008315259 TSecr=1039441954","","","","",""
"230","0.774728283","10.10.3.102","10.10.3.105","MPTCP","80","5201  >  53748 [ACK] Seq=1 Ack=768966 Win=946048 Len=0 TSval=1039441954 TSecr=2008315259","0.000007177","","","",""
"231","0.774905058","10.10.3.105","10.10.3.102","MPTCP","21452","53748  >  5201 [PSH, ACK] Seq=768966 Ack=1 Win=64256 Len=21360 TSval=2008315259 TSecr=1039441954","","","","",""
"232","0.774915070","10.10.3.102","10.10.3.105","MPTCP","80","5201  >  53748 [ACK] Seq=1 Ack=790326 Win=988800 Len=0 TSval=1039441955 TSecr=2008315259","0.000010012","","","",""
"233","0.775088985","10.10.3.105","10.10.3.102","MPTCP","21452","53748  >  5201 [PSH, ACK] Seq=790326 Ack=1 Win=64256 Len=21360 TSval=2008315259 TSecr=1039441954","","","","",""
"234","0.775100371","10.10.3.102","10.10.3.105","MPTCP","80","5201  >  53748 [ACK] Seq=1 Ack=811686 Win=1031552 Len=0 TSval=1039441955 TSecr=2008315259","0.000011386","","","",""
