"No.","Time","Source","Destination","Protocol","Length","Info","RTT","Lost Segement","Duplicate ","Retransmission","IDK"
"901","27.790859538","10.10.3.105","10.10.3.102","MPTCP","80","42132  >  5201 [SYN] Seq=0 Win=64240 Len=0 MSS=1460 SACK_PERM=1 TSval=2008132442 TSecr=0 WS=128","","","","",""
"902","27.790917411","10.10.3.102","10.10.3.105","MPTCP","88","5201  >  42132 [SYN, ACK] Seq=0 Ack=1 Win=65160 Len=0 MSS=1460 SACK_PERM=1 TSval=1039259138 TSecr=2008132442 WS=128","0.000057873","","","",""
"903","27.791243801","10.10.3.105","10.10.3.102","MPTCP","88","42132  >  5201 [ACK] Seq=1 Ack=1 Win=64256 Len=0 TSval=2008132442 TSecr=1039259138","0.000326390","","","",""
"904","27.791244388","10.10.3.105","10.10.3.102","MPTCP","129","42132  >  5201 [PSH, ACK] Seq=1 Ack=1 Win=64256 Len=37 TSval=2008132442 TSecr=1039259138","","","","",""
"905","27.791392342","10.10.3.102","10.10.3.105","MPTCP","80","5201  >  42132 [ACK] Seq=1 Ack=38 Win=65152 Len=0 TSval=1039259139 TSecr=2008132442","0.000147954","","","",""
"906","27.791514300","10.10.3.102","10.10.3.105","MPTCP","97","5201  >  42132 [PSH, ACK] Seq=1 Ack=38 Win=65152 Len=1 TSval=1039259139 TSecr=2008132442","","","","",""
"907","27.791560434","10.10.3.102","10.10.3.105","MPTCP","84","[TCP Dup ACK 905#1] 5201  >  42132 [ACK] Seq=2 Ack=38 Win=65152 Len=0 TSval=1039259139 TSecr=2008132442","","","â\234\223","","â\234\223"
"908","27.791579388","10.10.3.105","10.10.3.102","MPTCP","80","42132  >  5201 [ACK] Seq=38 Ack=2 Win=64256 Len=0 TSval=2008132443 TSecr=1039259139","0.000065088","","","",""
"909","27.791665010","10.10.3.105","10.10.3.102","MPTCP","76","[TCP Dup ACK 908#1] 42132  >  5201 [ACK] Seq=38 Ack=2 Win=64256 Len=0 TSval=2008132443 TSecr=1039259139","","","â\234\223","","â\234\223"
"910","27.791775133","10.10.3.105","10.10.3.102","MPTCP","100","42132  >  5201 [PSH, ACK] Seq=38 Ack=2 Win=64256 Len=4 TSval=2008132443 TSecr=1039259139","","","","",""
"911","27.791881742","10.10.3.62","10.10.3.102","MPTCP","88","47235  >  5201 [SYN] Seq=0 Win=64256 Len=0 MSS=1460 SACK_PERM=1 TSval=3345299647 TSecr=0 WS=128","","","","",""
"912","27.791930682","10.10.3.102","10.10.3.62","MPTCP","92","5201  >  47235 [SYN, ACK] Seq=0 Ack=1 Win=65160 Len=0 MSS=1460 SACK_PERM=1 TSval=2492077420 TSecr=3345299647 WS=128","0.000048940","","","",""
"913","27.794697388","10.10.3.105","10.10.3.59","MPTCP","88","42205  >  5201 [SYN] Seq=0 Win=64256 Len=0 MSS=1460 SACK_PERM=1 TSval=937387775 TSecr=0 WS=128","","","","",""
"914","27.794763051","10.10.3.59","10.10.3.105","MPTCP","92","5201  >  42205 [SYN, ACK] Seq=0 Ack=1 Win=65160 Len=0 MSS=1460 SACK_PERM=1 TSval=1399367520 TSecr=937387775 WS=128","0.000065663","","","",""
"915","27.797830919","10.10.3.105","10.10.3.59","MPTCP","92","42205  >  5201 [ACK] Seq=1 Ack=1 Win=64256 Len=0 TSval=937387779 TSecr=1399367520","0.003067868","","","",""
"916","27.797946924","10.10.3.59","10.10.3.105","MPTCP","80","[TCP Window Update] 5201  >  42205 [ACK] Seq=1 Ack=1 Win=65280 Len=0 TSval=1399367523 TSecr=937387779","","","","","â\234\223"
"917","27.833493026","10.10.3.102","10.10.3.105","MPTCP","80","5201  >  42132 [ACK] Seq=2 Ack=42 Win=65280 Len=0 TSval=1039259181 TSecr=2008132443","0.041717893","","","",""
"918","27.834052187","10.10.3.105","10.10.3.102","MPTCP","196","42132  >  5201 [PSH, ACK] Seq=42 Ack=2 Win=64256 Len=100 TSval=2008132485 TSecr=1039259181","","","","",""
"919","27.834104129","10.10.3.102","10.10.3.105","MPTCP","80","5201  >  42132 [ACK] Seq=2 Ack=142 Win=65280 Len=0 TSval=1039259181 TSecr=2008132485","0.000051942","","","",""
"920","27.834241142","10.10.3.102","10.10.3.105","MPTCP","97","5201  >  42132 [PSH, ACK] Seq=2 Ack=142 Win=65280 Len=1 TSval=1039259181 TSecr=2008132485","","","","",""
"921","27.834574757","10.10.3.105","10.10.3.102","MPTCP","80","42148  >  5201 [SYN] Seq=0 Win=64240 Len=0 MSS=1460 SACK_PERM=1 TSval=2008132485 TSecr=0 WS=128","","","","",""
"922","27.834619781","10.10.3.102","10.10.3.105","MPTCP","88","5201  >  42148 [SYN, ACK] Seq=0 Ack=1 Win=65160 Len=0 MSS=1460 SACK_PERM=1 TSval=1039259182 TSecr=2008132485 WS=128","0.000045024","","","",""
"924","27.834771041","10.10.3.105","10.10.3.102","MPTCP","88","42148  >  5201 [ACK] Seq=1 Ack=1 Win=64256 Len=0 TSval=2008132486 TSecr=1039259182","0.000151260","","","",""
"925","27.834890250","10.10.3.105","10.10.3.102","MPTCP","129","42148  >  5201 [PSH, ACK] Seq=1 Ack=1 Win=64256 Len=37 TSval=2008132486 TSecr=1039259182","","","","",""
"926","27.834914065","10.10.3.102","10.10.3.105","MPTCP","80","5201  >  42148 [ACK] Seq=1 Ack=38 Win=65152 Len=0 TSval=1039259182 TSecr=2008132486","0.000023815","","","",""
"927","27.835070316","10.10.3.102","10.10.3.105","MPTCP","84","5201  >  42148 [ACK] Seq=1 Ack=38 Win=65152 Len=0 TSval=1039259182 TSecr=2008132486","","","","",""
"928","27.835133859","10.10.3.105","10.10.3.102","MPTCP","76","42148  >  5201 [ACK] Seq=38 Ack=1 Win=64256 Len=0 TSval=2008132486 TSecr=1039259182","","","","",""
"929","27.835823387","10.10.3.105","10.10.3.59","MPTCP","88","39867  >  5201 [SYN] Seq=0 Win=64256 Len=0 MSS=1460 SACK_PERM=1 TSval=937387818 TSecr=0 WS=128","","","","",""
"930","27.835872317","10.10.3.59","10.10.3.105","MPTCP","92","5201  >  39867 [SYN, ACK] Seq=0 Ack=1 Win=65160 Len=0 MSS=1460 SACK_PERM=1 TSval=1399367561 TSecr=937387818 WS=128","0.000048930","","","",""
"931","27.835980156","10.10.3.62","10.10.3.102","MPTCP","88","53887  >  5201 [SYN] Seq=0 Win=64256 Len=0 MSS=1460 SACK_PERM=1 TSval=3345299691 TSecr=0 WS=128","","","","",""
"932","27.836023750","10.10.3.102","10.10.3.62","MPTCP","92","5201  >  53887 [SYN, ACK] Seq=0 Ack=1 Win=65160 Len=0 MSS=1460 SACK_PERM=1 TSval=2492077464 TSecr=3345299691 WS=128","0.000043594","","","",""
"934","27.843727842","10.10.3.105","10.10.3.59","MPTCP","92","39867  >  5201 [ACK] Seq=1 Ack=1 Win=64256 Len=0 TSval=937387823 TSecr=1399367561","0.007855525","","","",""
"935","27.843843080","10.10.3.59","10.10.3.105","MPTCP","80","[TCP Window Update] 5201  >  39867 [ACK] Seq=1 Ack=1 Win=65280 Len=0 TSval=1399367569 TSecr=937387823","","","","","â\234\223"
"938","27.877605893","10.10.3.105","10.10.3.102","MPTCP","80","42132  >  5201 [ACK] Seq=142 Ack=3 Win=64256 Len=0 TSval=2008132529 TSecr=1039259181","0.043364751","","","",""
"939","27.877655276","10.10.3.102","10.10.3.105","MPTCP","98","5201  >  42132 [PSH, ACK] Seq=3 Ack=142 Win=65280 Len=2 TSval=1039259225 TSecr=2008132529","","","","",""
"940","27.877773319","10.10.3.105","10.10.3.102","MPTCP","80","42132  >  5201 [ACK] Seq=142 Ack=5 Win=64256 Len=0 TSval=2008132529 TSecr=1039259225","0.000118043","","","",""
"941","27.877886174","10.10.3.105","10.10.3.102","MPTCP","7212","42148  >  5201 [PSH, ACK] Seq=38 Ack=1 Win=64256 Len=7120 TSval=2008132529 TSecr=1039259182","","","","",""
"942","27.877912492","10.10.3.102","10.10.3.105","MPTCP","80","5201  >  42148 [ACK] Seq=1 Ack=7158 Win=60672 Len=0 TSval=1039259225 TSecr=2008132529","0.000026318","","","",""
"943","27.877949576","10.10.3.105","10.10.3.102","MPTCP","7212","42148  >  5201 [PSH, ACK] Seq=7158 Ack=1 Win=64256 Len=7120 TSval=2008132529 TSecr=1039259182","","","","",""
"944","27.877963337","10.10.3.102","10.10.3.105","MPTCP","80","5201  >  42148 [ACK] Seq=1 Ack=14278 Win=55680 Len=0 TSval=1039259225 TSecr=2008132529","0.000013761","","","",""
"945","27.878177450","10.10.3.105","10.10.3.102","MPTCP","10060","42148  >  5201 [PSH, ACK] Seq=14278 Ack=1 Win=64256 Len=9968 TSval=2008132529 TSecr=1039259225","","","","",""
"946","27.878210057","10.10.3.102","10.10.3.105","MPTCP","80","5201  >  42148 [ACK] Seq=1 Ack=24246 Win=58752 Len=0 TSval=1039259225 TSecr=2008132529","0.000032607","","","",""
"947","27.878257785","10.10.3.105","10.10.3.102","MPTCP","7212","42148  >  5201 [PSH, ACK] Seq=24246 Ack=1 Win=64256 Len=7120 TSval=2008132529 TSecr=1039259225","","","","",""
"948","27.878270559","10.10.3.102","10.10.3.105","MPTCP","80","5201  >  42148 [ACK] Seq=1 Ack=31366 Win=53760 Len=0 TSval=1039259226 TSecr=2008132529","0.000012774","","","",""
"949","27.878306525","10.10.3.105","10.10.3.102","MPTCP","11484","42148  >  5201 [PSH, ACK] Seq=31366 Ack=1 Win=64256 Len=11392 TSval=2008132529 TSecr=1039259225","","","","",""
"950","27.878321411","10.10.3.102","10.10.3.105","MPTCP","80","5201  >  42148 [ACK] Seq=1 Ack=42758 Win=86912 Len=0 TSval=1039259226 TSecr=2008132529","0.000014886","","","",""
"951","27.878511413","10.10.3.105","10.10.3.102","MPTCP","18604","42148  >  5201 [PSH, ACK] Seq=42758 Ack=1 Win=64256 Len=18512 TSval=2008132529 TSecr=1039259225","","","","",""
"952","27.878528483","10.10.3.102","10.10.3.105","MPTCP","80","5201  >  42148 [ACK] Seq=1 Ack=61270 Win=123904 Len=0 TSval=1039259226 TSecr=2008132529","0.000017070","","","",""
"953","27.878536718","10.10.3.105","10.10.3.102","MPTCP","1516","42148  >  5201 [ACK] Seq=61270 Ack=1 Win=64256 Len=1424 TSval=2008132529 TSecr=1039259225","","","","",""
"954","27.878546179","10.10.3.102","10.10.3.105","MPTCP","80","5201  >  42148 [ACK] Seq=1 Ack=62694 Win=126848 Len=0 TSval=1039259226 TSecr=2008132529","0.000009461","","","",""
"955","27.878580725","10.10.3.105","10.10.3.102","MPTCP","2716","42148  >  5201 [PSH, ACK] Seq=62694 Ack=1 Win=64256 Len=2624 TSval=2008132529 TSecr=1039259226","","","","",""
"956","27.878591051","10.10.3.102","10.10.3.105","MPTCP","80","5201  >  42148 [ACK] Seq=1 Ack=65318 Win=132096 Len=0 TSval=1039259226 TSecr=2008132529","0.000010326","","","",""
"957","27.878794061","10.10.3.105","10.10.3.102","MPTCP","28572","42148  >  5201 [PSH, ACK] Seq=65318 Ack=1 Win=64256 Len=28480 TSval=2008132529 TSecr=1039259226","","","","",""
"958","27.878812079","10.10.3.102","10.10.3.105","MPTCP","80","5201  >  42148 [ACK] Seq=1 Ack=93798 Win=189056 Len=0 TSval=1039259226 TSecr=2008132529","0.000018018","","","",""
"959","27.878931850","10.10.3.105","10.10.3.102","MPTCP","14332","42148  >  5201 [PSH, ACK] Seq=93798 Ack=1 Win=64256 Len=14240 TSval=2008132530 TSecr=1039259226","","","","",""
"960","27.878945243","10.10.3.102","10.10.3.105","MPTCP","80","5201  >  42148 [ACK] Seq=1 Ack=108038 Win=217472 Len=0 TSval=1039259226 TSecr=2008132530","0.000013393","","","",""
"961","27.879177475","10.10.3.105","10.10.3.102","MPTCP","28572","42148  >  5201 [PSH, ACK] Seq=108038 Ack=1 Win=64256 Len=28480 TSval=2008132530 TSecr=1039259226","","","","",""
"962","27.879189376","10.10.3.105","10.10.3.59","MPTCP","1516","39867  >  5201 [ACK] Seq=1 Ack=1 Win=64256 Len=1424 TSval=937387861 TSecr=1399367569","","","","",""
"963","27.879195854","10.10.3.102","10.10.3.105","MPTCP","80","5201  >  42148 [ACK] Seq=1 Ack=136518 Win=242304 Len=0 TSval=1039259226 TSecr=2008132530","0.000018379","","","",""
"964","27.879227217","10.10.3.59","10.10.3.105","MPTCP","80","5201  >  39867 [ACK] Seq=1 Ack=1425 Win=240768 Len=0 TSval=1399367604 TSecr=937387861","0.000037841","","","",""
"965","27.879461874","10.10.3.105","10.10.3.102","MPTCP","32844","42148  >  5201 [PSH, ACK] Seq=136518 Ack=1 Win=64256 Len=32752 TSval=2008132530 TSecr=1039259226","","","","",""
"966","27.879481492","10.10.3.102","10.10.3.105","MPTCP","80","5201  >  42148 [ACK] Seq=1 Ack=169270 Win=240768 Len=0 TSval=1039259227 TSecr=2008132530","0.000019618","","","",""
"967","27.879971513","10.10.3.105","10.10.3.102","MPTCP","61324","42148  >  5201 [PSH, ACK] Seq=169270 Ack=1 Win=64256 Len=61232 TSval=2008132530 TSecr=1039259226","","","","",""
"968","27.879999027","10.10.3.102","10.10.3.105","MPTCP","80","5201  >  42148 [ACK] Seq=1 Ack=230502 Win=240768 Len=0 TSval=1039259227 TSecr=2008132530","0.000027514","","","",""
"969","27.880008796","10.10.3.105","10.10.3.102","MPTCP","1516","42148  >  5201 [ACK] Seq=230502 Ack=1 Win=64256 Len=1424 TSval=2008132530 TSecr=1039259226","","","","",""
"970","27.880017570","10.10.3.102","10.10.3.105","MPTCP","80","5201  >  42148 [ACK] Seq=1 Ack=231926 Win=240768 Len=0 TSval=1039259227 TSecr=2008132530","0.000008774","","","",""
"971","27.880470418","10.10.3.105","10.10.3.102","MPTCP","55628","42148  >  5201 [PSH, ACK] Seq=231926 Ack=1 Win=64256 Len=55536 TSval=2008132530 TSecr=1039259226","","","","",""
"972","27.880509639","10.10.3.102","10.10.3.105","MPTCP","80","5201  >  42148 [ACK] Seq=1 Ack=287462 Win=240768 Len=0 TSval=1039259228 TSecr=2008132530","0.000039221","","","",""
"973","27.880527819","10.10.3.105","10.10.3.102","MPTCP","7212","42148  >  5201 [PSH, ACK] Seq=287462 Ack=1 Win=64256 Len=7120 TSval=2008132531 TSecr=1039259227","","","","",""
"974","27.880538757","10.10.3.102","10.10.3.105","MPTCP","80","5201  >  42148 [ACK] Seq=1 Ack=294582 Win=240768 Len=0 TSval=1039259228 TSecr=2008132531","0.000010938","","","",""
"975","27.880600660","10.10.3.105","10.10.3.102","MPTCP","8492","42148  >  5201 [PSH, ACK] Seq=294582 Ack=1 Win=64256 Len=8400 TSval=2008132531 TSecr=1039259227","","","","",""
"976","27.880615151","10.10.3.102","10.10.3.105","MPTCP","80","5201  >  42148 [ACK] Seq=1 Ack=302982 Win=240768 Len=0 TSval=1039259228 TSecr=2008132531","0.000014491","","","",""
"977","27.884033010","10.10.3.105","10.10.3.59","MPTCP","1516","39867  >  5201 [ACK] Seq=1425 Ack=1 Win=64256 Len=1424 TSval=937387861 TSecr=1399367569","","","","",""
"978","27.884069608","10.10.3.59","10.10.3.105","MPTCP","80","5201  >  39867 [ACK] Seq=1 Ack=2849 Win=239488 Len=0 TSval=1399367609 TSecr=937387861","0.000036598","","","",""
"979","27.894012989","10.10.3.105","10.10.3.102","MPTCP","31572","42148  >  5201 [PSH, ACK] Seq=302982 Ack=1 Win=64256 Len=31480 TSval=2008132545 TSecr=1039259228","","","","",""
"980","27.894078510","10.10.3.102","10.10.3.105","MPTCP","80","5201  >  42148 [ACK] Seq=1 Ack=334462 Win=209408 Len=0 TSval=1039259241 TSecr=2008132545","0.000065521","","","",""
"981","27.894928884","10.10.3.105","10.10.3.102","MPTCP","62748","42148  >  5201 [PSH, ACK] Seq=334462 Ack=1 Win=64256 Len=62656 TSval=2008132545 TSecr=1039259241","","","","",""
"982","27.894978894","10.10.3.102","10.10.3.105","MPTCP","80","5201  >  42148 [ACK] Seq=1 Ack=397118 Win=248320 Len=0 TSval=1039259242 TSecr=2008132545","0.000050010","","","",""
"983","27.895479412","10.10.3.105","10.10.3.102","MPTCP","62748","42148  >  5201 [PSH, ACK] Seq=397118 Ack=1 Win=64256 Len=62656 TSval=2008132545 TSecr=1039259241","","","","",""
"984","27.895510535","10.10.3.102","10.10.3.105","MPTCP","80","5201  >  42148 [ACK] Seq=1 Ack=459774 Win=248320 Len=0 TSval=1039259243 TSecr=2008132545","0.000031123","","","",""
"985","27.895750481","10.10.3.105","10.10.3.102","MPTCP","32844","42148  >  5201 [PSH, ACK] Seq=459774 Ack=1 Win=64256 Len=32752 TSval=2008132546 TSecr=1039259241","","","","",""
"986","27.895783041","10.10.3.102","10.10.3.105","MPTCP","80","5201  >  42148 [ACK] Seq=1 Ack=492526 Win=268672 Len=0 TSval=1039259243 TSecr=2008132546","0.000032560","","","",""
"987","27.896023707","10.10.3.105","10.10.3.102","MPTCP","29996","42148  >  5201 [PSH, ACK] Seq=492526 Ack=1 Win=64256 Len=29904 TSval=2008132546 TSecr=1039259242","","","","",""
"988","27.896052673","10.10.3.102","10.10.3.105","MPTCP","80","5201  >  42148 [ACK] Seq=1 Ack=522430 Win=270592 Len=0 TSval=1039259243 TSecr=2008132546","0.000028966","","","",""
"989","27.896569964","10.10.3.105","10.10.3.102","MPTCP","62748","42148  >  5201 [PSH, ACK] Seq=522430 Ack=1 Win=64256 Len=62656 TSval=2008132547 TSecr=1039259243","","","","",""
"990","27.896604932","10.10.3.102","10.10.3.105","MPTCP","80","5201  >  42148 [ACK] Seq=1 Ack=585086 Win=248320 Len=0 TSval=1039259244 TSecr=2008132547","0.000034968","","","",""
"991","27.897165993","10.10.3.105","10.10.3.102","MPTCP","62748","42148  >  5201 [PSH, ACK] Seq=585086 Ack=1 Win=64256 Len=62656 TSval=2008132547 TSecr=1039259243","","","","",""
"992","27.897199668","10.10.3.102","10.10.3.105","MPTCP","80","5201  >  42148 [ACK] Seq=1 Ack=647742 Win=248320 Len=0 TSval=1039259244 TSecr=2008132547","0.000033675","","","",""
"993","27.897260653","10.10.3.105","10.10.3.102","MPTCP","12908","42148  >  5201 [ACK] Seq=647742 Ack=1 Win=64256 Len=12816 TSval=2008132548 TSecr=1039259244","","","","",""
"994","27.897276518","10.10.3.102","10.10.3.105","MPTCP","80","5201  >  42148 [ACK] Seq=1 Ack=660558 Win=239616 Len=0 TSval=1039259245 TSecr=2008132548","0.000015865","","","",""
"995","27.897702495","10.10.3.105","10.10.3.102","MPTCP","49932","42148  >  5201 [PSH, ACK] Seq=660558 Ack=1 Win=64256 Len=49840 TSval=2008132548 TSecr=1039259244","","","","",""
"996","27.897727268","10.10.3.102","10.10.3.105","MPTCP","80","5201  >  42148 [ACK] Seq=1 Ack=710398 Win=257152 Len=0 TSval=1039259245 TSecr=2008132548","0.000024773","","","",""
"997","27.897835920","10.10.3.105","10.10.3.59","MPTCP","1516","39867  >  5201 [ACK] Seq=2849 Ack=1 Win=64256 Len=1424 TSval=937387861 TSecr=1399367569","","","","",""
"998","27.897863485","10.10.3.59","10.10.3.105","MPTCP","80","5201  >  39867 [ACK] Seq=1 Ack=4273 Win=257152 Len=0 TSval=1399367623 TSecr=937387861","0.000027565","","","",""
"999","27.898131982","10.10.3.105","10.10.3.102","MPTCP","50892","42148  >  5201 [PSH, ACK] Seq=710398 Ack=1 Win=64256 Len=50800 TSval=2008132548 TSecr=1039259244","","","","",""
"1000","27.898165061","10.10.3.102","10.10.3.105","MPTCP","80","5201  >  42148 [ACK] Seq=1 Ack=761198 Win=256384 Len=0 TSval=1039259245 TSecr=2008132548","0.000033079","","","",""
"1001","27.898665029","10.10.3.105","10.10.3.102","MPTCP","59900","42148  >  5201 [PSH, ACK] Seq=761198 Ack=1 Win=64256 Len=59808 TSval=2008132548 TSecr=1039259244","","","","",""
"1002","27.898697998","10.10.3.102","10.10.3.105","MPTCP","80","5201  >  42148 [ACK] Seq=1 Ack=821006 Win=256384 Len=0 TSval=1039259246 TSecr=2008132548","0.000032969","","","",""
"1003","27.898716300","10.10.3.105","10.10.3.102","MPTCP","2940","42148  >  5201 [PSH, ACK] Seq=821006 Ack=1 Win=64256 Len=2848 TSval=2008132548 TSecr=1039259245","","","","",""
"1004","27.898727155","10.10.3.102","10.10.3.105","MPTCP","80","5201  >  42148 [ACK] Seq=1 Ack=823854 Win=256384 Len=0 TSval=1039259246 TSecr=2008132548","0.000010855","","","",""
"1005","27.899232744","10.10.3.105","10.10.3.102","MPTCP","62748","42148  >  5201 [PSH, ACK] Seq=823854 Ack=1 Win=64256 Len=62656 TSval=2008132549 TSecr=1039259245","","","","",""
"1006","27.899264957","10.10.3.102","10.10.3.105","MPTCP","80","5201  >  42148 [ACK] Seq=1 Ack=886510 Win=256384 Len=0 TSval=1039259247 TSecr=2008132549","0.000032213","","","",""
"1007","27.899757326","10.10.3.105","10.10.3.102","MPTCP","62748","42148  >  5201 [PSH, ACK] Seq=886510 Ack=1 Win=64256 Len=62656 TSval=2008132550 TSecr=1039259246","","","","",""
"1008","27.899790498","10.10.3.102","10.10.3.105","MPTCP","80","5201  >  42148 [ACK] Seq=1 Ack=949166 Win=256384 Len=0 TSval=1039259247 TSecr=2008132550","0.000033172","","","",""
"1009","27.900081242","10.10.3.105","10.10.3.102","MPTCP","36684","42148  >  5201 [PSH, ACK] Seq=949166 Ack=1 Win=64256 Len=36592 TSval=2008132550 TSecr=1039259247","","","","",""
"1010","27.900109316","10.10.3.102","10.10.3.105","MPTCP","80","5201  >  42148 [ACK] Seq=1 Ack=985758 Win=256384 Len=0 TSval=1039259247 TSecr=2008132550","0.000028074","","","",""
"1011","27.904337446","10.10.3.105","10.10.3.59","MPTCP","460","39867  >  5201 [PSH, ACK] Seq=4273 Ack=1 Win=64256 Len=368 TSval=937387861 TSecr=1399367569","","","","",""
"1012","27.904363418","10.10.3.59","10.10.3.105","MPTCP","80","5201  >  39867 [ACK] Seq=1 Ack=4641 Win=256896 Len=0 TSval=1399367630 TSecr=937387861","0.000025972","","","",""
"1013","27.908994156","10.10.3.105","10.10.3.59","MPTCP","460","[TCP Spurious Retransmission] 39867  >  5201 [PSH, ACK] Seq=4273 Ack=1 Win=64256 Len=368 TSval=937387877 TSecr=1399367604","","","","â\234\223","â\234\223"
"1014","27.909016263","10.10.3.59","10.10.3.105","MPTCP","92","[TCP Dup ACK 1012#1] 5201  >  39867 [ACK] Seq=1 Ack=4641 Win=256896 Len=0 TSval=1399367634 TSecr=937387877 SLE=4273 SRE=4641","0.000022107","","â\234\223","","â\234\223"
"1015","27.910058577","10.10.3.105","10.10.3.102","MPTCP","18516","42148  >  5201 [PSH, ACK] Seq=985758 Ack=1 Win=64256 Len=18424 TSval=2008132561 TSecr=1039259247","","","","",""
"1016","27.910095892","10.10.3.102","10.10.3.105","MPTCP","80","5201  >  42148 [ACK] Seq=1 Ack=1004182 Win=238464 Len=0 TSval=1039259257 TSecr=2008132561","0.000037315","","","",""
"1017","27.910396277","10.10.3.105","10.10.3.102","MPTCP","596","42148  >  5201 [PSH, ACK] Seq=1004182 Ack=1 Win=64256 Len=504 TSval=2008132561 TSecr=1039259257","","","","",""
"1018","27.910426771","10.10.3.102","10.10.3.105","MPTCP","80","5201  >  42148 [ACK] Seq=1 Ack=1004686 Win=238464 Len=0 TSval=1039259258 TSecr=2008132561","0.000030494","","","",""
"1019","27.917050577","10.10.3.105","10.10.3.59","MPTCP","1516","39867  >  5201 [ACK] Seq=4641 Ack=1 Win=64256 Len=1424 TSval=937387879 TSecr=1399367604","","","","",""
"1020","27.917090230","10.10.3.59","10.10.3.105","MPTCP","80","5201  >  39867 [ACK] Seq=1 Ack=6065 Win=255488 Len=0 TSval=1399367642 TSecr=937387879","0.000039653","","","",""
"1021","27.921670005","10.10.3.105","10.10.3.59","MPTCP","1516","39867  >  5201 [ACK] Seq=6065 Ack=1 Win=64256 Len=1424 TSval=937387879 TSecr=1399367604","","","","",""
"1022","27.921710598","10.10.3.59","10.10.3.105","MPTCP","80","5201  >  39867 [ACK] Seq=1 Ack=7489 Win=255488 Len=0 TSval=1399367647 TSecr=937387879","0.000040593","","","",""
"1023","27.925973976","10.10.3.105","10.10.3.102","MPTCP","100","42148  >  5201 [PSH, ACK] Seq=1004686 Ack=1 Win=64256 Len=8 TSval=2008132577 TSecr=1039259258","","","","",""
"1024","27.928918086","10.10.3.105","10.10.3.102","MPTCP","15756","42148  >  5201 [PSH, ACK] Seq=1004694 Ack=1 Win=64256 Len=15664 TSval=2008132580 TSecr=1039259258","","","","",""
"1025","27.928968032","10.10.3.102","10.10.3.105","MPTCP","80","5201  >  42148 [ACK] Seq=1 Ack=1020358 Win=255488 Len=0 TSval=1039259276 TSecr=2008132577","0.000049946","","","",""
"1026","27.929393917","10.10.3.105","10.10.3.102","MPTCP","1444","42148  >  5201 [PSH, ACK] Seq=1020358 Ack=1 Win=64256 Len=1352 TSval=2008132580 TSecr=1039259276","","","","",""
"1027","27.933715783","10.10.3.105","10.10.3.59","MPTCP","1516","39867  >  5201 [ACK] Seq=7489 Ack=1 Win=64256 Len=1424 TSval=937387879 TSecr=1399367604","","","","",""
"1028","27.933755971","10.10.3.59","10.10.3.105","MPTCP","80","5201  >  39867 [ACK] Seq=1 Ack=8913 Win=255488 Len=0 TSval=1399367659 TSecr=937387879","0.000040188","","","",""
"1029","27.946517377","10.10.3.105","10.10.3.59","MPTCP","1516","39867  >  5201 [ACK] Seq=8913 Ack=1 Win=64256 Len=1424 TSval=937387879 TSecr=1399367604","","","","",""
"1030","27.946557262","10.10.3.59","10.10.3.105","MPTCP","80","5201  >  39867 [ACK] Seq=1 Ack=10337 Win=255488 Len=0 TSval=1399367672 TSecr=937387879","0.000039885","","","",""
"1031","27.959847252","10.10.3.105","10.10.3.59","MPTCP","1516","39867  >  5201 [PSH, ACK] Seq=10337 Ack=1 Win=64256 Len=1424 TSval=937387879 TSecr=1399367604","","","","",""
"1032","27.959886030","10.10.3.59","10.10.3.105","MPTCP","80","5201  >  39867 [ACK] Seq=1 Ack=11761 Win=255488 Len=0 TSval=1399367685 TSecr=937387879","0.000038778","","","",""
"1034","27.973371897","10.10.3.102","10.10.3.105","MPTCP","80","5201  >  42148 [ACK] Seq=1 Ack=1021710 Win=255488 Len=0 TSval=1039259321 TSecr=2008132580","0.043977980","","","",""
"1035","27.973395236","10.10.3.105","10.10.3.59","MPTCP","1516","39867  >  5201 [ACK] Seq=11761 Ack=1 Win=64256 Len=1424 TSval=937387906 TSecr=1399367609","","","","",""
"1036","27.973429227","10.10.3.59","10.10.3.105","MPTCP","80","5201  >  39867 [ACK] Seq=1 Ack=13185 Win=255488 Len=0 TSval=1399367699 TSecr=937387906","0.000033991","","","",""
"1037","27.983600532","10.10.3.105","10.10.3.59","MPTCP","1516","39867  >  5201 [PSH, ACK] Seq=13185 Ack=1 Win=64256 Len=1424 TSval=937387906 TSecr=1399367609","","","","",""
"1038","27.983638833","10.10.3.59","10.10.3.105","MPTCP","80","5201  >  39867 [ACK] Seq=1 Ack=14609 Win=255488 Len=0 TSval=1399367709 TSecr=937387906","0.000038301","","","",""
"1039","27.992773293","10.10.3.105","10.10.3.59","MPTCP","1516","39867  >  5201 [ACK] Seq=14609 Ack=1 Win=64256 Len=1424 TSval=937387906 TSecr=1399367609","","","","",""
"1040","27.992801345","10.10.3.59","10.10.3.105","MPTCP","80","5201  >  39867 [ACK] Seq=1 Ack=16033 Win=255488 Len=0 TSval=1399367718 TSecr=937387906","0.000028052","","","",""
"1041","28.004762347","10.10.3.105","10.10.3.59","MPTCP","1516","39867  >  5201 [PSH, ACK] Seq=16033 Ack=1 Win=64256 Len=1424 TSval=937387906 TSecr=1399367609","","","","",""
"1042","28.004787405","10.10.3.59","10.10.3.105","MPTCP","80","5201  >  39867 [ACK] Seq=1 Ack=17457 Win=255488 Len=0 TSval=1399367730 TSecr=937387906","0.000025058","","","",""
"1043","28.017419985","10.10.3.105","10.10.3.59","MPTCP","1516","39867  >  5201 [ACK] Seq=17457 Ack=1 Win=64256 Len=1424 TSval=937387907 TSecr=1399367623","","","","",""
"1044","28.017440933","10.10.3.59","10.10.3.105","MPTCP","80","5201  >  39867 [ACK] Seq=1 Ack=18881 Win=255488 Len=0 TSval=1399367743 TSecr=937387907","0.000020948","","","",""
"1045","28.028741638","10.10.3.105","10.10.3.59","MPTCP","1516","39867  >  5201 [PSH, ACK] Seq=18881 Ack=1 Win=64256 Len=1424 TSval=937387907 TSecr=1399367623","","","","",""
"1046","28.028760408","10.10.3.59","10.10.3.105","MPTCP","80","5201  >  39867 [ACK] Seq=1 Ack=20305 Win=255488 Len=0 TSval=1399367754 TSecr=937387907","0.000018770","","","",""
"1047","28.040490345","10.10.3.105","10.10.3.59","MPTCP","1516","39867  >  5201 [ACK] Seq=20305 Ack=1 Win=64256 Len=1424 TSval=937387909 TSecr=1399367630","","","","",""
"1048","28.040510767","10.10.3.59","10.10.3.105","MPTCP","80","5201  >  39867 [ACK] Seq=1 Ack=21729 Win=255488 Len=0 TSval=1399367766 TSecr=937387909","0.000020422","","","",""
"1050","28.052432777","10.10.3.105","10.10.3.59","MPTCP","1516","39867  >  5201 [PSH, ACK] Seq=21729 Ack=1 Win=64256 Len=1424 TSval=937387909 TSecr=1399367630","","","","",""
"1051","28.052461147","10.10.3.59","10.10.3.105","MPTCP","80","5201  >  39867 [ACK] Seq=1 Ack=23153 Win=255360 Len=0 TSval=1399367778 TSecr=937387909","0.000028370","","","",""
"1052","28.064298951","10.10.3.105","10.10.3.59","MPTCP","1516","39867  >  5201 [ACK] Seq=23153 Ack=1 Win=64256 Len=1424 TSval=937387912 TSecr=1399367642","","","","",""
"1053","28.064329728","10.10.3.59","10.10.3.105","MPTCP","80","5201  >  39867 [ACK] Seq=1 Ack=24577 Win=254080 Len=0 TSval=1399367790 TSecr=937387912","0.000030777","","","",""
"1054","28.066318343","10.10.3.105","10.10.3.102","MPTCP","196","42148  >  5201 [PSH, ACK] Seq=1021710 Ack=1 Win=64256 Len=104 TSval=2008132717 TSecr=1039259321","","","","",""
"1055","28.076091866","10.10.3.105","10.10.3.59","MPTCP","1516","39867  >  5201 [PSH, ACK] Seq=24577 Ack=1 Win=64256 Len=1424 TSval=937387912 TSecr=1399367642","","","","",""
"1056","28.076129697","10.10.3.59","10.10.3.105","MPTCP","80","5201  >  39867 [ACK] Seq=1 Ack=26001 Win=252672 Len=0 TSval=1399367801 TSecr=937387912","0.000037831","","","",""
"1057","28.087732118","10.10.3.105","10.10.3.59","MPTCP","1516","39867  >  5201 [ACK] Seq=26001 Ack=1 Win=64256 Len=1424 TSval=937387914 TSecr=1399367647","","","","",""
"1058","28.087756801","10.10.3.59","10.10.3.105","MPTCP","80","5201  >  39867 [ACK] Seq=1 Ack=27425 Win=251264 Len=0 TSval=1399367813 TSecr=937387914","0.000024683","","","",""
"1059","28.103598190","10.10.3.105","10.10.3.59","MPTCP","1516","39867  >  5201 [PSH, ACK] Seq=27425 Ack=1 Win=64256 Len=1424 TSval=937387914 TSecr=1399367647","","","","",""
"1060","28.103625873","10.10.3.59","10.10.3.105","MPTCP","80","5201  >  39867 [ACK] Seq=1 Ack=28849 Win=249856 Len=0 TSval=1399367829 TSecr=937387914","0.000027683","","","",""
"1061","28.109248891","10.10.3.102","10.10.3.105","MPTCP","80","5201  >  42148 [ACK] Seq=1 Ack=1021814 Win=290304 Len=0 TSval=1039259457 TSecr=2008132717","0.042930548","","","",""
"1062","28.110049342","10.10.3.105","10.10.3.102","MPTCP","40588","42148  >  5201 [PSH, ACK] Seq=1021814 Ack=1 Win=64256 Len=40496 TSval=2008132761 TSecr=1039259457","","","","",""
"1063","28.110071641","10.10.3.102","10.10.3.105","MPTCP","80","5201  >  42148 [ACK] Seq=1 Ack=1062310 Win=371328 Len=0 TSval=1039259457 TSecr=2008132761","0.000022299","","","",""
"1064","28.110904019","10.10.3.105","10.10.3.102","MPTCP","62748","42148  >  5201 [PSH, ACK] Seq=1062310 Ack=1 Win=64256 Len=62656 TSval=2008132761 TSecr=1039259457","","","","",""
"1065","28.110917389","10.10.3.102","10.10.3.105","MPTCP","80","5201  >  42148 [ACK] Seq=1 Ack=1124966 Win=496640 Len=0 TSval=1039259458 TSecr=2008132761","0.000013370","","","",""
"1066","28.111079809","10.10.3.105","10.10.3.102","MPTCP","18460","42148  >  5201 [PSH, ACK] Seq=1124966 Ack=1 Win=64256 Len=18368 TSval=2008132761 TSecr=1039259457","","","","",""
"1067","28.111086858","10.10.3.102","10.10.3.105","MPTCP","80","5201  >  42148 [ACK] Seq=1 Ack=1143334 Win=533376 Len=0 TSval=1039259458 TSecr=2008132761","0.000007049","","","",""
"1068","28.111637866","10.10.3.105","10.10.3.102","MPTCP","62748","42148  >  5201 [PSH, ACK] Seq=1143334 Ack=1 Win=64256 Len=62656 TSval=2008132762 TSecr=1039259458","","","","",""
"1069","28.111653518","10.10.3.102","10.10.3.105","MPTCP","80","5201  >  42148 [ACK] Seq=1 Ack=1205990 Win=658688 Len=0 TSval=1039259459 TSecr=2008132762","0.000015652","","","",""
"1070","28.111793922","10.10.3.105","10.10.3.102","MPTCP","17180","42148  >  5201 [PSH, ACK] Seq=1205990 Ack=1 Win=64256 Len=17088 TSval=2008132762 TSecr=1039259458","","","","",""
"1071","28.111800572","10.10.3.102","10.10.3.105","MPTCP","80","5201  >  42148 [ACK] Seq=1 Ack=1223078 Win=692864 Len=0 TSval=1039259459 TSecr=2008132762","0.000006650","","","",""
"1072","28.111824590","10.10.3.105","10.10.3.102","MPTCP","1428","42148  >  5201 [PSH, ACK] Seq=1223078 Ack=1 Win=64256 Len=1336 TSval=2008132763 TSecr=1039259459","","","","",""
"1073","28.111829090","10.10.3.102","10.10.3.105","MPTCP","80","5201  >  42148 [ACK] Seq=1 Ack=1224414 Win=695808 Len=0 TSval=1039259459 TSecr=2008132763","0.000004500","","","",""
"1074","28.112381183","10.10.3.105","10.10.3.102","MPTCP","62748","42148  >  5201 [PSH, ACK] Seq=1224414 Ack=1 Win=64256 Len=62656 TSval=2008132763 TSecr=1039259459","","","","",""
"1075","28.112393557","10.10.3.102","10.10.3.105","MPTCP","80","5201  >  42148 [ACK] Seq=1 Ack=1287070 Win=821120 Len=0 TSval=1039259460 TSecr=2008132763","0.000012374","","","",""
"1076","28.112942580","10.10.3.105","10.10.3.102","MPTCP","62748","42148  >  5201 [PSH, ACK] Seq=1287070 Ack=1 Win=64256 Len=62656 TSval=2008132763 TSecr=1039259459","","","","",""
"1077","28.112954642","10.10.3.102","10.10.3.105","MPTCP","80","5201  >  42148 [ACK] Seq=1 Ack=1349726 Win=946432 Len=0 TSval=1039259460 TSecr=2008132763","0.000012062","","","",""
"1078","28.112991130","10.10.3.105","10.10.3.59","MPTCP","1516","39867  >  5201 [ACK] Seq=28849 Ack=1 Win=64256 Len=1424 TSval=937387918 TSecr=1399367659","","","","",""
"1079","28.113006545","10.10.3.59","10.10.3.105","MPTCP","80","5201  >  39867 [ACK] Seq=1 Ack=30273 Win=944896 Len=0 TSval=1399367838 TSecr=937387918","0.000015415","","","",""
"1080","28.113251402","10.10.3.105","10.10.3.102","MPTCP","29996","42148  >  5201 [ACK] Seq=1349726 Ack=1 Win=64256 Len=29904 TSval=2008132763 TSecr=1039259459","","","","",""
"1081","28.113259451","10.10.3.102","10.10.3.105","MPTCP","80","5201  >  42148 [ACK] Seq=1 Ack=1379630 Win=1006208 Len=0 TSval=1039259461 TSecr=2008132763","0.000008049","","","",""
"1082","28.113523010","10.10.3.105","10.10.3.102","MPTCP","31420","42148  >  5201 [PSH, ACK] Seq=1379630 Ack=1 Win=64256 Len=31328 TSval=2008132763 TSecr=1039259459","","","","",""
"1083","28.113533827","10.10.3.102","10.10.3.105","MPTCP","80","5201  >  42148 [ACK] Seq=1 Ack=1410958 Win=1068928 Len=0 TSval=1039259461 TSecr=2008132763","0.000010817","","","",""
"1084","28.113580978","10.10.3.105","10.10.3.102","MPTCP","1516","42148  >  5201 [ACK] Seq=1410958 Ack=1 Win=64256 Len=1424 TSval=2008132764 TSecr=1039259460","","","","",""
"1085","28.113600389","10.10.3.102","10.10.3.105","MPTCP","80","5201  >  42148 [ACK] Seq=1 Ack=1412382 Win=1071744 Len=0 TSval=1039259461 TSecr=2008132764","0.000019411","","","",""
"1086","28.114094430","10.10.3.105","10.10.3.102","MPTCP","62748","42148  >  5201 [PSH, ACK] Seq=1412382 Ack=1 Win=64256 Len=62656 TSval=2008132764 TSecr=1039259460","","","","",""
"1087","28.114108679","10.10.3.102","10.10.3.105","MPTCP","80","5201  >  42148 [ACK] Seq=1 Ack=1475038 Win=1197056 Len=0 TSval=1039259461 TSecr=2008132764","0.000014249","","","",""
"1088","28.114680879","10.10.3.105","10.10.3.102","MPTCP","62748","42148  >  5201 [PSH, ACK] Seq=1475038 Ack=1 Win=64256 Len=62656 TSval=2008132764 TSecr=1039259461","","","","",""
"1089","28.114692000","10.10.3.102","10.10.3.105","MPTCP","80","5201  >  42148 [ACK] Seq=1 Ack=1537694 Win=1322368 Len=0 TSval=1039259462 TSecr=2008132764","0.000011121","","","",""
"1090","28.115019642","10.10.3.105","10.10.3.102","MPTCP","35692","42148  >  5201 [PSH, ACK] Seq=1537694 Ack=1 Win=64256 Len=35600 TSval=2008132765 TSecr=1039259461","","","","",""
"1091","28.115029334","10.10.3.102","10.10.3.105","MPTCP","80","5201  >  42148 [ACK] Seq=1 Ack=1573294 Win=1393536 Len=0 TSval=1039259462 TSecr=2008132765","0.000009692","","","",""
"1092","28.115260549","10.10.3.105","10.10.3.102","MPTCP","27148","42148  >  5201 [PSH, ACK] Seq=1573294 Ack=1 Win=64256 Len=27056 TSval=2008132766 TSecr=1039259461","","","","",""
"1093","28.115268404","10.10.3.102","10.10.3.105","MPTCP","80","5201  >  42148 [ACK] Seq=1 Ack=1600350 Win=1447680 Len=0 TSval=1039259463 TSecr=2008132766","0.000007855","","","",""
"1094","28.115797009","10.10.3.105","10.10.3.102","MPTCP","62748","42148  >  5201 [PSH, ACK] Seq=1600350 Ack=1 Win=64256 Len=62656 TSval=2008132766 TSecr=1039259461","","","","",""
"1095","28.115810292","10.10.3.102","10.10.3.105","MPTCP","80","5201  >  42148 [ACK] Seq=1 Ack=1663006 Win=1572992 Len=0 TSval=1039259463 TSecr=2008132766","0.000013283","","","",""
"1096","28.115886649","10.10.3.105","10.10.3.102","MPTCP","11484","42148  >  5201 [PSH, ACK] Seq=1663006 Ack=1 Win=64256 Len=11392 TSval=2008132766 TSecr=1039259463","","","","",""
"1097","28.115891995","10.10.3.102","10.10.3.105","MPTCP","80","5201  >  42148 [ACK] Seq=1 Ack=1674398 Win=1595776 Len=0 TSval=1039259463 TSecr=2008132766","0.000005346","","","",""
"1098","28.116328824","10.10.3.105","10.10.3.102","MPTCP","51356","42148  >  5201 [PSH, ACK] Seq=1674398 Ack=1 Win=64256 Len=51264 TSval=2008132767 TSecr=1039259463","","","","",""
"1099","28.116338711","10.10.3.102","10.10.3.105","MPTCP","80","5201  >  42148 [ACK] Seq=1 Ack=1725662 Win=1698304 Len=0 TSval=1039259464 TSecr=2008132767","0.000009887","","","",""
"1100","28.116887029","10.10.3.105","10.10.3.102","MPTCP","62748","42148  >  5201 [PSH, ACK] Seq=1725662 Ack=1 Win=64256 Len=62656 TSval=2008132767 TSecr=1039259463","","","","",""
"1101","28.116898628","10.10.3.102","10.10.3.105","MPTCP","80","5201  >  42148 [ACK] Seq=1 Ack=1788318 Win=1823616 Len=0 TSval=1039259464 TSecr=2008132767","0.000011599","","","",""
"1102","28.116972869","10.10.3.105","10.10.3.102","MPTCP","11484","42148  >  5201 [PSH, ACK] Seq=1788318 Ack=1 Win=64256 Len=11392 TSval=2008132767 TSecr=1039259463","","","","",""
"1103","28.116977784","10.10.3.102","10.10.3.105","MPTCP","80","5201  >  42148 [ACK] Seq=1 Ack=1799710 Win=1846400 Len=0 TSval=1039259464 TSecr=2008132767","0.000004915","","","",""
"1104","28.117253891","10.10.3.105","10.10.3.102","MPTCP","32844","42148  >  5201 [ACK] Seq=1799710 Ack=1 Win=64256 Len=32752 TSval=2008132767 TSecr=1039259464","","","","",""
"1105","28.117262750","10.10.3.102","10.10.3.105","MPTCP","80","5201  >  42148 [ACK] Seq=1 Ack=1832462 Win=1911936 Len=0 TSval=1039259465 TSecr=2008132767","0.000008859","","","",""
"1106","28.117425181","10.10.3.105","10.10.3.102","MPTCP","18604","42148  >  5201 [PSH, ACK] Seq=1832462 Ack=1 Win=64256 Len=18512 TSval=2008132767 TSecr=1039259464","","","","",""
"1107","28.117431764","10.10.3.102","10.10.3.105","MPTCP","80","5201  >  42148 [ACK] Seq=1 Ack=1850974 Win=1948928 Len=0 TSval=1039259465 TSecr=2008132767","0.000006583","","","",""
"1108","28.117962056","10.10.3.105","10.10.3.102","MPTCP","62748","42148  >  5201 [PSH, ACK] Seq=1850974 Ack=1 Win=64256 Len=62656 TSval=2008132768 TSecr=1039259464","","","","",""
"1109","28.117975346","10.10.3.102","10.10.3.105","MPTCP","80","5201  >  42148 [ACK] Seq=1 Ack=1913630 Win=2074240 Len=0 TSval=1039259465 TSecr=2008132768","0.000013290","","","",""
"1110","28.118504825","10.10.3.105","10.10.3.102","MPTCP","62748","42148  >  5201 [PSH, ACK] Seq=1913630 Ack=1 Win=64256 Len=62656 TSval=2008132768 TSecr=1039259464","","","","",""
"1111","28.118517020","10.10.3.102","10.10.3.105","MPTCP","80","5201  >  42148 [ACK] Seq=1 Ack=1976286 Win=2199552 Len=0 TSval=1039259466 TSecr=2008132768","0.000012195","","","",""
"1112","28.118703303","10.10.3.105","10.10.3.102","MPTCP","22188","42148  >  5201 [PSH, ACK] Seq=1976286 Ack=1 Win=64256 Len=22096 TSval=2008132769 TSecr=1039259465","","","","",""
"1113","28.118710867","10.10.3.102","10.10.3.105","MPTCP","80","5201  >  42148 [ACK] Seq=1 Ack=1998382 Win=2243712 Len=0 TSval=1039259466 TSecr=2008132769","0.000007564","","","",""
"1114","28.124938959","10.10.3.105","10.10.3.59","MPTCP","1516","39867  >  5201 [PSH, ACK] Seq=30273 Ack=1 Win=64256 Len=1424 TSval=937387918 TSecr=1399367659","","","","",""
"1115","28.124958249","10.10.3.59","10.10.3.105","MPTCP","80","5201  >  39867 [ACK] Seq=1 Ack=31697 Win=2242176 Len=0 TSval=1399367850 TSecr=937387918","0.000019290","","","",""
"1116","28.135437592","10.10.3.105","10.10.3.59","MPTCP","1516","39867  >  5201 [ACK] Seq=31697 Ack=1 Win=64256 Len=1424 TSval=937387933 TSecr=1399367672","","","","",""
"1117","28.135482475","10.10.3.59","10.10.3.105","MPTCP","80","5201  >  39867 [ACK] Seq=1 Ack=33121 Win=2240896 Len=0 TSval=1399367861 TSecr=937387933","0.000044883","","","",""
"1118","28.150962159","10.10.3.105","10.10.3.59","MPTCP","1516","39867  >  5201 [PSH, ACK] Seq=33121 Ack=1 Win=64256 Len=1424 TSval=937387933 TSecr=1399367672","","","","",""
"1119","28.151007873","10.10.3.59","10.10.3.105","MPTCP","80","5201  >  39867 [ACK] Seq=1 Ack=34545 Win=2239488 Len=0 TSval=1399367876 TSecr=937387933","0.000045714","","","",""
"1120","28.160512776","10.10.3.105","10.10.3.59","MPTCP","1516","39867  >  5201 [ACK] Seq=34545 Ack=1 Win=64256 Len=1424 TSval=937387944 TSecr=1399367685","","","","",""
"1121","28.160568584","10.10.3.59","10.10.3.105","MPTCP","80","5201  >  39867 [ACK] Seq=1 Ack=35969 Win=2238080 Len=0 TSval=1399367886 TSecr=937387944","0.000055808","","","",""
"1122","28.171173122","10.10.3.105","10.10.3.59","MPTCP","588","39867  >  5201 [PSH, ACK] Seq=35969 Ack=1 Win=64256 Len=496 TSval=937387944 TSecr=1399367685","","","","",""
"1123","28.171241329","10.10.3.59","10.10.3.105","MPTCP","80","5201  >  39867 [ACK] Seq=1 Ack=36465 Win=2237696 Len=0 TSval=1399367896 TSecr=937387944","0.000068207","","","",""
"1124","28.176084746","10.10.3.105","10.10.3.59","MPTCP","1516","39867  >  5201 [ACK] Seq=36465 Ack=1 Win=64256 Len=1424 TSval=937388094 TSecr=1399367829","","","","",""
"1125","28.176145724","10.10.3.59","10.10.3.105","MPTCP","80","5201  >  39867 [ACK] Seq=1 Ack=37889 Win=2236288 Len=0 TSval=1399367901 TSecr=937388094","0.000060978","","","",""
"1126","28.182957928","10.10.3.105","10.10.3.102","MPTCP","62748","42148  >  5201 [PSH, ACK] Seq=1998382 Ack=1 Win=64256 Len=62656 TSval=2008132833 TSecr=1039259466","","","","",""
"1127","28.183029757","10.10.3.102","10.10.3.105","MPTCP","80","5201  >  42148 [ACK] Seq=1 Ack=2061038 Win=2369024 Len=0 TSval=1039259530 TSecr=2008132833","0.000071829","","","",""
"1128","28.183498079","10.10.3.105","10.10.3.102","MPTCP","62748","42148  >  5201 [PSH, ACK] Seq=2061038 Ack=1 Win=64256 Len=62656 TSval=2008132833 TSecr=1039259466","","","","",""
"1129","28.183539371","10.10.3.102","10.10.3.105","MPTCP","80","5201  >  42148 [ACK] Seq=1 Ack=2123694 Win=2494336 Len=0 TSval=1039259531 TSecr=2008132833","0.000041292","","","",""
