"No.","Time","Source","Destination","Protocol","Length","Info","RTT","Lost Segement","Duplicate ","Retransmission","IDK"
"1579","37.163066031","10.10.3.105","10.10.3.102","MPTCP","80","34878  >  5201 [SYN] Seq=0 Win=64240 Len=0 MSS=1460 SACK_PERM=1 TSval=2008056026 TSecr=0 WS=128","","","","",""
"1580","37.163111975","10.10.3.102","10.10.3.105","MPTCP","88","5201  >  34878 [SYN, ACK] Seq=0 Ack=1 Win=65160 Len=0 MSS=1460 SACK_PERM=1 TSval=1039182722 TSecr=2008056026 WS=128","0.000045944","","","",""
"1581","37.163341856","10.10.3.105","10.10.3.102","MPTCP","88","34878  >  5201 [ACK] Seq=1 Ack=1 Win=64256 Len=0 TSval=2008056026 TSecr=1039182722","0.000229881","","","",""
"1582","37.163410039","10.10.3.102","10.10.3.105","MPTCP","84","[TCP Window Update] 5201  >  34878 [ACK] Seq=1 Ack=1 Win=65280 Len=0 TSval=1039182723 TSecr=2008056026","","","","","â\234\223"
"1583","37.163420747","10.10.3.105","10.10.3.102","MPTCP","129","34878  >  5201 [PSH, ACK] Seq=1 Ack=1 Win=64256 Len=37 TSval=2008056026 TSecr=1039182722","","","","",""
"1584","37.163427698","10.10.3.102","10.10.3.105","MPTCP","80","5201  >  34878 [ACK] Seq=1 Ack=38 Win=65280 Len=0 TSval=1039182723 TSecr=2008056026","0.000006951","","","",""
"1585","37.163478029","10.10.3.102","10.10.3.105","MPTCP","97","5201  >  34878 [PSH, ACK] Seq=1 Ack=38 Win=65280 Len=1 TSval=1039182723 TSecr=2008056026","","","","",""
"1586","37.163566986","10.10.3.105","10.10.3.102","MPTCP","76","34878  >  5201 [ACK] Seq=38 Ack=1 Win=64256 Len=0 TSval=2008056026 TSecr=1039182723","","","","",""
"1587","37.163567117","10.10.3.105","10.10.3.102","MPTCP","80","34878  >  5201 [ACK] Seq=38 Ack=2 Win=64256 Len=0 TSval=2008056026 TSecr=1039182723","0.000089088","","","",""
"1588","37.163726299","10.10.3.105","10.10.3.102","MPTCP","100","34878  >  5201 [PSH, ACK] Seq=38 Ack=2 Win=64256 Len=4 TSval=2008056026 TSecr=1039182723","","","","",""
"1589","37.167166878","10.10.3.105","10.10.3.59","MPTCP","88","55973  >  5201 [SYN] Seq=0 Win=64256 Len=0 MSS=1460 SACK_PERM=1 TSval=937311358 TSecr=0 WS=128","","","","",""
"1590","37.167185907","10.10.3.59","10.10.3.105","MPTCP","92","5201  >  55973 [SYN, ACK] Seq=0 Ack=1 Win=65160 Len=0 MSS=1460 SACK_PERM=1 TSval=1399291104 TSecr=937311358 WS=128","0.000019029","","","",""
"1591","37.171414121","10.10.3.105","10.10.3.59","MPTCP","92","55973  >  5201 [ACK] Seq=1 Ack=1 Win=64256 Len=0 TSval=937311363 TSecr=1399291104","0.004228214","","","",""
"1592","37.171468765","10.10.3.59","10.10.3.105","MPTCP","80","[TCP Window Update] 5201  >  55973 [ACK] Seq=1 Ack=1 Win=65280 Len=0 TSval=1399291109 TSecr=937311363","","","","","â\234\223"
"1593","37.197266862","10.10.3.62","10.10.3.102","MPTCP","88","42423  >  5201 [SYN] Seq=0 Win=64256 Len=0 MSS=1460 SACK_PERM=1 TSval=3345223231 TSecr=0 WS=128","","","","",""
"1594","37.197305332","10.10.3.102","10.10.3.62","MPTCP","92","5201  >  42423 [SYN, ACK] Seq=0 Ack=1 Win=65160 Len=0 MSS=1460 SACK_PERM=1 TSval=2492001038 TSecr=3345223231 WS=128","0.000038470","","","",""
"1595","37.199421440","10.10.3.62","10.10.3.102","MPTCP","92","42423  >  5201 [ACK] Seq=1 Ack=1 Win=64256 Len=0 TSval=3345223266 TSecr=2492001038","0.002116108","","","",""
"1596","37.199488961","10.10.3.102","10.10.3.62","MPTCP","80","[TCP Window Update] 5201  >  42423 [ACK] Seq=1 Ack=1 Win=65280 Len=0 TSval=2492001040 TSecr=3345223266","","","","","â\234\223"
"1597","37.205479278","10.10.3.102","10.10.3.105","MPTCP","80","5201  >  34878 [ACK] Seq=2 Ack=42 Win=65280 Len=0 TSval=1039182765 TSecr=2008056026","0.041752979","","","",""
"1598","37.205790450","10.10.3.105","10.10.3.102","MPTCP","196","34878  >  5201 [PSH, ACK] Seq=42 Ack=2 Win=64256 Len=100 TSval=2008056068 TSecr=1039182765","","","","",""
"1599","37.205837963","10.10.3.102","10.10.3.105","MPTCP","80","5201  >  34878 [ACK] Seq=2 Ack=142 Win=65280 Len=0 TSval=1039182765 TSecr=2008056068","0.000047513","","","",""
"1600","37.205949463","10.10.3.102","10.10.3.105","MPTCP","97","5201  >  34878 [PSH, ACK] Seq=2 Ack=142 Win=65280 Len=1 TSval=1039182765 TSecr=2008056068","","","","",""
"1601","37.206154995","10.10.3.105","10.10.3.102","MPTCP","80","34880  >  5201 [SYN] Seq=0 Win=64240 Len=0 MSS=1460 SACK_PERM=1 TSval=2008056069 TSecr=0 WS=128","","","","",""
"1602","37.206189991","10.10.3.102","10.10.3.105","MPTCP","88","5201  >  34880 [SYN, ACK] Seq=0 Ack=1 Win=65160 Len=0 MSS=1460 SACK_PERM=1 TSval=1039182765 TSecr=2008056069 WS=128","0.000034996","","","",""
"1603","37.206243178","10.10.3.105","10.10.3.102","MPTCP","88","34880  >  5201 [ACK] Seq=1 Ack=1 Win=64256 Len=0 TSval=2008056069 TSecr=1039182765","0.000053187","","","",""
"1604","37.206329186","10.10.3.105","10.10.3.102","MPTCP","129","34880  >  5201 [PSH, ACK] Seq=1 Ack=1 Win=64256 Len=37 TSval=2008056069 TSecr=1039182765","","","","",""
"1605","37.206345995","10.10.3.102","10.10.3.105","MPTCP","80","5201  >  34880 [ACK] Seq=1 Ack=38 Win=65152 Len=0 TSval=1039182766 TSecr=2008056069","0.000016809","","","",""
"1607","37.206622903","10.10.3.102","10.10.3.105","MPTCP","84","5201  >  34880 [ACK] Seq=1 Ack=38 Win=65152 Len=0 TSval=1039182766 TSecr=2008056069","","","","",""
"1608","37.206718500","10.10.3.105","10.10.3.102","MPTCP","76","34880  >  5201 [ACK] Seq=38 Ack=1 Win=64256 Len=0 TSval=2008056069 TSecr=1039182766","","","","",""
"1609","37.207356153","10.10.3.62","10.10.3.102","MPTCP","88","39405  >  5201 [SYN] Seq=0 Win=64256 Len=0 MSS=1460 SACK_PERM=1 TSval=3345223274 TSecr=0 WS=128","","","","",""
"1610","37.207381594","10.10.3.105","10.10.3.59","MPTCP","88","47495  >  5201 [SYN] Seq=0 Win=64256 Len=0 MSS=1460 SACK_PERM=1 TSval=937311401 TSecr=0 WS=128","","","","",""
"1611","37.207397565","10.10.3.102","10.10.3.62","MPTCP","92","5201  >  39405 [SYN, ACK] Seq=0 Ack=1 Win=65160 Len=0 MSS=1460 SACK_PERM=1 TSval=2492001048 TSecr=3345223274 WS=128","0.000041412","","","",""
"1612","37.207418874","10.10.3.59","10.10.3.105","MPTCP","92","5201  >  47495 [SYN, ACK] Seq=0 Ack=1 Win=65160 Len=0 MSS=1460 SACK_PERM=1 TSval=1399291145 TSecr=937311401 WS=128","0.000037280","","","",""
"1614","37.209294103","10.10.3.62","10.10.3.102","MPTCP","92","39405  >  5201 [ACK] Seq=1 Ack=1 Win=64256 Len=0 TSval=3345223276 TSecr=2492001048","0.001896538","","","",""
"1615","37.209353039","10.10.3.102","10.10.3.62","MPTCP","80","[TCP Window Update] 5201  >  39405 [ACK] Seq=1 Ack=1 Win=65280 Len=0 TSval=2492001050 TSecr=3345223276","","","","","â\234\223"
"1616","37.210534431","10.10.3.105","10.10.3.59","MPTCP","92","47495  >  5201 [ACK] Seq=1 Ack=1 Win=64256 Len=0 TSval=937311404 TSecr=1399291145","0.003115557","","","",""
"1617","37.210619364","10.10.3.59","10.10.3.105","MPTCP","80","[TCP Window Update] 5201  >  47495 [ACK] Seq=1 Ack=1 Win=65280 Len=0 TSval=1399291148 TSecr=937311404","","","","","â\234\223"
"1620","37.250221843","10.10.3.105","10.10.3.102","MPTCP","80","34878  >  5201 [ACK] Seq=142 Ack=3 Win=64256 Len=0 TSval=2008056113 TSecr=1039182765","0.044272380","","","",""
"1621","37.250269258","10.10.3.102","10.10.3.105","MPTCP","98","5201  >  34878 [PSH, ACK] Seq=3 Ack=142 Win=65280 Len=2 TSval=1039182810 TSecr=2008056113","","","","",""
"1622","37.250387959","10.10.3.105","10.10.3.102","MPTCP","80","34878  >  5201 [ACK] Seq=142 Ack=5 Win=64256 Len=0 TSval=2008056113 TSecr=1039182810","0.000118701","","","",""
"1623","37.250495042","10.10.3.105","10.10.3.102","MPTCP","7212","34880  >  5201 [PSH, ACK] Seq=38 Ack=1 Win=64256 Len=7120 TSval=2008056113 TSecr=1039182766","","","","",""
"1624","37.250521853","10.10.3.102","10.10.3.105","MPTCP","80","5201  >  34880 [ACK] Seq=1 Ack=7158 Win=60672 Len=0 TSval=1039182810 TSecr=2008056113","0.000026811","","","",""
"1625","37.250561914","10.10.3.105","10.10.3.102","MPTCP","7212","34880  >  5201 [PSH, ACK] Seq=7158 Ack=1 Win=64256 Len=7120 TSval=2008056113 TSecr=1039182766","","","","",""
"1626","37.250575310","10.10.3.102","10.10.3.105","MPTCP","80","5201  >  34880 [ACK] Seq=1 Ack=14278 Win=55680 Len=0 TSval=1039182810 TSecr=2008056113","0.000013396","","","",""
"1627","37.250771140","10.10.3.105","10.10.3.102","MPTCP","10060","34880  >  5201 [PSH, ACK] Seq=14278 Ack=1 Win=64256 Len=9968 TSval=2008056113 TSecr=1039182810","","","","",""
"1628","37.250804784","10.10.3.102","10.10.3.105","MPTCP","80","5201  >  34880 [ACK] Seq=1 Ack=24246 Win=58752 Len=0 TSval=1039182810 TSecr=2008056113","0.000033644","","","",""
"1629","37.250851632","10.10.3.105","10.10.3.102","MPTCP","7212","34880  >  5201 [PSH, ACK] Seq=24246 Ack=1 Win=64256 Len=7120 TSval=2008056113 TSecr=1039182810","","","","",""
"1630","37.250864625","10.10.3.102","10.10.3.105","MPTCP","80","5201  >  34880 [ACK] Seq=1 Ack=31366 Win=53760 Len=0 TSval=1039182810 TSecr=2008056113","0.000012993","","","",""
"1631","37.250928779","10.10.3.105","10.10.3.102","MPTCP","11484","34880  >  5201 [PSH, ACK] Seq=31366 Ack=1 Win=64256 Len=11392 TSval=2008056113 TSecr=1039182810","","","","",""
"1632","37.250942260","10.10.3.102","10.10.3.105","MPTCP","80","5201  >  34880 [ACK] Seq=1 Ack=42758 Win=86912 Len=0 TSval=1039182810 TSecr=2008056113","0.000013481","","","",""
"1633","37.251092343","10.10.3.105","10.10.3.102","MPTCP","18604","34880  >  5201 [PSH, ACK] Seq=42758 Ack=1 Win=64256 Len=18512 TSval=2008056113 TSecr=1039182810","","","","",""
"1634","37.251108286","10.10.3.102","10.10.3.105","MPTCP","80","5201  >  34880 [ACK] Seq=1 Ack=61270 Win=123904 Len=0 TSval=1039182810 TSecr=2008056113","0.000015943","","","",""
"1635","37.251138700","10.10.3.105","10.10.3.102","MPTCP","1516","34880  >  5201 [ACK] Seq=61270 Ack=1 Win=64256 Len=1424 TSval=2008056113 TSecr=1039182810","","","","",""
"1636","37.251149231","10.10.3.102","10.10.3.105","MPTCP","80","5201  >  34880 [ACK] Seq=1 Ack=62694 Win=126848 Len=0 TSval=1039182810 TSecr=2008056113","0.000010531","","","",""
"1637","37.251173347","10.10.3.105","10.10.3.102","MPTCP","2716","34880  >  5201 [PSH, ACK] Seq=62694 Ack=1 Win=64256 Len=2624 TSval=2008056113 TSecr=1039182810","","","","",""
"1638","37.251188624","10.10.3.102","10.10.3.105","MPTCP","80","5201  >  34880 [ACK] Seq=1 Ack=65318 Win=132096 Len=0 TSval=1039182810 TSecr=2008056113","0.000015277","","","",""
"1639","37.251424445","10.10.3.105","10.10.3.102","MPTCP","28572","34880  >  5201 [PSH, ACK] Seq=65318 Ack=1 Win=64256 Len=28480 TSval=2008056114 TSecr=1039182810","","","","",""
"1640","37.251444007","10.10.3.102","10.10.3.105","MPTCP","80","5201  >  34880 [ACK] Seq=1 Ack=93798 Win=189056 Len=0 TSval=1039182811 TSecr=2008056114","0.000019562","","","",""
"1641","37.251600614","10.10.3.105","10.10.3.102","MPTCP","14332","34880  >  5201 [PSH, ACK] Seq=93798 Ack=1 Win=64256 Len=14240 TSval=2008056114 TSecr=1039182810","","","","",""
"1642","37.251615598","10.10.3.102","10.10.3.105","MPTCP","80","5201  >  34880 [ACK] Seq=1 Ack=108038 Win=217472 Len=0 TSval=1039182811 TSecr=2008056114","0.000014984","","","",""
"1643","37.251848280","10.10.3.105","10.10.3.102","MPTCP","28572","34880  >  5201 [PSH, ACK] Seq=108038 Ack=1 Win=64256 Len=28480 TSval=2008056114 TSecr=1039182810","","","","",""
"1644","37.251865669","10.10.3.102","10.10.3.105","MPTCP","80","5201  >  34880 [ACK] Seq=1 Ack=136518 Win=242304 Len=0 TSval=1039182811 TSecr=2008056114","0.000017389","","","",""
"1645","37.252106717","10.10.3.105","10.10.3.102","MPTCP","31068","34880  >  5201 [PSH, ACK] Seq=136518 Ack=1 Win=64256 Len=30976 TSval=2008056114 TSecr=1039182811","","","","",""
"1646","37.252125668","10.10.3.102","10.10.3.105","MPTCP","80","5201  >  34880 [ACK] Seq=1 Ack=167494 Win=242304 Len=0 TSval=1039182811 TSecr=2008056114","0.000018951","","","",""
"1647","37.252487654","10.10.3.105","10.10.3.102","MPTCP","41388","34880  >  5201 [PSH, ACK] Seq=167494 Ack=1 Win=64256 Len=41296 TSval=2008056114 TSecr=1039182811","","","","",""
"1648","37.252508133","10.10.3.102","10.10.3.105","MPTCP","80","5201  >  34880 [ACK] Seq=1 Ack=208790 Win=242304 Len=0 TSval=1039182812 TSecr=2008056114","0.000020479","","","",""
"1649","37.252660918","10.10.3.105","10.10.3.102","MPTCP","21452","34880  >  5201 [PSH, ACK] Seq=208790 Ack=1 Win=64256 Len=21360 TSval=2008056115 TSecr=1039182811","","","","",""
"1650","37.252676619","10.10.3.102","10.10.3.105","MPTCP","80","5201  >  34880 [ACK] Seq=1 Ack=230150 Win=242304 Len=0 TSval=1039182812 TSecr=2008056115","0.000015701","","","",""
"1651","37.253024394","10.10.3.105","10.10.3.102","MPTCP","42812","34880  >  5201 [PSH, ACK] Seq=230150 Ack=1 Win=64256 Len=42720 TSval=2008056115 TSecr=1039182812","","","","",""
"1652","37.253052304","10.10.3.102","10.10.3.105","MPTCP","80","5201  >  34880 [ACK] Seq=1 Ack=272870 Win=242304 Len=0 TSval=1039182812 TSecr=2008056115","0.000027910","","","",""
"1653","37.253084670","10.10.3.105","10.10.3.59","MPTCP","1516","47495  >  5201 [ACK] Seq=1 Ack=1 Win=64256 Len=1424 TSval=937311445 TSecr=1399291148","","","","",""
"1654","37.253117185","10.10.3.59","10.10.3.105","MPTCP","80","5201  >  47495 [ACK] Seq=1 Ack=1425 Win=242304 Len=0 TSval=1399291190 TSecr=937311445","0.000032515","","","",""
"1655","37.253178862","10.10.3.105","10.10.3.102","MPTCP","17164","34880  >  5201 [PSH, ACK] Seq=272870 Ack=1 Win=64256 Len=17072 TSval=2008056115 TSecr=1039182812","","","","",""
"1656","37.253194316","10.10.3.102","10.10.3.105","MPTCP","80","5201  >  34880 [ACK] Seq=1 Ack=289942 Win=242304 Len=0 TSval=1039182812 TSecr=2008056115","0.000015454","","","",""
"1657","37.254207102","10.10.3.62","10.10.3.102","MPTCP","1516","39405  >  5201 [ACK] Seq=1 Ack=1 Win=64256 Len=1424 TSval=3345223318 TSecr=2492001050","","","","",""
"1658","37.254223994","10.10.3.102","10.10.3.62","MPTCP","80","5201  >  39405 [ACK] Seq=1 Ack=1425 Win=240768 Len=0 TSval=2492001094 TSecr=3345223318","0.000016892","","","",""
"1659","37.255345065","10.10.3.105","10.10.3.59","MPTCP","1516","47495  >  5201 [ACK] Seq=1425 Ack=1 Win=64256 Len=1424 TSval=937311445 TSecr=1399291148","","","","",""
"1660","37.255375944","10.10.3.59","10.10.3.105","MPTCP","80","5201  >  47495 [ACK] Seq=1 Ack=2849 Win=240896 Len=0 TSval=1399291193 TSecr=937311445","0.000030879","","","",""
"1661","37.257154709","10.10.3.105","10.10.3.102","MPTCP","108","34880  >  5201 [PSH, ACK] Seq=289942 Ack=1 Win=64256 Len=16 TSval=2008056120 TSecr=1039182812","","","","",""
"1662","37.259431727","10.10.3.62","10.10.3.102","MPTCP","1516","39405  >  5201 [ACK] Seq=1425 Ack=1 Win=64256 Len=1424 TSval=3345223318 TSecr=2492001050","","","","",""
"1663","37.259461590","10.10.3.102","10.10.3.62","MPTCP","80","5201  >  39405 [ACK] Seq=1 Ack=2849 Win=239488 Len=0 TSval=2492001100 TSecr=3345223318","0.000029863","","","",""
"1664","37.263984713","10.10.3.105","10.10.3.59","MPTCP","1516","47495  >  5201 [ACK] Seq=2849 Ack=1 Win=64256 Len=1424 TSval=937311445 TSecr=1399291148","","","","",""
"1665","37.264031531","10.10.3.59","10.10.3.105","MPTCP","80","5201  >  47495 [ACK] Seq=1 Ack=4273 Win=239488 Len=0 TSval=1399291201 TSecr=937311445","0.000046818","","","",""
"1666","37.265518181","10.10.3.62","10.10.3.102","MPTCP","1516","39405  >  5201 [ACK] Seq=2849 Ack=1 Win=64256 Len=1424 TSval=3345223318 TSecr=2492001050","","","","",""
"1667","37.265555328","10.10.3.102","10.10.3.62","MPTCP","80","5201  >  39405 [ACK] Seq=1 Ack=4273 Win=238080 Len=0 TSval=2492001106 TSecr=3345223318","0.000037147","","","",""
"1668","37.277446801","10.10.3.62","10.10.3.102","MPTCP","460","39405  >  5201 [PSH, ACK] Seq=4273 Ack=1 Win=64256 Len=368 TSval=3345223318 TSecr=2492001050","","","","",""
"1669","37.277498097","10.10.3.102","10.10.3.62","MPTCP","80","5201  >  39405 [ACK] Seq=1 Ack=4641 Win=237824 Len=0 TSval=2492001118 TSecr=3345223318","0.000051296","","","",""
"1670","37.292798742","10.10.3.105","10.10.3.59","MPTCP","1516","47495  >  5201 [ACK] Seq=4273 Ack=1 Win=64256 Len=1424 TSval=937311445 TSecr=1399291148","","","","",""
"1671","37.292848790","10.10.3.59","10.10.3.105","MPTCP","80","5201  >  47495 [ACK] Seq=1 Ack=5697 Win=238080 Len=0 TSval=1399291230 TSecr=937311445","0.000050048","","","",""
"1672","37.296055180","10.10.3.105","10.10.3.102","MPTCP","124","34880  >  5201 [PSH, ACK] Seq=289958 Ack=1 Win=64256 Len=32 TSval=2008056158 TSecr=1039182812","","","","",""
"1673","37.296100699","10.10.3.102","10.10.3.105","MPTCP","80","5201  >  34880 [ACK] Seq=1 Ack=289990 Win=242304 Len=0 TSval=1039182855 TSecr=2008056120","0.000045519","","","",""
"1675","37.296151783","10.10.3.105","10.10.3.102","MPTCP","1516","34880  >  5201 [ACK] Seq=289990 Ack=1 Win=64256 Len=1424 TSval=2008056158 TSecr=1039182812","","","","",""
"1676","37.296164158","10.10.3.102","10.10.3.105","MPTCP","80","5201  >  34880 [ACK] Seq=1 Ack=291414 Win=242304 Len=0 TSval=1039182855 TSecr=2008056158","0.000012375","","","",""
"1677","37.296205409","10.10.3.105","10.10.3.102","MPTCP","348","34880  >  5201 [PSH, ACK] Seq=291414 Ack=1 Win=64256 Len=256 TSval=2008056159 TSecr=1039182855","","","","",""
"1678","37.296231656","10.10.3.102","10.10.3.105","MPTCP","80","5201  >  34880 [ACK] Seq=1 Ack=291670 Win=242304 Len=0 TSval=1039182855 TSecr=2008056159","0.000026247","","","",""
"1679","37.296266029","10.10.3.105","10.10.3.102","MPTCP","2940","34880  >  5201 [PSH, ACK] Seq=291670 Ack=1 Win=64256 Len=2848 TSval=2008056159 TSecr=1039182855","","","","",""
"1680","37.296279474","10.10.3.102","10.10.3.105","MPTCP","80","5201  >  34880 [ACK] Seq=1 Ack=294518 Win=242304 Len=0 TSval=1039182856 TSecr=2008056159","0.000013445","","","",""
"1681","37.296338275","10.10.3.105","10.10.3.102","MPTCP","1468","34880  >  5201 [PSH, ACK] Seq=294518 Ack=1 Win=64256 Len=1376 TSval=2008056159 TSecr=1039182855","","","","",""
"1682","37.296363458","10.10.3.102","10.10.3.105","MPTCP","80","5201  >  34880 [ACK] Seq=1 Ack=295894 Win=242304 Len=0 TSval=1039182856 TSecr=2008056159","0.000025183","","","",""
"1683","37.296434422","10.10.3.105","10.10.3.59","MPTCP","1516","47495  >  5201 [PSH, ACK] Seq=5697 Ack=1 Win=64256 Len=1424 TSval=937311445 TSecr=1399291148","","","","",""
"1684","37.296470115","10.10.3.59","10.10.3.105","MPTCP","80","5201  >  47495 [ACK] Seq=1 Ack=7121 Win=240768 Len=0 TSval=1399291234 TSecr=937311445","0.000035693","","","",""
"1685","37.298077746","10.10.3.62","10.10.3.102","MPTCP","1516","39405  >  5201 [ACK] Seq=4641 Ack=1 Win=64256 Len=1424 TSval=3345223363 TSecr=2492001118","","","","",""
"1686","37.298121376","10.10.3.102","10.10.3.62","MPTCP","80","5201  >  39405 [ACK] Seq=1 Ack=6065 Win=240768 Len=0 TSval=2492001138 TSecr=3345223363","0.000043630","","","",""
"1687","37.298635289","10.10.3.62","10.10.3.102","MPTCP","1516","39405  >  5201 [ACK] Seq=6065 Ack=1 Win=64256 Len=1424 TSval=3345223363 TSecr=2492001118","","","","",""
"1688","37.298680006","10.10.3.102","10.10.3.62","MPTCP","80","5201  >  39405 [ACK] Seq=1 Ack=7489 Win=240768 Len=0 TSval=2492001139 TSecr=3345223363","0.000044717","","","",""
"1689","37.307343106","10.10.3.105","10.10.3.59","MPTCP","1516","47495  >  5201 [ACK] Seq=7121 Ack=1 Win=64256 Len=1424 TSval=937311445 TSecr=1399291148","","","","",""
"1690","37.307393507","10.10.3.59","10.10.3.105","MPTCP","80","5201  >  47495 [ACK] Seq=1 Ack=8545 Win=239488 Len=0 TSval=1399291245 TSecr=937311445","0.000050401","","","",""
"1691","37.308269439","10.10.3.105","10.10.3.102","MPTCP","124","34880  >  5201 [PSH, ACK] Seq=295894 Ack=1 Win=64256 Len=32 TSval=2008056171 TSecr=1039182856","","","","",""
"1692","37.311585801","10.10.3.105","10.10.3.59","MPTCP","1516","47495  >  5201 [ACK] Seq=8545 Ack=1 Win=64256 Len=1424 TSval=937311445 TSecr=1399291148","","","","",""
"1693","37.311635929","10.10.3.59","10.10.3.105","MPTCP","80","5201  >  47495 [ACK] Seq=1 Ack=9969 Win=238080 Len=0 TSval=1399291249 TSecr=937311445","0.000050128","","","",""
"1694","37.321042679","10.10.3.62","10.10.3.102","MPTCP","1516","39405  >  5201 [ACK] Seq=7489 Ack=1 Win=64256 Len=1424 TSval=3345223363 TSecr=2492001118","","","","",""
"1695","37.321087463","10.10.3.102","10.10.3.62","MPTCP","80","5201  >  39405 [ACK] Seq=1 Ack=8913 Win=239488 Len=0 TSval=2492001161 TSecr=3345223363","0.000044784","","","",""
"1696","37.321109443","10.10.3.62","10.10.3.102","MPTCP","204","39405  >  5201 [PSH, ACK] Seq=8913 Ack=1 Win=64256 Len=112 TSval=3345223363 TSecr=2492001118","","","","",""
"1697","37.322357090","10.10.3.105","10.10.3.102","MPTCP","1516","34880  >  5201 [PSH, ACK] Seq=295926 Ack=1 Win=64256 Len=1424 TSval=2008056185 TSecr=1039182856","","","","",""
"1698","37.322403088","10.10.3.102","10.10.3.105","MPTCP","80","5201  >  34880 [ACK] Seq=1 Ack=297350 Win=240896 Len=0 TSval=1039182882 TSecr=2008056171","0.000045998","","","",""
"1699","37.322724772","10.10.3.105","10.10.3.102","MPTCP","1500","34880  >  5201 [PSH, ACK] Seq=297350 Ack=1 Win=64256 Len=1408 TSval=2008056185 TSecr=1039182882","","","","",""
"1700","37.327315116","10.10.3.105","10.10.3.59","MPTCP","1516","47495  >  5201 [ACK] Seq=9969 Ack=1 Win=64256 Len=1424 TSval=937311445 TSecr=1399291148","","","","",""
"1701","37.327365305","10.10.3.59","10.10.3.105","MPTCP","80","5201  >  47495 [ACK] Seq=1 Ack=11393 Win=239360 Len=0 TSval=1399291265 TSecr=937311445","0.000050189","","","",""
"1703","37.343514071","10.10.3.105","10.10.3.59","MPTCP","1516","47495  >  5201 [ACK] Seq=11393 Ack=1 Win=64256 Len=1424 TSval=937311445 TSecr=1399291148","","","","",""
"1704","37.343567239","10.10.3.59","10.10.3.105","MPTCP","80","5201  >  47495 [ACK] Seq=1 Ack=12817 Win=238080 Len=0 TSval=1399291281 TSecr=937311445","0.000053168","","","",""
"1705","37.347337532","10.10.3.105","10.10.3.59","MPTCP","316","47495  >  5201 [PSH, ACK] Seq=12817 Ack=1 Win=64256 Len=224 TSval=937311445 TSecr=1399291148","","","","",""
"1706","37.347403442","10.10.3.59","10.10.3.105","MPTCP","80","5201  >  47495 [ACK] Seq=1 Ack=13041 Win=237952 Len=0 TSval=1399291285 TSecr=937311445","0.000065910","","","",""
"1707","37.347649819","10.10.3.102","10.10.3.105","MPTCP","80","5201  >  34880 [ACK] Seq=1 Ack=298758 Win=289920 Len=0 TSval=1039182882 TSecr=2008056185","0.024925047","","","",""
"1708","37.347661433","10.10.3.102","10.10.3.62","MPTCP","80","5201  >  39405 [ACK] Seq=1 Ack=9025 Win=289920 Len=0 TSval=2492001161 TSecr=3345223363","0.026551990","","","",""
"1709","37.348131679","10.10.3.105","10.10.3.102","MPTCP","42812","34880  >  5201 [PSH, ACK] Seq=298758 Ack=1 Win=64256 Len=42720 TSval=2008056210 TSecr=1039182882","","","","",""
"1710","37.348184518","10.10.3.102","10.10.3.105","MPTCP","80","5201  >  34880 [ACK] Seq=1 Ack=341478 Win=289920 Len=0 TSval=1039182907 TSecr=2008056210","0.000052839","","","",""
"1711","37.348298726","10.10.3.105","10.10.3.102","MPTCP","20028","34880  >  5201 [PSH, ACK] Seq=341478 Ack=1 Win=64256 Len=19936 TSval=2008056210 TSecr=1039182882","","","","",""
"1712","37.348318293","10.10.3.102","10.10.3.105","MPTCP","80","5201  >  34880 [ACK] Seq=1 Ack=361414 Win=289920 Len=0 TSval=1039182908 TSecr=2008056210","0.000019567","","","",""
"1713","37.348468177","10.10.3.105","10.10.3.102","MPTCP","9356","34880  >  5201 [PSH, ACK] Seq=361414 Ack=1 Win=64256 Len=9264 TSval=2008056211 TSecr=1039182882","","","","",""
"1714","37.348500053","10.10.3.102","10.10.3.105","MPTCP","80","5201  >  34880 [ACK] Seq=1 Ack=370678 Win=289920 Len=0 TSval=1039182908 TSecr=2008056211","0.000031876","","","",""
"1715","37.348581940","10.10.3.105","10.10.3.102","MPTCP","14332","34880  >  5201 [PSH, ACK] Seq=370678 Ack=1 Win=64256 Len=14240 TSval=2008056211 TSecr=1039182907","","","","",""
"1716","37.348598916","10.10.3.102","10.10.3.105","MPTCP","80","5201  >  34880 [ACK] Seq=1 Ack=384918 Win=289920 Len=0 TSval=1039182908 TSecr=2008056211","0.000016976","","","",""
"1717","37.349015759","10.10.3.105","10.10.3.102","MPTCP","42812","34880  >  5201 [PSH, ACK] Seq=384918 Ack=1 Win=64256 Len=42720 TSval=2008056211 TSecr=1039182907","","","","",""
"1718","37.349041588","10.10.3.102","10.10.3.105","MPTCP","80","5201  >  34880 [ACK] Seq=1 Ack=427638 Win=289920 Len=0 TSval=1039182908 TSecr=2008056211","0.000025829","","","",""
"1719","37.349102736","10.10.3.105","10.10.3.102","MPTCP","5788","34880  >  5201 [PSH, ACK] Seq=427638 Ack=1 Win=64256 Len=5696 TSval=2008056211 TSecr=1039182908","","","","",""
"1720","37.349114032","10.10.3.102","10.10.3.105","MPTCP","80","5201  >  34880 [ACK] Seq=1 Ack=433334 Win=289920 Len=0 TSval=1039182908 TSecr=2008056211","0.000011296","","","",""
"1721","37.349237245","10.10.3.105","10.10.3.102","MPTCP","15756","34880  >  5201 [ACK] Seq=433334 Ack=1 Win=64256 Len=15664 TSval=2008056211 TSecr=1039182908","","","","",""
"1722","37.349251949","10.10.3.102","10.10.3.105","MPTCP","80","5201  >  34880 [ACK] Seq=1 Ack=448998 Win=289920 Len=0 TSval=1039182909 TSecr=2008056211","0.000014704","","","",""
"1723","37.349319980","10.10.3.105","10.10.3.102","MPTCP","8828","34880  >  5201 [PSH, ACK] Seq=448998 Ack=1 Win=64256 Len=8736 TSval=2008056211 TSecr=1039182908","","","","",""
"1724","37.349341811","10.10.3.102","10.10.3.105","MPTCP","80","5201  >  34880 [ACK] Seq=1 Ack=457734 Win=289920 Len=0 TSval=1039182909 TSecr=2008056211","0.000021831","","","",""
"1725","37.351571387","10.10.3.62","10.10.3.102","MPTCP","1516","39405  >  5201 [ACK] Seq=9025 Ack=1 Win=64256 Len=1424 TSval=3345223415 TSecr=2492001161","","","","",""
"1726","37.351584564","10.10.3.102","10.10.3.62","MPTCP","80","5201  >  39405 [ACK] Seq=1 Ack=10449 Win=289920 Len=0 TSval=2492001192 TSecr=3345223415","0.000013177","","","",""
"1727","37.353229314","10.10.3.105","10.10.3.59","MPTCP","316","[TCP Spurious Retransmission] 47495  >  5201 [PSH, ACK] Seq=12817 Ack=1 Win=64256 Len=224 TSval=937311473 TSecr=1399291201","","","","â\234\223","â\234\223"
"1728","37.353277530","10.10.3.59","10.10.3.105","MPTCP","92","[TCP Window Update] 5201  >  47495 [ACK] Seq=1 Ack=13041 Win=289920 Len=0 TSval=1399291291 TSecr=937311473 SLE=12817 SRE=13041","0.000048216","","","","â\234\223"
"1729","37.353315735","10.10.3.105","10.10.3.59","MPTCP","124","47495  >  5201 [PSH, ACK] Seq=13041 Ack=1 Win=64256 Len=32 TSval=937311542 TSecr=1399291281","","","","",""
"1730","37.353337958","10.10.3.59","10.10.3.105","MPTCP","80","5201  >  47495 [ACK] Seq=1 Ack=13073 Win=289920 Len=0 TSval=1399291291 TSecr=937311542","0.000022223","","","",""
"1731","37.353358000","10.10.3.105","10.10.3.59","MPTCP","1516","47495  >  5201 [ACK] Seq=13073 Ack=1 Win=64256 Len=1424 TSval=937311542 TSecr=1399291281","","","","",""
"1732","37.353369845","10.10.3.59","10.10.3.105","MPTCP","80","5201  >  47495 [ACK] Seq=1 Ack=14497 Win=288512 Len=0 TSval=1399291291 TSecr=937311542","0.000011845","","","",""
"1733","37.353818817","10.10.3.62","10.10.3.102","MPTCP","1516","39405  >  5201 [ACK] Seq=10449 Ack=1 Win=64256 Len=1424 TSval=3345223415 TSecr=2492001161","","","","",""
"1734","37.353847958","10.10.3.102","10.10.3.62","MPTCP","80","5201  >  39405 [ACK] Seq=1 Ack=11873 Win=288512 Len=0 TSval=2492001194 TSecr=3345223415","0.000029141","","","",""
"1735","37.358563862","10.10.3.105","10.10.3.102","MPTCP","45660","34880  >  5201 [PSH, ACK] Seq=457734 Ack=1 Win=64256 Len=45568 TSval=2008056221 TSecr=1039182909","","","","",""
"1736","37.358606091","10.10.3.102","10.10.3.105","MPTCP","80","5201  >  34880 [ACK] Seq=1 Ack=503302 Win=288512 Len=0 TSval=1039182918 TSecr=2008056221","0.000042229","","","",""
"1737","37.358714947","10.10.3.105","10.10.3.102","MPTCP","17180","34880  >  5201 [PSH, ACK] Seq=503302 Ack=1 Win=64256 Len=17088 TSval=2008056221 TSecr=1039182909","","","","",""
"1738","37.358730975","10.10.3.102","10.10.3.105","MPTCP","80","5201  >  34880 [ACK] Seq=1 Ack=520390 Win=288512 Len=0 TSval=1039182918 TSecr=2008056221","0.000016028","","","",""
"1739","37.358796774","10.10.3.105","10.10.3.102","MPTCP","9388","34880  >  5201 [PSH, ACK] Seq=520390 Ack=1 Win=64256 Len=9296 TSval=2008056221 TSecr=1039182909","","","","",""
"1740","37.358808704","10.10.3.102","10.10.3.105","MPTCP","80","5201  >  34880 [ACK] Seq=1 Ack=529686 Win=288512 Len=0 TSval=1039182918 TSecr=2008056221","0.000011930","","","",""
"1741","37.358853385","10.10.3.105","10.10.3.102","MPTCP","108","34880  >  5201 [PSH, ACK] Seq=529686 Ack=1 Win=64256 Len=16 TSval=2008056221 TSecr=1039182918","","","","",""
"1742","37.363026765","10.10.3.62","10.10.3.102","MPTCP","1516","39405  >  5201 [ACK] Seq=11873 Ack=1 Win=64256 Len=1424 TSval=3345223415 TSecr=2492001161","","","","",""
"1743","37.363055418","10.10.3.102","10.10.3.62","MPTCP","80","5201  >  39405 [ACK] Seq=1 Ack=13297 Win=288512 Len=0 TSval=2492001203 TSecr=3345223415","0.000028653","","","",""
"1744","37.368374310","10.10.3.105","10.10.3.59","MPTCP","1516","47495  >  5201 [ACK] Seq=14497 Ack=1 Win=64256 Len=1424 TSval=937311542 TSecr=1399291281","","","","",""
"1745","37.368403142","10.10.3.59","10.10.3.105","MPTCP","80","5201  >  47495 [ACK] Seq=1 Ack=15921 Win=287104 Len=0 TSval=1399291306 TSecr=937311542","0.000028832","","","",""
"1746","37.374709856","10.10.3.62","10.10.3.102","MPTCP","1516","39405  >  5201 [ACK] Seq=13297 Ack=1 Win=64256 Len=1424 TSval=3345223415 TSecr=2492001161","","","","",""
"1747","37.374738996","10.10.3.102","10.10.3.62","MPTCP","80","5201  >  39405 [ACK] Seq=1 Ack=14721 Win=287104 Len=0 TSval=2492001215 TSecr=3345223415","0.000029140","","","",""
"1748","37.377741253","10.10.3.105","10.10.3.59","MPTCP","1516","47495  >  5201 [PSH, ACK] Seq=15921 Ack=1 Win=64256 Len=1424 TSval=937311542 TSecr=1399291281","","","","",""
"1749","37.377771244","10.10.3.59","10.10.3.105","MPTCP","80","5201  >  47495 [ACK] Seq=1 Ack=17345 Win=285696 Len=0 TSval=1399291315 TSecr=937311542","0.000029991","","","",""
"1750","37.386617166","10.10.3.62","10.10.3.102","MPTCP","1516","39405  >  5201 [PSH, ACK] Seq=14721 Ack=1 Win=64256 Len=1424 TSval=3345223415 TSecr=2492001161","","","","",""
"1751","37.386647893","10.10.3.102","10.10.3.62","MPTCP","80","5201  >  39405 [ACK] Seq=1 Ack=16145 Win=285696 Len=0 TSval=2492001227 TSecr=3345223415","0.000030727","","","",""
"1752","37.390283654","10.10.3.105","10.10.3.59","MPTCP","1516","47495  >  5201 [ACK] Seq=17345 Ack=1 Win=64256 Len=1424 TSval=937311542 TSecr=1399291281","","","","",""
"1753","37.390311010","10.10.3.59","10.10.3.105","MPTCP","80","5201  >  47495 [ACK] Seq=1 Ack=18769 Win=284288 Len=0 TSval=1399291328 TSecr=937311542","0.000027356","","","",""
"1754","37.390366534","10.10.3.102","10.10.3.105","MPTCP","80","5201  >  34880 [ACK] Seq=1 Ack=529702 Win=289920 Len=0 TSval=1039182918 TSecr=2008056221","0.031513149","","","",""
"1755","37.390629154","10.10.3.105","10.10.3.102","MPTCP","5772","34880  >  5201 [PSH, ACK] Seq=529702 Ack=1 Win=64256 Len=5680 TSval=2008056253 TSecr=1039182918","","","","",""
"1756","37.390648337","10.10.3.102","10.10.3.105","MPTCP","80","5201  >  34880 [ACK] Seq=1 Ack=535382 Win=301312 Len=0 TSval=1039182950 TSecr=2008056253","0.000019183","","","",""
"1757","37.390830373","10.10.3.105","10.10.3.102","MPTCP","11484","34880  >  5201 [PSH, ACK] Seq=535382 Ack=1 Win=64256 Len=11392 TSval=2008056253 TSecr=1039182950","","","","",""
"1758","37.390846946","10.10.3.102","10.10.3.105","MPTCP","80","5201  >  34880 [ACK] Seq=1 Ack=546774 Win=324096 Len=0 TSval=1039182950 TSecr=2008056253","0.000016573","","","",""
"1759","37.391165472","10.10.3.105","10.10.3.102","MPTCP","22876","34880  >  5201 [PSH, ACK] Seq=546774 Ack=1 Win=64256 Len=22784 TSval=2008056253 TSecr=1039182950","","","","",""
"1760","37.391184356","10.10.3.102","10.10.3.105","MPTCP","80","5201  >  34880 [ACK] Seq=1 Ack=569558 Win=369664 Len=0 TSval=1039182950 TSecr=2008056253","0.000018884","","","",""
"1761","37.391667099","10.10.3.105","10.10.3.102","MPTCP","45660","34880  >  5201 [PSH, ACK] Seq=569558 Ack=1 Win=64256 Len=45568 TSval=2008056254 TSecr=1039182950","","","","",""
"1762","37.391680775","10.10.3.102","10.10.3.105","MPTCP","80","5201  >  34880 [ACK] Seq=1 Ack=615126 Win=460800 Len=0 TSval=1039182951 TSecr=2008056254","0.000013676","","","",""
"1763","37.392165270","10.10.3.105","10.10.3.102","MPTCP","45660","34880  >  5201 [PSH, ACK] Seq=615126 Ack=1 Win=64256 Len=45568 TSval=2008056254 TSecr=1039182951","","","","",""
"1764","37.392178386","10.10.3.102","10.10.3.105","MPTCP","80","5201  >  34880 [ACK] Seq=1 Ack=660694 Win=551936 Len=0 TSval=1039182951 TSecr=2008056254","0.000013116","","","",""
"1765","37.392324215","10.10.3.105","10.10.3.102","MPTCP","17180","34880  >  5201 [PSH, ACK] Seq=660694 Ack=1 Win=64256 Len=17088 TSval=2008056254 TSecr=1039182951","","","","",""
"1766","37.392331699","10.10.3.102","10.10.3.105","MPTCP","80","5201  >  34880 [ACK] Seq=1 Ack=677782 Win=586112 Len=0 TSval=1039182952 TSecr=2008056254","0.000007484","","","",""
"1767","37.392559740","10.10.3.105","10.10.3.102","MPTCP","28572","34880  >  5201 [PSH, ACK] Seq=677782 Ack=1 Win=64256 Len=28480 TSval=2008056255 TSecr=1039182951","","","","",""
"1768","37.392573257","10.10.3.102","10.10.3.105","MPTCP","80","5201  >  34880 [ACK] Seq=1 Ack=706262 Win=643072 Len=0 TSval=1039182952 TSecr=2008056255","0.000013517","","","",""
"1769","37.392959810","10.10.3.105","10.10.3.102","MPTCP","45660","34880  >  5201 [PSH, ACK] Seq=706262 Ack=1 Win=64256 Len=45568 TSval=2008056255 TSecr=1039182951","","","","",""
"1770","37.392972251","10.10.3.102","10.10.3.105","MPTCP","80","5201  >  34880 [ACK] Seq=1 Ack=751830 Win=734208 Len=0 TSval=1039182952 TSecr=2008056255","0.000012441","","","",""
"1771","37.393098290","10.10.3.105","10.10.3.102","MPTCP","17180","34880  >  5201 [PSH, ACK] Seq=751830 Ack=1 Win=64256 Len=17088 TSval=2008056255 TSecr=1039182952","","","","",""
"1772","37.393106280","10.10.3.102","10.10.3.105","MPTCP","80","5201  >  34880 [ACK] Seq=1 Ack=768918 Win=768384 Len=0 TSval=1039182952 TSecr=2008056255","0.000007990","","","",""
"1773","37.393283685","10.10.3.105","10.10.3.102","MPTCP","21452","34880  >  5201 [ACK] Seq=768918 Ack=1 Win=64256 Len=21360 TSval=2008056255 TSecr=1039182952","","","","",""
"1774","37.393293560","10.10.3.102","10.10.3.105","MPTCP","80","5201  >  34880 [ACK] Seq=1 Ack=790278 Win=811136 Len=0 TSval=1039182953 TSecr=2008056255","0.000009875","","","",""
"1775","37.393369143","10.10.3.105","10.10.3.102","MPTCP","8636","34880  >  5201 [PSH, ACK] Seq=790278 Ack=1 Win=64256 Len=8544 TSval=2008056255 TSecr=1039182952","","","","",""
"1776","37.393377244","10.10.3.102","10.10.3.105","MPTCP","80","5201  >  34880 [ACK] Seq=1 Ack=798822 Win=828160 Len=0 TSval=1039182953 TSecr=2008056255","0.000008101","","","",""
"1777","37.393645894","10.10.3.105","10.10.3.102","MPTCP","32844","34880  >  5201 [PSH, ACK] Seq=798822 Ack=1 Win=64256 Len=32752 TSval=2008056256 TSecr=1039182952","","","","",""
"1778","37.393656231","10.10.3.102","10.10.3.105","MPTCP","80","5201  >  34880 [ACK] Seq=1 Ack=831574 Win=893696 Len=0 TSval=1039182953 TSecr=2008056256","0.000010337","","","",""
"1779","37.393778850","10.10.3.105","10.10.3.102","MPTCP","15756","34880  >  5201 [PSH, ACK] Seq=831574 Ack=1 Win=64256 Len=15664 TSval=2008056256 TSecr=1039182953","","","","",""
"1780","37.393786212","10.10.3.102","10.10.3.105","MPTCP","80","5201  >  34880 [ACK] Seq=1 Ack=847238 Win=925056 Len=0 TSval=1039182953 TSecr=2008056256","0.000007362","","","",""
"1781","37.394196224","10.10.3.105","10.10.3.102","MPTCP","47084","34880  >  5201 [PSH, ACK] Seq=847238 Ack=1 Win=64256 Len=46992 TSval=2008056256 TSecr=1039182953","","","","",""
"1782","37.394208775","10.10.3.102","10.10.3.105","MPTCP","80","5201  >  34880 [ACK] Seq=1 Ack=894230 Win=1019008 Len=0 TSval=1039182953 TSecr=2008056256","0.000012551","","","",""
"1783","37.394213736","10.10.3.105","10.10.3.102","MPTCP","2940","34880  >  5201 [PSH, ACK] Seq=894230 Ack=1 Win=64256 Len=2848 TSval=2008056256 TSecr=1039182953","","","","",""
"1784","37.394218349","10.10.3.102","10.10.3.105","MPTCP","80","5201  >  34880 [ACK] Seq=1 Ack=897078 Win=1024640 Len=0 TSval=1039182953 TSecr=2008056256","0.000004613","","","",""
"1785","37.394628309","10.10.3.105","10.10.3.102","MPTCP","48508","34880  >  5201 [PSH, ACK] Seq=897078 Ack=1 Win=64256 Len=48416 TSval=2008056256 TSecr=1039182953","","","","",""
"1786","37.394642577","10.10.3.102","10.10.3.105","MPTCP","80","5201  >  34880 [ACK] Seq=1 Ack=945494 Win=1121536 Len=0 TSval=1039182954 TSecr=2008056256","0.000014268","","","",""
"1787","37.394721473","10.10.3.105","10.10.3.102","MPTCP","11484","34880  >  5201 [PSH, ACK] Seq=945494 Ack=1 Win=64256 Len=11392 TSval=2008056257 TSecr=1039182953","","","","",""
"1788","37.394728076","10.10.3.102","10.10.3.105","MPTCP","80","5201  >  34880 [ACK] Seq=1 Ack=956886 Win=1144320 Len=0 TSval=1039182954 TSecr=2008056257","0.000006603","","","",""
"1789","37.394755151","10.10.3.105","10.10.3.102","MPTCP","2988","34880  >  5201 [PSH, ACK] Seq=956886 Ack=1 Win=64256 Len=2896 TSval=2008056257 TSecr=1039182953","","","","",""
"1790","37.394760337","10.10.3.102","10.10.3.105","MPTCP","80","5201  >  34880 [ACK] Seq=1 Ack=959782 Win=1150080 Len=0 TSval=1039182954 TSecr=2008056257","0.000005186","","","",""
"1791","37.398407917","10.10.3.62","10.10.3.102","MPTCP","1516","39405  >  5201 [ACK] Seq=16145 Ack=1 Win=64256 Len=1424 TSval=3345223419 TSecr=2492001161","","","","",""
"1792","37.398417436","10.10.3.102","10.10.3.62","MPTCP","80","5201  >  39405 [ACK] Seq=1 Ack=17569 Win=1150080 Len=0 TSval=2492001239 TSecr=3345223419","0.000009519","","","",""
"1793","37.403643131","10.10.3.105","10.10.3.59","MPTCP","1516","47495  >  5201 [ACK] Seq=18769 Ack=1 Win=64256 Len=1424 TSval=937311542 TSecr=1399291281","","","","",""
"1794","37.403675713","10.10.3.59","10.10.3.105","MPTCP","80","5201  >  47495 [ACK] Seq=1 Ack=20193 Win=1148544 Len=0 TSval=1399291341 TSecr=937311542","0.000032582","","","",""
"1795","37.410540977","10.10.3.62","10.10.3.102","MPTCP","1516","39405  >  5201 [ACK] Seq=17569 Ack=1 Win=64256 Len=1424 TSval=3345223419 TSecr=2492001161","","","","",""
"1796","37.410568990","10.10.3.102","10.10.3.62","MPTCP","80","5201  >  39405 [ACK] Seq=1 Ack=18993 Win=1148672 Len=0 TSval=2492001251 TSecr=3345223419","0.000028013","","","",""
"1797","37.412319890","10.10.3.105","10.10.3.59","MPTCP","1516","47495  >  5201 [PSH, ACK] Seq=20193 Ack=1 Win=64256 Len=1424 TSval=937311542 TSecr=1399291281","","","","",""
"1798","37.412352119","10.10.3.59","10.10.3.105","MPTCP","80","5201  >  47495 [ACK] Seq=1 Ack=21617 Win=1147264 Len=0 TSval=1399291350 TSecr=937311542","0.000032229","","","",""
"1799","37.423553365","10.10.3.62","10.10.3.102","MPTCP","1516","39405  >  5201 [ACK] Seq=18993 Ack=1 Win=64256 Len=1424 TSval=3345223419 TSecr=2492001161","","","","",""
"1800","37.423591691","10.10.3.102","10.10.3.62","MPTCP","80","5201  >  39405 [ACK] Seq=1 Ack=20417 Win=1147264 Len=0 TSval=2492001264 TSecr=3345223419","0.000038326","","","",""
"1801","37.425660583","10.10.3.105","10.10.3.59","MPTCP","1516","47495  >  5201 [ACK] Seq=21617 Ack=1 Win=64256 Len=1424 TSval=937311543 TSecr=1399291281","","","","",""
"1802","37.425697934","10.10.3.59","10.10.3.105","MPTCP","80","5201  >  47495 [ACK] Seq=1 Ack=23041 Win=1145856 Len=0 TSval=1399291363 TSecr=937311543","0.000037351","","","",""
"1803","37.434297197","10.10.3.62","10.10.3.102","MPTCP","1516","39405  >  5201 [PSH, ACK] Seq=20417 Ack=1 Win=64256 Len=1424 TSval=3345223419 TSecr=2492001161","","","","",""
"1804","37.434341947","10.10.3.102","10.10.3.62","MPTCP","80","5201  >  39405 [ACK] Seq=1 Ack=21841 Win=1145856 Len=0 TSval=2492001275 TSecr=3345223419","0.000044750","","","",""
"1805","37.435872978","10.10.3.105","10.10.3.59","MPTCP","1516","47495  >  5201 [ACK] Seq=23041 Ack=1 Win=64256 Len=1424 TSval=937311543 TSecr=1399291281","","","","",""
"1806","37.435925127","10.10.3.59","10.10.3.105","MPTCP","80","5201  >  47495 [ACK] Seq=1 Ack=24465 Win=1144448 Len=0 TSval=1399291373 TSecr=937311543","0.000052149","","","",""
"1808","37.446173458","10.10.3.62","10.10.3.102","MPTCP","1516","39405  >  5201 [ACK] Seq=21841 Ack=1 Win=64256 Len=1424 TSval=3345223454 TSecr=2492001215","","","","",""
"1809","37.446217483","10.10.3.102","10.10.3.62","MPTCP","80","5201  >  39405 [ACK] Seq=1 Ack=23265 Win=1144448 Len=0 TSval=2492001286 TSecr=3345223454","0.000044025","","","",""
