"No.","Time","Source","Destination","Protocol","Length","Info","RTT","Lost Segement","Duplicate ","Retransmission","IDK"
"209","9.105086285","10.10.3.105","10.10.3.102","MPTCP","80","60436  >  5201 [SYN] Seq=0 Win=64240 Len=0 MSS=1460 SACK_PERM=1 TSval=2007702816 TSecr=0 WS=128","","","","",""
"210","9.105112203","10.10.3.102","10.10.3.105","MPTCP","88","5201  >  60436 [SYN, ACK] Seq=0 Ack=1 Win=65160 Len=0 MSS=1460 SACK_PERM=1 TSval=1038829516 TSecr=2007702816 WS=128","0.000025918","","","",""
"211","9.105196690","10.10.3.105","10.10.3.102","MPTCP","88","60436  >  5201 [ACK] Seq=1 Ack=1 Win=64256 Len=0 TSval=2007702816 TSecr=1038829516","0.000084487","","","",""
"212","9.105259354","10.10.3.105","10.10.3.102","MPTCP","129","60436  >  5201 [PSH, ACK] Seq=1 Ack=1 Win=64256 Len=37 TSval=2007702816 TSecr=1038829516","","","","",""
"213","9.105269200","10.10.3.102","10.10.3.105","MPTCP","80","5201  >  60436 [ACK] Seq=1 Ack=38 Win=65152 Len=0 TSval=1038829516 TSecr=2007702816","0.000009846","","","",""
"214","9.105315458","10.10.3.102","10.10.3.105","MPTCP","97","5201  >  60436 [PSH, ACK] Seq=1 Ack=38 Win=65152 Len=1 TSval=1038829516 TSecr=2007702816","","","","",""
"215","9.105369060","10.10.3.105","10.10.3.102","MPTCP","80","60436  >  5201 [ACK] Seq=38 Ack=2 Win=64256 Len=0 TSval=2007702816 TSecr=1038829516","0.000053602","","","",""
"216","9.105391344","10.10.3.102","10.10.3.105","MPTCP","84","[TCP Dup ACK 213#1] 5201  >  60436 [ACK] Seq=2 Ack=38 Win=65152 Len=0 TSval=1038829517 TSecr=2007702816","","","â\234\223","","â\234\223"
"217","9.105440805","10.10.3.105","10.10.3.102","MPTCP","76","60436  >  5201 [ACK] Seq=38 Ack=2 Win=64256 Len=0 TSval=2007702816 TSecr=1038829517","","","","",""
"218","9.105594954","10.10.3.105","10.10.3.102","MPTCP","100","60436  >  5201 [PSH, ACK] Seq=38 Ack=2 Win=64256 Len=4 TSval=2007702817 TSecr=1038829517","","","","",""
"219","9.106202470","10.10.3.62","10.10.3.102","MPTCP","88","44763  >  5201 [SYN] Seq=0 Win=64256 Len=0 MSS=1460 SACK_PERM=1 TSval=3344870021 TSecr=0 WS=128","","","","",""
"220","9.106218790","10.10.3.102","10.10.3.62","MPTCP","92","5201  >  44763 [SYN, ACK] Seq=0 Ack=1 Win=65160 Len=0 MSS=1460 SACK_PERM=1 TSval=2491647798 TSecr=3344870021 WS=128","0.000016320","","","",""
"221","9.106763441","10.10.3.105","10.10.3.59","MPTCP","88","33955  >  5201 [SYN] Seq=0 Win=64256 Len=0 MSS=1460 SACK_PERM=1 TSval=936958148 TSecr=0 WS=128","","","","",""
"222","9.106780910","10.10.3.59","10.10.3.105","MPTCP","92","5201  >  33955 [SYN, ACK] Seq=0 Ack=1 Win=65160 Len=0 MSS=1460 SACK_PERM=1 TSval=1398937896 TSecr=936958148 WS=128","0.000017469","","","",""
"223","9.109161608","10.10.3.62","10.10.3.102","MPTCP","92","44763  >  5201 [ACK] Seq=1 Ack=1 Win=64256 Len=0 TSval=3344870024 TSecr=2491647798","0.002942818","","","",""
"224","9.109205064","10.10.3.102","10.10.3.62","MPTCP","80","[TCP Window Update] 5201  >  44763 [ACK] Seq=1 Ack=1 Win=65280 Len=0 TSval=2491647801 TSecr=3344870024","","","","","â\234\223"
"226","9.112179744","10.10.3.105","10.10.3.59","MPTCP","92","33955  >  5201 [ACK] Seq=1 Ack=1 Win=64256 Len=0 TSval=936958152 TSecr=1398937896","0.005398834","","","",""
"227","9.112223530","10.10.3.59","10.10.3.105","MPTCP","80","[TCP Window Update] 5201  >  33955 [ACK] Seq=1 Ack=1 Win=65280 Len=0 TSval=1398937901 TSecr=936958152","","","","","â\234\223"
"228","9.149595512","10.10.3.102","10.10.3.105","MPTCP","80","5201  >  60436 [ACK] Seq=2 Ack=42 Win=65280 Len=0 TSval=1038829561 TSecr=2007702817","0.044000558","","","",""
"229","9.149936726","10.10.3.105","10.10.3.102","MPTCP","196","60436  >  5201 [PSH, ACK] Seq=42 Ack=2 Win=64256 Len=100 TSval=2007702861 TSecr=1038829561","","","","",""
"230","9.149961022","10.10.3.102","10.10.3.105","MPTCP","80","5201  >  60436 [ACK] Seq=2 Ack=142 Win=65280 Len=0 TSval=1038829561 TSecr=2007702861","0.000024296","","","",""
"231","9.150030538","10.10.3.102","10.10.3.105","MPTCP","97","5201  >  60436 [PSH, ACK] Seq=2 Ack=142 Win=65280 Len=1 TSval=1038829561 TSecr=2007702861","","","","",""
"232","9.150228416","10.10.3.105","10.10.3.102","MPTCP","80","60442  >  5201 [SYN] Seq=0 Win=64240 Len=0 MSS=1460 SACK_PERM=1 TSval=2007702861 TSecr=0 WS=128","","","","",""
"233","9.150277824","10.10.3.102","10.10.3.105","MPTCP","88","5201  >  60442 [SYN, ACK] Seq=0 Ack=1 Win=65160 Len=0 MSS=1460 SACK_PERM=1 TSval=1038829561 TSecr=2007702861 WS=128","0.000049408","","","",""
"235","9.150462075","10.10.3.105","10.10.3.102","MPTCP","88","60442  >  5201 [ACK] Seq=1 Ack=1 Win=64256 Len=0 TSval=2007702861 TSecr=1038829561","0.000184251","","","",""
"236","9.150527829","10.10.3.102","10.10.3.105","MPTCP","84","[TCP Window Update] 5201  >  60442 [ACK] Seq=1 Ack=1 Win=65280 Len=0 TSval=1038829562 TSecr=2007702861","","","","","â\234\223"
"237","9.150537891","10.10.3.105","10.10.3.102","MPTCP","129","60442  >  5201 [PSH, ACK] Seq=1 Ack=1 Win=64256 Len=37 TSval=2007702862 TSecr=1038829561","","","","",""
"238","9.150545094","10.10.3.102","10.10.3.105","MPTCP","80","5201  >  60442 [ACK] Seq=1 Ack=38 Win=65280 Len=0 TSval=1038829562 TSecr=2007702862","0.000007203","","","",""
"239","9.150691191","10.10.3.105","10.10.3.102","MPTCP","76","60442  >  5201 [ACK] Seq=38 Ack=1 Win=64256 Len=0 TSval=2007702862 TSecr=1038829562","","","","",""
"241","9.152597939","10.10.3.62","10.10.3.102","MPTCP","88","40493  >  5201 [SYN] Seq=0 Win=64256 Len=0 MSS=1460 SACK_PERM=1 TSval=3344870067 TSecr=0 WS=128","","","","",""
"242","9.152632588","10.10.3.102","10.10.3.62","MPTCP","92","5201  >  40493 [SYN, ACK] Seq=0 Ack=1 Win=65160 Len=0 MSS=1460 SACK_PERM=1 TSval=2491647845 TSecr=3344870067 WS=128","0.000034649","","","",""
"243","9.152760892","10.10.3.105","10.10.3.59","MPTCP","88","40057  >  5201 [SYN] Seq=0 Win=64256 Len=0 MSS=1460 SACK_PERM=1 TSval=936958194 TSecr=0 WS=128","","","","",""
"244","9.152776366","10.10.3.59","10.10.3.105","MPTCP","92","5201  >  40057 [SYN, ACK] Seq=0 Ack=1 Win=65160 Len=0 MSS=1460 SACK_PERM=1 TSval=1398937942 TSecr=936958194 WS=128","0.000015474","","","",""
"245","9.154305216","10.10.3.62","10.10.3.102","MPTCP","92","40493  >  5201 [ACK] Seq=1 Ack=1 Win=64256 Len=0 TSval=3344870070 TSecr=2491647845","0.001672628","","","",""
"246","9.154324542","10.10.3.105","10.10.3.59","MPTCP","92","40057  >  5201 [ACK] Seq=1 Ack=1 Win=64256 Len=0 TSval=936958196 TSecr=1398937942","0.001548176","","","",""
"247","9.154359912","10.10.3.102","10.10.3.62","MPTCP","80","[TCP Window Update] 5201  >  40493 [ACK] Seq=1 Ack=1 Win=65280 Len=0 TSval=2491647847 TSecr=3344870070","","","","","â\234\223"
"248","9.154363902","10.10.3.59","10.10.3.105","MPTCP","80","[TCP Window Update] 5201  >  40057 [ACK] Seq=1 Ack=1 Win=65280 Len=0 TSval=1398937944 TSecr=936958196","","","","","â\234\223"
"252","9.193572613","10.10.3.105","10.10.3.102","MPTCP","80","60436  >  5201 [ACK] Seq=142 Ack=3 Win=64256 Len=0 TSval=2007702905 TSecr=1038829561","0.043542075","","","",""
"253","9.193619316","10.10.3.102","10.10.3.105","MPTCP","98","5201  >  60436 [PSH, ACK] Seq=3 Ack=142 Win=65280 Len=2 TSval=1038829605 TSecr=2007702905","","","","",""
"254","9.193716563","10.10.3.105","10.10.3.102","MPTCP","80","60436  >  5201 [ACK] Seq=142 Ack=5 Win=64256 Len=0 TSval=2007702905 TSecr=1038829605","0.000097247","","","",""
"255","9.193844904","10.10.3.105","10.10.3.102","MPTCP","7212","60442  >  5201 [PSH, ACK] Seq=38 Ack=1 Win=64256 Len=7120 TSval=2007702905 TSecr=1038829562","","","","",""
"256","9.193870140","10.10.3.102","10.10.3.105","MPTCP","80","5201  >  60442 [ACK] Seq=1 Ack=7158 Win=60672 Len=0 TSval=1038829605 TSecr=2007702905","0.000025236","","","",""
"257","9.193916138","10.10.3.105","10.10.3.102","MPTCP","7212","60442  >  5201 [PSH, ACK] Seq=7158 Ack=1 Win=64256 Len=7120 TSval=2007702905 TSecr=1038829562","","","","",""
"258","9.193930535","10.10.3.102","10.10.3.105","MPTCP","80","5201  >  60442 [ACK] Seq=1 Ack=14278 Win=55680 Len=0 TSval=1038829605 TSecr=2007702905","0.000014397","","","",""
"259","9.194107055","10.10.3.105","10.10.3.102","MPTCP","10060","60442  >  5201 [PSH, ACK] Seq=14278 Ack=1 Win=64256 Len=9968 TSval=2007702905 TSecr=1038829605","","","","",""
"260","9.194120006","10.10.3.102","10.10.3.105","MPTCP","80","5201  >  60442 [ACK] Seq=1 Ack=24246 Win=58752 Len=0 TSval=1038829605 TSecr=2007702905","0.000012951","","","",""
"261","9.194181469","10.10.3.105","10.10.3.102","MPTCP","7212","60442  >  5201 [PSH, ACK] Seq=24246 Ack=1 Win=64256 Len=7120 TSval=2007702905 TSecr=1038829605","","","","",""
"262","9.194191877","10.10.3.102","10.10.3.105","MPTCP","80","5201  >  60442 [ACK] Seq=1 Ack=31366 Win=53760 Len=0 TSval=1038829605 TSecr=2007702905","0.000010408","","","",""
"263","9.194286320","10.10.3.105","10.10.3.102","MPTCP","11484","60442  >  5201 [PSH, ACK] Seq=31366 Ack=1 Win=64256 Len=11392 TSval=2007702905 TSecr=1038829605","","","","",""
"264","9.194300108","10.10.3.102","10.10.3.105","MPTCP","80","5201  >  60442 [ACK] Seq=1 Ack=42758 Win=86912 Len=0 TSval=1038829605 TSecr=2007702905","0.000013788","","","",""
"265","9.194446235","10.10.3.105","10.10.3.102","MPTCP","18604","60442  >  5201 [PSH, ACK] Seq=42758 Ack=1 Win=64256 Len=18512 TSval=2007702905 TSecr=1038829605","","","","",""
"266","9.194461344","10.10.3.102","10.10.3.105","MPTCP","80","5201  >  60442 [ACK] Seq=1 Ack=61270 Win=123904 Len=0 TSval=1038829606 TSecr=2007702905","0.000015109","","","",""
"267","9.194498456","10.10.3.105","10.10.3.102","MPTCP","1516","60442  >  5201 [ACK] Seq=61270 Ack=1 Win=64256 Len=1424 TSval=2007702905 TSecr=1038829605","","","","",""
"268","9.194509119","10.10.3.102","10.10.3.105","MPTCP","80","5201  >  60442 [ACK] Seq=1 Ack=62694 Win=126848 Len=0 TSval=1038829606 TSecr=2007702905","0.000010663","","","",""
"269","9.194551330","10.10.3.105","10.10.3.102","MPTCP","2716","60442  >  5201 [PSH, ACK] Seq=62694 Ack=1 Win=64256 Len=2624 TSval=2007702905 TSecr=1038829605","","","","",""
"270","9.194568926","10.10.3.102","10.10.3.105","MPTCP","80","5201  >  60442 [ACK] Seq=1 Ack=65318 Win=132096 Len=0 TSval=1038829606 TSecr=2007702905","0.000017596","","","",""
"271","9.194794762","10.10.3.105","10.10.3.102","MPTCP","28572","60442  >  5201 [PSH, ACK] Seq=65318 Ack=1 Win=64256 Len=28480 TSval=2007702905 TSecr=1038829605","","","","",""
"272","9.194812021","10.10.3.102","10.10.3.105","MPTCP","80","5201  >  60442 [ACK] Seq=1 Ack=93798 Win=189056 Len=0 TSval=1038829606 TSecr=2007702905","0.000017259","","","",""
"273","9.194952103","10.10.3.105","10.10.3.102","MPTCP","14332","60442  >  5201 [PSH, ACK] Seq=93798 Ack=1 Win=64256 Len=14240 TSval=2007702906 TSecr=1038829606","","","","",""
"274","9.194964816","10.10.3.102","10.10.3.105","MPTCP","80","5201  >  60442 [ACK] Seq=1 Ack=108038 Win=217472 Len=0 TSval=1038829606 TSecr=2007702906","0.000012713","","","",""
"275","9.195200873","10.10.3.105","10.10.3.102","MPTCP","28572","60442  >  5201 [PSH, ACK] Seq=108038 Ack=1 Win=64256 Len=28480 TSval=2007702906 TSecr=1038829606","","","","",""
"276","9.195217519","10.10.3.102","10.10.3.105","MPTCP","80","5201  >  60442 [ACK] Seq=1 Ack=136518 Win=242304 Len=0 TSval=1038829606 TSecr=2007702906","0.000016646","","","",""
"277","9.195455003","10.10.3.105","10.10.3.102","MPTCP","31068","60442  >  5201 [PSH, ACK] Seq=136518 Ack=1 Win=64256 Len=30976 TSval=2007702906 TSecr=1038829606","","","","",""
"278","9.195472779","10.10.3.102","10.10.3.105","MPTCP","80","5201  >  60442 [ACK] Seq=1 Ack=167494 Win=242304 Len=0 TSval=1038829607 TSecr=2007702906","0.000017776","","","",""
"279","9.195816215","10.10.3.105","10.10.3.102","MPTCP","41388","60442  >  5201 [PSH, ACK] Seq=167494 Ack=1 Win=64256 Len=41296 TSval=2007702906 TSecr=1038829606","","","","",""
"280","9.195836859","10.10.3.102","10.10.3.105","MPTCP","80","5201  >  60442 [ACK] Seq=1 Ack=208790 Win=242304 Len=0 TSval=1038829607 TSecr=2007702906","0.000020644","","","",""
"281","9.196017565","10.10.3.105","10.10.3.102","MPTCP","21452","60442  >  5201 [PSH, ACK] Seq=208790 Ack=1 Win=64256 Len=21360 TSval=2007702907 TSecr=1038829607","","","","",""
"282","9.196034632","10.10.3.102","10.10.3.105","MPTCP","80","5201  >  60442 [ACK] Seq=1 Ack=230150 Win=242304 Len=0 TSval=1038829607 TSecr=2007702907","0.000017067","","","",""
"283","9.196325417","10.10.3.105","10.10.3.102","MPTCP","35052","60442  >  5201 [PSH, ACK] Seq=230150 Ack=1 Win=64256 Len=34960 TSval=2007702907 TSecr=1038829607","","","","",""
"284","9.196349610","10.10.3.102","10.10.3.105","MPTCP","80","5201  >  60442 [ACK] Seq=1 Ack=265110 Win=242304 Len=0 TSval=1038829608 TSecr=2007702907","0.000024193","","","",""
"285","9.196379141","10.10.3.62","10.10.3.102","MPTCP","1516","40493  >  5201 [ACK] Seq=1 Ack=1 Win=64256 Len=1424 TSval=3344870110 TSecr=2491647847","","","","",""
"286","9.196389398","10.10.3.102","10.10.3.62","MPTCP","80","5201  >  40493 [ACK] Seq=1 Ack=1425 Win=242304 Len=0 TSval=2491647889 TSecr=3344870110","0.000010257","","","",""
"287","9.196602876","10.10.3.62","10.10.3.102","MPTCP","796","40493  >  5201 [PSH, ACK] Seq=1425 Ack=1 Win=64256 Len=704 TSval=3344870110 TSecr=2491647847","","","","",""
"288","9.196612389","10.10.3.102","10.10.3.62","MPTCP","80","5201  >  40493 [ACK] Seq=1 Ack=2129 Win=242304 Len=0 TSval=2491647889 TSecr=3344870110","0.000009513","","","",""
"289","9.196824670","10.10.3.105","10.10.3.59","MPTCP","1516","40057  >  5201 [ACK] Seq=1 Ack=1 Win=64256 Len=1424 TSval=936958237 TSecr=1398937944","","","","",""
"290","9.196863693","10.10.3.59","10.10.3.105","MPTCP","80","5201  >  40057 [ACK] Seq=1 Ack=1425 Win=240768 Len=0 TSval=1398937986 TSecr=936958237","0.000039023","","","",""
"291","9.196902552","10.10.3.105","10.10.3.59","MPTCP","1180","40057  >  5201 [PSH, ACK] Seq=1425 Ack=1 Win=64256 Len=1088 TSval=936958237 TSecr=1398937944","","","","",""
"292","9.196918630","10.10.3.59","10.10.3.105","MPTCP","80","5201  >  40057 [ACK] Seq=1 Ack=2513 Win=239872 Len=0 TSval=1398937986 TSecr=936958237","0.000016078","","","",""
"293","9.198236895","10.10.3.105","10.10.3.102","MPTCP","2300","60442  >  5201 [PSH, ACK] Seq=265110 Ack=1 Win=64256 Len=2208 TSval=2007702909 TSecr=1038829608","","","","",""
"294","9.198248553","10.10.3.102","10.10.3.105","MPTCP","80","5201  >  60442 [ACK] Seq=1 Ack=267318 Win=240128 Len=0 TSval=1038829609 TSecr=2007702909","0.000011658","","","",""
"295","9.198308234","10.10.3.105","10.10.3.102","MPTCP","348","60442  >  5201 [PSH, ACK] Seq=267318 Ack=1 Win=64256 Len=256 TSval=2007702909 TSecr=1038829609","","","","",""
"296","9.198333713","10.10.3.102","10.10.3.105","MPTCP","80","5201  >  60442 [ACK] Seq=1 Ack=267574 Win=240128 Len=0 TSval=1038829609 TSecr=2007702909","0.000025479","","","",""
"297","9.201780160","10.10.3.62","10.10.3.102","MPTCP","1516","40493  >  5201 [ACK] Seq=2129 Ack=1 Win=64256 Len=1424 TSval=3344870111 TSecr=2491647847","","","","",""
"298","9.201824271","10.10.3.102","10.10.3.62","MPTCP","80","5201  >  40493 [ACK] Seq=1 Ack=3553 Win=240896 Len=0 TSval=2491647894 TSecr=3344870111","0.000044111","","","",""
"299","9.203261016","10.10.3.105","10.10.3.102","MPTCP","860","60442  >  5201 [PSH, ACK] Seq=267574 Ack=1 Win=64256 Len=768 TSval=2007702914 TSecr=1038829609","","","","",""
"300","9.203305372","10.10.3.102","10.10.3.105","MPTCP","80","5201  >  60442 [ACK] Seq=1 Ack=268342 Win=240896 Len=0 TSval=1038829614 TSecr=2007702914","0.000044356","","","",""
"301","9.204549247","10.10.3.105","10.10.3.59","MPTCP","1516","40057  >  5201 [ACK] Seq=2513 Ack=1 Win=64256 Len=1424 TSval=936958237 TSecr=1398937944","","","","",""
"302","9.204592495","10.10.3.59","10.10.3.105","MPTCP","80","5201  >  40057 [ACK] Seq=1 Ack=3937 Win=239360 Len=0 TSval=1398937994 TSecr=936958237","0.000043248","","","",""
"303","9.213664466","10.10.3.62","10.10.3.102","MPTCP","1516","40493  >  5201 [ACK] Seq=3553 Ack=1 Win=64256 Len=1424 TSval=3344870111 TSecr=2491647847","","","","",""
"304","9.213709201","10.10.3.102","10.10.3.62","MPTCP","80","5201  >  40493 [ACK] Seq=1 Ack=4977 Win=239488 Len=0 TSval=2491647906 TSecr=3344870111","0.000044735","","","",""
"306","9.214508277","10.10.3.105","10.10.3.102","MPTCP","108","60442  >  5201 [PSH, ACK] Seq=268342 Ack=1 Win=64256 Len=16 TSval=2007702925 TSecr=1038829614","","","","",""
"307","9.214547785","10.10.3.102","10.10.3.105","MPTCP","80","5201  >  60442 [ACK] Seq=1 Ack=268358 Win=240896 Len=0 TSval=1038829626 TSecr=2007702925","0.000039508","","","",""
"308","9.214754372","10.10.3.105","10.10.3.102","MPTCP","1500","60442  >  5201 [PSH, ACK] Seq=268358 Ack=1 Win=64256 Len=1408 TSval=2007702926 TSecr=1038829626","","","","",""
"309","9.214792147","10.10.3.102","10.10.3.105","MPTCP","80","5201  >  60442 [ACK] Seq=1 Ack=269766 Win=240896 Len=0 TSval=1038829626 TSecr=2007702926","0.000037775","","","",""
"310","9.215774633","10.10.3.105","10.10.3.59","MPTCP","1516","40057  >  5201 [ACK] Seq=3937 Ack=1 Win=64256 Len=1424 TSval=936958237 TSecr=1398937944","","","","",""
"311","9.215829402","10.10.3.59","10.10.3.105","MPTCP","80","5201  >  40057 [ACK] Seq=1 Ack=5361 Win=239360 Len=0 TSval=1398938005 TSecr=936958237","0.000054769","","","",""
"312","9.225558227","10.10.3.62","10.10.3.102","MPTCP","1516","40493  >  5201 [ACK] Seq=4977 Ack=1 Win=64256 Len=1424 TSval=3344870111 TSecr=2491647847","","","","",""
"313","9.225603103","10.10.3.102","10.10.3.62","MPTCP","80","5201  >  40493 [ACK] Seq=1 Ack=6401 Win=239360 Len=0 TSval=2491647918 TSecr=3344870111","0.000044876","","","",""
"314","9.228724442","10.10.3.105","10.10.3.59","MPTCP","1516","40057  >  5201 [ACK] Seq=5361 Ack=1 Win=64256 Len=1424 TSval=936958237 TSecr=1398937944","","","","",""
"315","9.228778326","10.10.3.59","10.10.3.105","MPTCP","80","5201  >  40057 [ACK] Seq=1 Ack=6785 Win=238080 Len=0 TSval=1398938018 TSecr=936958237","0.000053884","","","",""
"316","9.229347514","10.10.3.105","10.10.3.102","MPTCP","124","60442  >  5201 [PSH, ACK] Seq=269766 Ack=1 Win=64256 Len=32 TSval=2007702940 TSecr=1038829626","","","","",""
"317","9.229379800","10.10.3.102","10.10.3.105","MPTCP","80","5201  >  60442 [ACK] Seq=1 Ack=269798 Win=240896 Len=0 TSval=1038829641 TSecr=2007702940","0.000032286","","","",""
"318","9.229497513","10.10.3.105","10.10.3.102","MPTCP","2908","60442  >  5201 [PSH, ACK] Seq=269798 Ack=1 Win=64256 Len=2816 TSval=2007702940 TSecr=1038829641","","","","",""
"319","9.229516715","10.10.3.102","10.10.3.105","MPTCP","80","5201  >  60442 [ACK] Seq=1 Ack=272614 Win=240896 Len=0 TSval=1038829641 TSecr=2007702940","0.000019202","","","",""
"320","9.237428230","10.10.3.62","10.10.3.102","MPTCP","1516","40493  >  5201 [ACK] Seq=6401 Ack=1 Win=64256 Len=1424 TSval=3344870111 TSecr=2491647847","","","","",""
"321","9.237470310","10.10.3.102","10.10.3.62","MPTCP","80","5201  >  40493 [ACK] Seq=1 Ack=7825 Win=240896 Len=0 TSval=2491647930 TSecr=3344870111","0.000042080","","","",""
"327","9.242330233","10.10.3.105","10.10.3.59","MPTCP","1516","40057  >  5201 [ACK] Seq=6785 Ack=1 Win=64256 Len=1424 TSval=936958237 TSecr=1398937944","","","","",""
"328","9.242387128","10.10.3.59","10.10.3.105","MPTCP","80","5201  >  40057 [ACK] Seq=1 Ack=8209 Win=239360 Len=0 TSval=1398938032 TSecr=936958237","0.000056895","","","",""
"329","9.249270261","10.10.3.62","10.10.3.102","MPTCP","1516","40493  >  5201 [PSH, ACK] Seq=7825 Ack=1 Win=64256 Len=1424 TSval=3344870111 TSecr=2491647847","","","","",""
"330","9.249313457","10.10.3.102","10.10.3.62","MPTCP","80","5201  >  40493 [ACK] Seq=1 Ack=9249 Win=239488 Len=0 TSval=2491647941 TSecr=3344870111","0.000043196","","","",""
"331","9.250120064","10.10.3.105","10.10.3.102","MPTCP","108","60442  >  5201 [PSH, ACK] Seq=272614 Ack=1 Win=64256 Len=16 TSval=2007702961 TSecr=1038829641","","","","",""
"332","9.253900820","10.10.3.105","10.10.3.59","MPTCP","1516","40057  >  5201 [PSH, ACK] Seq=8209 Ack=1 Win=64256 Len=1424 TSval=936958237 TSecr=1398937944","","","","",""
"333","9.253955408","10.10.3.59","10.10.3.105","MPTCP","80","5201  >  40057 [ACK] Seq=1 Ack=9633 Win=238080 Len=0 TSval=1398938043 TSecr=936958237","0.000054588","","","",""
"334","9.261140879","10.10.3.62","10.10.3.102","MPTCP","1516","40493  >  5201 [ACK] Seq=9249 Ack=1 Win=64256 Len=1424 TSval=3344870111 TSecr=2491647847","","","","",""
"335","9.261186979","10.10.3.102","10.10.3.62","MPTCP","80","5201  >  40493 [ACK] Seq=1 Ack=10673 Win=238080 Len=0 TSval=2491647953 TSecr=3344870111","0.000046100","","","",""
"336","9.267276596","10.10.3.105","10.10.3.59","MPTCP","1516","40057  >  5201 [ACK] Seq=9633 Ack=1 Win=64256 Len=1424 TSval=936958237 TSecr=1398937944","","","","",""
"337","9.267330484","10.10.3.59","10.10.3.105","MPTCP","80","5201  >  40057 [ACK] Seq=1 Ack=11057 Win=236672 Len=0 TSval=1398938056 TSecr=936958237","0.000053888","","","",""
"338","9.273034764","10.10.3.62","10.10.3.102","MPTCP","1516","40493  >  5201 [ACK] Seq=10673 Ack=1 Win=64256 Len=1424 TSval=3344870111 TSecr=2491647847","","","","",""
"339","9.273078365","10.10.3.102","10.10.3.62","MPTCP","80","5201  >  40493 [ACK] Seq=1 Ack=12097 Win=236672 Len=0 TSval=2491647965 TSecr=3344870111","0.000043601","","","",""
"340","9.277665758","10.10.3.105","10.10.3.59","MPTCP","1516","40057  >  5201 [ACK] Seq=11057 Ack=1 Win=64256 Len=1424 TSval=936958237 TSecr=1398937944","","","","",""
"341","9.277720698","10.10.3.59","10.10.3.105","MPTCP","80","5201  >  40057 [ACK] Seq=1 Ack=12481 Win=235264 Len=0 TSval=1398938067 TSecr=936958237","0.000054940","","","",""
"342","9.284697948","10.10.3.62","10.10.3.102","MPTCP","1516","40493  >  5201 [PSH, ACK] Seq=12097 Ack=1 Win=64256 Len=1424 TSval=3344870111 TSecr=2491647847","","","","",""
"343","9.284740437","10.10.3.102","10.10.3.62","MPTCP","80","5201  >  40493 [ACK] Seq=1 Ack=13521 Win=235264 Len=0 TSval=2491647977 TSecr=3344870111","0.000042489","","","",""
"344","9.289554097","10.10.3.105","10.10.3.59","MPTCP","1516","40057  >  5201 [PSH, ACK] Seq=12481 Ack=1 Win=64256 Len=1424 TSval=936958237 TSecr=1398937944","","","","",""
"345","9.289606921","10.10.3.59","10.10.3.105","MPTCP","80","5201  >  40057 [ACK] Seq=1 Ack=13905 Win=233856 Len=0 TSval=1398938079 TSecr=936958237","0.000052824","","","",""
"346","9.293588051","10.10.3.102","10.10.3.105","MPTCP","80","5201  >  60442 [ACK] Seq=1 Ack=272630 Win=240896 Len=0 TSval=1038829705 TSecr=2007702961","0.043467987","","","",""
"347","9.293884178","10.10.3.105","10.10.3.102","MPTCP","7196","60442  >  5201 [PSH, ACK] Seq=272630 Ack=1 Win=64256 Len=7104 TSval=2007703005 TSecr=1038829705","","","","",""
"348","9.293933153","10.10.3.102","10.10.3.105","MPTCP","80","5201  >  60442 [ACK] Seq=1 Ack=279734 Win=240896 Len=0 TSval=1038829705 TSecr=2007703005","0.000048975","","","",""
"349","9.296803364","10.10.3.62","10.10.3.102","MPTCP","1516","40493  >  5201 [ACK] Seq=13521 Ack=1 Win=64256 Len=1424 TSval=3344870115 TSecr=2491647889","","","","",""
"350","9.296847905","10.10.3.102","10.10.3.62","MPTCP","80","5201  >  40493 [ACK] Seq=1 Ack=14945 Win=240896 Len=0 TSval=2491647989 TSecr=3344870115","0.000044541","","","",""
"351","9.301232044","10.10.3.105","10.10.3.59","MPTCP","1516","40057  >  5201 [ACK] Seq=13905 Ack=1 Win=64256 Len=1424 TSval=936958241 TSecr=1398937986","","","","",""
"352","9.301286365","10.10.3.59","10.10.3.105","MPTCP","80","5201  >  40057 [ACK] Seq=1 Ack=15329 Win=239360 Len=0 TSval=1398938090 TSecr=936958241","0.000054321","","","",""
"353","9.308443366","10.10.3.62","10.10.3.102","MPTCP","1516","40493  >  5201 [PSH, ACK] Seq=14945 Ack=1 Win=64256 Len=1424 TSval=3344870115 TSecr=2491647889","","","","",""
"354","9.308481077","10.10.3.102","10.10.3.62","MPTCP","80","5201  >  40493 [ACK] Seq=1 Ack=16369 Win=239488 Len=0 TSval=2491648001 TSecr=3344870115","0.000037711","","","",""
"355","9.309795263","10.10.3.105","10.10.3.102","MPTCP","108","60442  >  5201 [PSH, ACK] Seq=279734 Ack=1 Win=64256 Len=16 TSval=2007703021 TSecr=1038829705","","","","",""
"356","9.313683389","10.10.3.105","10.10.3.59","MPTCP","316","40057  >  5201 [PSH, ACK] Seq=15329 Ack=1 Win=64256 Len=224 TSval=936958241 TSecr=1398937986","","","","",""
"357","9.313732706","10.10.3.59","10.10.3.105","MPTCP","80","5201  >  40057 [ACK] Seq=1 Ack=15553 Win=239360 Len=0 TSval=1398938103 TSecr=936958241","0.000049317","","","",""
"358","9.313956341","10.10.3.102","10.10.3.105","MPTCP","80","5201  >  60442 [ACK] Seq=1 Ack=279750 Win=278528 Len=0 TSval=1038829721 TSecr=2007703021","0.004161078","","","",""
"359","9.314752730","10.10.3.105","10.10.3.102","MPTCP","44236","60442  >  5201 [PSH, ACK] Seq=279750 Ack=1 Win=64256 Len=44144 TSval=2007703025 TSecr=1038829721","","","","",""
"360","9.314793138","10.10.3.102","10.10.3.105","MPTCP","80","5201  >  60442 [ACK] Seq=1 Ack=323894 Win=278528 Len=0 TSval=1038829726 TSecr=2007703025","0.000040408","","","",""
"361","9.314902920","10.10.3.105","10.10.3.102","MPTCP","18604","60442  >  5201 [PSH, ACK] Seq=323894 Ack=1 Win=64256 Len=18512 TSval=2007703025 TSecr=1038829721","","","","",""
"362","9.314919829","10.10.3.102","10.10.3.105","MPTCP","80","5201  >  60442 [ACK] Seq=1 Ack=342406 Win=278528 Len=0 TSval=1038829726 TSecr=2007703025","0.000016909","","","",""
"363","9.315048291","10.10.3.105","10.10.3.102","MPTCP","7948","60442  >  5201 [PSH, ACK] Seq=342406 Ack=1 Win=64256 Len=7856 TSval=2007703026 TSecr=1038829726","","","","",""
"364","9.315062509","10.10.3.102","10.10.3.105","MPTCP","80","5201  >  60442 [ACK] Seq=1 Ack=350262 Win=278528 Len=0 TSval=1038829726 TSecr=2007703026","0.000014218","","","",""
"365","9.315433318","10.10.3.105","10.10.3.102","MPTCP","44236","60442  >  5201 [PSH, ACK] Seq=350262 Ack=1 Win=64256 Len=44144 TSval=2007703026 TSecr=1038829726","","","","",""
"366","9.315454777","10.10.3.102","10.10.3.105","MPTCP","80","5201  >  60442 [ACK] Seq=1 Ack=394406 Win=278528 Len=0 TSval=1038829727 TSecr=2007703026","0.000021459","","","",""
"367","9.315494020","10.10.3.105","10.10.3.102","MPTCP","7212","60442  >  5201 [PSH, ACK] Seq=394406 Ack=1 Win=64256 Len=7120 TSval=2007703026 TSecr=1038829726","","","","",""
"368","9.315505540","10.10.3.102","10.10.3.105","MPTCP","80","5201  >  60442 [ACK] Seq=1 Ack=401526 Win=278528 Len=0 TSval=1038829727 TSecr=2007703026","0.000011520","","","",""
"369","9.315548870","10.10.3.105","10.10.3.102","MPTCP","700","60442  >  5201 [PSH, ACK] Seq=401526 Ack=1 Win=64256 Len=608 TSval=2007703026 TSecr=1038829726","","","","",""
"370","9.315560154","10.10.3.102","10.10.3.105","MPTCP","80","5201  >  60442 [ACK] Seq=1 Ack=402134 Win=278528 Len=0 TSval=1038829727 TSecr=2007703026","0.000011284","","","",""
"371","9.317080311","10.10.3.105","10.10.3.59","MPTCP","1516","40057  >  5201 [ACK] Seq=15553 Ack=1 Win=64256 Len=1424 TSval=936958357 TSecr=1398938090","","","","",""
"372","9.317109375","10.10.3.59","10.10.3.105","MPTCP","80","5201  >  40057 [ACK] Seq=1 Ack=16977 Win=278528 Len=0 TSval=1398938106 TSecr=936958357","0.000029064","","","",""
"373","9.320346022","10.10.3.62","10.10.3.102","MPTCP","1516","40493  >  5201 [ACK] Seq=16369 Ack=1 Win=64256 Len=1424 TSval=3344870119 TSecr=2491647894","","","","",""
"374","9.320375419","10.10.3.102","10.10.3.62","MPTCP","80","5201  >  40493 [ACK] Seq=1 Ack=17793 Win=276992 Len=0 TSval=2491648013 TSecr=3344870119","0.000029397","","","",""
"375","9.327480022","10.10.3.105","10.10.3.59","MPTCP","1516","40057  >  5201 [ACK] Seq=16977 Ack=1 Win=64256 Len=1424 TSval=936958357 TSecr=1398938090","","","","",""
"376","9.327507278","10.10.3.59","10.10.3.105","MPTCP","80","5201  >  40057 [ACK] Seq=1 Ack=18401 Win=277120 Len=0 TSval=1398938117 TSecr=936958357","0.000027256","","","",""
"377","9.328278187","10.10.3.105","10.10.3.102","MPTCP","108","60442  >  5201 [PSH, ACK] Seq=402134 Ack=1 Win=64256 Len=16 TSval=2007703039 TSecr=1038829727","","","","",""
"378","9.332213590","10.10.3.62","10.10.3.102","MPTCP","1516","40493  >  5201 [ACK] Seq=17793 Ack=1 Win=64256 Len=1424 TSval=3344870119 TSecr=2491647894","","","","",""
"379","9.332238347","10.10.3.102","10.10.3.62","MPTCP","80","5201  >  40493 [ACK] Seq=1 Ack=19217 Win=275712 Len=0 TSval=2491648024 TSecr=3344870119","0.000024757","","","",""
"380","9.339374762","10.10.3.105","10.10.3.59","MPTCP","1516","40057  >  5201 [PSH, ACK] Seq=18401 Ack=1 Win=64256 Len=1424 TSval=936958357 TSecr=1398938090","","","","",""
"381","9.339398596","10.10.3.59","10.10.3.105","MPTCP","80","5201  >  40057 [ACK] Seq=1 Ack=19825 Win=275712 Len=0 TSval=1398938129 TSecr=936958357","0.000023834","","","",""
"382","9.344283618","10.10.3.62","10.10.3.102","MPTCP","1516","40493  >  5201 [ACK] Seq=19217 Ack=1 Win=64256 Len=1424 TSval=3344870119 TSecr=2491647894","","","","",""
"383","9.344309594","10.10.3.102","10.10.3.62","MPTCP","80","5201  >  40493 [ACK] Seq=1 Ack=20641 Win=274304 Len=0 TSval=2491648036 TSecr=3344870119","0.000025976","","","",""
"384","9.351558931","10.10.3.105","10.10.3.59","MPTCP","1516","40057  >  5201 [ACK] Seq=19825 Ack=1 Win=64256 Len=1424 TSval=936958357 TSecr=1398938090","","","","",""
"385","9.351582491","10.10.3.59","10.10.3.105","MPTCP","80","5201  >  40057 [ACK] Seq=1 Ack=21249 Win=274304 Len=0 TSval=1398938141 TSecr=936958357","0.000023560","","","",""
"386","9.356126196","10.10.3.62","10.10.3.102","MPTCP","1516","40493  >  5201 [PSH, ACK] Seq=20641 Ack=1 Win=64256 Len=1424 TSval=3344870119 TSecr=2491647894","","","","",""
"387","9.356152657","10.10.3.102","10.10.3.62","MPTCP","80","5201  >  40493 [ACK] Seq=1 Ack=22065 Win=272896 Len=0 TSval=2491648048 TSecr=3344870119","0.000026461","","","",""
"388","9.356209459","10.10.3.102","10.10.3.105","MPTCP","80","5201  >  60442 [ACK] Seq=1 Ack=402150 Win=290304 Len=0 TSval=1038829739 TSecr=2007703039","0.027931272","","","",""
"389","9.356842288","10.10.3.105","10.10.3.102","MPTCP","17548","60442  >  5201 [PSH, ACK] Seq=402150 Ack=1 Win=64256 Len=17456 TSval=2007703068 TSecr=1038829739","","","","",""
"390","9.356871009","10.10.3.102","10.10.3.105","MPTCP","80","5201  >  60442 [ACK] Seq=1 Ack=419606 Win=325248 Len=0 TSval=1038829768 TSecr=2007703068","0.000028721","","","",""
"391","9.357377014","10.10.3.105","10.10.3.102","MPTCP","35036","60442  >  5201 [PSH, ACK] Seq=419606 Ack=1 Win=64256 Len=34944 TSval=2007703068 TSecr=1038829768","","","","",""
"392","9.357399301","10.10.3.102","10.10.3.105","MPTCP","80","5201  >  60442 [ACK] Seq=1 Ack=454550 Win=395136 Len=0 TSval=1038829769 TSecr=2007703068","0.000022287","","","",""
"393","9.357900530","10.10.3.105","10.10.3.102","MPTCP","44236","60442  >  5201 [PSH, ACK] Seq=454550 Ack=1 Win=64256 Len=44144 TSval=2007703068 TSecr=1038829769","","","","",""
"394","9.357927607","10.10.3.102","10.10.3.105","MPTCP","80","5201  >  60442 [ACK] Seq=1 Ack=498694 Win=483456 Len=0 TSval=1038829769 TSecr=2007703068","0.000027077","","","",""
"395","9.358056233","10.10.3.105","10.10.3.102","MPTCP","18604","60442  >  5201 [PSH, ACK] Seq=498694 Ack=1 Win=64256 Len=18512 TSval=2007703068 TSecr=1038829769","","","","",""
"396","9.358070879","10.10.3.102","10.10.3.105","MPTCP","80","5201  >  60442 [ACK] Seq=1 Ack=517206 Win=520448 Len=0 TSval=1038829769 TSecr=2007703068","0.000014646","","","",""
"397","9.358443972","10.10.3.105","10.10.3.102","MPTCP","44236","60442  >  5201 [PSH, ACK] Seq=517206 Ack=1 Win=64256 Len=44144 TSval=2007703069 TSecr=1038829769","","","","",""
"398","9.358461579","10.10.3.102","10.10.3.105","MPTCP","80","5201  >  60442 [ACK] Seq=1 Ack=561350 Win=608768 Len=0 TSval=1038829770 TSecr=2007703069","0.000017607","","","",""
"399","9.358591820","10.10.3.105","10.10.3.102","MPTCP","18604","60442  >  5201 [PSH, ACK] Seq=561350 Ack=1 Win=64256 Len=18512 TSval=2007703069 TSecr=1038829769","","","","",""
"400","9.358602470","10.10.3.102","10.10.3.105","MPTCP","80","5201  >  60442 [ACK] Seq=1 Ack=579862 Win=645760 Len=0 TSval=1038829770 TSecr=2007703069","0.000010650","","","",""
"401","9.358824560","10.10.3.105","10.10.3.102","MPTCP","27148","60442  >  5201 [PSH, ACK] Seq=579862 Ack=1 Win=64256 Len=27056 TSval=2007703069 TSecr=1038829769","","","","",""
"402","9.358836364","10.10.3.102","10.10.3.105","MPTCP","80","5201  >  60442 [ACK] Seq=1 Ack=606918 Win=699904 Len=0 TSval=1038829770 TSecr=2007703069","0.000011804","","","",""
"403","9.359132467","10.10.3.105","10.10.3.102","MPTCP","35692","60442  >  5201 [PSH, ACK] Seq=606918 Ack=1 Win=64256 Len=35600 TSval=2007703070 TSecr=1038829770","","","","",""
"404","9.359146555","10.10.3.102","10.10.3.105","MPTCP","80","5201  >  60442 [ACK] Seq=1 Ack=642518 Win=771072 Len=0 TSval=1038829770 TSecr=2007703070","0.000014088","","","",""
"405","9.359223140","10.10.3.105","10.10.3.102","MPTCP","10060","60442  >  5201 [PSH, ACK] Seq=642518 Ack=1 Win=64256 Len=9968 TSval=2007703070 TSecr=1038829770","","","","",""
"406","9.359231892","10.10.3.102","10.10.3.105","MPTCP","80","5201  >  60442 [ACK] Seq=1 Ack=652486 Win=791040 Len=0 TSval=1038829770 TSecr=2007703070","0.000008752","","","",""
"407","9.359622691","10.10.3.105","10.10.3.102","MPTCP","47084","60442  >  5201 [PSH, ACK] Seq=652486 Ack=1 Win=64256 Len=46992 TSval=2007703070 TSecr=1038829770","","","","",""
"408","9.359640192","10.10.3.102","10.10.3.105","MPTCP","80","5201  >  60442 [ACK] Seq=1 Ack=699478 Win=884992 Len=0 TSval=1038829771 TSecr=2007703070","0.000017501","","","",""
"409","9.359669524","10.10.3.105","10.10.3.102","MPTCP","5788","60442  >  5201 [PSH, ACK] Seq=699478 Ack=1 Win=64256 Len=5696 TSval=2007703070 TSecr=1038829770","","","","",""
"410","9.359676792","10.10.3.102","10.10.3.105","MPTCP","80","5201  >  60442 [ACK] Seq=1 Ack=705174 Win=896384 Len=0 TSval=1038829771 TSecr=2007703070","0.000007268","","","",""
"411","9.360041355","10.10.3.105","10.10.3.102","MPTCP","41388","60442  >  5201 [PSH, ACK] Seq=705174 Ack=1 Win=64256 Len=41296 TSval=2007703070 TSecr=1038829770","","","","",""
"412","9.360054771","10.10.3.102","10.10.3.105","MPTCP","80","5201  >  60442 [ACK] Seq=1 Ack=746470 Win=978944 Len=0 TSval=1038829771 TSecr=2007703070","0.000013416","","","",""
"413","9.360225387","10.10.3.105","10.10.3.102","MPTCP","21452","60442  >  5201 [PSH, ACK] Seq=746470 Ack=1 Win=64256 Len=21360 TSval=2007703071 TSecr=1038829771","","","","",""
"414","9.360236462","10.10.3.102","10.10.3.105","MPTCP","80","5201  >  60442 [ACK] Seq=1 Ack=767830 Win=1021696 Len=0 TSval=1038829771 TSecr=2007703071","0.000011075","","","",""
"415","9.360509702","10.10.3.105","10.10.3.102","MPTCP","34268","60442  >  5201 [PSH, ACK] Seq=767830 Ack=1 Win=64256 Len=34176 TSval=2007703071 TSecr=1038829771","","","","",""
"416","9.360522713","10.10.3.102","10.10.3.105","MPTCP","80","5201  >  60442 [ACK] Seq=1 Ack=802006 Win=1090048 Len=0 TSval=1038829772 TSecr=2007703071","0.000013011","","","",""
"417","9.360765560","10.10.3.105","10.10.3.102","MPTCP","28572","60442  >  5201 [PSH, ACK] Seq=802006 Ack=1 Win=64256 Len=28480 TSval=2007703071 TSecr=1038829771","","","","",""
"418","9.360777931","10.10.3.102","10.10.3.105","MPTCP","80","5201  >  60442 [ACK] Seq=1 Ack=830486 Win=1147008 Len=0 TSval=1038829772 TSecr=2007703071","0.000012371","","","",""
"419","9.360878841","10.10.3.105","10.10.3.102","MPTCP","14332","60442  >  5201 [PSH, ACK] Seq=830486 Ack=1 Win=64256 Len=14240 TSval=2007703072 TSecr=1038829771","","","","",""
"420","9.360886723","10.10.3.102","10.10.3.105","MPTCP","80","5201  >  60442 [ACK] Seq=1 Ack=844726 Win=1175424 Len=0 TSval=1038829772 TSecr=2007703072","0.000007882","","","",""
"421","9.361079517","10.10.3.105","10.10.3.102","MPTCP","22876","60442  >  5201 [PSH, ACK] Seq=844726 Ack=1 Win=64256 Len=22784 TSval=2007703072 TSecr=1038829772","","","","",""
"422","9.361090830","10.10.3.102","10.10.3.105","MPTCP","80","5201  >  60442 [ACK] Seq=1 Ack=867510 Win=1220992 Len=0 TSval=1038829772 TSecr=2007703072","0.000011313","","","",""
"423","9.361307684","10.10.3.105","10.10.3.102","MPTCP","25724","60442  >  5201 [PSH, ACK] Seq=867510 Ack=1 Win=64256 Len=25632 TSval=2007703072 TSecr=1038829772","","","","",""
"424","9.361319888","10.10.3.102","10.10.3.105","MPTCP","80","5201  >  60442 [ACK] Seq=1 Ack=893142 Win=1272320 Len=0 TSval=1038829772 TSecr=2007703072","0.000012204","","","",""
"425","9.361349100","10.10.3.105","10.10.3.102","MPTCP","5788","60442  >  5201 [ACK] Seq=893142 Ack=1 Win=64256 Len=5696 TSval=2007703072 TSecr=1038829772","","","","",""
"426","9.361355365","10.10.3.102","10.10.3.105","MPTCP","80","5201  >  60442 [ACK] Seq=1 Ack=898838 Win=1283712 Len=0 TSval=1038829773 TSecr=2007703072","0.000006265","","","",""
"427","9.361382402","10.10.3.105","10.10.3.102","MPTCP","4364","60442  >  5201 [PSH, ACK] Seq=898838 Ack=1 Win=64256 Len=4272 TSval=2007703072 TSecr=1038829772","","","","",""
"428","9.361387796","10.10.3.102","10.10.3.105","MPTCP","80","5201  >  60442 [ACK] Seq=1 Ack=903110 Win=1292288 Len=0 TSval=1038829773 TSecr=2007703072","0.000005394","","","",""
"429","9.361626514","10.10.3.105","10.10.3.102","MPTCP","28572","60442  >  5201 [PSH, ACK] Seq=903110 Ack=1 Win=64256 Len=28480 TSval=2007703072 TSecr=1038829772","","","","",""
"430","9.361642934","10.10.3.102","10.10.3.105","MPTCP","80","5201  >  60442 [ACK] Seq=1 Ack=931590 Win=1349248 Len=0 TSval=1038829773 TSecr=2007703072","0.000016420","","","",""
"431","9.361746016","10.10.3.105","10.10.3.102","MPTCP","14332","60442  >  5201 [PSH, ACK] Seq=931590 Ack=1 Win=64256 Len=14240 TSval=2007703072 TSecr=1038829772","","","","",""
"432","9.361756483","10.10.3.102","10.10.3.105","MPTCP","80","5201  >  60442 [ACK] Seq=1 Ack=945830 Win=1377664 Len=0 TSval=1038829773 TSecr=2007703072","0.000010467","","","",""
"433","9.361830665","10.10.3.105","10.10.3.102","MPTCP","10060","60442  >  5201 [PSH, ACK] Seq=945830 Ack=1 Win=64256 Len=9968 TSval=2007703072 TSecr=1038829772","","","","",""
"434","9.361837543","10.10.3.102","10.10.3.105","MPTCP","80","5201  >  60442 [ACK] Seq=1 Ack=955798 Win=1397632 Len=0 TSval=1038829773 TSecr=2007703072","0.000006878","","","",""
"435","9.361958815","10.10.3.105","10.10.3.102","MPTCP","14332","60442  >  5201 [PSH, ACK] Seq=955798 Ack=1 Win=64256 Len=14240 TSval=2007703072 TSecr=1038829772","","","","",""
"436","9.361966264","10.10.3.102","10.10.3.105","MPTCP","80","5201  >  60442 [ACK] Seq=1 Ack=970038 Win=1426048 Len=0 TSval=1038829773 TSecr=2007703072","0.000007449","","","",""
"437","9.362282508","10.10.3.105","10.10.3.102","MPTCP","37116","60442  >  5201 [PSH, ACK] Seq=970038 Ack=1 Win=64256 Len=37024 TSval=2007703072 TSecr=1038829773","","","","",""
"438","9.362297162","10.10.3.102","10.10.3.105","MPTCP","80","5201  >  60442 [ACK] Seq=1 Ack=1007062 Win=1500160 Len=0 TSval=1038829773 TSecr=2007703072","0.000014654","","","",""
"439","9.362372857","10.10.3.105","10.10.3.102","MPTCP","11484","60442  >  5201 [PSH, ACK] Seq=1007062 Ack=1 Win=64256 Len=11392 TSval=2007703073 TSecr=1038829773","","","","",""
"440","9.362381226","10.10.3.102","10.10.3.105","MPTCP","80","5201  >  60442 [ACK] Seq=1 Ack=1018454 Win=1522944 Len=0 TSval=1038829774 TSecr=2007703073","0.000008369","","","",""
"441","9.362767480","10.10.3.105","10.10.3.102","MPTCP","44236","60442  >  5201 [PSH, ACK] Seq=1018454 Ack=1 Win=64256 Len=44144 TSval=2007703073 TSecr=1038829773","","","","",""
"442","9.362780075","10.10.3.102","10.10.3.105","MPTCP","80","5201  >  60442 [ACK] Seq=1 Ack=1062598 Win=1611264 Len=0 TSval=1038829774 TSecr=2007703073","0.000012595","","","",""
"443","9.362830761","10.10.3.105","10.10.3.102","MPTCP","7772","60442  >  5201 [PSH, ACK] Seq=1062598 Ack=1 Win=64256 Len=7680 TSval=2007703073 TSecr=1038829773","","","","",""
"444","9.362837388","10.10.3.102","10.10.3.105","MPTCP","80","5201  >  60442 [ACK] Seq=1 Ack=1070278 Win=1626624 Len=0 TSval=1038829774 TSecr=2007703073","0.000006627","","","",""
"445","9.363612122","10.10.3.105","10.10.3.59","MPTCP","1516","40057  >  5201 [ACK] Seq=21249 Ack=1 Win=64256 Len=1424 TSval=936958357 TSecr=1398938090","","","","",""
"446","9.363641942","10.10.3.59","10.10.3.105","MPTCP","80","5201  >  40057 [ACK] Seq=1 Ack=22673 Win=1626624 Len=0 TSval=1398938153 TSecr=936958357","0.000029820","","","",""
