Time,No.,Source,Destination,Protocol,Length,Info,RTT,Lost Segement,Duplicate,Retransmission,IDK,Subflow,SubflowNo,packetloss,Time_Diff,Bandwidth,Jitter,Subflow1_RTT,Subflow1_packetloss,Subflow1_Bandwidth,Subflow1_Jitter,Subflow2_RTT,Subflow2_packetloss,Subflow2_Bandwidth,Subflow2_Jitter,Subflow3_RTT,Subflow3_packetloss,Subflow3_Bandwidth,Subflow3_Jitter
1970-01-01 00:01:02.106883295,1984,10.10.3.105,10.10.3.102,MPTCP,80,55084  >  5201 [SYN] Seq=0 Win=64240 Len=0 MSS=1460 SACK_PERM=1 TSval=2010519765 TSecr=0 WS=128,0.088057339,0,0,0,0,10.10.3.105_10.10.3.102,1.0,0.0,0.0,0.0,0.0,0.088057339,0.0,0.0,0.0,0.0,0.0,0.0,0.0,0.0,0.0,0.0,0.0
1970-01-01 00:01:02.194940634,1985,10.10.3.102,10.10.3.105,MPTCP,88,"5201  >  55084 [SYN, ACK] Seq=0 Ack=1 Win=65160 Len=0 MSS=1460 SACK_PERM=1 TSval=1041646465 TSecr=2010519765 WS=128",0.088057339,0,0,0,0,10.10.3.102_10.10.3.105,1.0,0.0,0.0880573389999952,999.3488447340516,0.0,0.088057339,0.0,999.3488447340516,0.0,0.0,0.0,0.0,0.0,0.0,0.0,0.0,0.0
1970-01-01 00:01:02.195521346,1986,10.10.3.105,10.10.3.102,MPTCP,88,55084  >  5201 [ACK] Seq=1 Ack=1 Win=64256 Len=0 TSval=2010519853 TSecr=1041646465,0.000580712,0,0,0,0,10.10.3.105_10.10.3.102,1.0,0.0,0.0005807120000014,151538.1118347543,0.0168348847154168,0.000580712,0.0,151538.1118347543,0.0168348847154168,0.0,0.0,0.0,0.0,0.0,0.0,0.0,0.0
1970-01-01 00:01:02.195521999,1987,10.10.3.105,10.10.3.102,MPTCP,129,"55084  >  5201 [PSH, ACK] Seq=1 Ack=1 Win=64256 Len=37 TSval=2010519853 TSecr=1041646465",0.0443190255,0,0,0,0,10.10.3.105_10.10.3.102,1.0,0.0,6.530000007387571e-07,197549770.06747124,0.0218691567499999,0.0443190255,0.0,197549770.06747124,0.0218691567499999,0.0,0.0,0.0,0.0,0.0,0.0,0.0,0.0
1970-01-01 00:01:02.286128704,1989,10.10.3.102,10.10.3.105,MPTCP,97,"5201  >  55084 [PSH, ACK] Seq=1 Ack=38 Win=65152 Len=1 TSval=1041646554 TSecr=2010519853",0.090606705,0,0,0,0,10.10.3.102_10.10.3.105,1.0,0.0,0.090606704999999,1070.5609480004937,0.0204701452266562,0.090606705,0.0,1070.5609480004937,0.0204701452266562,0.0,0.0,0.0,0.0,0.0,0.0,0.0,0.0
1970-01-01 00:01:02.286717125,1990,10.10.3.105,10.10.3.102,MPTCP,80,55084  >  5201 [ACK] Seq=38 Ack=2 Win=64256 Len=0 TSval=2010519944 TSecr=1041646554,0.000588421,0,0,0,0,10.10.3.105_10.10.3.102,1.0,0.0,0.0005884210000033,135957.0783495939,0.0147719891151791,0.000588421,0.0,135957.0783495939,0.0147719891151791,0.0,0.0,0.0,0.0,0.0,0.0,0.0,0.0
1970-01-01 00:01:02.286758637,1991,10.10.3.105,10.10.3.102,MPTCP,100,"55084  >  5201 [PSH, ACK] Seq=38 Ack=2 Win=64256 Len=4 TSval=2010519945 TSecr=1041646554",0.0230910647499999,0,0,0,0,10.10.3.105_10.10.3.102,1.0,0.0,4.151199999569144e-05,2408941.992926842,0.0124432305508106,0.0230910647499999,0.0,2408941.992926842,0.0124432305508106,0.0,0.0,0.0,0.0,0.0,0.0,0.0,0.0
1970-01-01 00:01:02.287041644,1992,10.10.3.62,10.10.3.102,MPTCP,88,44537  >  5201 [SYN] Seq=0 Win=64256 Len=0 MSS=1460 SACK_PERM=1 TSval=3347687149 TSecr=0 WS=128,0.120229089,0,0,0,0,10.10.3.62_10.10.3.102,2.0,0.0,0.0002830070000001,310946.372351029,0.0,0.0230910647499999,0.0,2408941.992926842,0.0124432305508106,0.120229089,0.0,310946.372351029,0.0,0.0,0.0,0.0,0.0
1970-01-01 00:01:02.288174145,1993,10.10.3.102,10.10.3.105,MPTCP,84,5201  >  55084 [ACK] Seq=2 Ack=38 Win=65152 Len=0 TSval=1041646554 TSecr=2010519853,0.023092992,0,0,0,0,10.10.3.102_10.10.3.105,1.0,0.0,0.0011325010000007,74172.11993627014,0.0109326512382476,0.023092992,0.0,74172.11993627014,0.0109326512382476,0.120229089,0.0,310946.372351029,0.0,0.0,0.0,0.0,0.0
1970-01-01 00:01:02.288785984,1994,10.10.3.105,10.10.3.102,MPTCP,76,55084  >  5201 [ACK] Seq=42 Ack=2 Win=64256 Len=0 TSval=2010519946 TSecr=1041646554,0.000588421,0,0,0,0,10.10.3.105_10.10.3.102,1.0,0.0,0.0006118390000011,124215.68419119218,0.0112513219850401,0.000588421,0.0,124215.68419119218,0.0112513219850401,0.120229089,0.0,310946.372351029,0.0,0.0,0.0,0.0,0.0
1970-01-01 00:01:02.289605184,1995,10.10.3.105,10.10.3.59,MPTCP,88,36471  >  5201 [SYN] Seq=0 Win=64256 Len=0 MSS=1460 SACK_PERM=1 TSval=939775278 TSecr=0 WS=128,3.0194e-05,0,0,0,0,10.10.3.105_10.10.3.59,3.0,0.0,0.0008192000000022,107421.87499970624,0.0,0.000588421,0.0,124215.68419119218,0.0112513219850401,0.120229089,0.0,310946.372351029,0.0,3.0194e-05,0.0,107421.87499970624,0.0
1970-01-01 00:01:02.289635378,1996,10.10.3.59,10.10.3.105,MPTCP,92,"5201  >  36471 [SYN, ACK] Seq=0 Ack=1 Win=65160 Len=0 MSS=1460 SACK_PERM=1 TSval=1401755026 TSecr=939775278 WS=128",3.0194e-05,0,0,0,0,10.10.3.59_10.10.3.105,3.0,0.0,3.0193999997152332e-05,3046962.9730634145,0.0,0.000588421,0.0,124215.68419119218,0.0112513219850401,0.120229089,0.0,310946.372351029,0.0,3.0194e-05,0.0,3046962.9730634145,0.0
1970-01-01 00:01:02.295130348,1997,10.10.3.105,10.10.3.59,MPTCP,92,36471  >  5201 [ACK] Seq=1 Ack=1 Win=64256 Len=0 TSval=939775280 TSecr=1401755026,0.00549497,0,0,0,0,10.10.3.105_10.10.3.59,3.0,0.0,0.0054949700000008,16742.584581896775,0.0010516966315536,0.000588421,0.0,124215.68419119218,0.0112513219850401,0.120229089,0.0,310946.372351029,0.0,0.00549497,0.0,16742.584581896775,0.0010516966315536
1970-01-01 00:01:02.295178413,1998,10.10.3.59,10.10.3.105,MPTCP,80,[TCP Window Update] 5201  >  36471 [ACK] Seq=1 Ack=1 Win=65280 Len=0 TSval=1401755032 TSecr=939775280,0.002762582,0,0,0,1,10.10.3.59_10.10.3.105,3.0,0.0,4.8065000001429325e-05,1664412.7743185482,0.001366194,0.000588421,0.0,124215.68419119218,0.0112513219850401,0.120229089,0.0,310946.372351029,0.0,0.002762582,0.0,1664412.7743185482,0.001366194
1970-01-01 00:01:02.295384037,1999,10.10.3.105,10.10.3.59,MPTCP,92,[TCP Dup ACK 1997#1] 36471  >  5201 [ACK] Seq=1 Ack=1 Win=64256 Len=0 TSval=939775285 TSecr=1401755026,0.004128776,0,1,0,1,10.10.3.105_10.10.3.59,3.0,0.0,0.0002056239999959,447418.5892786399,0.0017190897510767,0.000588421,0.0,124215.68419119218,0.0112513219850401,0.120229089,0.0,310946.372351029,0.0,0.004128776,0.0,447418.5892786399,0.0017190897510767
1970-01-01 00:01:02.295391290,2000,10.10.3.59,10.10.3.105,MPTCP,80,[TCP Dup ACK 1996#1] 5201  >  36471 [ACK] Seq=1 Ack=1 Win=65280 Len=0 TSval=1401755032 TSecr=939775285,0.00549497,0,1,0,1,10.10.3.59_10.10.3.105,3.0,0.0,7.252999999707299e-06,11029918.654795043,0.0015938929999999,0.000588421,0.0,124215.68419119218,0.0112513219850401,0.120229089,0.0,310946.372351029,0.0,0.00549497,0.0,11029918.654795043,0.0015938929999999
1970-01-01 00:01:02.303185936,2001,10.10.3.102,10.10.3.105,MPTCP,80,[TCP Keep-Alive] 5201  >  55084 [ACK] Seq=1 Ack=38 Win=65152 Len=0 TSval=1041646554 TSecr=2010519853,0.000588421,0,0,0,1,10.10.3.102_10.10.3.105,1.0,0.0,0.0077946460000006,10263.455197323008,0.0129924637995172,0.000588421,0.0,10263.455197323008,0.0129924637995172,0.120229089,0.0,310946.372351029,0.0,0.00549497,0.0,11029918.654795043,0.0015938929999999
1970-01-01 00:01:02.303766830,2002,10.10.3.105,10.10.3.102,MPTCP,80,[TCP Keep-Alive ACK] 55084  >  5201 [ACK] Seq=42 Ack=2 Win=64256 Len=0 TSval=2010519961 TSecr=1041646554,0.000588421,0,0,0,1,10.10.3.105_10.10.3.102,1.0,0.0,0.0005808940000022,137718.75763854812,0.0112522854999999,0.000588421,0.0,137718.75763854812,0.0112522854999999,0.120229089,0.0,310946.372351029,0.0,0.00549497,0.0,11029918.654795043,0.0015938929999999
1970-01-01 00:01:02.407270733,2004,10.10.3.102,10.10.3.62,MPTCP,92,"5201  >  44537 [SYN, ACK] Seq=0 Ack=1 Win=65160 Len=0 MSS=1460 SACK_PERM=1 TSval=2494464927 TSecr=3347687149 WS=128",0.120229089,0,0,0,0,10.10.3.102_10.10.3.62,2.0,0.0,0.1035039029999964,888.8553700240961,0.0,0.000588421,0.0,137718.75763854812,0.0112522854999999,0.120229089,0.0,888.8553700240961,0.0,0.00549497,0.0,11029918.654795043,0.0015938929999999
1970-01-01 00:01:02.426550086,2005,10.10.3.102,10.10.3.105,MPTCP,80,5201  >  55084 [ACK] Seq=2 Ack=42 Win=65280 Len=0 TSval=1041646689 TSecr=2010519945,0.139791449,0,0,0,0,10.10.3.102_10.10.3.105,1.0,0.0,0.0192793530000017,4149.516843225645,0.0174003784999999,0.139791449,0.0,4149.516843225645,0.0174003784999999,0.120229089,0.0,888.8553700240961,0.0,0.00549497,0.0,11029918.654795043,0.0015938929999999
1970-01-01 00:01:02.427083508,2006,10.10.3.105,10.10.3.102,MPTCP,196,"55084  >  5201 [PSH, ACK] Seq=42 Ack=2 Win=64256 Len=100 TSval=2010520085 TSecr=1041646689",0.070189935,0,0,0,0,10.10.3.105_10.10.3.102,1.0,0.0,0.0005334220000037,367438.9132781013,0.0333191881222411,0.070189935,0.0,367438.9132781013,0.0333191881222411,0.120229089,0.0,888.8553700240961,0.0,0.00549497,0.0,11029918.654795043,0.0015938929999999
1970-01-01 00:01:02.520079838,2007,10.10.3.102,10.10.3.105,MPTCP,80,5201  >  55084 [ACK] Seq=2 Ack=142 Win=65280 Len=0 TSval=1041646786 TSecr=2010520085,0.09299633,0,0,0,0,10.10.3.102_10.10.3.105,1.0,0.0,0.0929963299999983,860.2490012240426,0.0405657094550134,0.09299633,0.0,860.2490012240426,0.0405657094550134,0.120229089,0.0,888.8553700240961,0.0,0.00549497,0.0,11029918.654795043,0.0015938929999999
1970-01-01 00:01:02.530975349,2008,10.10.3.102,10.10.3.105,MPTCP,97,"5201  >  55084 [PSH, ACK] Seq=2 Ack=142 Win=65280 Len=1 TSval=1041646786 TSecr=2010520085",0.1163938895,0,0,0,0,10.10.3.102_10.10.3.105,1.0,0.0,0.010895511000001,8902.749031228584,0.0345540527335488,0.1163938895,0.0,8902.749031228584,0.0345540527335488,0.120229089,0.0,888.8553700240961,0.0,0.00549497,0.0,11029918.654795043,0.0015938929999999
1970-01-01 00:01:02.531634495,2009,10.10.3.105,10.10.3.102,MPTCP,80,55092  >  5201 [SYN] Seq=0 Win=64240 Len=0 MSS=1460 SACK_PERM=1 TSval=2010520189 TSecr=0 WS=128,0.10469510975,0,0,0,0,10.10.3.105_10.10.3.102,1.0,0.0,0.0006591459999967,121369.16555724767,0.0197055608956545,0.10469510975,0.0,121369.16555724767,0.0197055608956545,0.120229089,0.0,888.8553700240961,0.0,0.00549497,0.0,11029918.654795043,0.0015938929999999
1970-01-01 00:01:02.574871494,2012,10.10.3.105,10.10.3.102,MPTCP,80,55084  >  5201 [ACK] Seq=142 Ack=3 Win=64256 Len=0 TSval=2010520233 TSecr=1041646786,0.043896145,0,0,0,0,10.10.3.105_10.10.3.102,1.0,0.0,0.0432369990000012,1850.2671751107828,0.015291325287781,0.043896145,0.0,1850.2671751107828,0.015291325287781,0.120229089,0.0,888.8553700240961,0.0,0.00549497,0.0,11029918.654795043,0.0015938929999999
1970-01-01 00:01:02.624492176,2014,10.10.3.102,10.10.3.105,MPTCP,88,"5201  >  55092 [SYN, ACK] Seq=0 Ack=1 Win=65160 Len=0 MSS=1460 SACK_PERM=1 TSval=1041646890 TSecr=2010520189 WS=128",0.092857681,0,0,0,0,10.10.3.102_10.10.3.105,1.0,0.0,0.0496206819999969,1773.4540609499377,0.0178781950041058,0.092857681,0.0,1773.4540609499377,0.0178781950041058,0.120229089,0.0,888.8553700240961,0.0,0.00549497,0.0,11029918.654795043,0.0015938929999999
1970-01-01 00:01:02.624827998,2015,10.10.3.105,10.10.3.102,MPTCP,88,55092  >  5201 [ACK] Seq=1 Ack=1 Win=64256 Len=0 TSval=2010520283 TSecr=1041646890,0.000335822,0,0,0,0,10.10.3.105_10.10.3.102,1.0,0.0,0.0003358220000038,262043.5826092396,0.0192599678706157,0.000335822,0.0,262043.5826092396,0.0192599678706157,0.120229089,0.0,888.8553700240961,0.0,0.00549497,0.0,11029918.654795043,0.0015938929999999
1970-01-01 00:01:02.624828593,2016,10.10.3.105,10.10.3.102,MPTCP,129,"55092  >  5201 [PSH, ACK] Seq=1 Ack=1 Win=64256 Len=37 TSval=2010520283 TSecr=1041646890",0.0343563675,0,0,0,0,10.10.3.105_10.10.3.102,1.0,0.0,5.949999959398156e-07,216806724.1685299,0.0221879763519612,0.0343563675,0.0,216806724.1685299,0.0221879763519612,0.120229089,0.0,888.8553700240961,0.0,0.00549497,0.0,11029918.654795043,0.0015938929999999
1970-01-01 00:01:02.720488116,2018,10.10.3.102,10.10.3.105,MPTCP,84,5201  >  55092 [ACK] Seq=1 Ack=38 Win=65152 Len=0 TSval=1041646983 TSecr=2010520283,0.095659523,0,0,0,0,10.10.3.102_10.10.3.105,1.0,0.0,0.0956595230000019,878.1143514587494,0.0195929254437421,0.095659523,0.0,878.1143514587494,0.0195929254437421,0.120229089,0.0,888.8553700240961,0.0,0.00549497,0.0,11029918.654795043,0.0015938929999999
1970-01-01 00:01:02.720741055,2019,10.10.3.105,10.10.3.102,MPTCP,76,55092  >  5201 [ACK] Seq=38 Ack=1 Win=64256 Len=0 TSval=2010520378 TSecr=1041646983,0.0479976725,0,0,0,0,10.10.3.105_10.10.3.102,1.0,0.0,0.0002529389999992,300467.70169974276,0.0095127263461545,0.0479976725,0.0,300467.70169974276,0.0095127263461545,0.120229089,0.0,888.8553700240961,0.0,0.00549497,0.0,11029918.654795043,0.0015938929999999
1970-01-01 00:01:02.721491350,2020,10.10.3.62,10.10.3.102,MPTCP,88,45311  >  5201 [SYN] Seq=0 Win=64256 Len=0 MSS=1460 SACK_PERM=1 TSval=3347687584 TSecr=0 WS=128,0.120229089,0,0,0,0,10.10.3.62_10.10.3.102,2.0,0.0,0.0007502950000031,117287.2003673675,0.0,0.0479976725,0.0,300467.70169974276,0.0095127263461545,0.120229089,0.0,117287.2003673675,0.0,0.00549497,0.0,11029918.654795043,0.0015938929999999
1970-01-01 00:01:02.721657410,2021,10.10.3.105,10.10.3.59,MPTCP,88,39317  >  5201 [SYN] Seq=0 Win=64256 Len=0 MSS=1460 SACK_PERM=1 TSval=939775711 TSecr=0 WS=128,0.00549497,0,0,0,0,10.10.3.105_10.10.3.59,3.0,0.0,0.0001660599999979,529928.941352981,0.001308031170054,0.0479976725,0.0,300467.70169974276,0.0095127263461545,0.120229089,0.0,117287.2003673675,0.0,0.00549497,0.0,529928.941352981,0.001308031170054
1970-01-01 00:01:02.721706966,2022,10.10.3.59,10.10.3.105,MPTCP,92,"5201  >  39317 [SYN, ACK] Seq=0 Ack=1 Win=65160 Len=0 MSS=1460 SACK_PERM=1 TSval=1401755458 TSecr=939775711 WS=128",4.9556e-05,0,0,0,0,10.10.3.59_10.10.3.105,3.0,0.0,4.955600000045024e-05,1856485.5920406033,0.0007873776214771,0.0479976725,0.0,300467.70169974276,0.0095127263461545,0.120229089,0.0,117287.2003673675,0.0,4.9556e-05,0.0,1856485.5920406033,0.0007873776214771
1970-01-01 00:01:02.725471975,2023,10.10.3.105,10.10.3.59,MPTCP,92,39317  >  5201 [ACK] Seq=1 Ack=1 Win=64256 Len=0 TSval=939775712 TSecr=1401755458,0.003765009,0,0,0,0,10.10.3.105_10.10.3.59,3.0,0.0,0.0037650089999985,24435.53255783336,0.0009277825409319,0.0479976725,0.0,300467.70169974276,0.0095127263461545,0.120229089,0.0,117287.2003673675,0.0,0.003765009,0.0,24435.53255783336,0.0009277825409319
1970-01-01 00:01:02.725604370,2024,10.10.3.59,10.10.3.105,MPTCP,80,[TCP Window Update] 5201  >  39317 [ACK] Seq=1 Ack=1 Win=65280 Len=0 TSval=1401755462 TSecr=939775712,0.003268636,0,0,0,1,10.10.3.59_10.10.3.105,3.0,0.0,0.0001323950000013,604252.4264447825,0.0009639332933785,0.0479976725,0.0,300467.70169974276,0.0095127263461545,0.120229089,0.0,117287.2003673675,0.0,0.003268636,0.0,604252.4264447825,0.0009639332933785
1970-01-01 00:01:02.726501176,2025,10.10.3.102,10.10.3.105,MPTCP,80,5201  >  55092 [ACK] Seq=1 Ack=38 Win=65152 Len=0 TSval=1041646983 TSecr=2010520283,0.07182859775,0,0,0,0,10.10.3.102_10.10.3.105,1.0,0.0,0.000896806,89205.4691873076,0.0156202625575022,0.07182859775,0.0,89205.4691873076,0.0156202625575022,0.120229089,0.0,117287.2003673675,0.0,0.003268636,0.0,604252.4264447825,0.0009639332933785
1970-01-01 00:01:02.727268009,2026,10.10.3.105,10.10.3.59,MPTCP,92,39317  >  5201 [ACK] Seq=1 Ack=1 Win=64256 Len=0 TSval=939775717 TSecr=1401755458,0.00283614575,0,0,0,0,10.10.3.105_10.10.3.59,3.0,0.0,0.0007668330000001,119973.97086456112,0.0005583425118823,0.07182859775,0.0,89205.4691873076,0.0156202625575022,0.120229089,0.0,117287.2003673675,0.0,0.00283614575,0.0,119973.97086456112,0.0005583425118823
1970-01-01 00:01:02.727296235,2027,10.10.3.59,10.10.3.105,MPTCP,80,5201  >  39317 [ACK] Seq=1 Ack=1 Win=65280 Len=0 TSval=1401755464 TSecr=939775717,0.003765009,0,0,0,0,10.10.3.59_10.10.3.105,3.0,0.0,2.822599999774411e-05,2834266.279543463,0.000431619141156,0.07182859775,0.0,89205.4691873076,0.0156202625575022,0.120229089,0.0,117287.2003673675,0.0,0.003765009,0.0,2834266.279543463,0.000431619141156
1970-01-01 00:01:02.728653255,2029,10.10.3.102,10.10.3.105,MPTCP,97,"5201  >  55084 [PSH, ACK] Seq=3 Ack=142 Win=65280 Len=1 TSval=1041646986 TSecr=2010520233",0.095659523,0,0,0,0,10.10.3.102_10.10.3.105,1.0,0.0,0.0013570200000003,71480.15504559489,0.0230012149074322,0.095659523,0.0,71480.15504559489,0.0230012149074322,0.120229089,0.0,117287.2003673675,0.0,0.003765009,0.0,2834266.279543463,0.000431619141156
1970-01-01 00:01:02.728764004,2030,10.10.3.105,10.10.3.102,MPTCP,80,55084  >  5201 [ACK] Seq=142 Ack=4 Win=64256 Len=0 TSval=2010520387 TSecr=1041646986,0.000110749,0,0,0,0,10.10.3.105_10.10.3.102,1.0,0.0,0.0001107490000009,722354.1521756684,0.0194578893265186,0.000110749,0.0,722354.1521756684,0.0194578893265186,0.120229089,0.0,117287.2003673675,0.0,0.003765009,0.0,2834266.279543463,0.000431619141156
1970-01-01 00:01:02.833814800,2032,10.10.3.102,10.10.3.62,MPTCP,92,"5201  >  45311 [SYN, ACK] Seq=0 Ack=1 Win=65160 Len=0 MSS=1460 SACK_PERM=1 TSval=2494465361 TSecr=3347687584 WS=128",0.11232345,0,0,0,0,10.10.3.102_10.10.3.62,2.0,0.0,0.1050507960000004,875.7668052320099,0.000988204875,0.000110749,0.0,722354.1521756684,0.0194578893265186,0.11232345,0.0,875.7668052320099,0.000988204875,0.003765009,0.0,2834266.279543463,0.000431619141156
1970-01-01 00:01:02.842070551,2033,10.10.3.102,10.10.3.105,MPTCP,97,"5201  >  55084 [PSH, ACK] Seq=4 Ack=142 Win=65280 Len=1 TSval=1041647087 TSecr=2010520387",0.0478851359999999,0,0,0,0,10.10.3.102_10.10.3.105,1.0,0.0,0.008255751,11749.385367848296,0.0195038321123469,0.0478851359999999,0.0,11749.385367848296,0.0195038321123469,0.11232345,0.0,875.7668052320099,0.000988204875,0.003765009,0.0,2834266.279543463,0.000431619141156
1970-01-01 00:01:02.842174580,2034,10.10.3.105,10.10.3.102,MPTCP,80,55084  >  5201 [ACK] Seq=142 Ack=5 Win=64256 Len=0 TSval=2010520500 TSecr=1041647087,0.000104029,0,0,0,0,10.10.3.105_10.10.3.102,1.0,0.0,0.0001040289999991,769016.3319904654,0.0308388848701562,0.000104029,0.0,769016.3319904654,0.0308388848701562,0.11232345,0.0,875.7668052320099,0.000988204875,0.003765009,0.0,2834266.279543463,0.000431619141156
1970-01-01 00:01:02.842268543,2035,10.10.3.105,10.10.3.102,MPTCP,2940,"55092  >  5201 [PSH, ACK] Seq=38 Ack=1 Win=64256 Len=2848 TSval=2010520500 TSecr=1041646983",0.000107389,0,0,0,0,10.10.3.105_10.10.3.102,1.0,0.0,9.396300000474866e-05,31288911.591279753,0.0308397524184256,0.000107389,0.0,31288911.591279753,0.0308397524184256,0.11232345,0.0,875.7668052320099,0.000988204875,0.003765009,0.0,2834266.279543463,0.000431619141156
1970-01-01 00:01:02.842268797,2036,10.10.3.105,10.10.3.102,MPTCP,2940,"55092  >  5201 [PSH, ACK] Seq=2886 Ack=1 Win=64256 Len=2848 TSval=2010520500 TSecr=1041646983",0.000105709,0,0,0,0,10.10.3.105_10.10.3.102,1.0,0.0,2.5399999969977216e-07,11574803163.287708,0.022872293749573,0.000105709,0.0,11574803163.287708,0.022872293749573,0.11232345,0.0,875.7668052320099,0.000988204875,0.003765009,0.0,2834266.279543463,0.000431619141156
1970-01-01 00:01:02.842351063,2037,10.10.3.105,10.10.3.102,MPTCP,2940,"55092  >  5201 [PSH, ACK] Seq=5734 Ack=1 Win=64256 Len=2848 TSval=2010520500 TSecr=1041646983",0.000104029,0,0,0,0,10.10.3.105_10.10.3.102,1.0,0.0,8.226599999971995e-05,35737728.83098739,0.0119452768287592,0.000104029,0.0,35737728.83098739,0.0119452768287592,0.11232345,0.0,875.7668052320099,0.000988204875,0.003765009,0.0,2834266.279543463,0.000431619141156
1970-01-01 00:01:02.842351274,2038,10.10.3.105,10.10.3.102,MPTCP,2940,"55092  >  5201 [PSH, ACK] Seq=8582 Ack=1 Win=64256 Len=2848 TSval=2010520500 TSecr=1041646983",0.000104029,0,0,0,0,10.10.3.105_10.10.3.102,1.0,0.0,2.109999996946499e-07,13933649309.263702,1.6084783152304888e-06,0.000104029,0.0,13933649309.263702,1.6084783152304888e-06,0.11232345,0.0,875.7668052320099,0.000988204875,0.003765009,0.0,2834266.279543463,0.000431619141156
1970-01-01 00:01:02.842405545,2039,10.10.3.105,10.10.3.102,MPTCP,2940,"55092  >  5201 [PSH, ACK] Seq=11430 Ack=1 Win=64256 Len=2848 TSval=2010520500 TSecr=1041646983",0.000104029,0,0,0,0,10.10.3.105_10.10.3.102,1.0,0.0,5.427099999621987e-05,54172578.3605384,8.400014824946837e-07,0.000104029,0.0,54172578.3605384,8.400014824946837e-07,0.11232345,0.0,875.7668052320099,0.000988204875,0.003765009,0.0,2834266.279543463,0.000431619141156
1970-01-01 00:01:02.931562976,2042,10.10.3.102,10.10.3.105,MPTCP,80,5201  >  55092 [ACK] Seq=1 Ack=11430 Win=57344 Len=0 TSval=1041647201 TSecr=2010520500,0.089211702,0,0,0,0,10.10.3.102_10.10.3.105,1.0,0.0,0.0891574310000038,897.2892007172858,0.0111384591250001,0.089211702,0.0,897.2892007172858,0.0111384591250001,0.11232345,0.0,875.7668052320099,0.000988204875,0.003765009,0.0,2834266.279543463,0.000431619141156
1970-01-01 00:01:02.931982594,2043,10.10.3.105,10.10.3.102,MPTCP,2940,"55092  >  5201 [PSH, ACK] Seq=14278 Ack=1 Win=64256 Len=2848 TSval=2010520590 TSecr=1041647201",0.0446578655,0,0,0,0,10.10.3.105_10.10.3.102,1.0,0.0,0.0004196179999951,7006372.462654492,0.0213285254098219,0.0446578655,0.0,7006372.462654492,0.0213285254098219,0.11232345,0.0,875.7668052320099,0.000988204875,0.003765009,0.0,2834266.279543463,0.000431619141156
1970-01-01 00:01:02.932071472,2044,10.10.3.105,10.10.3.102,MPTCP,2940,"55092  >  5201 [PSH, ACK] Seq=17126 Ack=1 Win=64256 Len=2848 TSval=2010520590 TSecr=1041647201",0.06693478375,0,0,0,0,10.10.3.105_10.10.3.102,1.0,0.0,8.887799999968138e-05,33079052.184011113,0.0287593777956913,0.06693478375,0.0,33079052.184011113,0.0287593777956913,0.11232345,0.0,875.7668052320099,0.000988204875,0.003765009,0.0,2834266.279543463,0.000431619141156
1970-01-01 00:01:02.932071691,2045,10.10.3.105,10.10.3.102,MPTCP,2940,"55092  >  5201 [PSH, ACK] Seq=19974 Ack=1 Win=64256 Len=2848 TSval=2010520590 TSecr=1041647201",0.089211702,0,0,0,0,10.10.3.105_10.10.3.102,1.0,0.0,2.1900000035657285e-07,13424657512.38873,0.0287593777956913,0.089211702,0.0,13424657512.38873,0.0287593777956913,0.11232345,0.0,875.7668052320099,0.000988204875,0.003765009,0.0,2834266.279543463,0.000431619141156
1970-01-01 00:01:02.932127848,2046,10.10.3.105,10.10.3.102,MPTCP,2940,"55092  >  5201 [PSH, ACK] Seq=22822 Ack=1 Win=64256 Len=2848 TSval=2010520590 TSecr=1041647201",0.089211702,0,0,0,0,10.10.3.105_10.10.3.102,1.0,0.0,5.615700000305424e-05,52353223.99416103,0.0213285254098218,0.089211702,0.0,52353223.99416103,0.0213285254098218,0.11232345,0.0,875.7668052320099,0.000988204875,0.003765009,0.0,2834266.279543463,0.000431619141156
1970-01-01 00:01:02.932215288,2047,10.10.3.105,10.10.3.102,MPTCP,2940,"55092  >  5201 [PSH, ACK] Seq=25670 Ack=1 Win=64256 Len=2848 TSval=2010520590 TSecr=1041647201",0.089211702,0,0,0,0,10.10.3.105_10.10.3.102,1.0,0.0,8.744000000149299e-05,33623055.809123985,0.0111384591249999,0.089211702,0.0,33623055.809123985,0.0111384591249999,0.11232345,0.0,875.7668052320099,0.000988204875,0.003765009,0.0,2834266.279543463,0.000431619141156
1970-01-01 00:01:02.932287957,2048,10.10.3.105,10.10.3.102,MPTCP,2940,"55092  >  5201 [PSH, ACK] Seq=28518 Ack=1 Win=64256 Len=2848 TSval=2010520590 TSecr=1041647201",0.089211702,0,0,0,0,10.10.3.105_10.10.3.102,1.0,0.0,7.266899999791576e-05,40457416.50613498,0.0,0.089211702,0.0,40457416.50613498,0.0,0.11232345,0.0,875.7668052320099,0.000988204875,0.003765009,0.0,2834266.279543463,0.000431619141156
1970-01-01 00:01:02.932355033,2049,10.10.3.105,10.10.3.102,MPTCP,2940,"55092  >  5201 [PSH, ACK] Seq=31366 Ack=1 Win=64256 Len=2848 TSval=2010520590 TSecr=1041647201",0.089211702,0,0,0,0,10.10.3.105_10.10.3.102,1.0,0.0,6.707600000055436e-05,43830878.40622133,0.0,0.089211702,0.0,43830878.40622133,0.0,0.11232345,0.0,875.7668052320099,0.000988204875,0.003765009,0.0,2834266.279543463,0.000431619141156
1970-01-01 00:01:02.932395673,2050,10.10.3.105,10.10.3.102,MPTCP,2940,"55092  >  5201 [PSH, ACK] Seq=34214 Ack=1 Win=64256 Len=2848 TSval=2010520590 TSecr=1041647201",0.089211702,0,0,0,0,10.10.3.105_10.10.3.102,1.0,0.0,4.064000000170154e-05,72342519.6820105,0.0,0.089211702,0.0,72342519.6820105,0.0,0.11232345,0.0,875.7668052320099,0.000988204875,0.003765009,0.0,2834266.279543463,0.000431619141156
1970-01-01 00:01:02.933829316,2051,10.10.3.105,10.10.3.59,MPTCP,1516,39317  >  5201 [ACK] Seq=1 Ack=1 Win=64256 Len=1424 TSval=939775922 TSecr=1401755464,0.003765009,0,0,0,0,10.10.3.105_10.10.3.59,3.0,0.0,0.0014336429999985,1057445.961094557,0.0004477158698144,0.089211702,0.0,72342519.6820105,0.0,0.11232345,0.0,875.7668052320099,0.000988204875,0.003765009,0.0,1057445.961094557,0.0004477158698144
1970-01-01 00:01:02.933862727,2052,10.10.3.59,10.10.3.105,MPTCP,80,5201  >  39317 [ACK] Seq=1 Ack=1425 Win=92672 Len=0 TSval=1401755670 TSecr=939775922,3.3411e-05,0,0,0,0,10.10.3.59_10.10.3.105,3.0,0.0,3.341099999687458e-05,2394420.999296147,0.0005374471384793,0.089211702,0.0,72342519.6820105,0.0,0.11232345,0.0,875.7668052320099,0.000988204875,3.3411e-05,0.0,2394420.999296147,0.0005374471384793
1970-01-01 00:01:02.936141911,2053,10.10.3.102,10.10.3.105,MPTCP,80,5201  >  55092 [ACK] Seq=1 Ack=14278 Win=63488 Len=0 TSval=1041647201 TSecr=2010520500,0.093736366,0,0,0,0,10.10.3.102_10.10.3.105,1.0,0.0,0.0022791840000024,35100.281504219354,0.000565582999999,0.093736366,0.0,35100.281504219354,0.000565582999999,0.11232345,0.0,875.7668052320099,0.000988204875,3.3411e-05,0.0,2394420.999296147,0.0005374471384793
1970-01-01 00:01:02.936534975,2054,10.10.3.105,10.10.3.102,MPTCP,2940,"55092  >  5201 [PSH, ACK] Seq=37062 Ack=1 Win=64256 Len=2848 TSval=2010520594 TSecr=1041647201",0.091474034,0,0,0,0,10.10.3.105_10.10.3.102,1.0,0.0,0.0003930640000007,7479697.962659041,0.0010830089917718,0.091474034,0.0,7479697.962659041,0.0010830089917718,0.11232345,0.0,875.7668052320099,0.000988204875,3.3411e-05,0.0,2394420.999296147,0.0005374471384793
1970-01-01 00:01:02.936583668,2055,10.10.3.105,10.10.3.102,MPTCP,2940,"55092  >  5201 [PSH, ACK] Seq=39910 Ack=1 Win=64256 Len=2848 TSval=2010520594 TSecr=1041647201",0.0926052,0,0,0,0,10.10.3.105_10.10.3.102,1.0,0.0,4.869299999654686e-05,60378288.46463546,0.0014603290265983,0.0926052,0.0,60378288.46463546,0.0014603290265983,0.11232345,0.0,875.7668052320099,0.000988204875,3.3411e-05,0.0,2394420.999296147,0.0005374471384793
1970-01-01 00:01:02.940541036,2056,10.10.3.105,10.10.3.59,MPTCP,1516,39317  >  5201 [ACK] Seq=1425 Ack=1 Win=64256 Len=1424 TSval=939775922 TSecr=1401755464,0.00189921,0,0,0,0,10.10.3.105_10.10.3.59,3.0,0.0,0.0039573680000017,383082.8975216136,0.0008931832701123,0.0926052,0.0,60378288.46463546,0.0014603290265983,0.11232345,0.0,875.7668052320099,0.000988204875,0.00189921,0.0,383082.8975216136,0.0008931832701123
1970-01-01 00:01:02.940584108,2057,10.10.3.59,10.10.3.105,MPTCP,80,5201  >  39317 [ACK] Seq=1 Ack=2849 Win=104064 Len=0 TSval=1401755677 TSecr=939775922,4.3072e-05,0,0,0,0,10.10.3.59_10.10.3.105,3.0,0.0,4.3072000003974154e-05,1857355.1261287748,0.001203432895792,0.0926052,0.0,60378288.46463546,0.0014603290265983,0.11232345,0.0,875.7668052320099,0.000988204875,4.3072e-05,0.0,1857355.1261287748,0.001203432895792
1970-01-01 00:01:02.944067744,2058,10.10.3.105,10.10.3.59,MPTCP,700,"39317  >  5201 [PSH, ACK] Seq=2849 Ack=1 Win=64256 Len=608 TSval=939775922 TSecr=1401755464",3.82415e-05,0,0,0,0,10.10.3.105_10.10.3.59,3.0,0.0,0.0034836359999985,200939.4781774811,0.0012021856663066,0.0926052,0.0,60378288.46463546,0.0014603290265983,0.11232345,0.0,875.7668052320099,0.000988204875,3.82415e-05,0.0,200939.4781774811,0.0012021856663066
1970-01-01 00:01:02.944096820,2059,10.10.3.59,10.10.3.105,MPTCP,80,5201  >  39317 [ACK] Seq=1 Ack=3457 Win=104064 Len=0 TSval=1401755681 TSecr=939775922,2.9076e-05,0,0,0,0,10.10.3.59_10.10.3.105,3.0,0.0,2.9075999997019153e-05,2751410.0979571305,0.0008911539490952,0.0926052,0.0,60378288.46463546,0.0014603290265983,0.11232345,0.0,875.7668052320099,0.000988204875,2.9076e-05,0.0,2751410.0979571305,0.0008911539490952
1970-01-01 00:01:02.944948549,2060,10.10.3.102,10.10.3.105,MPTCP,80,5201  >  55092 [ACK] Seq=1 Ack=8582 Win=59392 Len=0 TSval=1041647201 TSecr=2010520500,0.093736366,0,0,0,0,10.10.3.102_10.10.3.105,1.0,0.0,0.0008517290000042,93926.58932547364,0.0014603290265983,0.093736366,0.0,93926.58932547364,0.0014603290265983,0.11232345,0.0,875.7668052320099,0.000988204875,2.9076e-05,0.0,2751410.0979571305,0.0008911539490952
1970-01-01 00:01:02.948145475,2061,10.10.3.102,10.10.3.105,MPTCP,80,5201  >  55092 [ACK] Seq=1 Ack=2886 Win=63488 Len=0 TSval=1041647201 TSecr=2010520500,0.093736366,0,0,0,0,10.10.3.102_10.10.3.105,1.0,0.0,0.0031969259999939,25024.038717239717,0.0010830089917718,0.093736366,0.0,25024.038717239717,0.0010830089917718,0.11232345,0.0,875.7668052320099,0.000988204875,2.9076e-05,0.0,2751410.0979571305,0.0008911539490952
1970-01-01 00:01:02.949661704,2062,10.10.3.105,10.10.3.59,MPTCP,1516,39317  >  5201 [ACK] Seq=3457 Ack=1 Win=64256 Len=1424 TSval=939775924 TSecr=1401755670,3.6074e-05,0,0,0,0,10.10.3.105_10.10.3.59,3.0,0.0,0.0015162290000034,999848.9674030264,0.0004657848405276,0.093736366,0.0,25024.038717239717,0.0010830089917718,0.11232345,0.0,875.7668052320099,0.000988204875,3.6074e-05,0.0,999848.9674030264,0.0004657848405276
1970-01-01 00:01:02.949687943,2063,10.10.3.59,10.10.3.105,MPTCP,80,5201  >  39317 [ACK] Seq=1 Ack=4881 Win=104064 Len=0 TSval=1401755686 TSecr=939775924,2.6239e-05,0,0,0,0,10.10.3.59_10.10.3.105,3.0,0.0,2.6239000000316537e-05,3048896.6804769584,2.7900403890864683e-06,0.093736366,0.0,25024.038717239717,0.0010830089917718,0.11232345,0.0,875.7668052320099,0.000988204875,2.6239e-05,0.0,3048896.6804769584,2.7900403890864683e-06
1970-01-01 00:01:02.954235422,2064,10.10.3.102,10.10.3.105,MPTCP,80,5201  >  55092 [ACK] Seq=1 Ack=5734 Win=61440 Len=0 TSval=1041647201 TSecr=2010520500,0.093736366,0,0,0,0,10.10.3.102_10.10.3.105,1.0,0.0,0.0045474790000028,17592.164801629613,0.0005655829999991,0.093736366,0.0,17592.164801629613,0.0005655829999991,0.11232345,0.0,875.7668052320099,0.000988204875,2.6239e-05,0.0,3048896.6804769584,2.7900403890864683e-06
1970-01-01 00:01:02.961532748,2065,10.10.3.105,10.10.3.59,MPTCP,1516,39317  >  5201 [ACK] Seq=4881 Ack=1 Win=64256 Len=1424 TSval=939775924 TSecr=1401755670,2.76575e-05,0,0,0,0,10.10.3.105_10.10.3.59,3.0,0.0,0.0072973259999997,207747.3310086527,4.336768540368927e-06,0.093736366,0.0,17592.164801629613,0.0005655829999991,0.11232345,0.0,875.7668052320099,0.000988204875,2.76575e-05,0.0,207747.3310086527,4.336768540368927e-06
1970-01-01 00:01:02.961576501,2066,10.10.3.59,10.10.3.105,MPTCP,80,5201  >  39317 [ACK] Seq=1 Ack=6305 Win=104064 Len=0 TSval=1401755698 TSecr=939775924,4.3753e-05,0,0,0,0,10.10.3.59_10.10.3.105,3.0,0.0,4.3752999999924214e-05,1828446.0494169216,3.446574476597534e-06,0.093736366,0.0,17592.164801629613,0.0005655829999991,0.11232345,0.0,875.7668052320099,0.000988204875,4.3753e-05,0.0,1828446.0494169216,3.446574476597534e-06
1970-01-01 00:01:02.973390251,2067,10.10.3.105,10.10.3.59,MPTCP,1516,39317  >  5201 [ACK] Seq=6305 Ack=1 Win=64256 Len=1424 TSval=939775924 TSecr=1401755670,3.4996e-05,0,0,0,0,10.10.3.105_10.10.3.59,3.0,0.0,0.0118137499999946,128325.04496884474,3.008027142397525e-06,0.093736366,0.0,17592.164801629613,0.0005655829999991,0.11232345,0.0,875.7668052320099,0.000988204875,3.4996e-05,0.0,128325.04496884474,3.008027142397525e-06
1970-01-01 00:01:02.973405315,2068,10.10.3.59,10.10.3.105,MPTCP,80,5201  >  39317 [ACK] Seq=1 Ack=7729 Win=104064 Len=0 TSval=1401755710 TSecr=939775924,1.5064e-05,0,0,0,0,10.10.3.59_10.10.3.105,3.0,0.0,1.506400000295116e-05,5310674.4546154635,3.0277420798179332e-06,0.093736366,0.0,17592.164801629613,0.0005655829999991,0.11232345,0.0,875.7668052320099,0.000988204875,1.5064e-05,0.0,5310674.4546154635,3.0277420798179332e-06
1970-01-01 00:01:02.985262190,2069,10.10.3.105,10.10.3.59,MPTCP,1516,39317  >  5201 [ACK] Seq=7729 Ack=1 Win=64256 Len=1424 TSval=939775924 TSecr=1401755670,2.94085e-05,0,0,0,0,10.10.3.105_10.10.3.59,3.0,0.0,0.0118568749999994,127858.31005219102,2.3227105793089207e-06,0.093736366,0.0,17592.164801629613,0.0005655829999991,0.11232345,0.0,875.7668052320099,0.000988204875,2.94085e-05,0.0,127858.31005219102,2.3227105793089207e-06
1970-01-01 00:01:02.985283945,2070,10.10.3.59,10.10.3.105,MPTCP,80,5201  >  39317 [ACK] Seq=1 Ack=9153 Win=104064 Len=0 TSval=1401755722 TSecr=939775924,2.1755e-05,0,0,0,0,10.10.3.59_10.10.3.105,3.0,0.0,2.1754999998790936e-05,3677315.5598458336,4.732637558841631e-06,0.093736366,0.0,17592.164801629613,0.0005655829999991,0.11232345,0.0,875.7668052320099,0.000988204875,2.1755e-05,0.0,3677315.5598458336,4.732637558841631e-06
1970-01-01 00:01:02.999040942,2072,10.10.3.105,10.10.3.59,MPTCP,1516,"39317  >  5201 [PSH, ACK] Seq=9153 Ack=1 Win=64256 Len=1424 TSval=939775924 TSecr=1401755670",1.84095e-05,0,0,0,0,10.10.3.105_10.10.3.59,3.0,0.0,0.0137569970000015,110198.46845934688,6.112078129002024e-06,0.093736366,0.0,17592.164801629613,0.0005655829999991,0.11232345,0.0,875.7668052320099,0.000988204875,1.84095e-05,0.0,110198.46845934688,6.112078129002024e-06
1970-01-01 00:01:02.999059946,2073,10.10.3.59,10.10.3.105,MPTCP,80,5201  >  39317 [ACK] Seq=1 Ack=10577 Win=104064 Len=0 TSval=1401755736 TSecr=939775924,1.9004e-05,0,0,0,0,10.10.3.59_10.10.3.105,3.0,0.0,1.9004000002098564e-05,4209640.075308661,5.0257514589262865e-06,0.093736366,0.0,17592.164801629613,0.0005655829999991,0.11232345,0.0,875.7668052320099,0.000988204875,1.9004e-05,0.0,4209640.075308661,5.0257514589262865e-06
1970-01-01 00:01:03.009089707,2074,10.10.3.105,10.10.3.59,MPTCP,1516,39317  >  5201 [ACK] Seq=10577 Ack=1 Win=64256 Len=1424 TSval=939775933 TSecr=1401755670,2.0379500000000004e-05,0,0,0,0,10.10.3.105_10.10.3.59,3.0,0.0,0.0100297609999984,151150.16200288714,2.396245861112659e-06,0.093736366,0.0,17592.164801629613,0.0005655829999991,0.11232345,0.0,875.7668052320099,0.000988204875,2.0379500000000004e-05,0.0,151150.16200288714,2.396245861112659e-06
1970-01-01 00:01:03.009110837,2075,10.10.3.59,10.10.3.105,MPTCP,80,5201  >  39317 [ACK] Seq=1 Ack=12001 Win=104064 Len=0 TSval=1401755746 TSecr=939775933,2.113e-05,0,0,0,0,10.10.3.59_10.10.3.105,3.0,0.0,2.113000000036891e-05,3786086.133393435,9.047227779958308e-07,0.093736366,0.0,17592.164801629613,0.0005655829999991,0.11232345,0.0,875.7668052320099,0.000988204875,2.113e-05,0.0,3786086.133393435,9.047227779958308e-07
1970-01-01 00:01:03.021420567,2076,10.10.3.105,10.10.3.59,MPTCP,1516,39317  >  5201 [ACK] Seq=12001 Ack=1 Win=64256 Len=1424 TSval=939775933 TSecr=1401755670,2.0067e-05,0,0,0,0,10.10.3.105_10.10.3.59,3.0,0.0,0.0123097299999983,123154.61021486278,4.33569694541165e-07,0.093736366,0.0,17592.164801629613,0.0005655829999991,0.11232345,0.0,875.7668052320099,0.000988204875,2.0067e-05,0.0,123154.61021486278,4.33569694541165e-07
1970-01-01 00:01:03.021444205,2077,10.10.3.59,10.10.3.105,MPTCP,80,5201  >  39317 [ACK] Seq=1 Ack=13425 Win=104064 Len=0 TSval=1401755758 TSecr=939775933,2.3638e-05,0,0,0,0,10.10.3.59_10.10.3.105,3.0,0.0,2.3638000001824366e-05,3384381.081048551,5.171095677170822e-07,0.093736366,0.0,17592.164801629613,0.0005655829999991,0.11232345,0.0,875.7668052320099,0.000988204875,2.3638e-05,0.0,3384381.081048551,5.171095677170822e-07
1970-01-01 00:01:03.023859637,2078,10.10.3.102,10.10.3.105,MPTCP,80,5201  >  55092 [ACK] Seq=1 Ack=28518 Win=75520 Len=0 TSval=1041647291 TSecr=2010520590,0.091644349,0,0,0,0,10.10.3.102_10.10.3.105,1.0,0.0,0.0024154319999993,33120.36935836753,0.0002615021249981,0.091644349,0.0,33120.36935836753,0.0002615021249981,0.11232345,0.0,875.7668052320099,0.000988204875,2.3638e-05,0.0,3384381.081048551,5.171095677170822e-07
1970-01-01 00:01:03.024309199,2079,10.10.3.105,10.10.3.102,MPTCP,2940,"55092  >  5201 [PSH, ACK] Seq=42758 Ack=1 Win=64256 Len=2848 TSval=2010520682 TSecr=1041647291",0.0926903575,0,0,0,0,10.10.3.105_10.10.3.102,1.0,0.0,0.000449562,6539698.6400093995,0.0005007384464207,0.0926903575,0.0,6539698.6400093995,0.0005007384464207,0.11232345,0.0,875.7668052320099,0.000988204875,2.3638e-05,0.0,3384381.081048551,5.171095677170822e-07
1970-01-01 00:01:03.024309518,2080,10.10.3.105,10.10.3.102,MPTCP,2940,"55092  >  5201 [PSH, ACK] Seq=45606 Ack=1 Win=64256 Len=2848 TSval=2010520682 TSecr=1041647291",0.09216735325,0,0,0,0,10.10.3.105_10.10.3.102,1.0,0.0,3.190000015251826e-07,9216300896.374475,0.0006751955834144,0.09216735325,0.0,9216300896.374475,0.0006751955834144,0.11232345,0.0,875.7668052320099,0.000988204875,2.3638e-05,0.0,3384381.081048551,5.171095677170822e-07
1970-01-01 00:01:03.024380124,2081,10.10.3.105,10.10.3.102,MPTCP,2940,"55092  >  5201 [PSH, ACK] Seq=48454 Ack=1 Win=64256 Len=2848 TSval=2010520682 TSecr=1041647291",0.091644349,0,0,0,0,10.10.3.105_10.10.3.102,1.0,0.0,7.060599999419992e-05,41639520.72403921,0.0006751955834144,0.091644349,0.0,41639520.72403921,0.0006751955834144,0.11232345,0.0,875.7668052320099,0.000988204875,2.3638e-05,0.0,3384381.081048551,5.171095677170822e-07
1970-01-01 00:01:03.024411711,2082,10.10.3.105,10.10.3.102,MPTCP,2940,"55092  >  5201 [PSH, ACK] Seq=51302 Ack=1 Win=64256 Len=2848 TSval=2010520682 TSecr=1041647291",0.091644349,0,0,0,0,10.10.3.105_10.10.3.102,1.0,0.0,3.1587000002275545e-05,93076265.5455789,0.0005007384464207,0.091644349,0.0,93076265.5455789,0.0005007384464207,0.11232345,0.0,875.7668052320099,0.000988204875,2.3638e-05,0.0,3384381.081048551,5.171095677170822e-07
1970-01-01 00:01:03.024411834,2083,10.10.3.105,10.10.3.102,MPTCP,2940,"55092  >  5201 [PSH, ACK] Seq=54150 Ack=1 Win=64256 Len=2848 TSval=2010520682 TSecr=1041647291",0.091644349,0,0,0,0,10.10.3.105_10.10.3.102,1.0,0.0,1.229999995189246e-07,23902439117.877037,0.000261502124998,0.091644349,0.0,23902439117.877037,0.000261502124998,0.11232345,0.0,875.7668052320099,0.000988204875,2.3638e-05,0.0,3384381.081048551,5.171095677170822e-07
1970-01-01 00:01:03.024447012,2084,10.10.3.105,10.10.3.102,MPTCP,2940,"55092  >  5201 [PSH, ACK] Seq=56998 Ack=1 Win=64256 Len=2848 TSval=2010520682 TSecr=1041647291",0.091644349,0,0,0,0,10.10.3.105_10.10.3.102,1.0,0.0,3.517800000452098e-05,83574961.61300129,0.0,0.091644349,0.0,83574961.61300129,0.0,0.11232345,0.0,875.7668052320099,0.000988204875,2.3638e-05,0.0,3384381.081048551,5.171095677170822e-07
1970-01-01 00:01:03.024498431,2085,10.10.3.105,10.10.3.102,MPTCP,2940,"55092  >  5201 [PSH, ACK] Seq=59846 Ack=1 Win=64256 Len=2848 TSval=2010520682 TSecr=1041647291",0.091644349,0,0,0,0,10.10.3.105_10.10.3.102,1.0,0.0,5.141899999472344e-05,57177308.00485618,0.0,0.091644349,0.0,57177308.00485618,0.0,0.11232345,0.0,875.7668052320099,0.000988204875,2.3638e-05,0.0,3384381.081048551,5.171095677170822e-07
1970-01-01 00:01:03.024528613,2086,10.10.3.105,10.10.3.102,MPTCP,2716,"55092  >  5201 [PSH, ACK] Seq=62694 Ack=1 Win=64256 Len=2624 TSval=2010520682 TSecr=1041647291",0.091644349,0,0,0,0,10.10.3.105_10.10.3.102,1.0,0.0,3.0182000003264875e-05,89987409.70466511,0.0,0.091644349,0.0,89987409.70466511,0.0,0.11232345,0.0,875.7668052320099,0.000988204875,2.3638e-05,0.0,3384381.081048551,5.171095677170822e-07
1970-01-01 00:01:03.028056184,2087,10.10.3.102,10.10.3.105,MPTCP,80,5201  >  55092 [ACK] Seq=1 Ack=19974 Win=61440 Len=0 TSval=1041647291 TSecr=2010520590,0.091644349,0,0,0,0,10.10.3.102_10.10.3.105,1.0,0.0,0.0035275709999993,22678.49463554807,0.0,0.091644349,0.0,22678.49463554807,0.0,0.11232345,0.0,875.7668052320099,0.000988204875,2.3638e-05,0.0,3384381.081048551,5.171095677170822e-07
1970-01-01 00:01:03.032927240,2088,10.10.3.102,10.10.3.105,MPTCP,80,5201  >  55092 [ACK] Seq=1 Ack=25670 Win=69888 Len=0 TSval=1041647291 TSecr=2010520590,0.091644349,0,0,0,0,10.10.3.102_10.10.3.105,1.0,0.0,0.0048710559999989,16423.54347805026,0.0,0.091644349,0.0,16423.54347805026,0.0,0.11232345,0.0,875.7668052320099,0.000988204875,2.3638e-05,0.0,3384381.081048551,5.171095677170822e-07
1970-01-01 00:01:03.033336169,2089,10.10.3.105,10.10.3.59,MPTCP,1516,"39317  >  5201 [PSH, ACK] Seq=13425 Ack=1 Win=64256 Len=1424 TSval=939775933 TSecr=1401755670",2.2384e-05,0,0,0,0,10.10.3.105_10.10.3.59,3.0,0.0,0.0004089290000024,3707245.022952485,1.0704552442884192e-06,0.091644349,0.0,16423.54347805026,0.0,0.11232345,0.0,875.7668052320099,0.000988204875,2.2384e-05,0.0,3707245.022952485,1.0704552442884192e-06
1970-01-01 00:01:03.033365636,2090,10.10.3.59,10.10.3.105,MPTCP,80,5201  >  39317 [ACK] Seq=1 Ack=14849 Win=135040 Len=0 TSval=1401755770 TSecr=939775933,2.9468e-05,0,0,0,0,10.10.3.59_10.10.3.105,3.0,0.0,2.946800000103167e-05,2714809.2845527087,1.8772347787103377e-06,0.091644349,0.0,16423.54347805026,0.0,0.11232345,0.0,875.7668052320099,0.000988204875,2.9468e-05,0.0,2714809.2845527087,1.8772347787103377e-06
